,title-es,content-es,title-de,content-de,title-en,content-en
0,"El fuego asola España: declarada la fase de preemergencia tras miles de desalojos en León, Madrid y Cádiz","Fallece el hombre que sufrió graves quemaduras en el incendio de Tres Cantos, perimetrado tras quemar 1.000 hectáreas. El foco de Las Médulas mejora y muchos de los frentes están controlados, pero la alta velocidad ha quedado interrumpida entre la capital de España y Galicia","Das Feuer verwüstet Spanien: erklärt die Phase der Vor-Notstand nach Tausenden von Räumungen in León, Madrid und Cádiz","Der Mann, der schwere Verbrennungen am Feuer von Tres Cantos erlitt, wurde nach 1.000 Hektar verbrannt. Der Fokus von Las Médulas verbessert sich und viele der Fronten sind unter Kontrolle, aber die hohe Geschwindigkeit ist zwischen der Hauptstadt von Spanien und Galicien unterbrochen worden","The fire ravages Spain: declared the pre-emergency phase after thousands of evictions in León, Madrid and Cádiz","The man who suffered severe burns in the fire of Tres Cantos dies, perimeterd after burning 1,000 hectares. The focus of Las Médulas improves and many of the fronts are controlled, but the high speed has been interrupted between the capital of Spain and Galicia"
1,"Incendios en España activos, en directo | El incendio en Ourense obliga a cortar la línea de tren de alta velocidad con Madrid","Interior declara la fase de preemergencia del plan estatal ante la situación en varias comunidades | Fallece el hombre que sufrió graves quemaduras por el incendio de Tres Cantos | Miles de personas pasan la noche fuera de casa en León, Madrid y Cádiz","Feuer in Spanien aktiv, Live-Herausforderung Das Feuer in Ourense zwingt zum Schneiden der Hochgeschwindigkeits-Zuglinie mit Madrid","Innen erklärt die Phase der Vorbereitung des staatlichen Plans angesichts der Situation in mehreren Gemeinden în Fallace der Mann, der schwere Verbrennungen durch das Feuer von Tres Cantos în Miles Menschen verbrachte die Nacht von zu Hause aus in León, Madrid und Cádiz","Fires in Spain active, live  The fire in Ourense forces to cut the high speed train line with Madrid","Interior declares the pre-emergency phase of the state plan before the situation in several communities  The man who suffered severe burns from the fire of Tres Cantos dies  Thousands of people spend the night away from home in León, Madrid and Cadiz"
2,La Aemet abre la puerta a que la ola de calor se prolongue hasta el lunes 18 de agosto,"Aunque la incertidumbre es elevada sobre la duración del episodio de temperaturas extremas, habrá un descenso térmico a partir del miércoles y luego un repunte de las temperaturas el jueves","Die Aemet öffnet die Tür, um die Hitzewelle bis Montag, den 18. August zu verlängern","Obwohl die Ungewissheit über die Dauer der extremen Temperaturepisode hoch ist, wird es ab Mittwoch einen thermischen Rückgang geben und dann am Donnerstag einen Anstieg der Temperaturen.","The Aemet opens the door for the heat wave to extend until Monday, August 18","Although uncertainty is high about the duration of the episode of extreme temperatures, there will be a thermal decline from Wednesday and then a surge of temperatures on Thursday"
3,Un temporero muere en Lleida en plena ola de calor,El hombre se desplomó en una jornada en la que varias empresas recomendaban no trabajar durante la mayor parte del día por el riesgo térmico,Ein Saisonarbeiter stirbt in Lleida mitten in der Hitzewelle,"Der Mensch stürzte an einem Tag zusammen, an dem mehrere Unternehmen empfahlen, den größten Teil des Tages wegen des thermischen Risikos nicht zu arbeiten.",A seasonaler dies in Lleida in the heat wave,The man collapsed on a day in which several companies recommended not to work for most of the day because of the thermal risk
4,¿Cómo avanzan los incendios del verano? Consulte el mapa con los últimos fuegos activos,"En la última semana han ardido 25.000 hectáreas en 37 incendios, el 36% de la superficie quemada en lo que va de año",Wie gehen die Sommerbrände voran? Schauen Sie sich die Karte mit den letzten aktiven Feuern an,"In der letzten Woche haben 25.000 Hektar bei 37 Bränden verbrannt, 36% der verbrannten Fläche im Laufe des Jahres",How do summer fires advance? See the map with the latest active fires,"In the last week they have burned 25,000 hectares in 37 fires, 36% of the area burned so far this year"
5,El viento complica las labores de extinción de los incendios activos en España,"La situación meteorológica afecta en especial a los fuegos de Cádiz, Toledo y Madrid, donde la Comunidad de Madrid mantiene el nivel 2 de emergencias por la previsión de tormentas y ráfagas",Der Wind verkompliziert das Löschen von Bränden in Spanien,"Die Wetterlage betrifft insbesondere die Feuer von Cádiz, Toledo und Madrid, wo die Gemeinschaft von Madrid aufgrund der Vorhersage von Stürmen und Stürmen die Stufe 2 der Notfälle aufrechterhält.",The wind complicates the work of extinguishing the active fires in Spain,"The weather situation affects in particular the fires of Cadiz, Toledo and Madrid, where the Community of Madrid maintains the level 2 emergency due to the forecast of storms and gusts"
6,"Mircea, el ex mecánico rumano que murió en el incendio de Tres Cantos intentando salvar a los caballos","El fallecido, de 50 años, tenía dos hijos y hace un año había montado una empresa de mudanzas","Mircea, der ehemalige rumänische Mechaniker, der bei dem Feuer von Tres Cantos starb, um die Pferde zu retten.","Der 50-jährige Tote hatte zwei Kinder, und vor einem Jahr hatte er eine Umzugsfirma gegründet.","Mircea, the former Romanian mechanic who died in the Three Cantos fire trying to save the horses","The deceased, aged 50, had two children and a year ago he had set up a moving company"
7,El fuego alcanza el internado del King’s College: “Es como si se hubiera quemado mi casa”,"El prestigioso colegio británico de Soto de Viñuelas, que acoge a estudiantes internacionales, ha sido afectado por el incendio que arrasó varias zonas del municipio madrileño","Das Feuer erreicht das Internat des King Hills College: Es ist, als wäre mein Haus verbrannt worden.","Die renommierte britische Schule Soto de Viñuelas, die internationale Studenten beherbergt, wurde von dem Brand getroffen, der mehrere Gebiete der Stadt Madrid zerstörte.",The fire reaches King’s College boarding school: “It’s like my house has been burned down”,"The prestigious British school of Soto de Viñuelas, which welcomes international students, has been affected by the fire that swept several areas of the Madrid municipality"
8,Varado 45 días en la Antártida: el aterrizaje sin permiso de un joven piloto estadounidense termina con una millonaria sanción en Chile,"Ethan Guo, un ‘influencer’ de 19 años, ha sido por un mes y medio un inesperado huésped en una base de la Fuerza Aérea. Un juzgado acordó una salida a su caso: la donación de 30.000 dólares a una fundación de ayuda a niños con cáncer",45 Tage in der Antarktis: Die Landung ohne Erlaubnis eines jungen amerikanischen Piloten endet mit einer millionären Strafe in Chile,"Ethan Guo, ein 19-jähriger Hlaing-Influencer, war eineinhalb Monate lang ein unerwarteter Gast auf einer Air Force-Basis. Ein Gericht vereinbarte einen Ausweg aus seinem Fall: die Spende von $30.000 an eine Stiftung zur Unterstützung von Kindern mit Krebs",Varado 45 days in Antarctica: the landing without permission of a young American pilot ends with a millionaire sanction in Chile,"Ethan Guo, a 19-year-old ‘influencer’, has been for a month and a half an unexpected guest at an Air Force base. A court agreed a way out of his case: the donation of $30,000 to a foundation to help children with cancer"
9,A 350 kilómetros del litoral más cercano: cómo España se ha llenado de playas artificiales,"En el interior del país se esconden magníficas lagunas, pantanos y embalses que cuentan con vestuarios, toboganes y banderas azules o permiten pasear en piragua y hacer windsurf",350 Kilometer von der nächsten Küste entfernt: wie Spanien mit künstlichen Stränden gefüllt ist,"Im Inneren des Landes verstecken sich wunderschöne Lagunen, Sümpfe und Stauseen mit Umkleidekabinen, Rutschen und blauen Fahnen oder ermöglichen es, im Kanu zu spazieren und Windsurfen zu machen.",350 kilometers from the nearest coastline: how Spain has filled with artificial beaches,"In the interior of the country are hidden magnificent lagoons, swamps and reservoirs that have changing rooms, slides and blue flags or allow to walk in canoe and windsurf"
10,“Son una epidemia”: la guerra contra los ‘pinkies’ se libra en las redes sociales y en los clubes de caballeros,"Calcetín tobillero, ‘pinkie’ o ‘sockette’. Recibe diferentes nombres según sus alturas, pero también el rechazo unánime de los más estetas y, ahora, también es motivo de veto en algunos establecimientos",Es handelt sich um eine Epidemie: Der Krieg gegen die Pickups wird in den sozialen Netzwerken und Gentlemenclubs geführt,"Calcetín tobillero, înpinkie în oder însockette în. Es erhält verschiedene Namen nach seinen Höhen, aber auch die einstimmige Ablehnung der ästhetischen und jetzt auch ein Veto in einigen Betrieben",“They are an epidemic”: the war against the ‘pinkies’ is fought on social media and gentlemen’s clubs,"Sock tobillero, ‘pinkie’ or ‘sockette’. It receives different names according to its heights, but also the unanimous rejection of the most aesthetes and, now, it is also a reason for veto in some establishments"
11,¿Qué leen en verano Dua Lipa o Reese Witherspoon? Las recomendaciones de agosto de los clubes de lectura de siete famosas,"Son varias las celebridades que han creado un espacio literario y una comunidad de lectoras donde seleccionan, mensualmente, un libro que, gracias a su influencia, entran en las listas de los más vendidos",Was lesen Sie im Sommer Dua Lipa oder Reese Witherspoon? August Empfehlungen der sieben berühmten Leseclubs,"Es gibt mehrere Prominente, die einen literarischen Raum und eine Gemeinschaft von Leserinnen geschaffen haben, in der sie monatlich ein Buch auswählen, das dank seines Einflusses in die Listen der Bestseller aufgenommen wird.",What do you read in the summer Dua Lipa or Reese Witherspoon? The August recommendations of the reading clubs of seven famous,"There are several celebrities who have created a literary space and a community of readers where they select, monthly, a book that, thanks to its influence, enters the lists of the best sellers"
12,El peligro de la popular ‘dieta de las princesas’: cómo la presión estética afecta a las niñas,Más del 84 % de las películas infantiles representan estereotipos negativos asociados a personajes con sobrepeso u obesidad,Die Gefahr der populären Hexendiät der Prinzessinnen: wie der ästhetische Druck Mädchen beeinflusst,"Mehr als 84 Prozent der Kinderfilme stellen negative Stereotypen dar, die mit übergewichtigen oder übergewichtigen Charakteren verbunden sind.",The danger of the popular ‘Princess Diet’: how aesthetic pressure affects girls,More than 84% of children's films represent negative stereotypes associated with overweight or obese characters
13,Falta un año para el eclipse del siglo: hoy es el día para saber dónde verlo,"Así se puede comprobar si será visible en cada lugar de España el eclipse total del 12 de agosto de 2026, que cruzará la mitad norte del país cuando el sol estará ya muy cerca de ponerse en el horizonte","Noch ein Jahr bis zur Sonnenfinsternis des Jahrhunderts: Heute ist der Tag, um zu wissen, wo man es sieht","So kann man feststellen, ob an jedem Ort Spaniens die totale Sonnenfinsternis vom 12. August 2026 sichtbar ist, die die nördliche Hälfte des Landes überqueren wird, wenn die Sonne schon nahe am Horizont liegt.",One year to the eclipse of the century: today is the day to know where to see it,"Thus it can be verified whether the total eclipse of August 12, 2026, which will cross the northern half of the country will be visible in each place in Spain when the sun will be very close to setting on the horizon"
14,Debacle en las oposiciones a profesor de secundaria: una de cada cuatro plazas queda desierta en España,"Castilla y León deja sin cubrir el 80% de los puestos de Matemáticas, y Madrid el 69% en Informática. Los resultados reflejan el agotamiento del actual sistema de selección",Debakel in den Auswahlverfahren für Lehrer der Sekundarstufe: jeder vierte Platz bleibt in Spanien verlassen,"Castilla y León hat 80% der Mathematical-Stellen nicht besetzt, und Madrid 69% in Informatik. Die Ergebnisse spiegeln die Erschöpfung des derzeitigen Auswahlsystems wider",Debacle in the competitions to secondary school teacher: one in four places is deserted in Spain,"Castilla y León leaves 80% of the posts in Mathematics unfilled, and Madrid 69% in Informatics. The results reflect the exhaustion of the current selection system"
15,Los datos y los residentes de Washington contradicen a Trump: “Nunca me he sentido amenazada”,"El presidente ha declarado la situación de emergencia para tomar el control de la capital de Estados Unidos, a pesar de que registra el menor índice de criminalidad en tres décadas",Die Daten und Bewohner von Washington widersprechen Trump: Ich habe mich noch nie bedroht gefühlt,"Der Präsident hat die Notsituation erklärt, um die Kontrolle über die Hauptstadt der Vereinigten Staaten zu übernehmen, obwohl es die niedrigste Kriminalitätsrate in drei Jahrzehnten",Data and Washington residents contradict Trump: “I’ve Never felt Threatened”,"The president has declared the emergency situation to take control of the capital of the United States, despite having recorded the lowest crime rate in three decades"
16,La UE reclama a Trump una salida a la guerra que proteja la seguridad de Ucrania y Europa,Todos los países de la Unión menos Hungría piden una “paz justa” para Kiev con garantías de seguridad,"EU fordert Trump zum Ausweg aus dem Krieg auf, um die Sicherheit der Ukraine und Europas zu schützen",Alle Länder der Union außer Ungarn fordern einen gerechten Frieden mit Sicherheitsgarantien für Kiew,EU calls on Trump for a way out of the war to protect the security of Ukraine and Europe,All countries of the Union except Hungary call for a “fair peace” for Kiev with security guarantees
17,Detenido el exjefe de Estupefacientes de la Policía Nacional en Baleares acusado de colaborar con una banda criminal,"La Guardia Civil y la Policía Nacional han detenido a 13 personas, entre ellas un abogado y varios miembros de una banda motera, en una investigación sobre blanqueo de capitales a gran escala","Der ehemalige Suchtstoff-Chef der Nationalpolizei auf den Balearen wurde verhaftet und beschuldigt, mit einer kriminellen Bande zusammenzuarbeiten.","Die Guardia Civil und die Nationalpolizei haben 13 Personen festgenommen, darunter einen Anwalt und mehrere Mitglieder einer Motera-Bande, bei einer groß angelegten Ermittlung zur Geldwäsche.",Former Chief of Narcotics of the National Police in the Balearic Islands arrested on charges of collaborating with a criminal gang,"The Civil Guard and the National Police have arrested 13 people, including a lawyer and several members of a biker gang, in a large-scale money-laundering investigation"
18,Sin casa para los jóvenes: la compra y el alquiler superan el esfuerzo recomendado en todas las comunidades,"El precio medio de arrendamiento representa el 92% del salario promedio, según los últimos datos del Consejo de la Juventud. La tasa de emancipación acabó 2024 en el 15,2%",Kein Zuhause für junge Menschen: Kauf und Miete übertreffen die in allen Gemeinden empfohlenen Anstrengungen,"Der durchschnittliche Mietpreis entspricht 92% des Durchschnittslohns, wie die jüngsten Angaben des Jugendrates zeigen. Die Emanzipationsrate endete 2024 bei 15,2%.",Homeless for young people: buying and renting exceed the recommended effort in all communities,"The average rental price represents 92 per cent of the average wage, according to the latest data of the Youth Council. The emancipation rate ended 2024 in 15.2%"
19,Periodistas sin refugio en Gaza: “¿Cuántos más tienen que ser asesinados para que el mundo reaccione?“,"Muchos reporteros se alejan de sus seres queridos, y sufren por no ayudarles a buscar comida, por el miedo permanente que sienten después de que Israel haya matado a más de 200 compañeros","Journalisten ohne Zuflucht in Gaza: Wie viele müssen noch getötet werden, damit die Welt reagiert?","Viele Reporter entfernen sich von ihren Angehörigen und leiden, weil sie ihnen nicht helfen, Nahrung zu suchen, weil sie ständig Angst haben, nachdem Israel mehr als 200 Gefährten getötet hat.",Journalists without a safe haven in Gaza: “How many more have to be killed for the world to react?”,"Many reporters turn away from their loved ones, and suffer for not helping them to seek food, for the permanent fear they feel after Israel has killed more than 200 companions."
20,El Cabildo reconoció al organo asesor de la Unesco en primavera que la capilla de la Mezquita “no era el mejor sitio” para servir de almacén,La Diócesis informó a Icomos de que habían adquirido dos inmuebles para trasladar los enseres,"Das Cabildo erkannte im Frühling den Beraterorgan der Unesco an, dass die Kapelle der Moschee der beste Ort war, um als Lager zu dienen.","Die Diözese teilte Icomos mit, dass sie zwei Gebäude erworben hatten, um die Leichen zu verlegen.",The Cabildo recognized the UNESCO advisory body in spring that the chapel of the Mosque “was not the best place” to serve as a warehouse,The Diocese informed Icomos that they had acquired two properties to move the goods.
21,Al menos 76 muertos en Argentina por el uso de fentanilo clínico contaminado,La justicia confirma que podría haber más víctimas y asegura que en los centros de salud ya no circulan ampollas con el opiáceo infectado con bacterias,Mindestens 76 Tote in Argentinien durch die Anwendung kontaminierter klinischer Fentanyle,"Die Justiz bestätigt, dass es weitere Opfer geben könnte, und stellt sicher, dass in Gesundheitszentren keine Blasen mehr mit dem mit Bakterien infizierten Opiat verkehren.",At least 76 deaths in Argentina from the use of contaminated clinical fentanyl,Justice confirms that there could be more victims and ensures that the health centers no longer circulate blisters with the opioid infected with bacteria
22,"Violaciones grupales, embarazos forzados y transmisión de enfermedades: los crímenes cometidos en Tigray para destruir la capacidad reproductiva de una etnia","Una investigación detalla, a través de informes médicos y testimonios del personal sanitario, cómo se cometieron delitos de lesa humanidad contra mujeres y niñas durante el conflicto que asoló el norte de Etiopía y posteriormente en otras regiones","Gruppenverletzung, Zwangsschwangerschaften und Übertragung von Krankheiten: Verbrechen in Tigray, um die Fortpflanzungsfähigkeit einer ethnischen Gruppe zu zerstören","Eine detaillierte Untersuchung, durch medizinische Berichte und Berichte des Gesundheitspersonals, wie während des Konflikts im Norden Äthiopiens und später in anderen Regionen Verbrechen gegen Frauen und Mädchen begangen wurden","Group rape, forced pregnancy and disease transmission: the crimes committed in Tigray to destroy the reproductive capacity of an ethnic group","A detailed investigation, through medical reports and testimonies from health personnel, of how crimes against humanity were committed against women and girls during the conflict in northern Ethiopia and subsequently in other regions"
23,El asesinato de Miguel Uribe devuelve a Colombia al horror de la violencia a nueve meses de las elecciones,"La muerte del senador, 65 días después de recibir varios disparos en un mitin, se produce en plena escalada de la polarización y sin avances en la investigación del crimen",Der Mord an Miguel Uribe bringt Kolumbien zurück zum Schrecken der Gewalt zu neun Monaten nach den Wahlen,"Der Tod des Senators, 65 Tage nachdem er mehrere Schüsse auf einer Kundgebung erhalten hatte, tritt in voller Eskalation der Polarisierung und ohne Fortschritte bei der Ermittlung des Verbrechens auf.",Miguel Uribe’s Murder Returns Colombia to the Horror of Violence Nine Months After Elections · Global Voices,"The death of the senator, 65 days after being shot several times in a rally, is taking place in the midst of the escalation of polarization and with no progress in the investigation of the crime."
24,El inicio ‘poco amistoso’ de Xabi Alonso en el Real Madrid,"El nuevo técnico blanco, que dirigió el Mundial sin apenas preparación, afronta este martes el único partido de pretemporada, contra el modesto WSG Tirol, una situación excepcional",Der Start von Xabi Alonso im Real Madrid,"Der neue weiße Techniker, der die Welt ohne Vorbereitung leitete, sieht sich am Dienstag dem einzigen Vorsaison-Spiel gegenüber, dem bescheidenen WSG Tirol, einer außergewöhnlichen Situation.",Xabi Alonso’s ‘unfriendly’ start in Real Madrid,"The new white technician, who led the World Cup with little preparation, faces this Tuesday the only preseason match, against the modest Tyrol WSG, an exceptional situation"
25,Detenido un joven en Almería por pedir imágenes de contenido sexual a menores a través de Fortnite y WhatsApp,"El hombre, de 21 años, identificaba a sus víctimas en un polideportivo en el que había sido entrenador y se comunicaba con ellas  después ‘online’","Ein junger Mann in Almería wurde verhaftet, weil er Bilder von sexuellen Inhalten von Minderjährigen über Fortnite und WhatsApp angefordert hatte.","Der 21-jährige Mann identifizierte seine Opfer in einem Sportwagen, in dem er Trainer war, und kommunizierte dann mit ihnen.",A young man arrested in Almeria for asking for images of sexual content from minors through Fortnite and WhatsApp,The 21-year-old man identified his victims in a sports car where he had been a coach and communicated with them after ‘online’.
26,La OPEP espera que el crecimiento de la demanda mundial de petróleo se acelere en 2026,"El cartel petrolero cree que China, la India y otros países asiáticos coparán buena parte de ese incremento de la demanda","OPEC hofft, dass sich das Wachstum der weltweiten Ölnachfrage bis 2026 beschleunigen wird","Das Ölkartell geht davon aus, dass China, Indien und andere asiatische Länder einen großen Teil der steigenden Nachfrage decken werden.",OPEC expects growth in global oil demand to accelerate by 2026,"The oil cartel believes that China, India and other Asian countries will share much of this increase in demand"
27,China veta la entrada de productos avícolas españoles por los brotes de gripe aviar,La medida llega apenas cuatro meses después de que Pekín y Madrid firmaran un acuerdo para abrir el mercado chino al sector avícola español,China verhindert den Eingang spanischer Geflügelerzeugnisse durch Ausbrüche der Aviären Influenza,Die Maßnahme kommt erst vier Monate nachdem Peking und Madrid eine Vereinbarung über die Öffnung des chinesischen Marktes für den spanischen Geflügelsektor unterzeichnet hatten.,China vetoes entry of Spanish poultry products due to outbreaks of avian influenza,The measure comes only four months after Beijing and Madrid signed an agreement to open the Chinese market to the Spanish poultry sector
28,Jennifer Aniston dice que su luto por Matthew Perry comenzó mucho antes de su muerte: “Hay una parte de mí que piensa que esto es mejor”,La actriz recuerda en una entrevista con ‘Vanity Fair’ la lucha contra las adicciones de su amigo y habla también de Brad Pitt y lo “vulnerable” que se sintió tras su divorcio,"Jennifer Aniston sagt, dass seine Trauer um Matthew Perry begann lange vor seinem Tod: Es gibt einen Teil von mir, der denkt, dass dies besser ist.",Die Schauspielerin erinnert sich an den Kampf gegen die Sucht ihres Freundes und spricht auch von Brad Pitt und wie wundernd sie sich nach ihrer Scheidung fühlte.,Jennifer Aniston says her mourning for Matthew Perry began long before her death: “There is a part of me that thinks this is better.”,The actress recalls in an interview with ‘Vanity Fair’ the fight against her friend’s addictions and also talks about Brad Pitt and how “vulnerable” he felt after his divorce
29,"El éxito de On, las zapatillas de Roger Federer: mejora beneficios y abrirá nuevas tiendas este año","El grupo suizo tiene previsto abrir los establecimientos en Zurich, California y Corea del Sur","Der Erfolg von On, Roger Federer Turnschuhe: Verbessert Vorteile und eröffnet neue Geschäfte in diesem Jahr","Die Schweizer Gruppe plant, die Betriebe in Zürich, Kalifornien und Südkorea zu öffnen","On's success, Roger Federer's sneakers: improve profits and open new stores this year","The Swiss group plans to open establishments in Zurich, California and South Korea"
30,Un yate se incendia en Formentera y acaba hundiéndose tras descontrolarse el fuego,Los siete tripulantes fueron evacuados por Salvamento Marítimo en buen estado,"Eine Yacht brannte in Formentera nieder und stürzte ab, nachdem das Feuer außer Kontrolle geraten war.",Die sieben Besatzungsmitglieder wurden von Seerettung in gutem Zustand evakuiert.,A yacht is burning in Formentera and eventually sinking after the fire is out of control,The seven crew members were evacuated by Sea Rescue in good condition
