,title-en,content-en,title-de,content-de,title-es,content-es,title-fr,content-fr,title-zh,content-zh
0,Britain is a global gaming superpower,The UK helped shape the global video-games industry: can it stay in the game?,Großbritannien ist eine globale Gaming-Supermacht,Das Vereinigte Königreich hat die globale Videospielindustrie mitgeprägt: Kann es im Spiel bleiben?,Gran Bretaña es una superpotencia global de juegos,El Reino Unido ayudó a dar forma a la industria mundial de videojuegos: ¿puede permanecer en el juego?,La Grande-Bretagne est une superpuissance mondiale du jeu,Le Royaume-Uni a aidé à façonner l'industrie mondiale des jeux vidéo: peut-il rester dans le jeu?,英国是一个全球博彩超级大国,英国帮助塑造了全球电子游戏产业:它能留在游戏中吗?
1,The four years when old New York died and a new one was born,Some of America’s most outlandish politicians also made their debuts in 1986-89,"Die vier Jahre, als der alte New York starb und ein neues geboren wurde",Einige amerikanische Politiker feierten auch 1986-89 ihre Debüts.,Los cuatro años en que murió la vieja Nueva York y nació una nueva,Algunos de los políticos más extravagantes de Estados Unidos también hicieron su debut en 1986-89,Les quatre ans où l'ancien New York est mort et un nouveau est né,Certains des hommes politiques les plus étrangers ont également fait leurs débuts en 1986-1989.,"纽约四岁去世,新出生的四年",美国一些最外国政客也在1986-1989年首次出场。
2,Next top model: GPT-5 and its AI rivals,Also on the daily podcast: why Japan has investing fever and a revealing look at America’s indie wrestling leagues,Nächstes Top-Modell: GPT-5 und seine KI-Konkurrenten,Auch auf dem täglichen Podcast: Warum Japan Fieber investiert hat und einen aufschlussreichen Blick auf Amerikas Indie-Wrestling-Ligen,Siguiente modelo superior: GPT-5 y sus rivales de IA,También en el podcast diario: por qué Japón ha invertido fiebre y una mirada reveladora a las ligas de lucha libre indie de Estados Unidos,Prochain top model : GPT-5 et ses rivaux AI,Aussi sur le podcast quotidien: pourquoi le Japon a investi la fièvre et un regard révélateur sur les ligues de lutte indie Americas,下一个顶顶级模型:GPT-5及其AI对手,"也出现在每日播客上:为什么日本投资发烧,"
3,"The US in brief: Bowser keeps calm, Democrats rage","Our daily political update, featuring the stories that matter","Die USA in Kürze: Bowser bleibt ruhig, Demokraten toben","Unser tägliches politisches Update mit den Geschichten, die wichtig sind","Estados Unidos en resumen: Bowser mantiene la calma, los demócratas rabia","Nuestra actualización política diaria, con las historias que importan","Les Etats-Unis en bref : Bowser se calme, les démocrates font rage","Notre mise à jour politique quotidienne, mettant en vedette les histoires qui comptent","简言之,美国:鲍泽保持平静,民主党的愤怒","我们每天的政治最新情况,特别报道重要的故事"
4,Wax off: Has McKinsey lost its lustre?,A handpicked article read aloud from the latest issue of The Economist,Wax off: Hat McKinsey seinen Glanz verloren?,Ein handverlesener Artikel aus der aktuellen Ausgabe von The Economist,¿Mckinsey ha perdido su brillo?,Un artículo escogido a mano leído en voz alta del último número de The Economist,McKinsey a-t-il perdu son éclat ?,Un article tiré à la main a été lu à haute voix dans le dernier numéro de The Economist,McKinsey失去了它的性欲吗?,"《经济学家》最新一期《经济学家》的一篇文章,"
5,Why Donald Trump is wrong to take over the DC police,The emergency he cites is over-hyped,"Warum Donald Trump falsch ist, die DC-Polizei zu übernehmen",Der von ihm zitierte Notfall ist überfüllt.,Por qué Donald Trump se equivoca al hacerse cargo de la policía de DC,La emergencia que él cita está sobre-hiperizada,Pourquoi Donald Trump a tort de prendre le contrôle de la police de DC,L'urgence qu'il cite est exagérée.,为什么唐纳德·特朗普 抓了华盛顿警方是错的,他所引用的紧急事件 已经过头了
6,How AI could create the first one-person unicorn,The technology is allowing entrepreneurs to start and grow businesses on their own,Wie KI das erste Einhorn mit einer Person erschaffen konnte,"Die Technologie ermöglicht es Unternehmern, eigene Unternehmen zu gründen und zu wachsen",Cómo IA podría crear el primer unicornio de una sola persona,La tecnología está permitiendo a los empresarios iniciar y hacer crecer sus negocios por su cuenta,Comment l'IA pourrait créer la première licorne d'une personne,La technologie permet aux entrepreneurs de créer et de développer des entreprises par eux-mêmes.,人工智能如何创造第一个单人独角兽,该技术使企业家能够自己创办和发展企业
7,The Russian-run town squatting on NATO territory,Could Vladimir Putin exploit the odd legal status of an Arctic archipelago?,"Die russisch geführte Stadt, die auf dem NATO-Territorium hockt",Könnte Wladimir Putin den seltsamen Rechtsstatus eines arktischen Archipels ausnutzen?,La ciudad dirigida por Rusia se agacha en territorio de la OTAN,¿Podría Vladimir Putin explotar el extraño estatus legal de un archipiélago ártico?,La ville russe squatte sur le territoire de l'OTAN,Vladimir Poutine pourrait-il exploiter le statut juridique étrange d'un archipel arctique ?,俄罗斯经营的城镇在北约领土上的占领,弗拉基米尔·普京能否利用北极群岛的奇特法律地位?
8,"Cow’s milk, as well as Russian oil, fuels the US-India trade war",There is another liquid the two sides cannot agree on,Kuhmilch sowie russisches Öl tanken den US-Indien-Handelskrieg,"Es gibt noch eine Flüssigkeit, über die sich die beiden Seiten nicht einigen können.","La leche de vaca, así como el petróleo ruso, alimentan la guerra comercial entre Estados Unidos y la India",Hay otro líquido en el que las dos partes no pueden ponerse de acuerdo,"Le lait de vache, ainsi que le pétrole russe, alimentent la guerre commerciale entre les États-Unis et l'Inde",Il y a un autre liquide sur lequel les deux parties ne peuvent s'entendre.,奶牛的牛奶以及俄罗斯石油助长了美印贸易战争,还有另外一种 双方无法达成一致的液体
9,The War Room newsletter: Seven of the best books on the Pacific war,"Richard Cockett, a news editor, recommends seven books about the defeat of Japan in the second world war",The War Room newsletter: Sieben der besten Bücher über den Pazifikkrieg,"Richard Cockett, ein Nachrichtenredakteur, empfiehlt sieben Bücher über die Niederlage Japans im Zweiten Weltkrieg",The War Room newsletter: Siete de los mejores libros sobre la guerra del Pacífico,"Richard Cockett, editor de noticias, recomienda siete libros sobre la derrota de Japón en la segunda guerra mundial",The War Room newsletter: Sept des meilleurs livres sur la guerre du Pacifique,"Richard Cockett, rédacteur en chef de l'actualité, recommande sept livres sur la défaite du Japon pendant la seconde guerre mondiale",《战争室通讯:太平洋战争最好的七本书》,"Richard Cockett, 一位新闻编辑, 推荐七本关于日本在第二次世界大战中败败的书,"
10,Private chefs are spilling the culinary secrets of the super-rich,On social media they serve recipes with a side of celebrity intrigue,Privatköche verschütten die kulinarischen Geheimnisse der Superreichen,In sozialen Medien servieren sie Rezepte mit einer Seite von Promi-Intrigen,Los chefs privados están derramando los secretos culinarios de los súper ricos,En las redes sociales sirven recetas con un lado de la intriga de celebridades,Les chefs privés répandent les secrets culinaires des super-riches,"Sur les réseaux sociaux, ils servent des recettes avec un côté de célébrité intrigue",私人厨师泄露了超级富豪的烹饪秘密,"在社交媒体上,"
11,"Confrontation in the Arctic is not inevitable, argues Kieran Mulvaney",The big players don’t need to view every adversary’s moves as a threat,"Konfrontation in der Arktis ist nicht unvermeidlich, argumentiert Kieran Mulvaney","Die großen Spieler brauchen nicht jeden Gegner zu sehen, bewegt sich als Bedrohung","La confrontación en el Ártico no es inevitable, argumenta Kieran Mulvaney",Los grandes jugadores no necesitan ver los movimientos de cada adversario como una amenaza,"La confrontation dans l'Arctique n'est pas inévitable, soutient Kieran Mulvaney",Les grands joueurs n'ont pas besoin de voir chaque adversaire se déplace comme une menace,"北极的对抗并非不可避免,",大玩家不需要把对手的动作看成威胁
12,Mikhail Komin on why the Arctic is Putin’s next front,The political scientist writes that the Kremlin’s insecurities are fuelling escalation in the region,"Michail Komin, warum die Arktis Putins nächste Front ist","Der Politikwissenschaftler schreibt, dass die Kreml-Unsicherheiten die Eskalation in der Region anheizen",Mikhail Komin sobre por qué el Ártico es el próximo frente de Putin,El politólogo escribe que las inseguridades del Kremlin están alimentando la escalada en la región,Mikhail Komin sur la raison pour laquelle l'Arctique est Poutine,Le politologue écrit que les insécurités du Kremlin alimentent l'escalade dans la région,"米哈伊尔·科明(Mikhail Komin),","这位政治科学家写道,克里姆林宫的不安全正在加剧该地区的升级。"
13,"The far north has become NATO’s soft underbelly, writes John Bolton",The foreign-policy expert makes the argument for keeping the Chinese out and the Russians down,"Der ferne Norden ist zu einem weichen Unterbauchen der NATO geworden, schreibt John Bolton","Der außenpolitische Experte macht das Argument, die Chinesen draußen und die Russen unten zu halten","El lejano norte se ha convertido en el vientre blando de la OTAN, escribe John Bolton",El experto en política exterior hace el argumento para mantener a los chinos fuera y a los rusos abajo,"L'extrême nord est devenu l'OTAN soft underbelly, écrit John Bolton",L'expert en politique étrangère fait l'argument pour garder les Chinois à l'écart et les Russes à la baisse,"约翰·博尔顿(John Bolton)写道,远北地区已成为北约的软腰软腰。",外交政策专家为中国人和俄国人
14,The US in brief: Shadowboxing in DC,"Our daily political update, featuring the stories that matter",Die USA in Kürze: Shadowboxing in DC,"Unser tägliches politisches Update mit den Geschichten, die wichtig sind",Estados Unidos en resumen: Shadowboxing en DC,"Nuestra actualización política diaria, con las historias que importan",Les Etats-Unis en bref : Shadowboxing en DC,"Notre mise à jour politique quotidienne, mettant en vedette les histoires qui comptent","简言之,美国:在华盛顿的影子拳击","我们每天的政治最新情况,特别报道重要的故事"
15,"The summit of its parts: Ukraine, Trump and Putin",Also on the daily podcast: where the Detroit of electric vehicles will be and allergy treatments get ever better,"Der Gipfel seiner Teile: Ukraine, Trump und Putin",Auch auf dem täglichen Podcast: wo die Detroit von Elektrofahrzeugen und Allergie-Behandlungen immer besser werden,"La cumbre de sus partes: Ucrania, Trump y Putin",También en el podcast diario: donde estará el Detroit de los vehículos eléctricos y los tratamientos de alergia mejoran cada vez más,"Le sommet de ses parties: Ukraine, Trump et Poutine",Aussi sur le podcast quotidien: où le Détroit des véhicules électriques sera et les traitements d'allergie obtiennent toujours mieux,其部分的首脑会议:乌克兰、特朗普和普京,"电动车辆底底特律将在那里, 过敏治疗也变得更好,"
16,"The world needs more than drugs to fight obesity, writes Novo Nordisk’s ex-boss",Lars Fruergaard Jørgensen on how society can pull together to avoid a health and economic catastrophe,"Die Welt braucht mehr als Drogen, um Fettleibigkeit zu bekämpfen, schreibt Novo Nordisk-ex-boss","Lars Fruergaard Jørgensen, wie die Gesellschaft zusammenhalten kann, um eine Gesundheits- und Wirtschaftskatastrophe zu vermeiden","El mundo necesita más que drogas para combatir la obesidad, escribe el exjefe de Novo Nordisk",Lars Fruergaard Jørgensen sobre cómo la sociedad puede unirse para evitar una catástrofe económica y sanitaria,"Le monde a besoin de plus que des médicaments pour lutter contre l'obésité, écrit Novo Nordisk, ex-boss",Lars Fruergaard Jørgensen sur la façon dont la société peut se rassembler pour éviter une catastrophe sanitaire et économique,"诺沃·诺迪斯克的前老板写道:世界需要的不仅仅是毒品,","Lars Frueregaard Jørgensen 讨论社会如何团结起来,避免健康和经济灾难"
17,Tipping scales: justice for Gaza will have to come from within Israel,A handpicked article read aloud from the latest issue of The Economist,Trinkwaagen: Gerechtigkeit für Gaza muss aus Israel kommen,Ein handverlesener Artikel aus der aktuellen Ausgabe von The Economist,Escalas de golpe: la justicia para Gaza tendrá que venir de dentro de Israel,Un artículo escogido a mano leído en voz alta del último número de The Economist,Balances de basculement: la justice pour Gaza devra venir d'Israël,Un article tiré à la main a été lu à haute voix dans le dernier numéro de The Economist,权定尺度:加沙的司法必须来自以色列内部,"《经济学家》最新一期《经济学家》的一篇文章,"
18,America’s drug regulator is in turmoil,The already fraught oversight of rare-disease treatments is becoming politicised,Amerikas Drogen-Regulator ist in Turbulenzen,Die bereits angespannte Überwachung der Behandlung mit seltenen Krankheiten wird zunehmend politisiert.,El regulador de drogas de Estados Unidos está en agitación,La ya tensa supervisión de los tratamientos de enfermedades raras se está politizando,Americas drug regulator est dans la tourmente,Le contrôle déjà chargé des traitements des maladies rares devient politisé,美国的药物监管者处于动荡之中,对稀有疾病治疗的本已充满监督的监管正日益政治化
19,America’s housing market is shuddering,"For the country’s homeowners, the good times are coming to an end",Amerikas Wohnungsmarkt schaudert,"Für das Land, Hausbesitzer, die guten Zeiten kommen zu einem Ende",El mercado inmobiliario de Estados Unidos está estremeciendo,"Para los propietarios del país, los buenos tiempos están llegando a su fin",Amérique Le marché de l'habitation tremble,"Pour les propriétaires du pays, les bons moments arrivent à leur terme",美国的房地产市场正在摇摇欲坠,"对于国家的房主来说,美好时代即将结束"
20,"Instead of sanctions, Donald Trump announces a summit with Russia","Despite the confusion, momentum for peace in Ukraine seems to be building",Statt Sanktionen kündigt Donald Trump einen Gipfel mit Russland an,Trotz der Verwirrung scheint die Dynamik für den Frieden in der Ukraine zu wachsen,"En lugar de sanciones, Donald Trump anuncia una cumbre con Rusia","A pesar de la confusión, el impulso hacia la paz en Ucrania parece estar aumentando","Au lieu de sanctions, Donald Trump annonce un sommet avec la Russie","Malgré la confusion, l'élan pour la paix en Ukraine semble être en train de se développer.","唐纳德·特朗普宣布与俄罗斯举行首脑会议,","尽管局势混乱,乌克兰的和平势头似乎正在形成。"
21,Donald Trump brokers a peace plan in the Caucasus,An American-backed deal between Armenia and Azerbaijan could weaken Russia,Donald Trump vermittelt einen Friedensplan im Kaukasus,Ein von den Amerikanern unterstütztes Abkommen zwischen Armenien und Aserbaidschan könnte Russland schwächen,Donald Trump negocia un plan de paz en el Cáucaso,Un acuerdo respaldado por los Estados Unidos entre Armenia y Azerbaiyán podría debilitar a Rusia,Donald Trump négocie un plan de paix dans le Caucase,Un accord soutenu par les Américains entre l'Arménie et l'Azerbaïdjan pourrait affaiblir la Russie,唐纳德·特朗普在高加索地区 促成一个和平计划,美国支持的亚美尼亚和阿塞拜疆之间的一项协议可能会削弱俄罗斯
22,The Memory Keepers,"As survivors die out, how do you keep the memories of Japan’s atomic apocalypse alive?",Die Gedächtnishüter,"Als Überlebende sterben, wie halten Sie die Erinnerungen an Japans Atomapokalypse am Leben?",Los guardianes de la memoria,"A medida que los sobrevivientes mueren, ¿cómo mantienes vivos los recuerdos del apocalipsis atómico japonés?",Les gardiens de la mémoire,"Comme les survivants meurent, comment gardez-vous en vie les souvenirs de l'apocalypse atomique du Japon ?",记忆保存者,"当幸存者死后,你如何将日本原子末日的记忆保存在生命中?"
23,Still want to be a London cabbie?,"Surprisingly, many do, and are prepared to study for the gruelling test to become one",Willst du immer noch ein Taxifahrer in London sein?,"Überraschenderweise tun und sind viele bereit, zu studieren, damit der zermürbende Test eins wird",¿Aún quieres ser taxista de Londres?,"Sorprendentemente, muchos lo hacen, y están preparados para estudiar para que la prueba agotadora se convierta en uno",Tu veux toujours être un taxi londonien ?,"Étonnamment, beaucoup d'entre eux le font et sont prêts à étudier pour que le test épuisant devienne un",还想当伦敦出租车司机吗?,"令人惊讶的是,许多人这样做,并准备研究如何使艰苦的试验成为一项试验。"
24,OpenAI’s latest step towards advanced artificial intelligence,"GPT-5 is an update, not a revolution. But revolution may still be on the way",OpenAI-neuster Schritt in Richtung fortgeschrittener künstlicher Intelligenz,"GPT-5 ist ein Update, keine Revolution. Aber Revolution kann immer noch auf dem Weg sein",El último paso de OpenAI hacia la inteligencia artificial avanzada,"El GPT-5 es una actualización, no una revolución.","La dernière étape de l'OpenAI, vers l'intelligence artificielle avancée","GPT-5 est une mise à jour, pas une révolution.",OpenAI 朝向先进的人工智能的最新一步,"GPT-5是最新消息,不是革命。 但革命可能还在路上。"
25,Cover Story newsletter: How we chose the cover image,,Cover Story Newsletter: Wie wir das Coverbild gewählt haben,,Portada del boletín: Cómo elegimos la imagen de la portada,,Cover Story newsletter: Comment nous avons choisi l'image de couverture,,封面新闻通讯:我们如何选择封面图像,
26,Treasure map: Trump finds gold in redistricting,"Our weekly podcast on democracy in America. This week, Donald Trump broke another norm when he told Texas Republicans to redraw their congressional maps to create more Republican seats. Democrats followed suit. We look at how this may tip the balance of power in Congress, and whether mid-decade redistricting is the new norm.",Schatzkarte: Trump findet Gold in der Neuverengung,"Unsere wöchentliche Podcast über Demokratie in Amerika. Diese Woche, Donald Trump brach eine andere Norm, als er Texas Republikaner sagte, ihre Kongress-Karten neu zu zeichnen, um mehr republikanische Sitze zu schaffen. Demokraten folgten Anzug. Wir betrachten, wie dies das Gleichgewicht der Macht im Kongress kippen kann, und ob Mitte-Dekade Neueinteilung ist die neue Norm.",Mapa del tesoro: Trump encuentra oro en la redistribución,"Esta semana, Donald Trump rompió otra norma cuando le dijo a los republicanos de Texas que redibujen sus mapas del Congreso para crear más escaños republicanos. Los demócratas siguieron el ejemplo. Observamos cómo esto puede inclinar el equilibrio de poder en el Congreso, y si la redistribución a mediados de decenio es la nueva norma.",Carte du trésor: Trump trouve de l'or dans le redistricting,"Notre podcast hebdomadaire sur la démocratie en Amérique. Cette semaine, Donald Trump a enfreint une autre norme quand il a dit aux Républicains du Texas de redessiner leurs cartes du Congrès pour créer plus de sièges républicains. Les démocrates ont suivi.",宝藏地图:特朗普在重新分区中找到黄金,"我们每周一次的美国民主播客。 本周,唐纳德·特朗普打破了另一个常规,他告诉得克萨斯共和党人重新绘制他们的国会地图,以创造更多的共和党席位。 民主党人也效仿了。 我们审视了这如何可能给国会的权力平衡起点作用,以及十年中期重新划分是否是新规范。"
27,Are nightmares bad for your health?,"If you have them often, the answer seems to be yes",Sind Albträume schlecht für Ihre Gesundheit?,"Wenn Sie sie oft haben, scheint die Antwort ja zu sein",¿Las pesadillas son malas para tu salud?,"Si los tienes a menudo, la respuesta parece ser sí.",Les cauchemars sont-ils mauvais pour votre santé ?,"Si vous les avez souvent, la réponse semble être oui.",恶梦对健康有害吗?,"如果你经常有,答案似乎是肯定的"
28,"Pascal Soriot, the pharma titan tiring of Britain",AstraZeneca’s boss shares Donald Trump’s mission to spread the cost of drug development,"Pascal Soriot, die Pharma-Titan ermüdend von Großbritannien","AstraZenecas Chef teilt Donald Trumps Mission, die Kosten der Drogenentwicklung zu verbreiten","Pascal Soriot, el titán farmacéutico cansado de Gran Bretaña",El jefe de AstraZeneca comparte la misión de Donald Trump de difundir el costo del desarrollo de drogas,"Pascal Soriot, le titan pharmaceutique de la Grande-Bretagne",Le patron d'AstraZeneca lance la mission de Donald Trump pour répartir le coût du développement de la drogue,"Pascal Soriot, 英国的药剂业巨人劳累","AstraZeneca的上司与Donald Trump共同承担任务, 分担毒品开发成本,"
29,Donald Trump’s tariffs on Brazil are more bark than bite,The Latin American giant may have avoided the worst—for now,Donald Trumps Zölle auf Brasilien sind mehr Rinde als Biss,Der lateinamerikanische Riese mag das Schlimmste vermieden haben — für jetzt,Los aranceles de Donald Trump sobre Brasil son más ladradores que mordiscos,"El gigante latinoamericano pudo haber evitado lo peor, por ahora",Les tarifs de Donald Trump sur le Brésil sont plus d'écorce que de morsure,Le géant latino-américain a peut-être évité le pire — pour l'instant,唐纳德·特朗普对巴西的关税比咬狗还多,拉丁美洲巨人可能已经避免了最坏的情况。
30,Xi Jinping’s city of the future is coming to life,It is both impressive and worrying,Xi Jinpings Stadt der Zukunft wird lebendig,Es ist beeindruckend und besorgniserregend,La ciudad del futuro de Xi Jinping está cobrando vida,Es a la vez impresionante y preocupante,La ville du futur de Xi Jinping's prend vie,C'est à la fois impressionnant et inquiétant,习近平的未来城市即将到来,"这既令人印象深刻,又令人担忧"
31,An economist’s guide to big life decisions,Forget your trip to the dentist. A new check-up is required,Ein Ökonom führt zu großen Lebensentscheidungen,Vergessen Sie Ihre Reise zum Zahnarzt. Ein neuer Check-up ist erforderlich,Guía de un economista para las grandes decisiones de la vida,Olvídese de su viaje al dentista. Se requiere un nuevo chequeo,Un guide de l'économiste sur les grandes décisions de vie,Oubliez votre voyage chez le dentiste. Un nouveau check-up est nécessaire,经济学家关于重大生活决策的指南,"忘了你去看牙医的行程,需要重新检查。"
32,Want better returns? Forget risk. Focus on fear,A recent study suggests a new paradigm for asset pricing,Wollen Sie bessere Rückkehr? Vergessen Sie Risiko. Konzentrieren Sie sich auf Angst,Eine kürzlich durchgeführte Studie schlägt ein neues Paradigma für die Preisgestaltung von Vermögenswerten vor.,¿Quieres mejores devoluciones? Olvida el riesgo. Concéntrate en el miedo,Un estudio reciente sugiere un nuevo paradigma para la fijación de precios de los activos,Vous voulez de meilleurs retours? Oubliez le risque. Concentrez-vous sur la peur,Une étude récente suggère un nouveau paradigme pour la tarification des actifs,"想要更好的回报吗? 忘记风险,专注于恐惧",最近的一项研究提出了资产定价的新范式
33,"If America goes after India’s oil trade, China will benefit",A crackdown on Russian crude would have knock-on consequences,"Wenn Amerika hinter Indiens Ölhandel her ist, wird China davon profitieren.",Eine Niederschlagung des russischen Rohmaterials hätte Auswirkungen auf die Wirtschaft.,"Si Estados Unidos va tras el comercio de petróleo de la India, China se beneficiará",Una represión contra el crudo ruso tendría consecuencias,"Si l'Amérique suit le commerce pétrolier de l'Inde, la Chine en bénéficiera",Une répression du brut russe aurait des conséquences fâcheuses,"如果美国追逐印度石油贸易,中国将受益",对俄罗斯原油的镇压将带来连锁后果
34,America’s fertility crash reaches a new low,Even once-fecund states are having fewer children,Amerikas Fruchtbarkeitsabsturz erreicht ein neues Tief,Selbst einmal-Fecund Staaten haben weniger Kinder,La caída de la fertilidad en Estados Unidos alcanza un nuevo nivel bajo,Incluso los estados fecundos están teniendo menos hijos.,L'accident de fertilité de l'Amérique atteint un nouveau bas,Même les états autrefois fédés ont moins d'enfants,美国的生育率崩溃达到新的低点,"即使是曾经生育过孩子的州,生育孩子的州也越来越少。"
