,title-en,content-en,title-de,content-de,title-es,content-es,title-fr,content-fr,title-zh,content-zh
36,Trump will not let the world move on from tariffs,"Six charts show the damage to America, its trading partners and its consumers","Trump wird nicht zulassen, dass die Welt von Zöllen abweicht","Sechs Diagramme zeigen den Schaden für Amerika, seine Handelspartner und seine Verbraucher",Trump no dejará que el mundo pase de los aranceles,"Seis gráficos muestran el daño a América, sus socios comerciales y sus consumidores",Trump ne laissera pas le monde passer des tarifs douaniers,"Six graphiques montrent les dommages causés à l'Amérique, à ses partenaires commerciaux et à ses consommateurs",特朗普不会让世界摆脱关税,六张图表显示美国、其贸易伙伴和消费者遭受的损害
37,Uncovering the secret food trade that corrupts Iran’s neighbours,Oil and terrorism are not the country’s only exports,"Enthüllen des geheimen Lebensmittelhandels, der Irans Nachbarn korrumpiert",Öl und Terrorismus sind nicht das Land nur Exporte,Descubrir el comercio secreto de alimentos que corrompe a los vecinos de Irán,El petróleo y el terrorismo no son las únicas exportaciones del país,Découvrir le commerce alimentaire secret qui corrompt les voisins de l'Iran,Le pétrole et le terrorisme ne sont pas les seules exportations du pays.,揭露腐蚀伊朗邻国的秘密食品贸易,石油和石油恐怖主义不是该国唯一的出口品。
38,The trade deal with America shows the limits of the EU’s power,The bloc opts for prudence over defiance,Der Handelsvertrag mit Amerika zeigt die Grenzen der Macht der EU,Der Block entscheidet sich für Klugheit über Trotz,El acuerdo comercial con Estados Unidos muestra los límites del poder de la UE,El bloque opta por la prudencia sobre el desafío,L'accord commercial avec l'Amérique montre les limites de la puissance de l'UE,Le bloc opte pour la prudence plutôt que la défiance,与美国的贸易协议 显示了欧盟权力的极限,"集团选择谨慎,而不是违抗"
39,Shanxi province is struggling to diversify away from coal,Why the transition is going so slowly,Die Provinz Shanxi kämpft um die Diversifizierung weg von der Kohle,Warum der Übergang so langsam voranschreitet,La provincia de Shanxi está luchando por diversificarse lejos del carbón,¿Por qué la transición va tan lentamente?,La province du Shanxi peine à se diversifier loin du charbon,Pourquoi la transition va si lentement,山西省正努力从煤炭中走向多样化,为什么过渡过程如此缓慢
40,"Six months after DeepSeek’s breakthrough, China speeds on with AI",Real-world applications have priority over cutting-edge development,Sechs Monate nach dem Durchbruch von DeepSeek beschleunigt China mit KI,Real-Welt-Anwendungen haben Vorrang vor modernster Entwicklung,"Seis meses después del avance de DeepSeek, China acelera con IA",Las aplicaciones del mundo real tienen prioridad sobre el desarrollo de vanguardia,"Six mois après la percée de DeepSeek, la Chine s'accélère avec l'IA",Les applications du monde réel ont la priorité sur le développement à la fine pointe de la technologie,"在DeepSeek突破六个月后,",现实世界的应用优先于前沿发展
41,Savvy staff are moving from China’s nurseries to its care homes,Last year there were 12m fewer pre-school pupils than in 2021,Savvy Mitarbeiter bewegen sich von Chinas Baumschulen zu seinen Pflegeheimen,Letztes Jahr gab es 12m weniger Vorschulkinder als 2021,El personal de Savvy se está trasladando de las guarderías chinas a sus hogares de acogida,El año pasado hubo 12 millones menos de alumnos preescolares que en 2021,Le personnel de Savvy déménage des crèches chinoises vers ses foyers de soins,"L'année dernière, il y avait 12 millions d'élèves d'âge préscolaire de moins qu'en 2021.",Savvvy工作人员正在从中国的托儿所迁至其护理之家。,"去年,学龄前学生人数比2021年少12万,比2021年少12万。"
42,Everyone loses in the rage of China’s delivery wars,Companies are caught in a race to the bottom,Jeder verliert in der Wut Chinas Lieferkriege,Unternehmen sind in einem Wettlauf nach unten gefangen,Todo el mundo pierde en la furia de las guerras de entrega de China,Las empresas están atrapadas en una carrera hasta el fondo,Tout le monde perd dans la rage des guerres de livraison de la Chine,Les entreprises sont prises dans une course au fond,"在中国投送战争的狂暴中,每个人都输了",公司在竞到底部的比赛中被抓住
43,Can pensioners rescue China’s economy?,The government is stingy and timid when it comes to retirement benefits,Können Rentner die chinesische Wirtschaft retten?,"Die Regierung ist geizig und zaghaft, wenn es um Rentenleistungen geht.",¿Pueden los pensionistas rescatar la economía china?,El gobierno es tacaño y tímido cuando se trata de beneficios de jubilación,Les retraités peuvent-ils sauver l'économie chinoise ?,Le gouvernement est téméraire et timide en ce qui concerne les prestations de retraite,养老金领取者能够拯救中国的经济吗?,"在退休金方面,政府很吝啬和胆怯。"
44,“Comrade” is making a comeback in China,Or so the government hopes,"""Comrade"" macht ein Comeback in China",Oder so hofft die Regierung,“Camarada” está volviendo a China,O eso es lo que el gobierno espera,Le camarade fait un retour en Chine,Ou alors le gouvernement espère,“同志”正在中国重新崛起,或政府希望
45,The looming deadline for the Panama Canal ports deal,China will approve their sale. But there’s a huge catch,Die bevorstehende Frist für den Panama-Kanal-Ports-Deal,China wird ihren Verkauf genehmigen. Aber es gibt einen riesigen Fang,El inminente plazo para el acuerdo con los puertos del Canal de Panamá,"China aprobará su venta, pero hay una enorme captura",L'échéance prochaine pour l'accord sur les ports du canal de Panama,La Chine va approuver leur vente. Mais il ya une énorme prise,巴拿马运河港口交易的最后期限即将到来,中国会批准它们的销售。 但有一个巨大的收获。
46,Xi Jinping is growing more elusive,His leadership is entering a new but no less powerful stage,Xi Jinping wird immer schwieriger,"Seine Führung tritt in eine neue, aber nicht weniger mächtige Bühne ein",Xi Jinping es cada vez más elusivo.,Su liderazgo está entrando en una nueva pero no menos poderosa etapa,Xi Jinping est de plus en plus insaisissable,"Son leadership entre dans une nouvelle étape, mais pas moins puissante",习近平越来越难以捉摸,他的领导层正在进入一个新的但同样强大的阶段
47,China’s exporters shrug off the trade war—for now,How long can they continue to do so?,Chinas Exporteure zucken den Handelskrieg ab — für jetzt,Wie lange können sie das noch tun?,"Los exportadores de China se encogen de hombros en la guerra comercial, por ahora",¿Cuánto tiempo pueden seguir haciéndolo?,Chine Les exportateurs s'éloignent de la guerre commerciale — pour l'instant,Combien de temps peuvent-ils continuer à le faire?,中国的出口商从贸易战争中退缩到现在,他们能继续这样做多久?
48,Why a fling with a foreigner insults China’s “national dignity”,Outrage mounts over a tryst between a Chinese student and a Ukrainian gamer,Warum ein Fling mit einem Ausländer China beleidigt,Outrage überragt einen Versuch zwischen einem chinesischen Schüler und einem ukrainischen Spieler,¿Por qué una aventura con un extranjero insulta la “dignidad nacional” de China?,La indignación se cierne sobre una cita entre un estudiante chino y un jugador ucraniano,Pourquoi un flirt avec un étranger insulte la Chine,L'outrage monte sur un essai entre un étudiant chinois et un joueur ukrainien,为何与外国人私奔侮辱中国的“民族尊严”,一个中国学生和一个乌克兰游戏玩家之间的交汇
49,How is Trump’s Brazil-bashing putting America first?,It isn’t,Wie setzt Trumps Brasilien-Bashing Amerika an die erste Stelle?,Es ist nicht,¿Cómo es que el golpe de Trump en Brasil está poniendo a Estados Unidos en primer lugar?,No lo es,Comment Trump est-il en train de mettre l'Amérique en premier ?,Ce n'est pas,特朗普对巴西的抨击如何将美国放在首位?,"并不是,"
50,Alligator Alcatraz is an exercise in performative cruelty,Many Republican voters don’t like it,Alligator Alcatraz ist eine Übung in performativer Grausamkeit,Viele republikanische Wähler mögen es nicht,El cocodrilo Alcatraz es un ejercicio de crueldad performativa,A muchos votantes republicanos no les gusta,Alcatraz alligator est un exercice de cruauté performative,Beaucoup d'électeurs républicains ne l'aiment pas,鳄鱼阿尔卡特拉齐是一种表现残忍的行为,"许多共和选民都不喜欢,"
51,MAGA’s disenchantment with Israel,"Democrats have long been split over the Jewish state. Cracks are appearing among Republicans, too",Maga-Entzauberung mit Israel,"Demokraten sind seit langem gespalten über den jüdischen Staat. Risse erscheinen unter Republikanern, auch",El desencanto de MEGA con Israel,"Los demócratas han estado divididos durante mucho tiempo sobre el estado judío. Las grietas están apareciendo entre los republicanos, también",MAGA's désenchantement avec Israël,Les démocrates sont depuis longtemps divisés sur l'État juif. Des cracks apparaissent aussi parmi les républicains.,MAGA对以色列的失望,"长期以来,民主党人一直分裂在犹太国家之上。 共和党人中间也出现了裂痕。"
52,Democrats are likely to lose the redistricting war,"If both sides abandon principle, a draw is possible, but Republicans face fewer obstacles","Die Demokraten werden wahrscheinlich den Krieg verlieren, der erneut einschränkt.","Wenn beide Seiten das Prinzip aufgeben, ist eine Auslosung möglich, aber Republikaner sehen sich weniger Hindernissen gegenüber",Es probable que los demócratas pierdan la guerra de redistribución de distritos,"Si ambas partes abandonan el principio, un empate es posible, pero los republicanos enfrentan menos obstáculos",Les Démocrates risquent de perdre la guerre de nouveau.,"Si les deux parties abandonnent le principe, un tirage est possible, mais les républicains sont confrontés à moins d'obstacles",民主党人很可能输掉重新划区战争,"如果双方都放弃原则,就有可能取胜,但共和党面临的障碍较少"
53,Donald Trump escalates his war on numbers,Another shocking assault on a non-partisan institution,Donald Trump eskaliert seinen Krieg auf Zahlen,Ein weiterer schockierender Angriff auf eine nicht-parteiische Institution,Donald Trump intensifica su guerra contra los números,Otro ataque escandaloso contra una institución no partidista,Donald Trump intensifie sa guerre contre les chiffres,Une autre agression choquante contre une institution non partisane,唐纳德·特朗普在数字战中升级,另一起对无党派机构令人震惊的袭击
54,Deadheads hope to “make America grateful again”,The band’s 60th anniversary concerts show how much San Francisco has changed,"Deadheads hoffen, Amerika wieder dankbar zu machen","Die 60. Jubiläumskonzerte der Band zeigen, wie sehr sich San Francisco verändert hat",Los muertos esperan “hacer que Estados Unidos vuelva a estar agradecido”,Los conciertos del 60 aniversario de la banda muestran cuánto ha cambiado San Francisco,Deadheads espèrent rendre l'Amérique reconnaissante à nouveau,Les concerts du 60e anniversaire du groupe montrent combien San Francisco a changé,死头希望“让美国再次感激”,乐队的60周年音乐会展示了旧金山的变化
55,The National Park Service is in disarray,The Trump administration is cutting thousands of staff at America’s favourite agency,Der National Park Service ist in Unordnung,Die Trump-Administration schneidet Tausende von Mitarbeitern bei Amerikas Lieblingsagentur,El Servicio de Parques Nacionales está en desorden,La administración Trump está cortando a miles de empleados en la agencia favorita de Estados Unidos,Le service des parcs nationaux est en désarroi,L'administration Trump est en train de couper des milliers de personnel à l'agence préférée de l'Amérique.,国家公园管理局陷入混乱,"特朗普政府正在裁员数千名美国最喜爱的机构工作人员,"
56,Donald Trump’s redistricting ploy is politics at its most cynical,But the Democrats’ response is self-defeating,Donald Trumps Umschichtung ist Politik an ihrer zynischsten,Aber die Democrats-Response ist selbstzerstörend,La estratagema de redistribución de Donald Trump es la política más cínica,Pero la respuesta de los demócratas es contraproducente,Donald Trumps redistricter stratagème est la politique à son plus cynique,Mais la réponse des Démocrates va à l'encontre de l'autodéfense.,"Donald Trump的重新分区策略是政治,",但民主党的反应是自败自败
57,Modular homes are helping LA’s wildfire survivors rebuild,"Could factory-made units ease America’s housing shortage, too?",Modulare Häuser helfen den Überlebenden des Waldfeuers beim Wiederaufbau,Könnte die Fabrikanlage auch Amerikas Wohnungsengpässe erleichtern?,Hogares modulares están ayudando a los sobrevivientes de incendios forestales de Los Ángeles a reconstruir,¿Podrían las unidades fabricadas aliviar también la escasez de viviendas en Estados Unidos?,Des maisons modulaires aident les survivants des incendies de forêt de LA.,Les unités fabriquées en usine pourraient-elles soulager la pénurie de logements aux États-Unis aussi ?,民居正在帮助洛杉矶的野火幸存者重建,工厂制造的单位也能缓解美国的住房短缺吗?
58,Illinois Democrats tell feds to stop trying to 'usurp' state authority over immigration,"Illinois Democrats tell DOJ and DHS that state sanctuary laws, including TRUST Act and Chicago Welcoming City Ordinance, follow constitutional requirements.","Illinois Democrats sagen den Feds, sie sollen aufhören zu versuchen, die staatliche Autorität über die Einwanderung zu ""unsurpieren""","Illinois Democrats sagen DOJ und DHS, dass staatliche Zufluchtsgesetze, einschließlich TRUST Act und Chicago Welcoming City Verordnung, verfassungsmäßigen Anforderungen folgen.",Los demócratas de Illinois dicen a los federales que dejen de intentar 'usurpar' la autoridad estatal sobre inmigración,"Los demócratas de Illinois le dicen al Departamento de Justicia y DHS que las leyes de santuario del estado, incluyendo la Ley de Confianza y la Ordenanza de Ciudad Acogedora de Chicago, siguen los requisitos constitucionales.","Les démocrates de l'Illinois disent aux fédéraux de cesser d'essayer d'""usurper"" l'autorité de l'État sur l'immigration","Les démocrates de l'Illinois disent au Ministère de la justice et au Ministère de la santé que les lois sur les sanctuaires d'État, y compris la TRUST Act et l'ordonnance de Chicago sur les villes accueillantes, respectent les exigences constitutionnelles.",伊利诺伊州民主党告诉联邦探员 不要再试图“拥有”国家移民权力,"伊利诺伊州民主党告诉司法部和国土安全部,国家庇护法,包括《信任法》和《芝加哥欢迎市法令》,都符合宪法规定。"
59,"Cincinnati assault: Police chiefs rip leaders over bail laws, ‘gaps in the judicial process’",Police chiefs sound off on judicial failures after viral Cincinnati beating footage leads to six arrests and grand jury indictments for assault charges.,"Cincinnati Angriff: Polizeichefs reißen Führer über Kaution Gesetze, ""Gaps im Gerichtsprozess""","Polizeichefs hören sich bei Justizversagen an, nachdem virale Cincinnati, die Aufnahmen verprügeln, zu sechs Verhaftungen und Anklagen wegen Körperverletzung geführt hat.","Agresión a Cincinnati: Los jefes de policía roban a los líderes por las leyes de libertad bajo fianza, ‘discusiones en el proceso judicial’",Los jefes de policía hablan de fallas judiciales después de que las imágenes virales de los golpes de Cincinnati conduzcan a seis arrestos y acusaciones del gran jurado por cargos de agresión.,"Agression de Cincinnati: Les chefs de police déchirent les dirigeants au sujet des lois sur la libération sous caution, «gaps dans le processus judiciaire»",Les chefs de la police font écho à des défaillances judiciaires après que Cincinnati viral a battu des images mène à six arrestations et à des mises en accusation de grands jurys pour des accusations d'agression.,"Cincinnati攻击:警察局长在保释法、“司法程序中的漏洞”上,","警方首长在Cincinnati毒打录像的病毒导致六起逮捕和大陪审团对攻击指控的起诉后,"
60,Israel says Al Jazeera journalist killed in airstrike was head of Hamas 'terrorist cell',"Israeli forces kill Al Jazeera journalist Anas Al-Sharif in Gaza City airstrike, claiming he led a Hamas terrorist cell while posing as a reporter.","Israel sagt, Al-Jazeera-Journalist, der bei Luftangriffen getötet wurde, sei Leiter der ""Terror-Zelle"" der Hamas.","Israelische Truppen töten den Al-Jazeera-Journalisten Anas Al-Sharif im Luftangriff in Gaza-Stadt und behaupten, er habe eine Hamas-Terrorzelle geführt, während er sich als Reporter ausgibt.","Israel dice que el periodista de Al Jazeera asesinado en ataque aéreo era jefe de la ""célula terrorista"" de Hamás","Las fuerzas israelíes matan al periodista Al Jazeera Anas Al-Sharif en el ataque aéreo de la ciudad de Gaza, afirmando que dirigió una célula terrorista de Hamas mientras se hacía pasar por periodista.","Israël dit que le journaliste d'Al Jazeera tué à la frappe aérienne était le chef de la ""cellule terroriste"" du Hamas","Les forces israéliennes tuent Anas Al-Sharif, journaliste d'Al Jazeera, à Gaza, en prétendant qu'il a mené une cellule terroriste du Hamas tout en se présentant comme journaliste.",以色列说在空袭中丧生的半岛电视台记者是哈马斯“恐怖小组”的头头。,"以色列军队在加沙市空袭中杀害半岛电视台记者Anas Al-Sharif,声称他在装扮记者时领导了一个哈马斯恐怖小组。"
61,Ancient rare Chinese manuscripts stolen in alleged scheme by man using multiple aliases,The FBI is investigating the theft of valuable Chinese manuscripts from the UCLA library system after a man allegedly replaced originals with fake copies using multiple aliases.,Alte seltene chinesische Manuskripte gestohlen in angeblichen Schema von Mann mit mehreren Aliasen,"Das FBI untersucht den Diebstahl wertvoller chinesischer Manuskripte aus dem UCLA-Bibliothekssystem, nachdem ein Mann angeblich Originale durch gefälschte Kopien mit mehreren Aliasen ersetzt hat.",Antiguos manuscritos chinos raros robados en supuesto esquema por el hombre usando alias múltiples,El FBI está investigando el robo de valiosos manuscritos chinos del sistema bibliotecario de la UCLA después de que un hombre supuestamente reemplazara originales con copias falsas usando varios alias.,Anciens manuscrits chinois rares volés dans le schéma présumé par l'homme utilisant de multiples alias,Le FBI enquête sur le vol de précieux manuscrits chinois du système de bibliothèque de l'UCLA après qu'un homme aurait remplacé des originaux par de fausses copies en utilisant de multiples alias.,古老的稀有中国手稿 被人类用多种化名,"联邦调查局正在调查盗窃加州大学洛杉矶分校图书馆系统有价值的中国手稿案,因为据称一名男子用多个化名用假冒拷贝取代原版。"
62,"Trump takes control of Metro Police, deploys National Guard to take on Washington crime","President Donald Trump recently promised Washington would be &quot;LIBERATED&quot; from &quot;Crime, Savagery, Filth, and Scum.&quot;","Trump übernimmt die Kontrolle über die Metro-Polizei, entsendet Nationalgarde, um Washington Verbrechen zu übernehmen","Präsident Donald Trump versprach vor kurzem, Washington werde &quot;LIBERATED&quot; aus &quot;Crime, Savagery, Filth, und Scum.&quot;","Trump toma el control de la Policía Metropolitana, despliega la Guardia Nacional para enfrentar el crimen de Washington","El presidente Donald Trump prometió recientemente que Washington sería &quot;LIBERATED&quot; de &quot;Crime, Savagery, Filth, y Scum.&quot;","Trump prend le contrôle de la police métropolitaine, déploie la Garde nationale pour s'attaquer au crime de Washington","Le président Donald Trump a récemment promis que Washington serait &quot;LIBERATED&quot; de &quot;Crime, Savagery, Filth et Scum.&quot;",特朗普控制大都会警察 部署国民警卫队来对付华盛顿犯罪,总统唐纳德·特朗普最近答应华盛顿将来自 & quot; 犯罪、 野蛮、  Filth 和 Scum. & quot; 的 & quot; 来自 & quot; 犯罪、 野蛮、 Filth 和 Scum. & qu;
63,"FOX ONE, ESPN DTC announce bundle offer for ‘ultimate sports fan’",Fox Corporation announces FOX ONE streaming service will bundle with ESPN&apos;s direct-to-consumer platform for $39.99 monthly starting October 2.,"FOX ONE, ESPN DTC kündigt Bündelangebot für „ultimative Sportfans"" an","Fox Corporation gibt bekannt, dass FOX ONE Streaming-Service mit ESPN&apos;s Direct-to-Consumer-Plattform für $39.99 monatlich ab 2. Oktober bündeln wird.","FOX ONE, ESPN DTC anuncia oferta de paquete para ‘último ventilador deportivo’",Fox Corporation anuncia que el servicio de streaming FOX ONE se combinará con ESPN&apos;s plataforma directa al consumidor por $39.99 mensuales a partir del 2 de octubre.,"FOX ONE, ESPN DTC annonce l'offre groupée pour «ventilateur sportif ultime»","Fox Corporation annonce que le service de diffusion en direct FOX ONE sera livré avec la plateforme ESPN&apos; directement au consommateur pour 39,99 $ par mois à compter du 2 octobre.",ESPN DTC宣布向“最后运动球迷”提供包包报价。,Fox Corporation 宣布FOX one 流水服务将和ESPN&apos捆绑在一起;从10月2日起每月39.99美元的直达消费者平台。
64,Epstein grand jury materials won't be released after federal judge denies DOJ request to unseal,Judge rejects government motion to make public grand jury evidence from sex trafficking cases involving Jeffrey Epstein and convicted accomplice Ghislaine Maxwell,"Epstein Grand Jury Materialien werden nicht freigegeben werden, nachdem Bundesrichter leugnet DOJ Antrag auf unseal",Richter lehnt Antrag der Regierung auf öffentliche Grand Jury Beweise aus Sex-Handel Fälle mit Jeffrey Epstein und verurteilt Komplize Ghislaine Maxwell,Los materiales del gran jurado de Epstein no serán puestos en libertad después de que el juez federal deniegue la solicitud del Departamento de Justicia de desenterrar,Juez rechaza moción del gobierno para hacer público gran jurado evidencia de casos de tráfico sexual que involucran Jeffrey Epstein y cómplice convicto Ghislaine Maxwell,Les documents du Grand jury d'Epstein ne seront pas libérés après que le juge fédéral ait rejeté la demande de non-scellement du ministère de la Justice.,Le juge rejette la requête du gouvernement visant à faire des preuves publiques du grand jury dans des affaires de trafic sexuel impliquant Jeffrey Epstein et la complice condamnée Ghislaine Maxwell,Epstein大陪审团材料在联邦法官驳回司法部要求解禁后 将不会发布,法官拒绝政府关于公布涉及Jeffrey Epstein和定罪共犯Ghislaine Maxwell的性贩运案件大陪审团证据的动议
65,Browns coach adds to quarterback intrigue following Shedeur Sanders' great preseason debut,The Cleveland Browns&apos; quarterback situation remained a mystery on Monday following Shedeur Sanders&apos; terrific preseason debut against the Carolina Panthers.,Browns Trainer fügt Quarterback-Intrigen nach Shedeur Sanders' große Vorsaison-Debüt,Die Cleveland Browns&apos; Quarterback Situation blieb ein Geheimnis am Montag nach Shedeur Sanders&apos; tolle Vorsaison-Debüt gegen die Carolina Panthers.,El entrenador Browns añade intriga al quarterback después del gran debut de Shedeur Sanders en la pretemporada,Los Cleveland Browns&apos; situación de quarterback siguió siendo un misterio el lunes después de Shedeur Sanders&apos; excelente debut pretemporada contra los Carolina Panthers.,L'entraîneur Browns ajoute à l'intrigue quart-arrière après les débuts de Shedeur Sanders en pré-saison,La situation du quarterback de Cleveland Browns&apos est restée mystérieuse lundi après Shedeur Sanders&apos; de formidables débuts en présaison contre les Carolina Panthers.,布朗斯教练在谢德·桑德斯的 盛季前首赛后 增加了四分卫的阴谋,"克里夫兰布朗斯和阿波斯; 四分卫的情况在星期一仍是一个谜,"
66,"75-foot boat surfs wave, runs aground in Hawaii","A boat ran aground in Hawaii after appearing to surf on top of a wave, two crewmembers escaping uninjured, according to the U.S. Coast Guard.","75 Fuß Boot surft Welle, läuft auf Grund in Hawaii","Ein Boot lief in Hawaii auf Grund, nachdem es auf einer Welle surfte, und zwei Besatzungsmitglieder flohen unverletzt, so die US-Küstenwache.","Ola de olas de 75 pies, encalló en Hawái","Un barco encalló en Hawái después de aparecer a surfear sobre una ola, dos tripulantes escapando sin sufrir heridas, según la Guardia Costera de Estados Unidos.","Surf de bateau de 75 pieds onde, s'échoue à Hawaii","Un bateau s'est échoué à Hawaii après avoir semblé surfer au-dessus d'une vague, deux membres d'équipage s'échappant sans être blessés, selon la Garde côtière américaine.","75英尺的船冲浪浪浪浪浪,在夏威夷搁浅","美国海岸警卫队表示, 一艘船似乎在海浪上冲浪后在夏威夷搁浅,"
