,title-es,content-es,title-de,content-de,title-en,content-en
31,Cristiano Ronaldo y Georgina Rodríguez anuncian su compromiso después de nueve años juntos: “Sí quiero. En esta y en todas mis vidas”,La ‘influencer’ ha hecho pública la futura boda con el futbolista a través de una publicación de Instagram en la que muestra el enorme diamante de su anillo de pedida. Todavía se desconocen la fecha y lugar del enlace,"Cristiano Ronaldo und Georgina Rodríguez verkünden ihre Verlobung nach neun Jahren gemeinsam: ""Ja, ich will."" In diesem und in meinem ganzen Leben.",Die Instagram-Veröffentlichung zeigt den riesigen Diamanten Ihres Ringes an. Das Datum und Ort des Links sind noch nicht bekannt.,Cristiano Ronaldo and Georgina Rodríguez announce their commitment after nine years together: “I do. In this and in all my lives”,The ‘influencer’ has made public the future wedding with the footballer through an Instagram post showing the huge diamond of his requested ring. The date and place of the link is still unknown.
32,Peridis: Jumilla da votos,Viñeta del 12 de agosto de 2025,Peridis: Jumilla gibt Stimmen,Vignette vom 12. August 2025,Peridis: Jumilla gives votes,"Vineyard of August 12, 2025"
33,Flavita Banana: propósito de septiembre 12,Viñeta del 12 de agosto de 2025,Flavita Banana: Ziel von September 12,Vignette vom 12. August 2025,Flavita Banana: Purpose of September 12,"Vineyard of August 12, 2025"
34,Riki Blanco: las Perseidas,Viñeta del 12 de agosto de 2025,Weißer Riki: die Perseiden,Vignette vom 12. August 2025,White Riki: the Perseids,"Vineyard of August 12, 2025"
35,Un tinte para crear cristales que imitan al iris facilita la conversión de rascacielos e invernaderos en centrales energéticas,La Royal Society of Chemistry premia el desarrollo fotocromático de un equipo internacional en el que participa España,"Ein Farbton, um Kristalle zu erzeugen, die die Iris nachahmen, erleichtert die Umwandlung von Wolkenkratzern und Gewächshäusern in Kraftwerke","Die Royal Society of Chemistry belohnt die fotografische Entwicklung eines internationalen Teams, an dem Spanien teilnimmt",A dye to create crystals that mimic the iris facilitates the conversion of skyscrapers and greenhouses into power plants,The Royal Society of Chemistry awards the photochromatic development of an international team in which Spain participates
36,"‘El Patilla’, el cazador extremeño que mató a 32 perros de hambre y sed durante dos meses",La Fiscalía de Medio Ambiente de Badajoz y el juzgado de Llerena le investigan por abandono animal y los animalistas piden que sea por maltrato,"Der Hackbock, der extreme Jäger, der 32 Hunde zwei Monate lang verhungert und durstig getötet hat.","Die Umweltstaatsanwaltschaft von Badajoz und das Gericht von Llerena untersuchen ihn wegen Vernachlässigung der Tiere und die Tierhalter fordern, dass es wegen Misshandlung ist.","‘El Patilla’, the Extremaduran hunter who killed 32 dogs of hunger and thirst for two months",The Environment Prosecutor's Office of Badajoz and the Llerena court investigate him for animal abandonment and animalists ask him to be for ill-treatment
37,Mano dura o brazos abiertos: la inmigración aflora las distintas almas del catolicismo español,"Fuerzas radicales urgen a defender la esencia cristiana de España frente al Islam, los obispos reivindican el mensaje de acogida del Catecismo y las comunidades de base advierten contra “el populismo que señala al débil”",Harte Hand oder offene Arme: Einwanderung blüht auf den verschiedenen Seelen des spanischen Katholizismus,"Radikale Kräfte drängen, die christliche Essenz Spaniens gegenüber dem Islam zu verteidigen, die Bischöfe fordern die Aufnahmebotschaft des Katechismus und die Basisgemeinden warnen vor dem Populismus, der auf den schwachen Populismus hinweist.",Hard hand or open arms: immigration brings out the different souls of Spanish Catholicism,"Radical forces urge to defend the Christian essence of Spain against Islam, bishops demand the message of acceptance of the Catechism and grassroots communities warn against “populism that points to the weak”"
38,Policía local bajo mínimos en Malgrat de Mar: “Solo hay dos agentes trabajando de los 53 que hay en plantilla”,El Sindicato Independiente de la Policía Local (SIP-FEPOL) del municipio de denuncia que la falta de un convenio favorable provoca problemas de salud a los trabajadores,"Ortspolizei in Malgrat de Mar: Es gibt nur zwei Agenten, die von den 53 in Personal arbeiten.","Die Unabhängige Gewerkschaft der örtlichen Polizei (SIP-FEPOL) der Gemeinde beklagt, dass das Fehlen einer günstigen Vereinbarung zu Gesundheitsproblemen für die Arbeitnehmer führt",Local police low minimums in Malgrat de Mar: “There are only two officers working out of the 53 in staff”,The Independent Union of the Local Police (SIP-FEPOL) of the municipality of complaint that the lack of a favorable agreement causes health problems for workers
39,"“Uf, géminis”: el horóscopo y la astrología como cultura pop, desde Mesopotamia hasta el ‘feed’ de TikTok","“La astrología ofrece una forma de mirar el desorden de la vida y encontrarle cierto sentido. No certeza, pero sí resonancia”, explica un antropólogo",TikTok's Horoskop und Astrologie als Popkultur von Mesopotamien bis hin zum TikTok's Feed,"Die Astrologie bietet eine Möglichkeit, die Unordnung des Lebens zu betrachten und einen Sinn für ihn zu finden. Keine Gewissheit, aber ein Anthropologe erklärt:","“Uf, Gemini”: horoscope and astrology as pop culture, from Mesopotamia to TikTok’s ‘feed’","“Astrology offers a way to look at the disorder of life and find some meaning for it. Not certainty, but resonance,” explains an anthropologist."
40,"Colombia, ante la tragedia de Uribe Turbay",La muerte en atentado del senador opositor debe suponer un punto de inflexión para erradicar la violencia de la política,"Kolumbien, angesichts der Tragödie von Uribe Turboy","Der Anschlag des Oppositionssenators muss einen Wendepunkt darstellen, um die Gewalt der Politik auszumerzen.","Colombia, in the face of the tragedy of Uribe Turbay",The death in attack of the opposition senator must be a turning point in order to eradicate violence from politics
41,Los grises,"La ficción es tan enorme y tan fundamental para entender al ser humano que a la persona que escribe, se expone y se radiografía en público",Die Grauen,"Fiktion ist so riesig und so wesentlich, um den Menschen zu verstehen, dass die Person, die schreibt, ausgesetzt und in der Öffentlichkeit röntgen",The Grey Ones,"Fiction is so huge and so fundamental to understanding the human being that the person who writes, exposes and x-rays himself in public"
42,A Rolex y a setas,Los relojes suizos de lujo se ven golpeados por un arancel del 39% que ha disparado el mercado de segunda mano,An Rolex und Pilze,"Luxuriöse Schweizer Uhren werden von einem 39% Tarif getroffen, der den Gebrauchtmarkt erschossen hat.",A Rolex and mushrooms,Luxury Swiss watches are hit by a 39% tariff that has triggered the second-hand market
43,"Los inmigrantes no amenazan Europa, señor Trump",Los nacidos fuera de la UE representan un porcentaje muy alto de su población y de su mano de obra en una sociedad cada vez más necesitada de rejuvenecimiento,"Die Einwanderer bedrohen Europa nicht, Mr. Trump","Geburten außerhalb der EU machen einen sehr hohen Anteil ihrer Bevölkerung und ihrer Arbeitskräfte in einer Gesellschaft aus, die zunehmend verjüngt werden muss","Immigrants do not threaten Europe, Mr Trump",Those born outside the EU account for a very high percentage of their population and workforce in an increasingly rejuvenated society
44,Opiniones migrantes,"La xenofobia no se activa en una sociedad espontáneamente, sino por la palabra y obra de sus políticos",Migration,"Fremdenfeindlichkeit ist nicht spontan in einer Gesellschaft aktiv, sondern durch das Wort und das Werk ihrer Politiker.",Migrant opinions,"Xenophobia is not activated in a society spontaneously, but by the word and work of its politicians."
45,"Cataluña, ¿y ahora qué?","El desgaste se precipitará si no se dota de un proyecto en el que se sienta identificada e interpelada una parte importante de la ciudadanía, sin demasiados rebrotes excluyentes","Katalonien, was jetzt?","Der Verschleiß wird überstürzt sein, wenn kein Projekt zur Verfügung gestellt wird, in dem sich ein wichtiger Teil der Bürgerschaft identifiziert und interpeliert, ohne dass zu viele Ausflüchte ausgeschlossen werden.","Catalonia, what now?","The wear will be precipitated if you do not have a project in which you feel identified and challenged an important part of the citizenship, without too many exclusive regrowths"
46,Madrid se prepara para 57 meses de obras con las que cambiar 210 kilómetros de tuberías de agua “fuera de norma” en la capital,El Canal de Isabel II presupuesta 130 millones para renovar su red y prepararla para los efectos del cambio climático y el aumento de la población,"Madrid bereitet sich auf 57 Monate von Baustellen vor, mit denen 210 Kilometer von Wasserleitungen außerhalb der Norm Hlaing in der Hauptstadt zu wechseln",Der Isabel-Kanal II budgetiert 130 Millionen für die Erneuerung seines Netzes und die Vorbereitung auf die Auswirkungen des Klimawandels und der Bevölkerungszunahme,Madrid prepares for 57 months of works with which to change 210 kilometers of water pipes “out of the norm” in the capital,The Isabel II Channel budgets 130 million to renew its network and prepare it for the effects of climate change and population growth
47,Una riña familiar termina con dos atrincherados y tres heridos en el barrio Puerta del Ángel,"La Policía Nacional ha detenido a siete personas de la misma familia que se encontraban en la vivienda, cinco de ellas como rehenes",Ein Familienstreit endet mit zwei verschanzten und drei Verwundeten im Viertel Puerta del Angel,"Die Nationalpolizei hat sieben Personen aus derselben Familie verhaftet, die sich in der Wohnung befanden, fünf davon als Geiseln.",A family quarrel ends with two barricades and three wounded in the Puerta del Ángel neighborhood,"The National Police has arrested seven persons from the same family who were in the house, five of them as hostages."
48,"La vivienda en el sur de Madrid, a debate: negociar o imponer precios",Dos expertos analizan las ocho propuestas que Más Madrid ha entregado a la Consejería de Vivienda,Das Wohnen im Süden von Madrid zur Diskussion: Handel oder Besteuerung von Preisen,"Zwei Experten analysieren die acht Vorschläge, die Mehr Madrid dem Wohnungsrat vorgelegt hat.","The housing in the south of Madrid, to debate: to negotiate or impose prices",Two experts analyze the eight proposals that More Madrid has delivered to the Housing Department
49,Calella se resiste a empadronar a 200 obreros de la reforma del Camp Nou,"Limak, la empresa contratada por el Barça para las obras, pide inscribir en este municipio turístico de Barcelona a unos 200 trabajadores extracomunitarios para que accedan al sistema de salud",Calella wehrt sich gegen 200 Arbeiter der Camp Nou-Reform,"Limak, das Unternehmen, das von der Barça für die Arbeiten eingestellt wurde, fordert, in dieser touristischen Gemeinde von Barcelona etwa 200 Arbeitnehmer aus Drittländern aufzunehmen, um Zugang zum Gesundheitssystem zu erhalten",Calella refuses to register 200 workers of the Camp Nou reform,"Limak, the company contracted by the Barça for the works, asks to register in this tourist municipality of Barcelona about 200 workers from outside the Community to access the health system"
50,"Trabajadores municipales de limpieza, abrasados por el calor: “El protocolo marca que tenemos derecho a buscar cobijo”",Semanas después de la muerte de una empleada de 51 años en Barcelona el Ayuntamiento pone especial énfasis en las medidas de protección,"Saubere Stadtarbeiter, von der Hitze angezündet: Das Protokoll markiert, dass wir berechtigt sind, Decke zu suchen",Wochen nach dem Tod einer 51-Jährigen in Barcelona legt die Stadtverwaltung besonderes Augenmerk auf Schutzmaßnahmen,"Municipal cleaning workers, scorched by heat: “The protocol marks that we have the right to seek shelter”","Weeks after the death of a 51-year-old employee in Barcelona, the City Council places special emphasis on protective measures"
51,El mercado contempla una mejora de la opa: el Sabadell sube con fuerza y el BBVA cotiza a la baja,La diferencia entre la oferta y la cotización se ensancha al 10% mientras los analistas consideran necesario un aumento de la retribución para que la operación tenga posibildades,Der Markt sieht eine Verbesserung der Opa: der Sabadell steigt stark und die BBVA wird nach unten notiert,"Die Differenz zwischen Angebot und Beitrag wird auf 10% ausgedehnt, während die Analysten eine Erhöhung des Arbeitsentgelts für erforderlich halten, damit das Geschäft positive Ergebnisse erzielen kann.",The market contemplates an improvement of the opa: the Sabadell rises strongly and BBVA is listed in the downside,The difference between the offer and the quote widens to 10% while the analysts consider it necessary to increase the remuneration in order for the operation to have possibilities
52,De Salvaje Oeste a un gigante de cuatro billones: el mercado cripto vale más que Microsoft,"La postura favorable de la administración de EE UU y la entrada de nuevos perfiles de inversor, claves de la gran aceleración. El bitcoin, que supone un 60% del ecosistema, roza máximos históricos",Vom Wilden Westen zu einem vier Billionen Riesen: Der kryptische Markt ist mehr wert als Microsoft,"Die positive Haltung der US-Regierung und der Eintritt neuer Investorenprofile als Schlüssel für die große Beschleunigung. Bitcoin, das 60% des Ökosystems ausmacht, ist historische Spitzenreiter",From Wild West to a giant of four billion: the crypto market is worth more than Microsoft,"The favorable stance of the US administration and the entry of new investor profiles, keys to the great acceleration. Bitcoin, which accounts for 60% of the ecosystem, touches historical highs"
53,"El Tesoro paga un 1,94% por las letras a tres meses, el primer ascenso desde octubre","El organismo cierra agosto con la venta de 2.524,8 millones en deuda a corto plazo a tipos más altos","Der Schatz zahlt 1,94% für die dreimonatigen Briefe, der erste Aufstieg seit Oktober","Die Körperschaft schließt August mit dem Verkauf von 2.524,8 Millionen in den kurzfristigen Schulden zu den höheren Zinssätzen","The Treasury pays 1.94% for letters to three months, the first promotion since October","The agency closes August with the sale of 2,524,8 million in short-term debt at higher rates"
54,Trump nombra a un halcón responsable de la agencia de estadísticas que compila los datos de inflación y empleo,"El designado es el economista jefe de la Heritage Foundation, el disco duro del trumpismo","Trump ernennt einen Falken, der für die Statistikagentur zuständig ist, die Inflations- und Beschäftigungsdaten kompiliert","Er ist der Chefökonom der Heritage Foundation, die Festplatte des Trumpismus.",Trump appoints a hawk responsible for the statistical agency that compiles inflation and employment data,"The designated one is the chief economist of the Heritage Foundation, the hard drive of Trumpism."
55,Doce recién nacidos mueren en un hospital público de Ecuador: “Se lo llevaron como si fuera basura”,Los médicos denuncian que el sistema de salud atraviesa una de sus peores crisis por el recorte de presupuesto y la falta de insumos,Zwölf Neugeborene sterben in einem öffentlichen Krankenhaus in Ecuador: Sie nahmen es als Abfall ab.,"Ärzte prangern an, dass das Gesundheitssystem eine ihrer schlimmsten Krisen durch die Kürzung des Budgets und den Mangel an Inputs durchlebt",Twelve newborns die in a public hospital in Ecuador: “They took him away like garbage”,Doctors report that the health system is going through one of its worst crises due to budget cuts and lack of inputs
56,"Trump Burger, el restaurante trumpista cuyo dueño está a punto de ser deportado",El propietario libanés de la cadena texana de comida rápida dedicada al presidente enfrenta un proceso de expulsión por permanecer en Estados Unidos de manera ilegal,"Trump Burger, das trumpistische Restaurant, dessen Besitzer bald deportiert wird","Der libanesische Besitzer der texanischen Fastfood-Kette, die dem Präsidenten gewidmet ist, steht vor einem Prozess der Ausweisung, weil er illegal in den Vereinigten Staaten bleibt.","Trump Burger, the Trump restaurant whose owner is about to be deported",Lebanese owner of the president’s Texan fast food chain faces expulsion for staying in the U.S. illegally
57,El genocidio olvidado de Namibia: cómo los alemanes cazaron y asesinaron a los bosquimanos,"El genocidio de los pueblos herero y nama de Namibia a manos de las fuerzas coloniales alemanas (1904-1907) está ampliamente documentado. Pero se habla mucho menos de lo que vino después: el genocidio de los bosquimanos del país, también conocidos como los san",Der vergessene Völkermord in Namibia: Wie die Deutschen die Buschmänner jagten und ermordeten,Der Völkermord an den heldenhaften Völkern Namibias an den deutschen Kolonialmächten (1904-1907) ist weitgehend dokumentiert.,The Forgotten Genocide of Namibia: How the Germans Hunted and Killed the Bushmen · Global Voices,"The genocide of the Herero and Nama peoples of Namibia at the hands of the German colonial forces (1904-1907) is widely documented, but there is much less talk of what came next: the genocide of the country's Bushmen, also known as the Saints."
58,"Dmitri Medvédev, de presidente ‘modernizador’ de Rusia a profeta fustigador de Occidente","El antiguo mandatario, fiel seguidor de Putin, utiliza las redes para atacar con sus diatribas a Europa y Ucrania. Una crítica a Trump ha llevado a EE UU a enviar submarinos nucleares a las proximidades del país","Dmitri Medwedew, russischer Präsident der Moderatorin für den Kämpfer des Westens","Putins ehemaliger Stellvertreter, treuer Anhänger, nutzt die Netze, um Europa und die Ukraine anzugreifen. Eine Kritik an Trump hat die USA dazu gebracht, Atom-U-Boote in die Nähe des Landes zu schicken.","Dmitri Medvedev, from Russia’s ‘modernising’ president to Western whipping prophet","The former president, Putin’s faithful follower, uses the networks to attack Europe and Ukraine with his diatribes. A criticism of Trump has led the US to send nuclear submarines near the country."
59,"El arte que aparece de la nada, mejor no comprarlo","Museos y coleccionistas protegen la veracidad de sus fondos frente a los intentos de falsificación, mezclando la mirada de los especialistas y la tecnología de vanguardia","Die Kunst, die aus dem Nichts erscheint, besser nicht kaufen","Museen und Sammler schützen die Wahrhaftigkeit ihres Geldes vor Fälschungen, indem sie den Blick von Spezialisten und modernster Technologie vermischen","Art that appears out of nowhere, better not buy it","Museums and collectors protect the veracity of their funds against attempts to counterfeit, mixing the look of specialists and cutting edge technology"
60,La Filarmónica de Viena mantiene el pulso del Festival de Salzburgo,"La formación austriaca multiplica sus apariciones tanto en conciertos como en óperas, incluido un espectáculo vago e indefinido ideado por Peter Sellars",Die Wiener Philharmonie hält den Puls des Salzburger Festivals,"Die österreichische Ausbildung vervielfacht ihre Erscheinungen sowohl in Konzerten als auch in Opern, einschließlich einer vagen und unabsehbaren Show von Peter Sellars",The Vienna Philharmonic maintains the pulse of the Salzburg Festival,"Austrian formation multiplies its appearances in both concerts and operas, including a vague and indefinite show devised by Peter Sellars"
61,"Kangding Ray, el arquitecto sonoro de las raves de la película ‘Sirât’: “Queríamos que pudiera verse el sonido y oírse la imagen”",El compositor de la música de uno de los filmes españoles más vistos del año desgrana su proceso de creación mano a mano con el director Oliver Laxe,"Kangding Ray, der Klangarchitekt des Films ""Sirât"": Wir wollten den Klang sehen und das Bild hören.",Der Komponist der Musik eines der am meisten angesehenen spanischen Filme des Jahres löst seinen Prozess der Hand-zu-Hand-Schöpfung mit Direktor Oliver Laxe,"Kangding Ray, the sound architect of the raves of the film ‘Sirât’: “We wanted the sound to be seen and the image heard”",The composer of the music of one of the most watched Spanish films of the year derails his process of hand-in-hand creation with director Oliver Laxe
62,¡Qué buena (y disparatada) la hostilidad entre Morante y Roca Rey!,La existencia de dos líderes es la prueba fehaciente de que la fiesta de los toros está viva,Wie gut (und verrückt) die Feindseligkeit zwischen Morante und Felsen König!,"Die Existenz zweier Führer ist der stichhaltige Beweis dafür, dass das Fest der Stiere am Leben ist.",How good (and foolish) the hostility between Morante and Roca Rey!,The existence of two leaders is the evident proof that the festival of the bulls is alive
63,"Vuelve Ramón J. Sender, el bicho raro de la literatura española",La reedición de obras como ‘Réquiem por un campesino español’ y la recuperación de su novela bélica sobre la Guerra Civil devuelven al primer plano a uno de los grandes cronistas del siglo XX,"Ramón J. Sender, der seltene Käfer der spanischen Literatur, kommt zurück.","Die Wiederausgabe von Werken wie ""Réquiem"" durch einen spanischen Bauer ""Réquiem"" und die Wiederherstellung seines Kriegsromans über den Bürgerkrieg rücken einen der großen Chronisten des 20. Jahrhunderts in den Vordergrund.","Ramón J. Sender, the rarer in Spanish literature, returns",The reissue of works such as ‘Réquiem por un campesino español’ and the recovery of his war novel on the Civil War bring one of the great chroniclers of the 20th century back to the fore
64,"Sonia Bermúdez: seria, disciplinada, de pocas palabras y, sobre todo, de la casa","La nueva seleccionadora tendrá como segunda a Iraia Iturregi, en una decisión continuista de la federación","Sonia Bermudez: seriös, diszipliniert, mit wenigen Worten und vor allem aus dem Hause","Die neue Auswahlfrau wird als zweite zu Iraia Iturregi haben, in einer ununterbrochenen Entscheidung von dem Verband","Sonia Bermúdez: serious, disciplined, of few words and, above all, of the house","The new selector will have as second Iraia Iturregi, in a continuous decision of the federation"
65,Sustituir a Montse Tomé por Sonia Bermúdez: experimentos con las campeonas del mundo,"Puede que las futbolistas se entiendan mejor con el nuevo cuerpo técnico de la selección hoy que ayer, pero es Reyes Bellver la artífice de un cambio que solo el tiempo dirá si valió la pena",Montse Tome durch Sonia Bermúdez ersetzen: Experimente mit Weltmeisterinnen,"Fußballer verstehen sich vielleicht besser mit dem neuen technischen Team der Auswahl heute als gestern, aber es ist Reyes Bellver, die Schöpferin einer Veränderung, die nur die Zeit zeigen wird, ob sie es wert war.",Replace Montse Tomé with Sonia Bermúdez: experiments with the champions of the world,"Footballers may understand each other better with the new technical team of the team today than they did yesterday, but Reyes Bellver is the architect of a change that only time will tell if it was worth it."
66,Las medias verdades sacuden la ética del alpinismo,"Varios alpinistas de élite, protagonistas de las mejores ascensiones de las dos últimas décadas, han sido ‘pillados’ faltando gravemente a la transparencia y honestidad que exige la actividad",Halbwahrheiten erschüttern die Ethik des Bergsteigens,"Mehrere Elite Bergsteiger, Protagonisten der besten Aufstiege der letzten zwei Jahrzehnte, wurden an der Transparenz und Ehrlichkeit, die die Tätigkeit erfordert, schwer verletzt.",Half truths shake the ethics of mountaineering,"Several elite climbers, protagonists of the best climbs of the last two decades, have been ‘pilled’ seriously lacking the transparency and honesty demanded by the activity"
67,"Alejandra Merit, al frente de Veneno, el fenómeno viral de Valencia: “Entiendo al hostelero que se pregunta quién es la niñata que acaba de llegar”","Revoluciona el sector compartiendo en Instagram y sin filtros el proceso de apertura de su nuevo local: desde la financiación a cómo sobrevivir a reseñas, ‘haters’ y sospechas del sector","Alejandra Merit, an der Spitze von Gift, das Virusphänomen von Valencia: Ich verstehe den Gastwirt, der sich fragt, wer das Mädchen ist, das gerade angekommen ist.","Die Branche revolutioniert, indem sie in Instagram und ohne Filter den Prozess der Eröffnung ihres neuen Standorts teilt: von der Finanzierung bis hin zum Überleben von Rezensionen, Hlainghaters und Branchenverdächtigen","Alejandra Merit, head of Veneno, the viral phenomenon of Valencia: “I understand the hotelier who wonders who the little girl has just arrived”","It revolutionises the sector by sharing on Instagram and without filters the process of opening its new premises: from funding to how to survive reviews, haters and industry suspicions"
