,title-es,content-es,title-de,content-de,title-en,content-en
36,Los dueños de los patinetes deberán contratar un seguro a partir del próximo enero,"La reforma de la Ley de Seguros de Automóviles, ya aprobada por el Congreso, obliga a disponer de una póliza de responsabilidad civil en caso de accidente",Skateboardbesitzer müssen ab Januar eine Versicherung abschließen,"Die vom Kongress bereits verabschiedete Reform des Kfz-Versicherungsgesetzes verpflichtet dazu, im Falle eines Unfalls eine Haftpflichtversicherung abzuschließen.",The owners of the skateboards will have to hire insurance from next January,"The reform of the Automobile Insurance Act, already approved by Congress, requires a civil liability policy in the event of an accident"
37,A mi primo Javier,"Con Lambán hay un antes y un después en Aragón y, para mí, era el referente que me demostró que siempre se puede actuar con honestidad, con rectitud y sin renunciar a tus principios",Meinen Cousin Javier.,"Mit Lamban gibt es einen Vor-und einen Nachgang in Aragon, und für mich war es der Bezugspunkt, der mir zeigte, dass man immer ehrlich, ehrlich und ohne auf deine Prinzipien zu verzichten",To my cousin Javier,"With Lambán there is a before and after in Aragon and, for me, it was the reference that showed me that you can always act honestly, with righteousness and without giving up your principles"
38,Los centros de datos secan el puerto de Marsella: “Consumen enormes cantidades de electricidad”,La proliferación de estas infraestructuras en la segunda ciudad de Francia amenaza el suministro energético de proyectos dirigidos a mejorar la vida de los vecinos,Die Rechenzentren trocknen den Hafen von Marseille aus:,Die Verbreitung dieser Infrastrukturen in der zweiten französischen Stadt bedroht die Energieversorgung von Projekten zur Verbesserung des Lebens der Nachbarn,The data centres dry up the port of Marseille: “They consume huge amounts of electricity”,The proliferation of these infrastructures in the second city of France threatens the energy supply of projects aimed at improving the lives of neighbours
39,El cesto y la furia: cada verano tiene su amor,De la pasión juvenil a la paternidad: el periodista y escritor Sergio C. Fanjul sabe que solo hay un estío con cada una de las sucesivas niñas que van apareciendo en su hija,Der Korb und die Wut: jeder Sommer hat seine Liebe,"Von der Jugendleidenschaft zur Vaterschaft: Der Journalist und Schriftsteller Sergio C. Fanjul weiß, dass es nur einen Stil mit jedem der aufeinanderfolgenden Mädchen gibt, die in seiner Tochter auftauchen.",The basket and the fury: every summer he has his love,From the youthful passion to the fatherhood: the journalist and writer Sergio C. Fanjul knows that there is only one estio with each of the successive girls who are appearing in his daughter
40,"María Paz García Vera, psicóloga clínica: “‘Tú puedes’ se ha convertido en ‘puedes ser perfecto’”","La especialista en estrés postraumático y depresión, y con una amplia trayectoria en la atención a víctimas del terrorismo, habla sobre las diferencias psicológicas entre hombres y mujeres","María Paz García Vera, klinische Psychologin: Du kannst sexy geworden sein, du kannst perfekt sein","Der Experte für posttraumatischen Stress und Depressionen und mit einem breiten Weg in der Betreuung von Opfern des Terrorismus, spricht über psychologische Unterschiede zwischen Männern und Frauen","María Paz García Vera, clinical psychologist: “‘You can’ has become ‘you can be perfect’”","The specialist in post-traumatic stress and depression, and with a broad track record in the care of victims of terrorism, talks about the psychological differences between men and women"
41,Preocupación en el Departamento catalán de Salud por el cierre de refugios climáticos en plena ola de calor,Los recintos abren durante todo el año pero cierran sus puertas en la temporada más crítica,Besorgnis im katalanischen Gesundheitsministerium über die Schließung von Klimaunterkünften mitten in der Hitzewelle,"Die Räume öffnen das ganze Jahr über, schließen aber ihre Türen in der kritischsten Jahreszeit",Concern in the Catalan Department of Health over the closure of climate shelters in the heat wave,The precincts open all year round but close their doors in the most critical season
42,Clau-Clau-Claudio y yo’,"La obra de teatro, representada hace 44 años por una cuarentena de niños de 11 años, dejó poso en muchos de ellos",Clau-Clau-Claudio und ich Hähnchen,"Das Theaterstück, das vor 44 Jahren durch eine 11-jährige Quarantäne dargestellt wurde, ließ bei vielen von ihnen posieren.",Clau-Clau-Claudio and I’,"The play, represented 44 years ago by a quarantine of 11-year-olds, left many of them posing"
43,Junqueras cuestiona la idoneidad de Montero para negociar los Presupuestos de 2026,"“No habrá negociación hasta que no se cumplan los acuerdos anteriores”, insiste el líder de Esquerra Republicana",Junqueras stellt die Eignung von Montero für Verhandlungen über die Haushaltspläne von 2026 in Frage,"Es wird keine Verhandlungen geben, bis die früheren Abkommen nicht eingehalten sind.",Junqueras questions Montero's suitability to negotiate 2026 Budgets,"“There will be no negotiation until the previous agreements are complied with,” insists the leader of Esquerra Republicana"
44,La retirada de Sinner en Cincinnati cubre de incógnitas el camino al US Open,"Pese al poco descanso, Alcaraz jugará esta misma tarde el dobles mixto del torneo neoyorquino junto a Emma Raducanu. El italiano descansará",Sinners Rückzug in Cincinnati deckt den Weg zum US Open ab.,Trotz der kurzen Pause wird Alcaraz noch heute Nachmittag das gemischte Double des New Yorker Turniers neben Emma Raducanu spielen. Der Italiener wird sich ausruhen.,Sinner's retreat in Cincinnati covers the way to the US Open with unknowns,"Despite the little rest, Alcaraz will play this afternoon the mixed doubles of the New York tournament with Emma Raducanu. The Italian will rest"
45,El dúo formado por Vinicius y Mbappé mide la capacidad de seducción de Xabi Alonso,"La pareja del brasileño y el francés, sin engrasar en ataque y rara vez implicada atrás, pone a prueba el objetivo del técnico de lograr un buen funcionamiento colectivo",Das Duo von Vinicius und Mbappé misst die Verführungsfähigkeit von Xabi Alonso,"Das Paar des Brasilianers und des Französischen, ohne zu fetten in Angriff und selten involviert zurück, prüft das Ziel des Technikers, ein gutes kollektives Funktionieren zu erreichen",The duo formed by Vinicius and Mbappé measures Xabi Alonso's seduction capacity,"The Brazilian and French couple, without oiling in attack and rarely involved behind, test the technician's objective of achieving a good collective functioning"
46,"Campeonas de Europa y a por el Mundial: “El verano se hace duro, pero estamos viviendo algo único”",Las gimnastas Inés Bergua y Andrea Corral narran junto a su entrenadora cómo afrontan la cita en Brasil tras hacer historia en junio al conseguir tres oros en los europeos,"Europameisterinnen und Weltmeisterinnen: Der Sommer wird hart, aber wir leben etwas Einzigartiges.","Die Turniere Inés Bergua und Andrea Corral erzählen gemeinsam mit ihrer Trainerin, wie sie mit dem Treffen in Brasilien konfrontiert werden, nachdem sie im Juni drei Gebete in den Europäern erhalten hatten.","Champions of Europe and the World Cup: “Summer gets tough, but we are living something unique”",Gymnasts Inés Bergua and Andrea Corral tell their coach how they face the event in Brazil after making history in June by getting three golds in Europeans
47,"Las secciones del Barcelona, y muy especialmente el equipo femenino, sufren por el límite salarial de LaLiga","Para proteger al primer equipo de fútbol, el club azulgrana se ha visto obligado a vender figuras estos años. Las últimas salidas afectan directamente a la plantilla de las campeonas de la Liga F","Die Sektionen von Barcelona, insbesondere das weibliche Team, leiden unter der Lohngrenze von LaLiga","Um das erste Fußballteam zu schützen, war der Blaugranat-Club in diesen Jahren gezwungen, Figuren zu verkaufen. Die letzten Ausgänge wirken sich direkt auf die F-Liga-Meisterschaft aus.","The sections of Barcelona, and especially the women's team, suffer from the salary limit of LaLiga","To protect the first football team, the club has been forced to sell figures over the years. The last exits directly affect the squad of the champions of the F League"
48,Del terreno de juego a tendencia: Najwa Khliwa tiene las prendas clave que definirán el nuevo uniforme urbano,"La actriz de ‘Olympo’, el último fenómeno audiovisual adolescente, adelanta las piezas de la temporada en la nueva campaña de Pull&amp;Bear, una propuesta inspirada en los clubes deportivos universitarios que celebra la elegancia relajada","Aus dem Spielfeld nach Trend: Najwa Khliwa hat die Schlüsselkleidung, die die neue städtische Uniform definieren","Die Schauspielerin von Pull &amp; Bear, das letzte jugendliche audiovisuelle Phänomen, zieht die Stücke der Saison in die neue Kampagne von Pull&amp;Bear, ein Vorschlag inspiriert von den Universitätssportvereinen, die entspannte Eleganz feiern",From the pitch to trend: Najwa Khliwa has the key garments that will define the new urban uniform,"The actress of ‘Olympo’, the latest adolescent audiovisual phenomenon, advances the pieces of the season in the new Pull&amp;Bear campaign, a proposal inspired by university sports clubs that celebrates relaxed elegance"
49,Xiaomi lanzará un coche eléctrico en Europa en 2027 tras disparar su beneficio un 133%,Las ventas ascendieron a 13.819 millones de euros y el beneficio neto prácticamente se duplicó hasta los 1.419 millones,"Xiaomi wird ein Elektroauto in Europa im Jahr 2027 starten, nachdem sie ihren Gewinn 133%","Die Verkäufe beliefen sich auf 13.819 Mio. EUR, und der Nettogewinn verdoppelte sich praktisch auf 1.419 Mio. EUR.",Xiaomi will launch an electric car in Europe in 2027 after firing its profit 133%,"Sales amounted to 13,819 million euros and the net profit almost doubled to 1,419 million"
50,Competencia avala la reforma que aligera las obligaciones contables de las pymes,"La CNMC no detecta riesgos en la propuesta, pero sugiere justificar mejor los umbrales elegidos por el Ministerio de Economía",Wettbewerb unterstützt die Reform zur Erleichterung der Rechnungslegungspflichten von KMU,"Das CNMC erkennt keine Risiken in dem Vorschlag, schlägt jedoch vor, die vom Wirtschaftsministerium gewählten Schwellenwerte besser zu begründen.",Competition supports the reform that eases the accounting obligations of SMEs,"CNMC does not detect risks in the proposal, but suggests better justification of the thresholds chosen by the Ministry of Economy"
51,Ni Adidas ni Hoka: las mejores baldas de Foot Locker estarán llenas de las zapatillas de Nike,Las dos empresas están reparando sus lazos tras la salida del anterior director ejecutivo del fabricante de ropa deportiva estadounidense,Weder Adidas noch Hoka: Die besten Regale von Foot Locker werden mit Nikes Schuhen gefüllt sein,Die beiden Unternehmen reparieren ihre Verbindungen nach der Entlassung des ehemaligen Exekutivdirektors des amerikanischen Sportbekleidungsherstellers,Neither Adidas nor Hoka: Foot Locker's best buckets will be filled with Nike's sneakers,The two companies are repairing their ties after the departure of the former executive director of the U.S. sportswear manufacturer
52,Hacer cima en el Everest será más caro,La Administración nepalí endurecerá las condiciones de ascensión al mítico monte para incrementar los ingresos y reducir el número de muertes,Höhepunkt im Everest wird teurer,"Die nepalesische Regierung wird die Bedingungen für den Aufstieg in den mythischen Berg verschärfen, um das Einkommen zu erhöhen und die Zahl der Todesfälle zu verringern",To top Everest will be more expensive,The Nepalese Administration will tighten the conditions of ascension to the mythical mountain to increase income and reduce the number of deaths
53,Los drones de Ucrania cortan el oleoducto que transporta petróleo ruso a Hungría y Eslovaquia,"Budapest, aliado de Moscú en la UE, amenaza con represalias contra Kiev por poner en riesgo su seguridad energética","Drohnen aus der Ukraine schneiden die Pipeline ab, die russisches Öl nach Ungarn und der Slowakei transportiert","Budapest, ein Verbündeter Moskaus in der EU, droht mit Vergeltungsmaßnahmen gegen Kiew, weil er seine Energiesicherheit gefährdet.",Ukrainian drones cut the Russian oil pipeline to Hungary and Slovakia,"Budapest, Moscow's EU ally, threatens retaliation against Kiev for putting its energy security at risk"
54,"El camerunés que ha corrido 19 maratones, de la Antártida hasta Sidney, vestido con el traje tradicional de su país","Afowiri Kizito Fondzenyuy, ganador de un récord Guinness, se mantiene muy vinculado a sus raíces y luce con orgullo el ‘toghu’ que encarna la fuerza y la identidad","Der Kamarus, der 19 Marathonzüge von der Antarktis bis nach Sidney gefahren ist, gekleidet mit dem traditionellen Anzug seines Landes","Afowiri Kizito Fondzenyuy, Gewinner eines Guinness-Rekorders, bleibt eng mit seinen Wurzeln verbunden und sieht stolz aus wie der nuttoghu Houten, der Stärke und Identität verkörpert","The Cameroonian who has run 19 marathons, from Antarctica to Sidney, dressed in the traditional costume of his country","Afowiri Kizito Fondzenyuy, winner of a Guinness record, remains closely linked to his roots and looks with pride the ‘toghu’ that embodies strength and identity"
55,El interés del Gobierno de Trump y los 2.000 millones de Softbank disparan a Intel en Bolsa,El Gobierno pretende convertir las ayudas concedidas en acciones para convertirse en su principal propietario,Das Interesse der Trump-Regierung und die 2 Milliarden Softbank schießen auf Intel an der Börse,"Die Regierung will die gewährten Beihilfen in Aktien umwandeln, um zum Haupteigentümer zu werden",Trump's Government Interest and Softbank's Two Billion Shoots Intel on Stock Exchange · Global Voices,The Government intends to convert the aid granted into shares to become its main owner
56,La campaña de Rodrigo Paz en Bolivia: de pueblo en pueblo y un expolicía como vice,El candidato de centroderecha que peleará por la presidencia en una segunda vuelta apenas usa redes sociales,Die Kampagne von Rodrigo Paz in Bolivien: von Dorf zu Dorf und ein Ex-Polizei als Vizepräsident,"Der richtige Kandidat, der in einer zweiten Runde für die Präsidentschaft kämpfen wird, benutzt kaum soziale Netzwerke",Rodrigo Paz's campaign in Bolivia: from people to people and a former police officer as vice president,The center-right candidate who will fight for the presidency in a second round barely uses social media
57,"Salterio, zanfona, rabel y laúd: los instrumentos medievales siguen vivos",Músicos y lutieres preservan y actualizan los sonidos de la Edad Media mientras crecen los festivales dedicados a la música antigua,"Psalter, Sanfone, Rabel und Laute: Mittelalterliche Instrumente sind noch am Leben","Musiker und Lutiers bewahren und aktualisieren die Klänge des Mittelalters, während Festivals, die der alten Musik gewidmet sind, wachsen","Psalter, zanfona, rabel and lute: medieval instruments are still alive",Musicians and Lutieres preserve and update the sounds of the Middle Ages as festivals dedicated to ancient music grow
58,“Que los pobres se peleen entre ellos”: el ‘remake’ de ‘Perseguido’ reaviva la obsesión por los concursos mortales,"En noviembre se estrena ‘The Running Man’, la versión del clásico ochentero de Arnold Schwarzenegger, que busca seducir al público de ‘Los Juegos del Hambre’ o ‘El juego del calamar’. Pero, ¿por qué están tan de moda las distopías violentas?",Die Armen sollen sich untereinander streiten: das nördliche nördliche nördliche nördliche nördliche nördliche nördliche nördliche nördliche nördliche nördliche nördliche nördliche nördliche nördliche nördliche nördliche nörgeln,"Im November wird die Premiere ""The Running Man Houten,"" die Version von Arnold Schwarzeneggers Klassiker, die das Publikum von ""The Hunger Games"" oder ""The Calamar Houten Game"" zu verführen sucht, veröffentlicht. Aber warum sind gewalttätige Distopien so trendig?",“Let the poor fight among themselves”: the ‘Persecuted’ ‘remake’ revives the obsession with mortal contests,"In November, ‘The Running Man’ premieres, the version of Arnold Schwarzenegger’s classic eight-year-old, who seeks to seduce the audience of ‘The Hunger Games’ or ‘The Squid Game’. But why are violent dystopias so fashionable?"
59,"Utopías, aquí y ahora: las iniciativas que proponen formas de vivir más justas y sostenibles","Una nueva oleada de autores, proyectos sociales e investigaciones artísticas dan vida a “utopías reales”, como ecoaldeas y espacios de agricultura sostenible","Utopien, hier und jetzt: Initiativen, die gerechtere und nachhaltigere Lebensformen vorschlagen","Eine neue Welle von Autoren, sozialen Projekten und künstlerischen Forschungen bringt echte Haufen wie Öko-Dörfer und Räume der nachhaltigen Landwirtschaft zum Leben","Utopias, here and now: initiatives that propose more just and sustainable ways of living","A new wave of authors, social projects and artistic research give life to “real utopias”, such as ecovillages and spaces of sustainable agriculture"
60,Cómo Europa se hizo grande cuando fue grande,"El libro de Walter Rodney, publicado en 1972, no ha perdido vigencia y su principal conclusión sigue siendo una realidad: el desarrollo de Occidente y el subdesarrollo de África son dos procesos de un mismo sistema, el imperialismo colonial","Wie Europa groß wurde, als es groß war","Walter Rodneys Buch, das 1972 veröffentlicht wurde, hat seine Gültigkeit nicht verloren, und seine wichtigste Schlußfolgerung bleibt eine Realität: Die Entwicklung des Westens und die Unterentwicklung Afrikas sind zwei Prozesse ein und desselben Systems, des Kolonialimperialismus.",How Europe got big when it was big,"Walter Rodney's book, published in 1972, has not lost its validity and its main conclusion remains a reality: the development of the West and the underdevelopment of Africa are two processes of the same system, colonial imperialism."
61,Néstor Reina o cómo llevar a la literatura las cualidades de un fino estilista del tejido,"El diseñador de vestuario se encomienda a santa Rita en su primera novela, en la que trata de exorcizar el trauma de su relación con el padre sin renunciar al humor inspirado en ‘Sexo en Nueva York’",Nestor Queen oder wie man die Qualitäten eines feinen Gewebe-Stylists in die Literatur bringt,"Der Kostümdesigner wird der hl. Rita in ihrem ersten Roman anvertraut, in dem sie versucht, das Trauma ihrer Beziehung zum Vater zu exorzieren, ohne auf die Stimmung zu verzichten, die von New York Sex inspiriert wurde.",Nestor Reina or how to bring to literature the qualities of a fine tissue stylist,"The costume designer entrusts himself to Saint Rita in his first novel, in which he tries to exorcise the trauma of his relationship with the father without giving up the humor inspired by ‘Sex in New York’"
62,"Melena de león, el hongo medicinal de moda que quiere conquistar la cocina","Es blanca, peluda y atrae a primera vista por su apariencia misteriosa. Una rareza gastronómica aún difícil de encontrar en España, donde muchos se lanzan a su cultivo","Löwemel, der trendige medizinische Pilz, der die Küche erobern will","Sie ist weiß, behaart und zieht sich auf den ersten Blick wegen ihres mysteriösen Aussehens an. Eine gastronomische Rarität, die in Spanien noch schwer zu finden ist, wo viele auf ihren Anbau gehen","Lion's mane, the fashionable medicinal fungus that wants to conquer the kitchen","It is white, hairy and attracts at first sight for its mysterious appearance. A gastronomic rarity still difficult to find in Spain, where many launch to its cultivation"
63,La última croqueta del Rober,"Nadie sabe cuántas quedan en el frigorífico del asador Zubikoetxea, pero sí que cuando se terminen no habrá más, pues Roberto, quien las hacía, murió a principios de verano durante un trayecto en moto",Die letzte Rober-Krokette,"Niemand weiß, wie viele noch im Kühlschrank von Zubikoetxea sind, aber wenn sie fertig sind, wird es nichts mehr geben, denn Roberto, der sie gemacht hat, starb Anfang Sommer auf einer Motorradfahrt.",The last croquette of the Rober,"No one knows how many are left in the fridge of the griller Zubikoetxea, but when they are finished there will be no more, because Roberto, who made them, died in early summer during a motorcycle ride"
64,El ‘imperio’ navarro de las verduras y las legumbres que le declara la guerra a la comida basura,"The Real Green Food, con marcas como Gvtarra y JA’E, factura 90 millones de euros y emplea a 850 personas. La compañía tiene más de 100 años de historia y es líder en la producción de cardo","Der Navarro-Navarra-Imperium von Gemüse und Hülsenfrüchten, die den Krieg gegen die Müllernte erklären","The Real Green Food, mit Marken wie Gvtarra und JA HELIOSE, berechnet 90 Millionen Euro und beschäftigt 850 Personen. Das Unternehmen hat mehr als 100 Jahre Geschichte und ist führend in der Herstellung von Distel",The Navarrese ‘Empire’ of Vegetables and Legumes Declares War on Garbage Food,"The Real Green Food, with brands like Gvtarra and JA’E, bills 90 million euros and employs 850 people. The company has more than 100 years of history and is a leader in the production of thistle"
65,"Cuando la comida a domicilio llega al hospital, la dieta salta a la basura",Enfermos y personal sanitario de los grandes centros públicos madrileños recurren cada vez más a aplicaciones de reparto mientras el desperdicio se dispara,"Wenn das Essen zu Hause im Krankenhaus ankommt, springt die Diät in den Müll.","Kranken und medizinisches Personal in den großen öffentlichen Einrichtungen in Madrid wenden sich immer mehr an Verteilungsanwendungen, während die Verschwendung stürmt.","When food comes home to the hospital, the diet jumps into the trash",Sick and health personnel from the large public centres in Madrid are increasingly turning to delivery applications while waste is being fired
66,Croquetas para despertar la conciencia de los diputados,Cristina Romero se convirtió en activista al saber que se tiraban las sobras del colegio de su hijo y ha impulsado dos leyes contra el desperdicio,"Kroketten, um das Bewusstsein der Abgeordneten zu wecken","Cristina Romero wurde Aktivist, weil sie wusste, dass die Reste der Schule ihres Sohnes weggeworfen wurden und zwei Gesetze gegen Verschwendung angestoßen hat.",Croquettes to awaken the conscience of the deputies,Cristina Romero became an activist when she learned that her son's school leftovers were being thrown away and has pushed for two laws against waste
67,Matar el hambre con lo que otros desechan,"Más de 1,4 millones de personas en España han recibido en 2023 ayuda de comedores y bancos de alimentos, según Agricultura","Den Hunger mit dem töten, was andere wegwerfen","Mehr als 1,4 Millionen Menschen in Spanien haben im Jahr 2023 Hilfe von Ess- und Lebensmittelbanken erhalten, nach Landwirtschaft",Kill the hunger with what others throw away,"More than 1.4 million people in Spain have received food aid in 2023, according to Agriculture"
68,Una cervecera de Liérganes condimenta quesos y alimenta las vacas con sus residuos,"La fábrica cántabra dona al pueblo cada semana toneladas de cáscaras, levadura y lúpulo que impulsan la economía circular",Eine Liérganer Brauerei würzt Käse und füttert die Kühe mit ihren Rückständen,"Die Cantabra-Fabrik spendet dem Volk jede Woche Tonnen von Schalen, Hefe und Hopfen, die die Kreislaufwirtschaft fördern",A brewery of Liérgans season cheese and feed the cows with its residues,"The Cantabrian factory donates to the village every week tons of shells, yeast and hops that drive the circular economy"
69,"Mar Flores, Cristina Cifuentes, Rocío Carrasco, Rosa Benito, Mariló Montero... La 1 llena su ‘prime time’ con famosos en concursos","‘Hasta el fin del mundo’, ‘DecoMasters’ y ‘MasterChef Celebrity’, tres formatos que RTVE emitirá este otoño, tendrán como participantes a rostros conocidos, muchos de ellos procedentes del universo de Mediaset","Mar Flores, Cristina Cifuentes, Rocío Carrasco, Rosa Benito, Mariló Montero... Die 1 füllt ihre Prime Time mit berühmten Wettbewerben","Bis zum Ende der Welt werden die drei Formate, die RTVE in diesem Herbst herausgeben wird, als Teilnehmer bekannt Gesichter haben, von denen viele aus dem Universum von Medienet stammen.","Mar Flores, Cristina Cifuentes, Rocío Carrasco, Rosa Benito, Mariló Montero... The 1 fills its ‘prime time’ with celebrities in contests","‘To the end of the world’, ‘DecoMasters’ and ‘MasterChef Celebrity’, three formats RTVE will issue this fall, will feature well-known faces, many of them from the Mediaset universe"
