,title-en,content-en,title-de,content-de,title-es,content-es,title-fr,content-fr,title-zh,content-zh
67,Rachel Morin's mother explains painstaking process of writing statement to read at killer's sentencing,"Victor Antonio Martinez Hernandez, an illegal immigrant convicted of rape and murder, faces sentencing as his victim&apos;s mother prepares emotional impact statement.","Rachel Morins Mutter erklärt sorgfältigen Prozess des Schreibens Aussage zu lesen, bei Killer-Sentencing","Victor Antonio Martinez Hernandez, ein illegaler Einwanderer, der wegen Vergewaltigung und Mord verurteilt wird, wird als sein Opfer und seine Mutter verurteilt.",La madre de Rachel Morin explica el minucioso proceso de escribir una declaración para leer en la sentencia del asesino,"Víctor Antonio Martínez Hernández, un inmigrante ilegal condenado por violación y asesinato, se enfrenta a una sentencia como su víctima y su madre prepara declaración de impacto emocional.",La mère de Rachel Morin explique le processus laborieux d'écrire une déclaration à lire lors de la condamnation du tueur,"Victor Antonio Martinez Hernandez, un immigrant illégal reconnu coupable de viol et de meurtre, est condamné comme sa victime et sa mère prépare une déclaration d'impact émotionnel.","Rachel Morin的母亲解释了写声明的艰难过程,","Victor Antonio Martinez Hernandez是一名被判犯有强奸和谋杀罪的非法移民,当他的受害者和被害者面临判刑;母亲编写情感影响说明。"
68,"WhatsApp bans 6.8M scam accounts, launches safety tool","Scammers are working harder than ever to trick people online, but WhatsApp is hitting back in a big way.","WhatsApp verbietet 6.8M Betrug Konten, startet Sicherheits-Tool","Scammers arbeiten härter als je zuvor, um Leute online auszutricksen, aber WhatsApp schlägt auf eine große Art und Weise zurück.","WhatsApp prohíbe cuentas de estafa de 6.8M, lanza herramienta de seguridad","Los estafadores están trabajando más duro que nunca para engañar a la gente en línea, pero WhatsApp está volviendo a golpear de una manera grande.","WhatsApp interdit les comptes d'escroquerie 6.8M, lance un outil de sécurité","Scammers travaillent plus dur que jamais pour tromper les gens en ligne, mais WhatsApp est en train de revenir en arrière d'une grande manière.",什么是App禁止6.8M诈骗账户、发射安全工具,"夏默斯比以往更努力地在网上欺骗人们,"
69,Dave Chappelle says he's been 'snubbed' by Hollywood awards shows following trans jokes,Comedian Dave Chappelle screened a documentary about his COVID-era comedy shows on Friday and quipped about being snubbed by award shows over his trans jokes.,"Dave Chappelle sagt, dass er von Hollywood-Awards nach Trans-Witzen ""geschnüffelt"" wurde","Der Komiker Dave Chappelle zeigte am Freitag einen Dokumentarfilm über seine Comedy-Shows aus der COVID-Ära und witzelte darüber, von Award-Shows über seine Trans-Witze geschnüffelt zu werden.",Dave Chappelle dice que ha sido 'desnudo' por los premios de Hollywood shows después de bromas trans,El comediante Dave Chappelle proyectó un documental sobre sus shows de comedia de la era COVID el viernes y bromeó sobre ser rechazado por los shows de premios por sus bromas trans.,"Dave Chappelle dit qu'il a été ""snobbed"" par les prix Hollywood shows suite à des blagues trans",Le comédien Dave Chappelle a projeté un documentaire sur ses spectacles de comédie de l'ère COVID vendredi et s'est contenté d'être snobé par des spectacles de remise de prix sur ses blagues trans.,"Dave Chappelle说他被好莱坞颁奖节目""迷惑""","喜剧演员Dave Chappelle放映了一部纪录片,"
70,"Tankinis for coverage, support and confidence at the beach","Tankinis are bikinis that provide coverage to your midsection, offering mix and match flexibility and body confident shaping. Shop 10 options available in water and sun-friendly fabrics","Tankinis für Abdeckung, Unterstützung und Vertrauen am Strand","Tankinis sind Bikinis, die Abdeckung für Ihren Mittelteil bieten, bietet Mischung und passen Flexibilität und körpersichere Gestaltung. Shop 10 Optionen in Wasser und sonnenfreundliche Stoffe","Tankinis para cobertura, apoyo y confianza en la playa","Los tankinis son bikinis que proporcionan cobertura a tu sección media, ofreciendo flexibilidad de mezcla y combinación y conformado seguro del cuerpo.","Tankinis pour la couverture, le soutien et la confiance à la plage","Les tankinis sont des bikinis qui assurent la couverture de votre milieu de section, offrant un mélange et une souplesse d'adaptation et de façonnage en toute confiance du corps.",用于海滩覆盖、支持和信任的坦克,"油基尼是比基尼,为中段提供覆盖,提供混合,并配合灵活性和身体自信的塑造。"
71,Zohran Mamdani launches anti-Trump tour across Five Boroughs in New York City,"NYC Democratic mayoral candidate, Zohran Mamdani, begins &apos;Five Boroughs Against Trump&apos; tour to oppose president&apos;s agenda on immigration and health care reform.",Zohran Mamdani startet Anti-Trump-Tour durch fünf Boroughs in New York City,"NYC Democratic Bürgermeisterkandidat, Zohran Mamdani, beginnt &apos;Fünf Boroughs gegen Trump&apos; Tour gegen Präsident&apos;s Agenda zur Einwanderungs- und Gesundheitsreform.",Zohran Mamdani lanza una gira anti-Trump a través de cinco distritos en la ciudad de Nueva York,"El candidato a la alcaldía demócrata de Nueva York, Zohran Mamdani, comienza &apos;cinco municipios contra Trump&apos; gira para oponerse a la agenda del presidente &apos sobre inmigración y reforma de la salud.",Zohran Mamdani lance une tournée anti-Trump à travers cinq arrondissements à New York,"Le candidat à la mairie démocratique de NYC, Zohran Mamdani, commence &apos;Cinq arrondissements contre Trump&apos; tournée pour s'opposer au programme du président&apos; sur l'immigration et la réforme des soins de santé.","Zohran Mamdani在纽约市五区发起反Trump旅游,",NYC民主市长候选人Zohran Mamdani 开始(apos); 五区反对Trump&apos; 巡视反对总统和apos; 移民和医疗保健改革议程。
72,Tom Brady burns Jets fans once more during statue ceremony,New England Patriots legend Tom Brady had one last zinger for the New York Jets as the organization unveiled his bronze statue outside of Gillette Stadium.,Tom Brady brennt Jets-Fans noch einmal während der Statuenzeremonie,"New England Patriots Legende Tom Brady hatte einen letzten Zinger für die New York Jets, als die Organisation seine Bronzestatue außerhalb des Gillette Stadions enthüllte.",Tom Brady quema ventiladores Jets una vez más durante la ceremonia de la estatua,La leyenda de los Patriotas de Nueva Inglaterra Tom Brady tuvo un último zinger para los Jets de Nueva York cuando la organización dio a conocer su estatua de bronce fuera del Estadio Gillette.,Tom Brady brûle encore une fois les fans de Jets lors de la cérémonie de la statue,La légende des patriotes de la Nouvelle-Angleterre Tom Brady a eu un dernier zinger pour les New York Jets alors que l'organisation a dévoilé sa statue de bronze à l'extérieur du stade Gillette.,汤姆·布雷迪在雕像仪式上再次烧伤喷风队球迷,"新英格兰爱国者传奇人物汤姆·布雷迪 在纽约喷气式飞机上 拥有最后一把琴 此时,本组织在吉莱特体育场外 揭开了他的青铜雕像"
73,Trump is threatening to 'federalize' DC with National Guard and more. Here's how that could play out,"President Donald Trump explores using D.C. National Guard authority to combat crime in Washington, despite data showing crime at lowest point in nearly 30 years.","Trump droht, DC mit Nationalgarde und mehr zu 'föderalisieren'.","Präsident Donald Trump erkundet mit D.C. National Guard Autorität, um Verbrechen in Washington zu bekämpfen, obwohl Daten zeigen, Verbrechen am niedrigsten Punkt in fast 30 Jahren.","Trump está amenazando con ""federar"" a DC con la Guardia Nacional y más.","El presidente Donald Trump explora el uso de la autoridad de la Guardia Nacional para combatir el crimen en Washington, a pesar de los datos que muestran el crimen en el punto más bajo en casi 30 años.",Trump menace de « fédéraliser » DC avec la Garde Nationale et plus encore. Voici comment cela pourrait jouer,"Le président Donald Trump explore l'utilisation de l'autorité de la Garde nationale de Washington pour lutter contre la criminalité, malgré les données montrant la criminalité à son point le plus bas depuis près de 30 ans.","特朗普威胁说要和国民警卫队 和更多的国民警卫队一起""联合""DC","总统唐纳德·特朗普(Donald Trump)探索如何利用华盛顿特区国民警卫队在华盛顿打击犯罪的权力,尽管有数据表明,犯罪是近30年来的最低点。"
74,"Andie MacDowell's daughter, Margaret Qualley, used 'Southern girl etiquette' to win over famous husband",&quot;The Substance&quot; star Margaret Qualley explained her &quot;Southern girl etiquette&quot; approach to romance with husband Jack Antonoff. The two married in 2023.,"Andie MacDowells Tochter Margaret Qualley nutzte die ""Southern Girl Etikette"", um den berühmten Ehemann zu gewinnen.",&quot;The Substance&quot; Star Margaret Qualley erklärte ihr &quot;Südliche Mädchen Etikette&quot; Annäherung an Romantik mit Ehemann Jack Antonoff. Die beiden heirateten im Jahr 2023.,"La hija de Andie MacDowell, Margaret Qualley, usó la etiqueta de chica sureña para ganarse a un marido famoso.",&quot;La Sustancia&quot; la estrella Margaret Qualley explicó su &quot;Southern girl etiqueta&quot; acercamiento al romance con el marido Jack Antonoff. Los dos se casaron en 2023.,"La fille d'Andie MacDowell, Margaret Qualley, s'est servie de l'étiquette « Southern girl » pour gagner le célèbre mari.",&quot;The Substance&quot; star Margaret Qualley a expliqué son &quot;Southern girl etiquette&quot; approche de la romance avec le mari Jack Antonoff. Les deux mariés en 2023.,Andie MacDowell的女儿Margaret Qualley 利用“南方女孩礼仪”来赢得著名的丈夫,& quot; The Deful & quot; star Margaret Qualley 解释了她与丈夫 Jack Antonoff 的浪漫态度。 两人于2023年结婚 。
75,"Illinois substitute teacher had sex with 11-year-old student during 'play dates,' police say","Former Decatur substitute teacher admits to predatory sexual assault of sixth-grade student at her Mt. Zion home, with sentencing scheduled for September.",Illinois Ersatzlehrer hatte Sex mit 11-jährigen Schüler während 'Spieldaten' Polizei sagen,"Ehemalige Decatur-Ersatzlehrerin gibt zu, sexuelle Übergriffe auf Schüler der sechsten Klasse an ihrem Mt. Zion zu begehen, wobei die Verurteilung für September geplant ist.","Profesor sustituto de Illinois tuvo relaciones sexuales con un estudiante de 11 años durante 'fechas de juego', dice la policía","Ex maestra sustituta de Decatur admite agresión sexual depredadora de estudiante de sexto grado en su casa del Monte Zion, con sentencia programada para septiembre.","L'instituteur remplaçant de l'Illinois a couché avec un élève de 11 ans pendant des ""dates de jeu"", disent la police.","L'ancien professeur remplaçant de Decatur admet avoir été victime d'agression sexuelle prédatrice à son domicile du Mont Zion, avec une condamnation prévue pour septembre.","伊利诺伊州代课老师与11岁学生发生性关系,","前Decatur代课教师承认六年级学生在其Mt.Zion山的家中遭受掠夺性性性攻击,定于9月判刑。"
76,Cowboys' Dak Prescott makes bold statement to Rams team owner,Dallas Cowboys quarterback Dak Prescott delivered a message to Los Angeles Rams team owner Stan Kroenke before their preseason game over the weekend.,Cowboys' Dak Prescott macht mutige Aussage zu Rams Teambesitzer,Dallas Cowboys Quarterback Dak Prescott gab eine Nachricht an Los Angeles Rams Teambesitzer Stan Kroenke vor ihrer Vorsaison Spiel über das Wochenende.,Dak Prescott de Cowboys hace una declaración audaz al dueño del equipo de Rams,"El quarterback de Dallas Cowboys Dak Prescott entregó un mensaje al dueño del equipo de Los Ángeles Rams, Stan Kroenke, antes de su partido de pretemporada el fin de semana.",Dak Prescott de Cowboys fait une déclaration audacieuse au propriétaire de l'équipe Rams,Dallas Cowboys quarterback Dak Prescott a livré un message au propriétaire de l'équipe de Los Angeles Rams Stan Kroenke avant leur match de présaison au cours du week-end.,牛仔的Dak Prescott 向拉姆斯队队长 作出大胆声明,达拉斯牛仔队四分卫戴克·普雷斯科特 在他们周末的赛前比赛前 给洛杉矶拉姆斯队队长斯坦·克伦克发了短信
77,Father of CDC gunman indicates possible motivation behind shooting,"Patrick Joseph White had been fixated on the COVID-19 vaccine before the deadly shooting at the CDC headquarters in Atlanta, his father said.",Vater von CDC Gunman zeigt mögliche Motivation hinter dem Schießen,"Patrick Joseph White war vor der tödlichen Schießerei im CDC-Hauptquartier in Atlanta auf den COVID-19-Impfstoff fixiert worden, sagte sein Vater.",Padre del pistolero de los CDC indica la posible motivación detrás de los disparos,"Patrick Joseph White había sido fijado en la vacuna COVID-19 antes del tiroteo mortal en la sede de los CDC en Atlanta, dijo su padre.",Le père du tireur du CDC indique une motivation possible derrière la fusillade,"Patrick Joseph White avait été fixé sur le vaccin COVID-19 avant la fusillade mortelle au siège du CDC à Atlanta, a déclaré son père.",疾控中心枪手之父 表示开枪背后可能有动机,"Patrick Joseph White在亚特兰大疾控中心总部发生致命枪击事件之前,他的父亲说,Patrick Joseph White一直坚持使用COVID-19疫苗。"
78,"Washington Post's effort to court conservatives could drive away its liberal readers, ex-fact checker warns","In an interview with Fox News Digital, former Washington Post fact checker Glenn Kessler warned the paper&apos;s efforts to court conservatives could backfire.","Washington Posts Bemühungen, Konservative vor Gericht könnte seine liberalen Leser vertreiben, Ex-Fakten-Checker warnt","In einem Interview mit Fox News Digital warnte der ehemalige Washington Post-Faktenprüfer Glenn Kessler das Paper&apos; seine Bemühungen, Konservative vor Gericht zu stellen, könnten nach hinten losgehen.","El esfuerzo de Washington Post para cortejar a los conservadores podría alejar a sus lectores liberales, advierte el ex verificador de hechos","En una entrevista con Fox News Digital, el ex verificador de hechos del Washington Post, Glenn Kessler, advirtió al periódico que los esfuerzos para cortejar a los conservadores podrían ser contraproducentes.","L'effort de Washington Post pour juger les conservateurs pourrait chasser ses lecteurs libéraux, l'ex-vérificateur de faits met en garde","Dans une entrevue avec Fox News Digital, l'ancien vérificateur des faits de Washington Post, Glenn Kessler, a mis en garde contre les efforts déployés par les conservateurs pour les cours de justice.","华盛顿邮报试图向保守派讨价还价,",前华盛顿邮报实情检查员Glenn Kessler在接受Fox News Digital的采访时警告报社;
79,Kamala Harris' major California announcement triggers circular Dem firing squad,"California&apos;s 2026 gubernatorial primary features Democrats Katie Porter, Xavier Becerra, Tony Thurmond and Antonio Villaraigosa after Harris opts out of the race.",Kamala Harris' große kalifornische Ankündigung löst runde Dem Erschießungskommando aus,== Weblinks ==* Offizielle Website (englisch)== Einzelnachweise ==,El mayor anuncio de Kamala Harris en California desencadena un pelotón de fusilamiento circular Dem,"California&apos; s 2026 primarias gubernatorial características Demócratas Katie Porter, Xavier Becerra, Tony Thurmond y Antonio Villaraigosa después de Harris opta por salir de la carrera.",L'annonce majeure de Kamala Harris en Californie déclenche l'équipe d'exécution de Dem circulaire,"California&apos;s 2026 gubernatorial features Democrats Katie Porter, Xavier Becerra, Tony Thurmond et Antonio Villaraigosa après Harris opte pour la sortie de la course.",卡玛拉哈里斯的加州主要公告 触发Dem突击行刑队,"California&apos; 2026年州长主修民主党Katie Porter, Xavier Becerra, Tony Thurmond 和Antonio Villaraigosa 在Harris退出后,"
80,You can eat bread and stay fit: Here are 9 high-fiber options from a health coach,"Nutritious bread products with high-fiber content can lower cholesterol, reduce blood sugar spikes and promote gut health, a New York health coach said. Here&apos;s why.",Sie können Brot essen und fit bleiben: Hier sind 9 High-Fiber-Optionen von einem Health Coach,"Nährhafte Brotprodukte mit hohem Fasergehalt können Cholesterin senken, Blutzuckerspitzen senken und die Gesundheit des Darms fördern, sagte ein New Yorker Gesundheitstrainer. Hier&apos;s warum.",Usted puede comer pan y mantenerse en forma: Aquí hay 9 opciones de alta fibra de un entrenador de salud,"Los productos nutritivos de pan con alto contenido de fibra pueden reducir el colesterol, reducir los picos de azúcar en sangre y promover la salud intestinal, dijo un entrenador de salud de Nueva York. Here&apos;s por qué.",Vous pouvez manger du pain et rester en forme: Voici 9 options de haute fibre d'un entraîneur de santé,"Les aliments nutritifs à haute teneur en fibres peuvent abaisser le cholestérol, réduire les pics de sucre dans le sang et promouvoir la santé des intestins, a déclaré un entraîneur de santé de New York.",你可以吃面包和保持健康:这里有9个健康教练的高自由选择。,"一位纽约卫生教练说,高纤维含量的营养面包产品可以降低胆固醇,减少血糖刺,促进肠道健康。这里和apos;原因在这里。"
81,"Special Forces vet exposes tactics of Montana, Washington state survivalists: 'Can't stay hidden forever'",Former soldier Michael Brown was on the run while Travis Decker evades a massive manhunt following Montana bar shooting and Washington child murders as authorities deploy.,"Special Forces Tierarzt entlarvt Taktiken von Montana, Washington State Survivalists: 'Kann nicht für immer versteckt bleiben'","Der ehemalige Soldat Michael Brown war auf der Flucht, während Travis Decker einer massiven Verfolgung aus dem Weg geht, nachdem Montana Bar Shooting und Washington Kindermorde als Behörden einsetzen.","Veterinario de las Fuerzas Especiales expone tácticas de Montana, los sobrevivientes del estado de Washington: 'No puede permanecer oculto para siempre'",El ex soldado Michael Brown estaba huyendo mientras Travis Decker evadía una persecución masiva tras el tiroteo en el bar Montana y los asesinatos de niños en Washington mientras las autoridades se despliegan.,"Le vétérinaire des Forces Spéciales expose les tactiques du Montana, Washington state survivalists: 'ne peut pas rester caché pour toujours'",L'ancien soldat Michael Brown était en fuite alors que Travis Decker s'évade d'une chasse massive à l'homme après la fusillade du bar du Montana et les meurtres d'enfants à Washington alors que les autorités se déploient.,"特种部队兽医揭露了蒙大拿的战术, 华盛顿州生存主义者: “不能永远躲藏起来。”","前士兵Michael Brown在逃, Travis Decker在蒙大拿酒吧枪击事件后躲避大规模搜捕,"
82,Fiscal hawks seek millions for home district projects amid government funding debate,"House Freedom Caucus members and deficit hawks requested federal funding for infrastructure, clean water and veterans projects, totaling millions.",Steuerhawks suchen Millionen für Wohnbezirk Projekte in der Regierung Finanzierung Debatte,"House Freedom Caucus Mitglieder und Defizit Falken forderte Bundesfinanzierung für Infrastruktur, sauberes Wasser und Veteranen-Projekte, insgesamt Millionen.",Los halcones fiscales buscan millones para proyectos de distrito hogareño en medio del debate de financiamiento del gobierno,"Los miembros de House Freedom Caucus y los halcones deficitarios solicitaron financiamiento federal para proyectos de infraestructura, agua potable y veteranos, sumando millones.",Les faucons fiscaux cherchent des millions de dollars pour des projets de district dans le cadre d'un débat sur le financement par le gouvernement,"Les membres de House Freedom Caucus et les faucons déficitaires ont demandé un financement fédéral pour des projets d'infrastructure, d'eau potable et d'anciens combattants, totalisant des millions.","财政鹰在政府筹资辩论期间,为本土地区项目寻找数以百万计的资金","自由之家核心小组成员和赤字鹰帮要求联邦为基础设施、清洁饮水和退伍军人项目提供资金,共计数百万人。"
83,Biopolis – into the microbiome,"A young scientist explores the human microbiome in a part-science, part-fiction audio series. Podcastmaker Michiel van Poelgeest follows Dr. Theda Bartolomaeus from the Max Delbrück Center on her quest to decode the microbes within us. (5 episodes)
<p></p>
  <img alt=""Theda Bartolomaeus"" height=""200"" src=""https://www.mdc-berlin.de/system/files/styles/mdc_inline_small_mdc_phablet_1x/private/2025-07/rn_image_picker_lib_temp_7c0c8b45-42be-48ad-b853-cbeef4a8bc06.jpg?h=4521fff0&amp;itok=EjrYGyxS"" width=""320"" />



<p></p>
<p><a href=""https://springcast.app/biopolis-into-the-microbiome""><strong>Podcast website</strong></a></p><p><a href=""https://podcasts.apple.com/de/podcast/biopolis-into-the-microbiome/id1822739797"">Biopolis at Apple Podcasts</a></p>
<p></p>

<p></p>",Biopolis – ins Mikrobiom,"Ein junger Wissenschaftler erforscht das Mikrobiom in einer Teil-Wissenschaft, Teil-Fiction-Audioserie. Podcastmaker Michiel van Poelgeest folgt Dr. Theda Bartolomaeus vom Max-Delbrück-Zentrum auf ihrer Suche nach der Dekodierung der Mikroben in uns. (5 Episoden) <p></p> <img alt=""Theda Bartolomaeus"" Höhe=""200"" src=""https://www.mdc-berlin.de/system/files/styles/mdc_inline_smmdc_phablet_1x/private/2025-07/rn_image_picker_lib_temp_7c0c8b45-42be-48ad-b853-cbeef4a8bc06.jpg?h=4521fff0&amp;itok=EjrYGyxS"" Breite <p><p>*p>Href/dcast/appotyp><p>",Biopolis – en el microbioma,"Un joven científico explora el microbioma humano en una serie de audio de parte-ciencia, de parte-ficción. Podcastmaker Michiel van Poelgeest sigue a la Dra. Theda Bartolomeus del Centro Max Delbrück en su búsqueda de decodificar los microbios dentro de nosotros. (5 episodios) <pÃ3s/p> <img alt=""Theda Bartolomeus"" thigh=""200"" src=""https://www.mdc-berlin.de/system/files/styles/mdc_inline_small_mdc_phablet_1x/privado/2025-07/rn_image_picker_lib_temp_7c0c8b45-42be-48ad-b853-cbeef4a8bc06.jp?h=4521fff&amp;itok=EjrYGyxS"" ancho=""320/p/pmefÃ3cÃ3",Biopolis – dans le microbiome,"Un jeune scientifique explore le microbiome humain dans une série audio en partie scientifique, en partie fiction. Podcastmaker Michiel van Poelgeest suit la Dre Theda Bartolomaeus du Centre Max Delbrück dans sa quête de décoder les microbes en nous. (5 épisodes) <p></p> <img alt=""Theda Bartolomaeus"" height=""200"" src=""https://www.mdc-berlin.de/system/files/styles/mdc_inline_small_mdc_phablet_1x/private/2025-07/rn_image_picker_lib_temp_7c0c8b45-42be-48ad-b853-cbeef4a8bc06.jpg?h=4521fff0&amp;itok=EjrYGyxS"" width=""320"" /> <p> <p><a href><p>https://springcast.gov><p><p><p><p><p><p><p><p>",Biopolis — — 进入微生物,"一位年轻的科学家在部分科学、部分虚构的音频系列中探索人类微生物。来自Max Delbrück中心的Podcacardmaker Michiel van Poelgeest博士追随Max Delbrück中心的Theda Bartolomaeus 试图解码我们体内的微生物。 (5个片段) <p/p> <img alt=""Theda Bartomaeus"" 高度=""200"" src="" https://www.mdc-berlin.de/ systems/fiscles/mdlines/ styms_indc_indc_1x_puty_p_x/privilal/2025-07/rn_image_parter_lib_lib_temp_7c8b45-42be-48ad-b853-cbefwefe4,a8c06.jpg?h=4521fff0 &amp;itok=eokok=Ejorks=EjryrYYGydxS_podS_pop=_p_pop=30_ma_ma_ma_ma_ma_ma_ma_max_tocast_ma_tocasts/ misal_tocasto_ma_ma_ma_ma_ma_ma_tocastoal_tocast."
