,title-en,content-en,title-de,content-de,title-es,content-es,title-fr,content-fr,title-zh,content-zh
66,"Female police officer leaps into water, fights career criminal before making arrest, video shows",NYPD officers jumped into East Rockaway Inlet to arrest suspected car thief Matthew Swafford after he leaped from a dock to escape capture in Queens.,"Weibliche Polizistin springt ins Wasser, kämpft Karriere kriminell vor der Verhaftung, Video-Shows","NYPD-Offiziere sprangen in East Rockaway Inlet, um den mutmaßlichen Autodieb Matthew Swafford zu verhaften, nachdem er von einem Dock gesprungen war, um in Queens zu entkommen.","Las mujeres policías saltan al agua, combaten a los criminales de carrera antes de hacer arrestos, programas de vídeo",Oficiales de la policía de Nueva York saltaron a East Rockaway Inlet para arrestar al presunto ladrón de coches Matthew Swafford después de saltar de un muelle para escapar de la captura en Queens.,"Un policier féminin saute dans l'eau, se bat pour une carrière criminelle avant d'être arrêté, des vidéos",Des officiers de la police de New York ont sauté dans East Rockaway Inlet pour arrêter le voleur présumé de voiture Matthew Swafford après avoir sauté d'un quai pour échapper à la capture dans le Queens.,"女警官跳入水中,在逮捕前打职业罪犯,录像节目","纽约警局官员跳进东洛克威入口 逮捕涉嫌偷车贼Matthew Swafford 后,他从码头跳下 逃出皇后区抓获"
67,"Cracker Barrel customers revolt against remodels, plus workers unearth 1,000-year-old tombs","The Fox News Lifestyle Newsletter brings you trending stories on family, travel, food, neighbors helping neighbors, pets, autos, military veterans, heroes, faith and American values.","Cracker Barrel Kunden revoltieren gegen Umbauten, plus Arbeiter ausgraben 1.000-jährige Gräber","The Fox News Lifestyle Newsletter bringt Sie Trendgeschichten über Familie, Reisen, Essen, Nachbarn helfen Nachbarn, Haustiere, Autos, Militärveteranen, Helden, Glauben und amerikanische Werte.","Los clientes de Cracker Barrel se rebelan contra las remodelaciones, además de los trabajadores desentierran tumbas de 1.000 años de antigüedad","The Fox News Lifestyle Newsletter te trae historias de moda sobre familia, viajes, comida, vecinos ayudando a vecinos, mascotas, autos, veteranos militares, héroes, fe y valores estadounidenses.","Les clients de Cracker Barrel se révoltent contre les remodelages, plus les travailleurs déterrent des tombes millénaires","Le Fox News Lifestyle Newsletter vous propose des histoires tendance sur la famille, les voyages, la nourriture, les voisins aidant les voisins, les animaux de compagnie, les automobiles, les anciens combattants, les héros, la foi et les valeurs américaines.","Cracker Barreel客户反对改造, 加上工人挖出一千年古墓,",福克斯新闻《生活方式通讯》带来关于家庭、旅行、食物、邻居帮助邻居、宠物、汽车、退伍军人、英雄、信仰和美国价值观的流行故事。
68,Minneapolis Democratic socialist Omar Fateh vows to protect illegal immigrants from 'hostile' Trump admin,Minneapolis mayoral candidate Omar Fateh says he would prioritize shielding illegal immigrants from President Donald Trump&apos;s &quot;hostile federal government.&quot;,"Minneapolis Democratic Socialist Omar Fateh Gelübde zum Schutz illegaler Einwanderer vor ""feindlichen"" Trump Admin","Minneapolis Bürgermeisterkandidat Omar Fateh sagt, er würde die Abschirmung illegaler Einwanderer von Präsident Donald Trump&apos;s &quot;feindliche Bundesregierung priorisieren.&quot;","Minneapolis El socialista demócrata Omar Fateh promete proteger a los inmigrantes ilegales de la administración ""hostil"" de Trump",El candidato a la alcaldía de Minneapolis Omar Fateh dice que priorizaría proteger a los inmigrantes ilegales del presidente Donald Trump&apos;s &quot;gobierno federal hostil.&quot;,Minneapolis démocrate socialiste Omar Fateh s'engage à protéger les immigrants illégaux de l'administration « hostile » Trump,Le candidat maire de Minneapolis Omar Fateh dit qu'il accorderait la priorité à protéger les immigrants illégaux du président Donald Trump&apos;s &quot;hostile gouvernement fédéral.&quot;,明尼阿波利斯民主社会主义社会主义者奥马尔·法特宣誓保护非法移民免受“敌对”特朗普行政官的迫害。,"Minneapolis市长候选人Omar Fateh表示, 他将优先保护非法移民不受总统Donald Trump&apos;s & qopot; 敌对的联邦政府。 & quot;"
69,CAPTCHAgeddon signals a dangerous shift,"Fake captchas have evolved into full-blown malware launchpads, thanks to a sneaky new method called ClickFix. It copies commands to your clipboard and tricks you into running them, without ever downloading a file.",CAPTCHAgeddon signalisiert eine gefährliche Verschiebung,"Fake Captchas haben sich zu vollwertigen Malware-Launchpads entwickelt, dank einer hinterhältigen neuen Methode namens ClickFix. Es kopiert Befehle in Ihre Zwischenablage und tricks Sie in den Betrieb, ohne jemals eine Datei herunterladen.",CAPTCHAgeddon señala un peligroso cambio,"Los falsos captchas se han convertido en lancepads de malware completos, gracias a un nuevo método astuto llamado ClickFix. Copia comandos a su portapapeles y trucos para ejecutarlos, sin nunca descargar un archivo.",CAPTCHageddon signale un changement dangereux,"Faux captchas ont évolué en des launchpads logiciels malveillants, grâce à une nouvelle méthode sournoise appelée ClickFix. Il copie des commandes à votre presse-papiers et vous aide à les exécuter, sans jamais télécharger un fichier.",CAPTCHAgddon 信号危险转换,"假的卡普查已演变成完整的恶意软件启动程序, 多亏了一种称为 ClickFix 的狡猾的新方法。 它将命令复制到剪贴板上, 并诱使您运行命令, 而不下载文件 。"
70,Female military recruits surge across all service branches,Pentagon officials credit Defense Secretary Pete Hegseth and President Donald Trump&apos;s leadership for sharp increase in female military recruits across all service branches in 2025.,Weibliche Militärrekruten strömen über alle Dienstzweige,Pentagon-Beamte kreditieren Verteidigungsminister Pete Hegseth und Präsident Donald Trump&apos; die Führung für einen starken Anstieg der weiblichen Rekruten in allen Dienststellen im Jahr 2025.,Reclutas militares femeninas aumentan en todas las ramas de servicio,Los funcionarios del Pentágono acreditan al Secretario de Defensa Pete Hegseth y al Presidente Donald Trump&apos; su liderazgo por el fuerte aumento de reclutas militares en todas las ramas del servicio en 2025.,L ' augmentation du nombre de recrues militaires dans toutes les branches de service,Les responsables du Pentagone créditent le secrétaire à la Défense Pete Hegseth et le président Donald Trump&apos; dirige une forte augmentation du nombre de recrues militaires féminines dans toutes les branches de service en 2025.,在所有服役部门招募的女军人激增,五角大楼官员 信用国防大臣彼得·赫格塞特 和总统唐纳德·特朗普·阿波斯 领导 2025年所有服役部门女性新兵 都急剧增加
71,America's obsession with politicizing our children has got to stop,"Imagine my shock hearing about the summer camp my friend’s daughter attended. Nestled in a mountain paradise of trees and lakes, it looked like the all-American camp—until it wasn’t.","Amerikas Obsession, unsere Kinder zu politisieren, muss aufhören","Stellen Sie sich vor, mein Schock hörte über das Sommerlager, das meine Freundin besuchte. Eingebettet in ein Bergparadies aus Bäumen und Seen, sah es aus wie das All-American Camp – bis es nicht war.",La obsesión de Estados Unidos por politizar a nuestros hijos tiene que parar,"Imaginen mi sorpresa al escuchar sobre el campamento de verano al que asistió la hija de mi amigo. Ubicado en un paraíso de montañas de árboles y lagos, parecía el campamento de todo Estados Unidos, hasta que no lo fue.",L'obsession de l'Amérique à politiser nos enfants doit cesser,"Imaginez que j'ai entendu parler du camp d'été auquel ma fille a assisté. Niché dans un paradis montagneux d'arbres et de lacs, il ressemblait au camp tout-américain – jusqu'à ce qu'il ne l'ait pas été.",美国的痴迷 将我们的孩子政治化 必须停止,"想象一下我所听到的关于我朋友女儿参加的夏令营的震撼。 在一个树木和湖泊的山顶天堂里,它看起来像一个全美的夏令营 — — 直到没有它为止。"
72,MIKE DAVIS: A tale of two Russiagate heroes,Kash Patel and Chuck Grassley expose Russia investigation allegations against Trump as politically motivated conspiracy involving Clinton campaign and FBI misconduct,MIKE DAVIS: Eine Geschichte von zwei russischen Helden,Kash Patel und Chuck Grassley entlarven Russland Untersuchung Vorwürfe gegen Trump als politisch motivierte Verschwörung mit Clinton Kampagne und FBI Fehlverhalten,MIKE DAVIS: Una historia de dos héroes de Russiagate,Kash Patel y Chuck Grassley exponen las acusaciones de investigación rusa contra Trump como conspiración por motivos políticos que involucra la campaña de Clinton y la mala conducta del FBI,MIKE DAVIS: Une histoire de deux héros de Russiegate,Kash Patel et Chuck Grassley dénoncent les allégations d'enquête de la Russie contre Trump en tant que complot politique impliquant la campagne Clinton et l'inconduite du FBI,两个俄罗斯门英雄的故事,"Kash Patel和Chuck Grassley揭露俄罗斯对Trump的调查指控,"
73,ICE Houston arrests more than 350 gang members -- and it's not just MS-13,"In Trump’s first six months back in office, ICE Houston has arrested more than 350 illegal migrants tied to over 40 gangs — including violent street crews like MS-13 and Tren de Aragua.",ICE Houston verhaftet mehr als 350 Gangmitglieder -- und es ist nicht nur MS-13,"In Trumps ersten sechs Monaten im Amt hat ICE Houston mehr als 350 illegale Migranten verhaftet, die an über 40 Banden gebunden sind – darunter gewalttätige Straßenbesatzungen wie MS-13 und Tren de Aragua.",ICE Houston arresta a más de 350 pandilleros... y no es solo MS-13,"En los primeros seis meses de Trump en el cargo, el ICE Houston ha arrestado a más de 350 migrantes ilegales vinculados a más de 40 pandillas, incluyendo a bandas callejeras violentas como el MS-13 y Tren de Aragua.",ICE Houston arrête plus de 350 membres de gangs -- et ce n'est pas seulement MS-13,"À Trump, les six premiers mois de son mandat, ICE Houston a arrêté plus de 350 migrants illégaux liés à plus de 40 gangs, dont des équipages de rue violents comme MS-13 et Tren de Aragua.",ICE休斯顿逮捕了350多名黑帮成员 不只是MS -13,包括像MS-13和Tren de Aragua这样的暴力街头小分队。
74,Mamdani zings Cuomo in rent-stabilized housing spat during anti-Trump tour stop,"NYC mayoral candidate, Zohran Mamdani, has faced criticism from former Gov. Andrew Cuomo over his rent-stabilized apartment amid his anti-Trump tour through New York City.",Mamdani zings Cuomo in Miet-stabilisierte Gehäuse spat während Anti-Trump Tour Stop,"Der bürgermeisterliche Kandidat der NYC, Zohran Mamdani, hat sich der Kritik des ehemaligen Gov. Andrew Cuomo wegen seiner mietstabilisierten Wohnung inmitten seiner Anti-Trump-Tour durch New York City ausgesetzt.",Mamdani zings Cuomo en alquiler-estabilizado de la vivienda escupió durante la parada del tour anti-Trump,"El candidato a la alcaldía de Nueva York, Zohran Mamdani, se ha enfrentado a las críticas del ex gobernador Andrew Cuomo por su apartamento estabilizado de alquiler en medio de su gira contra Trump por la ciudad de Nueva York.",Mamdani zings Cuomo en logement à louer-stabilisé spat pendant l'arrêt de tournée anti-Trump,"Le candidat maire de NYC, Zohran Mamdani, a fait l'objet de critiques de la part de l'ancien gouvernement Andrew Cuomo au sujet de son appartement stable à la location dans le cadre de sa tournée anti-Trump à New York.","Mamdani zings Cuomo在反Trump旅游停留期间,在房租稳定的住房中大便","纽约市市长候选人Zohran Mamdani在纽约市反特朗普之旅中, 面对前政府批评安德鲁·库莫(Andrew Cuomo),"
75,Deion Sanders' Colorado quarterback decision much tougher than years past,Colorado Buffaloes head coach Deion Sanders will have a tough decision to make on who will start at quarterback for the team after no-brainer options the last two years.,Deion Sanders' Colorado Quarterback Entscheidung viel härter als Jahre vergangen,"Colorado Buffaloes Cheftrainer Deion Sanders wird eine harte Entscheidung zu treffen, wer bei Quarterback für das Team nach no-brainer Optionen in den letzten zwei Jahren starten wird.",La decisión del quarterback de Deion Sanders en Colorado es mucho más dura que los años pasados,Colorado Buffalos entrenador jefe Deion Sanders tendrá una decisión difícil de tomar sobre quién comenzará en quarterback para el equipo después de opciones sin cerebro en los últimos dos años.,Deion Sanders' Colorado quarterback décision beaucoup plus difficile que les années précédentes,Colorado Buffaloes entraîneur-chef Deion Sanders aura une décision difficile à prendre sur qui commencera à quarterback pour l'équipe après des options sans cerveau ces deux dernières années.,Deion Sanders的科罗拉多州四分卫决定 比往年更艰难,科罗拉多水牛队总教练Deion Sanders 将做出艰难的决定 谁在过去两年的无脑选择后 开始在四分卫队
76,Public school teacher reveals years-long effort to expose alleged student abortion scandal,Fairfax County teacher Zenaida Perez says she warned school officials seven times about abortion allegations involving a social worker before district launched investigation,"Öffentlicher Lehrer enthüllt jahrelange Bemühungen, angeblichen Studentenabtreibungsskandal aufzudecken","Fairfax County Lehrerin Zenaida Perez sagt, sie warnte Schulbeamte sieben Mal über Abtreibung Anschuldigungen mit einem Sozialarbeiter, bevor Bezirk eingeleitet Untersuchung",Profesor de escuela pública revela un esfuerzo de años para denunciar el supuesto escándalo del aborto estudiantil,La profesora del condado de Fairfax Zenaida Pérez dice que advirtió a los funcionarios escolares siete veces sobre acusaciones de aborto envolviendo a una trabajadora social antes de que el distrito iniciara la investigación,Le professeur de l'école publique révèle des années d'efforts pour dénoncer le scandale présumé de l'avortement d'élèves,"L'enseignante du comté de Fairfax, Zenaida Perez, a averti les responsables de l'école sept fois des allégations d'avortement impliquant un travailleur social avant que le district ne lance une enquête.",公立学校教师揭露了多年来揭露学生堕胎丑闻的多年努力,"Fairfax县教师Zenaida Perez说,在地区展开调查之前,她曾七次警告学校官员有关一名社会工作者堕胎指控的警告七次。"
77,"Trump jokes he won't build a 'big, beautiful' press room because he doesn't want reporters 'comfortable'","President Trump jokingly told a packed White House briefing room he won&apos;t expand space for reporters, saying he doesn&apos;t want to make them &quot;comfortable.&quot;","Trump macht Witze, er baut keinen 'großen, schönen' Presseraum, weil er keine Reporter 'bequem' will.","Präsident Trump erzählte scherzhaft einem gepackten White House Briefing-Raum er gewann&apos;t Raum für Reporter erweitern, sagen, er tut&apos;t wollen sie machen &quot;comfortable.&quot;","Trump bromea que no construirá una sala de prensa ""grande y hermosa"" porque no quiere periodistas ""cómodos""","El presidente Trump le dijo en broma a una sala llena de reuniones informativas de la Casa Blanca que won&apos;t ampliar el espacio para los reporteros, diciendo que doesn&apos;t quieren hacerlos &quot; cómodo.&quot;","Trump plaisante qu'il ne construira pas une grande et belle salle de presse parce qu'il ne veut pas des journalistes ""confortables""","Le président Trump a dit à une salle d'information de la Maison-Blanche qu'il n'a pas gagné d'espace pour les journalistes, disant qu'il ne voulait pas les rendre confortables.&quot;","Trump的笑话,他不会 建造一个“大,漂亮,美丽的”记者室 因为他不希望记者“舒适”","特朗普总统开玩笑地告诉一个满载白宫简报室,他赢得了+apos; 扩大了记者的空间, 说他不想要让他们 & qut; comfortable. & quot;"
78,Luigi Mangione defense shared same records they claimed constituted privacy violation: prosecutors,Prosecutors deny HIPAA violation allegations in Luigi Mangione case after defense accused Manhattan DA&apos;s office of fraudulent subpoena for health insurance information.,Luigi Mangione Verteidigung teilte dieselben Aufzeichnungen sie behaupteten konstituiert Privatsphäre Verletzung: Staatsanwälte,Staatsanwaltschaft verweigert HIPAA Verletzung Vorwürfe in Luigi Mangione Fall nach Verteidigung beschuldigt Manhattan DA&apos;s Büro der betrügerischen Vorladung für Krankenversicherung Informationen.,La defensa de Luigi Mangione compartió los mismos registros que alegaron que constituían una violación de la privacidad: fiscales,Los fiscales niegan las acusaciones de violación de HIPAA en el caso Luigi Mangione después de que la defensa acusara a Manhattan DA&apos; oficina de citación fraudulenta para información del seguro médico.,La défense de Luigi Mangione partageait les mêmes dossiers qu'ils prétendaient constituer une violation de la vie privée: procureurs,Les procureurs rejettent les allégations de violation de l'HIPAA dans l'affaire Luigi Mangione après que la défense a accusé Manhattan DA&apos;s bureau d'assignation frauduleuse pour des informations d'assurance maladie.,Luigi Mangione的辩护律师分享了他们声称构成侵犯隐私的相同记录:检察官。,"检察官否认Luigi Mangione案的HIPAA违规指控,"
79,Sydney Sweeney's Dolly Parton-inspired Western will benefit from ad backlash: expert,Sydney Sweeney channeled Dolly Parton in her new Western &quot;Americana&quot; amid controversy over her American Eagle jeans ad campaign. Experts weighed in on how the drama could impact her career.,Sydney Sweeney's Dolly Parton-inspired Western wird von Ad Backlash profitieren: Experte,"Sydney Sweeney kanalisierte Dolly Parton in ihrem neuen Western &quot;Americana&quot; inmitten von Kontroversen über ihre American Eagle Jeans Werbekampagne. Experten wägten ein, wie das Drama ihre Karriere beeinflussen könnte.",La Dolly Parton Western de Sydney Sweeney se beneficiará de la reacción: experto,Sydney Sweeney canalizó a Dolly Parton en su nuevo Western &quot;Americana&quot; en medio de la controversia sobre su campaña publicitaria de jeans American Eagle. Expertos reflexionaron sobre cómo el drama podría impactar su carrera.,Sydney Sweeney's Dolly Parton-inspired Western bénéficiera de l'ad backlash: expert,Sydney Sweeney a canalisé Dolly Parton dans sa nouvelle Western &quot; Americana&quot; au milieu de la controverse sur sa campagne publicitaire jeans American Eagle. Les experts ont pesé sur la façon dont le drame pourrait influer sur sa carrière.,Sydney Sweeney的Dolly Parton鼓动西方将获益于反弹:专家。,"Sydney Sweeney将Dolly Parton在她的新西部 & qut; Americana & qut; 在她关于美国鹰牛仔裤广告运动的争议中,通过她的新西部 & 夸特; Americana& qut; 中传递给Dolly Parton。 专家们权衡了戏剧如何影响她的职业生涯。"
80,"Hostility against churches a 'growing trend,' as study finds hundreds of attacks on U.S. churches in 2024","New report finds church hostility remains high with over 400 incidents in 2024, including vandalism, gun violence and arson attacks across the United States.","Feindseligkeit gegen Kirchen eine ""zunehmende Tendenz"", wie Studie findet Hunderte von Angriffen auf US-Kirchen im Jahr 2024","Der neue Bericht stellt fest, dass die Feindseligkeit der Kirche mit über 400 Zwischenfällen im Jahr 2024 hoch bleibt, darunter Vandalismus, Waffengewalt und Brandstiftungsangriffe in den Vereinigten Staaten.","La hostilidad contra las iglesias es una 'tendencia creciente', ya que el estudio encuentra cientos de ataques contra las iglesias estadounidenses en 2024","Un nuevo informe revela que la hostilidad de la iglesia sigue siendo alta con más de 400 incidentes en 2024, incluyendo vandalismo, violencia con armas e incendios provocados en Estados Unidos.","L'hostilité contre les églises est une 'tendance croissante', comme l'étude trouve des centaines d'attaques contre les églises américaines en 2024","Selon un nouveau rapport, l'hostilité des Eglises reste élevée avec plus de 400 incidents en 2024, y compris le vandalisme, la violence armée et les incendies à travers les États-Unis.","研究发现2024年数百起攻击美国教堂的事件,","新报告发现,教会的敌意仍然很高,2024年发生了400多起事件,包括美国各地的破坏、枪支暴力和纵火袭击。"
81,Seventh Cincinnati assault suspect arrested over violent beatdown,"Seventh arrest made in Cincinnati downtown beatdown that went viral after injuring six people, with Gregory Wright facing riot and assault charges.",Siebter Cincinnati-Angriffsverdächtiger wegen gewaltsamen Verprügelns verhaftet,"Siebte Verhaftung in Cincinnati Downtown Beatdown, die virale ging, nachdem sechs Menschen verletzt, mit Gregory Wright vor Aufruhr und Angriffen.",Séptimo sospechoso de asalto de Cincinnati arrestado por una violenta paliza,"Séptimo arresto en el centro de Cincinnati que se volvió viral después de herir a seis personas, con Gregory Wright enfrentando cargos por disturbios y asaltos.",Septième agression de Cincinnati suspect arrêté pour coups violents,"Septième arrestation à Cincinnati au centre-ville qui est devenue virale après avoir blessé six personnes, Gregory Wright faisant face à des accusations d'émeute et d'agression.",因暴力殴打被捕的第七名辛辛那提袭击嫌疑人,"在辛辛那提市中心发生的第七起逮捕事件在六人受伤后,"
82,Biopolis – into the microbiome,"A young scientist explores the human microbiome in a part-science, part-fiction audio series. Podcastmaker Michiel van Poelgeest follows Dr. Theda Bartolomaeus from the Max Delbrück Center on her quest to decode the microbes within us. (5 episodes)
<p></p>
  <img alt=""Theda Bartolomaeus"" height=""200"" src=""https://www.mdc-berlin.de/system/files/styles/mdc_inline_small_mdc_phablet_1x/private/2025-07/rn_image_picker_lib_temp_7c0c8b45-42be-48ad-b853-cbeef4a8bc06.jpg?h=4521fff0&amp;itok=EjrYGyxS"" width=""320"" />



<p></p>
<p><a href=""https://springcast.app/biopolis-into-the-microbiome""><strong>Podcast website</strong></a></p><p><a href=""https://podcasts.apple.com/de/podcast/biopolis-into-the-microbiome/id1822739797"">Biopolis at Apple Podcasts</a></p>
<p></p>

<p></p>",Biopolis – ins Mikrobiom,"Ein junger Wissenschaftler erforscht das Mikrobiom in einer Teil-Wissenschaft, Teil-Fiction-Audioserie. Podcastmaker Michiel van Poelgeest folgt Dr. Theda Bartolomaeus vom Max-Delbrück-Zentrum auf ihrer Suche nach der Dekodierung der Mikroben in uns. (5 Episoden) <p></p> <img alt=""Theda Bartolomaeus"" Höhe=""200"" src=""https://www.mdc-berlin.de/system/files/styles/mdc_inline_smmdc_phablet_1x/private/2025-07/rn_image_picker_lib_temp_7c0c8b45-42be-48ad-b853-cbeef4a8bc06.jpg?h=4521fff0&amp;itok=EjrYGyxS"" Breite <p><p>*p>Href/dcast/appotyp><p>",Biopolis – en el microbioma,"Un joven científico explora el microbioma humano en una serie de audio de parte-ciencia, de parte-ficción. Podcastmaker Michiel van Poelgeest sigue a la Dra. Theda Bartolomeus del Centro Max Delbrück en su búsqueda de decodificar los microbios dentro de nosotros. (5 episodios) <pÃ3s/p> <img alt=""Theda Bartolomeus"" thigh=""200"" src=""https://www.mdc-berlin.de/system/files/styles/mdc_inline_small_mdc_phablet_1x/privado/2025-07/rn_image_picker_lib_temp_7c0c8b45-42be-48ad-b853-cbeef4a8bc06.jp?h=4521fff&amp;itok=EjrYGyxS"" ancho=""320/p/pmefÃ3cÃ3",Biopolis – dans le microbiome,"Un jeune scientifique explore le microbiome humain dans une série audio en partie scientifique, en partie fiction. Podcastmaker Michiel van Poelgeest suit la Dre Theda Bartolomaeus du Centre Max Delbrück dans sa quête de décoder les microbes en nous. (5 épisodes) <p></p> <img alt=""Theda Bartolomaeus"" height=""200"" src=""https://www.mdc-berlin.de/system/files/styles/mdc_inline_small_mdc_phablet_1x/private/2025-07/rn_image_picker_lib_temp_7c0c8b45-42be-48ad-b853-cbeef4a8bc06.jpg?h=4521fff0&amp;itok=EjrYGyxS"" width=""320"" /> <p> <p><a href><p>https://springcast.gov><p><p><p><p><p><p><p><p>",Biopolis — — 进入微生物,"一位年轻的科学家在部分科学、部分虚构的音频系列中探索人类微生物。来自Max Delbrück中心的Podcacardmaker Michiel van Poelgeest博士追随Max Delbrück中心的Theda Bartolomaeus 试图解码我们体内的微生物。 (5个片段) <p/p> <img alt=""Theda Bartomaeus"" 高度=""200"" src="" https://www.mdc-berlin.de/ systems/fiscles/mdlines/ styms_indc_indc_1x_puty_p_x/privilal/2025-07/rn_image_parter_lib_lib_temp_7c8b45-42be-48ad-b853-cbefwefe4,a8c06.jpg?h=4521fff0 &amp;itok=eokok=Ejorks=EjryrYYGydxS_podS_pop=_p_pop=30_ma_ma_ma_ma_ma_ma_ma_max_tocast_ma_tocasts/ misal_tocasto_ma_ma_ma_ma_ma_ma_tocastoal_tocast."
