,title-en,content-en,title-de,content-de,title-es,content-es,title-fr,content-fr,title-zh,content-zh
68,"Chicago residents call Obama Presidential Center a 'monstrosity,' fear they'll be displaced: report","Chicago community leaders and longtime residents say the Obama Presidential Center risks washing away the neighborhood’s fabric, warning that proposed luxury developments tied to the project could price out families who have long called the South Side home.","Die Einwohner von Chicago nennen Obama Presidential Center eine 'Monstrosität', die Angst, dass sie vertrieben werden: Bericht","Chicago Gemeindeleiter und langjährige Einwohner sagen, dass das Obama Presidential Center riskiert, die Nachbarschaft wegzuwaschen, Stoff, Warnung, dass vorgeschlagene Luxus-Entwicklungen an das Projekt gebunden könnte Familien, die lange die South Side Haus genannt haben, preisen.","Los residentes de Chicago llaman al Centro Presidencial Obama una ""monstruosidad"", y temen ser desplazados: informe","Líderes de la comunidad de Chicago y residentes de larga data dicen que el Centro Presidencial Obama corre el riesgo de lavar el tejido del vecindario, advirtiendo que los proyectos de lujo propuestos vinculados al proyecto podrían costar más que las familias que llevan mucho tiempo llamando hogar del South Side.","Les résidents de Chicago appellent Obama Presidential Center une « monstruosité », la peur qu'ils soient déplacés: rapport","Les dirigeants de la communauté de Chicago et les résidents de longue date disent que le Obama Presidential Center risque de laver le tissu du quartier, avertissant que les projets de développements de luxe liés au projet pourraient coûter aux familles qui ont longtemps appelé la maison South Side.","芝加哥居民称奥巴马总统中心为“怪物”,","芝加哥社区领袖及长期居民都说奥巴马总统中心可能会洗劫邻居的衣物, 警告说与该项目挂钩的奢侈发展计划可能会让长期称为南区家庭的家庭出价。"
69,"Cutting out alcohol and medicating sooner could prevent 'silent killer,' experts say","Health experts urge earlier blood pressure treatment to prevent heart disease, as well as cutting out alcohol, as new guidelines focus on comprehensive risk factors.","Alkohol ausschneiden und früher meditieren könnte ""schweigender Killer"" verhindern, sagen Experten","Gesundheitsexperten fordern eine frühere Blutdruckbehandlung, um Herzerkrankungen zu verhindern, sowie Alkohol abzubauen, da sich neue Richtlinien auf umfassende Risikofaktoren konzentrieren.","Cortar el alcohol y medicar antes podría prevenir 'asesino silencioso', dicen los expertos","Los expertos en salud instan a un tratamiento de presión arterial más temprano para prevenir enfermedades cardíacas, así como la reducción del alcohol, ya que las nuevas directrices se centran en factores de riesgo integrales.","Réduire l'alcool et la médication plus tôt pourrait prévenir le ""tueur silencieux"", disent les experts","Les experts de la santé préconisent un traitement plus précoce de la pression artérielle afin de prévenir les maladies cardiaques et d'éliminer l'alcool, car les nouvelles lignes directrices mettent l'accent sur des facteurs de risque complets.","专家说,早点戒酒和戒毒可以防止“沉默杀手”的“沉默杀手”","卫生专家敦促及早进行血压治疗,以防止心脏病,并根除酒精,因为新的准则侧重于全面风险因素。"
70,Do you trust a system that's failing at education to handle your child's mental health?,Mandatory tablet-based mental health assessments for students in grades 3-12 will begin in 2027-2028 school year under Illinois Gov. J.B. Pritzker.,"Vertrauen Sie einem System, das bei der Erziehung versagt, um mit der psychischen Gesundheit Ihres Kindes umzugehen?",Obligatorische tablettenbasierte Beurteilungen der psychischen Gesundheit für Schüler der Klassen 3-12 beginnen im Schuljahr 2027-2028 unter Illinois Gov. J.B. Pritzker.,¿Confía en un sistema que está fallando en la educación para manejar la salud mental de su hijo?,Las evaluaciones obligatorias de salud mental basadas en tabletas para los estudiantes de los grados 3-12 comenzarán en el año escolar 2027-2028 bajo Illinois Gov. J.B. Pritzker.,Faites-vous confiance à un système qui ne s'occupe pas de la santé mentale de votre enfant à l'école?,"Les évaluations obligatoires de la santé mentale basées sur des comprimés pour les élèves de la 3e à la 12e année commenceront en 2027-2028, sous le gouvernement de l'Illinois, J.B. Pritzker.",你相信一个在教育上失败的系统 能处理你孩子的心理健康吗?,"在伊利诺伊州政府J.B. Pritzker领导下,对3-12年级学生的强制性甲板心理健康评估将于2027-2028学年开始。"
71,"Trump offers 'assurance' of no US troops in Ukraine, believes Putin-Zelenskyy meeting will happen",Trump pledges no U.S. troops will defend Ukraine&apos;s border and plans Putin-Zelenskyy meeting as part of ongoing peace efforts to end the war between Russia and Ukraine.,"Trump bietet 'Versicherung' von keinen US-Truppen in der Ukraine, glaubt Putin-Zelenskyy Treffen stattfinden wird","Trump verspricht, dass keine US-Truppen die Ukraine & Apos verteidigen werden;s Grenze und plant Putin-Zelenskyy Treffen als Teil der laufenden Friedensbemühungen, um den Krieg zwischen Russland und der Ukraine zu beenden.","Trump ofrece ""aseguramiento"" de que no hay tropas estadounidenses en Ucrania, cree que la reunión Putin-Zelenskyy sucederá",Trump promete que ninguna tropa estadounidense defenderá la frontera entre Ucrania y Ucrania y planea una reunión entre Putin y Zelensky como parte de los esfuerzos de paz en curso para poner fin a la guerra entre Rusia y Ucrania.,"Trump offre l'assurance qu'il n'y aura pas de troupes américaines en Ukraine, pense que la réunion Poutine-Zelenskyy aura lieu.",Trump promet qu'aucune armée américaine ne défendra l'Ukraine et qu'elle prévoit une rencontre entre Poutine et Zelensky dans le cadre des efforts de paix en cours pour mettre fin à la guerre entre la Russie et l'Ukraine.,"特朗普为在乌克兰的美军提供“保证”,","Trump没有保证美国军队将保卫乌克兰和阿波斯;边界和计划普京-泽伦斯基会议,作为正在进行的结束俄罗斯和乌克兰之间战争的和平努力的一部分。"
72,"Conservative roadmap targets Medicaid, student loans for Trump's 'big, beautiful' sequel",A conservative think tank is circulating a memo to GOP lawmakers with recommendations for a second budget reconciliation bill.,"Konservative Roadmap zielt auf Medicaid, Studentendarlehen für Trumps ""große, schöne"" Fortsetzung",Ein konservativer Think Tank zirkuliert ein Memo an GOP-Gesetzgeber mit Empfehlungen für eine zweite Budget-Aussöhnungsrechnung.,"La hoja de ruta conservadora apunta a Medicaid, préstamos estudiantiles para la secuela ""grande y hermosa"" de Trump",Un grupo de expertos conservador está distribuyendo una nota a los legisladores del Partido Republicano con recomendaciones para un segundo proyecto de ley de conciliación presupuestaria.,"La feuille de route conservatrice cible Medicaid, prêts étudiants pour la suite « grande, belle » de Trump",Un groupe de réflexion conservateur distribue une note aux législateurs du GOP avec des recommandations pour un deuxième projet de loi de rapprochement budgétaire.,"保守的路线图目标 医疗补助,学生贷款 特朗普的'大,美丽的'续集","保守的智囊团正在向政府立法者分发备忘录,"
73,Tourists warned of rabies risk after bats infest cabins at national park,Health officials are sounding the alarm after hundreds of people were potentially exposed to rabies while staying in cabins at Grand Teton National Park.,"Touristen vor Tollwut Risiko gewarnt, nachdem Fledermäuse befallen Hütten im Nationalpark","Gesundheitsbeamte alarmieren, nachdem Hunderte von Menschen möglicherweise Tollwut ausgesetzt waren, während sie in Kabinen im Grand Teton National Park waren.",Los turistas advirtieron del riesgo de rabia después de que los murciélagos infestan cabañas en el parque nacional,Los funcionarios de salud están haciendo sonar la alarma después de que cientos de personas estuvieron potencialmente expuestas a la rabia mientras se alojaban en cabañas en el Parque Nacional Grand Teton.,Les touristes avertis du risque de rage après les cabanes infestées de chauves-souris dans le parc national,Les responsables de la santé sonnent l'alarme après que des centaines de personnes aient été exposées à la rage pendant qu'elles séjournaient dans des cabines du parc national Grand Teton.,"国家公园蝙蝠肆虐小屋后, 被警告有狂犬病风险的游客","数以百计的人在Grand Teton国家公园的木屋中可能接触狂犬病,"
74,Funeral scheduled in Ireland for bikini designer Martha Nolan found dead on Montauk yacht,"Funeral arrangements announced for Martha Nolan, 33-year-old Irish fashion designer found dead on yacht in Montauk, with Mass scheduled in Ireland",Funeral in Irland geplant für Bikini Designer Martha Nolan tot auf Montauk Yacht gefunden,"Bestattung für Martha Nolan, 33-jährige irische Modedesignerin, die auf der Yacht in Montauk tot aufgefunden wurde, angekündigt, wobei die Messe in Irland geplant war",Funeral programado en Irlanda para la diseñadora de bikini Martha Nolan encontrado muerto en yate Montauk,"Arreglos fúnebres anunciados para Martha Nolan, diseñadora de moda irlandesa de 33 años encontrada muerta en un yate en Montauk, con Mass programada en Irlanda",Funérailles prévues en Irlande pour la créatrice de bikini Martha Nolan retrouvée morte sur le yacht Montauk,"Des arrangements funéraires ont été annoncés pour Martha Nolan, une créatrice irlandaise de 33 ans retrouvée morte sur un yacht à Montauk, la messe étant prévue en Irlande.","爱尔兰计划为比基尼设计师Martha Nolan举行葬礼,","为Martha Nolan宣布的葬礼安排, 33岁的爱尔兰时装设计师Martha Nolan在蒙陶克的游艇上被发现死亡,"
75,Chiefs' Xavier Worthy reacts after Taylor Swift reveals how excited she was team drafted him,Kansas City Chiefs star Xavier Worthy responded to Taylor Swift&apos;s reaction when she found out the team drafted the former Texas Longhorns standout.,"Chiefs' Xavier Worthy reagiert, nachdem Taylor Swift enthüllt, wie aufgeregt sie war Team eingezogen ihn","Der Kansas City Chiefs-Star Xavier Worthy reagierte auf Taylor Swift&apos, als sie herausfand, dass das Team den ehemaligen Texas Longhorns-Stand herauszog.",Xavier Worthy de los jefes reacciona después de Taylor Swift revela lo emocionado que estaba el equipo lo reclutó,"La estrella de Kansas City Chiefs, Xavier Worthy, respondió a la reacción de Taylor Swift&apos cuando descubrió que el equipo reclutó a los ex Longhorns de Texas.",Xavier Worthy des chefs réagit après que Taylor Swift ait révélé à quel point elle était excitée à l'équipe qui l'a repêché.,"La star des chefs de Kansas City, Xavier Worthy, a répondu à la réaction de Taylor Swift&apos lorsqu'elle a découvert que l'équipe avait rédigé l'ancien numéro du Texas Longhorns.",在泰勒·斯威夫特透露她是如何兴奋的团队把他征召入伍后 酋长Xavier Worthy的反应,堪萨斯市首府的明星Xavier Worthy回应Taylor Swift&apos;
76,Veteran who served in Middle Eastern wars launches campaign against Sen. Susan Collins,Combat veteran Graham Platner enters 2026 Senate race as Democrat challenging Republican Susan Collins in Maine with focus on healthcare and veterans.,"Veteran, der in Nahost-Kriegen diente, startet Kampagne gegen Sen. Susan Collins",Kampfveteran Graham Platner tritt 2026 Senat Rennen als Demokrat Herausforderung Republikanerin Susan Collins in Maine mit Fokus auf Gesundheit und Veteranen.,Veterano que sirvió en las guerras del Medio Oriente lanza campaña contra la Senadora Susan Collins,El veterano de combate Graham Platner entra en la carrera senatorial de 2026 como demócrata desafiando a la republicana Susan Collins en Maine con enfoque en la salud y veteranos.,Vétéran qui a servi dans les guerres du Moyen-Orient lance une campagne contre Sen. Susan Collins,Le vétéran du combat Graham Platner entre dans la course au Sénat en 2026 en tant que démocrate défiant la républicaine Susan Collins dans le Maine avec l'accent sur les soins de santé et les anciens combattants.,曾在中东战争中服役的老兵 向森·苏珊·柯林斯宣战,"格莱厄姆·普拉特纳(Graham Platner)参加2026年参议院竞选, 成为民主党人, 挑战缅因州的共和党人苏珊·柯林斯,"
77,Alicia Silverstone reveals fame 'didn't feel as fun' anymore during her Hollywood career break,"Alicia Silverstone explains why she took a break from acting after her &apos;90s fame, saying it &quot;didn&apos;t feel as fun&quot; and led her to focus on activism and motherhood.",Alicia Silverstone offenbart Ruhm 'hat sich nicht mehr als Spaß' während ihrer Hollywood-Karriere Pause,"Alicia Silverstone erklärt, warum sie sich nach ihrem Ruhm in den 90er Jahren eine Pause von ihrem Schauspiel genommen hat, indem sie sagte, dass es &quot;didn&apos;t sich als fun&quot; und sie dazu veranlasste, sich auf Aktivismus und Mutterschaft zu konzentrieren.",Alicia Silverstone revela que la fama ya no se sentía tan divertida durante su descanso profesional en Hollywood,"Alicia Silverstone explica por qué se tomó un descanso de actuar después de su fama de &apos;90s, diciendo que &quot;didn&apos;t se siente como divertido&quot; y la llevó a centrarse en el activismo y la maternidad.",Alicia Silverstone révèle la célébrité 'ne se sent plus comme amusante' lors de sa pause de carrière à Hollywood,"Alicia Silverstone explique pourquoi elle a pris une pause d'agir après sa renommée des années 90, en disant qu'elle se sentait amusante et qu'elle se concentrait sur l'activisme et la maternité.",Alicia Silverstone在她好莱坞职业生涯中断时 透露了名声 '不再觉得好玩',"Alicia Silverstone 解释了为什么她在 &apos; 90年代的名声后停止演戏, 说这是 & qut; didn&apos; 觉得自己是有趣的 & quot; 并导致她关注积极性和母性。"
78,Rubio hails Trump as 'only leader in the world' who can broker Ukraine peace deal after talks,"Secretary of State Marco Rubio praises Trump&apos;s &quot;unprecedented&quot; progress on Ukraine peace talks, while bashing former Biden admin for giving Ukraine weapons.","Rubio ruft Trump als ""nur Führer in der Welt"" auf, der den Ukraine-Friedensdeal nach Gesprächen vermitteln kann","Außenminister Marco Rubio lobt Trump&apos;s &quot;unvorhergesehene&quot; Fortschritte bei den Friedensgesprächen in der Ukraine, während er den ehemaligen Biden-Admin für die Gewährung von Waffen in der Ukraine missbilligt.","Rubio saluda a Trump como ""único líder en el mundo"" que puede negociar un acuerdo de paz con Ucrania después de las conversaciones","El Secretario de Estado Marco Rubio elogia a Trump&apos;s &quot;sin precedentes&quot; los avances en las conversaciones de paz de Ucrania, mientras golpeaba al ex administrador de Biden por darle armas a Ucrania.",Rubio salue Trump comme «seul leader dans le monde» qui peut négocier un accord de paix avec l'Ukraine après les pourparlers,"Le secrétaire d'État Marco Rubio loue Trump&apos;s &quot;unprecedented&quot; progrès sur les pourparlers de paix en Ukraine, tout en bassant l'ancien administrateur Biden pour avoir donné des armes à l'Ukraine.","鲁比奥欢迎特朗普(Trumps)成为“世界上唯一的领袖”,","国务卿Marco Rubio赞美Trump&apos;s & quot;s; uncececeed & quot; 乌克兰和平谈判的进展, 并抨击前拜登行政官给予乌克兰武器。"
79,Ex-LSU coach makes bold Arch Manning comparison ahead of Texas' 1st game of 2025,Former LSU Tigers head coach Ed Orgeron said in a recent interview that Texas Longhorns quarterback Arch Manning reminded him of Joe Burrow.,Ex-LSU Trainer macht mutigen Arch Manning Vergleich vor Texas' 1. Spiel von 2025,"Der ehemalige Cheftrainer von LSU Tigers, Ed Orgeron, sagte in einem Interview, dass ihn der texanische Quarterback Arch Manning an Joe Burrow erinnerte.",Ex entrenador de LSU hace una comparación audaz de Arch Manning antes del primer juego de Texas de 2025,"El ex entrenador de LSU Tigers, Ed Orgeron, dijo en una entrevista reciente que el quarterback de Texas Longhorns Arch Manning le recordó a Joe Burrow.",L'ex-entraîneur LSU fait une comparaison audacieuse avec Arch Manning avant le 1er match du Texas de 2025,L'ancien entraîneur-chef des Tigres de LSU Ed Orgeron a déclaré dans une interview récente que le quart-arrière du Texas Longhorns Arch Manning lui rappelait Joe Burrow.,前LSU教练在2025年得克萨斯第一场比赛之前 进行大胆的Arch Manning比对,"前SU虎队总教练Ed Orgeron在最近的采访中说,德州长角四分卫Arch Manning让他想起Joe Burrow。"
80,"Joy Reid claims 'mediocre White men' like Trump, Elvis can't 'invent anything,' steal culture from other races","Joy Reid argued that White people cannot create culture independently, and they have historically relied on appropriating achievements from Black and Brown communities across America.","Joy Reid behauptet, ""mittelmäßige weiße Männer"" wie Trump, Elvis kann nichts ""erfinden"", Kultur von anderen Rassen stehlen","Joy Reid argumentierte, dass Weiße nicht unabhängig Kultur schaffen können, und sie haben sich historisch auf die Aneignung von Errungenschaften von Black and Brown Communities in ganz Amerika verlassen.","Joy Reid afirma que ""los hombres blancos mediocres"" como Trump, Elvis no puede ""inventar nada"", robar la cultura de otras razas","Joy Reid argumentó que los blancos no pueden crear cultura de forma independiente, e históricamente han confiado en los logros de las comunidades negras y marrones de todo Estados Unidos.","Joy Reid prétend que les hommes blancs comme Trump, Elvis ne peut rien inventer, voler la culture d'autres races",Joy Reid a soutenu que les Blancs ne peuvent pas créer leur propre culture et qu'ils se sont toujours appuyés sur des réalisations appropriantes des communautés noires et brunes partout en Amérique.,"Joy Reid声称“memedicocre White men' 喜欢特朗普,猫王不能'发明任何东西,'偷文化 从其他种族","Joy Reid认为,白人不能独立创造文化,他们历来依赖美国黑人和布朗社区的成果。"
81,Biopolis – into the microbiome,"A young scientist explores the human microbiome in a part-science, part-fiction audio series. Podcastmaker Michiel van Poelgeest follows Dr. Theda Bartolomaeus from the Max Delbrück Center on her quest to decode the microbes within us. (6 episodes)
<p></p>
  <img alt=""Theda Bartolomaeus"" height=""200"" src=""https://www.mdc-berlin.de/system/files/styles/mdc_inline_small_mdc_phablet_1x/private/2025-07/rn_image_picker_lib_temp_7c0c8b45-42be-48ad-b853-cbeef4a8bc06.jpg?h=4521fff0&amp;itok=EjrYGyxS"" width=""320"" />



<p></p>
<p><a href=""https://springcast.app/biopolis-into-the-microbiome""><strong>Podcast website</strong></a></p><p><a href=""https://podcasts.apple.com/de/podcast/biopolis-into-the-microbiome/id1822739797"">Biopolis at Apple Podcasts</a></p>
<p></p>

<p></p>",Biopolis – ins Mikrobiom,"Ein junger Wissenschaftler erforscht das Mikrobiom in einer Teil-Wissenschaft, Teil-Fiction-Audioserie. Podcastmaker Michiel van Poelgeest folgt Dr. Theda Bartolomäus vom Max-Delbrück-Zentrum auf ihrer Suche, die Mikroben in uns zu entschlüsseln. (6 Episoden) <p> </p> <img alt=""Theda Bartolomäus"" Höhe=""200"" src=""https://www.mdc-berlin.de/system/files/styles/mdc_inline_small_mdc_phablet_1x/private/2025-07/rn_image_picker_lib_temp_7c0c8b45-42be-48ad-b853-cbeef4a8bc06.jpg?h=4521fff0&amp;itok=EjrYGyxS"" Breite <p><p>*p>eine href><p-cast/appotyp><pform/form/form/form/form/form/form/>",Biopolis – en el microbioma,"Un joven científico explora el microbioma humano en una serie de audio de parte-ciencia, de parte-ficción. Podcastmaker Michiel van Poelgeest sigue a la Dra. Theda Bartolomeus del Centro Max Delbrück en su búsqueda de decodificar los microbios dentro de nosotros. (6 episodios) <pÃ3s/p> <img alt=""Theda Bartolomeus"" thigh=""200"" src=""https://www.mdc-berlin.de/system/files/styles/mdc_inline_small_mdc_phablet_1x/privado/2025-07/rn_image_picker_lib_temp_7c0c8b45-42be-48ad-b853-cbeef4a8bc06.jp?h=4521fff&amp;itok=EjrYGyxS"" ancho=""320/p/pmefÃ3cÃ3",Biopolis – dans le microbiome,"Un jeune scientifique explore le microbiome humain dans une série audio en partie scientifique, en partie fiction. Le podcastmaker Michiel van Poelgeest suit la Dre Theda Bartolomaeus du Centre Max Delbrück dans sa quête de décoder les microbes en nous. (6 épisodes) <p></p> <img alt=""Theda Bartolomaeus"" height=""200"" src=""https://www.mdc-berlin.de/system/files/styles/mdc_inline_small_mdc_phablet_1x/private/2025-07/rn_image_picker_lib_temp_7c0c8b45-42be-48ad-b853-cbeef4a8bc06.jpg?h=4521fff0&amp;itok=EjrYGyxS"" width=""320"" /> <p> <p><a href><p>https://springcast.org/bio><bn><p><p><p><p>",Biopolis — — 进入微生物,"一位年轻的科学家在部分科学、部分虚构的音频系列中探索人类微生物。来自Max Delbrück中心的Podcacardmaker Michiel van Poelgeest 博士追随Max Delbrück中心的Theda Bartolomeeus, 试图解码我们体内的微生物。 (6个片段) <p/p> <img alt=""Theda Bartomaeus"" 高度=""200"" src="" https://www.mdc-berlin.de/systems/filesm/ sockes/mdcal_inces_mdc_phable_1x/私人2025-07/rn_image_parter_lib_lip_temp_7c8b45-42be-48ad-b853-cbefeef4a8b.06.jpg?h=4521fff0&andamp;itok=Eok=Ejorks=EjrgyrYYGyGy-pods_p=""_p_p_p=_ma_toma_ma_ ==_ma_ma_ma_mas_mas_tocastards_ma_tocastemos/ misal_ma_ma_ma_ma_ma_ma_tocastos/ misal_tocastal_mas=网站网站网站网站网站网站网站。http网站。"
82,Growth opportunities through renewable energy: KfW loan benefits German and South African companies,"During her visit to South Africa to attend the G20 Development Ministerial Meeting, Development Minister Reem Alabali Radovan announced an agreement with the South African government today on the expansion of renewable energy in South Africa. A KfW loan of 500 million euros aims to facilitate further reforms to South Africa’s energy sector that will create a conducive environment for private investment.",Wachstumschancen durch erneuerbare Energien: KfW-Darlehen kommt deutschen und südafrikanischen Unternehmen zugute,"Während ihres Besuchs in Südafrika anlässlich des G20-Entwicklungsministertreffens kündigte Entwicklungsminister Reem Alabali Radovan heute ein Abkommen mit der südafrikanischen Regierung über den Ausbau erneuerbarer Energien in Südafrika an. Ein KfW-Darlehen von 500 Millionen Euro zielt darauf ab, weitere Reformen des südafrikanischen Energiesektors zu ermöglichen, die ein förderliches Umfeld für private Investitionen schaffen werden.",Oportunidades de crecimiento a través de la energía renovable: el préstamo de KfW beneficia a las empresas alemanas y sudafricanas,"Durante su visita a Sudáfrica para asistir a la Reunión Ministerial de Desarrollo del G20, la ministra de Desarrollo Reem Alabali Radovan anunció hoy un acuerdo con el gobierno sudafricano sobre la expansión de las energías renovables en Sudáfrica. Un préstamo de 500 millones de euros de KfW tiene como objetivo facilitar nuevas reformas al sector energético de Sudáfrica que crearán un entorno propicio para la inversión privada.",Possibilités de croissance grâce aux énergies renouvelables: les prêts KfW bénéficient aux entreprises allemandes et sud-africaines,"Lors de sa visite en Afrique du Sud pour assister à la réunion ministérielle du G20 sur le développement, la ministre du développement Reem Alabali Radovan a annoncé aujourd'hui un accord avec le gouvernement sud-africain sur l'expansion des énergies renouvelables en Afrique du Sud. Un prêt KfW de 500 millions d'euros vise à faciliter de nouvelles réformes au secteur énergétique sud-africain qui créeront un environnement propice aux investissements privés.",通过可再生能源创造增长机会:KfW贷款使德国和南非公司受益,"在她访问南非出席20国集团发展部长级会议期间,发展部长雷姆·阿拉巴利·拉多万(Reem Alabali Radovan)宣布了今天与南非政府达成的在南非扩大可再生能源的协议。 5亿欧元的KfW贷款旨在推动南非能源部门的进一步改革,为私人投资创造有利环境。"
