,title-es,content-es,title-de,content-de,title-en,content-en
68,"‘Hojicha’, ‘kukicha’ y ‘bancha’: las alternativas sostenibles al té ‘matcha’","Son japoneses, aptos para todas las edades, fáciles de preparar y están hechos con lo que normalmente se descartaría como hojas maduras, tallos y ramitas","Hojicha silber, silbern, silbern und silbern: nachhaltige Alternativen zu Tee silbern","Sie sind Japaner, geeignet für jedes Alter, leicht zubereiten und sind aus dem gemacht, was normalerweise als reife Blätter, Stiele und Zweige ausgeschlossen würde.","‘Hojicha’, ‘kukicha’ and ‘banka’: sustainable alternatives to ‘matcha’ tea","They are Japanese, suitable for all ages, easy to prepare and are made with what would normally be discarded as mature leaves, stems and twigs"
69,Empanadillas de atún como las que hacía tu abuela,"Con huevo duro, aceitunas y salsa de tomate son un clásico absoluto de la cocina de aprovechamiento que puedes preparar en casa",Thunfischbällchen wie deine Großmutter.,"Mit hartem Ei, Oliven und Tomatensoße sind ein absoluter Klassiker der Verwertungsküche, die Sie zu Hause vorbereiten können",Tuna empanadillas like your grandmother used to make.,"With hard egg, olives and tomato sauce are an absolute classic of the kitchen you can make at home"
70,"Taylor Swift anuncia que lanzará un nuevo disco, ‘The Life of a Showgirl’","La noticia la ha dado la megaestrella del pop en el ‘podcast’ de su novio, el jugador de fútbol estadounidense Travis Kelce","Taylor Swift kündigt an, dass er eine neue Scheibe starten wird, ""The Life of a Showgirl Houten""",Die Nachricht wurde von der Pop-Mega-Star auf dem Podcast-Freund seines amerikanischen Footballspielers Travis Kelce gegeben.,"Taylor Swift announces to release a new album, ‘The Life of a Showgirl’","The news was given by the pop megastar in the podcast of her boyfriend, American football player Travis Kelce"
71,Restricción de agua y pensamientos obsesivos con la comida: Orlando Bloom cuenta cómo perdió 14 kilos en tres meses para ‘The Cut’,"El actor, que recientemente hizo oficial el fin de su relación sentimental con Katy Perry, ha detallado las partes más duras de su transformación física para encarnar a un boxeador en la película de Sean Ellis","Einschränkung des Wassers und zwanghafte Gedanken mit dem Essen: Orlando Bloom erzählt, wie er 14 Kilo in drei Monaten verloren hat, um den Cut Houten","Der Schauspieler, der vor kurzem das Ende seiner sentimentalen Beziehung mit Katy Perry offiziell gemacht hat, hat die härtesten Teile seiner physischen Transformation beschrieben, um einen Boxer in Sean Ellis' Film zu verkörpern.",Water restriction and obsessive thoughts on food: Orlando Bloom tells how he lost 14 kilos in three months for ‘The Cut’,"The actor, who recently made official the end of his sentimental relationship with Katy Perry, has detailed the hardest parts of his physical transformation to embody a boxer in Sean Ellis' film"
72,Detenidos dos jóvenes de 18 años relacionados con el robo en casa de Brad Pitt en Los Ángeles,La policía cree que los sospechosos forman parte de un grupo que asaltó varias viviendas en el sur de California,Zwei 18-jährige verhaftet wegen Diebstahls bei Brad Pitt in Los Angeles,"Die Polizei glaubt, dass Verdächtige Teil einer Gruppe sind, die mehrere Häuser in Südkalifornien überfallen hat.",Two 18-year-olds arrested in connection with Brad Pitt's house robbery in Los Angeles,Police believe suspects are part of a group that raided several homes in Southern California
73,Un amor de verano de... Miren Iza (Tulsa): ‘Un deseo autoritario y radical’,La música escribe sobre un viaje de amigas con la promesa de vivir tantas aventuras como fuera posible,Eine Sommerliebe von... Siehe Iza (Tulsa): Ein autoritärer und radikaler Wunsch,"Musik schreibt über eine Freundin Reise mit dem Versprechen, so viele Abenteuer wie möglich zu leben",A summer love of... Look at Iza (Tulsa): ‘An authoritarian and radical desire’,Music writes about a friend trip with the promise of living as many adventures as possible
74,Aesop o el fenómeno de los jabones de lujo asequibles que transforman tu baño en una experiencia más elegante,Mantén tus manos limpias y cuidadas cada día con este jabón (y descubre su versión low cost),"Aesop oder das Phänomen der erschwinglichen Luxus Seifen, die Ihr Badezimmer in ein eleganteres Erlebnis verwandeln",Halten Sie Ihre Hände sauber und gepflegt jeden Tag mit dieser Seife (und entdecken Sie Ihre Version low cost),Aesop or the phenomenon of affordable luxury soaps that transform your bathroom into a more elegant experience,Keep your hands clean and careful every day with this soap (and discover its low cost version)
75,Relatos de la cárcel: También hay condena para los se quedan fuera,"Elena, Verónica y Adolfo, familiares de presos, han tenido que adaptar su vida y su economía a su familiar ingresado en el centro penitenciario de Valdemoro","Gefängnisberichte: Es ist auch eine Strafe für die, die draußen bleiben.","Elena, Veronica und Adolfo, Familienangehörige von Häftlingen, mussten ihr Leben und ihre Wirtschaft an ihre Familie anpassen, die in das Gefängnis in Valdemoro eingeliefert wurde.",Stories from the Prison: There is also a sentence for those who stay outside,"Elena, Verónica and Adolfo, relatives of prisoners, have had to adapt their lives and their economy to their family members admitted to Valdemoro Prison"
76,Los ‘refugiados’ de Trump se instalan en España: “No vamos a volver a Estados Unidos”,EL PAÍS recoge las historias de varias familias norteamericanas llegadas ante la deriva del país y la pérdida de libertades: “Las cosas se están poniendo feas”,Trumps Flüchtlinge werden in Spanien installiert: Wir werden nicht nach Amerika zurückkehren.,"DAS LAND sammelt die Geschichten mehrerer amerikanischer Familien, die vor dem Abgleiten des Landes und dem Verlust von Freiheiten angekommen sind: Die Dinge werden hässlich.",Trump’s ‘refugees’ settle in Spain: “We’re Not Going Back to the United States”,THE COUNTRY gathers the stories of several American families coming to the country’s drift and the loss of freedoms: “Things are getting ugly”
77,"Los españoles tienen una ‘deuda de sueño’: insomnio, fármacos y fatiga en un país que no descansa bien","Mientras Francia lanza una estrategia pionera para abordar el problema como una epidemia, España encabeza el consumo mundial de benzodiacepinas y casi la mitad de la población duerme mal","Die Spanier haben eine Schlafschuld: Schlaflosigkeit, Medikamente und Müdigkeit in einem Land, das nicht gut ruht","Während Frankreich eine Pionierstrategie auf den Weg bringt, um das Problem als Epidemie anzugehen, führt Spanien den weltweiten Konsum von Benzodiazepinen an und fast die Hälfte der Bevölkerung schläft schlecht","Spanish people have a ‘sleep debt’: insomnia, drugs and fatigue in a country that doesn’t rest well","While France launches a pioneering strategy to address the problem as an epidemic, Spain leads the global consumption of benzodiazepines and almost half the population sleeps badly"
78,Hijos de inmigrantes que se han convertido en referentes en una sociedad que se resiste a representar su diversidad,"El Chojin, Hiba Abouk, Ouyang Zhu, Delarue... Sus padres llegaron a España desde América Latina, China o África. Se han hecho un hueco en el mundo de la gastronomía, la música, la moda, el cine o la literatura. Muchos crecieron sin referentes que no fueran blancos. Esperan que a los de la siguiente generación no les suceda lo mismo","Kinder von Einwanderern, die sich in eine Gesellschaft verwandelt haben, die sich weigert, ihre Vielfalt zu repräsentieren","Chojin, Hiba Abouk, Ouyang Zhu, Delarue... Ihre Eltern kamen aus Lateinamerika, China oder Afrika nach Spanien. Sie haben sich in der Welt der Gastronomie, Musik, Mode, Kino oder Literatur eine Lücke gemacht. Viele wuchsen, ohne dass sie nicht weiß waren.",Children of immigrants who have become referents in a society that resists representing its diversity,"El Chojin, Hiba Abouk, Ouyang Zhu, Delarue... His parents came to Spain from Latin America, China or Africa. They have made a hole in the world of gastronomy, music, fashion, cinema or literature. Many grew up without references that were not white. They hope that those of the next generation will not happen the same."
79,EE UU prorroga 90 días el plazo para un acuerdo con China sobre aranceles,La ampliación evita una subida de gravámenes al 145% para los productos chinos y al 125% para los estadounidenses,Die USA verlängern die Frist für ein Zollabkommen mit China 90 Tage,Die Erweiterung vermeidet eine Erhöhung der Gebühren auf 145% für chinesische Produkte und auf 125% für Amerikaner,US extends 90 days deadline for agreement with China on tariffs,Enlargement avoids a 145% increase in charges for Chinese products and 125% for Americans
80,Un juez federal rechaza publicar los registros del gran jurado en el juicio a Ghislaine Maxwell,"El magistrado ha fallado que la documentación no añade nada nuevo sobre el proceso a la cómplice del pederasta Jeffrey Epstein, la única condenada por el caso de tráfico sexual","Ein Bundesrichter lehnt es ab, die Akten der Grand Jury im Prozess an Ghislaine Maxwell zu veröffentlichen.","Der Richter hat versagt, dass die Dokumentation nichts Neues über den Prozess zu der Komplizin des Pädophilen Jeffrey Epstein, die einzige verurteilt durch den Fall des Sexhandels",A federal judge refuses to publish grand jury records at Ghislaine Maxwell's trial.,"The magistrate has ruled that the documentation adds nothing new about the trial to the accomplice of paedophile Jeffrey Epstein, the only one convicted of the sex trafficking case."
81,Rusia supera en drones a Ucrania y consigue su mayor avance en el frente desde 2024,"El ejército invasor se ceba en las líneas logísticas, el talón de Aquiles del ejército ucranio, para conquistar ciudades clave de la provincia de Donetsk",Russland übertrifft in Drohnen in der Ukraine und erreicht seinen größten Vormarsch an der Front seit 2024,"Die Eindringlinge werden in die logistischen Linien, die Achillesferse der ukrainischen Armee gezüchtet, um wichtige Städte der Provinz Donezk zu erobern",Russia overtakes Ukraine in drones and gets its biggest advance on the front line since 2024,"The invading army is fed on the logistics lines, the Achilles heel of the Ukrainian army, to conquer key cities of Donetsk province"
82,"Cáritas, de nuevo en la diana de Vox: la ONG que da atención humanitaria a medio millón de inmigrantes","La organización de la Iglesia católica, con un 70% de sus recursos privados, apoya la regularización extraordinaria de migrantes, a la que se opone el partido de Abascal","Caritas, wieder im Vox-Ziel: Die NRO, die eine halbe Million Einwanderern humanitäre Hilfe gewährt","Die Organisation der katholischen Kirche, mit 70% ihrer privaten Ressourcen, unterstützt die außerordentliche Regularisierung von Migranten, gegen die die Partei Abascal","Caritas, again in the target of Vox: the NGO that provides humanitarian care to half a million immigrants","The organization of the Catholic Church, with 70% of its private resources, supports the extraordinary regularization of migrants, to which the Abascal party opposes"
83,El Ayuntamiento de Xàbia retira el combustible del gran velero encallado ante el silencio del dueño,"El Consistorio ha contratado a una empresa especializada para la descontaminación preventiva del barco, varado desde hace 20 días en la duna fósil del municipio alicantino","Das Rathaus von Xàbia zieht den Treibstoff von dem großen Segelboot, das vor dem Schweigen des Besitzers gestrandet ist","Das Konsistorium hat ein spezialisiertes Unternehmen für die vorbeugende Dekontaminierung von dem Schiff angeheuert, seit 20 Tagen in der Fossildüne von der alicantino Gemeinde gesäumt",The City Council of Xàbia withdraws the fuel of the large sailboat in the silence of the owner,"The Consistory has hired a company specialized for the preventive decontamination of the ship, stranded for 20 days in the fossil dune of the municipality of Alicante"
84,El empresario que financió a Alvise denuncia el asalto a su casa de hombres armados para robarle dos millones de euros en criptomonedas y relojes,"Según aseguró Romillo a la Policía, los cinco asaltantes los amordazaron y maniataron a él y su pareja para sustraerles también joyas y dinero en efectivo","Der Geschäftsmann, der Alvise finanziert hat, verurteilt den Angriff auf sein Haus bewaffneter Männer, um ihm zwei Millionen Euro in Kryptowährungen und Uhren zu stehlen.","Wie Romillo der Polizei versicherte, wurden die fünf Angreifer von ihm und seinem Partner geknebelt und manipuliert, um ihnen auch Schmuck und Bargeld wegzunehmen.",The businessman who financed Alvise denounces the assault on his house of armed men to rob him of two million euros in cryptocurrencies and watches,"According to Romillo to the police, the five assailants gagged and manipulated him and his partner to take away also jewels and cash"
85,La factura de las comunidades por los intereses de la deuda aumentará un 50% hasta 2028,El centro de estudios Fedea estima cuánto crecerá la carga a la luz de la evolución de los tipos de interés y la composición de los pasivos regionales,Die Rechnung der Gemeinschaften für die Zinsen der Schulden wird um 50% bis 2028 erhöht,"Das Studienzentrum Fedea schätzt, wie hoch die Belastung angesichts der Entwicklung der Zinssätze und der Zusammensetzung der regionalen Verbindlichkeiten sein wird.",Communities' bill for debt interest will increase by 50% until 2028,The Fedea study centre estimates how much the burden will grow in light of the evolution of interest rates and the composition of regional liabilities
86,El Gobierno limita el FLA y espolea a las comunidades a financiarse en los mercados,"Hacienda restringe la adhesión al fondo por no haber podido aprobar los objetivos presupuestarios, pero el Estado seguirá financiando a las autonomías",Die Regierung beschränkt die FLA und schmeichelt Gemeinschaften auf die Finanzierung auf den Märkten,"Finanzwesen beschränkt den Beitritt zum Fonds, weil sie die Haushaltsziele nicht erreichen konnten, aber der Staat wird weiterhin die Autonomie der öffentlichen Hand finanzieren.",Government limits FLA and spurs communities to market finance,"Finance restricts accession to the fund because it has not been able to approve the budgetary objectives, but the State will continue to finance self-governments"
87,El calor afecta a la unidad de oncología de uno de los mayores hospitales de Tenerife: “Esto no es humano”,El Servicio Canario de Salud afirma que se está trabajando para solucionar el problema,Wärme wirkt sich auf die Onkologieeinheit eines der größten Krankenhäuser in Teneriffa aus:,"Der Gesundheitsdienst der Kanarischen Inseln erklärt, dass derzeit an der Lösung des Problems gearbeitet wird",Heat affects the oncology unit of one of the largest hospitals in Tenerife: “This is not human”,The Canary Islands Health Service states that work is under way to solve the problem.
88,Al menos 43 afectados por un brote de salmonelosis en un restaurante de Palma,"Salud Pública ordena el cierre temporal del establecimiento tras detectar deficiencias en la elaboración de las comidas a temperaturas inadecuadas, que han llevado a 12 personas al hospital","Mindestens 43 Personen, die von einem Ausbruch der Salmonellose in einem Restaurant in Palma betroffen sind","Öffentliche Gesundheit ordnet die vorübergehende Schließung des Betriebs an, nachdem Mängel bei der Herstellung von Mahlzeiten bei unzureichenden Temperaturen festgestellt wurden, die 12 Personen ins Krankenhaus gebracht haben.",At least 43 affected by an outbreak of salmonella in a restaurant in Palma,"Public Health orders the temporary closure of the facility after detecting deficiencies in the preparation of meals at inadequate temperatures, which have taken 12 people to the hospital"
89,"Silvia Álava, psicóloga: “El juego es un factor protector de la salud mental en la infancia”",La autora y miembro del Observatorio del Juego Infantil desarrolla la importancia de que los menores disfruten del tiempo al aire libre para mejorar sus habilidades socioemocionales,"Silvia Álava, Psychologin: Das Spiel ist ein Schutzfaktor für die psychische Gesundheit in der Kindheit în","Die Autorin und Mitglied des Kinderspiel-Observatoriums entwickelt, wie wichtig es ist, dass Kinder die Freizeit im Freien genießen, um ihre sozioemotionalen Fähigkeiten zu verbessern","Silvia Álava, psychologist: “The game is a protective factor of mental health in childhood”",The author and member of the Children's Play Observatory develops the importance of children enjoying outdoor time to improve their socio-emotional skills
90,El palestino que defendió su tesis de la Universidad del País Vasco desde Cisjordania: “Estudiar puede ser una forma de resistencia”,"Qasem Budair, de 30 años, relata la odisea de investigar en medio de la violencia, la represión y los apagones: “el miedo diario es agotador”","Der Palästinenser, der seine Dissertation von der Universität des Baskenlandes aus dem Westjordanland verteidigte: Studieren kann eine Form des Widerstands sein","Qasem Budair, 30 Jahre alt, erzählt die Odyssee der Untersuchung inmitten von Gewalt, Unterdrückung und Stromausfällen: Die tägliche Angst ist ermüdend",The Palestinian who defended his thesis from the University of the Basque Country from the West Bank: “Study can be a form of resistance”,"30-year-old Qasem Budair recounts the odyssey of investigating in the midst of violence, repression and blackouts: “Daily fear is exhausting”"
91,La Junta andaluza rechaza de nuevo los grados de IA e Ingeniería Biomédica en las universidades de Granada y Jaén,"Los rectores califican la decisión de “atropello” y dejan la puerta abierta a futuras movilizaciones, también por el “deficiente” sistema de financiación universitaria",Andalusische Junta lehnt die Grade IA und Biomedizin Engineering an den Universitäten von Granada und Jaén erneut ab,"Die Rektoren bewerten die Entscheidung als ""Terror"" und lassen die Tür für künftige Mobilisierungen offen, auch durch das unzureichende System der Hochschulfinanzierung.",The Andalusian Junta rejects again the grades of AI and Biomedical Engineering in the universities of Granada and Jaén,"The rectors describe the decision as “overroaching” and leave the door open for future mobilizations, also by the “deficient” university funding system"
92,Ayuso lleva al colapso al Consejo Escolar del Estado al retirar de golpe a la mitad de su equipo técnico,"Los tres profesores cuya comisión de servicio ha sido revocada por Madrid suponen la mitad del equipo técnico del organismo estatal. La comunidad lo justifica en su déficit de docentes, pese a tener una plantilla de 60.000","Ayuso führt zum Zusammenbruch des Staatsschulrats, indem er die Hälfte seines technischen Teams mit Putsch zurückzieht.","Die drei Lehrer, deren Abordnung von Madrid aufgehoben wurde, machen die Hälfte des technischen Teams der staatlichen Einrichtung aus. Die Gemeinschaft rechtfertigt dies in ihrem Mangel an Lehrkräften, obwohl sie über 60.000 Mitarbeiter verfügen.",Ayuso leads to the collapse of the State School Council by abruptly withdrawing half of its technical team,"The three professors whose commission of service has been revoked by Madrid represent half of the technical team of the state agency. The community justifies it in its shortage of teachers, despite having a staff of 60,000"
93,"Las Médulas, un paisaje cultural que modelaron los romanos, golpeado por las llamas",La Junta de Castilla y León todavía no ha informado del alcance de los daños en el paraje,"Die Medulas, eine Kulturlandschaft, die die Römer modellierten und von den Flammen getroffen wurden",Die Junta de Castilla y León hat noch nicht über den Umfang der Schäden an der Landschaft berichtet,"The Marrows, a cultural landscape modeled by the Romans, struck by the flames",The Junta de Castilla y León has not yet reported the extent of the damage to the site
94,Primer mes de estreno del Sena: solo 35.000 bañistas y la mitad de los días con bandera roja por contaminación de bacterias,El río de París se convierte a partir de este lunes en uno de los refugios para combatir la ola de calor que empieza en Francia,Erster Monat der Seine-Premiere: nur 35.000 Badegäste und die Hälfte der Tage mit roter Flagge durch Bakterienkontamination,"Der Fluss von Paris wird von diesem Montag zu einem der Zufluchtsorte, um die Hitzewelle zu bekämpfen, die in Frankreich beginnt","First month of Seine premiere: only 35,000 bathers and half the days with red flag due to bacteria contamination",The river of Paris becomes from this Monday one of the refuges to fight the heat wave that begins in France
95,"Jorge Marín, el fotógrafo de los glaciares chilenos: “Hay un deterioro muy grande y se puede palpar”","El autor de un proyecto que retrata el deshielo en ocho puntos de Chile, entre 2022 y 2024, reflexiona sobre el vertiginoso retroceso de estos ecosistemas: “Se habla de políticas, pero los gobiernos no han tomado el peso al sistema glaciar”","Jorge Marin, der Fotograf der chilenischen Gletscher: Es gibt eine sehr große Verschlechterung und kann getadelt werden","Der Autor eines Projekts, das das Schmelzen an acht Punkten in Chile zwischen 2022 und 2024 schildert, überlegt den rasanten Rückgang dieser Ökosysteme: ""Es wird von Politik gesprochen, aber die Regierungen haben das Gletschersystem nicht übernommen.""","Jorge Marín, the photographer of Chilean glaciers: “There is a very large deterioration and you can feel it”","The author of a project that portrays the thaw in eight points in Chile, between 2022 and 2024, reflects on the dizzying retreat of these ecosystems: “We talk about policies, but governments have not taken the weight of the glacier system”"
96,"Sí, hace calor… pero no necesitas una dieta nueva en verano","Respetar el hambre y la saciedad, elegir alimentos frescos y escuchar al cuerpo siguen siendo los pilares de una buena nutrición en la época estival y todo el año","Ja, es ist heiß, aber du brauchst keine neue Diät im Sommer.","Respekt vor Hunger und Saft, wählen Sie frische Lebensmittel und hören den Körper sind immer noch die Säulen einer guten Ernährung in der Sommerzeit und das ganze Jahr über","Yeah, it's hot, but you don't need a new diet in summer.","Respecting hunger and satiety, choosing fresh foods and listening to the body continue to be the pillars of good nutrition in the summer season and throughout the year"
97,El volcán de La Palma no contaminó de forma significativa los plátanos de la isla,"Un estudio ha analizado 55 elementos inorgánicos, ayudando a entender cómo las cenizas pueden pasar a la cadena trófica",Der Vulkan von La Palma hat die Bananen der Insel nicht erheblich verschmutzt,"Eine Studie hat 55 anorganische Elemente analysiert und dabei geholfen zu verstehen, wie die Asche in die trophe Kette gelangen kann.",The volcano of La Palma did not significantly pollute the bananas of the island,"One study has analyzed 55 inorganic elements, helping to understand how ashes can pass into the trophic chain."
98,La “vacuna autoestopista” contra el cáncer logra resultados prometedores en 25 personas,"La inyección, que usa un medio de transporte natural para diseminarse por el cuerpo humano, se ha probado en pacientes con tumor de páncreas o colorrectal",Selbststop-Tumorimpfungen erreichen vielversprechende Ergebnisse bei 25 Personen,"Die Injektion, die ein natürliches Transportmittel benutzt, um sich über den menschlichen Körper zu verbreiten, wurde bei Patienten mit Bauchspeicheldrüsen- oder Kolorektaltumor getestet.",Cancer “Histhopper Vaccine” Achieves Promising Results in 25 People · Global Voices,"The injection, which uses a natural means of transport to spread throughout the human body, has been tested in patients with pancreatic or colorectal tumor."
99,"La IA descubre antibióticos en arqueas, los microorganismos que explican el origen de la vida compleja",Uno de los compuestos arroja resultados equiparables a fármacos utilizados como último recurso en infecciones resistentes a medicamentos existentes,"KI entdeckt Antibiotika in Archeas, Mikroorganismen, die den Ursprung des komplexen Lebens erklären","Eine der Verbindungen liefert Ergebnisse, die mit Arzneimitteln vergleichbar sind, die als letztes Mittel bei Infektionen verwendet werden, die gegen bestehende Arzneimittel resistent sind.","AI discovers antibiotics in archeas, microorganisms that explain the origin of complex life",One of the compounds produces results comparable to drugs used as a last resort in infections resistant to existing drugs
