,title-es,content-es,title-de,content-de,title-en,content-en
70,Paradas imprescindibles de un viaje en tren de Bangkok a Chiang Mai,"Optar por un trayecto con escalas entre ambas ciudades de Tailandia permite conocer la histórica Ayutthaya, el templo de los monos de Lopburi o la belleza de Sukhothai",Unverzichtbare Haltestellen für eine Zugfahrt von Bangkok nach Chiang Mai,"Wählen Sie für einen Spaziergang mit Zwischenlandungen zwischen den beiden Städten von Thailand können Sie die historische Ayutthaya, den Tempel der Affen von Lopburi oder die Schönheit von Sukhothai kennen",Essential stops of a train trip from Bangkok to Chiang Mai,"Choosing a stopover route between the two cities of Thailand allows you to discover the historic Ayutthaya, the temple of the Lopburi monkeys or the beauty of Sukhothai"
71,‘¿Quién lo dice? ¡Calvin Klein!’: cómo ‘Clueless’ se adelantó a los grandes dilemas de la generación Z,"Varias voces relevantes de la generación Z revisitan la comedia adolescente que redefinió los noventa y anticipó obsesiones estéticas, culturales y emocionales que aún resuenan hoy en día","""Wer sagt das?"" ""Calvin Klein!"" ""Wie hat sich Clueless Hill den großen Dilemmas der Z-Generation nähert?""","Mehrere wichtige Stimmen der Z-Generation revidieren die Teenagerkomödie, die die 90er Jahre neu definiert hat, und antizipierten ästhetische, kulturelle und emotionale Besessenheit, die heute noch klingen.",‘Who says so? Calvin Klein!’: how ‘Cluelss’ went ahead of the great dilemmas of the Z generation,"Several relevant voices of the Z generation revisit the teenage comedy that redefined the ninety and anticipated aesthetic, cultural and emotional obsessions that still resonate today"
72,"Celia Padilla, matrona: “Cuando te conviertes en madre no estás perdiendo quién eras, estás evolucionando”","La creadora de contenido publica su primer libro, ‘Oh, la maternidad’, en el que habla del embarazo, el parto y el posparto desde la experiencia de su profesión. Para ella, a pesar de toda la información que existe, no se habla suficiente de la soledad, el agotamiento y el miedo después de dar a luz","Celia Padilla, Hebamme: Wenn du Mutter wirst, verlierst du nicht, wer du bist, dann wirst du dich entwickeln.","Die Content-Schöpferin veröffentlicht ihr erstes Buch, ""Oh, die Mutterschaft,"" in dem sie über Schwangerschaft, Geburt und Postparte aus der Erfahrung ihres Berufs spricht. Für sie, trotz aller Informationen, die es gibt, wird nicht genug über Einsamkeit, Erschöpfung und Angst nach der Geburt gesprochen.","Celia Padilla, midwife: “When you become a mother you are not losing who you were, you are evolving”","The content creator publishes her first book, ‘Oh, motherhood’, in which she speaks of pregnancy, childbirth and postpartum from the experience of her profession. For her, despite all the information that exists, there is not enough talk of loneliness, exhaustion and fear after giving birth."
73,Esta crema coreana con niacinamida y pantenol es perfecta para aliviar las pieles más sensibles,"La crema coreana cuenta con ingredientes para fortalecer la piel, es muy ligera y efectiva y se puede aplicar fácilmente y a diario","Diese koreanische Creme mit Niacinamid und Panthenol ist perfekt, um die empfindlichsten Haut zu lindern","Koreanische Creme hat Zutaten zur Stärkung der Haut, ist sehr leicht und effektiv und kann leicht und täglich angewendet werden",This Korean cream with niacinamide and panthenol is perfect for relieving the most sensitive skins,"Korean cream has ingredients to strengthen the skin, is very light and effective and can be applied easily and daily"
74,El ocaso del veraneo en Italia: las familias ya solo van a la playa el fin de semana,Los tradicionales establecimientos privados de la costa alertan de la crisis de la clase media,Der Sonnenuntergang des Sommers in Italien: Familien gehen am Wochenende nur noch an den Strand,Traditionelle private Küsteneinrichtungen warnen vor der Krise der Mittelschicht,The twilight of the summer in Italy: families go to the beach only on the weekend,Traditional coastal private establishments alert to the middle class crisis
75,"Modelos súper delgadas en los anuncios sí, pero que parezcan saludables","En el Reino Unido tres marcas de moda han tenido que retirar fotos por las protestas de la audiencia, donde se denuncia la glorificación de la delgadez extrema. En España no hay tantas reclamaciones, pero una responsable de una agencia alerta de que se piden menos mujeres con curvas","Super dünne Modelle in Werbung ja, aber sie scheinen gesund","Im Vereinigten Königreich mussten drei Modemarken Fotos von den Protesten des Publikums entfernen, wo die Verherrlichung der extremen Schlankheit angeprangert wird. In Spanien gibt es nicht so viele Beschwerden, aber eine Agentur warnt, dass weniger Frauen mit Kurven gefordert werden.","Super thin models in ads yes, but that look healthy","In the United Kingdom three fashion brands have had to remove photos from the protests of the audience, where the glorification of extreme thinness is denounced. In Spain there are not so many complaints, but one head of an agency alerts that fewer women with curves are asked"
76,Abuelos que ponen límites al cuidado de sus nietos: “No quiero ser la canguro”,"En España, el 85% de los abuelos se hace cargo de los niños de sus hijos, la mayoría de forma habitual y a diario, pero cada vez son más los que rompen con esta tendencia, no porque no los quieran, sino para disfrutar de su jubilación","Großeltern, die der Pflege ihrer Enkel Grenzen setzen: Ich will nicht Känguru sein","In Spanien kümmern sich 85% der Großeltern um die Kinder ihrer Kinder, die meisten davon regelmäßig und täglich, aber immer mehr brechen mit dieser Tendenz, nicht weil sie sie nicht wollen, sondern um ihren Ruhestand zu genießen.",Grandparents who place limits on the care of their grandchildren: “I don’t want to be the kangaroo”,"In Spain, 85% of grandparents take care of their children's children, most of them on a regular basis and on a daily basis, but more and more are breaking this trend, not because they don't want them, but to enjoy their retirement."
77,Modo ‘beta’ global: el experimento masivo de la IA,"La humanidad se convierte de nuevo en un laboratorio para las grandes tecnológicas, que despliegan sin control unas herramientas poco fiables que ya forman parte de la vida cotidiana de miles de millones de personas en todo el mundo",Gesamt-Glucose-Modus: das massive KI-Experiment,"Die Menschheit wird wieder zu einem Labor für die großen Technologien, die unkontrolliert unzuverlässige Werkzeuge einsetzen, die bereits Teil des täglichen Lebens von Milliarden von Menschen auf der ganzen Welt sind.",Global ‘beta’ mode: the massive AI experiment,"Humanity becomes again a laboratory for the great technology, which deploys unchecked unreliable tools that are already part of the daily lives of billions of people around the world."
78,Rodrigo Paz y Tuto Quiroga se disputarán la presidencia de Bolivia en octubre,"El candidato del Partido Demócrata Cristiano da la sorpresa y logra el mayor número de votos en primera vuelta, por delante del expresidente. La izquierda, fuera de la lucha por el poder por primera vez en 20 años",Rodrigo Paz und Tuto Quiroga werden den Präsidenten von Bolivien im Oktober streiten,"Der Kandidat der christdemokratischen Partei überrascht und erreicht die meisten Stimmen in der ersten Runde, vor dem ehemaligen Präsidenten. Die Linke, aus dem Kampf um die Macht zum ersten Mal in 20 Jahren",Rodrigo Paz and Tuto Quiroga will contest the presidency of Bolivia in October,"The candidate of the Christian Democratic Party is surprised and gets the highest number of votes in the first round, ahead of the former president. The left, out of the struggle for power for the first time in 20 years"
79,Polémica en Francia tras cancelarse la proyección de ‘Barbie’ en un cine de verano,El alcalde comunista de Noisy-Le-Sec suspendió la sesión por las amenazas de unos vecinos que alegaban que el filme “denigra a la mujer” y “promueve la homosexualidad”. La derecha le acusa de ceder ante el islamismo,Polemik in Frankreich nach Abblasen der Projektion von HlaingBarbie Hlaing in einem Sommerfilm,"Der kommunistische Bürgermeister von Noisy-Le-Sec hat die Sitzung wegen der Drohungen von Nachbarn unterbrochen, die behaupteten, dass der Film die Frau verneinen und die Homosexualität fördern würde.",Polemic in France after cancelling the screening of ‘Barbie’ in a summer cinema,The Communist mayor of Noisy-Le-Sec suspended the session because of threats from neighbors claiming that the film “denigrates women” and “promotes homosexuality.” The right wing accuses him of giving in to Islamism
80,Un reencuentro discreto entre el Reino Unido y la UE deja atrás las rencillas del Brexit,Starmer utiliza la incertidumbre geopolítica y la necesidad de un rearme para reiniciar la cooperación entre Londres y Bruselas,Eine diskrete Wiedervereinigung zwischen dem Vereinigten Königreich und der EU hinterlässt die Rückschläge des Brexit,Starmer nutzt geopolitische Ungewissheit und die Notwendigkeit einer Neubelebung der Zusammenarbeit zwischen London und Brüssel,A discreet rendezvous between the UK and the EU leaves behind Brexit’s feuds,Starmer uses geopolitical uncertainty and the need for rearmament to restart cooperation between London and Brussels
81,Las aseguradoras reciben las primeras reclamaciones de afectados por los incendios,2025 será el año con mayor superficie afectada por el fuego en explotaciones agrícolas y ganaderas del último lustro,Versicherer erhalten die ersten Ansprüche von Brandopfern,"2025 wird das Jahr sein, in dem die größte Feuerfläche in landwirtschaftlichen und landwirtschaftlichen Betrieben des letzten Glanzes liegt.",Insurance companies receive the first fire-affected claims,2025 will be the year with the largest area affected by fire on farms and livestock farms of the last five years
82,"La guerra contra el fuego en Galicia intenta proteger O Courel: “Como en la dana, el pueblo salva al pueblo”",Indignación vecinal por la detención de un hombre que hizo una quema para frenar las llamas que asediaban casas,"Der Krieg gegen das Feuer in Galicien versucht, O Courel zu schützen: Wie in der Tänze rettet das Volk das Volk","Nachbarschaftskummer über die Verhaftung eines Mannes, der ein Feuer verbrannte, um die Flammen zu stoppen, die Häuser belagerten","The war on fire in Galicia tries to protect O Courel: “As in the dana, the people save the people”",Neighborly outrage over the arrest of a man who made a burning to stop the flames that besieged houses
83,Pedro Sánchez pierde fuelle en una Bruselas cada vez más escorada a la derecha,España se encuentra en minoría en la UE en migración o defensa y ve cómo la Comisión cuestiona la amnistía o su postura sobre la opa del BBVA al Sabadell,Pedro Sanchez verliert den Balg in einem mehr und mehr nach rechts gewölbten Brüssel,"Spanien befindet sich in der Minderheit in der EU im Bereich Migration oder Verteidigung und sieht, wie die Kommission Amnestie oder ihre Haltung zur Opa der BBVA al Sabadell in Frage stellt",Pedro Sánchez loses bellows in an increasingly decorated Brussels on the right,Spain is in a minority in the EU in migration or defense and sees how the Commission questions the amnesty or its stance on BBVA al Sabadell’s opa
84,Las ‘telecos’ ponen en marcha planes de contingencia ante los incendios,Las incidencias en las comunicaciones son mínimas en las zonas afectadas por los fuegos,Die FCKW führen Notfallpläne für Brände ein,Die Auswirkungen auf die Kommunikation sind in den von Bränden betroffenen Gebieten minimal.,‘Telecos’ Launch Fire Contingency Plans,Communications incidences are minimal in fire-affected areas
85,"La deuda pública marca un nuevo récord en junio de 1,69 billones, pero su peso sobre el PIB sigue bajando","El Banco de España confirma que la ratio sobre la riqueza se reduce en casi dos puntos con respecto al mismo periodo del año pasado, hasta el 103,4%","Die Staatsverschuldung ist im Juni ein neuer Rekord von 1,69 Billionen, aber ihr Gewicht auf das BIP sinkt weiter","Die Banco de España bestätigt, dass die Wohlstandsquote gegenüber dem gleichen Zeitraum des vergangenen Jahres um fast zwei Prozentpunkte auf 103,4% gesunken ist.","Public debt sets a new record in June of 1.69 billion, but its weight on GDP continues to fall","The Banco de España confirms that the ratio on wealth is reduced by almost two points compared to the same period last year, to 103.4%"
86,Los operadores bloquean 50 millones de llamadas y sms fraudulentos tras el plan antiestafas,"Óscar López admite que Huawei forma parte del organismo de ciberseguridad del 5G, pero afirma que España cumple las normas de la UE",Operatoren blockieren 50 Millionen gefälschte Anrufe und SMS nach dem Anti-Straffen-Plan,"Óscar López räumt ein, dass Huawei Teil der 5G Cybersicherheitsagentur ist, erklärt jedoch, dass Spanien die EU-Normen erfüllt.",Operators block 50 million fraudulent calls and SMSs after the anti-stafa plan,"Óscar López admits that Huawei is part of the 5G cybersecurity agency, but states that Spain complies with EU standards"
87,Muere la mujer que estuvo retenida por su pareja 12 días en la localidad valenciana de Llíria,Los investigadores manejan el suicidio de la víctima como principal hipótesis,"Die Frau, die 12 Tage von ihrem Partner in der valencianischen Stadt Llíria festgehalten wurde, stirbt",Ermittler behandeln den Selbstmord des Opfers als Haupthypothese,The woman who was held by her partner dies 12 days in the Valencian town of Llíria,Investigators handle the victim's suicide as the main hypothesis
88,Prisión provisional domiciliaria para el hombre de 85 años detenido en julio en Navarra por la muerte de su mujer,La audiencia provincial considera que “en este momento procesal” no puede valorar si se trató de un asesinato o fue accidental,"Vorläufiges Heimgefängnis für den 85-jährigen Mann, der im Juli in Navarra wegen des Todes seiner Frau verhaftet wurde","Die Provinzanhörung ist der Ansicht, dass die Untersuchung zum jetzigen Zeitpunkt nicht beurteilen kann, ob es sich um einen Mord oder einen Unfall handelte.",Temporary home imprisonment for the 85-year-old man arrested in July in Navarra for the death of his wife,The provincial hearing considers that “at this time of trial” cannot assess whether it was a murder or accidental
89,"Muere Isabel Guerrero, la niña que hizo visible la realidad del cáncer infantil","La pequeña, de 12 años, padeció una leucemia cuando tenía siete meses y se sometió a un tratamiento avanzado que ha servido para salvar después a otros niños","Isabel Guerrero stirbt, das Mädchen, das die Realität des Kinderkrebses sichtbar gemacht hat.","Die 12-Jährige litt an Leukämie, als sie sieben Monate alt war, und wurde einer fortgeschrittenen Behandlung unterzogen, die später dazu diente, andere Kinder zu retten.","Isabel Guerrero, the girl who made the reality of childhood cancer visible, dies",The 12-year-old girl suffered from leukemia when she was seven months old and underwent advanced treatment that has served to save other children afterwards.
90,"Recortar fondos, cortar futuros: la educación está en crisis en América Latina y el Caribe","La escuela no es solo un aula: es refugio,  rutina, seguridad, alimentación, recuperación emocional y, por supuesto, aprendizaje","Kürzung der Mittel, Schneiden der Zukunft: Bildung ist in der Krise in Lateinamerika und der Karibik","Die Schule ist nicht nur ein Klassenzimmer: Es ist Zuflucht, Routine, Sicherheit, Ernährung, emotionale Erholung und natürlich Lernen","Cutting funds, cutting futures: education is in crisis in Latin America and the Caribbean","School is not just a classroom: it is shelter, routine, safety, nutrition, emotional recovery and, of course, learning"
91,"Las chicas sacan cada vez más ventaja a los chicos en educación: “Para algunos, estudiar resta masculinidad”","Los expertos advierten de que se está creando una “infraclase” social de jóvenes muy poco formados, con un sombrío futuro laboral y  especialmente vulnerables a los discursos ultras","Mädchen gewinnen immer mehr Vorsprung für Jungen in der Ausbildung: Für einige, studieren subculinity männlich","Die Experten warnen vor der Schaffung einer sozialen Infra- ferenz für junge Menschen, die sehr wenig ausgebildet sind, mit einer düsteren beruflichen Zukunft, die besonders anfällig für ultrasoziale Reden ist.","Girls take more and more advantage of boys in education: “For some, studying subtracts masculinity”","Experts warn that a social “infraclass” is being created for very poorly trained young people, with a bleak future at work and especially vulnerable to ultrasonic discourses"
92,‘Sorpasso’ en el ‘ranking’ de Shanghái: China y Taiwán ya tienen más universidades que EE UU en los 500 primeros puestos,Los campus españoles se estancan en la clasificación más prestigiosa del mundo por la falta de financiación,"""Sorpasso"" in Shanghai: China und Taiwan haben bereits mehr Universitäten als die USA an den ersten 500 Plätzen.",Die spanischen Campus stagnieren in der renommiertesten Rangliste der Welt wegen fehlender Finanzierung,‘Sorpasso’ in Shanghai’s ‘ranking’: China and Taiwan already have more universities than the US in the top 500 positions,Spanish campuses stagnate in the most prestigious ranking in the world due to lack of funding
93,Los coches de caballos no entienden de horarios ni en ola de calor,Solo Córdoba limita los horarios para esta actividad cuando hay alertas por altas temperaturas. Sevilla y Málaga no han modificado las ordenanzas para proteger a los animales,Pferdeautos verstehen weder Zeitpläne noch Hitzewellen,"Nur Cordoba beschränkt die Arbeitszeiten für diese Aktivität, wenn Alarme wegen hoher Temperaturen auftreten. Sevilla und Málaga haben die Vorschriften zum Schutz der Tiere nicht geändert.",Horse cars don't understand hours or heat wave,Only Cordoba limits the hours for this activity when there are alerts for high temperatures. Seville and Malaga have not modified the ordinances to protect the animals
94,"La ola de calor se despide con avisos en Alicante y Murcia por altas temperaturas y un récord de 45,8 grados en Jerez de la Frontera",Este episodio está entre los tres más duraderos registrados por Aemet desde 1975,"Die Hitzewelle feuert mit Warnungen in Alicante und Murcia wegen hoher Temperaturen und einem Rekord von 45,8 Grad in Jerez de la Frontera",Diese Episode gehört zu den drei langlebigsten registriert von Aemet seit 1975,The heat wave is fired with warnings in Alicante and Murcia due to high temperatures and a record of 45.8 degrees in Jerez de la Frontera,This episode is among the three most durable recorded by Aemet since 1975
95,Ecologistas exigen recortar el ascenso final de La Vuelta a España por su impacto en la Sierra de Guadarrama,Algunos vecinos del norte de Madrid temen daños al Parque Nacional protegido por el Estado y la UE,"Ökologisten verlangen, den letzten Aufstieg von La Vuelta nach Spanien wegen seiner Auswirkungen auf die Sierra de Guadarrama zu kürzen",Einige Nachbarn im Norden von Madrid fürchten Schäden an dem staatlich und EU-geschützten Nationalpark,Ecologists demand to cut the final ascent of La Vuelta to Spain for its impact on the Sierra de Guadarrama,Some neighbors in northern Madrid fear damage to the state- and EU-protected National Park
96,Investigadores españoles resucitan a ‘los fantasmas’ de los campamentos neandertales,"El proyecto Scavengers estudia hoy en día el comportamiento que podrían haber tenido osos, lobos y hienas ante los fuegos neandertales",Spanische Forscher beleben die Phantome der Neandertalcamps,"Das Projekt Scavengers untersucht heute das Verhalten von Bären, Wölfen und Hyänen vor Neandertaler-Feuern.",Spanish researchers resurrect ‘the ghosts’ of Neanderthal camps,"The Scavengers project is currently studying the behavior that bears, wolves and hyenas might have had before Neanderthal fires."
97,¿Por qué lo que está lejos se ve más pequeño?,"El cerebro, gracias a la retina, procesa la información que proviene de cada uno de los dos ojos de forma independiente para poder generar una imagen tridimensional del mundo que nos rodea","Warum sieht das, was weit weg ist, kleiner aus?","Das Gehirn verarbeitet dank der Netzhaut die Informationen, die von jedem der beiden Augen unabhängig sind, um ein dreidimensionales Bild der Welt um uns herum zu erzeugen.",Why does what's far away look smaller?,"The brain, thanks to the retina, processes the information that comes from each of the two eyes independently in order to generate a three-dimensional image of the world around us."
98,"Imagina bien, rinde mejor: el poder del entrenamiento psicológico en el deporte","La preparación mental se ha convertido una parte esencial del rendimiento deportivo, con aplicaciones en el tratamiento de lesiones, el perfeccionamiento de habilidades físicas y la gestión del estrés","Stellen Sie sich vor, es ist besser: die Kraft des psychologischen Trainings im Sport","Psychische Vorbereitung ist ein wesentlicher Bestandteil der sportlichen Leistung geworden, mit Anwendungen in der Behandlung von Verletzungen, Verbesserung der körperlichen Fähigkeiten und Stressmanagement","Imagine well, it yields better: the power of psychological training in sport","Mental preparation has become an essential part of sports performance, with applications in injury treatment, physical skills development and stress management"
99,"Verónica Álvarez, matemática: “Los algoritmos son herramientas que nos ayudan a tomar decisiones, no vienen a reemplazarnos”","La joven investigadora ha sido galardonada por la Fundación BBVA por su aporte en el desarrollo de modelos estadísticos para aplicar algoritmos en ámbitos tan diversos como anticipar picos en la red eléctrica, la ciberseguridad o en la medicina","Veronica Álvarez, Mathematik: Die Algorithmen sind Werkzeuge, die uns helfen, Entscheidungen zu treffen, sie ersetzen uns nicht.","Die junge Forscherin wurde von der BBVA-Stiftung für ihren Beitrag zur Entwicklung statistischer Modelle für die Anwendung von Algorithmen in so unterschiedlichen Bereichen ausgezeichnet, wie z.B. Vorwegnahme von Spitzen im Stromnetz, in der Cybersicherheit oder in der Medizin.","Veronica Alvarez, Math: “Algorithms are tools that help us make decisions, they don’t come to replace us”","The young researcher has been awarded by the BBVA Foundation for her contribution to the development of statistical models to apply algorithms in areas as diverse as anticipating peaks in the electricity grid, cybersecurity or medicine."
