,title-en,content-en,title-de,content-de,title-es,content-es,title-fr,content-fr,title-zh,content-zh
0,"Confrontation in the Arctic is not inevitable, argues Kieran Mulvaney",The big players don’t need to view every adversary’s moves as a threat,"Konfrontation in der Arktis ist nicht unvermeidlich, argumentiert Kieran Mulvaney","Die großen Spieler brauchen nicht jeden Gegner zu sehen, bewegt sich als Bedrohung","La confrontación en el Ártico no es inevitable, argumenta Kieran Mulvaney",Los grandes jugadores no necesitan ver los movimientos de cada adversario como una amenaza,"La confrontation dans l'Arctique n'est pas inévitable, soutient Kieran Mulvaney",Les grands joueurs n'ont pas besoin de voir chaque adversaire se déplace comme une menace,"北极的对抗并非不可避免,",大玩家不需要把对手的动作看成威胁
1,Mikhail Komin on why the Arctic is Putin’s next front,The political scientist writes that the Kremlin’s insecurities are fuelling escalation in the region,"Michail Komin, warum die Arktis Putins nächste Front ist","Der Politikwissenschaftler schreibt, dass die Kreml-Unsicherheiten die Eskalation in der Region anheizen",Mikhail Komin sobre por qué el Ártico es el próximo frente de Putin,El politólogo escribe que las inseguridades del Kremlin están alimentando la escalada en la región,Mikhail Komin sur la raison pour laquelle l'Arctique est Poutine,Le politologue écrit que les insécurités du Kremlin alimentent l'escalade dans la région,"米哈伊尔·科明(Mikhail Komin),","这位政治科学家写道,克里姆林宫的不安全正在加剧该地区的升级。"
2,"The far north has become NATO’s soft underbelly, writes John Bolton",The foreign-policy expert makes the argument for keeping the Chinese out and the Russians down,"Der ferne Norden ist zu einem weichen Unterbauchen der NATO geworden, schreibt John Bolton","Der außenpolitische Experte macht das Argument, die Chinesen draußen und die Russen unten zu halten","El lejano norte se ha convertido en el vientre blando de la OTAN, escribe John Bolton",El experto en política exterior hace el argumento para mantener a los chinos fuera y a los rusos abajo,"L'extrême nord est devenu l'OTAN soft underbelly, écrit John Bolton",L'expert en politique étrangère fait l'argument pour garder les Chinois à l'écart et les Russes à la baisse,"约翰·博尔顿(John Bolton)写道,远北地区已成为北约的软腰软腰。",外交政策专家为中国人和俄国人
3,The US in brief: Shadowboxing in DC,"Our daily political update, featuring the stories that matter",Die USA in Kürze: Shadowboxing in DC,"Unser tägliches politisches Update mit den Geschichten, die wichtig sind",Estados Unidos en resumen: Shadowboxing en DC,"Nuestra actualización política diaria, con las historias que importan",Les Etats-Unis en bref : Shadowboxing en DC,"Notre mise à jour politique quotidienne, mettant en vedette les histoires qui comptent","简言之,美国:在华盛顿的影子拳击","我们每天的政治最新情况,特别报道重要的故事"
4,"The summit of its parts: Ukraine, Trump and Putin",Also on the daily podcast: where the Detroit of electric vehicles will be and allergy treatments get ever better,"Der Gipfel seiner Teile: Ukraine, Trump und Putin",Auch auf dem täglichen Podcast: wo die Detroit von Elektrofahrzeugen und Allergie-Behandlungen immer besser werden,"La cumbre de sus partes: Ucrania, Trump y Putin",También en el podcast diario: donde estará el Detroit de los vehículos eléctricos y los tratamientos de alergia mejoran cada vez más,"Le sommet de ses parties: Ukraine, Trump et Poutine",Aussi sur le podcast quotidien: où le Détroit des véhicules électriques sera et les traitements d'allergie obtiennent toujours mieux,其部分的首脑会议:乌克兰、特朗普和普京,"电动车辆底底特律将在那里, 过敏治疗也变得更好,"
5,"The world needs more than drugs to fight obesity, writes Novo Nordisk’s ex-boss",Lars Fruergaard Jørgensen on how society can pull together to avoid a health and economic catastrophe,"Die Welt braucht mehr als Drogen, um Fettleibigkeit zu bekämpfen, schreibt Novo Nordisk-ex-boss","Lars Fruergaard Jørgensen, wie die Gesellschaft zusammenhalten kann, um eine Gesundheits- und Wirtschaftskatastrophe zu vermeiden","El mundo necesita más que drogas para combatir la obesidad, escribe el exjefe de Novo Nordisk",Lars Fruergaard Jørgensen sobre cómo la sociedad puede unirse para evitar una catástrofe económica y sanitaria,"Le monde a besoin de plus que des médicaments pour lutter contre l'obésité, écrit Novo Nordisk, ex-boss",Lars Fruergaard Jørgensen sur la façon dont la société peut se rassembler pour éviter une catastrophe sanitaire et économique,"诺沃·诺迪斯克的前老板写道:世界需要的不仅仅是毒品,","Lars Frueregaard Jørgensen 讨论社会如何团结起来,避免健康和经济灾难"
6,Tipping scales: justice for Gaza will have to come from within Israel,A handpicked article read aloud from the latest issue of The Economist,Trinkwaagen: Gerechtigkeit für Gaza muss aus Israel kommen,Ein handverlesener Artikel aus der aktuellen Ausgabe von The Economist,Escalas de golpe: la justicia para Gaza tendrá que venir de dentro de Israel,Un artículo escogido a mano leído en voz alta del último número de The Economist,Balances de basculement: la justice pour Gaza devra venir d'Israël,Un article tiré à la main a été lu à haute voix dans le dernier numéro de The Economist,权定尺度:加沙的司法必须来自以色列内部,"《经济学家》最新一期《经济学家》的一篇文章,"
7,America’s drug regulator is in turmoil,The already fraught oversight of rare-disease treatments is becoming politicised,Amerikas Drogen-Regulator ist in Turbulenzen,Die bereits angespannte Überwachung der Behandlung mit seltenen Krankheiten wird zunehmend politisiert.,El regulador de drogas de Estados Unidos está en agitación,La ya tensa supervisión de los tratamientos de enfermedades raras se está politizando,Americas drug regulator est dans la tourmente,Le contrôle déjà chargé des traitements des maladies rares devient politisé,美国的药物监管者处于动荡之中,对稀有疾病治疗的本已充满监督的监管正日益政治化
8,America’s housing market is shuddering,"For the country’s homeowners, the good times are coming to an end",Amerikas Wohnungsmarkt schaudert,"Für das Land, Hausbesitzer, die guten Zeiten kommen zu einem Ende",El mercado inmobiliario de Estados Unidos está estremeciendo,"Para los propietarios del país, los buenos tiempos están llegando a su fin",Amérique Le marché de l'habitation tremble,"Pour les propriétaires du pays, les bons moments arrivent à leur terme",美国的房地产市场正在摇摇欲坠,"对于国家的房主来说,美好时代即将结束"
9,"Instead of sanctions, Donald Trump announces a summit with Russia","Despite the confusion, momentum for peace in Ukraine seems to be building",Statt Sanktionen kündigt Donald Trump einen Gipfel mit Russland an,Trotz der Verwirrung scheint die Dynamik für den Frieden in der Ukraine zu wachsen,"En lugar de sanciones, Donald Trump anuncia una cumbre con Rusia","A pesar de la confusión, el impulso hacia la paz en Ucrania parece estar aumentando","Au lieu de sanctions, Donald Trump annonce un sommet avec la Russie","Malgré la confusion, l'élan pour la paix en Ukraine semble être en train de se développer.","唐纳德·特朗普宣布与俄罗斯举行首脑会议,","尽管局势混乱,乌克兰的和平势头似乎正在形成。"
10,Donald Trump brokers a peace plan in the Caucasus,An American-backed deal between Armenia and Azerbaijan could weaken Russia,Donald Trump vermittelt einen Friedensplan im Kaukasus,Ein von den Amerikanern unterstütztes Abkommen zwischen Armenien und Aserbaidschan könnte Russland schwächen,Donald Trump negocia un plan de paz en el Cáucaso,Un acuerdo respaldado por los Estados Unidos entre Armenia y Azerbaiyán podría debilitar a Rusia,Donald Trump négocie un plan de paix dans le Caucase,Un accord soutenu par les Américains entre l'Arménie et l'Azerbaïdjan pourrait affaiblir la Russie,唐纳德·特朗普在高加索地区 促成一个和平计划,美国支持的亚美尼亚和阿塞拜疆之间的一项协议可能会削弱俄罗斯
11,The Memory Keepers,"As survivors die out, how do you keep the memories of Japan’s atomic apocalypse alive?",Die Gedächtnishüter,"Als Überlebende sterben, wie halten Sie die Erinnerungen an Japans Atomapokalypse am Leben?",Los guardianes de la memoria,"A medida que los sobrevivientes mueren, ¿cómo mantienes vivos los recuerdos del apocalipsis atómico japonés?",Les gardiens de la mémoire,"Comme les survivants meurent, comment gardez-vous en vie les souvenirs de l'apocalypse atomique du Japon ?",记忆保存者,"当幸存者死后,你如何将日本原子末日的记忆保存在生命中?"
12,Still want to be a London cabbie?,"Surprisingly, many do, and are prepared to study for the gruelling test to become one",Willst du immer noch ein Taxifahrer in London sein?,"Überraschenderweise tun und sind viele bereit, zu studieren, damit der zermürbende Test eins wird",¿Aún quieres ser taxista de Londres?,"Sorprendentemente, muchos lo hacen, y están preparados para estudiar para que la prueba agotadora se convierta en uno",Tu veux toujours être un taxi londonien ?,"Étonnamment, beaucoup d'entre eux le font et sont prêts à étudier pour que le test épuisant devienne un",还想当伦敦出租车司机吗?,"令人惊讶的是,许多人这样做,并准备研究如何使艰苦的试验成为一项试验。"
13,OpenAI’s latest step towards advanced artificial intelligence,"GPT-5 is an update, not a revolution. But revolution may still be on the way",OpenAI-neuster Schritt in Richtung fortgeschrittener künstlicher Intelligenz,"GPT-5 ist ein Update, keine Revolution. Aber Revolution kann immer noch auf dem Weg sein",El último paso de OpenAI hacia la inteligencia artificial avanzada,"El GPT-5 es una actualización, no una revolución.","La dernière étape de l'OpenAI, vers l'intelligence artificielle avancée","GPT-5 est une mise à jour, pas une révolution.",OpenAI 朝向先进的人工智能的最新一步,"GPT-5是最新消息,不是革命。 但革命可能还在路上。"
14,Cover Story newsletter: How we chose the cover image,,Cover Story Newsletter: Wie wir das Coverbild gewählt haben,,Portada del boletín: Cómo elegimos la imagen de la portada,,Cover Story newsletter: Comment nous avons choisi l'image de couverture,,封面新闻通讯:我们如何选择封面图像,
15,Treasure map: Trump finds gold in redistricting,"Our weekly podcast on democracy in America. This week, Donald Trump broke another norm when he told Texas Republicans to redraw their congressional maps to create more Republican seats. Democrats followed suit. We look at how this may tip the balance of power in Congress, and whether mid-decade redistricting is the new norm.",Schatzkarte: Trump findet Gold in der Neuverengung,"Unsere wöchentliche Podcast über Demokratie in Amerika. Diese Woche, Donald Trump brach eine andere Norm, als er Texas Republikaner sagte, ihre Kongress-Karten neu zu zeichnen, um mehr republikanische Sitze zu schaffen. Demokraten folgten Anzug. Wir betrachten, wie dies das Gleichgewicht der Macht im Kongress kippen kann, und ob Mitte-Dekade Neueinteilung ist die neue Norm.",Mapa del tesoro: Trump encuentra oro en la redistribución,"Esta semana, Donald Trump rompió otra norma cuando le dijo a los republicanos de Texas que redibujen sus mapas del Congreso para crear más escaños republicanos. Los demócratas siguieron el ejemplo. Observamos cómo esto puede inclinar el equilibrio de poder en el Congreso, y si la redistribución a mediados de decenio es la nueva norma.",Carte du trésor: Trump trouve de l'or dans le redistricting,"Notre podcast hebdomadaire sur la démocratie en Amérique. Cette semaine, Donald Trump a enfreint une autre norme quand il a dit aux Républicains du Texas de redessiner leurs cartes du Congrès pour créer plus de sièges républicains. Les démocrates ont suivi.",宝藏地图:特朗普在重新分区中找到黄金,"我们每周一次的美国民主播客。 本周,唐纳德·特朗普打破了另一个常规,他告诉得克萨斯共和党人重新绘制他们的国会地图,以创造更多的共和党席位。 民主党人也效仿了。 我们审视了这如何可能给国会的权力平衡起点作用,以及十年中期重新划分是否是新规范。"
16,Are nightmares bad for your health?,"If you have them often, the answer seems to be yes",Sind Albträume schlecht für Ihre Gesundheit?,"Wenn Sie sie oft haben, scheint die Antwort ja zu sein",¿Las pesadillas son malas para tu salud?,"Si los tienes a menudo, la respuesta parece ser sí.",Les cauchemars sont-ils mauvais pour votre santé ?,"Si vous les avez souvent, la réponse semble être oui.",恶梦对健康有害吗?,"如果你经常有,答案似乎是肯定的"
17,"Pascal Soriot, the pharma titan tiring of Britain",AstraZeneca’s boss shares Donald Trump’s mission to spread the cost of drug development,"Pascal Soriot, die Pharma-Titan ermüdend von Großbritannien","AstraZenecas Chef teilt Donald Trumps Mission, die Kosten der Drogenentwicklung zu verbreiten","Pascal Soriot, el titán farmacéutico cansado de Gran Bretaña",El jefe de AstraZeneca comparte la misión de Donald Trump de difundir el costo del desarrollo de drogas,"Pascal Soriot, le titan pharmaceutique de la Grande-Bretagne",Le patron d'AstraZeneca lance la mission de Donald Trump pour répartir le coût du développement de la drogue,"Pascal Soriot, 英国的药剂业巨人劳累","AstraZeneca的上司与Donald Trump共同承担任务, 分担毒品开发成本,"
18,Donald Trump’s tariffs on Brazil are more bark than bite,The Latin American giant may have avoided the worst—for now,Donald Trumps Zölle auf Brasilien sind mehr Rinde als Biss,Der lateinamerikanische Riese mag das Schlimmste vermieden haben — für jetzt,Los aranceles de Donald Trump sobre Brasil son más ladradores que mordiscos,"El gigante latinoamericano pudo haber evitado lo peor, por ahora",Les tarifs de Donald Trump sur le Brésil sont plus d'écorce que de morsure,Le géant latino-américain a peut-être évité le pire — pour l'instant,唐纳德·特朗普对巴西的关税比咬狗还多,拉丁美洲巨人可能已经避免了最坏的情况。
19,"Japan’s dithering wartime leaders were just as harmful as European dictators, says Eri Hotta",The historian argues that Japan stayed in the war much longer than necessary,"Japans dithering Kriegsführer waren genauso schädlich wie europäische Diktatoren, sagt Eri Hotta","Der Historiker argumentiert, dass Japan im Krieg blieb viel länger als notwendig","Los difuminados líderes de Japón en tiempos de guerra fueron tan dañinos como los dictadores europeos, dice Eri Hotta",El historiador argumenta que Japón permaneció en la guerra mucho más de lo necesario,"Les dirigeants japonais qui distraient en temps de guerre étaient tout aussi nuisibles que les dictateurs européens, dit Eri Hotta",L'historien soutient que le Japon est resté dans la guerre beaucoup plus longtemps que nécessaire,"Eri Hotta说,日本战时领导人的动荡与欧洲独裁者一样有害。","历史学家认为,日本在战争中逗留的时间长于必要的时间"
20,What to watch this weekend,Our titles this week use old ideas in new ways,Was an diesem Wochenende zu sehen,Unsere Titel in dieser Woche verwenden alte Ideen auf neue Weisen,Qué ver este fin de semana,Nuestros títulos de esta semana utilizan viejas ideas de nuevas maneras,Que regarder ce week-end,Nos titres cette semaine utilisent des idées anciennes de nouvelles façons,这周末看什么看这个周末,我们本周的称号 以新方式利用旧思想
21,Not all’s fair: Israel and accountability,"Also on the daily podcast: the case against “job-hopping” for higher pay and remembering Patrick Ryan, the “Devil’s Disciple”",Nicht alle fair: Israel und Rechenschaftspflicht,"Auch auf dem täglichen Podcast: der Fall gegen -job-hopping für höhere Bezahlung und Patrick Ryan erinnern, die -Devils Disciple",No todo es justo: Israel y la rendición de cuentas,"También en el podcast diario: el caso contra el “trabajo-saltar” por un salario más alto y recordar a Patrick Ryan, el “discípulo del Diablo”",Pas tous : Israël et responsabilisation,"Aussi sur le podcast quotidien: l'affaire contre le travail-happing de l'emploi pour une rémunération plus élevée et se souvenant Patrick Ryan, le Disciple de Devil",并非所有人都公平:以色列和问责,也是在每日播客上:反对为高薪而“寻找工作”和纪念“魔鬼的花旗”Patrick Ryan的案件。
22,The US in brief: Donald Trump questions the count,"Our daily political update, featuring the stories that matter",Die USA in Kürze: Donald Trump befragt den Grafen,"Unser tägliches politisches Update mit den Geschichten, die wichtig sind",Estados Unidos en resumen: Donald Trump cuestiona el conteo,"Nuestra actualización política diaria, con las historias que importan",Les Etats-Unis en bref : Donald Trump remet en question le décompte,"Notre mise à jour politique quotidienne, mettant en vedette les histoires qui comptent","简言之,美国:唐纳德·特朗普质疑人数","我们每天的政治最新情况,特别报道重要的故事"
23,Stablecoins: is this crypto’s big bang moment?,"Our podcast on markets, the economy and business. This week, how the crypto tokens could destabilise the financial system",Stablecoins: Ist das ein Krypto-Bang-Moment?,"Unser Podcast über Märkte, Wirtschaft und Wirtschaft. Diese Woche, wie die Krypto-Token könnte das Finanzsystem destabilisieren",Stablecoins: ¿es el momento de big bang de este cripto?,"Nuestro podcast sobre mercados, economía y negocios. Esta semana, cómo los tokens criptográficos podrían desestabilizar el sistema financiero",Stablecoins: Est-ce que c'est un moment de big bang ?,"Notre podcast sur les marchés, l'économie et les affaires. Cette semaine, comment les jetons crypto pourraient déstabiliser le système financier",稳定器:这是加密大爆炸时刻吗?,"在市场、经济和商业上播客。本周,暗语象征品是如何破坏金融系统的稳定的。"
24,"Economic data, commodities and markets",,"Wirtschaftsdaten, Rohstoffe und Märkte",,"Datos económicos, productos básicos y mercados",,"Données économiques, produits de base et marchés",,经济数据、商品和市场,
25,"Fr Patrick Ryan, the “Devil’s Disciple”, improved IRA bomb-making","The former Catholic priest died on June 15th, aged 94","Pater Patrick Ryan, der Schüler von Devil, verbesserte die IRA-Bombenherstellung",Der ehemalige katholische Priester starb am 15. Juni im Alter von 94 Jahren,"El P. Patrick Ryan, el “Discípulo del Diablo”, mejoró la fabricación de bombas del IRA","El ex sacerdote católico murió el 15 de junio, a los 94 años.","P. Patrick Ryan, le Disciple de Dévil, a amélioré la fabrication de bombes IRA","L'ancien prêtre catholique est décédé le 15 juin, âgé de 94 ans.","Fr Patrick Ryan, "" Devil's Disciple "" ,改进了爱尔兰共和军制造炸弹的工作。","前天主教神父于6月15日去世,"
26,Provence is not just a destination. It is a lifestyle brand,"The region, associated with a relaxed way of life, has become a marketing tool",Provence ist nicht nur ein Reiseziel. Es ist eine Lifestyle-Marke,"Die Region, verbunden mit einer entspannten Lebensweise, ist zu einem Marketing-Tool geworden",Provence no es sólo un destino. Es una marca de estilo de vida,"La región, asociada con un estilo de vida relajado, se ha convertido en una herramienta de marketing",La Provence n'est pas seulement une destination. C'est une marque de style de vie,"La région, associée à un mode de vie détendu, est devenue un outil de marketing","普罗旺斯不仅仅是一个目的地,它是一个生活方式品牌","该区域与宽松的生活方式相联系,已成为一种营销工具"
27,The novels conservatives want you to read,It is not just “The Pilgrim’s Progress” and works by Ayn Rand,"Die Romane Konservativen wollen, dass Sie lesen",Es ist nicht nur der Pilger Fortschritt und Werke von Ayn Rand,Las novelas conservadoras quieren que leas,No es sólo “El Progreso del Peregrino” y obras de Ayn Rand,Les romans conservateurs veulent que tu lises,Ce n'est pas juste -Le Pèlerin -Progress et les œuvres d'Ayn Rand,小说保守派希望你读,"不只是 "" 朝圣者的进步 "" ,"
28,America’s barmy battle to ban bawdy books,Organised puritans are invading school libraries,Amerikas barmy Kampf zu bannen bawdy Bücher,Organisierte Puritaner dringen in Schulbibliotheken ein,La batalla bárbara de Estados Unidos para prohibir los libros bárbaros,Los puritanos organizados están invadiendo las bibliotecas escolares,Amériques Barmy bataille pour bannir les livres bawdy,Les puritains organisés envahissent les bibliothèques scolaires,美国为禁止丑陋书籍的野蛮斗争,组织起来的清教徒入侵学校图书馆
29,McDonald’s secret sauce—plus a pickle or two,Hearty quarterly results conceal a dual challenge for the burger behemoth,McDonald's geheime Soße — plus eine Gurke oder zwei,Herzhafte Quartalsergebnisse verbergen eine doppelte Herausforderung für den Burgerbehemoth,Salsa secreta de McDonald — más un pepinillo o dos,Grandes resultados trimestrales ocultan un doble desafío para el behemoth hamburguesa,"La sauce secrète McDonald, plus un cornichon ou deux",Des résultats trimestriels copieux cachent un double défi pour le burger behemoth,麦当劳的秘密酱酱酱加一两个泡菜,令人心痛的季度结果掩盖了汉堡的双重挑战
30,Xi Jinping’s city of the future is coming to life,It is both impressive and worrying,Xi Jinpings Stadt der Zukunft wird lebendig,Es ist beeindruckend und besorgniserregend,La ciudad del futuro de Xi Jinping está cobrando vida,Es a la vez impresionante y preocupante,La ville du futur de Xi Jinping's prend vie,C'est à la fois impressionnant et inquiétant,习近平的未来城市即将到来,"这既令人印象深刻,又令人担忧"
31,An economist’s guide to big life decisions,Forget your trip to the dentist. A new check-up is required,Ein Ökonom führt zu großen Lebensentscheidungen,Vergessen Sie Ihre Reise zum Zahnarzt. Ein neuer Check-up ist erforderlich,Guía de un economista para las grandes decisiones de la vida,Olvídese de su viaje al dentista. Se requiere un nuevo chequeo,Un guide de l'économiste sur les grandes décisions de vie,Oubliez votre voyage chez le dentiste. Un nouveau check-up est nécessaire,经济学家关于重大生活决策的指南,"忘了你去看牙医的行程,需要重新检查。"
32,Want better returns? Forget risk. Focus on fear,A recent study suggests a new paradigm for asset pricing,Wollen Sie bessere Rückkehr? Vergessen Sie Risiko. Konzentrieren Sie sich auf Angst,Eine kürzlich durchgeführte Studie schlägt ein neues Paradigma für die Preisgestaltung von Vermögenswerten vor.,¿Quieres mejores devoluciones? Olvida el riesgo. Concéntrate en el miedo,Un estudio reciente sugiere un nuevo paradigma para la fijación de precios de los activos,Vous voulez de meilleurs retours? Oubliez le risque. Concentrez-vous sur la peur,Une étude récente suggère un nouveau paradigme pour la tarification des actifs,"想要更好的回报吗? 忘记风险,专注于恐惧",最近的一项研究提出了资产定价的新范式
33,"If America goes after India’s oil trade, China will benefit",A crackdown on Russian crude would have knock-on consequences,"Wenn Amerika hinter Indiens Ölhandel her ist, wird China davon profitieren.",Eine Niederschlagung des russischen Rohmaterials hätte Auswirkungen auf die Wirtschaft.,"Si Estados Unidos va tras el comercio de petróleo de la India, China se beneficiará",Una represión contra el crudo ruso tendría consecuencias,"Si l'Amérique suit le commerce pétrolier de l'Inde, la Chine en bénéficiera",Une répression du brut russe aurait des conséquences fâcheuses,"如果美国追逐印度石油贸易,中国将受益",对俄罗斯原油的镇压将带来连锁后果
34,America’s fertility crash reaches a new low,Even once-fecund states are having fewer children,Amerikas Fruchtbarkeitsabsturz erreicht ein neues Tief,Selbst einmal-Fecund Staaten haben weniger Kinder,La caída de la fertilidad en Estados Unidos alcanza un nuevo nivel bajo,Incluso los estados fecundos están teniendo menos hijos.,L'accident de fertilité de l'Amérique atteint un nouveau bas,Même les états autrefois fédés ont moins d'enfants,美国的生育率崩溃达到新的低点,"即使是曾经生育过孩子的州,生育孩子的州也越来越少。"
35,"Buy now, pay later is taking over the world. Good","Buy that burrito, and don’t let anyone judge you","Kaufen Sie jetzt, zahlen Sie später übernimmt die Welt. Gut","Kaufen Sie diesen Burrito, und lassen Sie sich nicht von jemandem beurteilen","Comprar ahora, pagar más tarde es tomar el control del mundo.","Compra ese burrito, y no dejes que nadie te juzgue","Acheter maintenant, payer plus tard, c'est prendre le monde en main.","Achète ce burrito, et ne laisse personne te juger","现在买,晚点还钱就占了世界的优势","买那个墨西哥卷饼,不要让任何人评判你"
