,title-de,content-de,title-en,content-en,title-zh,content-zh
0,Israel lässt Gaza-Hilfe durch Privat-Unternehmen wieder zu,"Die Wareneinfuhr durch den Privatsektor solle ""schrittweise und kontrolliert wieder aufgenommen"" werden, erklärte die zuständige Behörde COGAT. Israel reagiert mit dem Beschluss auch auf wachsenden internationalen Druck.",Israel Releases Gaza Aid Through Private Companies,"Imports of goods through the private sector should be ""resumed step by step and under control"", said the competent authority COGAT. Israel is also responding to increasing international pressure with the decision.",以色列通过私营公司重新批准加沙援助,"主管当局解释说,私营部门进口的商品应该""以步调和控制的方式重新装入"" COGAT. 以色列也对国际压力日增的决定作出回应."
1,Frankreichs Palästina-Kurs vertieft religiöse Gräben,"Politische Spaltung in Frankreich: Nach der Ankündigung von Präsident Macron, die palästinensischen Gebiete als eigenen Staat anzuerkennen, hat die Gewalt gegen muslimische und jüdische Gemeinschaften im Land zugenommen.",France's Palestine Course deepens religious trenches,"Political split in France: Following President Macron's announcement that Palestinian territories would be recognized as their own state, violence against Muslim and Jewish communities in the country has increased.",法国的巴勒斯坦课程深化宗教战壕,"在法国的政治分裂:在麦肯总统宣布承认巴勒斯坦领土是自己的国家后,对穆斯林和犹太社区的暴力已经增加."
2,Neue US-Strategie zur Beendigung des Kriegs im Gazastreifen?,"Es geht nicht mehr nur um eine begrenzte Waffenruhe in Gaza. Die USA erklärten, die Terrororganisation Hamas sei bereit, die Waffen niederzulegen. Doch die Extremisten stellen Bedingungen.",New US strategy to end the war in Gaza?,It is no longer just about a limited ceasefire in Gaza. The US said that the terrorist organization Hamas was ready to put down the weapons. But the extremists are setting conditions.,结束加沙地带战争的新美国战略?,这不再只是加沙的有限停火问题了. 美国宣称哈马斯恐怖组织愿意放下武器. 但极端分子们提供条件.
3,Gewaltige Sturzflut erfasst indische Touristenregion,Eine Schlammlawine wälzt sich von den Bergen ins Tal. Die Folgen für Dharali im indischen Bundesstaat Uttarakhand sind verheerend.,Huge torrential flood captures Indian tourist region,A mud avalanche rolls from the mountains into the valley. The consequences for Dharali in the Indian state of Uttarakhand are devastating.,赤裸裸的洪水席卷了印度旅游地区,泥漿從山脊流向山谷. 印度的烏他拉克拉罕邦的達利市的災難性后果是巨大的.
4,Moldau: Prorussische Gouverneurin zu Haftstrafe verurteilt,Die kleine Republik Moldau schwankt seit langem zwischen Ost und West. In wenigen Wochen wird ein neues Parlament gewählt. In den Wahlkampf platzt das Urteil in einem Strafprozess.,Moldova: Pro-Russian Governor Sentenced to Prison,"The small Republic of Moldova has long fluctuated between East and West. In a few weeks, a new parliament will be elected. In the election campaign, the verdict bursts in a criminal trial.","摩尔多瓦,普罗俄州长被判入狱","小摩尔多瓦共和国长期以来一直在东边和西边摇摆不定. 几周后,新议会将选出. 竞选活动将以刑事审判告终."
5,Ex-Fußball-Weltmeister Frank Mill ist tot,"Der frühere deutsche Fußball-Nationalspieler und WM-Teilnehmer von 1990 Frank Mill ist im Alter von 67 Jahren gestorben. Der frühere Topstürmer sagte über sich selbst: ""Eigentlich bin ich kein Weltmeister.""",Ex-football world champion Frank Mill is dead,"The former German national football player and World Cup participant from 1990 Frank Mill died at the age of 67. The former top striker said about himself: ""Actually, I am not a world champion.""",前足球冠军弗兰克·米尔死了,"1990年,前德国足球运动员和世界冠军弗兰克·米尔 (Frank Mill) 死于67岁. 前任参赛者自言自语说: ""其实我不是世界冠军. """
6,Spionage-Prozess: Ex-Assistent von AfD-Mann Krah vor Gericht,Ein früherer Mitarbeiter des bekannten AfD-Parlamentariers Maximilian Krah steht unter Spionage-Verdacht für China. Mit einer mutmaßlichen Komplizin muss er sich nun vor Gericht in Dresden verantworten.,Espionage trial: ex-assistant of AfD man Krah in court,"A former employee of the well-known AfD parliamentarian Maximilian Krah is suspected of espionage for China. With a suspected accomplice, he now has to answer to court in Dresden.",间谍程序: 最高法院审判AffD人克拉赫的前助理,"一名著名的AfD派系成员马克西米连·克拉赫为中国提供间谍证据. 现在,他必须接受审判,以一名同谋."
7,Brasiliens Ex-Präsident Bolsonaro muss in Hausarrest,Der frühere Staatschef Brasiliens spricht bei einer Demonstration per Telefon zur Menge. Die Justiz hält das für rechtswidrig und verstärkt den Druck auf Jair Bolsonaro.,Brazil's ex-president Bolsonaro must be grounded,The former head of state of Brazil speaks to the crowd during a demonstration by telephone. The judiciary considers this illegal and increases the pressure on Jair Bolsonaro.,巴西前总统波尔森罗必须被软禁,"巴西的前任国家元首通过电话和电话对示威游行发言. 司法部门认为这是非法的,并加强了对贾尔·博尔塔罗的压力."
8,News kompakt: Hausarrest für Brasiliens Ex-Staatschef,Der Rechtspopulist Jair Bolsonaro soll gegen gerichtliche Auflagen verstoßen haben. Der ukrainische Präsident Selenskyj besucht Soldaten an der Front. Das Wichtigste in Kürze.,News compact: Home arrest for Brazil's former head of state,The right-wing populist Jair Bolsonaro is said to have violated judicial requirements. Ukrainian President Selenskyi visits soldiers at the front.,最新消息:禁足巴西前国务卿,"法律民粹主义者贾尔·博尔森罗 (Jair Bolsono) 违反了司法程序. 乌克兰总统塞尔伦斯基 (Selenskyj) 在前线访问士兵. 最重要的是,很快."
9,Bosnien: Milorad Dodik verliert Amt nach Urteil,Milorad Dodik darf sein Amt als Präsident der Republika Srpska nicht mehr ausüben. Das Oberste Gericht Bosniens bestätigte das Urteil: Politikverbot für sechs Jahre – Haft bleibt ihm dank Kaution erspart.,Bosnia: Milorad Dodik loses office after judgment,Milorad Dodik is no longer allowed to serve as President of the Republika Srpska. Bosnia's Supreme Court confirmed the verdict: a policy ban for six years – he is spared imprisonment thanks to bail.,波斯尼亚:米洛拉德·多迪克因判决而下台,"米洛拉德·多迪克不能再担任斯普斯卡共和国总统了. 波斯尼亚最高法院证实了判决:6年不得入狱,他获免保释."
10,Weltstillwoche: Muttermilch kann vor Brustkrebs schützen,"Stillen schützt nicht nur Babys, sondern auch Mütter – etwa vor Brustkrebs, Eierstockkrebs und Typ-2-Diabetes. Wie das funktioniert – und was Forschende bisher wissen.",World still week: breast milk can protect against breast cancer,"Breastfeeding not only protects babies, but also mothers – such as breast cancer, ovarian cancer and type 2 diabetes. How this works – and what researchers know so far.",世界休息周:母乳可以防止乳腺癌,"哺乳动物不仅保护婴儿,还保护母亲免受乳腺癌,卵巢癌和2型糖尿病的侵害. 这如何工作,以及迄今为止对研究结果的了解."
11,Plastikmüll: Gelingt ein internationales Abkommen?,In Genf verhandeln 170 Länder über ein UN-Abkommen gegen Plastikmüll. Streitpunkt: Sollte man die Plastik-Produktion begrenzen oder das Recycling verbessern? Die Industrie blockt – auch Deutschland steht in der Kritik.,Plastic waste: Is an international agreement successful?,"In Geneva, 170 countries are negotiating a UN agreement against plastic waste.Is there a dispute: Should we limit plastic production or improve recycling? Industry is blocking – Germany is also critical of this.",塑料废料: 有国际协议吗?,"在日内瓦,170个国家在谈判联合国与塑料废料谈判协议. 争论点是限制塑料生产还是改进回收? 工业阻塞也受到德国的批评."
12,Deutschland: Die Kosten für die Altenpflege explodieren,Die Pflegeversicherung in Deutschland gerät unter Druck: Die Kosten steigen und es fehlen Reformen. Warum immer mehr Senioren ihre Pflege nicht mehr selbst finanzieren können – und was sich ändern muss.,Germany: The costs of care for the elderly are exploding,Care insurance in Germany is under pressure: costs are rising and reforms are missing. Why more and more seniors can no longer finance their care themselves – and what needs to change.,德国:老年护理的费用会爆炸,"德国的医疗保险正受到压力:成本的上升,改革的缺失. 为什么越来越多的老人无法为照顾自己提供资金,以及什么必须改变."
13,Indien: Jugend entdeckt Spiritualität neu,"Indiens Generation Z sucht Trost in Spiritualität – oft jenseits traditioneller Religion. Pilgerreisen, Meditation und Social Media prägen ihren modernen Glauben.",India: Youth rediscovers spirituality,"India's Generation Z seeks consolation in spirituality – often beyond traditional religion. Pilgrimages, meditation and social media shape their modern faith.",印度:青年发现了新精神.,"印度的一代人常常在传统宗教之外寻求精神慰藉. 他们的朝圣之旅,冥想,社交媒体,都决定了他们的现代信仰."
14,"Kroaten und Serben gedenken der Militäroperation ""Sturm""","Vor drei Jahrzehnten beendete die kroatische Militäroperation ""Oluja"" (Sturm) nach über drei Jahren den Kroatien-Krieg. Bis heute sind Serbien und Kroatien im Gedenken gespalten.","Croats and Serbs commemorate the military operation ""Sturm""","Three decades ago, the Croatian military operation ""Oluja"" (Sturm) ended the war on Croatia after more than three years. Serbia and Croatia are still divided in memory.","克罗地亚人和塞尔维亚人纪念""暴风城""军事行动","三十年前,克罗地亚战争结束了克罗地亚战争后,克罗地亚和克罗地亚的科罗地亚的军事行动,直到今天,在纪念中分裂了."
15,Bangladesch: Kaum Fortschritt nach Sturz von Premierministerin Hasina vor einem Jahr,Vor einem Jahr trat Sheikh Hasina als Premierministerin von Bangladesch nach wochenlangen Protesten zurück und floh nach Indien. Seitdem sucht Bangladesch einen politischen Neuanfang. Der gestaltet sich sehr schwierig.,Bangladesh: Hardly any progress after Prime Minister Hasina's fall a year ago,"A year ago, Sheikh Hasina resigned as Prime Minister of Bangladesh after weeks of protests and fled to India. Since then, Bangladesh has been looking for a new political start.",孟加拉国:一年前首相哈西纳倒台后 孟加拉国几乎没有进展,"一年前,谢赫·哈西纳在数周的抗议后辞去孟加拉国总理职务,逃往印度. 自那以后,孟加拉国一直在寻求政治重新开始. 孟加拉国陷入了非常困难的境地."
16,"AfD: Richtungsstreit über das Reizwort ""Remigration""","Die in Teilen rechtsextremistische Partei AfD streitet über ihre politische Ausrichtung. Mit Maximilian Krah warnt einer der bekanntesten Vertreter vor einem Festhalten am Begriff ""Remigration"".","AfD: Dispute over the stimulus word ""remigration""","The far-right party AfD is arguing about its political orientation. With Maximilian Krah, one of the best-known representatives warns against holding on to the term ""remigration"".","Afd:对""移民""的刺激词的对立","极右翼政党的AfD在为政治方向争执. 与马克西米连·克拉赫一起,最著名的代表之一在""归还""一词之前 提醒他."
17,Warum die Geburtenrate in Deutschland immer weiter sinkt,"Frauen in Deutschland bringen im Durchschnitt noch 1,35 Kinder zur Welt - ein historischer Tiefstand. Alarmsignal für den Wohlstand oder ein Zeichen für die Selbstbestimmung der Frau?",Why the birth rate in Germany continues to fall,"On average, women in Germany still give birth to 1.35 children - a historic low. Alarm signal for prosperity or a sign for women's self-determination?",为什么德国的出生率会不断下降,"德国女性平均能生1.35个孩子,历史低谷"
18,Vom Sofa ins Raubtiergehege - wenn Haustiere Zootiere retten,Haustiere sind treue Gefährten und Statussymbole. Da wirkt der Aufruf eines dänischen Zoos recht befremdlich: Er bittet um lebende Haustiere als Futterspenden. Ein keiner Einblick in globale Tierliebe versus Natur.,From the sofa to the predatory enclosure - when pets rescue zoo animals,Pets are faithful companions and status symbols. The call of a Danish zoo seems quite strange: he asks for live pets as food donations. A no insight into global animal love versus nature.,从沙发到野生动物栏杆 当宠物拯救动物时,"宠物是忠诚的伙伴,也是地位的象征. 丹麦动物园的呼吁显得很奇怪:它要求活物作为食物. 没有任何对全球野生动物爱的洞察力."
19,Biopolis – Reise ins Mikrobiom,"Eine junge Wissenschaftlerin erkundet das menschliche Mikrobiom – in einer fünfteiligen Serie, die changiert zwischen Wissenschaft und Fiktion. Der Podcaster Michiel van Poelgeest begleitet Dr. Theda Bartolomaeus vom Max Delbrück Center auf ihrer Suche nach dem Code der Mikroben in uns. (in Englisch)
<p></p>
  <img alt=""Theda Bartolomaeus"" height=""200"" src=""https://www.mdc-berlin.de/system/files/styles/mdc_inline_small_mdc_phablet_1x/private/2025-07/rn_image_picker_lib_temp_7c0c8b45-42be-48ad-b853-cbeef4a8bc06.jpg?h=4521fff0&amp;itok=EjrYGyxS"" width=""320"" />



<p></p>
<p><a href=""https://springcast.app/biopolis-into-the-microbiome""><strong>Podcast Website</strong></a></p><p><a href=""https://podcasts.apple.com/de/podcast/biopolis-into-the-microbiome/id1822739797"">Biopolis bei Apple Podcasts</a></p>
<p></p>

<p></p>",Biopolis – Journey to the microbiome,"A young scientist explores the human microbiome in a five-part series that changes between science and fiction. Podcaster Michiel van Poelgeest accompanies Dr. Theda Bartolomaeus from the Max Delbrück Center in her search for the code of the microbes in us. (in English) <p> </p> <img alt=""Theda Bartolomaeus"" height=""200"" src=""https://www.mdc-berlin.de/system/files/styles/mdc_inline_small_mdc_phablet_1x/private/2025-07/rn_image_picker_lib_temp_7c0c0c8b45-42be-48ad-b853cbeef4a8bc06.jpg?h21fff0&amp;itok=EjrYGyxS"" width=""320"" /> < </p> < bio-pbio-ref> http/bio-ref>.",Biopolis 和 微生物旅行到微生物.,"一名年轻的科学家在五部分中探索人类微生物,并进行科学和虚构之间的交换. 播客Michel/mc_inmel_mmml_mdl_BARt_220/20n_high_mx_p220n_high_b4b4b4b8bb8bbccm."" sc=""http: /w.mdc-blin.de.com/files/mc_mcl_mdit_BAR_BAR_BAR_1x220/20n_high_highr_high_bc8b4b4b4bc4bg=""mc""=""src=""mc=""mc=""mc=""mc=""mc=""mdlins.m2:h"
20,Für verlässliche Handelsbeziehungen mit Afrika: Bundeskabinett leitet Ratifizierung von EU-Handelsabkommen mit afrikanischen Staaten ein,"Auf Vorschlag von Entwicklungsministerin Reem Alabali Radovan hat das Bundeskabinett heute die deutsche Ratifizierung von vier Handelsabkommen der EU mit Côte d’Ivoire, Ghana, Kamerun und sechs Ländern der Entwicklungsgemeinschaft des südlichen Afrikas (Botswana, Eswatini, Lesotho, Mosambik, Namibia, Südafrika) eingeleitet. Unternehmen erhalten durch die Abkommen einen langfristigen verlässlichen Rahmen für Handel und Investitionen.",For reliable trade relations with Africa: Federal Cabinet initiates ratification of EU trade agreements with African states,"On the proposal of Development Minister Reem Alabali Radovan, the Federal Cabinet has today launched the German ratification of four EU trade agreements with Côte d'Ivoire, Ghana, Cameroon and six countries of the Southern African Development Community (Botswana, Eswatini, Lesotho, Mozambique, Namibia, South Africa). The agreements provide companies with a long-term reliable framework for trade and investment.","为了与非洲建立可靠的贸易关系,联邦机构批准了与非洲国家签署的""欧盟贸易协定""","今天,根据发展部长雷姆·阿拉巴利·拉多万的建议,联邦机构已正式批准了欧盟与科特迪瓦,加纳,喀麦隆以及南部发展共同体 (博茨瓦纳,埃斯瓦提尼,莱索托,莫桑比克,纳米比亚,南非) 的四个贸易协定. 协议将为贸易和投资提供一个长期可靠的框架."
21,"Entwicklungsministerin Alabali Radovan zum UN-Bericht zur Lage der weltweiten Ernährungssicherheit (""SOFI-Report"")","Heute wird der UN-Bericht zur Lage der weltweiten Ernährungssicherheit veröffentlicht (The State of Food Security and Nutrition in the World 2025, „SOFI-Report“). Dazu erklärt Entwicklungsministerin Reem Alabali Radovan: „Weltweit leiden unerträglich viele Menschen an Hunger. Das ist inakzeptabel in einer Welt, in der es eigentlich genug Essen für alle gibt. (...)""","Development Minister Alabali Radovan on the UN Report on the Global Food Security Situation (""SOFI Report"")","Today, the UN report on the situation of global food security (The State of Food Security and Nutrition in the World 2025, ""SOFI Report"") states Development Minister Reem Alabali Radovan: ""Many people worldwide suffer from hunger, which is unacceptable in a world where there is actually enough food for everyone. (...)""","世界粮食安全状况的联合国报告 (""SOFI报告"") 的发展部长阿拉巴利·拉多万 (Alabali Radovan)","今天,联合国全球粮食安全报告 (World 2025年,""The State Security and Nuction in the World 2025, SOFI Reem Alabali Radovann) 发表了这一报告. 这解释了世界各国的发展部长莱姆·阿拉巴利·拉多万: 世界上许多人饱受饥饿之苦."
22,Wachstumschancen durch erneuerbare Energien: KfW-Kredit hilft deutschen und südafrikanischen Unternehmen,"Entwicklungsministerin Reem Alabali Radovan hat heute anlässlich ihrer Reise zum G20-Entwicklungsministertreffen eine Vereinbarung mit der südafrikanischen Regierung zum Ausbau der erneuerbaren Energien in Südafrika bekannt gegeben. Mit dem KfW-Kredit in Höhe von 500 Millionen Euro – reine Marktmittel, also ohne deutsches Steuergeld – sollen weitere Reformen des südafrikanischen Energiesektors vorangebracht werden, die gute Bedingungen für privatwirtschaftliche Investitionen schaffen. Dazu gehört der Ausbau der erforderlichen Netze für Solar- und Windanlagen.",Growth opportunities through renewable energies: KfW loan helps German and South African companies,"Development Minister Reem Alabali Radovan today announced an agreement with the South African government on the expansion of renewable energies in South Africa on her trip to the G20 Development Minister Meeting. The KfW loan of EUR 500 million – pure market funds, i.e. without German tax money – is intended to advance further reforms of the South African energy sector that create good conditions for private-sector investments, including the expansion of the necessary solar and wind power grids.",可再生能源为增长带来机会:KFW贷款帮助德国和南非公司.,"发展部长雷姆·阿拉巴利·拉多万 (Reem Alabali Radovan) 今天在前往G-20发展部长会议的路上,与南非政府签订了一项协议,在南非开发可再生能源. KFW发展中心 (KFW) 的市场资源纯额为5亿欧元,即没有德国的税收,南非能源部门应该继续改革,为私人部门投资创造有利条件. 这包括发展必要的太阳能和风能网."
23,Alabali Radovan beim Treffen der G20-Entwicklungsminister*innen: Globale Partnerschaften sichern in unsicheren Zeiten,Im Anschluss an ihre bilateralen Termine in Südafrika nimmt Entwicklungsministerin Reem Alabali Radovan am Treffen der G20-Entwicklungsminister*innen in Skukuza teil (24./25. Juli). Mit Südafrika hat erstmals ein afrikanisches Land die Präsidentschaft der G20 inne. Trotz des Rückzugs der USA aus den Verhandlungen konnte sich die Gruppe der 20 wirtschaftsstärksten Nationen unter anderem auf wichtige Schritte zur Bekämpfung illegaler Finanzströme sowie zur Stärkung sozialer Sicherungssysteme einigen.,Alabali Radovan at the G20 Development Ministers Meeting: Securing Global Partnerships in Unsafe Times,"Following her bilateral appointments in South Africa, Development Minister Reem Alabali Radovan is taking part in the G20 Development Ministers' meeting in Skukuza (24-25 July). With South Africa, for the first time, an African country holds the presidency of the G20. Despite the withdrawal of the US from the negotiations, the group of 20 most economically powerful nations was able to agree on important steps to combat illegal financial flows and strengthen social security systems.","在G-20发展部长会议期间,亚拉巴利·拉多万 (Alabali Radovan) 说: 全球伙伴关系在不确定的时代保护着不确定性","在双边会议之后,发展部长雷姆·阿拉巴利·拉多万 (Rem Alabal Radovan) 将在7月24日至25日在Skurza举行G-20会议. 与南非首次举行了非洲国家总统会议. 尽管美国已退出谈判,但20国集团仍能够商定采取重要步骤打击非法金融流以及加强社会保障制度."
24,Entwicklungsministerin Alabali Radovan in Südafrika: Wirtschaftliche Zusammenarbeit und strategische Partnerschaft stärken,Entwicklungsministerin Reem Alabali Radovan ist zu ihrer ersten großen Afrikareise gestartet. Ein zentrales Thema in Südafrika wird die enge wirtschaftliche Zusammenarbeit zwischen der größten afrikanischen Volkswirtschaft und Deutschland sein. Außerdem nimmt Alabali Radovan vom 24. bis 25. Juli am Treffen der G20-Entwicklungsminister*innen teil.,Development Minister Alabali Radovan in South Africa: Strengthening economic cooperation and strategic partnership,Development Minister Reem Alabali Radovan has started her first major trip to Africa. A central topic in South Africa will be close economic cooperation between the largest African economy and Germany. Alabali Radovan will also take part in the G20 Development Ministers' meeting from 24 to 25 July.,南非的发展部长阿拉巴利·拉多万 加强经济合作和战略伙伴关系,非洲最大经济体与德国之间的密切经济合作将会在7月24日至25日举行的G-20发展部长会议.
25,Bundesentwicklungsministerin Reem Alabali Radovan zu Gaza:,"„Was gerade in Gaza passiert, ist unfassbar. Unschuldige Kinder sterben. Menschen hungern. Ich war gerade in der Region, und alle meine Gespräche haben bestätigt: Es braucht jetzt – nicht irgendwann – einen sofortigen und nachhaltigen Waffenstillstand. Vor diesem Hintergrund sind die Forderungen des Briefes der 29 Partner an die israelische Regierung für mich nachvollziehbar. Ich hätte mir gewünscht, dass Deutschland sich dem Signal der 29 Partner anschließt. (...)""",Federal Minister for Development Reem Alabali Radovan on Gaza:,"""What is happening in Gaza is unbelievable. Innocent children are dying. People are starving. I was in the region right now, and all my conversations have confirmed that an immediate and sustainable ceasefire is needed now – not at some point. Against this background, the demands of the letter from the 29 partners to the Israeli government are understandable to me. I would have liked Germany to join the signal of the 29 partners. (...)""",联邦发展部长莱姆·阿拉巴利·拉多万 (Radovin) 前往加沙 (Reem Alabali Radovan),"目前加沙发生的事件令人难以置信. 无辜儿童正在挨饿. 我才刚到该地区,所有的谈话都证实了:现在不需要立即和可持续的停火. 在这样的背景下,29个伙伴给以色列政府的信的要求是可以解释的. 我希望德国能加入29个伙伴的信号. """
26,Deutschland setzt auf verstärkte internationale Zusammenarbeit zur Umsetzung der Agenda 2030,"Deutschland präsentiert heute seinen dritten Freiwilligen Staatenbericht vor den Vereinten Nationen in New York. Im Rahmen des jährlichen Hochrangigen Politischen Forums (HLPF) kommen dort Vertreter*innen von Regierungen, Zivilgesellschaft, Wissenschaft und Wirtschaft zusammen, um den Fortschritt bei der Umsetzung der Agenda 2030 zu bewerten.",Germany relies on increased international cooperation to implement the 2030 Agenda,"Today, Germany is presenting its third volunteer state report to the United Nations in New York. Representatives of governments, civil society, science and industry will meet at the HLPF to assess progress in implementing the 2030 Agenda.","德国要求加强国际合作,实施2030年议程.","德国今天在纽约向联合国发表了第三次志愿国报告. 在年度高级政治论坛 (HLPF) 中,各国政府,民间社会,科学和经济代表聚集在一起,评估2030年议程的执行进展情况."
