,title-de,content-de,title-en,content-en,title-zh,content-zh
61,USA planen Kaution bei Einreisen aus bestimmten Ländern,"Die US-Regierung verschärft die Bedingungen für visumpflichtige Einreisen. Wer künftig aus bestimmten Ländern als Tourist oder Geschäftsreisender in die USA einreisen will, muss bis zu 15.000 Dollar Kaution auf den Tisch legen.",USA plan bail on entry from certain countries,"The U.S. government tightens the conditions for visa entry. Those who want to enter the U.S. from certain countries as tourists or business travellers must deposit up to $15,000 on the table.",美国计划为某些国家入境保释,"美国政府加剧了对签证移民的限制. 今后想作为游客或旅行者从某些国家移民到美国, 就必须把最多15000美元的保释金交出来."
62,Neuer Meeressaurier in Fossil aus Baden-Württemberg entdeckt,Neue Analysen zeigen: Ein Fossil aus dem Naturkundemuseum Stuttgart ist ein bisher unbekannter Meeressaurier - mit einem ungewöhnlich langen Hals. Gefunden wurde es in einem kleinen Ort in Baden-Württemberg. Von Veronika Simon.,New marine dinosaur discovered in Fossil from Baden-Württemberg,New analyses show: A fossil from the Museum of Natural History Stuttgart is an unknown marine dinosaur - with an unusually long neck. It was found in a small village in Baden-Württemberg. By Veronika Simon.,在巴登-沃特伯格的化石上发现新的海洋生物,新的分析表明 自然历史博物馆的化石是迄今为止从未见过的海洋动物 - - 脖子非常长. 它被发现在巴登-沃恩特伯格的一个小地方. 由维罗妮卡·西蒙 (Veronica Simon) 发现的.
63,Schweizer wollen in Washington über hohen Zollsatz nachverhandeln,"Die Zollsätze stünden ""so gut wie fest"", heißt es aus den USA. Die Schweiz schickt nun kurz vor Fristende eine Delegation nach Washington. Trump hatte den Zollsatz für das Alpenland kurzfristig auf 39 Prozent erhöht.",Swiss want to renegotiate high tariffs in Washington,"The tariffs would be ""as good as fixed,"" says the US. Switzerland is now sending a delegation to Washington shortly before the deadline. Trump had increased the tariff rate for the Alpine country to 39 percent in the short term.",瑞士想在华盛顿进行高关税后再谈判,"根据美国的说法,关税率是""差不多""的. 在截止日期之前,瑞士正在派遣代表团前往华盛顿. 特朗普在短期内将阿尔卑斯山的关税率提高到39% ."
64,"Japan meldet Rekordtemperatur von 41,8 Grad","41,8 Grad - so warm wie in der Stadt Isesaki war es in Japan noch nie. Die Regierung riet den Menschen, zu Hause zu bleiben. Und sie versprach Hilfe unter anderem bei der Bekämpfung von Schädlingen, die sich rasend schnell ausbreiten.",Japan reports record temperature of 41.8 degrees,"41,8 degrees - as warm as in the city of Isesaki it has never been in Japan. The government advised the people to stay at home. And it promised help, among other things, in the fight against pests that spread rapidly.",日本创纪录的气温是41.8度,"41.8度 - - 日本的热度前所未有的高温. 政府建议人们待在家里,并承诺帮助除其他外,对付快速蔓延的害虫."
65,Krieg gegen die Ukraine: Russland und Ukraine attackieren gegenseitig Bahnanlagen,Mit gegenseitigen Angriffen auf die Bahninfrastruktur versuchen Russland und die Ukraine Nachschubwege zu unterbrechen. Moskau meldet unterdessen ein weiteres Vorrücken in der Region Dnipropetrowsk.,War against Ukraine: Russia and Ukraine attack each other's railways,"Russia and Ukraine are trying to break supply routes with mutual attacks on the railway infrastructure. Moscow, meanwhile, is reporting a further advance in the Dnipropetrovsk region.",乌克兰战争 俄罗斯和乌克兰互相攻击铁路设施,"俄罗斯和乌克兰之间相互攻击铁路基础设施,试图切断供应通道. 与此同时,莫斯科在Dnipropetrowsk地区又出现了一次进攻."
66,Nahost-Liveblog: ++ Israel erlaubt private Wareneinfuhren in den Gazastreifen ++,"Israel will mehr Hilfsgüter in den Gazastreifen lassen - und erlaubt deshalb privaten Anbietern den Verkauf von Waren in das Gebiet. Nach Hannover und Düsseldorf haben sich weitere Städte bereit erklärt, hilfsbedürftigen Kindern aus Gaza Schutz zu bieten.",Middle East live blog: ++ Israel allows private imports of goods into the Gaza Strip ++,"Israel wants more aid to the Gaza Strip - and therefore allows private providers to sell goods to the area. After Hanover and Düsseldorf, other cities have agreed to provide protection to children in need from Gaza.",中东参考博客:++以色列允许私人货运进加沙++,"以色列要求在加沙地带提供更多的援助,因此私人供应商可以出售商品到该地区. 在汉诺威和杜塞尔多夫之后,其他城市已经同意提供加沙需要援助的儿童保护."
67,Dresden: Spionage-Prozess gegen Ex-Mitarbeiter von Krah hat begonnen,Am Oberlandesgericht Dresden muss sich seit heute ein ehemaliger Mitarbeiter des AfD-Politikers Krah verantworten. Es geht um jahrelange Spionage für China. Zum Auftakt wies die Verteidigung die Vorwürfe zurück.,Dresden: Espionage trial against former Krah employees has begun,"Since today, a former employee of the AfD politician Krah has been responsible at the Oberlandesgericht Dresden. It is about years of espionage for China. At the beginning, the defense rejected the allegations.",德累斯顿 针对克拉赫前雇员的间谍程序已经开始了,"德累斯顿上等法院,一位前AfD政治家必须接受审判. 这是对中国进行多年的间谍活动. 辩方驳回了指控."
68,EU-Zolldeal mit den USA: Wer soll die Energieimporte bezahlen?,"Die EU hat den USA im Zuge des Zoll-Deals versprochen, Energie im Wert von 750 Milliarden Dollar zu importieren. Doch die Vereinbarung bleibt nebulös. Wer kommt für die Kosten auf? Und wird die Vereinbarung wirklich umgesetzt?",EU customs deal with the USA: Who should pay for energy imports?,"The EU has promised the US, as part of the customs deal, to import 750 billion dollars of energy, but the agreement remains nebulous. Who will pay for the costs? And will the agreement really be implemented?",欧盟和美国的协议: 能源进口要由谁来支付?,"欧盟在海关交易中向美国承诺要进口7500亿美元的能源,但协议仍然很不稳定. 谁愿意为成本付出代价?"
69,Deutsche Post steigert Gewinn trotz Konjunkturschwäche,"Die DHL Group hat im zweiten Quartal mehr verdient als erwartet, vor allem dank des Brief- und Paketgeschäfts in Deutschland. Die negativen Folgen der US-Zollpolitik zeigten sich besonders beim Frachtgeschäft.",Deutsche Post increases profit despite economic weakness,"DHL Group earned more than expected in the second quarter, mainly thanks to the letter and parcel business in Germany. The negative consequences of US customs policy were particularly evident in the freight business.","尽管经济放缓,德国邮政局仍能提高利润","DHL集团在第二季度赚的钱比预期的多得多,尤其要感谢德国的邮政和包裹交易. 美国政策的负面影响在货物交易中尤其明显."
70,Wieso die Lieferando-Mitarbeiter die Arbeit niederlegen,Bei Lieferando häufen sich die Arbeitskämpfe. In vielen Städten demonstrieren die Beschäftigten gegen Massenentlassungen und für bessere Arbeitsbedingungen. Was sind die Probleme beim Lieferdienst?,Why the delivery ando employees lay down the work,"In many cities, workers demonstrate against mass redundancies and for better working conditions. What are the problems with the delivery service?",为什么供应国员工要辞去工作?,"供应商的斗争日益激烈. 在许多城市中,工作者抗议大规模裁员和更好的工作条件. 供应商问题是什么?"
71,Destatis: Bebauung Deutschlands um mehr als 50 Hektar pro Tag gewachsen,"In Deutschland ist in den vergangenen Jahren der Flächenverbrauch für neue Straßen und Gebäude auf 51 Hektar pro Tag gestiegen. Die Bundesregierung plant, dass bis 2050 netto keine neuen Siedlungs- und Verkehrsflächen verbraucht werden.",Destatis: Germany's cultivation increased by more than 50 hectares per day,"In Germany, land use for new roads and buildings has increased to 51 hectares per day in recent years. The Federal Government plans that no new residential and transport areas will be used net by 2050.",德斯塔蒂:德国的建设每天增长超过50公亩.,"在过去的几年里,德国的公路和建筑土地使用量每天上升51公顷. 联邦政府计划到2050年不使用任何新的定居点和交通设施."
72,Wirtschaftliche Lage in der Türkei: Wenn der Urlaub unerschwinglich wird,"In der Türkei können viele Menschen nur davon träumen, am Strand von Bodrum zu liegen. Bei wenigen Urlaubstagen und niedrigen Einkommen machen die meisten nur wenige Tage Ferien bei Verwandten - Urlaub woanders ist zu teuer. Von Uwe Lueb.",Economic situation in Turkey: When the holiday becomes unaffordable,"In Turkey, many people can only dream of lying on the beach of Bodrum. With a few days of holiday and low income, most of them spend only a few days on a family holiday - holiday elsewhere is too expensive. By Uwe Lueb.",土耳其的经济状况:当假期变得不可持续时,"在土耳其,许多人只能梦想在博德姆海滩上躺着. 在度假日和低收入日里,大多数人只能在亲戚家度假几天 - - 其他地方的假期太贵了. 由乌鲁·卢布 (Ue Lueb) 提供."
73,Problem für Deiche und heimische Arten: Nutrias breiten sich aus,"Nutrias, eine aus Südamerika stammende Nagetierart, graben sich durch Deiche und fressen Schilf an Flussläufen. In Deutschland sind sie in immer mehr Regionen zu finden - besonders in Städten. Und sie können zum Problem werden.",Problem for dikes and native species: Nutrias spread,"Nutrias, a rodent species from South America, digs through dikes and eat reeds at river courses. In Germany, they are found in more and more regions - especially in cities. And they can become a problem.",乳腺素和家乡物种的问题: 核子病正在蔓延.,"娜卓亚,来自南美洲的哺乳动物, 钻进池塘, 吃掉河道的珊瑚礁. 在德国,它们可以发现越来越多的区域, 特别是城市. 它们可以变成问题."
74,Rechtsextreme Graue Wölfe nehmen Kinder und Jugendliche ins Visier,"Die Grauen Wölfe sind in Deutschland laut Experten eine der gefährlichsten Extremismus-Bewegungen. ARD-Story-Recherchen zeigen erstmals, wie sie vor allem Kinder und Jugendliche ins Visier nehmen. Von Yağmur Ekim Çay und Annkathrin Weis.",Far-right Grey Wolves Target Children and Teenagers,"According to experts, the Grey Wolves are one of the most dangerous extremism movements in Germany. ARD story research shows for the first time how they target children and young people in particular. By Yağmur Ekim Çay and Annkathrin Weis.",极右翼的灰狼对儿童和青少年下手,"德国的灰狼是最危险的极端主义运动之一,根据专家的推测. 劳德故事研究家首次展示他们如何瞄准儿童和青少年. 由雅穆尔·埃基姆·马基姆和安卡汀·魏斯 (Annakathrin Weis) 负责."
75,"SPD wirft Söder vor, eine ""Bürgergeld-Kampagne"" anzuzetteln","In der Koalition rumort es nach Söders Vorstoß für einen Bürgergeld-Stopp für geflüchtete Ukrainer. SPD-Politiker Bovenschulte sieht darin eine ""umfassende Kampagne"", die Jusos einen populistischen Plan. Die Union will beschwichtigen.","SPD accuses Söder of launching a ""citizen money campaign""","In the coalition, after Söder's push for a citizens' money stop for refugees from Ukraine, the SPD politician Bovenschulte sees it as a ""comprehensive campaign"", which Jusos has a populist plan. The Union wants to appease.","社民党指控Söder发起""公民福利运动""","联军正在调查索德尔为乌克兰逃难者提供公民津贴的动向. 社民党领袖博芬普特认为尤索斯的""全面运动""是民粹主义计划. 联盟想调和一下."
76,Monate vor Weihnachten: Lebkuchen-Hersteller schon im Backstress,"Während einige ihren Sommerurlaub genießen und auf sonniges Wetter hoffen, denken andere bereits an die Weihnachtszeit. Denn schon bald kommen die ersten Lebkuchen, Stollen und Zimtsterne in den Handel.",Months before Christmas: Gingerbread manufacturer already in back stress,"While some enjoy their summer holidays and hope for sunny weather, others already think of the Christmas season. Because soon the first gingerbreads, tunnels and cinnamon stars come into the trade.",圣诞节前几个月 吃蛋糕的制造商已经在烤箱里了,"一些人享受夏日的假期,希望天气晴朗,但有人已经想到圣诞节了. 因为不久之后,第一份姜饼,果酱和肉桂就会出现在贸易中."
77,"Rapper Sean ""Diddy"" Combs bleibt in Haft - Richter gegen Entlassung",Die Anwälte des US-Musikers Combs hatten einen Antrag auf Haftentlassung gestellt. Der zuständige Richter lehnte das ab. Er sieht ein Fluchtrisiko - und eine mögliche Gefahr für Zeugen in dem Prozess. Von M. Ganslmeier.,"Rapper Sean ""Diddy"" Combs remains in custody - Judge against dismissal",The lawyers of the US musician Combs had filed an application for release from prison. The judge in charge refused. He sees a risk of escape - and a possible danger for witnesses in the trial. By M. Ganslmeier.,"饒舌歌手肖恩·""迪迪·康柏斯"" remaining a custody slaughter Sean ""Diddy"" Combs remains in custody - Judge for release.","美国音乐家康伯斯律师已经申请释放. 有关法官拒绝这样做. 他认为有逃亡风险,而且可能对庭审证人造成威胁. 甘斯梅尔先生."
78,Palantir wächst dank KI-Boom weiter und weiter,Das Geschäft der für ihre Zusammenarbeit mit Sicherheitsbehörden bekannten Datenanalyse-Firma Palantir wächst dank Künstlicher Intelligenz rasant. Zum zweiten Mal in diesem Jahr hat der Konzern seine Prognose angehoben.,Palantir continues to grow thanks to AI boom,"The business of the data analysis company Palantir, known for its cooperation with security authorities, is growing rapidly thanks to artificial intelligence. For the second time this year, the Group has increased its forecast.","由于人工智慧的繁荣,帕兰蒂尔的成长更进一步","由于人工智能,帕兰蒂尔公司与安全机构合作的交易正在快速增加. 今年,该公司第二次提高了预测力."
79,Bürgergeld für ukrainische Geflüchtete - ein Überblick,Wie ist die aktuelle Regelung für Geflüchtete aus der Ukraine? Was spricht für eine Änderung - und was dagegen? Ein schneller Überblick über zentrale Fragen. Von Hans-Joachim Vieweger.,Citizens' money for Ukrainian refugees - an overview,What is the current regulation for refugees from Ukraine? What does it mean to change - and what about it? A quick overview of central questions. By Hans-Joachim Vieweger.,乌克兰被吓跑的公民的钱 概览一下,乌克兰逃犯的现行安排是什么? 什么改变? 反对吗? 汉斯·乔希姆·维维耶韦瑟的简短概述
80,Wie rechtsextreme Influencer Hass im Netz schüren,"Ein Kopfschütteln reichte, um einen Zuschauer in der Talkshow ""maischberger"" zur Zielscheibe digitaler Hetze zu machen. Eine neue VOLLBILD-Recherche zeigt, wie unter anderem rechtsextreme Influencer solche Hasswellen in Gang setzen.",How far-right influencers stir hatred in the net,"A headshaking was enough to make a spectator in the talk show ""maischberger"" the target of digital incitement. A new FOLLBILD research shows how right-wing extreme influencers, among other things, set such hate waves in motion.",极右翼的仇恨是如何在网络上激发的.,"摇头足以让""马萨诸塞人""秀的观众成为数字霸主. 新的VOLBRD调查显示极右翼的潜伏者如何引发这样的仇恨浪潮."
81,Spionage-Prozess gegen Ex-Mitarbeiter von Krah beginnt,Ein ehemaliger Mitarbeiter des AfD-Politikers Krah steht unter Spionage-Verdacht für China. Mit seiner mutmaßlichen Komplizin muss er sich nun vor Gericht verantworten. China weist die Vorwürfe zurück.,Espionage trial against ex-employee of Krah begins,A former employee of the AfD politician Krah is suspected of espionage for China. With his alleged accomplice he now has to answer to court. China rejects the allegations.,针对前克拉赫雇员的间谍程序开始,AfD政客克拉赫的前任官员对中国进行间谍调查. 他的同谋现在必须接受审判. 中国反对这些指控.
82,Warum Bolsonaro-Anhänger die US-Zölle feiern,"50 Prozent US-Zölle auf Importe aus Brasilien - das feiern einige im Land. Sie hoffen, Zölle und Sanktionen von US-Präsident Trump könnten den Prozess gegen Ex-Präsident Bolsonaro beenden. Von A. Herrberg und X. Böttcher.",Why Bolsonaro followers celebrate US tariffs,50 percent US tariffs on imports from Brazil - some celebrate this in the country. They hope US President Trump's tariffs and sanctions could end the trial against former President Bolsonaro. By A. Herrberg and X. Böttcher.,为什么布尔桑罗支持者要庆祝美国关税,他们希望美国总统特朗普能结束对前总统波索纳洛的关税和制裁. 从A. Herrberg 和 X.
83,Medienberichte: Netanjahu strebt Einnahme des ganzen Gazastreifens an,"Medienberichten zufolge will Israels Premier Netanjahu den gesamten Gazastreifen einnehmen. Es soll demnach auch Einsätze in Gebieten geben, in denen Geiseln vermutet werden. Noch diese Woche soll Israels Sicherheitskabinett zusammenkommen.",Media reports: Netanyahu seeks to capture the entire Gaza Strip,"According to media reports, Israel's Prime Minister Netanyahu wants to take over the entire Gaza Strip. Therefore, there is also to be operations in areas where hostages are suspected. Israel's security cabinet is to meet this week.",媒体报道: 内塔尼亚胡想占领加沙地带,"媒体报道说以色列总理内塔尼亚胡打算占领加沙地带. 因此,据说在可疑的人质地区也有行动. 本周,以色列安全屋将齐聚一堂."
84,Richter stellt Brasiliens Ex-Präsidenten Bolsonaro unter Hausarrest,Das Oberste Gericht in Brasilien hat Hausarrest für den Ex-Präsidenten Bolsonaro angeordnet. Er soll gegen Auflagen verstoßen haben. Außerdem soll die Maßnahme Medien zufolge eine Flucht verhindern.,Judge puts Brazil's ex-president Bolsonaro under house arrest,"The Supreme Court in Brazil has ordered house arrest for ex-president Bolsonaro, who is said to have violated regulations, and according to the media, the measure is intended to prevent an escape.",法官将巴西前总统波尔森罗软禁在内,"巴西最高法院下令软禁前总统波尔森罗,据称他违反了规定,据说媒体阻止了逃狱"
85,Hitzewelle in Spanien fordert Todesopfer,In Spanien sorgt eine Hitzewelle wieder für Temperaturen um 40 Grad. Ein Mann ist nach Behördenangaben an den Folgen der Hitze gestorben. Auf Mallorca wird einer Gemeinde im Kampf gegen Trockenheit das Wasser abgedreht.,Heat wave in Spain kills victims,"In Spain, a heat wave restores temperatures by 40 degrees. According to the authorities, a man died from the consequences of the heat. In Mallorca, a municipality is turned off in the fight against drought.",西班牙的热浪造成死亡,"在西班牙,有股热浪卷土重来,导致气温升高了40度. 一名男子据官方统计,死于热带影响. 在马洛卡,一个社区在对抗干旱的斗争中,水流会疯狂地流出水来."
86,Marktbericht: Zinsbullen scharren mit den Füßen,Die schwachen Arbeitsmarktdaten vom Freitag haben der Wall Street umgehend neue Zinshoffnungen beschert. Auch die US-Notenbank Federal Reserve selbst steht dabei im Fokus.,Market Report: Interest rate bulls scratch their feet,The weak labour market data from Friday immediately brought new interest-rate hopes to Wall Street. The focus is also on the US Federal Reserve itself.,市场报告: 利息警察的脚踏实地.,美联储本人也在关注这个问题.
87,Strafzölle für Öl-Käufe: Trump will Aufschläge für Indien noch einmal erhöhen,"US-Präsident Trump plant, die Zölle für Indien noch einmal anzuheben - und begründet das mit Indiens Käufen von russischem Öl. Finanzminister Klingbeil versucht indes, in Washington die Lage für die deutsche Stahlbranche zu retten.",Penalties for oil purchases: Trump wants to increase extras for India once again,"US President Trump is planning to raise tariffs for India once again - and is justifying this with India's purchases of Russian oil. Finance Minister Klingbeil, however, is trying to save the situation for the German steel industry in Washington.",石油收购关税:特朗普想再次增加印度的收费额.,"美国总统特朗普计划再次提高对印度的关税,并以印度购买俄罗斯石油为依据. 克林贝尔财政部长克林贝尔正试图拯救华盛顿的钢铁业."
88,Debatte über Bürgergeld: Klingbeil warnt vor Koalitionsstreit,"CSU-Chef Söder plädiert für einen Stopp aller Bürgergeld-Zahlungen an Geflüchtete aus der Ukraine - SPD-Chef Klingbeil hält davon offenbar wenig: Manche Vorschläge trügen ""nicht dazu bei, dass wir in der Koalition gemeinsam vorankommen"".",Citizen money debate: Klingbeil warns against coalition dispute,"CSU boss Söder pleads for a stop to all civil money payments to refugees from Ukraine - SPD boss Klingbeil seems to think little of this: Some proposals ""do not help us to move forward together in the coalition"".",关于公民钱的争论: 克林贝尔警告联盟斗争.,"CSU首席执行官Söder建议停止所有来自乌克兰的逃犯支付的公民津贴 - - SPD总裁Klingbil似乎对此不满意 - - 有些提议""我们无法联合起来"""
89,Wie sich Trumps Wirtschaftspolitik auswirkt,"Enttäuschende Arbeitsmarktzahlen und schlechte Stimmung in der Industrie, trotzdem wächst die Wirtschaft: Die Lage in den USA scheint zweigeteilt. Doch die konjunkturellen Alarmsignale häufen sich.",How Trump's Economic Policy Is Impacted,"Disappointing labour market figures and a bad mood in industry, the economy is still growing: the situation in the US seems to be divided into two, but the economic alarms are rising.",特朗普的经济政策对特朗普的影响,"劳动力市场令人失望,工业情绪低落,但经济增长不振:美国局势似乎两极分化. 但周期性警铃不断增加."
90,Nach Austausch mit AfD: Union distanziert sich von Abgeordneter Ludwig,Erneute Kritik an CDU-Politikerin Ludwig: Vor Kurzem besuchte sie das Festival einer rechten Denkfabrik in Ungarn - und kam dabei offenbar ins Gespräch mit AfD-Chefin Weidel. Die Union distanziert sich von ihrer Abgeordneten.,After exchange with AfD: Union dissociates itself from deputy Ludwig,Renewed criticism of CDU politician Ludwig: Recently she visited the festival of a right-wing think tank in Hungary - and apparently came into conversation with AfD leader Weidel. The Union distanced itself from its deputies.,和AfD交换后: 联盟与路德维希议员疏远,"对CDU政客路易再次批评:最近她去了匈牙利一个右翼智囊团,显然与AfD首席执行官韦勒的谈话. 联盟与议会议员疏远了."
91,Kommentar zur Bürgergeld-Debatte: Ständig wiederkehrendes Ablenkungsmanöver,"Die Regierung und vor allem die Union sollte aufhören, so zu tun, als seien mit Kürzungen am Bürgergeld die wichtigsten Probleme gelöst, meint Jim-Bob Nickschas. Damit lenkt sie nur ab. Die Realität ist komplizierter.",Comment on the Citizens' Money Debate: Constantly Recurring Distraction,"The government and, above all, the Union should stop pretending that the most important problems have been solved by cuts in civic money, says Jim-Bob Nickschas, which only distracts them. Reality is more complicated.",关于公民金钱辩论的评论: 不断的分散注意力,"政府,特别是联盟,应该停止假装 削减公民津贴是问题的关键,吉姆-巴比认为它只是转移注意力. 现实情况更加复杂."
