,title-en,content-en,title-de,content-de,title-es,content-es,title-fr,content-fr,title-zh,content-zh
39,How scared should you be of “the China squeeze”?,Xi Jinping masters the dark arts of the trade war,Wie verängstigt solltest du vor dem China-Squeeze sein?,Xi Jinping beherrscht die dunklen Künste des Handelskrieges,¿Qué tan asustado debería estar de “el apretón de China”?,Xi Jinping domina las artes oscuras de la guerra comercial,À quel point devriez-vous avoir peur de la Chine ?,Xi Jinping maîtrise les arts sombres de la guerre commerciale,你该多害怕“中国挤压”?,习近平掌握着贸易战争的黑暗艺术
40,Shanxi province is struggling to diversify away from coal,Why the transition is going so slowly,Die Provinz Shanxi kämpft um die Diversifizierung weg von der Kohle,Warum der Übergang so langsam voranschreitet,La provincia de Shanxi está luchando por diversificarse lejos del carbón,¿Por qué la transición va tan lentamente?,La province du Shanxi peine à se diversifier loin du charbon,Pourquoi la transition va si lentement,山西省正努力从煤炭中走向多样化,为什么过渡过程如此缓慢
41,"Six months after DeepSeek’s breakthrough, China speeds on with AI",Real-world applications have priority over cutting-edge development,Sechs Monate nach dem Durchbruch von DeepSeek beschleunigt China mit KI,Real-Welt-Anwendungen haben Vorrang vor modernster Entwicklung,"Seis meses después del avance de DeepSeek, China acelera con IA",Las aplicaciones del mundo real tienen prioridad sobre el desarrollo de vanguardia,"Six mois après la percée de DeepSeek, la Chine s'accélère avec l'IA",Les applications du monde réel ont la priorité sur le développement à la fine pointe de la technologie,"在DeepSeek突破六个月后,",现实世界的应用优先于前沿发展
42,Savvy staff are moving from China’s nurseries to its care homes,Last year there were 12m fewer pre-school pupils than in 2021,Savvy Mitarbeiter bewegen sich von Chinas Baumschulen zu seinen Pflegeheimen,Letztes Jahr gab es 12m weniger Vorschulkinder als 2021,El personal de Savvy se está trasladando de las guarderías chinas a sus hogares de acogida,El año pasado hubo 12 millones menos de alumnos preescolares que en 2021,Le personnel de Savvy déménage des crèches chinoises vers ses foyers de soins,"L'année dernière, il y avait 12 millions d'élèves d'âge préscolaire de moins qu'en 2021.",Savvvy工作人员正在从中国的托儿所迁至其护理之家。,"去年,学龄前学生人数比2021年少12万,比2021年少12万。"
43,Everyone loses in the rage of China’s delivery wars,Companies are caught in a race to the bottom,Jeder verliert in der Wut Chinas Lieferkriege,Unternehmen sind in einem Wettlauf nach unten gefangen,Todo el mundo pierde en la furia de las guerras de entrega de China,Las empresas están atrapadas en una carrera hasta el fondo,Tout le monde perd dans la rage des guerres de livraison de la Chine,Les entreprises sont prises dans une course au fond,"在中国投送战争的狂暴中,每个人都输了",公司在竞到底部的比赛中被抓住
44,Can pensioners rescue China’s economy?,The government is stingy and timid when it comes to retirement benefits,Können Rentner die chinesische Wirtschaft retten?,"Die Regierung ist geizig und zaghaft, wenn es um Rentenleistungen geht.",¿Pueden los pensionistas rescatar la economía china?,El gobierno es tacaño y tímido cuando se trata de beneficios de jubilación,Les retraités peuvent-ils sauver l'économie chinoise ?,Le gouvernement est téméraire et timide en ce qui concerne les prestations de retraite,养老金领取者能够拯救中国的经济吗?,"在退休金方面,政府很吝啬和胆怯。"
45,“Comrade” is making a comeback in China,Or so the government hopes,"""Comrade"" macht ein Comeback in China",Oder so hofft die Regierung,“Camarada” está volviendo a China,O eso es lo que el gobierno espera,Le camarade fait un retour en Chine,Ou alors le gouvernement espère,“同志”正在中国重新崛起,或政府希望
46,The looming deadline for the Panama Canal ports deal,China will approve their sale. But there’s a huge catch,Die bevorstehende Frist für den Panama-Kanal-Ports-Deal,China wird ihren Verkauf genehmigen. Aber es gibt einen riesigen Fang,El inminente plazo para el acuerdo con los puertos del Canal de Panamá,"China aprobará su venta, pero hay una enorme captura",L'échéance prochaine pour l'accord sur les ports du canal de Panama,La Chine va approuver leur vente. Mais il ya une énorme prise,巴拿马运河港口交易的最后期限即将到来,中国会批准它们的销售。 但有一个巨大的收获。
47,Texas’s Democrats prepare for a glorious defeat,With the lawmakers in suburban Illinois,Texas-Demokraten bereiten sich auf eine glorreiche Niederlage vor,Mit den Gesetzgebern im Vorort Illinois,Los demócratas de Texas se preparan para una gloriosa derrota,Con los legisladores en los suburbios de Illinois,Les démocrates du Texas se préparent à une glorieuse défaite,Avec les législateurs de la banlieue de l'Illinois,得克萨斯的民主党准备一场光荣的失败,在伊利诺伊郊区与立法者
48,Why the Trump administration excites some personal-injury lawyers,The strange case of vaccine-injury courts,Warum die Trump-Administration einige persönlich verletzte Anwälte anregt,Der seltsame Fall von Impfstoff-Verletzungsgerichten,Por qué la administración Trump excita a algunos abogados de lesiones personales,El extraño caso de los tribunales de lesiones por vacunación,Pourquoi l'administration Trump excite certains avocats-mutilés,L'étrange affaire des tribunaux de la vaccination-blessures,为什么特朗普政府 激怒了一些个人伤害律师,疫苗伤害法庭这一奇怪的案件
49,The real collusion between Donald Trump and Vladimir Putin,It may be scarier than their critics long suspected,Die wirkliche Absprache zwischen Donald Trump und Wladimir Putin,"Es kann beängstigend sein, als ihre Kritiker lange vermuteten",La verdadera connivencia entre Donald Trump y Vladimir Putin,Puede ser más aterrador de lo que sus críticos sospecharon desde hace mucho tiempo.,La véritable collusion entre Donald Trump et Vladimir Poutine,Il peut être plus effrayant que leurs critiques longtemps soupçonnés,唐纳德·特朗普和弗拉基米尔·普京之间的真正勾结,可能比他们的批评者 长期怀疑更可怕
50,Trump 2 is pushing environmentalists to rethink their approach,The administration is trying to erase climate-change regulation,"Trump 2 drängt Umweltschützer, ihren Ansatz zu überdenken","Die Regierung versucht, die Regulierung des Klimawandels zu beseitigen.",Trump 2 está empujando a los ambientalistas a repensar su enfoque,La administración está tratando de borrar la regulación del cambio climático,Trump 2 pousse les écologistes à repenser leur approche,L'administration essaie d'effacer la régulation du changement climatique,特朗普2号正在推动环保主义者重新思考他们的方法,当局试图抹去气候变化条例
51,How many pythons could you catch in ten days?,Florida gamifies conservation in the Everglades,Wie viele Pythons könnten Sie in zehn Tagen fangen?,Florida gamifiziert Erhaltung in den Everglades,¿Cuántos pitones podrías coger en diez días?,Florida gamifica la conservación en los Everglades,Combien de pythons avez-vous pu attraper en dix jours ?,La Floride gamifie la conservation dans les Everglades,10天之内能捕到多少个保龄球?,佛罗里达州在Everglades 保护银河
52,Why Donald Trump is wrong to take over the DC police,The emergency he cites is overhyped,"Warum Donald Trump falsch ist, die DC-Polizei zu übernehmen",Der von ihm zitierte Notfall ist überfüllt.,Por qué Donald Trump se equivoca al hacerse cargo de la policía de DC,La emergencia que cita es exagerada.,Pourquoi Donald Trump a tort de prendre le contrôle de la police de DC,L'urgence qu'il cite est exagérée.,为什么唐纳德·特朗普 抓了华盛顿警方是错的,他提到的紧急事件 已经过头了
53,America’s drug regulator is in turmoil,The already fraught oversight of rare-disease treatments is becoming politicised,Amerikas Drogen-Regulator ist in Turbulenzen,Die bereits angespannte Überwachung der Behandlung mit seltenen Krankheiten wird zunehmend politisiert.,El regulador de drogas de Estados Unidos está en agitación,La ya tensa supervisión de los tratamientos de enfermedades raras se está politizando,Americas drug regulator est dans la tourmente,Le contrôle déjà chargé des traitements des maladies rares devient politisé,美国的药物监管者处于动荡之中,对稀有疾病治疗的本已充满监督的监管正日益政治化
54,How is Trump’s Brazil-bashing putting America first?,It isn’t,Wie setzt Trumps Brasilien-Bashing Amerika an die erste Stelle?,Es ist nicht,¿Cómo es que el golpe de Trump en Brasil está poniendo a Estados Unidos en primer lugar?,No lo es,Comment Trump est-il en train de mettre l'Amérique en premier ?,Ce n'est pas,特朗普对巴西的抨击如何将美国放在首位?,"并不是,"
55,Alligator Alcatraz is an exercise in performative cruelty,Many Republican voters don’t like it,Alligator Alcatraz ist eine Übung in performativer Grausamkeit,Viele republikanische Wähler mögen es nicht,El cocodrilo Alcatraz es un ejercicio de crueldad performativa,A muchos votantes republicanos no les gusta,Alcatraz alligator est un exercice de cruauté performative,Beaucoup d'électeurs républicains ne l'aiment pas,鳄鱼阿尔卡特拉齐是一种表现残忍的行为,"许多共和选民都不喜欢,"
56,"Alleged Cincinnati attackers walk free after bond cuts, police hunt eighth suspect","DeKyra Vernon and Aisha Devaughn posted $2,500 bond each in the July 26 Cincinnati assault case as authorities hunt for another suspect in the attack","Angeblich Cincinnati Angreifer gehen frei nach Bond Cuts, Polizei Jagd achter Verdächtiger","DeKyra Vernon und Aisha Devaughn haben im Angriffsfall Cincinnati am 26. Juli jeweils 2.500 Dollar gebunden, als Behörden einen weiteren Verdächtigen im Angriff jagen.","Presuntos atacantes de Cincinnati caminan libres después de cortes de bonos, la policía caza octavo sospechoso","DeKyra Vernon y Aisha Devaughn publicaron un bono de $2,500 cada uno en el caso de asalto de Cincinnati el 26 de julio mientras las autoridades cazan a otro sospechoso en el ataque","Les agresseurs présumés de Cincinnati marchent libre après les coupures d'obligations, la police chasse huitième suspect","DeKyra Vernon et Aisha Devaughn ont versé 2 500 $ chacun dans l'affaire d'agression du 26 juillet Cincinnati, les autorités cherchant un autre suspect dans l'attaque.","据称辛辛那提袭击者在断债后自由行走,","7月26日辛辛那提攻击案, 当局在7月26日搜捕另一名疑犯时, DeKyra Vernon和Aisha Devaughn分别发了2 500美元的保证金,"
57,California pastor leads rally at state capitol warning parents to flee state if 'dangerous' bill passes,"California pastor Jack Hibbs urged families to flee the state if a bill expanding caregiver rights passes, warning it could strip away parents&apos; rights.","Kalifornien Pastor führt Kundgebung bei State Capitol Warnung Eltern zu fliehen Zustand, wenn ""gefährliche"" Rechnung geht","Der kalifornische Pastor Jack Hibbs forderte Familien auf, aus dem Staat zu fliehen, wenn ein Gesetz zur Erweiterung der Pflegerrechte vergeht, und warnte davor, dass es Eltern & Apos wegnehmen könnte; Rechte.",Pastor de California lidera mitin en el capitolio estatal advirtiendo a los padres que huyan del estado si se aprueba la ley 'peligrosa',"El pastor de California, Jack Hibbs, instó a las familias a huir del estado si se aprueba una ley en expansión de los derechos de cuidador, advirtiendo que podría despojar a los padres y padres; derechos.","California pasteur mène le rassemblement au capitole de l'État avertissant les parents de fuir l'État si le projet de loi ""dangereux"" passe","Le pasteur californien Jack Hibbs a exhorté les familles à fuir l'État si un projet de loi élargissant les droits des aidants naturels passe, l'avertit qu'il pourrait enlever les parents et apos; droits.","加州牧师领头在州立首都集会,警告父母如果“危险”法案通过,父母将逃离州。","加利福尼亚牧师Jack Hibbs敦促家庭逃离该州,"
58,Get up to 83% off lifetime licenses for Acrobat Classic and Microsoft Office Professional,Elevate your productivity with the Adobe Acrobat Classic and Microsoft Office Professional lifetime license bundle.,Erhalten Sie bis zu 83% Rabatt auf lebenslange Lizenzen für Acrobat Classic und Microsoft Office Professional,Erhöhen Sie Ihre Produktivität mit dem Adobe Acrobat Classic und Microsoft Office Professional lebenslangen Lizenzpaket.,Obtenga hasta un 83% de licencias de por vida para Acrobat Classic y Microsoft Office Professional,Eleva tu productividad con el paquete de licencia de por vida Adobe Acrobat Classic y Microsoft Office Professional.,Obtenez jusqu'à 83 % de licences à vie pour Acrobat Classic et Microsoft Office Professional,Augmentez votre productivité grâce au package de licences Adobe Acrobat Classic et Microsoft Office Professional à vie.,Acrobbat 经典和微软办公室专业人员的终身许可证最多可达83%,用Adobe Acrobat经典和微软办公室专业终身许可证包提高生产率。
59,Aubrey Plaza battles 'daily struggle' after husband’s death at 47,&quot;The White Lotus&quot; star Aubrey Plaza shares emotional update on daily struggle with grief following husband Jeff Baena&apos;s death by suicide.,Aubrey Plaza kämpft 'Tageskampf' nach dem Tod des Mannes bei 47,&quot;The White Lotus&quot; Star Aubrey Plaza teilt emotionale Aktualisierung über den täglichen Kampf mit Trauer nach Ehemann Jeff Baena&apos;s Tod durch Selbstmord.,Aubrey Plaza batalla 'lucha diariamente' después de la muerte del marido a los 47,&quot;El Loto Blanco&quot; la estrella Aubrey Plaza comparte la actualización emocional sobre la lucha diaria con el dolor después de la muerte del marido Jeff Baena&apos;s por suicidio.,Aubrey Plaza combat 'lutte quotidienne' après la mort du mari à 47,L'étoile Aubrey Plaza partage une mise à jour émotionnelle sur la lutte quotidienne contre le chagrin suite à la mort par suicide du mari Jeff Baena&apos.,"Aubrey Plaza在47岁丈夫死后,",& quot; 白色Lotus&quot; 明星 Aubrey Plaza 分享丈夫Jeff Baena&apos因自杀而死亡后每日悲痛挣扎的情感更新。
60,Conservative 'playbook' to beat Democrats in court outlined in senator's new book,"Sen. Eric Schmitt, R-Mo., outlined to Fox News Digital how Democrats used lawfare to &quot;silence dissent&quot; under the Biden administration, and how his book shows a path ahead for conservatives to battle the Left in court.","Konservatives ""Spielbuch"" gegen Demokraten vor Gericht skizziert in Senators neuem Buch","Sen. Eric Schmitt, R-Mo., skizzierte Fox News Digital, wie Demokraten Gesetz für &quot;Schweigen dissent&quot; unter der Biden-Administration, und wie sein Buch zeigt einen Weg für Konservative, um die Linke vor Gericht zu kämpfen.","El ""libro de jugada"" conservador vencerá a los demócratas en la corte esbozado en el nuevo libro del senador","El senador Eric Schmitt, R-Mo., describió a Fox News Digital cómo los demócratas usaron la vía de la ley para &quot;silencia disentir&quot; bajo la administración de Biden, y cómo su libro muestra un camino por delante para que los conservadores luchen contra la izquierda en la corte.",Livre de jeu conservateur pour battre les démocrates au tribunal décrit dans le nouveau livre du sénateur,"Le Sen. Eric Schmitt, R-Mo., a expliqué à Fox News Digital comment les démocrates utilisaient le droit à la dissidence de &quot;silence; sous l'administration de Biden, et comment son livre montre une voie à suivre pour les conservateurs pour combattre la gauche en cour.",保守的“游戏本” 在法庭上打败民主党人 参议员的新书中概括了,"Sen. Eric Schmitt,R-Mo.向Fox News Digital 描述民主党如何在拜登政府统治下使用法律工具,"
61,MS-13 gang member arrested in DC as Bondi touts admin's 'extraordinary' crime crackdown,"Trump administration reports 465 total arrests and 68 guns seized in Washington D.C. federal policing operation, with nearly half occurring in high-crime areas.","MS-13 Gangmitglied verhaftet in DC als Bondi touts Admin ""außerordentliche"" Verbrechensbekämpfung","Trump-Administration berichtet von 465 Verhaftungen und 68 Geschützen, die in Washington D.C. föderale Polizeioperationen beschlagnahmt wurden, wobei fast die Hälfte in Gebieten mit hoher Kriminalität vorlag.","MS-13 pandillero arrestado en DC como la ""extraordinaria"" represión del crimen de Bondi touts","La administración Trump reporta 465 arrestos totales y 68 armas incautadas en Washington D.C. operación policial federal, con casi la mitad ocurriendo en áreas de alto crimen.",MS-13 membre de gang arrêté à DC comme Bondi touts admin 'extraordinaire' répression du crime,"L'administration Trump rapporte 465 arrestations totales et 68 armes saisies à Washington D.C. opération de police fédérale, avec près de la moitié se produisant dans les zones à forte criminalité.",在DC被捕的MS-13黑帮成员 以邦迪·托托夫 行政官的“特别”犯罪镇压,"特朗普行政当局报告说,在华盛顿特区联邦治安行动中共逮捕465人,缴获68支枪支,其中近一半发生在犯罪率高的地区。"
62,Yankees World Series champion says he'd be 'very surprised' if team misses postseason despite struggles,"David Cone optimistic about the Yankees&apos; playoff chances, highlighting improved pitching rotation and return of key players, Aaron Judge and Giancarlo Stanton.","Yankees World Series Champion sagt, er wäre 'sehr überrascht', wenn Team verpasst Nachsaison trotz Kämpfen","David Cone optimistisch über die Yankees&apos; Playoff-Chancen, Hervorhebung verbessert Pitching Rotation und Rückkehr der wichtigsten Spieler, Aaron Judge und Giancarlo Stanton.","El campeón de la Serie Mundial de Yankees dice que estaría ""muy sorprendido"" si el equipo fallara la posttemporada a pesar de las luchas","David Cone optimista acerca de los Yankees&apos; oportunidades de playoff, destacando mejor rotación de lanzamiento y retorno de los jugadores clave, Aaron Judge y Giancarlo Stanton.","Le champion des Yankees World Series dit qu'il serait ""très surpris"" si l'équipe rate la saison après-saison malgré les luttes","David Cone est optimiste au sujet des Yankees&apos; les chances des séries éliminatoires, soulignant l'amélioration de la rotation des lancers et le retour des joueurs clés, Aaron Judge et Giancarlo Stanton.","扬基队世界大赛冠军说,如果球队不顾挣扎,错过后季赛,他会感到非常惊讶","David Cone对扬基和阿波斯; 决赛机会感到乐观, 突显出主要球员、 Aaron Judge 和 Giancarlo Stanton 的投球轮回率的提高。"
63,The Who's Pete Townshend says he has only five years left in show business career,"In an interview, Pete Townshend opened up about his career over the past 60 years and explained why he only has about five years left in show business.","The Who's Pete Townshend sagt, er hat nur noch fünf Jahre in Show-Business-Karriere","In einem Interview eröffnete Pete Townshend über seine Karriere in den letzten 60 Jahren und erklärte, warum er nur noch etwa fünf Jahre im Showbusiness habe.",The Who's Pete Townshend dice que sólo le quedan cinco años en la carrera del mundo del espectáculo,"En una entrevista, Pete Townshend abrió sobre su carrera en los últimos 60 años y explicó por qué sólo le quedan unos cinco años en el mundo del espectáculo.",Le Who's Pete Townshend dit qu'il ne lui reste que cinq ans de carrière dans le show-business,"Dans une entrevue, Pete Townshend a ouvert sur sa carrière au cours des 60 dernières années et a expliqué pourquoi il ne lui reste que cinq ans dans le show business.",谁是皮特·汤盛说 他只有五年时间 从事艺艺生涯,"Pete Townshend在接受采访时, 揭开了他过去60年的职业生涯, 并解释了为什么他只有大约五年时间从事表演业务。"
64,Trump admin slams ACLU for comparing ICE center to Japanese internment camp: 'Deranged and lazy',DHS official calls ACLU comparison of Fort Bliss immigrant detention facility to WWII internment camps &apos;deranged and lazy&apos; as center opens Monday,Trump admin slams ACLU für den Vergleich ICE Zentrum zu japanischen Internierungslager: 'Gestört und faul',DHS offiziell ruft ACLU Vergleich von Fort Bliss Immigrant Haftanstalt zu WWII Internierungslager &apos;geordnet und faul&apos; als Zentrum geöffnet Montag,"El administrador de Trump critica a ACLU por comparar el centro de ICE con el campo de internamiento japonés: ""Desquiciado y perezoso""",DHS oficial llama ACLU comparación de centro de detención de inmigrantes Fort Bliss a campos de internamiento de la Segunda Guerra Mundial &apos; desquiciados y perezosos &apos; a medida que el centro abre el lunes,Trump admin clams ACLU pour comparer le centre ICE au camp d'internement japonais: 'Dérangé et paresseux',DHS official appelle ACLU comparaison du centre de détention d'immigrants de Fort Bliss aux camps d'internement de la Deuxième Guerre mondiale &apos;dérangé et paresseux&apos; comme le centre ouvre lundi,将ICE中心与日本拘留营作比较:,国土安全部官方称ACLU将Bliss堡移民拘留设施与WWWII拘留营和apos的比较;
65,"Cutting this food could nearly double weight loss, plus ancient writings about Moses discovered","The Fox News Lifestyle Newsletter brings you trending stories on family, travel, food, neighbors helping neighbors, pets, autos, military veterans, heroes, faith and American values.","Schneiden dieses Essen könnte fast doppelt so viel Gewicht zu verlieren, plus alte Schriften über Moses entdeckt","The Fox News Lifestyle Newsletter bringt Sie Trendgeschichten über Familie, Reisen, Essen, Nachbarn helfen Nachbarn, Haustiere, Autos, Militärveteranen, Helden, Glauben und amerikanische Werte.","Cortar este alimento podría casi duplicar la pérdida de peso, además de escritos antiguos sobre Moisés descubierto","The Fox News Lifestyle Newsletter te trae historias de moda sobre familia, viajes, comida, vecinos ayudando a vecinos, mascotas, autos, veteranos militares, héroes, fe y valores estadounidenses.","Couper cette nourriture pourrait presque double perte de poids, ainsi que des écrits anciens sur Moïse découverts","Le Fox News Lifestyle Newsletter vous propose des histoires tendance sur la famille, les voyages, la nourriture, les voisins aidant les voisins, les animaux de compagnie, les automobiles, les anciens combattants, les héros, la foi et les valeurs américaines.",再加上关于摩西的古老著作,福克斯新闻《生活方式通讯》带来关于家庭、旅行、食物、邻居帮助邻居、宠物、汽车、退伍军人、英雄、信仰和美国价值观的流行故事。
66,Joe Burrow's risky hits during Bengals' preseason game gets football fans worried,"Cincinnati Bengals quarterback Joe Burrow took multiple dangerous hits in the team&apos;s preseason game against the Commanders on Monday night, as fans had to look away.",Joe Burrow riskante Hits während Bengals' Vorsaison Spiel bekommt Fußballfans besorgt,"Cincinnati Bengals Quarterback Joe Burrow nahm mehrere gefährliche Hits im Team&apos;s Vorsaison-Spiel gegen die Commanders am Montag Abend, als Fans mussten wegschauen.",Los riesgosos éxitos de Joe Burrow durante el juego de pretemporada de Bengalas preocupan a los aficionados al fútbol,"El quarterback de Cincinnati Bengals, Joe Burrow, recibió múltiples éxitos peligrosos en el partido de pretemporada contra los comandantes el lunes por la noche, ya que los fans tuvieron que mirar hacia otro lado.",Les succès risqués de Joe Burrow pendant la présaison du match de Bengals inquiètent les fans de football,"Cincinnati Bengals quarterback Joe Burrow a pris plusieurs coups dangereux dans l'équipe&apos;s match de présaison contre les commandants lundi soir, alors que les fans ont dû regarder loin.","Joe Burrow在孟加拉人赛前的赛季比赛中冒着风险,",Cincinnati孟加拉四分卫Joe Burrow在团队和apos中遭到多次危险打击;
67,Here are the 5 GOP House seats that could be wiped out with Newsom's California redistricting plan,Gov. Gavin Newsom&apos;s redistricting plan threatens to flip five Republican congressional districts to Democratic control in California&apos;s gerrymandering plan.,"Hier sind die 5 GOP House-Sitze, die mit Newsoms Kalifornien-Neubeschränkungsplan ausgelöscht werden könnten.",Gov. Gavin Newsom&apos;s Plan zur Umgrenzung droht fünf republikanische Kongressbezirke an die demokratische Kontrolle in California&apos zu werfen;s Plan zur Sperrung.,Aquí están los 5 asientos de Gop House que podrían ser eliminados con el plan de redistribución de Newsom en California,El gobernador Gavin Newsom&apos;s plan de redistribución de distritos amenaza con cambiar cinco distritos republicanos del congreso al control demócrata en California&apos;s plan de gerrymandering.,Voici les 5 sièges GOP House qui pourraient être effacés avec le plan californien de Newsom,Gavin Newsom&apos;s redistricting plan menace de renverser cinq districts du Congrès républicain au contrôle démocratique en Californie&apos;s gerrymander plan.,这是5个GOP 众议院的席位 可能用Newsom的加州重新分区计划,Gav. Gav. Gav. Gavin Newsom&apos; 重新划分地区计划有可能将五个共和党国会区转而由加利福尼亚和阿pos的民主控制;
