,title-de,content-de,title-en,content-en,title-zh,content-zh
27,Entwicklungsministerin Alabali Radovan führt in Ägypten Gespräche zum Wiederaufbau von Gaza,"Entwicklungsministerin Reem Alabali Radovan reist heute nach Ägypten, um mit der ägyptischen Regierung Gespräche zum Wiederaufbau in Gaza zu führen. Ägypten hatte kürzlich gemeinsam mit weiteren arabischen Ländern einen Plan für die Zukunft des weitgehend zerstörten Küstenstreifens vorgelegt.",Development Minister Alabali Radovan holds talks in Egypt on the reconstruction of Gaza,"Development Minister Reem Alabali Radovan is travelling to Egypt today to discuss reconstruction in Gaza with the Egyptian government. Egypt, together with other Arab countries, recently presented a plan for the future of the largely destroyed coastline.",艾拉巴利·拉多万发展部长 在埃及举行重建加沙的讨论会,"发展部长莱姆·阿拉巴利·拉多万今天将前往埃及与埃及政府进行加沙重建谈判. 埃及最近和其他阿拉伯国家一道,提出了一个关于被广泛摧毁的海岸线的未来计划."
28,Entwicklungsministerin Reem Alabali Radovan zur aktuellen Lage in Syrien:,"„Ich bin sehr beunruhigt über die Lage in Syrien. Die anhaltenden Auseinandersetzungen in Sweida haben zu vielen Opfern geführt, insbesondere in der Zivilbevölkerung. Ich appelliere an alle Beteiligten, die gestern vereinbarte Waffenruhe einzuhalten, alle Zivilisten zu schützen und von Angriffen und Hassrede gegen Minderheiten abzusehen. Syrien gehört allen Syrerinnen und Syrern und nur gemeinsam kann die Zukunft des Landes gesichert und ein Abgleiten ins Chaos vermieden werden. (...)""",Minister of Development Reem Alabali Radovan on the current situation in Syria:,"""I am very concerned about the situation in Syria. The ongoing clashes in Sweida have led to many victims, especially in the civilian population. I appeal to all those involved to observe the ceasefire agreed yesterday, to protect all civilians and to refrain from attacks and hate speech against minorities. Syria belongs to all Syrians and only together can the future of the country be secured and a drift into chaos can be avoided. (...)""",叙利亚目前的局势中 Reem Alabali Radovan 发展部长Reem Alabali Radovan:,"我对叙利亚局势感到非常不安. 斯威达持续的冲突造成许多伤亡,特别是平民伤亡. 我呼吁所有各方遵守昨天达成的停火协议,保护所有平民,避免针对少数族裔的攻击和仇恨言论. 叙利亚属于所有叙利亚人和叙利亚人,只有团结一致才能保证叙利亚的未来,避免陷入混乱 (...) ."
29,Startschuss für europäischen Ukraine-Wiederaufbaufonds,"Entwicklungsministerin Reem Alabali Radovan nimmt heute in Rom an der Ukraine-Wiederaufbaukonferenz teil. Das Entwicklungsministerium ist zuständig für die Koordinierung der Unterstützung der Bundesregierung für den Wiederaufbau der Ukraine. Auf der heutigen Konferenz wird der Startschuss für den „European Flagship Fund for Reconstruction of Ukraine“ gegeben. Dieser soll Privatinvestitionen in Infrastruktur, Energie, Industrie und andere strategisch wichtige Sektoren der ukrainischen Wirtschaft befördern.",Launch of European Ukraine Reconstruction Fund,"Development Minister Reem Alabali Radovan is taking part in the Ukraine Reconstruction Conference in Rome today. The Ministry of Development is responsible for coordinating the Federal Government's support for the reconstruction of Ukraine. Today's conference will launch the European Flagship Fund for Reconstruction of Ukraine, which will promote private investment in infrastructure, energy, industry and other strategically important sectors of the Ukrainian economy.",向欧洲乌克兰重建基金发射发射弹头,"发展部负责协调联邦政府对乌克兰重建的支持. 今天的会议将为乌克兰重建的欧盟旗帜基金 (European Flags for Ukraine Reconvention Foundation Foundation) 提供启动. 该基金将向基础设施,能源,工业和其他重要的乌克兰经济部门提供私人投资."
30,Israelische Unternehmen in Gazastreifen und Westjordanland: Norwegische Regierung will Staatsfonds auf israelische Firmen prüfen,"Der norwegische Staatsfonds hält laut Berichten Anteile an einem israelischen Triebwerkhersteller, der für die Armee tätig ist. Nun soll der gesamte Fonds geprüft werden.",Israeli Companies in Gaza and West Bank: Norwegian Government to Investigate State Funds for Israeli Companies,"According to reports, the Norwegian State Fund holds shares in an Israeli engine manufacturer working for the army. Now the entire fund is to be audited.",在加沙地带和西岸的以色列公司: 挪威政府希望对以色列公司进行国有主权财富基金测试.,"挪威主权财富基金据报持有一个为军队工作的以色列引擎制造商的股份. 现在,该基金将接受审查."
31,Nahost: Linke setzt sich für Aufnahme von Kindern aus Gaza ein,"<a href=""https://www.zeit.de/news/2025-08/05/linke-setzt-sich-fuer-aufnahme-von-kindern-aus-gaza-ein""><img src=""https://img.zeit.de/news/2025-08/05/linke-setzt-sich-fuer-aufnahme-von-kindern-aus-gaza-ein-image-group/wide__148x84"" style=""float: left; margin-right: 5px;"" /></a> None",Middle East: Left advocates reception of children from Gaza,"<a href=""https://www.zeit.de/news/2025-08/05/left-set-for-take-of-children-from-gaza-a""><img src=""https://img.zeit.de/news/2025-08/05/left-set-for-take-of-children-from-gaza-a-image-group/wide__148x84"" style=""float: left; margin-right: 5px;"" /></a> None",中东:左翼反对从加沙接纳儿童,<\ \ \ \ \ \ \ \ \ \ \ \ \ \ \ \ \ \ \ \ \ \ \ \ \ \ \ \ \ \ \ \ \ \ \ \ \ \ \ \ \ \ \ \ \ \ \ \ \ \ \ \ \ \ \ \ \ \ \ \ \ \ \ \ \ \ \ \ \ \ \ \ \ \ \ >
32,Krieg gegen die Ukraine: Skandinavische Länder kaufen US-Waffen für die Ukraine,"Schweden, Norwegen und Dänemark geben 500 Millionen Euro für den Kauf von US-Waffen frei. Russland und die Ukraine greifen gegenseitig Bahnanlagen an. Das Liveblog",War against Ukraine: Scandinavian countries buy US weapons for Ukraine,"Sweden, Norway and Denmark release 500 million euros for the purchase of US weapons. Russia and Ukraine attack each other's railways. The live blog",乌克兰战争:斯堪的纳维亚国家为乌克兰购买美国武器.,"斯洛伐克,挪威和丹麦出出5亿欧元购买美国武器. 俄罗斯和乌克兰相互攻击火车站. 现场博客是实况报道."
33,Landeskriminalamt: 'Ndrangheta größte italienische Mafia-Organisation in NRW,"<a href=""https://www.zeit.de/news/2025-08/05/ndrangheta-groesste-italienische-mafia-organisation-in-nrw""><img src=""https://img.zeit.de/news/2025-08/05/ndrangheta-groesste-italienische-mafia-organisation-in-nrw-image-group/wide__148x84"" style=""float: left; margin-right: 5px;"" /></a> None",National Criminal Office: 'Ndrangheta largest Italian Mafia organization in NRW,"<a href=""https://www.zeit.de/news/2025-08/05/ndrangheta-groesste-Italian-mafia-organisation-in-nrw""><img src=""https://img.zeit.de/news/2025-08/05/ndrangheta-groesste-Italian-mafia-organisation-in-nrw-image-group/wide_148x84"" style=""float: left; margin-right: 5px;"" /></a> None",全国犯罪集团: 全国最大的意大利黑手党组织 (NRW),"<href=""http://www.Time.en/news2025-08/05/ndrandhate-groats-groats-groupa -in-nrw""> <img shrc=""http://img.time.com/news 2025-05/ends"
34,"Von München zum ""Club"": FC Bayern verleiht Nachwuchsprofi an den 1. FC Nürnberg","<a href=""https://www.zeit.de/news/2025-08/05/fc-bayern-verleiht-nachwuchsprofi-an-den-1-fc-nuernberg""><img src=""https://img.zeit.de/news/2025-08/05/fc-bayern-verleiht-nachwuchsprofi-an-den-1-fc-nuernberg-image-group/wide__148x84"" style=""float: left; margin-right: 5px;"" /></a> None","From Munich to the ""Club"": FC Bayern awards young professionals to 1. FC Nürnberg","<a href=""https://www.zeit.de/news/2025-08/05/fc-bayern-verleiht-nachwuchsprofi-an-den-1-fc-nuernberg""><img src=""https://img.zeit.de/news/2025-08/05/fc-bayern-verleiht-nachwuchsprofi-an-den-1-fc-nuernberg-image-group/wide_148x84"" style=""float: left; margin-right: 5px;"" /></a> None","从慕尼黑到""俱乐部"": FC Bayern 将从第1个FC Nurenberg获利","<href=""http://www.时间.en/news 2025-08/wide_1448x84"" style=""float: left; margin-right: 5px;"""
35,Staatsschutzverfahren: Spionage-Prozess gegen Ex-Mitarbeiter von AfD-Politiker Krah,"<a href=""https://www.zeit.de/news/2025-08/05/spionage-prozess-gegen-ex-mitarbeiter-von-krah-beginnt""><img src=""https://img.zeit.de/news/2025-08/05/spionage-prozess-gegen-ex-mitarbeiter-von-krah-beginnt-image-group/wide__148x84"" style=""float: left; margin-right: 5px;"" /></a> None",State protection proceedings: espionage trial against ex-employees of AfD politician Krah,"<a href=""https://www.zeit.de/news/2025-08/05/spionage-process-against-ex-employee-from-krah-starts""><img src=""https://img.zeit.de/news/2025-08/05/spionage-process-against-ex-employee-from-krah-starts-image-group/wide__148x84"" style=""float: left; margin-right: 5px;"" /></a> None",国家安全程序:针对前AfD政策的雇员的间谍程序,<\ \ \ \ \ \ \ \ \ \ \ \ \ \ \ \ \ \ \ \ \ \ \ \ \ \ \ \ \ \ \ \ \ \ \ \ \ \ \ \ \ \ \ \ \ \ \ \ \ \ \ \ \ \ \ \ \ \ \ \ \ \ \ \ \ \ \ \ \ \ \ \ \ \ \ \ \ \ \ \ \ \ \ \ \ \ \ \ \ \ \ \ \ \ \ \ >
36,Evakuierung: Historische Altstadt nach Gasalarm mehrere Stunden geräumt,"<a href=""https://www.zeit.de/news/2025-08/05/gasleck-in-bad-camberg-ganze-altstadt-muss-evakuiert-werden""><img src=""https://img.zeit.de/news/2025-08/05/gasleck-in-bad-camberg-ganze-altstadt-muss-evakuiert-werden-image-group/wide__148x84"" style=""float: left; margin-right: 5px;"" /></a> None",Evacuation: Historic old town cleared several hours after gas alarm,"<a href=""https://www.zeit.de/news/2025-08/05/gas leak-in-bad-camberg-ganze-altstadt-must-be evacuated""><img src=""https://img.zeit.de/news/2025-08/05/gas leak-in-bad-camberg-ganze-altstadt-must-be evacuated-image-group/wide__148x84"" style=""float: left; margin-right: 5px;"" /></a> None","在天然气警报后,历史悠久的古城疏散数小时",<\ \ \ \ \ \ \ \ \ \ \ \ \ \ \ \ \ \ \ \ \ \ \ \ \ \ \ \ \ \ \ \ \ \ \ \ \ \ \ \ \ \ \ \ \ \ \ \ \ \ \ \ \ \ \ \ \ \ \ \ \ \ \ \ \ \ \ \ \ \ \ \ \ \ \ \ \ \ \ \ \ \ \ \ \ \ \ \ \ >
37,Bombenfund: Erneut Weltkriegsbombe an Dresdner Carolabrücke gefunden,"<a href=""https://www.zeit.de/news/2025-08/05/erneut-weltkriegsbombe-an-dresdner-carolabruecke-gefunden""><img src=""https://img.zeit.de/news/2025-08/05/erneut-weltkriegsbombe-an-dresdner-carolabruecke-gefunden-image-group/wide__148x84"" style=""float: left; margin-right: 5px;"" /></a> None",Bomb find: Found again World War bomb at Dresden Carolabrücke,"<a href=""https://www.zeit.de/news/2025-08/05/renew-world war bomb-and-dresdner-carolabruecke-found-image-group/wide_148x84"" style=""float: left; margin-right: 5px;"" /></a> None",炸彈發現: 在卓斯纳·卡洛大桥上再次發現世界大戰的炸彈,"<href=""http://www.时间.en/news2025-08//erneut bomb-an-drek-dropolabruck""> <img src=""http://img. time.com/news 2025-05/erneutr-exec bombs-ndresner-carolablock- finds Image group/wide_148x84"" style=""float: left: margin-right: 5px;"""
38,Neues Quartier: DFB-Nationalteams trainieren künftig im Weimarer Land,"<a href=""https://www.zeit.de/news/2025-08/05/dfb-nationalteams-trainieren-kuenftig-im-weimarer-land""><img src=""https://img.zeit.de/news/2025-08/05/dfb-nationalteams-trainieren-kuenftig-im-weimarer-land-image-group/wide__148x84"" style=""float: left; margin-right: 5px;"" /></a> None",New quarter: DFB national teams will train in the Weimarer Land in the future,"<a href=""https://www.zeit.de/news/2025-08/05/dfb-nationalteams-training-going-in-weimarer-land""><img src=""https://img.zeit.de/news/2025-08/05/dfb-nationalteams-training-going-in-weimarer-land-image-group/wide_148x84"" style=""float: left; margin-right: 5px;"" /></a> None","新的住处: 未来,DFB国家队将在魏玛国家训练","<href=""http://www.Time.en/news 2025-08/50/fb-global-trainion-court"
39,Feuerwehreinsatz: Mit Batterien beladener Laster auf A71 in Brand geraten,"<a href=""https://www.zeit.de/news/2025-08/05/mit-batterien-beladener-laster-auf-a71-in-brand-geraten""><img src=""https://img.zeit.de/news/2025-08/05/mit-batterien-beladener-laster-auf-a71-in-brand-geraten-image-group/wide__148x84"" style=""float: left; margin-right: 5px;"" /></a> None",Firefighting: Charged truck on A71 on fire with batteries,"<a href=""https://www.zeit.de/news/2025-08/05/with-battery-laden-laster-on-a71-in-brand-rated""><img src=""https://img.zeit.de/news/2025-08/05/with-battery-laden-laster-on-a71-in-brand-rated-image-group/wide_148x84"" style=""float: left; margin-right: 5px;"" /></a> None",消防队: 装载电池的卡车被烧毁在A71,"<href=""http://www.时间.en/news 2025-08/05/load-to/load-to - carrier -a71 in -Brand range""> <img shrc=http:///img.time.com/news 2025-08/mit-to-to-to-loader-to-to-a71-in -brand-in"
40,"OceanGate: Implosion der ""Titan"" hätte laut Küstenwache verhindert werden können","2023 starben fünf Menschen bei einem Tauchausflug zum Wrack der ""Titanic"". Ein Untersuchungsbericht bestätigt nun Medienberichte über massive Sicherheitslücken.","OceanGate: Implosion of ""Titan"" could have been prevented according to the Coast Guard","In 2023, five people died on a diving trip to the wreck of the ""Titanic"". A review report now confirms media reports about massive security gaps.","根据海岸警卫队的说法,""泰坦号""的爆炸可能被阻止了.",2023年潜水船沉没时死了五个人. 一份调查报告证实了重大安全漏洞.
41,Strafzölle: Trump droht Medikamentenherstellern mit Zöllen bis zu 250 Prozent,Zunächst will die US-Regierung auf Arzneimittel einen niedrigen Zollsatz erheben. In den nächsten Jahren wird dieser laut Trump aber steigen – auf bis zu 250 Prozent.,Penalties: Trump threatens drug manufacturers with tariffs of up to 250 percent,"First, the U.S. government wants to impose a low rate of duty on medicines, but in the next few years, according to Trump, this will increase to up to 250 percent.","关税:特朗普威胁到药品制造商,关税最多可达250%的关税","首先,美国政府打算降低对药品的关税. 在未来几年中,根据特朗普的说法,该药量将达到250%以上."
42,Elon Musk: Aktionäre verklagen Tesla wegen angeblicher Falschangaben zu Robotaxis,"Ein von Tesla durchgeführter Test machte im Juni öffentlich, wie fehlerhaft seine Robotaxis sind. Weil der Aktienkurs daraufhin einbrach, fordern Aktionäre nun Geld.",Elon Musk: Shareholders sue Tesla for alleged misstatement of Robotaxis,"A test conducted by Tesla made public in June how flawed his robotaxis are. Because the share price collapsed, shareholders now demand money.",Elon Musk:股东控告Tesla对机器人斧头的假象 起诉Tesla,"特斯拉的一项测试在6月公开了其机器人战利品的缺陷. 由于股票价格因此下跌,股东们开始收钱."
43,"""Verbrechen""-Podcast – Eure Fragen, Teil 2: Darf True Crime unterhaltsam sein?",Alle vier Hosts beantworten Fragen der Fans: Wie recherchieren wir Kriminalfälle? Und warum machen wir diesen Podcast überhaupt?,"""Crime"" podcast – your questions, part 2: May True Crime be entertaining?",All four hosts answer fans' questions: How do we research criminal cases? And why do we even do this podcast?,"第二部分,""犯罪""""犯罪新闻""可以有趣吗?",四位接待员都回答了粉丝的问题 如何调查刑事案件
44,Etgar Keret: Eine Schande für mein Land,Etgar Keret gehört zu den wichtigsten Schriftstellern Israels. Hier macht er seiner Wut und Verzweiflung über die Situation in Gaza Luft und fordert ein Ende des Tötens.,Etgar Keret: A disgrace to my country,Etgar Keret is one of Israel's most important writers. Here he airs his anger and despair about the situation in Gaza and calls for an end to the killing.,埃特加·凯雷特:我的祖国蒙羞,"他对加沙局势充满愤怒和绝望,要求停止杀戮"
45,Weltweites Plastikabkommen: Finale Verhandlungsrunde gestartet,Heute startet die entscheidende Runde für ein globales UN-Plastikabkommen. Über 170 Staaten beraten in Genf über die Reduktion von Plastikverschmutzung.,Global plastic agreement: Final round of negotiations started,"Today, the crucial round for a global UN plastic agreement begins. More than 170 states are discussing the reduction of plastic pollution in Geneva.",全球塑胶协议: 决赛决赛开始,"今天,联合国全球裁军协议将展开关键回合. 超过170个国家将在日内瓦就减少塑料污染问题进行讨论."
46,Klingbeil in Washington: Kurswechsel in der Handelspolitik,Aktuelle Informationen über die deutsche Außenpolitik und die internationalen Beziehungen Deutschlands.<br />,Klingbeil in Washington: Change of course in trade policy,Current information on German foreign policy and international relations in Germany.<br />,华盛顿的铃木: 贸易政策的改变.,关于德国外交政策和德国国际关系的最新信息.
47,Merz und Wadephul entsetzt über Gräuel-Videos der Hamas,Die Bundesregierung fordert die Freilassung aller israelischen Geiseln. Dies sei Voraussetzung für einen Waffenstillstand.,Merz and Wadephul appalled by Hamas' atrocity videos,The Federal Government calls for the release of all Israeli hostages. This is a prerequisite for a ceasefire.,莫兹和韦德福对哈马斯的恐怖视频 感到震惊,联邦政府要求释放所有以色列人质 这是停火的条件
48,Hamburger CSD mit Rekordbeteiligung,"Die CSD-Demo hat in der Hansestadt mehr Menschen erreicht als je zuvor. Mitwirkung von Vereinen, Parteien, Unternehmen und Kirchengemeinden.",Hamburg CSD with record participation,"The CSD demo has reached more people in the Hanseatic city than ever before. Participation of associations, parties, companies and parishes.",有记录的汉堡包CSD汉堡,"CSD计划比以往任何时候都多. 社团,政党,企业和教会都参与其中."
49,Deutschland fliegt erneut Hilfsgüter nach Gaza,"Die Bundeswehr hat humanitäre Hilfe für die Bevölkerung in Gaza wieder aufgenommen. Bundeskanzler Merz forderte erneut, den Landweg zu öffnen.",Germany flies aid to Gaza again,The Bundeswehr has resumed humanitarian aid for the Gazans. Federal Chancellor Merz once again called for the country to be opened up.,德国再次向加沙运送援助物资,联邦军队已经恢复对加沙居民的人道主义援助. 德国总理默斯再次要求开放陆路.
50,Außenminister warnt vor Isolation Israels,Außenminister Johann Wadephul ruft in Jerusalem zu mehr humanitärer Hilfe für Gaza auf. Am Freitag reist er weiter ins Westjordanland.&nbsp;,Foreign Minister warns against Israel's isolation,Foreign Minister Johann Wadephul calls for more humanitarian aid for Gaza in Jerusalem. On Friday he will continue to travel to the West Bank.,Foreign Secretary warned about separate Israel Israel.,"国务卿韦德福在耶路撒冷呼吁增加对加沙的人道主义援助. 星期五,他将前往西岸. & nbsp;"
51,Deutschland trauert um Laura Dahlmeier,Die Biathlon-Legende Laura Dahlmeier ist bei einem Bergunfall in Pakistan ums Leben gekommen. Ihr Tod sorgt für große Betroffenheit.,Germany mourns Laura Dahlmeier,The biathlon legend Laura Dahlmeier died in a mountain accident in Pakistan. Her death causes great concern.,德国为劳拉·达梅耶哀悼,比阿思隆传说的劳拉·达米耶死于巴基斯坦的一次山区事故. 她的死引起了极大的伤害.
52,Anna Elendt wird Weltmeisterin über 100 Meter Brust,Anna Elendt sorgt in Singapur für eine deutsche Schwimm-Sensation. Mit neuer Lockerheit gewinnt sie Gold.,Anna Elendt becomes world champion over 100 meters breast,Anna Elendt is responsible for a German swimming sensation in Singapore. With new looseness she wins gold.,安娜·拜勒特將成為一百米以上的世界冠軍,"安娜·拉内特在新加坡提供一个德国的游泳选拔. 有了新的放松,她将获得黄金."
53,Deutsch als Fremdsprache weltweit von großer Bedeutung,In vielen Ländern wird Deutschland als attraktives Arbeits- oder Ausbildungsziel gesehen.&nbsp;,German as a foreign language of great importance worldwide,"In many countries, Germany is seen as an attractive target for work or training.",以德语作为世界范围的外语意义重大,"在许多国家,德国被认为是一个吸引人的工作或训练目标. & nbsp;"
54,Deutscher Florian Lipowitz wird Tour-Dritter,Regen und rasante Attacken: Das Tour-Finale in Paris geriet zu einem Spektakel der Etappenjäger. Florian Lipowitz feiert den dritten Rang.&nbsp;,German Florian Lipowitz gets tour third,Rain and rapid attacks: The Tour Finale in Paris became a spectacle of stage hunters. Florian Lipowitz celebrates third place.&nbsp;,德意志弗洛里安·利普维茨成为巡演者,大雨和猛烈的袭击:巴黎的巡回比赛场地成为了街头猎手的盛宴. Florian Lipowitz庆祝了第三名. & nbsp;
55,Mitgliederbefragung und Fehleranalyse: FDP versucht den Neuanfang,Mit einem neuen Grundsatzprogramm will die FDP das Wahldebakel hinter sich lassen und einen Neustart wagen. Dabei setzen die Liberalen auf Mitgliederbefragungen. Auch eine interne Analyse soll helfen.,Member survey and error analysis: FDP tries to start over,"With a new program of principles, the FDP wants to leave the electoral debacle behind and try a restart. The liberals rely on member surveys. Also an internal analysis should help.",成员协商和错误分析: FDP试图重新开始.,"FDP希望通过一项新的政策计划来摆脱选举失败,并开始重新启动. 自由党把重点放在成员协商上. 内部分析也是为了帮助."
56,Paulaner gewinnt im Spezi-Prozess gegen Berentzen,"Paulaner hat vor Gericht einen Sieg gegen den Konkurrenten Berentzen erzielt. Die Flaschen der Mio Mio ""Cola+Orange Mische"" sind den Spezi-Flaschen zu ähnlich. Das Urteil ist noch nicht rechtskräftig.",Paulaner wins in the Speci trial against Berentzen,"Paulaner has won a victory in court against the competitor Berentzen. The bottles of the Mio Mio ""Cola+Orange Mix"" are too similar to the Speci bottles. The verdict is not yet final.",宝拉纳在斯皮兹对贝伦齐的审判中胜出,Paulaner在法庭上打败了竞争对手Berrenzer. 百万的可口可乐+奥兰奇混合剂的瓶子太像Spezzi的花瓶了. 判决尚未确定.
57,Hunderte Menschen fliehen vor Waldbrand in Südkalifornien,Wenige Monate nach den verheerenden Waldbränden im Großraum Los Angeles ist in Kalifornien erneut ein Feuer ausgebrochen. Im Bezirk Santa Barbara zerstörten die Flammen 290 Quadratkilometer Land.,Hundreds of people flee forest fire in Southern California,"A few months after the devastating forest fires in the Greater Los Angeles area, a fire broke out again in California. In the Santa Barbara district, the flames destroyed 290 square kilometers of land.",数百人逃离南加州的森林大火,"洛杉矶大气层的毁坏森林数月后,加利福尼亚州又发生一场大火. 在圣巴巴拉地区,火焰摧毁了290平方公里的土地."
58,Marktbericht: Börsen ganz im Bann der Zinsen,Neue US-Zinshoffnungen elektrisieren derzeit die Anleger und sorgen für steigende Kurse. Zudem stützen überwiegend positiv aufgenommene Firmenbilanzen aus DAX und MDAX.,Market Report: Stock exchanges under the spell of interest,"New US interest rates are currently electrifying investors and increasing prices. In addition, mainly positively received company balance sheets from DAX and MDAX support.",市场报告:股票市场受利率的影响,"新的美国投资者预期正在刺激投资者,并提高股价. 此外,大体上,来自DAX和MDAX的公司资产负债表是建立在积极的基石之上的."
59,USA planen Atomkraftwerke auf dem Mond - geht das überhaupt?,"Die NASA plant, einen Atomreaktor auf dem Mond zu errichten. Laut Medienberichten werden die Pläne in den USA konkreter. Wie realistisch ist das - und wie würde solch ein Atomkraftwerk auf dem Mond aussehen? Von Uwe Gradwohl und Pascal Kiss.",USA is planning nuclear power plants on the moon - is that even possible?,"NASA plans to build a nuclear reactor on the moon. According to media reports, the plans in the US are becoming more concrete. How realistic is that - and what would such a nuclear power plant look like on the moon? By Uwe Gradwohl and Pascal Kiss.",美国计划在月球上进行核电站计划吗?,"NASA计划在月球上建一个核反应堆. 根据媒体报道,美国计划更具体. 这到底有多真实?"
60,"Lage im Gazastreifen: Was plant Netanjahu, was will Trump?","Hungernde Menschen in Gaza, schockierende Geiselvideos: Eine Waffenruhe in Nahost ist in weite Ferne gerückt. Will Premier Netanjahu jetzt den gesamten Gazastreifen einnehmen? Welche Politik verfolgt US-Präsident Trump? Ein Überblick.","Situation in the Gaza Strip: What is Netanyahu planning, what does Trump want?","Hunger people in Gaza, shocking hostage videos: A ceasefire in the Middle East has moved far away. Will Prime Minister Netanyahu now take over the entire Gaza Strip? What policy does US President Trump pursue? An overview.",加沙地带的情况 内塔尼亚胡有什么计划 特朗普想要什么?,"加沙的饥荒人口,令人震惊的人质视频:中东的停火已经远去. 内塔尼亚胡总理现在要占领加沙地带吗? 美国总统特朗普在追求什么政策?"
