,title-en,content-en,title-de,content-de,title-es,content-es,title-fr,content-fr,title-zh,content-zh
35,"Buy now, pay later is taking over the world. Good","Buy that burrito, and don’t let anyone judge you","Kaufen Sie jetzt, zahlen Sie später übernimmt die Welt. Gut","Kaufen Sie diesen Burrito, und lassen Sie sich nicht von jemandem beurteilen","Comprar ahora, pagar más tarde es tomar el control del mundo.","Compra ese burrito, y no dejes que nadie te juzgue","Acheter maintenant, payer plus tard, c'est prendre le monde en main.","Achète ce burrito, et ne laisse personne te juger","现在买,晚点还钱就占了世界的优势","买那个墨西哥卷饼,不要让任何人评判你"
36,Trump will not let the world move on from tariffs,"Six charts show the damage to America, its trading partners and its consumers","Trump wird nicht zulassen, dass die Welt von Zöllen abweicht","Sechs Diagramme zeigen den Schaden für Amerika, seine Handelspartner und seine Verbraucher",Trump no dejará que el mundo pase de los aranceles,"Seis gráficos muestran el daño a América, sus socios comerciales y sus consumidores",Trump ne laissera pas le monde passer des tarifs douaniers,"Six graphiques montrent les dommages causés à l'Amérique, à ses partenaires commerciaux et à ses consommateurs",特朗普不会让世界摆脱关税,六张图表显示美国、其贸易伙伴和消费者遭受的损害
37,Uncovering the secret food trade that corrupts Iran’s neighbours,Oil and terrorism are not the country’s only exports,"Enthüllen des geheimen Lebensmittelhandels, der Irans Nachbarn korrumpiert",Öl und Terrorismus sind nicht das Land nur Exporte,Descubrir el comercio secreto de alimentos que corrompe a los vecinos de Irán,El petróleo y el terrorismo no son las únicas exportaciones del país,Découvrir le commerce alimentaire secret qui corrompt les voisins de l'Iran,Le pétrole et le terrorisme ne sont pas les seules exportations du pays.,揭露腐蚀伊朗邻国的秘密食品贸易,石油和石油恐怖主义不是该国唯一的出口品。
38,The trade deal with America shows the limits of the EU’s power,The bloc opts for prudence over defiance,Der Handelsvertrag mit Amerika zeigt die Grenzen der Macht der EU,Der Block entscheidet sich für Klugheit über Trotz,El acuerdo comercial con Estados Unidos muestra los límites del poder de la UE,El bloque opta por la prudencia sobre el desafío,L'accord commercial avec l'Amérique montre les limites de la puissance de l'UE,Le bloc opte pour la prudence plutôt que la défiance,与美国的贸易协议 显示了欧盟权力的极限,"集团选择谨慎,而不是违抗"
39,Shanxi province is struggling to diversify away from coal,Why the transition is going so slowly,Die Provinz Shanxi kämpft um die Diversifizierung weg von der Kohle,Warum der Übergang so langsam voranschreitet,La provincia de Shanxi está luchando por diversificarse lejos del carbón,¿Por qué la transición va tan lentamente?,La province du Shanxi peine à se diversifier loin du charbon,Pourquoi la transition va si lentement,山西省正努力从煤炭中走向多样化,为什么过渡过程如此缓慢
40,"Six months after DeepSeek’s breakthrough, China speeds on with AI",Real-world applications have priority over cutting-edge development,Sechs Monate nach dem Durchbruch von DeepSeek beschleunigt China mit KI,Real-Welt-Anwendungen haben Vorrang vor modernster Entwicklung,"Seis meses después del avance de DeepSeek, China acelera con IA",Las aplicaciones del mundo real tienen prioridad sobre el desarrollo de vanguardia,"Six mois après la percée de DeepSeek, la Chine s'accélère avec l'IA",Les applications du monde réel ont la priorité sur le développement à la fine pointe de la technologie,"在DeepSeek突破六个月后,",现实世界的应用优先于前沿发展
41,Savvy staff are moving from China’s nurseries to its care homes,Last year there were 12m fewer pre-school pupils than in 2021,Savvy Mitarbeiter bewegen sich von Chinas Baumschulen zu seinen Pflegeheimen,Letztes Jahr gab es 12m weniger Vorschulkinder als 2021,El personal de Savvy se está trasladando de las guarderías chinas a sus hogares de acogida,El año pasado hubo 12 millones menos de alumnos preescolares que en 2021,Le personnel de Savvy déménage des crèches chinoises vers ses foyers de soins,"L'année dernière, il y avait 12 millions d'élèves d'âge préscolaire de moins qu'en 2021.",Savvvy工作人员正在从中国的托儿所迁至其护理之家。,"去年,学龄前学生人数比2021年少12万,比2021年少12万。"
42,Everyone loses in the rage of China’s delivery wars,Companies are caught in a race to the bottom,Jeder verliert in der Wut Chinas Lieferkriege,Unternehmen sind in einem Wettlauf nach unten gefangen,Todo el mundo pierde en la furia de las guerras de entrega de China,Las empresas están atrapadas en una carrera hasta el fondo,Tout le monde perd dans la rage des guerres de livraison de la Chine,Les entreprises sont prises dans une course au fond,"在中国投送战争的狂暴中,每个人都输了",公司在竞到底部的比赛中被抓住
43,Can pensioners rescue China’s economy?,The government is stingy and timid when it comes to retirement benefits,Können Rentner die chinesische Wirtschaft retten?,"Die Regierung ist geizig und zaghaft, wenn es um Rentenleistungen geht.",¿Pueden los pensionistas rescatar la economía china?,El gobierno es tacaño y tímido cuando se trata de beneficios de jubilación,Les retraités peuvent-ils sauver l'économie chinoise ?,Le gouvernement est téméraire et timide en ce qui concerne les prestations de retraite,养老金领取者能够拯救中国的经济吗?,"在退休金方面,政府很吝啬和胆怯。"
44,“Comrade” is making a comeback in China,Or so the government hopes,"""Comrade"" macht ein Comeback in China",Oder so hofft die Regierung,“Camarada” está volviendo a China,O eso es lo que el gobierno espera,Le camarade fait un retour en Chine,Ou alors le gouvernement espère,“同志”正在中国重新崛起,或政府希望
45,The looming deadline for the Panama Canal ports deal,China will approve their sale. But there’s a huge catch,Die bevorstehende Frist für den Panama-Kanal-Ports-Deal,China wird ihren Verkauf genehmigen. Aber es gibt einen riesigen Fang,El inminente plazo para el acuerdo con los puertos del Canal de Panamá,"China aprobará su venta, pero hay una enorme captura",L'échéance prochaine pour l'accord sur les ports du canal de Panama,La Chine va approuver leur vente. Mais il ya une énorme prise,巴拿马运河港口交易的最后期限即将到来,中国会批准它们的销售。 但有一个巨大的收获。
46,Xi Jinping is growing more elusive,His leadership is entering a new but no less powerful stage,Xi Jinping wird immer schwieriger,"Seine Führung tritt in eine neue, aber nicht weniger mächtige Bühne ein",Xi Jinping es cada vez más elusivo.,Su liderazgo está entrando en una nueva pero no menos poderosa etapa,Xi Jinping est de plus en plus insaisissable,"Son leadership entre dans une nouvelle étape, mais pas moins puissante",习近平越来越难以捉摸,他的领导层正在进入一个新的但同样强大的阶段
47,China’s exporters shrug off the trade war—for now,How long can they continue to do so?,Chinas Exporteure zucken den Handelskrieg ab — für jetzt,Wie lange können sie das noch tun?,"Los exportadores de China se encogen de hombros en la guerra comercial, por ahora",¿Cuánto tiempo pueden seguir haciéndolo?,Chine Les exportateurs s'éloignent de la guerre commerciale — pour l'instant,Combien de temps peuvent-ils continuer à le faire?,中国的出口商从贸易战争中退缩到现在,他们能继续这样做多久?
48,Why a fling with a foreigner insults China’s “national dignity”,Outrage mounts over a tryst between a Chinese student and a Ukrainian gamer,Warum ein Fling mit einem Ausländer China beleidigt,Outrage überragt einen Versuch zwischen einem chinesischen Schüler und einem ukrainischen Spieler,¿Por qué una aventura con un extranjero insulta la “dignidad nacional” de China?,La indignación se cierne sobre una cita entre un estudiante chino y un jugador ucraniano,Pourquoi un flirt avec un étranger insulte la Chine,L'outrage monte sur un essai entre un étudiant chinois et un joueur ukrainien,为何与外国人私奔侮辱中国的“民族尊严”,一个中国学生和一个乌克兰游戏玩家之间的交汇
49,Trump v DC,,Trump gegen DC,,Trump v DC,,Trump v DC,,特朗普诉DC,
50,How is Trump’s Brazil-bashing putting America first?,It isn’t,Wie setzt Trumps Brasilien-Bashing Amerika an die erste Stelle?,Es ist nicht,¿Cómo es que el golpe de Trump en Brasil está poniendo a Estados Unidos en primer lugar?,No lo es,Comment Trump est-il en train de mettre l'Amérique en premier ?,Ce n'est pas,特朗普对巴西的抨击如何将美国放在首位?,"并不是,"
51,Alligator Alcatraz is an exercise in performative cruelty,Many Republican voters don’t like it,Alligator Alcatraz ist eine Übung in performativer Grausamkeit,Viele republikanische Wähler mögen es nicht,El cocodrilo Alcatraz es un ejercicio de crueldad performativa,A muchos votantes republicanos no les gusta,Alcatraz alligator est un exercice de cruauté performative,Beaucoup d'électeurs républicains ne l'aiment pas,鳄鱼阿尔卡特拉齐是一种表现残忍的行为,"许多共和选民都不喜欢,"
52,MAGA’s disenchantment with Israel,"Democrats have long been split over the Jewish state. Cracks are appearing among Republicans, too",Maga-Entzauberung mit Israel,"Demokraten sind seit langem gespalten über den jüdischen Staat. Risse erscheinen unter Republikanern, auch",El desencanto de MEGA con Israel,"Los demócratas han estado divididos durante mucho tiempo sobre el estado judío. Las grietas están apareciendo entre los republicanos, también",MAGA's désenchantement avec Israël,Les démocrates sont depuis longtemps divisés sur l'État juif. Des cracks apparaissent aussi parmi les républicains.,MAGA对以色列的失望,"长期以来,民主党人一直分裂在犹太国家之上。 共和党人中间也出现了裂痕。"
53,Democrats are likely to lose the redistricting war,"If both sides abandon principle, a draw is possible, but Republicans face fewer obstacles","Die Demokraten werden wahrscheinlich den Krieg verlieren, der erneut einschränkt.","Wenn beide Seiten das Prinzip aufgeben, ist eine Auslosung möglich, aber Republikaner sehen sich weniger Hindernissen gegenüber",Es probable que los demócratas pierdan la guerra de redistribución de distritos,"Si ambas partes abandonan el principio, un empate es posible, pero los republicanos enfrentan menos obstáculos",Les Démocrates risquent de perdre la guerre de nouveau.,"Si les deux parties abandonnent le principe, un tirage est possible, mais les républicains sont confrontés à moins d'obstacles",民主党人很可能输掉重新划区战争,"如果双方都放弃原则,就有可能取胜,但共和党面临的障碍较少"
54,Donald Trump escalates his war on numbers,Another shocking assault on a non-partisan institution,Donald Trump eskaliert seinen Krieg auf Zahlen,Ein weiterer schockierender Angriff auf eine nicht-parteiische Institution,Donald Trump intensifica su guerra contra los números,Otro ataque escandaloso contra una institución no partidista,Donald Trump intensifie sa guerre contre les chiffres,Une autre agression choquante contre une institution non partisane,唐纳德·特朗普在数字战中升级,另一起对无党派机构令人震惊的袭击
55,Deadheads hope to “make America grateful again”,The band’s 60th anniversary concerts show how much San Francisco has changed,"Deadheads hoffen, Amerika wieder dankbar zu machen","Die 60. Jubiläumskonzerte der Band zeigen, wie sehr sich San Francisco verändert hat",Los muertos esperan “hacer que Estados Unidos vuelva a estar agradecido”,Los conciertos del 60 aniversario de la banda muestran cuánto ha cambiado San Francisco,Deadheads espèrent rendre l'Amérique reconnaissante à nouveau,Les concerts du 60e anniversaire du groupe montrent combien San Francisco a changé,死头希望“让美国再次感激”,乐队的60周年音乐会展示了旧金山的变化
56,The National Park Service is in disarray,The Trump administration is cutting thousands of staff at America’s favourite agency,Der National Park Service ist in Unordnung,Die Trump-Administration schneidet Tausende von Mitarbeitern bei Amerikas Lieblingsagentur,El Servicio de Parques Nacionales está en desorden,La administración Trump está cortando a miles de empleados en la agencia favorita de Estados Unidos,Le service des parcs nationaux est en désarroi,L'administration Trump est en train de couper des milliers de personnel à l'agence préférée de l'Amérique.,国家公园管理局陷入混乱,"特朗普政府正在裁员数千名美国最喜爱的机构工作人员,"
57,Travis Kelce takes credit for turning Taylor Swift into an 'engulfed' football fan,Kansas City Chiefs star Travis Kelce took credit for turning Taylor Swift into a football fan as he opened up about their relationship in a magazine interview.,"Travis Kelce nimmt die Ehre, Taylor Swift zu einem ""engulfed"" Fußballfan zu machen","Der Kansas City Chiefs-Star Travis Kelce machte Taylor Swift zu einem Fußballfan, als er sich in einem Magazininterview über ihre Beziehung öffnete.",Travis Kelce se lleva el mérito de convertir a Taylor Swift en un fanático del fútbol 'engordado',"La estrella de Kansas City Chiefs, Travis Kelce, se atribuyó el mérito de convertir a Taylor Swift en un fan del fútbol mientras abría su relación en una entrevista con una revista.",Travis Kelce prend le crédit d'avoir transformé Taylor Swift en fan de football «engulfed»,La star de Kansas City Chiefs Travis Kelce a pris le mérite d'avoir transformé Taylor Swift en fan de football alors qu'il s'ouvrait sur leur relation dans une interview de magazine.,特拉维斯·凯尔斯将泰勒·斯威夫特变成“engulfed”足球迷功得分。,"堪萨斯市首府明星Travis Kelce在杂志采访中公开他们的关系时, 将泰勒·斯威夫特变成足球迷,"
58,Influencer couple killed in Canadian mountain crash,"ToyotaWorldRunners influencers Stacey Tourout and Matthew Yeomans were killed in an August 7 crash near Trout Lake, British Columbia, officials say.",Influencer Paar bei kanadischen Bergabsturz getötet,"ToyotaWorldRunners Influencer Stacey Tourout und Matthew Yeomans wurden bei einem Absturz am 7. August in der Nähe von Trout Lake, British Columbia, getötet, sagen Beamte.",Pareja de influencers asesinada en el accidente de la montaña canadiense,"Los influencers de ToyotaWorldRunners Stacey Tourout y Matthew Yeomans murieron en un accidente del 7 de agosto cerca de Trout Lake, Columbia Británica, dicen los funcionarios.",Un couple influenceur tué dans un accident de montagne au Canada,"Les influenceurs de ToyotaWorldRunners, Stacey Tourout et Matthew Yeomans, ont été tués dans un accident survenu le 7 août près de Trout Lake, en Colombie-Britannique.",在加拿大山崩中丧生的一对影响性夫妇,"在8月7日不列颠哥伦比亚省Trout湖附近坠毁事件中, Stacey Tourout和Matthew Yeomans遇难身亡。"
59,Kentucky dad rages after court-approved release of repeat offender leads to family’s kidnapping,Louisville father demands answers after repeat offender released early on &quot;shock probation&quot; allegedly kidnapped his family and forced them to rob a bank.,Kentucky Vater tobt nach gerichtlich genehmigte Freilassung von Wiederholungstäter führt zu Familie .,"Louisville Vater fordert Antworten, nachdem wiederholte Täter entlassen früh auf &quot;shock Bewährung&quot; angeblich entführt seine Familie und zwang sie, eine Bank auszurauben.",El padre de Kentucky se enfurece después de que la liberación aprobada por la corte del reincidente lleve al secuestro de la familia,Louisville padre exige respuestas después de reincidente liberado temprano en &quot;shock libertad condicional&quot; supuestamente secuestró a su familia y los obligó a robar un banco.,Kentucky papa rage après la libération approuvée par le tribunal du récidiviste conduit à l'enlèvement de la famille.,Le père de Louisville exige des réponses après que le récidiviste ait été libéré tôt à la probation de &quot;shock; il aurait kidnappé sa famille et les aurait forcés à voler une banque.,肯塔基爸爸在法院批准释放累犯 导致家庭绑架后 暴怒,"Louisville的父亲在 & qut; 提前释放了累犯后要求回答, 据称他的家人被绑架, 并强迫他们抢银行。"
60,Jet ski rescue saves 6 people at beach as one dies in dramatic rip current incident,One person drowned and six others were rescued from a rip current 100 yards offshore at Seaside Heights beach in New Jersey during dramatic jet ski rescue operation.,"Jet-Ski-Rettung spart 6 Menschen am Strand, wie man in dramatischen Riss aktuellen Vorfall stirbt",Eine Person ertrunken und sechs andere wurden während eines dramatischen Jet-Ski-Rettungseinsatzes vor 100 Metern vor der Küste von Seaside Heights in New Jersey gerettet.,El rescate de motos acuáticas salva a 6 personas en la playa mientras uno muere en un incidente actual de ruptura dramática,Una persona se ahogó y otras seis fueron rescatadas de una redada a 100 yardas de la playa de Seaside Heights en Nueva Jersey durante una operación dramática de rescate de motos acuáticas.,Jet ski sauvetage sauve 6 personnes à la plage alors qu'on meurt dans l'incident dramatique de courant de déchirement,"Une personne s'est noyée et six autres ont été sauvées d'un courant de déchirures de 100 verges au large de la plage Seaside Heights, dans le New Jersey, lors d'une opération de sauvetage à réaction spectaculaire.","喷气式滑雪救援在海滩上拯救了6人,","在新泽西海滨高地海滨海岸100码外的裂缝中,有一人被淹死,另有6人被救出,当时正在采取飞跃式喷气式滑雪救援行动。"
61,Texas GOP seeks to ‘domesticate’ rogue Dems for breaking quorum through nationwide civil arrest warrants,Texas GOP officials are seeking to enforce civil arrest warrants across state lines for the House Democrats who fled to prevent a Republican redistricting vote.,"Texas GOP versucht, „Dems für den Bruch der Beschlußfähigkeit durch landesweite Haftbefehle zu beherbergen"".","Die texanischen GOP-Beamten versuchen, Haftbefehle über staatliche Grenzen hinweg für die House Democrats durchzusetzen, die geflohen sind, um eine republikanische Wiedereinschränkung der Abstimmung zu verhindern.",Texas GOP busca ‘domesticar’ a Dems por romper el quórum a través de órdenes de arresto civil a nivel nacional,Los funcionarios del Partido Republicano de Texas están tratando de hacer cumplir órdenes de arresto civiles a través de las líneas estatales para los demócratas de la Cámara de Representantes que huyeron para impedir un voto republicano de redistribución de distritos.,Texas GOP cherche à «domestiquer» voyous Dems pour avoir brisé le quorum par des mandats d'arrêt civils à l'échelle nationale,Les responsables du GOP du Texas cherchent à faire respecter les mandats d'arrêt civils par-delà les frontières de l'État pour les démocrates de la Chambre qui ont fui pour empêcher un vote républicain de nouveau.,"德克萨斯GOP试图通过全国性的民事逮捕令,将违反法定人数的流氓Dems“本国化”","得克萨斯州GOP官员正试图跨州执行针对众议院民主党的民事逮捕令,这些民主党为阻止共和党重新划分选区投票而逃之夭夭。"
62,"As Trump intervenes in DC's crime crisis, another violent city's DA gets a challenger from inside the tent","Former Philadelphia Judge Patrick Dugan joins GOP ballot to run against incumbent DA Larry Krasner, citing failed crime policies and public safety concerns.","Als Trump in die Verbrechenskrise von DC eingreift, bekommt der Staatsanwalt einer anderen gewalttätigen Stadt einen Herausforderer aus dem Zelt","Der ehemalige Richter von Philadelphia, Patrick Dugan, schließt sich der Wahl der GOP an, um gegen den amtierenden Staatsanwalt Larry Krasner vorzugehen.","Mientras Trump interviene en la crisis criminal de DC, el fiscal de otra ciudad violenta consigue un retador desde el interior de la tienda","El ex juez de Filadelfia Patrick Dugan se une a la votación del Partido Republicano para presentarse contra el actual fiscal Larry Krasner, citando políticas criminales fallidas y preocupaciones de seguridad pública.","Alors que Trump intervient dans la crise criminelle de DC, le procureur d'une autre ville violente obtient un challenger de l'intérieur de la tente","L'ancien juge de Philadelphie Patrick Dugan se joint au scrutin du GOP pour se présenter contre l'ancien procureur Larry Krasner, invoquant l'échec des politiques criminelles et des préoccupations en matière de sécurité publique.","当特朗普介入华盛顿的 犯罪危机, 另一个暴力城市的地检官 得到一个挑战者 从帐篷内","前费城法官帕特里克·杜根(Patrick Dugan)加入GOP的选票,"
63,Teddi Mellencamp struggles with speech following cancer treatment,Former &quot;Real Housewives&quot; cast member Teddi Mellencamp explains how cancer treatment affects her speech and creates concerns about television appearances.,Teddi Mellencamp kämpft mit Sprache nach Krebsbehandlung,"Ehemaliges &quot;Real Housewives&quot; Castmitglied Teddi Mellencamp erklärt, wie Krebsbehandlung ihre Sprache beeinflusst und Sorgen über Fernsehauftritte erzeugt.",Teddi Mellencamp lucha con el habla después del tratamiento del cáncer,El ex miembro del elenco Teddi Mellencamp explica cómo el tratamiento del cáncer afecta su habla y crea preocupación por las apariencias de la televisión.,Teddi Mellencamp lutte avec la parole après le traitement du cancer,"Ancien membre de &quot;Real Housewives&quot; cast, Teddi Mellencamp, explique comment le traitement du cancer affecte son discours et suscite des préoccupations au sujet des apparences télévisées.","Teddi Mellencamp在癌症治疗后,","前 & 夸特; Real Homewifice & 夸特; 演员成员 Teddi Mellencamp 解释癌症治疗如何影响她的演讲,"
64,Chuck Todd warns America is heading towards a 'cold civil war' as redistricting battle continues,Former NBC host Chuck Todd argued that America is heading towards a &quot;cold civil war&quot; on &quot;The Chuck Toddcast&quot; on Tuesday as redistricting battles in states like Texas and California continue.,"Chuck Todd warnt Amerika auf dem Weg zu einem 'kalten Bürgerkrieg', während der Kampf weiter eingeschränkt wird","Der ehemalige NBC-Gastgeber Chuck Todd argumentierte, dass Amerika in Richtung eines &quot;kalten Bürgerkriegs &quot; auf &quot;The Chuck Toddcast&quot; am Dienstag geht, da erneut Kämpfe in Staaten wie Texas und Kalifornien dauern.",Chuck Todd advierte que Estados Unidos se dirige hacia una 'guerra civil fría' mientras continúa la batalla de redistribución,"El ex anfitrión de la NBC, Chuck Todd, argumentó que Estados Unidos se está dirigiendo hacia una guerra civil fría y una guerra civil fría; en el Chuck Toddcast y una cita; el martes mientras continúan las batallas de redistribución de distritos en estados como Texas y California.","Chuck Todd avertit que l'Amérique se dirige vers une ""guerre civile froide"" alors que la bataille se poursuit","L'ancien hôte de la CCBN, Chuck Todd, a soutenu que l'Amérique se dirige vers une guerre civile froide et la guerre civile froide.Le Chuck Toddcast et la guerre civile se poursuivent, mardi, dans des États comme le Texas et la Californie.","查克·托德警告美国, 随着重新划区战的继续, 美国正走向“冷战内战”,","前NBC东道主查克托德(Chuck Todd)认为,美国正走向 & qut; 冷战和可控; 在 & qut; The Chuck Toddcast&可控; 星期二,"
65,CNN's Dana Bash roasted for calling Jan. 6 'most violent moment in recent history' after Trump crime presser,CNN host Dana Bash referred to the Jan. 6 Capitol riot while reporting on President Donald Trump’s announcement that he would federalize the D.C. police.,"CNN's Dana Bash geröstet für die Berufung am 6. Januar ""gewaltvollsten Moment in der jüngeren Geschichte"" nach Trump Verbrechen Presse","CNN-Gastgeber Dana Bash bezog sich auf den Krawall am 6. Januar, während er über Präsident Donald Trump berichtete, dass er die D.C.-Polizei föderalisieren würde.",Dana Bash de CNN asado por llamar al 6 de enero 'momento más violento de la historia reciente' después de Trump,"Dana Bash, presentadora de la CNN, se refirió al motín del 6 de enero en el Capitolio mientras informaba sobre el anuncio del presidente Donald Trump de que federalizaría a la policía de Washington.",Dana Bash de CNN a grillé pour avoir appelé le 6 janvier « moment le plus violent de l'histoire récente » après Trump presseur de crime,"L'hôte de CNN Dana Bash a fait référence à l'émeute du Capitole le 6 janvier alors qu'il rapportait sur l'annonce du président Donald Trump, qu'il fédéraliserait la police de D.C.","有线电视新闻网的Dana Bash在Trump犯罪新闻记者之后, 致电1月6日「近代史上最暴力的时刻」,","有线电视新闻网主持人Dana Bash提到一月六日国会暴动,"
