,title-en,content-en,title-de,content-de,title-es,content-es,title-fr,content-fr,title-zh,content-zh
38,The economic lessons from Ukraine’s spectacular drone success,National security is a weak argument for battery subsidies,Die wirtschaftlichen Lehren aus der Ukraine spektakulärer Drohnen-Erfolg,Nationale Sicherheit ist ein schwaches Argument für Batteriesubventionen,Las lecciones económicas del espectacular éxito de los drones en Ucrania,La seguridad nacional es un argumento débil para las subvenciones a las baterías,Les leçons économiques de l'Ukraine le succès spectaculaire drone,La sécurité nationale est un argument faible en faveur des subventions à la batterie,乌克兰无人驾驶飞机的壮观成功在经济上的教训,国家安全是电池补贴的薄弱论据
39,Rich Chinese cities are suffocating poor ones,A hitch in the battle against smog,Reiche chinesische Städte ersticken die Armen,Ein Haken im Kampf gegen Smog,Las ciudades ricas chinas están sofocando a las pobres,Un enganche en la batalla contra el smog,De riches villes chinoises asphyxient les pauvres,Un accrochage dans la bataille contre le smog,中国富裕城市扼杀贫穷城市,在对抗烟雾的战斗中
40,China has become the most important enabler of Russia’s war machine,It has crossed the line into providing lethal aid,China hat sich zum wichtigsten Enabler Russlands Kriegsmaschine entwickelt,"Sie hat die Grenze überschritten, um tödliche Hilfe zu leisten.",China se ha convertido en el facilitador más importante de la maquinaria de guerra de Rusia,Ha cruzado la línea para proporcionar ayuda letal.,La Chine est devenue le moteur le plus important de la Russie machine de guerre,Il a franchi la ligne pour fournir une aide létale,中国已成为俄罗斯战争机器最重要的推进器,"它已经越过边界,提供致命援助"
41,Chinese consumers are splurging—but probably not for long,There is a reason retail sales have boomed,Die chinesischen Verbraucher spritzen – aber wahrscheinlich nicht lange.,"Es gibt einen Grund, warum der Einzelhandel boomte","Los consumidores chinos están goteando, pero probablemente no por mucho tiempo",Hay una razón por la que las ventas al por menor han aumentado,"Les consommateurs chinois s'éparpillent, mais probablement pas pour longtemps.",Il y a une raison pour laquelle les ventes au détail ont connu un essor,"中国消费者在挤压,但可能不会持续很长时间",零售业兴旺发展是有原因的
42,Would you want to know if you were terminally ill?,"In China, catastrophic diagnoses are often kept from patients","Würdest du wissen wollen, ob du unheilbar krank bist?",In China werden katastrophale Diagnosen oft von Patienten ferngehalten.,¿Le gustaría saber si estaba enfermo terminal?,"En China, los diagnósticos catastróficos a menudo se mantienen alejados de los pacientes",Voudriez-vous savoir si vous étiez en phase terminale ?,"En Chine, les diagnostics catastrophiques sont souvent évités aux patients",你想知道你是否病得很重吗?,"在中国,灾难性诊断往往不向病人提供"
43,Bride prices are surging in China,Why is the government struggling to curb them?,Brautpreise steigen in China,"Warum kämpft die Regierung, um sie einzudämmen?",Los precios de la novia están aumentando en China,¿Por qué el gobierno está luchando para detenerlos?,Les prix de la mariée sont en hausse en Chine,Pourquoi le gouvernement lutte-t-il pour les endiguer?,中国的新娘价格正在上涨,为何政府苦苦阻止他们?
44,China’s booze business looks smashed,First terrified officials went off the lash; now young people are going dry,Chinas Alkoholgeschäft sieht zerschmettert aus,Erste erschrockene Beamte gingen von der Wimper ab; jetzt werden die jungen Leute trocken,El negocio del alcohol de China se ve destrozado,Primero los funcionarios aterrorizados se salieron del látigo; ahora los jóvenes se están secando,Chine L'alcool business semble fracassé,"Les premiers fonctionnaires terrifiés sont sortis du clash; maintenant, les jeunes s'assèchent.",中国的酒业看起来一团糟,最初吓吓人心的官员们脱了干线;现在年轻人正在干枯。
45,Now China’s ultra-cheap EVs are scaring China,They highlight many of the economy’s current problems,Chinas ultra-billige EVs erschrecken China,Sie heben viele der aktuellen Probleme der Wirtschaft hervor,Ahora los vehículos eléctricos ultra baratos de China están asustando a China,Destacan muchos de los problemas actuales de la economía,"Aujourd'hui, les VE ultra-paches de la Chine font peur à la Chine",Ils mettent en évidence de nombreux problèmes économiques actuels,现在中国超便宜的EV正在吓吓中国,它们突显了经济当前的许多问题。
46,Chinese students want an American education less than they used to,Many are staying at home or studying elsewhere in Asia,"Chinesische Studenten wollen eine amerikanische Ausbildung weniger, als sie früher",Viele wohnen zu Hause oder studieren anderswo in Asien,Los estudiantes chinos quieren una educación americana menos de lo que solían,Muchos se están quedando en casa o estudiando en otras partes de Asia,Les étudiants chinois veulent une éducation américaine moins qu'ils n'en voulaient auparavant.,Beaucoup séjournent à la maison ou étudient ailleurs en Asie,中华学生想要的美国教育比以前少,许多人留在家中或在亚洲其他地方学习。
47,China is waking up from its property nightmare,An ecstatic $38m luxury-mansion auction lights up the market,China erwacht aus seinem Eigentum Alptraum,Eine ekstatische $38m Luxus-Mansion-Auktion erhellt den Markt,China está despertando de su pesadilla de propiedad,Una subasta extática de $38m de lujo-mansión ilumina el mercado,La Chine se réveille de son cauchemar de propriété,Une vente aux enchères extatique de 38 M$ de luxe-mansion éclaire le marché,中国正在从财产恶梦中醒来,令人欣欣喜的38m豪华豪华豪华豪华豪华豪华豪华豪华豪华大拍卖 将市场推向光明
48,China’s crazy reverse-credit cards,"In the People’s Republic you “pay now, buy later”",Chinas verrückte Reverse-Kreditkarten,"In der Volksrepublik bezahlen Sie jetzt, kaufen Sie später",Las tarjetas de crédito inversas locas de China,"En la República Popular “pagáis ahora, comprad más tarde”",Les cartes de crédit inversées de la Chine,"Dans la République Populaire vous payez maintenant, achetez plus tard",中国疯狂的逆向信用卡,"在人民共和国,你 "" 现在就付钱,以后买 """
49,The New York mayor’s race is a study in Democratic Party dysfunction,A party with a bad reputation for local governance shows few signs of turning that round,Die New Yorker Bürgermeister Rennen ist eine Studie in der demokratischen Partei Dysfunktion,"Eine Partei mit einem schlechten Ruf für die lokale Regierungsführung zeigt nur wenige Anzeichen dafür, dass diese Runde",La carrera del alcalde de Nueva York es un estudio sobre la disfunción del Partido Demócrata,Un partido con mala reputación de gobierno local muestra pocas señales de dar vuelta esa ronda,La course du maire de New York est une étude sur le dysfonctionnement du Parti démocratique,Un parti qui a une mauvaise réputation pour la gouvernance locale montre peu de signes de faire tourner ce tour,纽约市长的竞选是对民主党功能失调的研究,"一个地方治理名声差的政党,"
50,Our model suggests President Trump is under water in every swing state,American voters are having a hard time working out what they really want,Unser Modell suggeriert Präsident Trump ist unter Wasser in jedem Schaukelstaat,"Amerikanische Wähler haben eine harte Zeit, herauszufinden, was sie wirklich wollen",Nuestro modelo sugiere que el presidente Trump está bajo el agua en cada estado de oscilación,Los votantes estadounidenses están teniendo dificultades para resolver lo que realmente quieren,Notre modèle suggère que le président Trump est sous l'eau dans chaque état swing,Les électeurs américains ont du mal à travailler ce qu'ils veulent vraiment.,我们的模型建议特朗普总统 在每个摇摆状态下 都在水下,美国选民在努力想出他们真正想要的东西
51,Congestion pricing in Manhattan is a predictable success,So why on earth did it take so long to start?,Congestion Pricing in Manhattan ist ein vorhersehbarer Erfolg,"Warum also hat es so lange gedauert, bis es angefangen hat?",El precio de la congestión en Manhattan es un éxito predecible,"Entonces, ¿por qué demonios tardó tanto en empezar?",Le prix de la congestion à Manhattan est un succès prévisible,Alors pourquoi diable a-t-il fallu si longtemps pour commencer ?,曼曼哈顿的拥挤物定价是可预料的成功,"那么,为什么在地球上 这么长时间才开始呢?"
52,Democrats could do a lot better with the power they hold,More than half of Americans live in states with Democratic governors. Many are poorly run,"Demokraten könnten mit der Macht, die sie halten, viel besser umgehen.",Mehr als die Hälfte der Amerikaner leben in Staaten mit demokratischen Gouverneuren. Viele sind schlecht geführt,Los demócratas podrían hacerlo mucho mejor con el poder que tienen,Más de la mitad de los estadounidenses viven en estados con gobernadores demócratas.,Les démocrates pourraient faire beaucoup mieux avec le pouvoir qu'ils détiennent,Plus de la moitié des Américains vivent dans des États avec des gouverneurs démocratiques.,民主党能用他们掌握的权力 做得更好,超过半数的美国人生活在有民主省长的州。
53,The attacks in Minnesota reflect a worrying trend,Threats are increasing—and state legislators are particularly vulnerable,Die Angriffe in Minnesota spiegeln einen besorgniserregenden Trend wider,Die Bedrohung nimmt zu – und die staatlichen Gesetzgeber sind besonders gefährdet,Los ataques en Minnesota reflejan una tendencia preocupante,Las amenazas están aumentando — y los legisladores estatales son particularmente vulnerables,Les attaques au Minnesota reflètent une tendance inquiétante,"Les menaces augmentent, et les législateurs des États sont particulièrement vulnérables.",明尼苏达州袭击事件反映出一个令人担忧的趋势,威胁正在增加——州立法者特别容易受到伤害
54,The strange history of the tribe courted by Donald Trump,North Carolina’s Lumbee look to the president in their battle with the Cherokee,Die seltsame Geschichte des Stammes von Donald Trump,North Carolinas Lumbee Blick auf den Präsidenten in ihrer Schlacht mit der Cherokee,La extraña historia de la tribu cortejada por Donald Trump,Lumbee de Carolina del Norte mirar al presidente en su batalla con el Cherokee,L'étrange histoire de la tribu courtisée par Donald Trump,Caroline du Nord Les Lumbee se tournent vers le président dans leur bataille avec les Cherokee,部落的奇奇历史 由唐纳德·特朗普所追赶,北卡罗来纳州的鲁比(Lumbee)期待总统与切罗基人的战斗。
55,Protests against a regal presidency have been notably peaceful,There is no need to send in the troops,Proteste gegen eine königliche Präsidentschaft waren besonders friedlich,"Es gibt keine Notwendigkeit, die Truppen zu schicken",Las protestas contra una presidencia real han sido notablemente pacíficas,No hay necesidad de enviar a las tropas.,Les protestations contre une présidence royale ont été particulièrement pacifiques.,Il n'est pas nécessaire d'envoyer les troupes,抗议王朝主席的抗议活动 特别和平,没有必要派遣部队
56,Gavin Newsom is ready for his close-up,The California governor’s beef with Donald Trump could resonate with voters beyond his state,Gavin Newsom ist bereit für seine Nahaufnahme,Der kalifornische Gouverneur streitet mit Donald Trump könnte mit Wählern über seinen Staat hinaus mitschwingen,Gavin Newsom está listo para su primer plano,La disputa del gobernador de California con Donald Trump podría resonar con los votantes más allá de su estado,Gavin Newsom est prêt pour son gros plan,Le gouverneur californien se bat avec Donald Trump pourrait résonner avec les électeurs au-delà de son état,Gavin Newsom已经准备好为他的特写准备了,加州州长与唐纳德·特朗普的争吵可能会与州以外的选民产生共鸣
57,"Johnny Depp says he was a 'crash test dummy for MeToo,' accuses Hollywood pals of abandoning him to 'go woke'","In a new interview, Johnny Depp opened up about the domestic abuse accusations from Amber Heard and explained why he was willing to fight to the end.","Johnny Depp sagt, er sei ein 'Crash-Test-Dummy für MeToo', beschuldigt Hollywood-Freunde, ihn verlassen zu haben, um aufzuwachen.","In einem neuen Interview eröffnete Johnny Depp über die häuslichen Misshandlungsvorwürfe von Amber Heard und erklärte, warum er bereit sei, bis zum Ende zu kämpfen.","Johnny Depp dice que era un tonto de prueba para MeToo, acusa a amigos de Hollywood de abandonarlo para 'despertar'.","En una nueva entrevista, Johnny Depp abrió sobre las acusaciones de abuso doméstico de Amber Heard y explicó por qué estaba dispuesto a luchar hasta el final.","Johnny Depp dit qu'il était un 'strash test factice pour MeToo,' accuse les copains d'Hollywood de l'abandonner pour 'aller se réveiller'","Dans une nouvelle interview, Johnny Depp a ouvert sur les accusations de violence domestique d'Amber Heard et a expliqué pourquoi il était prêt à se battre jusqu'à la fin.","Johnny Depp说他是MeToo的崩溃测试假人, 指责好莱坞伙伴抛弃他,","Johnny Depp在一次新的采访中, 揭露了Amber Heard提出的家庭虐待指控, 并解释了为什么他愿意战斗到底。"
58,Pacers staff confronts ESPN camera capturing emotional TJ McConnell after NBA Finals loss to Thunder,"Indiana Pacers guard T.J. McConnell was visibly devastated following the Game 7 NBA Finals loss to Thunder, and one team staffer did not like how an ESPN camera was capturing the raw moment.",Pacers Mitarbeiter konfrontiert ESPN Kamera Aufnahme emotional TJ McConnell nach NBA Finals Verlust an Thunder,"Indiana Pacers Wache T.J. McConnell war nach dem Spiel 7 NBA Finals Verlust an Thunder sichtbar verwüstet, und ein Teammitarbeiter mochte nicht, wie eine ESPN-Kamera den rohen Moment erfasste.",El personal de Pacers se enfrenta a la cámara ESPN capturando emocional TJ McConnell después de la pérdida final de la NBA ante Thunder,"El guardia de Indiana Pacers T.J. McConnell quedó visiblemente devastado tras la derrota de la NBA Final al Thunder, y a un miembro del equipo no le gustó cómo una cámara ESPN estaba capturando el momento crudo.",Le personnel de Pacers confronte la caméra ESPN captant émotionnellement TJ McConnell après NBA Finals perte à Thunder,"Indiana Pacers garde T.J. McConnell a été visiblement dévasté suite à la défaite du match 7 NBA Finals contre Thunder, et un membre de l'équipe n'a pas aimé comment une caméra ESPN a capturé le moment brut.","Pacers 工作人员面对ESPN 摄影机,拍摄NBA决赛雷雷雷输后 情绪激动的TJ McConnell","T. J. McConnell在NBA第7比赛决赛雷雷输后明显被摧毁, 一名团队工作人员不喜欢ESPN摄像头拍下生机。"
59,BBC presenter goes viral for correcting 'pregnant people' phrasing to 'women' during live broadcast,BBC&apos;s Martine Croxall went viral after she changed the phrase &quot;pregnant people&quot; to &quot;women&quot; as she read off a report about potential heat-related deaths in the U.K.,"BBC Moderator geht viral für die Korrektur ""schwangere Menschen"" Phrasierung zu ""Frauen"" während der Live-Übertragung","BBC&apos;s Martine Croxall wurde viral, nachdem sie den Ausdruck &quot;schwangere Menschen&quot; in &quot;Frauen&quot; geändert hatte, als sie einen Bericht über mögliche hitzebedingte Todesfälle in Großbritannien las.",La presentadora de la BBC se vuelve viral por corregir el fraseo de 'personas embarazadas' a 'mujeres' durante la transmisión en vivo,BBC&apos;s Martine Croxall se volvió viral después de que cambió la frase &quot; gente embarazada&quot; a &quot;mujeres&quot; mientras leía un informe sobre las muertes potenciales relacionadas con el calor en el Reino Unido.,Le présentateur de la BBC est viral pour avoir corrigé la phrase « personnes enceintes » à « femmes » pendant la diffusion en direct,La BBC&apos;s Martine Croxall est devenue virale après qu'elle a changé la phrase &quot;pregnant people&quot; à &quot;women&quot; alors qu'elle lisait un rapport sur les décès potentiels liés à la chaleur au Royaume-Uni.,"BBC主播在现场直播中将“孕妇”的措辞改为“妇女”,","BBC&apos;s Martine Croxall 在她将 & qot; pregnant people & qot; 的短语改为 & quot; women& qot; 读了一篇关于英国可能与热有关的死亡的报告后, 即进入了病毒传播。"
60,Trump campaign unleashes PAC to oust GOP congressman who questioned authority to strike Iran,President Donald Trump&apos;s campaign apparatus targets Rep. Thomas Massie with a new Kentucky PAC after the congressman challenged Trump&apos;s constitutional authority on Iran strikes.,"Trump-Kampagne entfesselt PAC, um GOP-Kongressabgeordnete zu verdrängen, der die Autorität des Iran-Streiks in Frage gestellt hat","Präsident Donald Trump&apos;s Wahlkampfapparat zielt auf Rep. Thomas Massie mit einem neuen Kentucky PAC, nachdem der Kongressabgeordnete Trump&apos herausgefordert hatte;s verfassungsrechtliche Autorität für Iranstreiks.",Campaña de Trump desata PAC para derrocar a congresista del Partido Republicano que cuestionó autoridad para atacar a Irán,El aparato de campaña del presidente Donald Trump&apos se dirige al representante Thomas Massie con un nuevo PAC de Kentucky después de que el congresista desafió a Trump&apos; la autoridad constitucional sobre las huelgas de Irán.,La campagne Trump lance le PAC pour évincer le député du GOP qui a remis en question l'autorité de frapper l'Iran,Le président Donald Trump&apos; l'appareil de campagne vise le Rep. Thomas Massie avec un nouveau PAC Kentucky après que le député a contesté Trump&apos; l'autorité constitutionnelle sur les grèves en Iran.,"Trump运动释放PAC推翻GOP国会议员,",总统Donald Trump&apos; 竞选机器的目标为Thomas Massie Rep.
61,"Simple daily activity could reduce risk of lower back pain, study finds","Research from Norway shows longer daily walks could improve chronic lower back pain, with those walking over 100 minutes experiencing lower risk despite intensity.","Einfache tägliche Aktivität könnte das Risiko von Schmerzen im unteren Rückenbereich verringern, Studienergebnisse","Forschung aus Norwegen zeigt, dass längere tägliche Spaziergänge chronische Schmerzen im unteren Rückenbereich verbessern könnten, wobei diejenigen, die über 100 Minuten mit einem geringeren Risiko trotz Intensität gehen.","La actividad diaria simple podría reducir el riesgo de dolor lumbar, según el estudio","Las investigaciones de Noruega muestran que caminatas diarias más largas podrían mejorar el dolor crónico de espalda, con quienes caminan más de 100 minutos experimentando menor riesgo a pesar de la intensidad.","Une activité quotidienne simple pourrait réduire le risque de douleurs lombaires plus faibles, selon les résultats de l'étude.","Des recherches menées en Norvège montrent que des promenades quotidiennes plus longues pourraient améliorer les douleurs lombaires chroniques, les personnes qui marchent pendant plus de 100 minutes présentant un risque moindre malgré l'intensité.","研究发现,简单的日常活动可以减少后背疼痛的风险","挪威的研究显示,日散步时间较长可以改善长期较低的背部疼痛,行走100分钟以上的人尽管精力充沛,但风险却较低。"
62,"Michigan police ID slain church shooter, reveal his connection to congregation","Wayne Police Department reveals identity of CrossPointe Church shooter as Brian Anthony Browning, who was armed with an AR-15, a handgun and hundreds of rounds of ammunition.","Michigan Polizei ID getötet Kirche Shooter, offenbaren seine Verbindung zur Gemeinde","Wayne Police Department enthüllt die Identität des CrossPointe Church Shooters als Brian Anthony Browning, der mit einer AR-15, einer Handfeuerwaffe und Hunderten von Munitionsrunden bewaffnet war.","La policía de Michigan mató al tirador de la iglesia, revela su conexión con la congregación","El Departamento de Policía de Wayne revela la identidad del tirador de CrossPonte Church como Brian Anthony Browning, que estaba armado con un AR-15, una pistola y cientos de cartuchos.","La police du Michigan a tué le tireur de l'église, révéler son lien avec la congrégation","Wayne Police Department révèle l'identité du tireur de l'église CrossPointe comme Brian Anthony Browning, qui était armé d'un AR-15, d'une arme de poing et de centaines de cartouches.",密密歇根警方身份证 杀害教堂枪手 透露他与圣会的联系,"Wayne警察局透露了交叉点教会射击手的身份,名叫Brian Anthony Browning,他携带AR-15、手枪和数百发子弹。"
63,Americans in Qatar told to shelter in place as Iranian military threatens action against US interests,"A U.S. Embassy Qatar warning advises Americans to shelter in place after weekend strikes on Iran, despite Qatari officials assuring the security situation remains stable.","Amerikaner in Qatar sagten, sie sollen sich in ihrem Platz aufhalten, da das iranische Militär Maßnahmen gegen US-Interessen bedroht.","Eine Warnung der US-Botschaft Qatar riet Amerikanern, sich nach den Streiks am Wochenende im Iran zu verstecken, obwohl katarische Beamte die Sicherheitslage sicherstellen, bleibt stabil.",Los estadounidenses en Qatar dijeron que debían refugiarse en su lugar mientras el ejército iraní amenazaba la acción contra los intereses de EE.UU.,"Una advertencia de la Embajada de Qatar aconseja a los estadounidenses que se refugien después de las huelgas de fin de semana en Irán, a pesar de que los funcionarios de Qatar aseguran que la situación de seguridad permanece estable.",Les Américains au Qatar ont dit d'abriter en place alors que l'armée iranienne menace d'agir contre les intérêts américains,"Un avertissement de l'ambassade des États-Unis au Qatar conseille aux Américains d'abriter en place après les frappes du week-end sur l'Iran, bien que les responsables qatariens assurent la stabilité de la situation en matière de sécurité.","伊朗军方威胁针对美国利益采取行动,","美国驻卡塔尔大使馆发出警告, 建议美国人在周末袭击伊朗后安顿好住所, 尽管卡塔尔官员确保安全情况保持稳定,"
64,Karoline Leavitt fires back at GOP lawmaker who 'should be a Democrat' over Iran strike criticism,"Karoline Leavitt defends the Trump administration&apos;s Iran strikes, stating bipartisan calls were made despite claims from Rep. Massie and CNN that lawmakers weren&apos;t adequately briefed.","Karoline Leavitt feuert zurück auf die GOP-Gesetzgeberin, die ""ein Demokrat"" über Irans Streikkritik sein sollte","Karoline Leavitt verteidigt die Trump-Administration & Apos;s Iran Streiks, behauptet, zweiparteiische Anrufe wurden trotz der Behauptungen von Rep. Massie und CNN, dass Gesetzgeber waren&apos;t angemessen informiert.","Karoline Leavitt dispara contra el legislador del Partido Republicano que ""debería ser demócrata"" por las críticas a la huelga en Irán","Karoline Leavitt defiende a la administración Trump y apos; las huelgas de Irán, afirmando que se hicieron llamadas bipartidistas a pesar de las afirmaciones del representante Massie y CNN de que los legisladores eran y apos; no se informó adecuadamente.","Karoline Leavitt revient sur le législateur du GOP qui ""devrait être un démocrate"" sur la critique de la grève iranienne","Karoline Leavitt défend l'administration Trump&apos;s grèves en Iran, déclarant des appels bipartites ont été faits malgré les affirmations de Rep. Massie et CNN que les législateurs étaient&apos;t correctement informés.","Karoline Leavitt向GOP的立法者开火,","Karoline Leavitt为Trump 行政当局辩护;伊朗罢工,称尽管Massie Rep. Massie和CNN声称立法者被充分简报,但还是发出了两党呼吁。"
