,title-en,content-en,title-de,content-de,title-es,content-es,title-fr,content-fr,title-zh,content-zh
0,The Arab world thinks differently about this Iran war,A new spectator sport with scary consequences,Die arabische Welt denkt anders über diesen Iran-Krieg,Ein neuer Zuschauersport mit gruseligen Folgen,El mundo árabe piensa diferente acerca de esta guerra de Irán,Un nuevo deporte de espectadores con consecuencias aterradoras,Le monde arabe pense différemment à cette guerre en Iran,Un nouveau sport de spectateurs aux conséquences effrayantes,阿拉伯世界对这场伊朗战争的看法不同,一场具有可怕后果的新观众运动
1,MI6’s new “C” used to be “Q”. And she’s good with the gadgets,"Blaise Metreweli is the first female head of Britain’s spy service, too",MI6 s neue .C . Früher zu sein .Q . Und sie ist gut mit den Gadgets,Blaise Metreweli ist auch die erste weibliche Leiterin des britischen Spionagedienstes,La nueva “C” del MI6 solía ser “Q”. Y ella es buena con los gadgets,Blaise Metreweli también es la primera mujer jefa del servicio de espionaje de Gran Bretaña,"Le nouveau MI6, c'est le nouveau MI6 et c'est bien avec les gadgets.","Blaise Metreweli est la première femme chef du service d'espionnage britannique, aussi",MI6的新“C”过去是“Q”。,布莱斯·梅特鲁埃利也是英国第一位女间谍部门负责人。
2,"In Trumpworld, toppling rulers is taboo",Donald Trump prefers deals to regime change,"In Trumpworld ist es tabu, die Machthaber zu stürzen",Donald Trump bevorzugt Deals zum Regimewechsel,"En Trumpworld, derrocar a los gobernantes es tabú",Donald Trump prefiere los acuerdos al cambio de régimen,"Dans Trumpworld, le renversement des dirigeants est tabou",Donald Trump préfère les transactions au changement de régime,在特朗普世界 推翻统治者是禁忌,唐纳德·特朗普更喜欢交易 而不是换政权
3,"Donald Trump, Elon Musk and the age of the genius",The perils of bowing to those anointed as special,"Donald Trump, Elon Musk und das Zeitalter des Genies","Die Gefahr, sich vor den Gesalbten zu verneigen","Donald Trump, Elon Musk y la era del genio",Los peligros de inclinarse ante los ungidos como especiales,"Donald Trump, Elon Musk et l'âge du génie",Les dangers de se prosterner devant ceux qui sont oints comme spéciaux,唐纳德·特朗普、伊隆·穆斯克和天才时代,屈从于那些特别受膏者的危险
4,"As the UN turns 80, Thant Myint-U argues it should be retooled for a less internationalist age",The world body should go back to focusing on its founding principle: preventing war,"Da die UNO 80 Jahre alt wird, argumentiert Thant Myint-U, dass sie für ein weniger internationalistisches Zeitalter umgerüstet werden sollte.",Der Weltkörper sollte sich wieder auf sein Gründungsprinzip konzentrieren: Krieg verhindern,"A medida que la ONU cumple 80 años, Thant Myint-U argumenta que debería ser reelaborada para una era menos internacionalista",El órgano mundial debería volver a centrarse en su principio fundacional: la prevención de la guerra,"Comme l'ONU a 80 ans, Thant Myint-U soutient qu'il devrait être retravaillé pour un âge moins internationaliste",L'organe mondial devrait revenir à se concentrer sur son principe fondateur : la prévention de la guerre,"在联合国80岁时, Thant Myint-U认为,",世界机构应回到其创始原则:预防战争的重心。
5,Mo’ changes mo’ problems for budget bill,"Our daily political update, featuring the stories that matter",Änderungen für die Budgetrechnung,"Unser tägliches politisches Update mit den Geschichten, die wichtig sind",Mo’ cambia mo’ problemas para el proyecto de presupuesto,"Nuestra actualización política diaria, con las historias que importan",Le projet de loi de finances modifie le projet de loi de finances,"Notre mise à jour politique quotidienne, mettant en vedette les histoires qui comptent",Mo ' change Mo ' change mo ' m ' 问题预算法案,"我们每天的政治最新情况,特别报道重要的故事"
6,"In Iran there is, so far, no sign of a mutinous mood",Also on the daily podcast: the “world’s coolest dictator” goes after his critics and remembering India’s Tiger Man,Im Iran gibt es bisher keine Anzeichen einer meutenden Stimmung,Auch auf dem täglichen Podcast: Der coolste Diktator der Welt folgt seinen Kritikern und erinnert sich an Indiens Tiger Man,"En Irán, hasta ahora, no hay señales de un estado de ánimo amotinado.",También en el podcast diario: el “dictador más cool del mundo” va tras sus críticos y recuerda al hombre tigre de la India,"En Iran, il n'y a jusqu'à présent aucun signe d'humeur mutineuse.",Aussi sur le podcast quotidien : le dictateur le plus cool du monde va après ses critiques et se souvenir de l'Inde Tiger Man,"在伊朗,到目前为止,没有迹象显示有叛逆情绪","也是在每日播客的播客上:“世界最酷的独裁者”追逐他的批评者,"
7,Political violence has returned to Colombia,A handpicked article read aloud from the latest issue of The Economist,Politische Gewalt ist nach Kolumbien zurückgekehrt,Ein handverlesener Artikel aus der aktuellen Ausgabe von The Economist,La violencia política ha regresado a Colombia,Un artículo escogido a mano leído en voz alta del último número de The Economist,La violence politique est revenue en Colombie,Un article tiré à la main a été lu à haute voix dans le dernier numéro de The Economist,政治暴力又回到了哥伦比亚,"《经济学家》最新一期《经济学家》的一篇文章,"
8,The world’s most liveable cities in 2025,Vienna has lost its crown. Instability threatens living standards everywhere,Die lebenswertesten Städte der Welt im Jahr 2025,Wien hat seine Krone verloren. Instabilität bedroht den Lebensstandard überall,Las ciudades más habitables del mundo en 2025,Viena ha perdido su corona. La inestabilidad amenaza los niveles de vida en todas partes,Les villes les plus habitables du monde en 2025,Vienne a perdu sa couronne. L'instabilité menace le niveau de vie partout,2025年世界上最宜居的城市,"维也纳已失去其王冠,不稳定威胁着各地的生活水平。"
9,Israel’s race to kill Iran’s nuclear dream,If it fails the regime could make a frantic dash for a bomb,"Israeles Rennen, Irans nuklearen Traum zu töten","Wenn es scheitert, könnte das Regime einen hektischen Schlag für eine Bombe machen",La carrera de Israel para matar el sueño nuclear de Irán,Si falla el régimen podría hacer una carrera frenética por una bomba,Israël course pour tuer l'Iran rêve nucléaire,"S'il échoue, le régime pourrait faire un bond frénétique pour une bombe.",以色列屠杀伊朗核梦想的竞赛,"如果它失败了,该政权可以制造炸弹的疯狂破碎"
10,Will Iran’s hated regime implode?,Trump calls for Tehran to “immediately evacuate”,Wird das gehasste Regime Irans implodieren?,Trump fordert Teheran zur sofortigen Evakuierung,¿ Implotará el odiado régimen iraní?,Trump pide que Teherán “evacue inmediatamente”,Les Iraniens haïront-ils le régime à imploser ?,Trump appelle Téhéran à évacuer immédiatement,伊朗受恨的政权是否会内爆?,Trump呼吁德黑兰“立即撤离”
11,The Laurel Canyon sound has reverberated down the decades,A district in the Hollywood Hills has had a profound influence on popular music,Der Laurel Canyon Sound hat die Jahrzehnte nachgehallt,Ein Stadtteil in den Hollywood Hills hat einen tiefen Einfluss auf die populäre Musik,El sonido de Laurel Canyon ha reverberado a lo largo de las décadas,Un distrito en Hollywood Hills ha tenido una profunda influencia en la música popular,Le son de Laurel Canyon a réverbéré au cours des décennies,Un quartier des Hollywood Hills a eu une profonde influence sur la musique populaire,劳蕾尔峡谷的声音 反响了几十年,好莱坞山丘的一个区 对流行音乐产生了深远影响
12,Emmanuel Macron flies in to show his support for Greenland,A message to Donald Trump—and to Europe,"Emmanuel Macron fliegt herein, um seine Unterstützung für Grönland zu zeigen",Eine Botschaft an Donald Trump – und an Europa,Emmanuel Macron vuela para mostrar su apoyo a Groenlandia,Un mensaje a Donald Trump — y a Europa,Emmanuel Macron s'envole pour montrer son soutien au Groenland,Un message à Donald Trump – et à l'Europe,Emmanuel Macron 飞进来表示他支持格陵兰,给唐纳德·特朗普(Donald Trump-and Europe)和欧洲的讯息
13,Why today’s graduates are screwed,The bottom has fallen out of the job market,Warum heute Absolventen verarscht werden,Der Boden ist aus dem Arbeitsmarkt gefallen,¿Por qué los graduados de hoy están jodidos,El fondo ha caído fuera del mercado de trabajo,Pourquoi aujourd'hui les diplômés sont foutus,Le bas est tombé du marché du travail,为何今日的毕业生惨遭破坏,底底已经从就业市场跌出
14,What our analysis of 900 firms shows about their values,We crunch the numbers on what employees think in 19 industries,Was unsere Analyse von 900 Unternehmen über ihre Werte zeigt,"Wir knacken die Zahlen über das, was Mitarbeiter in 19 Branchen denken",Lo que muestra nuestro análisis de 900 empresas sobre sus valores,Recortamos los números de lo que piensan los empleados en 19 industrias,Ce que notre analyse de 900 entreprises montre sur leurs valeurs,Nous réduisons les chiffres sur ce que les employés pensent dans 19 industries,我们对900家企业的分析 显示了它们的价值,我们根据19个行业的员工想法 来计算数字
15,How to build the right corporate culture,It is critical to firms’ success,Wie man die richtige Unternehmenskultur baut,Es ist entscheidend für den Erfolg der Unternehmen,Cómo construir la cultura corporativa adecuada,Es fundamental para el éxito de las empresas,Comment construire la bonne culture d'entreprise,Il est essentiel à la réussite des entreprises.,如何建立正确的公司文化,它对公司的成功至关重要
16,"Meet the boss: Robin Dunbar, evolutionary psychologist",How many close relationships can a person really have?,"Treffen Sie den Chef: Robin Dunbar, Evolutionspsychologe",Wie viele enge Beziehungen kann jemand wirklich haben?,"Conoce al jefe: Robin Dunbar, psicólogo evolutivo",¿Cuántas relaciones estrechas puede tener realmente una persona?,"Voici le patron : Robin Dunbar, psychologue évolutionniste",Combien de relations étroites une personne peut - elle vraiment avoir?,见见老板 罗宾邓巴 进化心理学家,一个人到底能有多少亲密关系?
17,Culture: Show me the way,Mission statements aren’t enough to transmit company values,Kultur: Zeigen Sie mir den Weg,"Missionsaussagen reichen nicht aus, um Unternehmenswerte zu übermitteln",Cultura: Muéstrame el camino,Las declaraciones de misión no son suficientes para transmitir los valores de la empresa,Culture: Montrez-moi le chemin,Les énoncés de mission ne sont pas suffisants pour transmettre les valeurs de l'entreprise,文化:告诉我路,任务说明不足以传送公司价值
18,"For all the damage, Israel has not much dented Iran’s nuclear capability",Also on the daily podcast: the surprising upside of India’s pollution and the quiet genius of Brian Wilson’s Beach Boys songs,"Für all den Schaden, Israel hat nicht viel verbeult Irans atomare Fähigkeit",Auch auf dem täglichen Podcast: der überraschende Aufwärtstrend der Verschmutzung Indiens und das stille Genie von Brian Wilson-Boys-Songs,"Por todo el daño, Israel no ha abollado mucho la capacidad nuclear de Irán",También en el podcast diario: la sorprendente ventaja de la contaminación de la India y el genio silencioso de las canciones de Brian Wilson’s Beach Boys,"Pour tous les dommages, Israël n'a pas beaucoup réduit la capacité nucléaire de l'Iran",Aussi sur le podcast quotidien : la surprise de la pollution de l'Inde et le génie tranquille des chansons de Brian Wilson,"面对所有破坏,以色列并没有严重削弱伊朗的核能力",也是每日播客的播客:印度污染的惊人反效果和Brian Wilson海滩男孩歌曲的安静天才
19,The Minnesota manhunt ends,"Our daily political update, featuring the stories that matter",Die Minnesota-Mahnjagd endet,"Unser tägliches politisches Update mit den Geschichten, die wichtig sind",La cacería de Minnesota termina,"Nuestra actualización política diaria, con las historias que importan",La chasse à l'homme du Minnesota se termine,"Notre mise à jour politique quotidienne, mettant en vedette les histoires qui comptent",明尼苏达搜捕结束,"我们每天的政治最新情况,特别报道重要的故事"
20,Factory work is overrated. Here are the jobs of the future,A handpicked article read aloud from the latest issue of The Economist,Die Fabrikarbeit wird überbewertet. Hier sind die Arbeitsplätze der Zukunft,Ein handverlesener Artikel aus der aktuellen Ausgabe von The Economist,El trabajo en la fábrica está sobrevalorado. Aquí están los trabajos del futuro,Un artículo escogido a mano leído en voz alta del último número de The Economist,Le travail en usine est surestimé. Voici les emplois du futur,Un article tiré à la main a été lu à haute voix dans le dernier numéro de The Economist,"工厂的工作被高估了,这些是未来的工作","《经济学家》最新一期《经济学家》的一篇文章,"
21,Trump’s three excruciating choices on Iran,Israel started the Iran war. Only America can finish it,Trumps drei qualvolle Entscheidungen über den Iran,Israel begann den Iran-Krieg. Nur Amerika kann es beenden,Tres opciones insoportables de Trump sobre Irán,Israel inició la guerra de Irán. Sólo Estados Unidos puede terminarla,Trump fait trois choix épouvantables sur l'Iran,Israël a commencé la guerre d'Iran. Seule l'Amérique peut la terminer.,特朗普对伊朗的三个令人痛苦的选择,以色列发动了伊朗战争 只有美国能完成
22,The Israel-Iran war is now a brutal test of staying power,Both sides have prepared for an air and missile war for decades,Der israelisch-iranische Krieg ist nun eine brutale Prüfung der Machterhaltung,Beide Seiten bereiten sich seit Jahrzehnten auf einen Luft- und Raketenkrieg vor,La guerra entre Israel e Irán es ahora una prueba brutal de mantener el poder,Ambas partes se han preparado para una guerra aérea y de misiles durante décadas,La guerre israélo-iranienne est maintenant un test brutal de maintien du pouvoir,Les deux parties se préparent à une guerre aérienne et antimissile depuis des décennies.,以色列-伊朗战争现在是对持久力量的残酷考验,双方已准备数十年来的空中和导弹战争
23,Can China reclaim its IPO crown?,Hong Kong is hot. The mainland very much is not,Kann China seine IPO-Krone zurückerobern?,Hongkong ist heiß. Das Festland sehr viel ist nicht,¿Puede China reclamar su corona de la OPI?,Hong Kong es caliente.,La Chine peut-elle récupérer sa couronne ?,Hong Kong est chaud.,中国能收回其IPO王冠吗?,"香港很热,大陆不太热"
24,Protests against a regal presidency have been notably peaceful,There is no need to send in the troops,Proteste gegen eine königliche Präsidentschaft waren besonders friedlich,"Es gibt keine Notwendigkeit, die Truppen zu schicken",Las protestas contra una presidencia real han sido notablemente pacíficas,No hay necesidad de enviar a las tropas.,Les protestations contre une présidence royale ont été particulièrement pacifiques.,Il n'est pas nécessaire d'envoyer les troupes,抗议王朝主席的抗议活动 特别和平,没有必要派遣部队
25,This time Hizbullah isn’t helping Iran,A once fearsome militia is sitting out the war,Diesmal hilft Hizbullah dem Iran nicht,Eine einst furchterregende Miliz sitzt aus dem Krieg,Esta vez Hizbullah no está ayudando a Irán,Una milicia que alguna vez fue temible está sentada fuera de la guerra.,"Cette fois, le Hezbollah n'aide pas l'Iran",Une milice autrefois redoutable est en train de faire la guerre.,这一次真主党对伊朗毫无帮助,曾经有恐怖的民兵在打仗
26,Correction: Canada minerals story,,Korrektur: Kanada Mineralien Geschichte,,Corrección: Historia de minerales de Canadá,,Correction : Histoire des minéraux du Canada,,更正:加拿大矿物故事,
27,Destroying Iran’s nuclear programme is Netanyahu’s obsession,He is planning at least two weeks of air strikes,Irans Atomprogramm zu zerstören ist Netanjahus Obsession,Er plant mindestens zwei Wochen Luftangriffe,Destruir el programa nuclear de Irán es la obsesión de Netanyahu,Está planeando al menos dos semanas de ataques aéreos.,Détruire l'Iran Le programme nucléaire est l'obsession de Netanyahu,Il prévoit au moins deux semaines de frappes aériennes.,摧毁伊朗核计划是内塔尼亚胡的执着,他计划至少进行两周的空袭
28,Trump is urged to go “all in” on crushing Iran,As the war escalates America is being dragged in deeper,"Trump wird dazu gedrängt, in der ganzen Welt den Iran zu zerquetschen.","Während der Krieg eskaliert, wird Amerika tiefer hineingeschleppt",Trump es instado a ir “all in” sobre aplastar a Irán,A medida que la guerra se intensifica Estados Unidos está siendo arrastrado en más profundo,Trump est pressé d'aller tout en dedans pour écraser l'Iran,"Au fur et à mesure que la guerre s'intensifie, l'Amérique est entraînée plus profondément.",要求特朗普在粉碎伊朗时“全力以赴”,随着战争的升级 美国被拖入更深的
29,Inside Operation Spiderweb,A blow-by-blow account of Ukraine’s daring raid deep into Russia,Inside Operation Spiderweb,Ein Blow-by-Blow-Bericht über Ukraines wagemutige Razzia tief in Russland,Dentro de la Operación Spiderweb,Una cuenta de golpe a golpe de la audaz incursión de Ucrania en las profundidades de Rusia,Opération Spiderweb à l'intérieur,Un compte-rendu coup par coup de l'Ukraine avec l'audace d'un raid en Russie,蜘蛛网内部行动,"乌克兰在俄罗斯深处的大胆突袭中,"
30,What an Israel-Iran war means for oil prices,We investigate possible scenarios,Was ein israelisch-irischer Krieg für die Ölpreise bedeutet,Wir untersuchen mögliche Szenarien,Lo que significa una guerra entre Israel e Irán para los precios del petróleo,Investigamos posibles escenarios,Que signifie une guerre israélo-iranienne pour le prix du pétrole,Nous étudions les scénarios possibles,以色列-伊朗战争对石油价格意味着什么?,我们调查了可能的假想情况
31,How to invest your enormous inheritance,Do not make the mistakes of the first Gilded Age,Wie man sein enormes Erbe investiert,Machen Sie nicht die Fehler des ersten Gilded Age,Cómo invertir su enorme herencia,No cometas los errores de la primera edad dorada,Comment investir votre énorme héritage,Ne faites pas les erreurs du premier Âge Gilded,如何投资你巨大的遗产,不要犯第一个时代的错误
32,The economic lessons from Ukraine’s spectacular drone success,National security is a weak argument for battery subsidies,Die wirtschaftlichen Lehren aus der Ukraine spektakulärer Drohnen-Erfolg,Nationale Sicherheit ist ein schwaches Argument für Batteriesubventionen,Las lecciones económicas del espectacular éxito de los drones en Ucrania,La seguridad nacional es un argumento débil para las subvenciones a las baterías,Les leçons économiques de l'Ukraine le succès spectaculaire drone,La sécurité nationale est un argument faible en faveur des subventions à la batterie,乌克兰无人驾驶飞机的壮观成功在经济上的教训,国家安全是电池补贴的薄弱论据
33,European stocks are buoyant. Firms still refuse to list there,Another star prepares to move from London to New York,"Die europäischen Aktien sind lebhaft, und die Unternehmen weigern sich immer noch, dort aufzuführen.",Ein weiterer Star bereitet sich auf den Umzug von London nach New York vor,Las existencias europeas son boyantes y las empresas siguen negándose a incluirlas en la lista.,Otra estrella se prepara para mudarse de Londres a Nueva York,Les stocks européens sont dynamiques et les entreprises refusent toujours de les inscrire sur la liste.,Une autre étoile se prépare à déménager de Londres à New York,"欧洲的股票活跃,公司仍然拒绝将它列入名单。",另一颗明星准备从伦敦搬到纽约
34,America and China have spooked each other,"With the costs of the trade war abundantly clear, officials seek to restore their truce",Amerika und China haben einander erschreckt,"Mit den Kosten des Handelskrieges reichlich klar, versuchen Beamte, ihren Waffenstillstand wiederherzustellen",América y China se han asustado el uno al otro,"Con los costos de la guerra comercial abundantemente claros, los funcionarios buscan restaurar su tregua",L'Amérique et la Chine se sont fait peur.,"Avec les coûts de la guerre commerciale très clair, les officiels cherchent à rétablir leur trêve",美国和中国互相惊吓,"由于贸易战争的代价十分明显,官员们设法恢复休战"
35,The rise of the loner consumer,Solo spenders are a new economic force,Der Anstieg des Einzelverbrauchers,Solo-Ausgaben sind eine neue Wirtschaftskraft,El aumento del consumidor solitario,Los que gastan en solitario son una nueva fuerza económica,La montée du consommateur solitaire,Les dépensiers solitaires sont une nouvelle force économique,独家消费者的崛起,独居者是新一股经济力量
36,Trump’s tariffs have so far caused little inflation,Our estimate of their impact will update every month,Trumps Zölle haben bisher wenig Inflation verursacht,Unsere Schätzung ihrer Auswirkungen wird jeden Monat aktualisiert,Los aranceles de Trump hasta ahora han causado poca inflación,Nuestra estimación de su impacto se actualizará cada mes,Les droits de douane de Trump ont jusqu'à présent causé peu d'inflation,Notre estimation de leur impact sera mise à jour chaque mois,特朗普的关税迄今导致的通货膨胀很少。,我们对其影响的估计将每月更新
37,Would you want to know if you were terminally ill?,"In China, catastrophic diagnoses are often kept from patients","Würdest du wissen wollen, ob du unheilbar krank bist?",In China werden katastrophale Diagnosen oft von Patienten ferngehalten.,¿Le gustaría saber si estaba enfermo terminal?,"En China, los diagnósticos catastróficos a menudo se mantienen alejados de los pacientes",Voudriez-vous savoir si vous étiez en phase terminale ?,"En Chine, les diagnostics catastrophiques sont souvent évités aux patients",你想知道你是否病得很重吗?,"在中国,灾难性诊断往往不向病人提供"
38,Bride prices are surging in China,Why is the government struggling to curb them?,Brautpreise steigen in China,"Warum kämpft die Regierung, um sie einzudämmen?",Los precios de la novia están aumentando en China,¿Por qué el gobierno está luchando para detenerlos?,Les prix de la mariée sont en hausse en Chine,Pourquoi le gouvernement lutte-t-il pour les endiguer?,中国的新娘价格正在上涨,为何政府苦苦阻止他们?
39,China’s booze business looks smashed,First terrified officials went off the lash; now young people are going dry,Chinas Alkoholgeschäft sieht zerschmettert aus,Erste erschrockene Beamte gingen von der Wimper ab; jetzt werden die jungen Leute trocken,El negocio del alcohol de China se ve destrozado,Primero los funcionarios aterrorizados se salieron del látigo; ahora los jóvenes se están secando,Chine L'alcool business semble fracassé,"Les premiers fonctionnaires terrifiés sont sortis du clash; maintenant, les jeunes s'assèchent.",中国的酒业看起来一团糟,最初吓吓人心的官员们脱了干线;现在年轻人正在干枯。
40,Now China’s ultra-cheap EVs are scaring China,They highlight many of the economy’s current problems,Chinas ultra-billige EVs erschrecken China,Sie heben viele der aktuellen Probleme der Wirtschaft hervor,Ahora los vehículos eléctricos ultra baratos de China están asustando a China,Destacan muchos de los problemas actuales de la economía,"Aujourd'hui, les VE ultra-paches de la Chine font peur à la Chine",Ils mettent en évidence de nombreux problèmes économiques actuels,现在中国超便宜的EV正在吓吓中国,它们突显了经济当前的许多问题。
41,Chinese students want an American education less than they used to,Many are staying at home or studying elsewhere in Asia,"Chinesische Studenten wollen eine amerikanische Ausbildung weniger, als sie früher",Viele wohnen zu Hause oder studieren anderswo in Asien,Los estudiantes chinos quieren una educación americana menos de lo que solían,Muchos se están quedando en casa o estudiando en otras partes de Asia,Les étudiants chinois veulent une éducation américaine moins qu'ils n'en voulaient auparavant.,Beaucoup séjournent à la maison ou étudient ailleurs en Asie,中华学生想要的美国教育比以前少,许多人留在家中或在亚洲其他地方学习。
42,China is waking up from its property nightmare,An ecstatic $38m luxury-mansion auction lights up the market,China erwacht aus seinem Eigentum Alptraum,Eine ekstatische $38m Luxus-Mansion-Auktion erhellt den Markt,China está despertando de su pesadilla de propiedad,Una subasta extática de $38m de lujo-mansión ilumina el mercado,La Chine se réveille de son cauchemar de propriété,Une vente aux enchères extatique de 38 M$ de luxe-mansion éclaire le marché,中国正在从财产恶梦中醒来,令人欣欣喜的38m豪华豪华豪华豪华豪华豪华豪华豪华豪华大拍卖 将市场推向光明
