,title-en,content-en,title-de,content-de,title-es,content-es,title-fr,content-fr,title-zh,content-zh
43,China’s crazy reverse-credit cards,"In the People’s Republic you “pay now, buy later”",Chinas verrückte Reverse-Kreditkarten,"In der Volksrepublik bezahlen Sie jetzt, kaufen Sie später",Las tarjetas de crédito inversas locas de China,"En la República Popular “pagáis ahora, comprad más tarde”",Les cartes de crédit inversées de la Chine,"Dans la République Populaire vous payez maintenant, achetez plus tard",中国疯狂的逆向信用卡,"在人民共和国,你 "" 现在就付钱,以后买 """
44,China’s carbon emissions may have peaked,"If so, it is a significant, symbolic moment",Die CO2-Emissionen in China könnten ihren Höhepunkt erreicht haben,"Wenn ja, dann ist es ein bedeutsamer, symbolischer Moment.",Las emisiones de carbono de China pueden haber alcanzado su punto máximo,"Si es así, es un momento significativo y simbólico.",Les émissions de carbone de la Chine ont peut-être atteint un sommet,"Si c'est le cas, c'est un moment significatif et symbolique.",中国的碳排放量可能已经达到顶峰,"如果是这样的话,这是一个意义重大的象征意义的时刻"
45,Xi Jinping’s plan to overtake America in AI,China’s leaders believe they can outwit American cash and utopianism,"Xi Jinpings Plan, Amerika in KI zu überholen","Chinas Führer glauben, dass sie amerikanisches Geld und Utopismus überlisten können",El plan de Xi Jinping para superar a Estados Unidos en IA,Los líderes chinos creen que pueden burlar el dinero estadounidense y el utopismo,Xi Jinping's prévoit de dépasser l'Amérique en AI,Les dirigeants chinois croient qu'ils peuvent surpasser l'argent américain et l'utopianisme,习近平计划在AI公司上越越美国,"中国领导人相信,他们能够战胜美国的现金和乌托邦主义。"
46,A sex scandal in China sparks a nationwide debate,The affair has morphed into a discussion about privilege and fairness,Ein Sexskandal in China löst eine landesweite Debatte aus,Die Affäre hat sich in eine Diskussion über Privilegien und Fairness verwandelt,Un escándalo sexual en China desencadena un debate a nivel nacional,El asunto se ha transformado en una discusión sobre el privilegio y la equidad,Un scandale sexuel en Chine déclenche un débat national,L'affaire s'est transformée en une discussion sur le privilège et l'équité,中国的性丑闻引发全国辩论,这件事已经演变成对特权和公平的讨论
47,Gavin Newsom is ready for his close-up,The California governor’s beef with Donald Trump could resonate with voters beyond his state,Gavin Newsom ist bereit für seine Nahaufnahme,Der kalifornische Gouverneur streitet mit Donald Trump könnte mit Wählern über seinen Staat hinaus mitschwingen,Gavin Newsom está listo para su primer plano,La disputa del gobernador de California con Donald Trump podría resonar con los votantes más allá de su estado,Gavin Newsom est prêt pour son gros plan,Le gouverneur californien se bat avec Donald Trump pourrait résonner avec les électeurs au-delà de son état,Gavin Newsom已经准备好为他的特写准备了,加州州长与唐纳德·特朗普的争吵可能会与州以外的选民产生共鸣
48,The true meaning of Trump Derangement Syndrome,His partnership with Elon Musk is the Rosetta Stone,Die wahre Bedeutung des Trump-Derangement-Syndroms,Seine Partnerschaft mit Elon Musk ist der Rosetta Stein,El verdadero significado del Síndrome de Trastorno de Trump,Su asociación con Elon Musk es la Piedra de Rosetta,La véritable signification du syndrome de dérangement de Trump,Son partenariat avec Elon Musk est la Pierre Rosetta,Trump 疏离综合症的真正含义,他与埃隆·穆斯克的伙伴关系是罗塞塔石
49,How a Christian group is changing education in America,"LifeWise is growing fast, closing the gap between church and state",Wie eine christliche Gruppe die Bildung in Amerika verändert,LifeWise wächst schnell und schließt die Kluft zwischen Kirche und Staat,Cómo un grupo cristiano está cambiando la educación en América,"LifeWise está creciendo rápidamente, cerrando la brecha entre la iglesia y el estado",Comment un groupe chrétien change l'éducation en Amérique,"LifeWise grandit rapidement, comblant l'écart entre l'église et l'État",基督教团体如何改变美国教育状况,"生命维思正在快速成长,缩小了教会与邦之间的差距"
50,The meaning of the protests in Los Angeles,"Donald Trump’s provocation could change LA, California and perhaps the entire country",Die Bedeutung der Proteste in Los Angeles,"Donald Trumps Provokation könnte LA, Kalifornien und vielleicht das ganze Land verändern",El significado de las protestas en Los Ángeles,"La provocación de Donald Trump podría cambiar LA, California y quizás todo el país",Le sens des manifestations à Los Angeles,"La provocation de Donald Trump pourrait changer LA, la Californie et peut-être tout le pays",洛杉矶抗议活动的意义,唐纳德·特朗普的挑衅可能改变洛杉矶、加利福尼亚和整个国家。
51,Donald Trump can call in the troops,His authority is broad even if his actions are inflammatory,Donald Trump kann die Truppen rufen,"Seine Autorität ist breit, auch wenn seine Handlungen entzündlich sind",Donald Trump puede llamar a las tropas,Su autoridad es amplia incluso si sus acciones son inflamatorias,Donald Trump peut appeler les troupes,Son autorité est large même si ses actions sont inflammatoires,唐纳德·特朗普可以召集部队,"即使他的行为具有煽动性,他的权力也十分广泛"
52,Does America now have a woke right?,Members of the anti-woke coalition are turning against one another,Hat Amerika jetzt ein Aufwachen richtig?,Mitglieder der Anti-Wachs-Koalition wenden sich gegeneinander,¿América ahora tiene un despertar derecho?,Los miembros de la coalición anti-despertar se están volviendo unos contra otros,L'Amérique a-t-elle maintenant le droit de se réveiller ?,Les membres de la coalition anti-woke se retournent les uns contre les autres,美国现在是不是醒了?,反吵吵的联盟成员相互对立
53,Donald Trump’s new travel ban is coming into effect,It will probably stand up in court,Donald Trumps neues Reiseverbot tritt in Kraft,Es wird wahrscheinlich vor Gericht stehen,La nueva prohibición de viajar de Donald Trump está entrando en vigor,Probablemente se pondrá de pie en la corte.,La nouvelle interdiction de voyager de Donald Trump entre en vigueur,Il se lèvera probablement devant le tribunal.,唐纳德·特朗普的新旅行禁令即将生效,它很可能在法庭上站立起来
54,Sending the National Guard to LA is not about stopping rioting,The city is being punished for resisting the Trump administration’s deportation efforts,"Die Nationalgarde nach L.A. zu schicken, geht nicht darum, Krawalle zu stoppen.","Die Stadt wird bestraft, weil sie der Trump-Administration Widerstand leistet.",Enviar a la Guardia Nacional a Los Ángeles no es parar los disturbios.,La ciudad está siendo castigada por resistirse a los esfuerzos de deportación de la administración Trump,Envoyer la Garde nationale à Los Angeles ne consiste pas à arrêter les émeutes,La ville est punie pour avoir résisté aux efforts de déportation de l'administration Trump,派国民警卫队去洛杉矶 不是为了阻止暴乱,"因为抵制特朗普政府驱逐行动,"
55,Donald Trump has many ways to hurt Elon Musk,The incentives for Mr Musk to make up with the president are powerful,"Donald Trump hat viele Möglichkeiten, Elon Musk zu verletzen","Die Anreize für Herrn Musk, den Präsidenten wiedergutzumachen, sind gewaltig.",Donald Trump tiene muchas maneras de herir a Elon Musk,Los incentivos para que el Sr. Musk compense con el Presidente son poderosos,Donald Trump a plusieurs façons de blesser Elon Musk,Les incitations pour M. Musk à se réconcilier avec le président sont puissantes,唐纳德・特朗普有很多方法 伤害伊隆・穆斯克,促使穆克先生和总统和解的激励力非常强大
56,"Mel Gibson doesn't mince words, Trump delivers major win for steel workers, and more from Fox News Opinion","Read the latest from Fox News Opinion &amp; watch videos from Sean Hannity, Raymond Arroyo &amp; more.","Mel Gibson nicht mince Worte, Trump liefert großen Sieg für Stahlarbeiter, und mehr von Fox News Meinung","Lesen Sie die neuesten von Fox News Opinion &amp; Videos von Sean Hannity, Raymond Arroyo &amp; mehr.","Mel Gibson no habla mal, Trump obtiene una gran victoria para los trabajadores del acero, y más de Fox News Opinion","Lea lo último de Fox News Opinion &amp; ver vídeos de Sean Hannity, Raymond Arroyo &amp; más.","Mel Gibson ne mâche pas les mots, Trump livre une victoire majeure pour les travailleurs de l'acier, et d'autres de Fox News Opinion","Lisez les dernières nouvelles de Fox News Opinion &amp; regardez des vidéos de Sean Hannity, Raymond Arroyo &amp; plus.","Mel Gibson不小说, Trump为钢铁工人带来重大胜利,",阅读Fox News Views & amp; 从肖恩·汉尼蒂、雷蒙德·阿罗约(Raymond Arroyo) & amp; 更多观察视频的最新消息。
57,Ex-White House officials to testify on who 'really ran the country' during Biden era,"Sens. John Cornyn and Eric Schmitt advance probe into alleged Biden cognitive decline, with Wednesday&apos;s hearing featuring former White House officials, while Democrats call no witnesses.","Ex-White House Beamte zu bezeugen, wer 'wirklich das Land geführt' während Biden-Ära","Sens. John Cornyn und Eric Schmitt untersuchen den angeblichen kognitiven Niedergang von Biden mit Wednesday&apos;s Anhörung mit ehemaligen Beamten des Weißen Hauses, während Demokraten keine Zeugen rufen.",Ex funcionarios de la Casa Blanca para testificar sobre quienes 'realmente gobernaron el país' durante la era Biden,"Los senadores John Cornyn y Eric Schmitt avanzan la investigación sobre el supuesto deterioro cognitivo de Biden, con la audiencia de Wednesday&apos con ex funcionarios de la Casa Blanca, mientras que los demócratas no llaman a testigos.",Des fonctionnaires de l'ex-Maison Blanche pour témoigner sur qui « a réellement géré le pays » pendant l'ère Biden,"John Cornyn et Eric Schmitt avancent une enquête sur le prétendu déclin cognitif de Biden, avec une audience de mercredi avec des anciens fonctionnaires de la Maison-Blanche, tandis que les démocrates n'appellent pas de témoins.",前白宫官员在拜登时代作证谁“真正管理国家”,"John Cornyn和Eric Schmitt对据称Biden认知下降进行预先调查,周三和周三举行听证会,前白宫官员出席听证会,而民主党不传唤证人。"
58,New York Dems make shocking terror claim about Trump's budget cut proposal,House Democrats representing parts of New York City are sending an ominous warning to congressional appropriators.,New York Dems machen schockierende Terroranschläge über Trumps Budgetkürzungsantrag,"House Democrats, die Teile von New York City vertreten, senden eine ominöse Warnung an Kongressaneigner.",Los demócratas de Nueva York afirman terror sobre la propuesta de Trump de recortar el presupuesto,Demócratas de la Cámara de Representantes que representan partes de la ciudad de Nueva York están enviando una advertencia ominosa a los apropiadores del Congreso.,Les Dems de New York revendiquent la terreur choquante à propos de la proposition de réduction du budget de Trump,Les démocrates de la Chambre représentant certaines parties de la ville de New York envoient un avertissement inquiétant aux responsables du Congrès.,纽约Dems对特朗普的削减预算提案 提出令人震惊的恐怖指控,代表纽约市部分地区的众议院民主党人 正在向国会的股东发出不祥的警告
59,Minnesota police praised for foiling lawmaker shooting suspect's plan,"Officer intervention likely prevented more deaths after suspect Vance Boelter allegedly killed state Rep. Melissa Hortman on Saturday, police chief says.",Minnesota Polizei lobte für die Verhängung Gesetzgeber schießen Verdächtigen Plan,"Officer Intervention wahrscheinlich verhindert mehr Todesfälle, nachdem Verdächtige Vance Boelter angeblich getötet State Rep. Melissa Hortman am Samstag, Polizeichef sagt.",Policía de Minnesota alabado por frustrar legislador disparar plan de sospechoso,"La intervención del oficial probablemente impidió más muertes después de que el sospechoso Vance Boelter supuestamente matara a la representante estatal Melissa Hortman el sábado, dice el jefe de policía.",La police du Minnesota a loué pour avoir déjoué le plan du suspect.,"L'intervention de l'officier a probablement empêché plus de morts après que le suspect Vance Boelter aurait tué la Rep. Melissa Hortman samedi, dit le chef de la police.",明尼苏达警方赞扬 挫败立法者 拍摄嫌疑人的计划,"警方主管表示, 警员干预很可能防止更多人死亡, 疑犯Vance Boelter涉嫌在星期六杀害州政府Melissa Hortman Rep."
60,Blistering report calls for investigation into 5 'woke' hospitals pushing 'radical' agenda with taxpayer money,A blistering new report highlights five hospitals across the country that the group says is promoting &quot;woke&quot; ideology over patient care with federal dollars.,"Blisterbericht fordert Untersuchung in 5 'erwachten' Krankenhäusern, die 'radikale' Agenda mit Steuergeldern drängen","Ein neuer brisanter Bericht hebt fünf Krankenhäuser im ganzen Land hervor, dass die Gruppe sagt, dass sie &quot;Woke&quot;-Ideologie über die Patientenversorgung mit Bundesdollars fördern.",El informe Blistering pide que se investiguen 5 hospitales 'despiertos' que impulsan la agenda 'radical' con dinero de los contribuyentes,Un nuevo y contundente informe destaca cinco hospitales en todo el país que el grupo dice que está promoviendo la ideología de &quot;woke&quot; sobre la atención al paciente con dólares federales.,Le rapport Blistering appelle à une enquête sur 5 hôpitaux «woke» poussant l'agenda «radical» avec l'argent des contribuables,Un nouveau rapport éclectique met en lumière cinq hôpitaux partout au pays que le groupe dit promouvoir &quot;woke&quot; idéologie sur les soins aux patients avec des dollars fédéraux.,以纳税人的钱推动“激进”议程。,"一份令人发指的新报告突显了全国五家医院, 该团体认为这五家医院正在推广 & qut; woke&qot; 有关用联邦美元治疗病人的意识形态。"
61,'Grow up': Newsom slams Trump after DOJ rules it can strip Biden-era protections from CA lands,Justice Department memo confirms presidential authority to rescind national monument status on federal lands.,'Grow up': Newsom knallt Trump nach den DOJ-Regeln ab und kann Biden-Ära-Schutz aus CA-Ländern entfernen,"Das Memo des Justizministeriums bestätigt die Präsidialbehörde, den Status eines nationalen Denkmals auf Bundesebene aufzuheben.",'Crecer': Newsom golpea a Trump después de que el Departamento de Justicia gobierne que puede quitar las protecciones de la era Biden de tierras de CA,El memorando del Departamento de Justicia confirma la autoridad presidencial para anular el estado de monumento nacional en tierras federales.,"'Grow up': Newsom frappe Trump après les règles du DOJ, il peut enlever les protections de l'ère Biden des terres CA",La note du ministère de la Justice confirme l'autorité présidentielle d'annuler le statut de monument national sur les terres fédérales.,"Newsom shlams Trumps Trumps 依据司法部的规则,",司法部备忘录确认总统有权取消联邦土地上的国家纪念碑地位。
62,Why Super Bowl champion Joe Theismann believes Aaron Rodgers has 'potential' to be successful with Steelers,Super Bowl champion Joe Theismann expressed optimism about Aaron Rodgers having success with the Pittsburgh Steelers in an interview with Fox News Digital.,"Warum Super Bowl-Champion Joe Theismann glaubt, dass Aaron Rodgers 'potenziell' ist, um mit Steelers erfolgreich zu sein","Super Bowl-Champion Joe Theismann äußerte Optimismus darüber, dass Aaron Rodgers mit den Pittsburgh Steelers im Interview mit Fox News Digital Erfolg hatte.","¿Por qué el campeón del Super Bowl Joe Theismann cree que Aaron Rodgers tiene ""potencial"" para tener éxito con Steelers",El campeón del Super Bowl Joe Theismann expresó su optimismo acerca de que Aaron Rodgers tuviera éxito con los Pittsburgh Steelers en una entrevista con Fox News Digital.,"Pourquoi le champion du Super Bowl Joe Theismann croit qu'Aaron Rodgers a ""potentiel"" de réussir avec Steelers",Le champion du Super Bowl Joe Theismann a exprimé son optimisme quant au succès d'Aaron Rodgers avec les Steelers de Pittsburgh dans une interview avec Fox News Digital.,"为什么超级碗冠军乔·西斯曼 认为艾伦·罗杰斯有""潜力""",超级碗冠军乔·西斯曼对亚伦·罗杰斯成功 与匹兹堡钢铁家一起采访福克斯新闻数字公司表示乐观
63,Fox Nation's 'Summer of Chaos' special revisits Seattle's failed CHOP zone experiment,"Five years after Seattle&apos;s police-free CHOP zone, Fox Nation&apos;s &apos;Summer of Chaos&apos; special revisits the lawlessness that led to violence, deaths, and unrest in the city.",Fox Nation's 'Summer of Chaos' Spezial-Revisits Seattles gescheitertes CHOP-Zonen-Experiment,"Fünf Jahre nach Seattle&apos; die polizeifreie Zone CHOP, Fox Nation&apos;s &apos;Sommer von Chaos&apos; Sonderberichte über die Gesetzlosigkeit, die zu Gewalt, Todesfällen und Unruhen in der Stadt führte.","El especial de ""Verano del Caos"" de Fox Nation revisa el fallido experimento de zona CHOP de Seattle","Cinco años después de Seattle&apos;s zona libre de policía CHOP, Fox Nation&apos;s &apos;Verano de Caos&apos; especial revisa la anarquía que llevó a la violencia, muertes y disturbios en la ciudad.",La spéciale de Fox Nation 'Summer of Chaos' revisite l'expérience ratée de Seattle sur la zone CHOP,"Cinq ans après Seattle&apos; zone CHOP sans police, Fox Nation&apos;s &apos;Été de Chaos&apos; spécial revisite l'anarchie qui a mené à la violence, à la mort et aux troubles dans la ville.",福克斯民族的'混乱之夏'特别重访 西雅图失败的CHOP区实验,"西雅图和阿波斯;无警察的CHOP区,Fox Nations和阿波斯;s&apos;Chaos&apos的夏天;特别重温导致城市暴力、死亡和动乱的无政府状态。"
64,Trans Dem Rep. McBride suggests party went too far with transgender agenda before public was ready,"Rep. Sarah McBride, a transgender Democratic lawmaker elected to Congress in 2024, suggested the party overplayed its hand on trans issues.","Trans Dem Rep. McBride schlägt Partei ging zu weit mit transgender Agenda, bevor die Öffentlichkeit bereit war","Rep. Sarah McBride, eine Transgender Democratic Lawmaker in den Kongress im Jahr 2024 gewählt, schlug vor, die Partei überspielt seine Hand auf Trans-Fragen.",El representante de Trans Dem McBride sugiere que la fiesta fue demasiado lejos con la agenda transgénero antes de que el público estuviera listo,"La representante Sarah McBride, legisladora demócrata transgénero elegida para el Congreso en 2024, sugirió que el partido se excediera en las cuestiones trans.",Trans Dem Rep. McBride suggère que la fête est allée trop loin avec l'agenda transgenre avant que le public soit prêt,"La rép. Sarah McBride, une avocate démocratique transgenre élue au Congrès en 2024, a suggéré que le parti surjouait sa main sur les questions trans.","McBride建议党在公众准备之前,",2024年当选国会议员的变性民主立法者Sarah McBride Rep.
65,Florida man convicted of posing as flight attendant to get dozens of free flights,Federal jury convicts Florida man for fraudulently accessing airline websites and flying on 34 free flights using fake flight attendant credentials.,Florida Mann des Posierens als Flugbegleiter verurteilt Dutzende von freien Flügen zu bekommen,Bundesjury verurteilt Florida Mann für betrügerisch Zugriff auf Airline-Websites und fliegen auf 34 kostenlose Flüge mit gefälschten Flugbegleiter Anmeldeinformationen.,Hombre de Florida condenado por hacerse pasar por azafata para conseguir docenas de vuelos gratis,El jurado federal condena al hombre de Florida por acceder fraudulentamente a sitios web de aerolíneas y volar en 34 vuelos gratis usando credenciales falsas de asistente de vuelo.,Florida homme reconnu coupable de poser comme agent de bord pour obtenir des dizaines de vols gratuits,Le jury fédéral condamne l'homme de Floride pour avoir frauduleux accès aux sites web de la compagnie aérienne et avoir volé sur 34 vols gratuits en utilisant de faux certificats d'agent de bord.,佛罗里达州男子被定罪 假扮空服员 搭乘数十次免费航班,"联邦陪审团判定佛罗里达男子以欺诈手段访问航空公司网站,并使用伪造的空姐证书乘坐34次免费航班飞行。"
66,Message in bottle from 1983 washes up on remote island with historical contents intact,"An archaeology technician recently discovered a 1983 message in a bottle on Sable Island, with the gin-scented container preserving a faded letter and Canadian currency.",Botschaft in der Flasche von 1983 wäscht sich auf entlegene Insel mit historischen Inhalten intakt,"Ein Archäologie-Techniker entdeckte vor kurzem eine Botschaft von 1983 in einer Flasche auf Sable Island, wobei der gin-scented Behälter einen verblassten Buchstaben und kanadische Währung bewahrte.",Mensaje en botella de 1983 se lava en isla remota con contenidos históricos intactos,"Un técnico de arqueología descubrió recientemente un mensaje de 1983 en una botella en la isla de Sable, con el contenedor perfumado de ginebra conservando una letra descolorida y la moneda canadiense.",Message en bouteille de 1983 se lave sur l'île éloignée avec le contenu historique intact,"Un technicien en archéologie a récemment découvert un message de 1983 dans une bouteille de l'île de Sable, le contenant parfumé au gin conservant une lettre effacée et une monnaie canadienne.",1983年的瓶装信件 被洗在边远岛屿上 历史内容完好无损,"一位考古技术员最近发现1983年在塞布尔岛的一个瓶子中发现了一条信息,其中的金刚石容器保存着淡化的字母和加拿大货币。"
67,"American tourists in popular vacation spot face increased risk of being killed, robbed","The Dominican Republic receives updated travel advisory warning Americans about violent crime, robbery, homicide and sexual assault amid concerns over limited police effectiveness.","Amerikanische Touristen in beliebten Urlaubsort konfrontiert erhöhte Gefahr, getötet zu werden, ausgeraubt","Die Dominikanische Republik erhält aktualisierte Reiseberatung Warnung Amerikaner über Gewaltverbrechen, Raub, Mord und sexuelle Übergriffe inmitten von Sorgen über begrenzte Polizei Wirksamkeit.","Los turistas estadounidenses en lugares populares de vacaciones enfrentan un mayor riesgo de ser asesinados, robados","La República Dominicana recibe información actualizada sobre viajes que advierte a los estadounidenses sobre delitos violentos, robos, homicidios y agresiones sexuales en medio de preocupaciones por la limitada eficacia policial.","Les touristes américains dans les lieux de vacances populaires sont confrontés à un risque accru d'être tués, volés","La République dominicaine reçoit une mise à jour des avis de voyage avertissant les Américains de crimes violents, de vols, d'homicides et d'agressions sexuelles alors que les préoccupations concernant l'efficacité limitée de la police.",在流行度假点的美国游客面临被杀、抢劫的风险增加,"多米尼加共和国收到关于暴力犯罪、抢劫、杀人和性攻击的最新旅行咨询警告,因为担心警察效力有限。"
68,Red Sox exec says he believes team could win 'more games' without Rafael Devers,Boston Red Sox chief baseball officer Craig Breslow said he believes there is a &quot;real chance&quot; his team is better after trading Rafael Devers.,"Red Sox exec sagt, er glaubt, Team könnte gewinnen ""mehr Spiele"" ohne Rafael Devers","Boston Red Sox Chief Baseball Officer Craig Breslow sagte, er glaubt, es gibt eine &quot;real chance&quot; sein Team ist besser nach dem Handel Rafael Devers.",Red Sox exec dice que cree que el equipo podría ganar 'más juegos' sin Rafael Devers,"El jefe de béisbol de Boston Red Sox, Craig Breslow, dijo que cree que hay una &quot;real chance&quot; su equipo es mejor después de negociar Rafael Devers.",Red Sox exec dit qu'il croit que l'équipe pourrait gagner 'plus de jeux' sans Rafael Devers,Le chef de baseball de Boston Red Sox Craig Breslow a dit qu'il croyait qu'il y avait une chance réelle; son équipe est meilleure après avoir échangé Rafael Devers.,红袜队执行员说他相信没有拉斐尔·德弗斯 球队可以赢得更多比赛,"波士顿红袜队棒球总经理克雷格·布雷斯洛(Craig Breslow)说,他相信有一个 & qut; 真正的机会和配额; 他的球队比交易拉斐尔·德弗斯要好。"
