,title-de,content-de,title-en,content-en,title-zh,content-zh
25,Entwicklungsministerin Alabali Radovan zum Pandemieabkommen,"Heute hat die Weltgesundheitsversammlung der WHO ein Pandemieabkommen beschlossen. Dazu erklärt Ministerin Reem Alabali Radovan: „Es ist eine gute Nachricht für das globale Miteinander, dass sich die Weltgemeinschaft auf ein Pandemieabkommen geeinigt hat. Das Abkommen ist eine Lehre aus der Corona-Pandemie, als sich die Länder des Globalen Südens bei der Verteilung von Impfstoffen hinten anstellen mussten. Das hat nicht nur im Kampf gegen die Pandemie geschadet, es hat auch viel Vertrauen zerstört. Mit dem Abkommen nimmt sich die Weltgemeinschaft vor: In Zukunft soll es gerechter zugehen. (...)""",Minister for Development Alabali Radovan on the Pandemic Agreement,"Today, the World Health Assembly of the WHO has adopted a pandemic agreement. Minister Reem Alabali Radovan explains: ""It is good news for the global community that the world community has agreed on a pandemic agreement. The agreement is a lesson from the Corona pandemic when the countries of the Global South had to stand behind in the distribution of vaccines. This has not only damaged the fight against the pandemic, it has also destroyed a lot of confidence. With the agreement, the world community takes action: in the future, it should be fairer. (...)""",发展部长阿巴拉利·拉多万 参加流行病协议的发展部长阿拉巴利·拉多万,"今天世卫组织世界卫生大会通过了流行病公约. 部长雷姆·阿拉巴利·拉多万 (Reem Alabali Radovan) 对此表示:全球合作是好消息,国际社会已经达成了大流行病协议. 这项协议是科罗纳大流行病的教训,当南方各国必须在疫苗分发方面进行部署时. 这不仅对防治大流行病造成伤害,而且也摧毁了许多信任. 该协议让国际社会相信,今后应当公平行事."
26,Diplomatie: Keine umfassende Abschlusserklärung bei G7-Gipfel geplant,"<a href=""https://www.zeit.de/news/2025-06/12/keine-umfassende-abschlusserklaerung-bei-g7-gipfel-geplant""><img src=""https://img.zeit.de/news/2025-06/12/keine-umfassende-abschlusserklaerung-bei-g7-gipfel-geplant-image-group/wide__148x84"" style=""float: left; margin-right: 5px;"" /></a> None",Diplomacy: No comprehensive final declaration planned at G7 summit,"<a href=""https://www.zeit.de/news/2025-06-/12/no comprehensive closing declaration-at-g7-summit-planned""><img src=""https://img.zeit.de/news/2025-06-/12/no comprehensive closing declaration-at-g7-summit-planned-image-group/wide__148x84"" style=""float: left; margin-right: 5px;"" /></a> None",外交:没有在G7峰会上发表全面的毕业宣言,"< a href=""http://www.Time.en/news2025-06/12/无完成总结折叠计划""> <img shrc=""http://img.time.com/news2025-06/162无完成总结表单"" src=""http://img.time."""
27,Oberfranken: Koffer löst Großeinsatz aus – Kindergarten evakuiert,"<a href=""https://www.zeit.de/news/2025-06/12/koffer-loest-grosseinsatz-aus-kindergarten-evakuiert""><img src=""https://img.zeit.de/news/2025-06/12/koffer-loest-grosseinsatz-aus-kindergarten-evakuiert-image-group/wide__148x84"" style=""float: left; margin-right: 5px;"" /></a> None",Upper Franconia: Suitcase triggers large-scale deployment – Kindergarten evacuated,"<a href=""https://www.zeit.de/news/2025-06-/12/case-loest-gross-out-kindergarten-evacuated""><img src=""https://img.zeit.de/news/2025-06-/12/case-loest-gross-out-kindergarten-evacuated-image-group/wide__148x84"" style=""float: left; margin-right: 5px;"" /></a> None",大理石:手提箱能解决从幼儿园疏散的大行动,"<href=""http://www.时间.en/news2025-06/02-lose-gross -out-ground"
28,Windkraft: Großprojekt zur Umrüstung von Windrädern kurz vor Abschluss,"<a href=""https://www.zeit.de/news/2025-06/12/grossprojekt-zur-umruestung-von-windraedern-kurz-vor-abschluss""><img src=""https://img.zeit.de/news/2025-06/12/grossprojekt-zur-umruestung-von-windraedern-kurz-vor-abschluss-image-group/wide__148x84"" style=""float: left; margin-right: 5px;"" /></a> None",Wind power: large-scale wind turbine conversion project shortly before completion,"<a href=""https://www.zeit.de/news/2025-06-/12/grossproject-to-turn-from-windrowedern-short-before-finished""><img src=""https://img.zeit.de/news/2025-06-/12/grossproject-to-turn-from-windrowedern-short-before-finished-image-group/wide_148x84"" style=""float: left; margin-right: 5px;"" /></a> None",风力: 风力发电大工程即将完成.,"<href=""http://www.时间.en/news2025-06/102gross project to float from float: left; margin-right: 5px;"""
29,Trotz Kritik: Bahn bleibt dabei: Familienreservierung wird abgeschafft,"<a href=""https://www.zeit.de/news/2025-06/12/bahn-bleibt-dabei-familienreservierung-wird-abgeschafft""><img src=""https://img.zeit.de/news/2025-06/12/bahn-bleibt-dabei-familienreservierung-wird-abgeschafft-image-group/wide__148x84"" style=""float: left; margin-right: 5px;"" /></a> None",Despite criticism: Bahn remains there: Family reservation is abolished,"<a href=""https://www.zeit.de/news/2025-06-/12/bahn-remains-with-family reservation-will be removed""><img src=""https://img.zeit.de/news/2025-06-/12/bahn-remains-with-family reservation-will be removed-image-group/wide_148x84"" style=""float: left; margin-right: 5px;"" /></a> None",尽管有批评: 铁路仍保留着: 取消家庭保留权,"< a href=""http://www.时间.en/news2025-06/62 reservation""> <img shrc=""http://img.time.com/news 2025-06/162/dit-distitial reservion"" - tobug-broup/wide_148x84"" style=""float: left; margin-right: 5px;"" //a> None"
30,Parteien: Gelbhaar: Ombudsverfahren war alptraumhaft,"<a href=""https://www.zeit.de/news/2025-06/12/gelbhaar-ombudsverfahren-war-alptraumhaft""><img src=""https://img.zeit.de/news/2025-06/12/gelbhaar-ombudsverfahren-war-alptraumhaft-image-group/wide__148x84"" style=""float: left; margin-right: 5px;"" /></a> None",Parties: Yellow hair: Ombuds trial was nightmareous,"<a href=""https://www.zeit.de/news/2025-06/12/yellow-hair-ombuds-war-dreamlike""><img src=""https://img.zeit.de/news/2025-06-/12/yellow-hair-ombuds-war-dreamlike-image-group/wide_148x84"" style=""float: left; margin-right: 5px;"" /></a> None",双方: 黄头发: Ombud 程序是梦幻的,<\ \ \ \ \ \ \ \ \ \ \ \ \ \ \ \ \ \ \ \ \ \ \ \ \ \ \ \ \ \ \ \ \ \ \ \ \ \ \ \ \ \ \ \ \ \ \ \ \ \ \ \ \ \ \ \ \ \ \ \ \ \ \ \ \ \ \ \ \ \ \ \ \ \ \ \ \ \ \ \ \ \ \ \ \ \ \ \ \ \ \ \ \ \ \ \ >
31,Städte- und Gemeindetag: Kommunen fordern bessere Finanzierung und Strukturreform,"<a href=""https://www.zeit.de/news/2025-06/12/kommunen-fordern-bessere-finanzierung-und-strukturreform""><img src=""https://img.zeit.de/news/2025-06/12/kommunen-fordern-bessere-finanzierung-und-strukturreform-image-group/wide__148x84"" style=""float: left; margin-right: 5px;"" /></a> None",Urban and municipal day: municipalities demand better financing and structural reform,"<a href=""https://www.zeit.de/news/2025-06-/12/communal-demand-better-financing-and-structural-reform""><img src=""https://img.zeit.de/news/2025-06-/12/communal-demand-better-financing-and-structural-reform-image-group/wide_148x84"" style=""float: left; margin-right: 5px;"" /></a> None",城市日和社区日:地方政府要求更好的融资和结构改革,"< a href=""http://www.时间.en/news2025-06/62-request corresponding 和结构改革""> <img shrc=http://img.time.com/news2025-06/06/12/square-request"
32,Plädoyer: Nach Tod eines Mädchens - Verteidigung will Freispruch,"<a href=""https://www.zeit.de/news/2025-06/12/nach-tod-eines-maedchens-verteidigung-will-freispruch""><img src=""https://img.zeit.de/news/2025-06/12/nach-tod-eines-maedchens-verteidigung-will-freispruch-image-group/wide__148x84"" style=""float: left; margin-right: 5px;"" /></a> None",Pleasure: After a girl's death - Defense wants acquittal,"<a href=""https://www.zeit.de/news/2025-06-/12/after-tod-one-maedchens-defense-will-defense-will-defense-image-group/wide__148x84"" style=""float: left; margin-right: 5px;"" /></a> None",被告:在女孩去世后 - - 辩护律师要求无罪释放,"< a href=""http://www.时间.en/news2025-06/02 after a majest defended defence""> <img shrc=""http://img.time.com/news 2025-06/162 after 1-06/162 后死亡的防御性防治措施."" 组合/wide_1448x84"" style=""float: left""; margin-right: 5px; //a> None"
33,Volleyball-Bundesliga: Deutscher Pokalsieger setzt auf den Nachwuchs,"<a href=""https://www.zeit.de/news/2025-06/12/deutscher-pokalsieger-setzt-auf-den-nachwuchs""><img src=""https://img.zeit.de/news/2025-06/12/deutscher-pokalsieger-setzt-auf-den-nachwuchs-image-group/wide__148x84"" style=""float: left; margin-right: 5px;"" /></a> None",Volleyball Bundesliga: German Cup Winner Counts on Young Talents,"<a href=""https://www.zeit.de/news/2025-06/12/German Cup Winner-set-on-the-news""><img src=""https://img.zeit.de/news/2025-06/12/German Cup Winner-set-on-the-news-image-group/wide_148x84"" style=""float: left; margin-right: 5px;"" /></a> None","排球联盟: 德国胜利者胜出者胜出,胜者胜出. . . . . .","<href=""http://www.时间.en/news 2025-06/12/德国加权者加权者""> <imgsrc=""http://img.time.com/news 2025-06/162-06/warder-pulenter-pulder-plusives-plusives-size/wide_1448x84"" style=""float: left: margin-right: 5px;"" //a - None"
34,US-Migrationspolitik: Wie sehr die US-Wirtschaft von der Einwanderung abhängt,"Alles Kriminelle, die US-Bürgern die Arbeit wegnehmen? So begründet Donald Trump seine Abschiebeoffensive. Doch wirtschaftlich droht den USA damit großer Schaden.",US migration policy: How much the US economy depends on immigration,All criminals who take the work away from U.S. citizens? Donald Trump explains his deportation offensive. But economic damage threatens the U.S. with this.,美国移民政策:美国经济有多依赖移民,"所有剥夺美国公民工作的权利的罪犯都是唐纳德·特朗普的借口. 但经济上,这会给美国带来巨大的伤害."
35,Ukrainekrieg: Boris Pistorius kündigt in Kyjiw neue Milliardenhilfen an,"Zusätzliche 1,9 Milliarden Euro sollen laut Pistorius die Produktion weitreichender Waffen in der Ukraine finanzieren – wenn der Bundestag zustimmt. Das Liveblog",Ukraine War: Boris Pistorius announces new billions in Kyyiv,"According to Pistorius, additional 1.9 billion euros are to finance the production of far-reaching weapons in Ukraine – if the Bundestag agrees.",乌克兰战争:鲍里斯·皮斯托里斯 (Boris Pistorius) 在京城宣布了新的数十亿援助计划.,"皮斯托里厄斯说联邦日同意后,在乌克兰的大规模杀伤性武器生产中增加19亿欧元. 实况博客指出,实况博客是用来资助实况转播的."
36,Hitzewelle: Deutscher Wetterdienst rechnet mit bis zu 35 Grad am Wochenende,In Deutschland wird es die erste kleine Hitzewelle des Jahres geben. Sie währt laut dem DWD aber wegen kräftiger Gewitter nur kurz. Es besteht Unwettergefahr.,Heat wave: German weather service expects up to 35 degrees on weekends,"In Germany there will be the first small heat wave of the year. According to the DWD, however, it only lasts for a short time due to strong thunderstorms.",热浪:德国气象局预计 周末能达到35摄氏度,"德国将有一年中第一个小型热浪. 但根据民主党的统计,由于暴风雪而持续时间很短. 天气晴朗."
37,"Lionel Richie: ""Leute, hört auf zurückzuschauen, oder ihr verpasst eure Zukunft""","Lionel Richie schrieb einen Song mit Michael Jackson und erlebte Bob Dylan, als der noch kaum einen Ton rausbekam: Was machte seine Generation von Popstars so besonders?","Lionel Richie: ""People, stop looking back or you're missing your future""",Lionel Richie wrote a song with Michael Jackson and experienced Bob Dylan when he barely got a sound out: What made his generation of pop stars so special?,"莱昂内尔·里奇说 ""你们别再回头了 否则你们会错过自己的未来""",莱昂内尔·里奇和迈克尔·杰克逊写过一首歌 和鲍勃·迪伦一起 他音调极低时 鲍伯·迪伦却一言不发
38,Vorwürfe der sexuellen Belästigung: Grüne räumen Fehler im Fall Stefan Gelbhaar ein,"Gegen den Grünenpolitiker Gelbhaar gab es Vorwürfe der Belästigung, die offenbar erfunden waren. Seine Partei räumt Fehler ein und sieht zuständige Stellen überfordert.",Allegations of sexual harassment: Greens make mistakes in Stefan Gelbhaar's case,"Against the Green politician Yellow Hair there were allegations of harassment, which were apparently invented. His party admits mistakes and sees competent bodies overwhelmed.",性骚扰的指控:绿党在Stefan 黄头发案件中犯下错误.,"绿色头发的反对者被控骚扰,显然是虚构的. 他的政党承认了错误,并视其为不称职."
39,Österreich: Motiv des Amokläufers von Graz laut Ermittlern weiter unklar,Der Schütze von Graz hat seine Tat nach Angaben der Ermittler akribisch geplant. Sein Motiv bleibt derweil rätselhaft. Von seinen Opfern kannte er wohl nur eine Lehrerin.,Austria: Motif of the amok runner of Graz continues to be unclear according to investigators,"According to the investigators, the Sagittarius of Graz planned his act meticulously. Meanwhile, his motive remains enigmatic. Of his victims, he probably only knew one teacher.",调查员说奥地利的葛拉兹行凶动机尚不明朗,"格拉兹的枪手根据调查员的描述计划了他的行动,同时他的动机仍然神秘. 他可能只认识一位老师,他被害者可能只认识一位老师."
40,Flug nach London: Flugzeug mit mehr als 240 Menschen an Bord in Indien abgestürzt,In Westindien ist ein Flugzeug kurz nach dem Start verunglückt. Die Maschine war mit mehr als 240 Menschen an Bord auf dem Weg nach London.,Flight to London: plane crashed with more than 240 people on board in India,"In West India, a plane crashed shortly after take-off, with more than 240 people on board on its way to London.",飞往伦敦的航班 飞机在印度坠毁 飞机载有超过240名乘客,一架在西印度的飞机在起飞后不久就坠毁. 飞机载着240多人飞往伦敦.
41,Merz und Schoof appellieren an geeintes Europa,Aktuelle Informationen über die deutsche Außenpolitik und die internationalen Beziehungen Deutschlands.<br />,Merz and Schoof appeal to united Europe,Current information on German foreign policy and international relations in Germany.<br />,默兹和舒芬向统一的欧洲呼吁,关于德国外交政策和德国国际关系的最新信息.
42,Eine Million Balkonkraftwerke in Deutschland,Die Zahl der auf Balkonen installierten Solaranlagen hat sich in Deutschland innerhalb von einem Jahr verdoppelt.&nbsp;&nbsp;,One Million Balcony Power Plants in Germany,The number of solar installations installed on balconies has doubled in Germany within one year.&nbsp;&nbsp;,德国有一百万个阳台发电厂,在阳台安装的太阳能设备在德国一年内翻了一番 & nbsp; & nbsp; & nbsp; & nbsp;
43,UN-Ozeankonferenz in Nizza,In Nizza ringen 130 Staaten um den Schutz der Ozeane – zum Beispiel vor Plastikmüll. Umweltminister Schneider: Deutschland treibt weltweiten Meeresschutz voran.,UN Ocean Conference in Nice,"In Nice, 130 countries are struggling for the protection of the oceans – for example against plastic waste. Environment Minister Schneider: Germany is pushing ahead with global marine protection.",在尼斯的联合国海洋会议,"例如,在尼斯,130个国家正在寻求保护海洋免受塑料废料. 环境部长施耐德: 德国正在推动全球海洋保护."
44,Erinnerung an spektakuläre Reichstagsverhüllung 1995,Vor 30 Jahren verhüllten Christo und Jeanne-Claude das deutsche Parlament und schufen ein weltweit beachtetes Kunstwerk.,Remembrance of spectacular Reichstag cover-up 1995,"30 years ago, Christo and Jeanne-Claude disguised the German parliament and created a work of art that was respected worldwide.",1995年盛大纪念日的纪念品,"30年前,基督和Jeanne-Claude遮掩了德国议会 并创造了一件世界关注的艺术品"
45,Berlin feiert drei Tage Karneval der Kulturen,Hunderttausende Besucher bei internationales Straßenfest mit Bühnenprogrammen und Umzug.,Berlin celebrates three days of Carnival of Cultures,Hundreds of thousands of visitors at international street festival with stage programs and parades.,柏林举行了3天文化狂欢节,成百上千的来访者 参加国际街头大会 举办舞台表演和搬家活动
46,Merz bei Trump: freundschaftliche Begegnung,Kanzler Friedrich Merz wollte bei seinem Besuch im Weißen Haus einen guten Draht zu US-Präsident Donald Trump aufbauen – das scheint ihm geglückt zu sein.&nbsp;&nbsp;,Merz at Trump: a friendly encounter,Chancellor Friedrich Merz wanted to build a good connection with US President Donald Trump during his visit to the White House – he seems to have succeeded.&nbsp;&nbsp;,特朗普的梅兹: 友好的相遇,总理弗里德里希·梅兹在访问白宫时 想与美国总统唐纳德·特朗普建立良好的关系 他似乎很满意
47,Deutschland und Polen wollen Zusammenarbeit vertiefen,Außenminister Wadephul und Sikorski betonen Freundschaft beider Länder.&nbsp;,Germany and Poland want to deepen cooperation,Foreign Minister Wadephul and Sikorski emphasize friendship between both countries.,德国和波兰想加深合作关系,韦德福和西科斯基外交部长都强调两国的友谊
48,Kabinett: Steuersenkungen für Unternehmen,Neue Regierung unterstützt Wirtschaft mit milliardenschweren Entlastungen.,Cabinet: Tax cuts for companies,New government supports the economy with billions of reliefs.,内阁: 公司减税,"新政府支持经济,有数十亿美元的减免费用."
49,Biontech: Kooperation mit US-Firma BMS,Bristol Meyers Squibb (BMS) beteiligt sich mit mehreren Milliarden Dollar an Krebsforschung.,Biontech: Cooperation with US company BMS,Bristol Meyers Squibb (BMS) invests several billion dollars in cancer research.,生物技术: 与美国BMS公司合作,Bristol Meyers Squibb (BMS) 参与了数十亿美元的癌症研究.
50,Konferenz für nachhaltige Entwicklung in Hamburg,1.600 Internationale Fachleute bei der Hamburg Sustainability Conference (HSC),Conference for Sustainable Development in Hamburg,"1,600 International experts at the Hamburg Sustainability Conference (HSC)",汉堡的可持续发展会议,汉堡可持续发展大会的1600名国际专业人员 (HSC)
51,Marktbericht: Der Wind hat gedreht,Die vagen Erfolgsmeldungen aus Washington zu den Gesprächen mit China können die Anleger nicht mehr locken. Der DAX gibt den fünften Tag in Folge nach. Auch die Wall Street ist verhalten gestartet.,Market Report: The wind has turned,The vague success reports from Washington on the talks with China can no longer attract investors. The DAX gives way to the fifth day in a row. Wall Street has also started cautiously.,市场报告: 风向已改变,华盛顿对中国对话的模糊成功消息已经无法吸引投资者了. DAX连續第五天向投资者屈服. 华尔街也开始行动了.
52,Parteivorstand der Grünen räumt Fehler im Fall Gelbhaar ein,Vorwürfe gegen den Grünen-Politiker Gelbhaar hatten diesen unter anderem die Kandidatur für den Bundestag gekostet. Dann folgten Zweifel am Wahrheitsgehalt der Behauptungen gegen ihn. Der Vorstand der Grünen gibt sich nun selbstkritisch.,Green Party leader admits mistakes in the case of yellow hair,"Allegations against the Green politician Yellow Hair had cost him, among other things, the candidacy for the Bundestag. Then followed doubts about the truth content of the claims against him. The board of the Greens is now self-critical.",绿色党领袖会承认黄头发案件的缺点,"对绿色头发的指责,除其他外,他们失去了联邦日的参选权. 随后,人们开始怀疑这些指控的真实性. 绿发董事会现在将自己投给了自己."
53,Flugzeugunglück in Indien: ++ Laut Fluggesellschaft doch Passagiere lebend gefunden ++,Nach Angaben von Air India haben doch Menschen den Flugzeugabsturz überlebt. Der indische Premierminister Modi hat sich ähnlich wie viele andere Politiker bestürzt über das Unglück gezeigt.,Aircraft accident in India: ++ According to the airline passengers found alive ++,"According to Air India, people have survived the plane crash. Indian Prime Minister Modi, like many other politicians, has been shocked by the disaster.",印度的飞机失事:++ 航空公司说 发现有乘客活着的++,"根据印度航空的统计,人们在坠机中幸存了下来. 印度总理莫迪和其他许多政客一样,对这次事故感到震惊."
54,Ukraine-Liveblog: ++ Pistorius verspricht weitere Militärhilfen ++,"Bundesverteidigungsminister Pistorius hat der Ukraine weitere Militärhilfen in Milliardenhöhe in Aussicht gestellt. Die Europäer versprechen bei einem Außenministertreffen in Rom, den Druck auf Russland zu erhöhen.",Ukraine live blog: ++ Pistorius promises further military aid ++,Federal Defence Minister Pistorius has promised Ukraine further military aid in billions. Europeans promise to increase pressure on Russia at a meeting of foreign ministers in Rome.,++Pistorius 提供更多军事援助 +++,德国国防部长皮斯托里乌斯已经向乌克兰提供了数十亿美元的军事援助. 欧洲人在罗马举行外交部长会议时承诺会增加对俄罗斯的压力.
55,Passagierflugzeug in Indien abgestürzt - wohl alle 242 Insassen tot,Beim Absturz einer Passagiermaschine im indischen Ahmedabad sind laut Behörden wohl alle 242 Insassen ums Leben gekommen. Auch am Boden soll es mehrere Tote geben. Das Flugzeug war kurz nach dem Start in ein Wohngebiet gestürzt.,Passenger plane crashed in India - probably all 242 passengers dead,"According to the authorities, all 242 passengers were killed in the crash of a passenger plane in Ahmedabad, India. There are supposed to be several deaths on the ground, too. The plane had fallen into a residential area shortly after its take-off.","印度的客机坠毁,可能所有242名乘客死亡","在印度阿哈迈德巴德的一架客机坠毁事件中,据当局估计,所有242名乘客死亡. 地面上也有数人死亡. 飞机在起飞后不久坠毁在了居民区."
56,Deutscher Pharma-Deal: BioNTech greift nach CureVac,BioNTech will als Investition in die Entwicklung von Krebsmedizin den deutschen Konkurrenten CureVac übernehmen. Beide Unternehmen waren 2020 am Wettlauf um einen Corona-Impfstoff beteiligt.,German Pharma deal: BioNTech takes care of CureVac,BioNTech wants to take over the German competitor CureVac as an investment in the development of cancer medicine. Both companies were involved in the competition for a Corona vaccine in 2020.,德国制药公司: 生化科技公司正在寻找CureVac.,生物科技公司想在德国竞争对手CureVac上进行癌症研究投资. 两家公司都参与了2020年科罗纳疫苗的竞赛.
57,Streit um Atomprogramm: Iran will neue Uran-Anreicherungsanlage bauen,"Der Streit um Irans Atomprogramm spitzt sich weiter zu. Nach Kritik der Internationale Atomenergiebehörde kündigte das Regime in Teheran an, eine neue Anlage zur Anreicherung von Uran zu bauen. Am Wochenende wird aber weiter verhandelt.",Controversy over nuclear program: Iran wants to build new uranium enrichment plant,"The dispute over Iran's nuclear program is intensifying. According to criticism by the International Atomic Energy Agency, the regime in Tehran announced that it would build a new uranium enrichment facility. However, negotiations will continue on the weekend.",伊朗想建造新的铀浓缩设施,"伊朗核计划的争执仍在继续. 国际原子能机构批评后,德黑兰政权宣布要建造新的铀浓缩设施. 但是,这个周末将会继续谈判."
58,Amoklauf an Grazer Schule: Motiv des Täters weiter unklar,"Laut Polizei war der Amokläufer von Graz ein sehr introvertierter Mensch, der zurückgezogen lebte. Der 21-Jährige habe seine Attacke bis ins kleinste Detail geplant. Ermittelt wird noch, ob er während der Tat Kontakt zu jemandem hatte.",Amoklauf an Grazer Schule: Motif of the perpetrator remains unclear,"According to the police, the amok runner from Graz was a very introverted person who lived in seclusion. The 21-year-old had planned his attack to the smallest detail. It is still being determined whether he had contact with someone during the act.",犯罪者的动机仍不明朗,"警方称格拉兹的恶行者是隐姓埋名的内向人. 21岁的男子计划了袭击的细节. 还在调查中,他是否与某人有接触."
59,Dublin-Zentrum in Brandenburg: Wer nimmt die Fingerabdrücke?,Vor der Bundestagswahl wurde in Eisenhüttenstadt ein sogenanntes Dublin-Zentrum eröffnet. Doch mit den Zurückweisungen an der Grenze des neuen Innenministers Dobrindt ist es im Prinzip hinfällig. Von Mirja Fiedler.,Dublin-Zentrum in Brandenburg: Who takes the fingerprints?,"Before the Bundestag election, a so-called Dublin Centre was opened in Eisenhüttenstadt. However, with the rejections at the border of the new Interior Minister Dobrindt, it is basically obsolete.",Brandenburg的都柏林中心 谁取指纹?,"联邦选举前夕,在铁库城开设了一个所谓的都柏林中心. 但是,在新的内政部长杜布利特的边界上,它基本上是无效的. 由米里亚·菲德勒 (Milia Fieder) 发起的."
