,title-en,content-en,title-de,content-de,title-es,content-es,title-fr,content-fr,title-zh,content-zh
42,China has become the most important enabler of Russia’s war machine,It has crossed the line into providing lethal aid,China hat sich zum wichtigsten Enabler Russlands Kriegsmaschine entwickelt,"Sie hat die Grenze überschritten, um tödliche Hilfe zu leisten.",China se ha convertido en el facilitador más importante de la maquinaria de guerra de Rusia,Ha cruzado la línea para proporcionar ayuda letal.,La Chine est devenue le moteur le plus important de la Russie machine de guerre,Il a franchi la ligne pour fournir une aide létale,中国已成为俄罗斯战争机器最重要的推进器,"它已经越过边界,提供致命援助"
43,Chinese consumers are splurging—but probably not for long,There is a reason retail sales have boomed,Die chinesischen Verbraucher spritzen – aber wahrscheinlich nicht lange.,"Es gibt einen Grund, warum der Einzelhandel boomte","Los consumidores chinos están goteando, pero probablemente no por mucho tiempo",Hay una razón por la que las ventas al por menor han aumentado,"Les consommateurs chinois s'éparpillent, mais probablement pas pour longtemps.",Il y a une raison pour laquelle les ventes au détail ont connu un essor,"中国消费者在挤压,但可能不会持续很长时间",零售业兴旺发展是有原因的
44,Would you want to know if you were terminally ill?,"In China, catastrophic diagnoses are often kept from patients","Würdest du wissen wollen, ob du unheilbar krank bist?",In China werden katastrophale Diagnosen oft von Patienten ferngehalten.,¿Le gustaría saber si estaba enfermo terminal?,"En China, los diagnósticos catastróficos a menudo se mantienen alejados de los pacientes",Voudriez-vous savoir si vous étiez en phase terminale ?,"En Chine, les diagnostics catastrophiques sont souvent évités aux patients",你想知道你是否病得很重吗?,"在中国,灾难性诊断往往不向病人提供"
45,Bride prices are surging in China,Why is the government struggling to curb them?,Brautpreise steigen in China,"Warum kämpft die Regierung, um sie einzudämmen?",Los precios de la novia están aumentando en China,¿Por qué el gobierno está luchando para detenerlos?,Les prix de la mariée sont en hausse en Chine,Pourquoi le gouvernement lutte-t-il pour les endiguer?,中国的新娘价格正在上涨,为何政府苦苦阻止他们?
46,China’s booze business looks smashed,First terrified officials went off the lash; now young people are going dry,Chinas Alkoholgeschäft sieht zerschmettert aus,Erste erschrockene Beamte gingen von der Wimper ab; jetzt werden die jungen Leute trocken,El negocio del alcohol de China se ve destrozado,Primero los funcionarios aterrorizados se salieron del látigo; ahora los jóvenes se están secando,Chine L'alcool business semble fracassé,"Les premiers fonctionnaires terrifiés sont sortis du clash; maintenant, les jeunes s'assèchent.",中国的酒业看起来一团糟,最初吓吓人心的官员们脱了干线;现在年轻人正在干枯。
47,Now China’s ultra-cheap EVs are scaring China,They highlight many of the economy’s current problems,Chinas ultra-billige EVs erschrecken China,Sie heben viele der aktuellen Probleme der Wirtschaft hervor,Ahora los vehículos eléctricos ultra baratos de China están asustando a China,Destacan muchos de los problemas actuales de la economía,"Aujourd'hui, les VE ultra-paches de la Chine font peur à la Chine",Ils mettent en évidence de nombreux problèmes économiques actuels,现在中国超便宜的EV正在吓吓中国,它们突显了经济当前的许多问题。
48,"Oklahoma City has been reborn, 30 years after the bombing",Basketball is only the beginning,Oklahoma City wurde 30 Jahre nach dem Bombenanschlag wiedergeboren,Basketball ist erst der Anfang,"Oklahoma City ha renacido, 30 años después del bombardeo",El baloncesto es sólo el principio,"Oklahoma City a renaître, 30 ans après l'attentat",Basketball n'est que le début,俄克拉荷马城在轰炸30年后 重生了,篮球只是开始
49,Has Donald Trump solved Iran from the air?,Peace in his time,Hat Donald Trump den Iran aus der Luft gelöst?,Frieden in seiner Zeit,¿Ha resuelto Donald Trump Irán desde el aire?,Paz en su tiempo,Donald Trump a-t-il résolu l'Iran ?,La paix en son temps,唐纳德·特朗普从空中解决了伊朗吗?,在他时代的和平
50,"The fallout from Trump’s Iran strikes is political, too",Will the biggest foreign-policy gamble of his presidency pay off?,Der Fallout aus Trumps Iran Streiks ist auch politisch,Wird sich das größte außenpolitische Spiel seiner Präsidentschaft auszahlen?,Las consecuencias de las huelgas de Trump en Irán también son políticas,¿La mayor apuesta de política exterior de su presidencia dará sus frutos?,"Les retombées des grèves d'Iran Trump, c'est aussi politique.",Le plus grand pari de politique étrangère de sa présidence va-t-il payer ?,"特朗普的伊朗打击的余波也是政治性的,",总统任期内最大的外交政策赌博是否会有回报?
51,Why America’s hospitals don’t want their taxes cut,Congress is taking aim at a gimmick vital to rural health providers,Warum Amerikas Krankenhäuser nicht ihre Steuern senken wollen,Der Kongress zielt auf eine für die ländlichen Gesundheitsdienstleister lebenswichtige Gimmick ab,Por qué los hospitales de Estados Unidos no quieren reducir sus impuestos,El Congreso tiene como objetivo un truco vital para los proveedores de salud rurales,Pourquoi les hôpitaux américains ne veulent-ils pas réduire leurs impôts,Le Congrès s'efforce de donner un coup d'oeil vital aux dispensateurs de soins de santé en milieu rural.,为什么美国医院不想减税?,国会正致力于一个对农村保健提供者至关重要的难题。
52,"Even for $10bn, the Los Angeles Lakers may look like a bargain",A seeming vanity investment is in fact a market-beating asset class,Selbst für $10 Mrd. könnten die Los Angeles Lakers wie ein Schnäppchen aussehen.,Eine scheinbare Eitelkeitsinvestition ist in der Tat eine marktbeherrschende Anlageklasse,"Incluso por $10 mil millones, los Lakers de Los Ángeles pueden parecer una ganga.","Una aparente inversión vanidad es, de hecho, una clase de activos que supera al mercado","Même pour 10 milliards de dollars, les Lakers de Los Angeles peuvent ressembler à une affaire",Un investissement de vanité apparent est en fait une classe d'actifs qui bat le marché,洛杉矶湖人可能看起来像一个交易,似乎空虚的投资实际上是一种打市场的资产类别。
53,The meaning of Zohran Mamdani’s win in New York,America’s biggest city takes a strange turn,Die Bedeutung des Sieges von Zohran Mamdani in New York,Amerikas größte Stadt nimmt eine seltsame Wendung,El significado de la victoria de Zohran Mamdani en Nueva York,La ciudad más grande de Estados Unidos toma un giro extraño,"La signification de Zohran Mamdani , gagne à New York",Americas la plus grande ville prend un tour étrange,Zohran Mamdani在纽约获胜的意义,美国最大的城市 是一个奇怪的转折
54,Robert F. Kennedy looks set to mess with vaccines,An influential panel has been stacked with vaccine sceptics and ideologues,Robert F. Kennedy sieht mit Impfstoffen fertig aus,Ein einflussreiches Panel wurde mit Impfstoff-Skeptikern und Ideologen gestapelt,Robert F. Kennedy parece dispuesto a meterse con las vacunas,Un panel influyente ha sido apilado con escépticos de vacunas e ideólogos,Robert F. Kennedy semble prêt à gâcher les vaccins,Un panel influent a été empilé de scepticismes et d'idéologues vaccinaux,罗伯特F. 肯尼迪似乎 弄乱了疫苗,一个有影响力的小组 已经堆积了疫苗的怀疑者和理论家
55,New poll reveals full extent of Trump's gains with minority voters in 2024,"New Pew Research poll revealed Trump&apos;s diverse voter coalition with increased support from Hispanic, Black and Asian voters, plus strong backing from non-college educated voters.",Neue Umfrage zeigt volles Ausmaß von Trumps Gewinnen mit Minderheitswählern im Jahr 2024,"Neue Pew Research Umfrage ergab Trump&apos; eine vielfältige Wählerkoalition mit verstärkter Unterstützung von Hispanic, Black und Asian Wählern, sowie starke Unterstützung von nicht-college gebildeten Wählern.",Nueva encuesta revela el alcance completo de los logros de Trump con los votantes minoritarios en 2024,"Nueva encuesta de Pew Research reveló Trump&apos; una coalición de votantes diversa con un mayor apoyo de votantes hispanos, negros y asiáticos, además de un fuerte respaldo de votantes no universitarios.",Un nouveau sondage révèle toute l'étendue des gains de Trump avec les électeurs minoritaires en 2024,"Le nouveau sondage Pew Research a révélé la diversité de la coalition électorale de Trump&apos, avec un soutien accru des électeurs hispaniques, noirs et asiatiques, ainsi qu'un soutien fort des électeurs non diplômés.","新民调显示Trump在2024年少数族群选民中,","在西班牙裔、黑人和亚裔选民的更多支持下, 加上未受过大学教育的选民的大力支持,"
56,Cooper Flagg names Caitlin Clark to his WNBA Mount Rushmore: 'Changed the game',"Caitlin Clark might only be in her second season, but Dallas Mavericks draft pick Cooper Flagg already has her on his WNBA Mount Rushmore.",Cooper Flagg nennt Caitlin Clark zu seinem WNBA Mount Rushmore: 'Verändert das Spiel',"Caitlin Clark ist vielleicht nur in ihrer zweiten Saison, aber Dallas Mavericks Draftpick Cooper Flagg hat sie bereits auf seinem WNBA Mount Rushmore.",Cooper Flagg nombra a Caitlin Clark a su WNBA Mount Rushmore: 'Cambió el juego',"Caitlin Clark podría estar solo en su segunda temporada, pero el draft de Dallas Mavericks Cooper Flagg ya la tiene en su WNBA Mount Rushmore.",Cooper Flagg nomme Caitlin Clark à son WNBA Mount Rushmore: 'Modifier le jeu',"Caitlin Clark n'en est peut-être qu'à sa deuxième saison, mais le repêchage de Dallas Mavericks Cooper Flagg l'a déjà sur son mont Rushmore de la WNBA.",Cooper Flagg names Caitlin Clark 致他的WNBA Rushmore山:“改变游戏”,Caitlin Clark可能只是第二季 但Dallas Mavericks选取Cooper Flagg的草稿 已经在WNBA Rushmore的WNBA山上找到了她
57,David Beckham hospitalized for surgery related to soccer injury,"Former soccer star David Beckham underwent surgery related to a wrist injury sustained during a 2003 England match, as wife Victoria shares recovery photos.",David Beckham hospitalisiert für Chirurgie im Zusammenhang mit Fußball-Verletzung,"Der ehemalige Fußballstar David Beckham unterzog sich einer Operation im Zusammenhang mit einer Handgelenkverletzung, die während eines England-Matches 2003 erlitten wurde, da Frau Victoria Fotos zur Genesung teilt.",David Beckham hospitalizado por cirugía relacionada con lesiones de fútbol,"La exestrella de fútbol David Beckham se sometió a una cirugía relacionada con una lesión en la muñeca sufrida durante un partido en Inglaterra en 2003, cuando su esposa Victoria comparte fotos de recuperación.",David Beckham hospitalisé pour chirurgie liée à une blessure au soccer,"L'ancienne star de football David Beckham a subi une chirurgie liée à une blessure au poignet subie lors d'un match en Angleterre en 2003, alors que sa femme Victoria partage des photos de récupération.",David Beckham因与足球受伤有关的手术住院,"前足球明星David Beckham接受了与2003年英格兰比赛期间手腕受伤有关的手术,"
58,New PayPal scam uses real emails to trick you,"A new sophisticated PayPal scam sends legitimate-looking emails from official PayPal addresses, using phone numbers instead of links to convince victims to download remote access tools.","Neuer PayPal-Betrug verwendet echte E-Mails, um Sie auszutricksen","Ein neuer ausgefeilter PayPal-Betrug sendet legitim aussehende E-Mails von offiziellen PayPal-Adressen, mit Telefonnummern anstelle von Links, um Opfer zu überzeugen, Remote-Access-Tools herunterzuladen.",Nueva estafa de PayPal utiliza correos electrónicos reales para engañarte,"Una nueva estafa sofisticada de PayPal envía correos electrónicos de aspecto legítimo desde direcciones PayPal oficiales, utilizando números de teléfono en lugar de enlaces para convencer a las víctimas de descargar herramientas de acceso remoto.",Nouvelle escroquerie PayPal utilise de vrais e-mails pour vous tromper,"Une nouvelle escroquerie PayPal sophistiquée envoie des e-mails légitimes à partir d'adresses PayPal officielles, en utilisant des numéros de téléphone au lieu de liens pour convaincre les victimes de télécharger des outils d'accès à distance.",新的PayPal骗骗徒利用真实的电子邮件来欺骗你,"使用电话号码而非链接, 说服受害者下载远程访问工具。 校对:Soup"
59,Pompeo says Iran strike shows US is 'back to leading the world',Mike Pompeo tells Fox News that strikes on Iranian nuclear sites increased U.S. deterrence while criticizing isolationists who abandon American leadership,"Pompeo sagt Iran Streik zeigt, dass die USA ""zurück in die Welt führen""","Mike Pompeo erzählt Fox News, dass Streiks auf iranischen Atomstandorten die Abschreckung der USA erhöhen und Isolationisten kritisieren, die die amerikanische Führung aufgeben",Pompeo dice que la huelga de Irán muestra que EE.UU. está 'de vuelta a liderar el mundo',Mike Pompeo le dice a Fox News que los ataques a sitios nucleares iraníes aumentaron la disuasión estadounidense mientras criticaban a los aislacionistas que abandonan el liderazgo estadounidense,Pompeo dit que la grève de l'Iran montre que les États-Unis sont « retour à la tête du monde »,Mike Pompeo raconte à Fox News que les frappes sur des sites nucléaires iraniens ont accru la dissuasion américaine tout en critiquant les isolationnistes qui abandonnent le leadership américain,"Pompeo说,伊朗的罢工表明,美国正在“领导世界”。","Mike Pompeo告诉Fox News, 对伊朗核基地的打击增加了美国的威慑力,"
60,"Beach bags that carry sunscreen, snacks and other summer essentials","From waterproof totes to mesh carryalls, the right beach bag can make summer fun more convenient.","Strandtaschen, die Sonnencreme, Snacks und andere wichtige Sommer tragen","Von wasserdichten Totes bis zu Mesh Carryalls, die richtige Strandtasche kann Sommerspaß bequemer machen.","Bolsas de playa que llevan protector solar, aperitivos y otros productos esenciales de verano","Desde totes impermeables hasta portaaldas de malla, la bolsa de playa adecuada puede hacer que el verano sea más cómodo.","Sacs de plage à l'écran solaire, en-cas et autres articles essentiels d'été","De l'imperméabilisation aux voiles, le bon sac de plage peut rendre le plaisir d'été plus pratique.",带防晒霜、零食和其他夏季必需品的沙滩袋,从防水托盘到网状货架 右边的沙滩袋可以让夏天更方便
61,Chicago braces for deadly July 4 weekend as Fox News analyst takes action in brother's unsolved murder,"Fox News analyst transforms grief into action after his brother&apos;s murder with new book, offering a reward and establishing the Caldwell Institute for Public Safety amid Chicago&apos;s crime crisis.",Chicago Klammern für tödliche Juli 4 Wochenende als Fox News Analyst ergreift Maßnahmen in Bruders ungelösten Mord,"Fox News-Analyst verwandelt Trauer in Aktion nach seinem Bruder&apos;s Mord mit neuem Buch, bietet eine Belohnung und Gründung des Caldwell Institute for Public Safety inmitten Chicago&apos;s Kriminalitätskrise.",Chicago se prepara para el mortal fin de semana del 4 de julio mientras el analista de Fox News toma acción en el asesinato sin resolver de su hermano,"El analista de Fox News transforma el dolor en acción después de su hermano & apos;s asesinato con nuevo libro, ofreciendo una recompensa y estableciendo el Instituto Caldwell para la Seguridad Pública en medio de Chicago & apos;s crisis del crimen.",Chicago appareillages pour mort Juillet 4 week-end que Fox News analyste prend des mesures dans le meurtre de frère non résolu,"Fox News analyste transforme le chagrin en action après le meurtre de son frère avec un nouveau livre, offrant une récompense et la création de l'Institut Caldwell pour la sécurité publique au milieu de Chicago&apos; crise de la criminalité.",芝加哥7月4日 周末4日 福克斯新闻分析员采取行动 调查兄弟未破的谋杀案,"Fox News分析员将悲痛转化为行动, 因为他的兄弟和apos; 用新书谋杀; 提供奖赏, 并在芝加哥和apos犯罪危机中建立Caldwell公共安全研究所。"
62,"Republican senators say leaked Iran damage report was inaccurate, politically motivated","Republican senators said that after receiving a classified intelligence report on Trump’s strikes Iran strikes, they believe initial reporting underestimated the damage.","Republikanische Senatoren sagen, durchgesickert Iran Schaden Bericht war ungenau, politisch motiviert","Republikanische Senatoren sagten, dass, nachdem sie einen geheimen Geheimdienstbericht über Trumps Streiks im Iran erhalten hatten, sie glauben, dass die erste Berichterstattung den Schaden unterschätzte.","Senadores republicanos dicen que filtraron el informe de daño de Irán fue inexacto, motivado políticamente","Los senadores republicanos dijeron que después de recibir un informe de inteligencia clasificado sobre las huelgas de Trump en Irán, creen que los informes iniciales subestimaron el daño.",Les sénateurs républicains disent que le rapport sur les dommages causés par l'Iran est inexact et politiquement motivé.,"Les sénateurs républicains ont déclaré qu'après avoir reçu un rapport secret sur Trump, ils croyaient que le rapport initial sous-estimait les dégâts.","共和党参议员说泄露的伊朗损坏报告 不准确,出于政治动机","共和党参议员表示, 在收到关于特朗普攻击伊朗的机密情报报告后,"
63,Presidents have F---’s to give when it’s about Israel’s Bibi Netanyahu,Netanyahu&apos;s leadership style and Israel&apos;s security situation have led multiple US presidents to drop the F-bomb while trying to maintain cooperation with their ally,"Präsidenten haben F------ , um zu geben, wenn es um Israel-Bibi Netanyahu","Netanjahu&apos;s Führungsstil und Israel&apos;s Sicherheitssituation haben mehrere US-Präsidenten veranlasst, die F-Bombe fallen zu lassen, während sie versuchen, die Zusammenarbeit mit ihrem Verbündeten zu halten",Los presidentes tienen F--- es dar cuando se trata de Israel Bibi Netanyahu,Netanyahu&apos; el estilo de liderazgo e Israel&apos; la situación de seguridad ha llevado a varios presidentes estadounidenses a abandonar la bomba F mientras intentaban mantener la cooperación con su aliado,Les Présidents ont des F------s à donner quand il s'agit d'Israël,Le style de leadership de Netanyahu&apos et la situation en matière de sécurité en Israël ont conduit plusieurs présidents américains à abandonner la bombe F tout en essayant de maintenir la coopération avec leur allié,"以色列的比比内塔尼亚胡,","内塔尼亚胡和阿波斯; 领导风格和以色列和阿波斯; 安全局势导致美国多位总统投下F炸弹,"
64,Sen. Kirsten Gillibrand urges Zohran Mamdani to denounce 'globalize the intifada' rhetoric,Sen. Kirsten Gillibrand pressed NYC mayoral candidate Zohran Mamdani to denounce &quot;global the intifada&quot; rhetoric during a WNYC radio interview on Thursday.,"Sen. Kirsten Gillibrand fordert Zohran Mamdani auf, die Rhetorik der ""Globalisierung der Intifada"" anzuprangern","Sen. Kirsten Gillibrand drängte den Bürgermeisterkandidaten der NYC Zohran Mamdani, &quot;global die intifada&quot; Rhetorik während eines WNYC-Radiointerviews am Donnerstag anzuprangern.","El Senador Kirsten Gillibrand insta a Zohran Mamdani a denunciar la retórica de ""globalizar la intifada""",El senador Kirsten Gillibrand presionó al candidato de la alcaldía de Nueva York Zohran Mamdani para que denunciara la retórica de la intifada y la cita durante una entrevista de radio de la WNYC el jueves.,Le Sen. Kirsten Gillibrand exhorte Zohran Mamdani à dénoncer 'mondialiser la rhétorique de l'Intifada',Le Sen. Kirsten Gillibrand a pressé le candidat maire de NYC Zohran Mamdani de dénoncer &quot;global l'intifada&quot; rhétorique lors d'une interview radio WNYC jeudi.,Kirsten Gillibrand敦促Zohran Mamdani谴责“起义全球化”的言论。,"Kirsten Gillibrand在星期四的纽约州纽约市电台采访中, 向纽约市市长候选人Zohran Mamdani施压,"
65,Lauren Sánchez becomes Mrs. Bezos in elegant Venice wedding with conservative dress departing from usual style,"Lauren Sánchez Bezos shares first look at her Dolce &amp; Gabbana wedding gown inspired by Sophia Loren, calling Jeff Bezos her &quot;best friend&quot; who has &quot;revealed&quot; rather than changed her.",Lauren Sánchez wird Frau Bezos in elegante Venedig Hochzeit mit konservativem Kleid weg von üblichen Stil,"Lauren Sánchez Bezos teilt ihren ersten Blick auf ihr Dolce &amp; Gabbana Hochzeitskleid inspiriert von Sophia Loren, rief Jeff Bezos ihre &quot;beste Freundin&quot; wer hat &quot;vealed&quot; anstatt sie geändert.",Lauren Sánchez se convierte en la Sra. Bezos en la elegante boda de Venecia con vestido conservador que sale del estilo habitual,"Lauren Sánchez Bezos comparte primero mirar su vestido de novia Dolce &amp; Gabbana inspirado por Sophia Loren, llamando a Jeff Bezos su &quot;mejor amigo&quot; que ha &quot;revelado&quot; en lugar de cambiarla.",Lauren Sánchez devient Mme Bezos dans le mariage élégant de Venise avec une robe conservatrice qui part du style habituel,"Lauren Sánchez Bezos partage son premier regard sur sa robe de mariée Dolce &amp; Gabbana inspirée de Sophia Loren, appelant Jeff Bezos sa meilleure amie &quot; qui a &quot;reveled&quot; plutôt que de la changer.",Lauren Sánchez成为Bezos夫人 在优雅的威尼斯婚礼上 穿着保守的礼服,"Lauren Sánchez Bezos首先分享她的Dolce & amp; 由Sophia Loren启发的Gabbana结婚礼服, 称杰夫· Bezos为她的 & quot; 最好的朋友 & quot; 谁拥有 & quot; revealed & quot; 而不是改变她 。"
66,Trump touts success of Iran strikes and attack's initial damage assessments during 23rd week in office,"Trump continued to brag about the success of U.S. strikes against Iran, and also attended the NATO Summit this week.",Trump schlägt Erfolg von Iran Streiks und Angriff erste Schadensbeurteilung während der 23. Woche im Amt,Trump prahlte weiter über den Erfolg der US-Streiks gegen den Iran und nahm auch am NATO-Gipfel in dieser Woche teil.,Trump anuncia el éxito de los ataques de Irán y las evaluaciones iniciales de daños del ataque durante la 23a semana en el cargo,"Trump continuó alardeando sobre el éxito de los ataques estadounidenses contra Irán, y también asistió a la Cumbre de la OTAN esta semana.",Trump tout succès de l'Iran frappe et l'évaluation initiale des dommages de l'attaque pendant la 23ème semaine en fonction,"Trump a continué à se vanter du succès des frappes américaines contre l'Iran, et a également assisté au Sommet de l'OTAN cette semaine.","伊朗在执政的第23周成功打击和攻击的初步损害评估,","特朗普继续炫耀美国对伊朗发动袭击的成功,"
67,"Iran holds funeral for top commanders, nuclear scientists killed in Israeli operation",Crowds gathered in Tehran wearing all black and waving Iranian flags as the country held a funeral for top military commanders and nuclear scientists killed during the 12-day war with Israel.,"Iran hält Begräbnis für Top-Kommandanten, Atomwissenschaftler getötet in israelischer Operation","Die Massen versammelten sich in Teheran, trugen alle schwarzen und winkenden iranischen Flaggen, als das Land eine Beerdigung für Spitzen-Militärkommandanten und Atomwissenschaftler veranstaltete, die während des 12-tägigen Krieges mit Israel getötet wurden.","Irán celebra funerales para altos comandantes, científicos nucleares muertos en la operación israelí",Las multitudes se reunieron en Teherán vistiendo todas las banderas negras y ondeando banderas iraníes mientras el país celebraba un funeral para altos mandos militares y científicos nucleares asesinados durante la guerra de 12 días con Israel.,"L'Iran organise des funérailles pour des commandants supérieurs, des scientifiques nucléaires tués dans l'opération israélienne","Des foules se sont rassemblées à Téhéran, portant tous les drapeaux iraniens noirs et agités, alors que le pays organisait des funérailles pour des commandants militaires de haut rang et des scientifiques nucléaires tués pendant la guerre de 12 jours contre Israël.",伊朗为最高指挥官举行葬礼 核科学家在以色列行动中丧生,"伊朗为在与以色列的12天战争中丧生的顶级军事指挥官和核科学家举行葬礼,"
68,Fox News AI Newsletter: ChatGPT rewiring your brain,Fox News&apos; AI Newsletter brings you the latest on this rapidly evolving technology.,Fox News KI Newsletter: ChatGPT verdrahtet Ihr Gehirn,Fox News&apos; KI Newsletter bringt Ihnen das Neueste über diese sich schnell entwickelnde Technologie.,Fox News AI Newsletter: ChatGPT reconecta tu cerebro,Fox News&apos; AI Newsletter te trae lo último en esta tecnología en rápida evolución.,Fox News AI Newsletter: ChatGPT redémarrer votre cerveau,Fox News&apos; AI Newsletter vous apporte les dernières informations sur cette technologie en évolution rapide.,Fox News News AI News News News: ChatGPT 重新连接你的大脑,Fox News&apos; AI 通讯为大家带来了关于这一迅速演变的技术的最新消息。
