,title-en,content-en,title-de,content-de,title-es,content-es,title-fr,content-fr,title-zh,content-zh
65,"Bill Maher corrects guest who says he left Democratic Party, says he was never there to begin with","Comedian Bill Maher said he &quot;never was a Democrat&quot; during his podcast, criticizing the party for getting &quot;crazier&quot; and discussing &quot;woke supremacists.&quot;","Bill Maher korrigiert Gast, der sagt, er verließ die Demokratische Partei, sagt, er war nie da, um mit zu beginnen","Der Komiker Bill Maher sagte, er sei niemals ein Demokrat gewesen; während seines Podcasts kritisierte er die Partei, weil sie &quot;crazier&quot; bekommen hatte, und diskutierte &quot;woke supremacists.&quot;","Bill Maher corrige al invitado que dice que dejó el Partido Demócrata, dice que nunca estuvo allí para empezar","El comediante Bill Maher dijo que él &quot;nunca fue un demócrata&quot; durante su podcast, criticando al partido por conseguir &quot;crazier&quot; y discutiendo &quot;despertó a supremacistas.&quot;","Bill Maher corrige l'invité qui dit qu'il a quitté le Parti démocratique, dit qu'il n'a jamais été là pour commencer par",Le comédien Bill Maher a dit qu'il n'était jamais un démocrate et qu'il n'était jamais un démocrate et qu'il critiquait le parti pour avoir obtenu &quot;crazier&quot; et pour avoir discuté de &quot;woke supremacists.&quot;,"比尔・马赫纠正了客人 谁说他离开民主党, 说他从来没有在那里开始","喜剧演员Bill Maher说,在他播客播客期间,他从未是民主党和quot; 批评该党获得 & quot; crazier & quot; 并讨论 & quot; woke supremacists. & quot;"
66,"'Mofo...in the White House': Jasmine Crockett attacks Trump, praises Massie in anti-Iran strike rant",Rep. Jasmine Crockett launched into a lengthy diatribe against President Donald Trump&apos;s strikes on Iran over the weekend.,"'Mofo...im Weißen Haus': Jasmine Crockett greift Trump an, lobt Massie im Anti-Iran-Streik-Rand",Rep. Jasmine Crockett startete in eine lange Diatribe gegen Präsident Donald Trump&apos;s Streiks auf den Iran am Wochenende.,"'Mofo...en la Casa Blanca': Jasmine Crockett ataca a Trump, elogia a Massie en huelga antiiraní",El representante Jasmine Crockett lanzó una larga diatriba contra el presidente Donald Trump&apos;s huelgas en Irán durante el fin de semana.,"""Mofo... à la Maison Blanche"": Jasmine Crockett attaque Trump, loue Massie dans la campagne anti-Iran",La rép. Jasmine Crockett a lancé une longue diatribe contre le président Donald Trump&apos; frappe sur l'Iran au cours du week-end.,茉莉·克罗克特攻击特朗普 赞美反对伊朗的马西,"Rep Jasmine Crockett对总统Donald Trump&apos提出长篇反言,"
67,"‘For Sale’: DOGE moves to sell off almost half a billion in federal real estate, relocate cabinet agency HQs",Sale of six prominent Washington D.C. properties would help reduce $36 trillion national debt without layoffs.,"„Für Verkauf: DOGE zieht um, fast eine halbe Milliarde an Bundesimmobilien zu verkaufen, verlagern Kabinett Agentur HQs","Der Verkauf von sechs prominenten Washington D.C. Immobilien würde dazu beitragen, 36 Billionen US-Dollar Staatsschulden ohne Entlassungen zu reduzieren.","‘En Venta’: DOGE se mueve para vender casi 500 millones en bienes raíces federales, reubicar oficinas centrales de la agencia del gabinete",La venta de seis propiedades prominentes de Washington D.C. ayudaría a reducir la deuda nacional de 36 billones de dólares sin despidos.,"«À vendre» : DOGE s'installe pour vendre près d'un demi-milliard d'immeubles fédéraux, relocaliser les QG de l'agence du Cabinet",La vente de six propriétés importantes de Washington contribuerait à réduire la dette nationale de 36 billions de dollars sans licenciement.,""" 出售 "" :DOGE搬来卖掉近5亿的联邦房地产,搬迁内阁机构总部",出售华盛顿市六家著名房产将有助于减少36万亿美元不被解雇的国民债务。
68,"American travelers should know escape routes at transit hubs after Iran strikes, security expert warns","A security expert urges vigilance at transportation hubs following Iranian airstrikes, as New York, Los Angeles, Washington, D.C., and Miami implement increased security protocols.","Amerikanische Reisende sollten Fluchtwege an Transit-Hubs nach Iran Streiks kennen, warnt Sicherheitsexperte","Ein Sicherheitsexperte fordert Wachsamkeit bei Verkehrsknotenpunkten nach iranischen Luftangriffen, wie New York, Los Angeles, Washington, D.C. und Miami erhöhte Sicherheitsprotokolle implementieren.","Los viajeros estadounidenses deben conocer las rutas de escape en los centros de tránsito después de los ataques de Irán, advierte un experto en seguridad","Un experto en seguridad insta a la vigilancia en los centros de transporte después de los ataques aéreos iraníes, mientras Nueva York, Los Ángeles, Washington, D.C. y Miami implementan protocolos de seguridad aumentados.","Les voyageurs américains devraient connaître les routes d'évasion aux centres de transit après les frappes iraniennes, avertit l'expert en sécurité","Un expert de la sécurité appelle à la vigilance dans les centres de transport à la suite des frappes aériennes iraniennes, car New York, Los Angeles, Washington et Miami appliquent des protocoles de sécurité accrus.","安全专家警告说,","一位安全专家敦促伊朗空袭后对运输枢纽保持警惕,因为纽约、洛杉矶、华盛顿特区和迈阿密执行增加的安全议定书。"
69,Oklahoma City police report shooting incident outside arena after Thunder's win over Pacers to win NBA Finals,Oklahoma City Police reported one person was injured in a shooting near Scissortail Park after the Thunder&apos;s NBA championship win over the Pacers on Sunday night.,Oklahoma City Polizei Bericht Schießen Vorfall außerhalb Arena nach Thunders Sieg über Pacers zu gewinnen NBA Finals,"Oklahoma City Police berichtete, dass eine Person bei einer Schießerei in der Nähe von Scissortail Park nach dem Thunder&apos verletzt wurde; NBA-Meisterschaftssieg über die Pacers am Sonntagabend.",Policía de Oklahoma informa incidente de tiroteo fuera de la arena después de la victoria de Thunder sobre Pacers para ganar las finales de la NBA,La policía de Oklahoma informó que una persona resultó herida en un tiroteo cerca de Scissortail Park después de que Thunder&apos ganara el campeonato de la NBA sobre los Pacers el domingo por la noche.,La police de la ville d'Oklahoma rapporte un incident de fusillade à l'extérieur de l'arène après la victoire de Thunder sur Pacers pour gagner NBA Finals,La police de la ville d'Oklahoma a signalé qu'une personne avait été blessée lors d'une fusillade près de Scissortail Park après la victoire du championnat NBA sur les Pacers dimanche soir.,俄克拉荷马州警方报告 在雷雷赢得和平队 赢得NBA决赛后 在竞技场外的枪击事件,"俄克拉荷马市警方报告说,在Scissortail公园附近发生枪击事件后,有一人受伤;星期天晚上,NBA锦标赛赢得了Pacers。"
70,"Refresh your patio for the Fourth of July with new grills, dining sets and outdoor seating","If your patio needs an upgrade, there are sales on outdoor seating, dining sets and grills.","Erfrischen Sie Ihre Terrasse für den vierten Juli mit neuen Grills, Esssets und Sitzgelegenheiten im Freien","Wenn Ihre Terrasse ein Upgrade benötigt, gibt es Verkäufe auf Sitzgelegenheiten im Freien, Esssets und Grills.","Refresca tu patio para el 4 de julio con nuevas parrillas, juegos de comedor y asientos al aire libre","Si su patio necesita una mejora, hay ventas en asientos al aire libre, juegos de comedor y parrillas.","Rafraîchir votre patio pour le 4 juillet avec de nouveaux barbecues, des ensembles de repas et des sièges extérieurs","Si votre patio a besoin d'une mise à niveau, il y a des ventes sur les sièges extérieurs, les ensembles de restauration et les grilles.",用新的烤架、餐具和户外座位刷新你的七月四日的露台,如果你的院子需要升级 户外座位、餐具和烤架都有销售量
71,Russia claims US strikes on Iran have opened a ‘Pandora's box' and could lead to global ‘nuclear catastrophe’,"Russian U.N. Ambassador Vassily Nebenzia said, &quot;the whole world could find itself on the verge of a nuclear catastrophe&quot; following the U.S. airstrikes on Iran.","Russland behauptet, US-Streiks gegen den Iran hätten eine „Pandora-Box"" geöffnet und könnte zu einer globalen „nuklearen Katastrophe"" führen.","Der russische UN-Botschafter Wassily Nebenzia sagte, &quot;die ganze Welt könnte sich am Rande einer nuklearen Katastrophe &quot befinden; nach den US-Luftangriffen auf den Iran.","Rusia afirma que las huelgas estadounidenses contra Irán han abierto una ""caja de Pandora"" y podrían conducir a una ""catástrofe nuclear"" global","El embajador ruso de la ONU Vassily Nebenzia dijo, &quot;que el mundo entero podría encontrarse al borde de una catástrofe nuclear&quot; siguiendo los ataques aéreos de Estados Unidos en Irán.",La Russie affirme que les frappes américaines contre l'Iran ont ouvert une «boîte de Pandore» et pourraient conduire à une «catastrophe nucléaire» mondiale,"L'ambassadeur russe de l'ONU, Vassily Nebenzia, a déclaré que le monde entier pourrait se trouver sur le point d'une catastrophe nucléaire, après les frappes aériennes américaines contre l'Iran.","俄国声称美国对伊朗的打击开启了`潘多拉的盒子', 可能导致全球“核灾难 ” 。","俄罗斯的U. Nebenzia大使说, & quot; 全世界可能都处在核灾难的边缘; 在美国对伊朗的空袭之后。"
72,NASCAR drivers taken back by wild fan reception at New York's Fanatics Fest,"Kyle Larson, Denny Hamlin and William Byron were genuinely surprised by the fanfare they got at Fanatics Fest in New York this past weekend.",NASCAR-Fahrer vom wilden Fan-Empfang auf dem New Yorker Fanatics Fest zurückgenommen,"Kyle Larson, Denny Hamlin und William Byron waren wirklich überrascht von der Fanfare, die sie am vergangenen Wochenende beim Fanatics Fest in New York bekamen.",Conductores de NASCAR recuperados por la recepción de aficionados salvajes en el Fanatics Fest de Nueva York,"Kyle Larson, Denny Hamlin y William Byron estaban genuinamente sorprendidos por la fanfarria que recibieron en el Fanatics Fest en Nueva York el fin de semana pasado.",Les pilotes NASCAR repris par la réception des fans sauvages au Fanatics Fest de New York,"Kyle Larson, Denny Hamlin et William Byron ont été vraiment surpris par la fanfare qu'ils ont eue au Fanatics Fest à New York ce week-end dernier.",纽约狂热节的野风扇招待会 夺回了NASCAR的司机,"Kyle Larson、Denny Hamlin和William Byron对上个周末他们在纽约的 "" 狂热狂热节日 "" 上所表现出的幻想感到惊讶。"
73,Karen Read's lawyers identify exact moment prosecution 'lost the case' in murder trial,"Karen Read&apos;s defense attorneys reveal the trial turning point was when prosecutor Hank Brennan made a critical error about evidence, leading to her acquittal.","Karen Reads Anwälte identifizieren den genauen Moment der Anklage ""verloren den Fall"" im Mordverfahren","Karen Read&apos;s Verteidiger offenbaren den Prozess Wendepunkt war, als Staatsanwalt Hank Brennan einen kritischen Fehler über Beweise machte, was zu ihrem Freispruch führte.",Los abogados de Karen Read identifican el momento exacto en que la fiscalía perdió el caso en el juicio por asesinato.,"Karen Read&apos;s abogados defensores revelan que el punto de inflexión del juicio fue cuando el fiscal Hank Brennan cometió un error crítico sobre las pruebas, llevando a su absolución.","Les avocats de Karen Read identifient le moment exact où l'accusation ""perdu l'affaire"" dans le procès pour meurtre","Karen Read&apos;s avocats de la défense révèlent le point tournant du procès était quand le procureur Hank Brennan a fait une erreur critique au sujet de la preuve, conduisant à son acquittement.",Karen Read的律师在谋杀案审判中 指认起诉“失去案件”的确切时间,"Karen Read&apos; 辩护律师透露审判的转折点是汉克·布伦南检察官在证据方面犯了重大错误,导致她无罪释放。"
74,"Clinton backs Cuomo in NYC mayoral race, boosting scandal-scarred frontrunner","Former President Bill Clinton endorses Andrew Cuomo in NYC&apos;s Democratic mayoral primary, highlighting his experience amid a tightening race against progressive Zohran Mamdani.",Clinton unterstützt Cuomo im Bürgermeister-Rennen von NYC und steigert skandalgefährdeten Spitzenreiter,"Der ehemalige Präsident Bill Clinton unterstützt Andrew Cuomo in NYC&apos, einem demokratischen Bürgermeister, der seine Erfahrung in einem verschärften Wettlauf gegen den progressiven Zohran Mamdani hervorhebt.","Clinton respalda a Cuomo en la carrera de alcaldes de Nueva York, impulsando el escandaloso delantero","El ex presidente Bill Clinton apoya a Andrew Cuomo en NYC&apos;s Alcalde demócrata primario, destacando su experiencia en medio de una carrera de endurecimiento contra Zohran Mamdani progresista.","Clinton soutient Cuomo dans la course à la mairie de NYC, stimulant le leader du scandale","L'ancien président Bill Clinton soutient Andrew Cuomo à NYC&apos;s Démocratic Mayoral primaire, soulignant son expérience au milieu d'une course serrée contre Zohran Mamdani progressiste.","Clintons Cunos Cuomo支持纽约市市长竞选,",前总统克林顿(Cilling Clinton)支持安德鲁·库莫(Andrew Cuomo)在纽约市和阿波斯(NYC&apos);
75,The unintended consequences of Hamas’s war on Israel for the US and global security,"Hamas&apos; Yahya Sinwar&apos;s plan to spark a war against Israel backfired, leading to severe setbacks for Hamas, Hezbollah and Iran as their strategy to eradicate the Jewish state has all but failed.",Die unbeabsichtigten Folgen des Hamas-Krieges gegen Israel für die USA und die globale Sicherheit,"Hamas&apos; Yahya Sinwar&apos;s Plan, einen Krieg gegen Israel nach hinten zu entfachen, was zu schweren Rückschlägen für die Hamas, die Hisbollah und den Iran als ihre Strategie zur Ausrottung des jüdischen Staates geführt hat, ist alles andere als gescheitert.",Las consecuencias no deseadas de la guerra de Hamás contra Israel para Estados Unidos y la seguridad mundial,"Hamás&apos; Yahya Sinwar&apos;s plan para desencadenar una guerra contra Israel contraproducente, llevando a graves reveses para Hamás, Hezbolá e Irán como su estrategia para erradicar el estado judío ha fracasado.",Les conséquences imprévues de la guerre du Hamas sur Israël pour les États-Unis et la sécurité mondiale,"Hamas&apos; Yahya Sinwar&apos; plan pour déclencher une guerre contre Israël a fait demi-tour, conduisant à de graves revers pour le Hamas, le Hezbollah et l'Iran comme leur stratégie pour éradiquer l'État juif a tous échoué, mais.",哈马斯对以色列的战争对美国和全球安全造成的意外后果,"哈马斯; 叶海亚·辛瓦尔和阿波斯; 计划引发一场针对以色列的战争,但遭到反弹,导致哈马斯、真主党和伊朗遭受严重挫折,因为其消灭犹太国家的战略完全失败了。"
76,Pakistan flip flops on Trump Nobel Peace Prize nomination after less than 24 hours,"Pakistan said President Trump was Nobel Peace Prize worthy for India mediation, a law violator the next day over the U.S. strikes on Iranian nuclear sites.",Pakistan Flip Flops auf Trump Nobel Friedenspreis Nominierung nach weniger als 24 Stunden,"Pakistan sagte Präsident Trump war Friedensnobelpreis würdig für Indien Vermittlung, ein Gesetzesverletzer am nächsten Tag über die US-Streik auf iranischen Atomstandorten.",Las chanclas de Pakistán sobre la nominación al Premio Nobel de la Paz de Trump después de menos de 24 horas,"Pakistán dijo que el presidente Trump fue Premio Nobel de la Paz digno de la mediación de la India, un violador de la ley al día siguiente sobre los ataques de Estados Unidos en sitios nucleares iraníes.",Pakistan flip flops sur la nomination Trump Prix Nobel de la Paix après moins de 24 heures,"Le Pakistan a déclaré que le président Trump était le prix Nobel de la paix digne de la médiation indienne, un violateur de loi le lendemain sur les frappes américaines sur des sites nucléaires iraniens.","巴基斯坦在不到24小时后,","巴基斯坦总统特朗普(Trump)获得诺贝尔和平奖,"
77,Senate GOP aims to approve major legislation next week as Trump touts party unity,"Senate Republicans aim to pass the &quot;Big, Beautiful Bill&quot; next week, as President Donald Trump urges unity despite SALT deduction concerns.","Senats-GOP will nächste Woche wichtige Gesetze verabschieden, da Trump die Einheit der Partei ablehnt.","Senatsrepublikaner wollen die &quot;Big, Beautiful Bill&quot; nächste Woche, wie Präsident Donald Trump fordert Einheit trotz SALT Abzug Bedenken.",Senado GOP pretende aprobar legislación importante la próxima semana como Trump promociona la unidad del partido,"Los republicanos del Senado pretenden aprobar la Gran y Hermosa Bill&quot; la próxima semana, mientras el presidente Donald Trump insta a la unidad a pesar de las preocupaciones de deducción de SALT.",Le GOP du Sénat entend approuver une loi majeure la semaine prochaine en tant qu'unité du parti Trump touts,"Les Républicains du Sénat visent à passer le &quot;Big, Beautiful Bill&quot; la semaine prochaine, comme le président Donald Trump exhorte à l'unité malgré les préoccupations de déduction SALT.","参议员GOP(GOP)打算下周批准主要立法,","参议院共和党人希望下周通过 & qut; Big, Beautiful Bill & quot; 因为总统唐纳德·特朗普(Donald Trump)敦促团结,"
78,Iran’s Fordow nuclear site struck second time as IDF targets access routes,Israel Defense Forces targeted access routes to Iran&apos;s Fordow facility on Monday after U.S. B-2 bombers pummeled the site over the weekend with bunker-buster bombs.,"Irans Atomstandort Fordow wurde zum zweiten Mal angegriffen, da IDF Zugangswege anvisiert hat.","Israel Defense Forces zielte auf Zugangswege nach Iran&Apos; Fordow-Anlage am Montag, nachdem US-B-2-Bomber den Standort über das Wochenende mit Bunker-Buster-Bomben pummeled.",El sitio nuclear de Fordow en Irán atacó por segunda vez mientras las FDI atacaban las rutas de acceso,Las Fuerzas de Defensa de Israel atacaron las rutas de acceso a Iran&apos;s Instalaciones de Fordow el lunes después de que los bombarderos B-2 de EE.UU. golpearon el sitio durante el fin de semana con bombas de bunker-buster.,Iran Le site nucléaire de Fordow a frappé la deuxième fois alors que les FDI ciblent des voies d'accès,Les Forces de défense israéliennes ont ciblé les voies d'accès à l'Iran et à l'installation de Fordow lundi après que des bombardiers américains de type B-2 aient bombardé le site au cours du week-end avec des bombes de bunker-buster.,"伊朗Fordow核站点第二次袭击,","以色列国防军对通往伊朗和阿波斯的通道进行攻击;美国B-2轰炸机在周末用掩体炸弹轰炸Fordow设施之后,星期一的Fordow设施。"
79,Giants pitcher Sean Hjelle speaks out after wife's explosive abuse allegations,"San Francisco Giants pitcher Sean Hjelle addressed his wife Caroline&apos;s viral accusations of abandonment and abuse, as MLB takes jurisdiction over the allegations while the team withholds comment.",Giants Krug Sean Hjelle spricht nach Frau explosive Missbrauch Anschuldigungen,"San Francisco Giants Pitcher Sean Hjelle wandte sich an seine Frau Caroline&apos; virale Anschuldigungen des Verlassens und Missbrauchs, als MLB die Zuständigkeit für die Vorwürfe übernimmt, während das Team Kommentare zurückhält.",El lanzador de los Gigantes Sean Hjelle habla después de las acusaciones de abuso explosivo de su esposa,"El lanzador de los Gigantes de San Francisco Sean Hjelle se dirigió a su esposa Caroline&apos;s acusaciones virales de abandono y abuso, ya que MLB toma jurisdicción sobre las acusaciones mientras el equipo retiene comentarios.",Le pichet géant Sean Hjelle s'exprime après les allégations d'abus explosifs de sa femme,"Le lanceur de San Francisco Giants, Sean Hjelle, s'est adressé à son épouse Caroline&apos; les accusations virales d'abandon et d'abus, puisque le MLB a compétence sur les allégations pendant que l'équipe retient les commentaires.",巨人投手Sean Hjelle在妻子的爆炸性虐待指控后 大声疾呼,"San Francisco Giants投手Sean Hjelle向他的妻子Caroline&apos讲了话;对遗弃和虐待的病毒指控,因为MLB对指控拥有管辖权,而小组则不予评论。"
80,"White House office tells agencies to apply 'Gold Standard Science' to depoliticize research, restore trust","EXCLUSIVE: The White House Office of Science and Technology on Monday directed federal agencies to implement “Gold Standard Science&quot; to de-politicize science and restore public trust, Fox News Digital has learned.","Das Büro des Weißen Hauses fordert Agenturen auf, ""Gold Standard Science"" anzuwenden, um Forschung zu entpolitisieren, Vertrauen wiederherzustellen","EXCLUSIVE: Das Büro des Weißen Hauses für Wissenschaft und Technologie hat am Montag die Bundesbehörden angewiesen, den Goldstandard Science&quot umzusetzen; um die Wissenschaft zu entpolitisieren und das Vertrauen der Öffentlichkeit wiederherzustellen, hat Fox News Digital gelernt.","La oficina de la Casa Blanca le dice a las agencias que apliquen la 'Ciencia Estándar de Oro' para despolitizar la investigación, restaurar la confianza","EXCLUSIVA: El lunes, la Oficina de Ciencia y Tecnología de la Casa Blanca ordenó a las agencias federales implementar “Ciencia de Oro Estándar y Quot; para despolitizar la ciencia y restaurar la confianza pública, Fox News Digital ha aprendido.","Le bureau de la Maison-Blanche dit aux agences d'appliquer la « science standard d'or » pour dépolitiser la recherche, restaurer la confiance","EXCLUSIF : Le Bureau des sciences et de la technologie de la Maison-Blanche, lundi, a demandé aux organismes fédéraux de mettre en oeuvre la norme Gold Science&quot; pour dépolitiser la science et rétablir la confiance du public, Fox News Digital a appris.","白宫办公室告诉机构应用“金标准科学”来将研究非政治化,恢复信任","特例:白宫科学技术办公室周一指示联邦机构执行“黄金标准科学和辩论;使科学非政治化并恢复公众信任”,Fox News Digital学会了。"
81,"Sophie Cunningham shows off tight bond with Caitlin Clark, Lexie Hull through cheeky pre-game outfit",Indiana Fever&apos;s Sophie Cunningham showcases bond with teammates through a cheeky pre-game shirt amid a surge in her popularity and social media following.,"Sophie Cunningham zeigt enge Bindung mit Caitlin Clark, Lexie Hull durch freche Pre-Game-Outfit",Indiana Fever&apos;s Sophie Cunningham zeigt die Verbindung mit Teamkollegen durch ein freches Vorspielhemd inmitten einer Zunahme ihrer Popularität und ihrer sozialen Medien.,"Sophie Cunningham muestra un estrecho vínculo con Caitlin Clark, Lexie Hull a través de descarado traje antes del juego",Indiana Fever&apos;s Sophie Cunningham muestra el vínculo con sus compañeros de equipo a través de una descarada camiseta pre-juego en medio de un aumento en su popularidad y los siguientes medios sociales.,"Sophie Cunningham montre un lien étroit avec Caitlin Clark, Lexie Hull à travers une tenue pré-jeu coquine",Indiana Fever&apos;s Sophie Cunningham met en valeur les liens avec ses coéquipiers à travers une chemise pré-jeu coquine au milieu d'une vague de popularité et de médias sociaux qui suit.,苏菲·坎宁安 和凯特琳·克拉克 莱克西·霍尔的亲密关系,"Indiana Fever&apos;s Sophie Cunningham展示与队友的关系,"
