,title-en,content-en,title-de,content-de,title-es,content-es,title-fr,content-fr,title-zh,content-zh
0,Losing Religion,What happens to America’s fight for equality if the traditional Black church disappears?,Religionsverlust,"Was geschieht mit Amerikas Kampf für Gleichheit, wenn die traditionelle schwarze Kirche verschwindet?",Perder la religión,¿Qué pasa con la lucha de Estados Unidos por la igualdad si desaparece la iglesia tradicional negra?,Perdre la religion,Qu'arrive-t-il aux Américains qui luttent pour l'égalité si l'église noire traditionnelle disparaît ?,丧失宗教信仰,"如果传统的黑人教会消失,美国争取平等的斗争会怎么样?"
1,A blow to judicial power and a win for Trump,The Supreme Court curtails judges’ ability to block the president’s agenda,Ein Schlag auf die richterliche Macht und ein Sieg für Trump,"Der Oberste Gerichtshof beschränkt Richter die Fähigkeit, die Agenda des Präsidenten zu blockieren",Un golpe al poder judicial y una victoria para Trump,La Corte Suprema limita la capacidad de los jueces para bloquear la agenda del presidente,Un coup au pouvoir judiciaire et une victoire pour Trump,La Cour suprême limite la capacité des juges à bloquer l'ordre du jour du président,对司法权力的打击和特朗普的胜利,最高法院限制法官阻止总统议程的能力
2,America’s role in the Middle East,"Our weekly podcast on democracy in America. This week, the United States helped to broker a ceasefire between Israel and Iran. But how firm is it? And how stable are the leaders in Tel Aviv and Tehran?",Amerikas Rolle im Nahen Osten,"Unsere wöchentliche Podcast über Demokratie in Amerika. Diese Woche haben die Vereinigten Staaten geholfen, einen Waffenstillstand zwischen Israel und Iran zu vermitteln. Aber wie fest ist es? Und wie stabil sind die Führer in Tel Aviv und Teheran?",El papel de Estados Unidos en Oriente Medio,"Esta semana, Estados Unidos ayudó a negociar un alto el fuego entre Israel e Irán. Pero, ¿qué tan firme es? ¿Y cuán estables son los líderes en Tel Aviv y Teherán?",Rôle de l'Amérique au Moyen-Orient,"Notre podcast hebdomadaire sur la démocratie en Amérique. Cette semaine, les États-Unis ont aidé à négocier un cessez-le-feu entre Israël et l'Iran. Mais comment est-ce ferme? Et à quel point les dirigeants de Tel-Aviv et de Téhéran sont-ils stables?",美国在中东的作用,"我们每周一次的关于美国民主的播客。本周,美国帮助促成以色列和伊朗之间的停火。但是,停火有多坚定?特拉维夫和德黑兰的领导人有多稳定?"
3,"Zohran Mamdani, Trump’s “worst nightmare”, may really be a gift to him",The young socialist could exemplify the sort of leader the Democrats need. He also offers Republicans an easy target,"Zohran Mamdani, Trumps schwerster Albtraum, könnte wirklich ein Geschenk für ihn sein","Der junge Sozialist könnte die Art von Führer, den die Demokraten brauchen, exemplifizieren. Er bietet auch Republikanern ein leichtes Ziel","Zohran Mamdani, la “peor pesadilla” de Trump, puede ser realmente un regalo para él",El joven socialista podría ilustrar el tipo de líder que los demócratas necesitan. También ofrece a los republicanos un blanco fácil,"Zohran Mamdani, Trump, le pire cauchemar, peut vraiment être un cadeau pour lui",Le jeune socialiste pourrait illustrer le genre de leader dont les démocrates ont besoin. Il offre aussi aux républicains une cible facile,"特朗普(Trump)的“最恶梦”Zohran Mamdani,",年轻的社会主义者可以证明民主党需要什么样的领袖。 他还向共和党提供容易的目标。
4,Is being bilingual good for your brain?,"Perhaps. Learning languages offers other, more concrete benefits",Ist Zweisprachigkeit gut für dein Gehirn?,"Vielleicht. Sprachen lernen bietet andere, konkretere Vorteile",¿Ser bilingüe es bueno para tu cerebro?,Tal vez. Aprender idiomas ofrece otros beneficios más concretos,Être bilingue est-il bon pour votre cerveau ?,Peut-être. L'apprentissage des langues offre d'autres avantages plus concrets.,双语对大脑有好处吗?,"也许,学习语言可以提供其他更具体的好处"
5,Six books about tennis’s greatest players,Enjoy these titles with strawberries and a glass of Pimms,Sechs Bücher über die größten Tennisspieler,Genießen Sie diese Titel mit Erdbeeren und einem Glas Pimms,Seis libros sobre los mejores jugadores de tenis,Disfruta de estos títulos con fresas y un vaso de Pimms,Six livres sur les plus grands joueurs de tennis,Profitez de ces titres avec des fraises et un verre de Pimms,有关网球最伟大的球员的六本书,用草莓和一杯平姆酒来享受这些称号
6,Can Daniel Noboa save Ecuador without trampling its democracy?,Also on the daily podcast: the imperturbability of global markets and our “Archive 1945” project looks back on the UN’s founding,"Kann Daniel Noboa Ecuador retten, ohne seine Demokratie zu zertreten?","Auch auf dem Tagespodcast: Die Unerschütterlichkeit der globalen Märkte und unser Projekt ""Archiv 1945"" blickt zurück auf die UN-Gründung",¿Puede Daniel Noboa salvar a Ecuador sin pisotear su democracia?,También en el podcast diario: la imperturbabilidad de los mercados globales y nuestro proyecto “Archivo 1945” recuerda la fundación de la ONU,Daniel Noboa peut-il sauver l'Équateur sans piétiner sa démocratie ?,Aussi sur le podcast quotidien : l'imperturbabilité des marchés mondiaux et notre projet d'Archive 1945,丹尼尔·诺沃亚能否不践踏厄瓜多尔的民主而拯救厄瓜多尔?,"也是在每日播客上:全球市场和我们的 "" 1945年稳定 "" 项目的不可无容性回顾联合国的成立。"
7,The six best “lost” albums,Great records that have been mislaid and rediscovered,Die sechs besten Alben,"Große Aufzeichnungen, die falsch abgelegt und wiederentdeckt wurden",Los seis mejores álbumes “perdidos”,Grandes discos que han sido extraviados y redescubiertos,Les six meilleurs albums,De grands disques qui ont été mis en erreur et redécouverts,六张最佳“丢失”专辑,"曾被错置和重新发现的伟大记录,"
8,What to watch this weekend,Stories of restaurants and robots,Was an diesem Wochenende zu sehen,Geschichten von Restaurants und Robotern,Qué ver este fin de semana,Historias de restaurantes y robots,Que regarder ce week-end,Histoires de restaurants et de robots,这周末看什么看这个周末,餐馆和机器人的故事
9,Jabs get a right hook,"Our daily political update, featuring the stories that matter",Jabs bekommen einen richtigen Haken,"Unser tägliches politisches Update mit den Geschichten, die wichtig sind",Los jabs tienen un gancho derecho.,"Nuestra actualización política diaria, con las historias que importan",Les jabs ont un crochet droit,"Notre mise à jour politique quotidienne, mettant en vedette les histoires qui comptent",Jabs 右勾拳,"我们每天的政治最新情况,特别报道重要的故事"
10,"On its tenth birthday, gay marriage in America is under attack",Republican support for same-sex marriage is dropping fast,An seinem zehnten Geburtstag wird Homosexuell Ehe in Amerika angegriffen,Republikanische Unterstützung für gleichgeschlechtliche Ehe fällt schnell,"En su décimo cumpleaños, el matrimonio gay en Estados Unidos está bajo ataque",El apoyo republicano al matrimonio entre personas del mismo sexo está cayendo rápidamente,"À son dixième anniversaire, le mariage gay en Amérique est attaqué",Le soutien républicain au mariage de même sexe est en baisse rapide,"在美国同志婚姻在十岁生日时,",共和党对同性婚姻的支持正在迅速下降
11,Iran has come back online—for now,The regime has a long history of cutting access to the internet,Iran ist wieder online gekommen – für jetzt,Das Regime hat eine lange Geschichte des Schneidens des Zugangs zum Internet,"Irán ha vuelto a estar en línea, por ahora",El régimen tiene una larga historia de cortar el acceso a Internet,L'Iran est revenu en ligne — pour l'instant,Le régime a une longue histoire de couper l'accès à Internet,"伊朗已经回到网络上,",该政权有切断互联网接入的悠久历史
12,Will AI eat the advertising industry?,"Our podcast on markets, the economy and business. This week, is the job of the advertising creative about to be fully automated?",Wird KI die Werbebranche essen?,"Unser Podcast über Märkte, Wirtschaft und Wirtschaft. Ist diese Woche die Aufgabe der Werbeschaffenden dabei, voll automatisiert zu werden?",¿Se comerá IA la industria de la publicidad?,"Nuestro podcast sobre mercados, economía y negocios. Esta semana, ¿está el trabajo de los creativos publicitarios a punto de ser completamente automatizados?",L'IA mangera-t-elle l'industrie de la publicité?,"Notre podcast sur les marchés, l'économie et les entreprises. Cette semaine, le travail de la publicité créative est-il sur le point d'être entièrement automatisé?",AI会吃广告业吗?,"在市场、经济和商业上播客。本周,广告创意的工作即将完全自动化吗?"
13,"This is Europe’s Manhattan Project moment, argues a tech boss","NATO’s front line needs more money, says Gundbert Scherf, but just as important is smarter technology","Dies ist Europas Manhattan Projekt Moment, argumentiert ein Tech-Chef","NATO-Front braucht mehr Geld, sagt Gundbert Scherf, aber genauso wichtig ist intelligentere Technologie","Este es el momento del Proyecto Manhattan de Europa, argumenta un jefe de tecnología","La primera línea de la OTAN necesita más dinero, dice Gundbert Scherf, pero igual de importante es la tecnología más inteligente","C'est le moment du projet de Manhattan d'Europe, soutient un boss de la technologie","La première ligne de l'OTAN a besoin de plus d'argent, dit Gundbert Scherf, mais tout aussi important est la technologie plus intelligente","这是欧洲曼哈顿项目时刻,","Gundbert Scherf指出,北约前线需要更多的钱,但同样重要的是更聪明的技术。"
14,"Violeta Chamorro was a mother first, a ruler second","The first female president of Nicaragua died on June 14th, aged 95","Violeta Chamorro war eine Mutter zuerst, eine Herrscherin zweite","Die erste Präsidentin Nicaraguas starb am 14. Juni, im Alter von 95 Jahren","Violeta Chamorro fue madre primero, gobernante segundo","La primera presidenta de Nicaragua murió el 14 de junio, a los 95 años.","Violeta Chamorro était une mère d'abord, une gouvernante seconde","La première femme présidente du Nicaragua est décédée le 14 juin, âgée de 95 ans.","维奥莱塔·查莫罗是母亲第一,统治者第二","尼加拉瓜第一位女总统于6月14日去世,"
15,"Economic data, commodities and markets",,"Wirtschaftsdaten, Rohstoffe und Märkte",,"Datos económicos, productos básicos y mercados",,"Données économiques, produits de base et marchés",,经济数据、商品和市场,
16,“F1 The Movie” is a very expensive promotional film,Will it rev up new fans for the motorsport?,Der Film ist ein sehr teurer Werbefilm,Wird es neue Fans für den Motorsport auffrischen?,“F1 The Movie” es una película promocional muy cara,¿Va a mejorar los nuevos fans para el automovilismo?,Le film est un film promotionnel très cher,Est-ce qu'il va redynamiser de nouveaux fans pour le sport automobile ?,“F1电影”是一部非常昂贵的促销影片。,电动运动会吸引新球迷吗?
17,"William F. Buckley, the man who put the charm into conservatism",He was the 20th century’s most influential journalist,"William F. Buckley, der Mann, der den Charme in den Konservatismus setzte",Er war der einflussreichste Journalist des 20. Jahrhunderts.,"William F. Buckley, el hombre que puso el encanto en el conservadurismo",Fue el periodista más influyente del siglo XX.,"William F. Buckley, l'homme qui a mis le charme dans le conservatisme",Il était le journaliste le plus influent du XXe siècle.,William F. Buckley 将魅力投入保守主义的人,他是20世纪最有影响力的记者
18,Distrust in public-health institutions is not just an American problem,Across the rich world politics is driving scepticism,Misstrauen gegenüber öffentlichen Gesundheitseinrichtungen ist nicht nur ein amerikanisches Problem,In der reichen Weltpolitik treibt dies Skepsis an,La desconfianza en las instituciones de salud pública no es sólo un problema estadounidense,En todo el rico mundo la política está impulsando el escepticismo,La méfiance à l'égard des institutions de santé publique n'est pas seulement un problème américain.,"Dans le monde riche, la politique est source de scepticisme.",对公共卫生机构的不信任不仅仅是一个美国问题,全世界富饶的政治 正在引发怀疑
19,"Wendell Weeks, the small-town boss at the big-tech table",Corning’s boss is a corporate stalwart with a passion for glass,"Wendell Weeks, der kleine Stadtboss am Big-Tech-Tisch",Corning-Chef ist ein Corporate-stalwart mit einer Leidenschaft für Glas,"Wendell Weeks, el jefe de la pequeña ciudad en la mesa de grandes tecnologías",El jefe de Corning es un incondicional corporativo con una pasión por el vidrio,"Wendell Weeks, le patron de la petite ville à la table des grandes technologies",Le patron de Corning est un stalwart d'entreprise avec une passion pour le verre,"Wendell Wheeks, 在大科技台的小镇老板",康宁的上司是一对玻璃热情的 企业铁石场
20,Behind the world’s fragrances sits a shadowy oligopoly,Trustbusters have been poking their noses into it,Hinter den Düften der Welt sitzt ein schattiges Oligopol,Treuhandbuster haben ihre Nasen hineingestochen.,Detrás de las fragancias del mundo se encuentra un oligopolio oscuro,Los asesinos de confianza han estado metiendo sus narices en ello.,Derrière le monde les parfums se trouvent un oligopole ombreux,Les trustbusters ont mis leur nez dedans.,"在世界香味的背后, 有一种阴暗的寡头寡头,",受信任的打手一直在打探 他们的鼻子在里面
21,Who needs Accenture in the age of AI?,The self-styled reinvention powerhouse faces its toughest job yet—remaking itself,Wer braucht Accenture im Zeitalter der KI?,Das selbstentwickelte Wiedererfindungs-Kraftwerk steht noch vor seiner härtesten Aufgabe – sich selbst zu reproduzieren,¿Quién necesita Accenture en la era de la IA?,La autoproclamada potencia de la reinvención se enfrenta a su trabajo más duro hasta ahora —rehaciéndose a sí misma,Qui a besoin d'Accenture à l'ère de l'IA?,L'auto-réinventeur est confronté à son travail le plus difficile encore — se reformulant lui-même,谁在AI年龄需要Accenture?,自我自封的改造动力厂 面对着最艰难的工作
22,How to tell the West’s car industry really is in trouble,"Suppliers, once far more profitable than auto firms, are struggling",Wie man der West-Auto-Industrie wirklich zu sagen ist in Schwierigkeiten,"Lieferanten, einmal weit profitabler als Autofirmen, kämpfen",Cómo decir que la industria automovilística de Occidente realmente está en problemas,"Los proveedores, una vez mucho más rentables que las empresas de automóviles, están luchando",Comment dire à l'industrie automobile de l'Ouest est vraiment en difficulté,"Les fournisseurs, une fois de plus rentables que les entreprises automobiles, luttent",如何告诉西方汽车工业真的有麻烦,供应商比汽车公司更有利可图
23,Chinese cops are cuffing erotica,Local police have found a perverse way to raise money,Chinesische Cops sind Handschellen Erotik,"Die örtliche Polizei hat einen perversen Weg gefunden, um Geld zu sammeln.",Policías chinos están esposando erótica,La policía local ha encontrado una forma perversa de recaudar dinero,Les flics chinois menottes érotiques,La police locale a trouvé un moyen pervers de recueillir de l'argent,中国警察在拷打色情片,当地警察找了个反常的筹钱办法
24,China’s new army of engineers,Its ranks will swell as the country’s high-tech industries grow,Chinas neue Armee der Ingenieure,"Seine Ränge werden schwellen, während das Land die High-Tech-Industrien wachsen",El nuevo ejército de ingenieros de China,Sus filas se incrementarán a medida que las industrias de alta tecnología del país crezcan,Chine nouvelle armée d'ingénieurs,Ses rangs vont gonfler au fur et à mesure que les industries de haute technologie du pays grandissent,中国新的工兵新军,"随着该国高科技产业的增长,其军衔将不断膨胀"
25,Sex work in the gig economy,Sweden is banning OnlyFans content as the lines around sex work blur,Sex Arbeit in der Gig Wirtschaft,"Schweden verbietet OnlyFans Inhalt, da die Linien um Sex Arbeit verschwommen",El trabajo sexual en la economía de los conciertos,Suecia está prohibiendo el contenido de OnlyFans mientras las líneas alrededor del trabajo sexual se difuminan,Le travail du sexe dans l'économie des concerts,La Suède interdit le contenu d'OnlyFans car les lignes autour du travail sexuel sont floues,有效工作经济中的性工作,"瑞典正在禁止《单方服务计划》的内容,因为围绕性工作的路线模糊不清。"
26,Japan’s civil war over surnames,Inventive schemes help women dodge inflexible marriage laws,Japans Bürgerkrieg über Nachnamen,"Erfinderische Maßnahmen helfen Frauen, unflexible Ehegesetze auszuweichen",La guerra civil de Japón por los apellidos,Los planes inventivos ayudan a las mujeres a eludir las leyes inflexibles sobre el matrimonio,Japon La guerre civile sur les noms de famille,Des programmes inventifs aident les femmes à éviter des lois de mariage rigides,日本为姓氏而爆发的内战,创新计划帮助妇女避开僵硬的婚姻法
27,Asia’s disgraced saint,"As she turns 80, Myanmar’s jailed leader still has much support",Asiens entehrter Heiliger,"Als sie 80 wird, hat Myanmars inhaftierter Anführer immer noch viel Unterstützung",El santo deshonrado de Asia,"A medida que cumple 80 años, el líder encarcelado de Myanmar todavía tiene mucho apoyo",L'Asie a déshonoré saint,"Alors qu'elle a 80 ans, le leader du Myanmar en prison a encore beaucoup de soutien.",亚洲可耻的圣徒,"在她80岁时,"
28,Dutch football has a secret team,Suriname’s squad is becoming less dire,Niederländischer Fußball hat ein geheimes Team,Surinames Kader wird immer schlimmer,El fútbol holandés tiene un equipo secreto,La escuadra de Surinam se está volviendo menos grave,Le football néerlandais a une équipe secrète,L'équipe du Suriname est de moins en moins désespérée,荷兰足球有一支秘密球队,苏里南的队伍越来越不那么可怕了
29,Colombia’s dire president gets desperate,Gustavo Petro wants to save his legacy,Kolumbiens schrecklicher Präsident wird verzweifelt,Gustavo Petro will sein Erbe retten,El presidente desesperado de Colombia se desespera,Gustavo Petro quiere salvar su legado,Colombie Le terrible président devient désespéré,Gustavo Petro veut sauver son héritage,哥伦比亚的可怕总统陷入绝望,古斯塔沃·佩特罗想拯救他的遗产
30,Why commodities are on a rollercoaster ride,Pity Tommy Norris. And his real-world equivalents,Warum Waren auf einer Achterbahnfahrt sind,Schade Tommy Norris. Und seine realen Äquivalente,¿Por qué las mercancías están en un paseo en montaña rusa,"Lástima Tommy Norris, y sus equivalentes en el mundo real.",Pourquoi les marchandises sont sur un rollercoaster ride,Dommage Tommy Norris et ses équivalents du monde réel,为什么商品要坐滚滚车?,可怜的汤米·诺里斯 和他真实世界的等同人物
31,Jane Street’s sneaky retention tactic,"It involves the use of an obscure, French programming language",Jane Streets hinterhältige Retentionstaktik,"Es geht um die Verwendung einer obskuren, französischen Programmiersprache",La táctica de retención a escondidas de Jane Street,Implica el uso de un oscuro lenguaje de programación francés,"Jane Street, une tactique de rétention sournoise",Il s'agit de l'utilisation d'une langue de programmation française obscure,Jane Street的隐秘留守策略,它涉及使用一种模糊的法语编程语言
32,How to escape taxes on your stocks,Not that American investors need a guide—a booming industry is doing the job for them,Wie Steuern auf Ihre Aktien zu entkommen,"Nicht, dass amerikanische Investoren einen Leitfaden brauchen – eine boomende Industrie macht den Job für sie",Cómo escapar de los impuestos sobre sus acciones,No es que los inversionistas estadounidenses necesiten una guía — una industria en auge está haciendo el trabajo para ellos,Comment échapper aux impôts sur vos actions,Non pas que les investisseurs américains aient besoin d'un guide — une industrie en plein essor fait le travail pour eux,如何逃避对你的股票征税,"并非美国投资者需要指南,"
33,The dream scenario for prediction markets,"Polymarket and Kalshi are soaring in popularity. With a few tweaks, they could really take off",Das Traumszenario für Vorhersagemärkte,"Polymarket und Kalshi sind in der Popularität stark. Mit ein paar Tweaks, sie könnten wirklich abheben",El escenario de ensueño para los mercados de predicción,"Polymarket y Kalshi están aumentando en popularidad. Con unos pocos ajustes, que realmente podrían despegar",Le scénario de rêve pour les marchés de prédiction,"Polymarket et Kalshi sont en plein essor. Avec quelques ajustements, ils pourraient vraiment décoller",预测市场预测市场梦幻情景,垄断市场和Kalshi越来越受欢迎。
34,Politicians slashed migration. Now they face the consequences,Across the West the number of new arrivals is plummeting,Politiker haben die Migration durchbrochen. Jetzt stehen sie vor den Konsequenzen,Im Westen sinkt die Zahl der Neuankömmlinge,Los políticos cortaron la migración. Ahora se enfrentan a las consecuencias,A través del Oeste el número de recién llegados se está desplomando,"Les politiciens ont réduit la migration. Maintenant, ils font face aux conséquences","De l'autre côté de l'Ouest, le nombre de nouveaux arrivants est en baisse","政客们在移民移民问题上大刀阔斧。 现在,他们面对着后果。","在整个西方,新来港定居的人数 正在急剧下降"
35,Who are the world’s best investors?,The answer is not hedge funds or quant shops or short-sellers,Wer sind die besten Investoren der Welt?,Die Antwort ist nicht Hedge-Fonds oder Quant-Shops oder Short-Sellers,¿Quiénes son los mejores inversores del mundo?,La respuesta no es fondos de cobertura o tiendas de cuantificación o vendedores cortos,Qui sont les meilleurs investisseurs du monde ?,"La réponse n'est ni les hedge funds, ni les magasins quant ou les vendeurs à découvert.",谁是世界最好的投资者?,答案不是对冲基金、量化商店或短卖方。
36,Japan is obsessed with rice. And prices have gone ballistic,Politicians are reaching for increasingly extreme measures,Japan ist besessen von Reis. Und die Preise sind ballistisch geworden,Politiker streben nach immer extremeren Maßnahmen,Japón está obsesionado con el arroz y los precios se han vuelto locos.,Los políticos están adoptando medidas cada vez más extremas,Le Japon est obsédé par le riz.,Les politiciens cherchent des mesures de plus en plus extrêmes,日本对大米着迷。,政客们正在采取越来越极端的措施
37,Japan’s debts are shrinking. Its troubles may be only starting,Politicians have a yen for handouts,Japans Schulden schrumpfen.,Politiker haben einen Yen für Handouts,Las deudas de Japón se están reduciendo y sus problemas pueden estar empezando,Los políticos tienen un yen para limosnas,Les dettes du Japon se rétrécissent.,Les politiciens ont un yen pour les dons,"日本的债务正在萎缩,其麻烦可能才刚刚开始。",政客有日元做义工
38,Investors ignore world-changing news. Rightly,The Nothing Ever Happens Market,Investoren ignorieren weltverändernde Nachrichten. Zu Recht,"Das Nichts, das jemals passiert Markt",Los inversores ignoran las noticias que cambian el mundo.,El mercado nunca ocurre,Les investisseurs ignorent les nouvelles qui changent le monde.,Le marché de rien n'arrive jamais,投资者无视世界变化中的消息。,""" 从未发生过的市场 """
39,Why today’s graduates are screwed,The bottom has fallen out of the job market,Warum heute Absolventen verarscht werden,Der Boden ist aus dem Arbeitsmarkt gefallen,¿Por qué los graduados de hoy están jodidos,El fondo ha caído fuera del mercado de trabajo,Pourquoi aujourd'hui les diplômés sont foutus,Le bas est tombé du marché du travail,为何今日的毕业生惨遭破坏,底底已经从就业市场跌出
40,The Dalai Lama faces a horrible dilemma,Tibet’s spiritual leader is set to reveal one succession plan. China has another,Der Dalai Lama steht vor einem schrecklichen Dilemma,Tibets spiritueller Führer soll einen Nachfolgeplan offenbaren. China hat einen anderen,El Dalai Lama se enfrenta a un terrible dilema,El líder espiritual del Tíbet está dispuesto a revelar un plan de sucesión. China tiene otro,Le Dalaï Lama fait face à un terrible dilemme,Le chef spirituel du Tibet est prêt à révéler un plan de succession. La Chine en a un autre.,达赖喇嘛面临可怕的困境,西藏精神领袖将揭示一个继承计划。 中国还有另一个
41,Rich Chinese cities are suffocating poor ones,A hitch in the battle against smog,Reiche chinesische Städte ersticken die Armen,Ein Haken im Kampf gegen Smog,Las ciudades ricas chinas están sofocando a las pobres,Un enganche en la batalla contra el smog,De riches villes chinoises asphyxient les pauvres,Un accrochage dans la bataille contre le smog,中国富裕城市扼杀贫穷城市,在对抗烟雾的战斗中
