,title-en,content-en,title-de,content-de,title-es,content-es,title-fr,content-fr,title-zh,content-zh
41,China’s crazy reverse-credit cards,"In the People’s Republic you “pay now, buy later”",Chinas verrückte Reverse-Kreditkarten,"In der Volksrepublik bezahlen Sie jetzt, kaufen Sie später",Las tarjetas de crédito inversas locas de China,"En la República Popular “pagáis ahora, comprad más tarde”",Les cartes de crédit inversées de la Chine,"Dans la République Populaire vous payez maintenant, achetez plus tard",中国疯狂的逆向信用卡,"在人民共和国,你 "" 现在就付钱,以后买 """
42,China’s carbon emissions may have peaked,"If so, it is a significant, symbolic moment",Die CO2-Emissionen in China könnten ihren Höhepunkt erreicht haben,"Wenn ja, dann ist es ein bedeutsamer, symbolischer Moment.",Las emisiones de carbono de China pueden haber alcanzado su punto máximo,"Si es así, es un momento significativo y simbólico.",Les émissions de carbone de la Chine ont peut-être atteint un sommet,"Si c'est le cas, c'est un moment significatif et symbolique.",中国的碳排放量可能已经达到顶峰,"如果是这样的话,这是一个意义重大的象征意义的时刻"
43,Xi Jinping’s plan to overtake America in AI,China’s leaders believe they can outwit American cash and utopianism,"Xi Jinpings Plan, Amerika in KI zu überholen","Chinas Führer glauben, dass sie amerikanisches Geld und Utopismus überlisten können",El plan de Xi Jinping para superar a Estados Unidos en IA,Los líderes chinos creen que pueden burlar el dinero estadounidense y el utopismo,Xi Jinping's prévoit de dépasser l'Amérique en AI,Les dirigeants chinois croient qu'ils peuvent surpasser l'argent américain et l'utopianisme,习近平计划在AI公司上越越美国,"中国领导人相信,他们能够战胜美国的现金和乌托邦主义。"
44,A sex scandal in China sparks a nationwide debate,The affair has morphed into a discussion about privilege and fairness,Ein Sexskandal in China löst eine landesweite Debatte aus,Die Affäre hat sich in eine Diskussion über Privilegien und Fairness verwandelt,Un escándalo sexual en China desencadena un debate a nivel nacional,El asunto se ha transformado en una discusión sobre el privilegio y la equidad,Un scandale sexuel en Chine déclenche un débat national,L'affaire s'est transformée en une discussion sur le privilège et l'équité,中国的性丑闻引发全国辩论,这件事已经演变成对特权和公平的讨论
45,China’s universities are wooing Western scientists,And they are reaching beyond academics with Chinese heritage,Chinas Universitäten werben westliche Wissenschaftler,Und sie erreichen über Akademiker mit chinesischem Erbe hinaus,Las universidades chinas están cortejando a científicos occidentales,Y están llegando más allá de los académicos con la herencia china,Chine Les universités sont en train de faire du tort aux scientifiques occidentaux,Et ils vont au-delà des universitaires avec l'héritage chinois,中国的大学正在向西方科学家求爱,并且他们超越了 具有中国历史遗产的学者范围
46,How China became cool,Western livestreamers and Chinese video games have burnished the country’s image,Wie China kühl wurde,Western Livestreamer und chinesische Videospiele haben das Land verbrannt Bild,Cómo China se volvió genial,Las transmisiones en vivo occidentales y los videojuegos chinos han bruñido la imagen del país,Comment la Chine est devenue cool,Les livestreamers occidentaux et les jeux vidéo chinois ont brûlé l'image du pays,中国是如何变得酷酷的,西方游民和中国电子游戏已经烧毁了中国的形象。
47,Young Chinese are turning to AI chatbots for friendship and love,It is not doing anything for the low birth rate,Junge Chinesen wenden sich an KI-Chatbots für Freundschaft und Liebe,Es tut nichts für die niedrige Geburtenrate,Jóvenes chinos están recurriendo a chatbots de IA para la amistad y el amor,No está haciendo nada por la baja tasa de natalidad.,Les jeunes Chinois se tournent vers AI chatbots pour l'amitié et l'amour,Il ne fait rien pour le faible taux de natalité,年轻的中国人正在向爱爱的闲聊爱好者寻求友谊和爱,它没有为低出生率做任何事情
48,What a New Jersey election says about MAGA America,Republican moderates have converted and Democrats are divided,Was eine Wahl in New Jersey über MAMA Amerika sagt,Republikanische Moder haben sich bekehrt und Demokraten sind gespalten,Lo que una elección de Nueva Jersey dice sobre MAGA América,Los moderados republicanos se han convertido y los demócratas están divididos,Ce qu'une élection du New Jersey dit sur MAGA America,Les modérés républicains se sont convertis et les démocrates sont divisés,新泽西州选举对MAMAGA美洲有何看法?,"共和党温和派已经转变,民主党分裂"
49,California’s carbon market reaches an inflection point,With ramifications for the West Coast and beyond,Kaliforniens Kohlenstoffmarkt erreicht einen Wendepunkt,Mit Verzweigungen für die Westküste und darüber hinaus,El mercado de carbono de California alcanza un punto de inflexión,Con ramificaciones para la Costa Oeste y más allá,Le marché du carbone de la Californie atteint un point d'inflexion,Avec des ramifications pour la côte Ouest et au-delà,加州的碳市场达到一个反弹点,影响西海岸及以外地区
50,Pete Hegseth once scared America’s allies. Now he reassures them,The defence secretary is a MAGA radical at home but a globalist abroad,Pete Hegseth erschreckte einmal Amerikas Verbündete. Jetzt beruhigt er sie,"Die Verteidigungsministerin ist ein MAMA radikal zu Hause, aber ein Globalist im Ausland",Pete Hegseth una vez asustó a los aliados de Estados Unidos. Ahora les tranquiliza,El secretario de defensa es un radical de MAGA en casa pero un globalista en el extranjero,"Pete Hegseth a une fois effrayé les alliés de l'Amérique. Maintenant, il les rassure",Le secrétaire de la défense est un radical MAGA au pays mais un mondialiste à l'étranger,"彼得·赫格塞斯曾经吓吓过美国的盟友,现在他向他们保证",国防秘书是国内的MAGAA激进分子 却是国外的全球化主义者
51,Police are cracking down on cyclists in New York City,The lycra-clad are getting swept up in problems around e-bikes,Die Polizei knallt Radfahrer in New York City nieder,Die Lycra-Klappe wird in E-Bike-Problemen aufgepeppt,La policía está reprimiendo a los ciclistas en la ciudad de Nueva York,Los lycra-clad están siendo barridos en problemas alrededor de e-bikes,La police punit les cyclistes à New York,Le lycra-clad est balayé dans les problèmes autour des e-bikes,警察正在打击纽约市的骑自行车的人,卢克拉 - 俱乐部正在被 席卷在电子自行车上的问题中
52,"Meet SCOTUSbot, our AI tool to predict Supreme Court rulings",Impending decisions will be a test of our model,"Treffen Sie SCOTUSbot, unser KI-Tool, um Urteile des Obersten Gerichtshofs vorherzusagen",Imperierende Entscheidungen werden ein Test für unser Modell sein,"Conozca a SCOTUSbot, nuestra herramienta de inteligencia artificial para predecir fallos de la Corte Suprema",Las decisiones imprevistas serán una prueba de nuestro modelo,"Rencontrez SCOTUSbot, notre outil AI pour prédire les décisions de la Cour suprême",Des décisions implacables seront un test de notre modèle,"来见SCOTUSBot, 我们用来预测最高法院裁决的人工智能工具",即将做出的决定将是对我们模式的考验
53,Elon Musk’s failure in government,His legacy will be to make reform even harder,Elon Musk's Versagen in der Regierung,"Sein Vermächtnis wird es sein, Reformen noch härter zu machen.",El fracaso de Elon Musk en el gobierno,Su legado será hacer la reforma aún más difícil,"Elon Musk, l'échec du gouvernement",Son héritage sera de rendre la réforme encore plus difficile,Elon Musk的政府失败,他的遗产将是使改革更加艰难
54,The fantastical world of Republican economic thinking,The elites of the American right cannot reconcile the inconsistencies in their policy platform,Die fantastische Welt des republikanischen wirtschaftlichen Denkens,Die Eliten der amerikanischen Rechten können die Inkonsistenzen in ihrer politischen Plattform nicht in Einklang bringen,El fantástico mundo del pensamiento económico republicano,Las élites de la derecha americana no pueden conciliar las inconsistencias en su plataforma política,Le monde fantastique de la pensée économique républicaine,Les élites du droit américain ne peuvent pas concilier les incohérences dans leur plate-forme politique,共和党经济思想的奇妙世界,美国右派精英们无法调和其政策纲领中的不一致之处
55,Why stricter voting laws no longer help Republicans,The party is pushing tougher requirements anyway,Warum strengere Wahlgesetze den Republikanern nicht mehr helfen,Die Partei drängt ohnehin härtere Anforderungen,¿Por qué leyes de voto más estrictas ya no ayudan a los republicanos,El partido está presionando requisitos más duros de todos modos,Pourquoi des lois de vote plus strictes n'aident plus les républicains,"De toute façon, le parti impose des exigences plus sévères.",为什么更严格的投票法不再帮助共和党人,"党反反反反反反反反反反反反反反反反反反反反反反反反反反反反反反反反反反反反反反反反反反反反反反反反反反反反反反反反反反反反反反反反反反反反反反反反反反反反反反反反反反反反反反反反反反反反反反反反反反反反反反反反反反反反反反反反反反反反反反反反反反反反反反反反反反反反反反反反反反反反反反反反反反反反反反反反反反反反反反反反反反反反反反反反反反反反反党党,要求要求要求要求要求要求要求要求要求更苛严"
56,Helen Hunt opens up about rejecting Hollywood's beauty standards after years of 'misery and shame',Helen Hunt opened up about the “misery and shame&quot; she often felt about her appearance early in her career and explained how she moved beyond expectations.,"Helen Hunt öffnet sich über die Ablehnung Hollywoods Schönheit Standards nach Jahren der ""Mäuse und Scham""","Helen Hunt öffnete sich über das ""Shame&quot"" und das ""Shame&quot""; sie spürte oft schon früh über ihr Aussehen und erklärte, wie sie sich über die Erwartungen hinaus bewegte.",Helen Hunt se abre sobre rechazar los estándares de belleza de Hollywood después de años de 'miserio y vergüenza',Helen Hunt se abrió acerca de la “miseria y vergüenza y cita; a menudo se sentía acerca de su aparición al principio de su carrera y explicó cómo se movió más allá de las expectativas.,"Helen Hunt s'ouvre sur le rejet des normes de beauté d'Hollywood après des années de ""mauvaise et honte""",Helen Hunt s'est ouverte au sujet de la miserie et de la honte; elle s'est souvent sentie au sujet de son apparition au début de sa carrière et a expliqué comment elle allait au-delà des attentes.,"Helen Hunt开始拒绝好莱坞的美貌标准 经过多年的""羞耻与羞耻""",Helen Hunt开诚布公地谈到“悲观与羞耻与夸脱;
57,Sports columnist faces backlash over Simone Biles defense after Riley Gaines attack,USA Today sports columnist Nancy Armour painted Simone Biles as a hero for the transgender community after her personal attack against Riley Gaines.,Sport Kolumnist Gesichter Rückschlag über Simone Biles Verteidigung nach Riley Gaines Angriff,USA Heute malte die Sportkolumnistin Nancy Armour Simone Biles nach ihrem persönlichen Angriff auf Riley Gaines als Heldin für die Transgender-Community.,El columnista deportivo se enfrenta a una reacción violenta por la defensa de Simone Biles después del ataque de Riley Gaines,La columnista deportiva de USA Today Nancy Armour pintó a Simone Biles como una heroína para la comunidad transgénero después de su ataque personal contra Riley Gaines.,Le chroniqueur sportif affronte la défense de Simone Biles après l'attaque de Riley Gaines,"USA Aujourd'hui, la chroniqueuse sportive Nancy Armour a peint Simone Biles comme un héros pour la communauté transgenre après son attaque personnelle contre Riley Gaines.","Riley Gaines攻击后, 体育专栏作家面对Simone Biles防御的反弹,","今天美国体育专栏作家Nancy Armour将Simone Biles描绘成变性社群的英雄,"
58,"California Republicans slam Newsom, Bass for letting LA burn with riots amid Trump immigration blitz",Riots erupted in Los Angeles over immigration raids as California Republicans blame Gov. Newsom and Mayor Bass for the violence by siding with illegal immigrants.,"Kalifornien Republikaner slam Newsom, Bass für L.A. brennen lassen mit Unruhen inmitten Trump Immigration Blitz",Unruhen brachen in Los Angeles wegen Immigration Razzien als kalifornische Republikaner Schuld Gov. Newsom und Bürgermeister Bass für die Gewalt durch die Abordnung mit illegalen Einwanderern.,"Los republicanos de California golpean a Newsom, Bass por dejar que LA arda con disturbios en medio del bombardeo de inmigración de Trump",Los disturbios estallaron en Los Ángeles por las redadas de inmigración mientras los republicanos de California culpan al gobernador Newsom y al alcalde Bass por la violencia al ponerse del lado de inmigrantes ilegales.,"Républicains de Californie slam Newsom, Bass pour laisser LA brûler avec des émeutes au milieu de Trump immigration blitz",Des émeutes ont éclaté à Los Angeles à la suite de raids d'immigration alors que les républicains de Californie blâment Gov. Newsom et le maire Bass pour la violence en s'en tenant aux immigrants illégaux.,"加州共和党人抨击Newsom和Bass,",加州共和党谴责政府Newsom和Bass市长与非法移民站在一起实施暴力。
59,"ABC's Terry Moran suspended after journalist slams Trump, top advisor in since-deleted post","ABC&apos;s Terry Moran attacked President Donald Trump and top advisor Stephen Miller on Sunday in a since-deleted social media post, prompting a response from the White House.","ABC's Terry Moran suspendiert, nachdem Journalist Trump, Top-Berater in seit dem gelöschten Beitrag","ABC&apos; Terry Moran attackierte Präsident Donald Trump und Top-Berater Stephen Miller am Sonntag in einem seit seiner Entlassung veröffentlichten Social-Media-Post, was eine Antwort aus dem Weißen Haus forderte.","Terry Moran de ABC suspendido después de que el periodista golpeara a Trump, asesor principal en el puesto desde que fue eliminado","ABC&apos; Terry Moran atacó al presidente Donald Trump y al asesor principal Stephen Miller el domingo en un post de redes sociales desde entonces eliminado, lo que provocó una respuesta de la Casa Blanca.","Terry Moran d'ABC suspendu après que le journaliste a claqué Trump, le meilleur conseiller dans le poste depuis-supprimé","ABC&apos;s Terry Moran a attaqué le président Donald Trump et le conseiller principal Stephen Miller dimanche dans un billet de médias sociaux depuis sa suppression, ce qui a suscité une réponse de la Maison Blanche.","ABC的Terry Moran在记者Tramps 遭吊销后被停职,","ABC&apos; Terry Moran在星期天攻击Donald Trump总统和高级顾问Stephen Miller,"
60,"Trump ally stands firm against 'big, beautiful bill' despite pressure: 'It'll completely backfire'","Fiscal hawk Ron Johnson stands firm against Trump&apos;s budget bill, contending it lacks substantial cuts while highlighting lawmakers&apos; poor understanding of federal expenditures.","Trump-Ally steht trotz Druck fest gegen 'große, schöne Rechnung': 'Es wird komplett nach hinten feuern'","Finanzhawk Ron Johnson steht fest gegen Trump&apos;s Haushaltsrechnung, behauptet, es fehlen erhebliche Kürzungen, während Hervorhebung von Gesetzgebern&apos; schlechtes Verständnis der Bundesausgaben.","El aliado de Trump se mantiene firme en contra del ""gran y hermoso proyecto de ley"" a pesar de la presión: ""Será completamente contraproducente""","El halcón fiscal Ron Johnson se mantiene firme contra Trump&apos;s proyecto de presupuesto, argumentando que carece de recortes sustanciales al tiempo que destaca legisladores&apos; mala comprensión de los gastos federales.","L'allié Trump s'oppose fermement au « gros, beau projet de loi » malgré la pression : « Il va complètement faire demi-tour »","Le faucon fiscal Ron Johnson s'oppose fermement au projet de loi sur le budget de Trump&apos, prétendant qu'il manque de réductions substantielles tout en mettant en lumière les législateurs&apos; mauvaise compréhension des dépenses fédérales.","尽管压力很大,但朗普盟友仍坚定地反对“大、漂亮法案”:“它会完全反弹”","财政鹰 Ron Johnson 坚持反对Trump&apos; 预算法案,"
61,Rubio condemns assassination attempt on Colombian presidential candidate Miguel Uribe,"Colombian presidential candidate Miguel Uribe fights for his life after an assassination attempt by a 15-year-old hit man, an attack condemned by U.S. and Latin American leaders.",Rubio verurteilt Attentat auf den kolumbianischen Präsidentschaftskandidaten Miguel Uribe,"Der kolumbianische Präsidentschaftskandidat Miguel Uribe kämpft um sein Leben nach einem Attentat eines 15-jährigen Attentäters, der von US-amerikanischen und lateinamerikanischen Führern verurteilt wurde.",Rubio condena intento de asesinato contra el candidato presidencial colombiano Miguel Uribe,"El candidato presidencial colombiano Miguel Uribe lucha por su vida después de un intento de asesinato de un sicario de 15 años, un ataque condenado por líderes estadounidenses y latinoamericanos.",Rubio condamne la tentative d'assassinat contre le candidat à la présidence colombienne Miguel Uribe,"Le candidat à la présidence colombienne Miguel Uribe se bat pour sa vie après une tentative d'assassinat d'un tueur de 15 ans, une attaque condamnée par les dirigeants américains et latino-américains.",鲁比奥谴责对哥伦比亚总统候选人米格尔·乌里韦的暗杀企图,"哥伦比亚总统候选人米格尔·乌里韦(Miguel Uribe)在一名15岁的杀手企图暗杀后,"
62,Simone Biles' social media post saying it was 'good thing guys don't compete against girls' resurfaces,An old social media post from Simone Biles appeared to come back to bite the Olympic gold medalist amid her personal attack on Riley Gaines over the weekend.,"Simone Biles' Social-Media-Post sagt, es war 'gute Sache Jungs nicht gegen Mädchen konkurrieren' wieder auftauchen","Ein alter Social-Media-Post von Simone Biles schien zurückzukommen, um den olympischen Goldmedaillengewinner inmitten ihres persönlichen Angriffs auf Riley Gaines am Wochenende zu beißen.",El post en las redes sociales de Simone Biles diciendo que era 'algo bueno que los chicos no compitan con las chicas' resurge,Un viejo post en las redes sociales de Simone Biles pareció volver a morder a la medallista olímpica de oro en medio de su ataque personal a Riley Gaines durante el fin de semana.,Le post de Simone Biles disant que c'était 'bonne chose que les gars ne concurrencent pas les filles' refait surface,Un vieux billet de médias sociaux de Simone Biles semblait revenir mordre la médaillée d'or olympique au milieu de son attaque personnelle contre Riley Gaines au cours du week-end.,"Simone Biles的社交媒体文章说,",一位来自Simone Biles的旧社交媒体文章似乎在周末对Riley Gaines的人身攻击中回来咬奥运金牌得主。
63,Kid Rock opens new Nashville restaurant and enjoys 'breakfast' in the afternoon,"During an interview with &quot;Fox &amp; Friends&quot; at his new Nashville restaurant, singer Kid Rock revealed his unusual breakfast schedule, saying that he eats it at 1 p.m. or 5 p.m.","Kid Rock eröffnet neues Nashville Restaurant und genießt ""Frühstück"" am Nachmittag","Während eines Interviews mit &quot;Fox &amp;Friends&quot; in seinem neuen Nashville Restaurant enthüllt Sänger Kid Rock seinen ungewöhnlichen Frühstücksplan und sagt, dass er es um 13 Uhr oder 17 Uhr isst.","Kid Rock abre el nuevo restaurante Nashville y disfruta del ""desayuno"" por la tarde","Durante una entrevista con &quot;Fox &amp; Friends&quot; en su nuevo restaurante Nashville, el cantante Kid Rock reveló su inusual horario de desayuno, diciendo que lo come a la 1 p.m. o 5 p.m.",Kid Rock ouvre le nouveau restaurant Nashville et profite du petit-déjeuner dans l'après-midi,"Lors d'une entrevue avec &quot;Fox &amp; Friends&quot; dans son nouveau restaurant de Nashville, le chanteur Kid Rock a révélé son horaire de petit-déjeuner inhabituel, disant qu'il le mange à 13 h ou 17 h.",Kid Rock开新纳什维尔餐厅 下午享受早餐,"在与 & quot; Fox & amp; Friends & quot; 在他的新Nashville 餐馆接受采访时,歌手Kid Rock透露了他的不寻常的早餐时间,他说他下午1点或5点吃早餐。"
64,What’s the right time to get your kids off the family payroll?,Financial independence for adult children is crucial for their development and parents&apos; retirement security. Here&apos;s what parents should stop covering.,"Was ist der richtige Zeitpunkt, um Ihre Kinder von der Familie Lohn?","Finanzielle Unabhängigkeit für erwachsene Kinder ist entscheidend für ihre Entwicklung und Eltern & Apos; Alterssicherung. Hier & Apos;s, was Eltern aufhören sollten zu decken.",¿Cuál es el momento adecuado para sacar a tus hijos de la nómina familiar?,La independencia financiera de los hijos adultos es crucial para su desarrollo y padres y apos; la seguridad de la jubilación. Here&apos;s lo que los padres deben dejar de cubrir.,Quel est le bon moment pour retirer vos enfants de la paie de la famille ?,L'indépendance financière des enfants adultes est essentielle à leur développement et à celui des parents; la sécurité de la retraite.,让孩子不再领取家庭工资的适当时机是什么?,成年儿童的经济独立对于他们的成长和父母和父母关系;退休保障至关重要。 这里 & apos; 父母应该停止覆盖的东西 。
65,How to tell if a login alert is real or a scam,"Protect yourself from login alert scams with five security steps, including avoiding suspicious links, checking account activity and enabling two-factor authentication","Wie man sagt, ob ein Login-Alarm real ist oder ein Betrug","Schützen Sie sich vor Login-Alarm-Betrügen mit fünf Sicherheitsschritten, einschließlich der Vermeidung verdächtiger Links, Überprüfung der Kontoaktivität und Ermöglichung der Zwei-Faktor-Authentifizierung",Cómo saber si una alerta de inicio de sesión es real o una estafa,"Protéjase de las estafas de alerta de inicio de sesión con cinco pasos de seguridad, incluyendo evitar enlaces sospechosos, comprobar la actividad de la cuenta y permitir la autenticación de dos factores",Comment dire si une alerte de connexion est réelle ou une arnaque,"Protégez-vous des arnaques d'alerte de connexion avec cinq étapes de sécurité, notamment en évitant les liens suspects, en vérifiant l'activité du compte et en permettant l'authentification à deux facteurs",如何辨别登录警告是真实的还是欺诈的 ?,"采取五个安全步骤,保护自己免受登录警报骗骗,包括避免可疑联系、检查账户活动和促成两个因素的认证"
66,Madeleine McCann search resumes as suspect's prison release looms after years behind bars,A new search for Madeleine McCann in Portugal likely stems from an inside tip after authorities used advanced technology to investigate areas where the toddler vanished.,"Madeleine McCann sucht weiter, als die Freilassung des Verdächtigen nach Jahren hinter Gittern droht.","Eine neue Suche nach Madeleine McCann in Portugal stammt wahrscheinlich von einem Geheimtipp, nachdem die Behörden fortschrittliche Technologien benutzten, um Gebiete zu untersuchen, in denen das Kleinkind verschwand.",La búsqueda de Madeleine McCann se reanuda mientras la liberación del sospechoso se avecina después de años tras las rejas,Una nueva búsqueda de Madeleine McCann en Portugal probablemente provenga de una punta interna después de que las autoridades usaran tecnología avanzada para investigar áreas donde el niño desapareció.,La recherche de Madeleine McCann reprend alors que la libération du suspect se profile après des années derrière les barreaux,Une nouvelle recherche de Madeleine McCann au Portugal provient probablement d'une pointe intérieure après que les autorités ont utilisé la technologie de pointe pour enquêter sur les zones où le tout-petit a disparu.,"Madleine McCann在多年监禁后,","在葡萄牙对马德琳·麦坎恩的新搜索可能来自内部消息, 因为当局使用先进技术调查幼儿失踪的地区。"
