,title-en,content-en,title-de,content-de,title-es,content-es,title-fr,content-fr,title-zh,content-zh
69,For All America Summer Vacation Quiz,Summer is here! Find out which Fox News talent you may be rubbing shoulders with on your vacation this summer.,Für alle Amerika Sommer Urlaub Quiz,"Sommer ist hier! Finden Sie heraus, mit welchem Fox News Talent Sie in Ihrem Urlaub in diesem Sommer die Schultern reiben können.",Para todos los EE.UU. Prueba de vacaciones de verano,¡El verano está aquí! Averigüe con qué talento Fox News puede estar frotándose los hombros en sus vacaciones este verano.,Pour toute l'Amérique Quiz Vacances d'été,L'été est là! Découvrez le talent de Fox News avec lequel vous pourriez vous frotter pendant vos vacances cet été.,全美暑暑假吉斯,查查你今年暑假时 可能与哪个狐狸新闻天才擦肩而过
70,Fake Venmo accounts are stealing donations from real charities,Tech expert Kurt “CyberGuy&quot; Knutsson reports that scammers made a fake Venmo that mimics a real cancer nonprofit’s handle.,Fake Venmo Konten stehlen Spenden von echten Wohltätigkeitsorganisationen,"Tech-Experte Kurt CyberGuy&quot; Knutsson berichtet, dass Betrüger einen gefälschten Venmo gemacht haben, der eine echte Krebs Nonprofit-Handhabung nachahmt.",Cuentas falsas de Venmo están robando donaciones de organizaciones benéficas reales,Experto en tecnología Kurt “CyberGuy&quot; Knutsson informa que los estafadores hicieron un Venmo falso que imita una verdadera manija de cáncer sin fines de lucro.,De faux comptes Venmo volent des dons de vrais organismes de bienfaisance,"L'expert en technologie Kurt, CyberGuy&quot; Knutsson rapporte que les arnaqueurs ont fait un faux Venmo qui imite une vraie poignée sans but lucratif de cancer.",伪造的文模账户在盗取慈善组织的捐款,"Tech专家Kurt “CyberGuy&quot; Knutsson ” 报告说,骗徒制造了假的Venmo,模仿了真正的非盈利性癌症手柄。"
71,Faith under fire: How Trump's 'beautiful bill' targets Christian education,Christian higher education faces threats from Trump&apos;s &apos;One Big Beautiful Bill&apos; which could penalize institutions whose graduates choose service careers over high-paying jobs.,"Glaube unter Beschuss: Wie Trumps ""schöner Gesetzentwurf"" die christliche Erziehung zum Ziel hat","Christliche Hochschulbildung droht mit Drohungen von Trump&apos;s &apos;One Big Beautiful Bill&apos; die Institutionen bestrafen könnte, deren Absolventen wählen Dienstleistungskarrieren über hoch bezahlte Jobs.","Fe bajo fuego: Cómo la ""bella ley"" de Trump apunta a la educación cristiana",La educación superior cristiana se enfrenta a amenazas de Trump&apos;s &apos;One Big Beautiful Bill&apos; que podría penalizar a las instituciones cuyos graduados eligen carreras de servicio por encima de los trabajos de alta remuneración.,La foi sous le feu : comment le « beau projet de loi » de Trump cible l'éducation chrétienne,L'enseignement supérieur chrétien fait face à des menaces de la part de Trump&apos;s &apos;One Big Beautiful Bill&apos; qui pourraient pénaliser les établissements dont les diplômés choisissent des carrières de service plutôt que des emplois à forte rémunération.,Trump的“漂亮法案”是如何针对基督教教育的?,"基督教高等教育面临来自Trump&apos;s&apos; One Big Beautiful Bill&apos; 的威胁,这可能会惩罚那些毕业生选择服务职业而不是高薪工作的机构。"
72,"LPGA Tour legend Annika Sorenstam appreciates Paige Spiranac, other golf influencers' efforts to grow game","LPGA Tour legend Annika Sorenstam may be the greatest female golfer of this generation, but the average fan may know the name Paige Spiranac before her.","LPGA Tour Legende Annika Sorenstam schätzt Paige Spiranac, andere Golf Influencer Bemühungen zu wachsen Spiel","LPGA Tour Legende Annika Sorenstam mag die größte Golferin dieser Generation sein, aber der durchschnittliche Fan kann den Namen Paige Spiranac vor ihr kennen.","La leyenda del LPGA Tour Annika Sorenstam aprecia a Paige Spiranac, los esfuerzos de otros influencers del golf para crecer juego","La leyenda del LPGA Tour Annika Sorenstam puede ser la mejor golfista femenina de esta generación, pero la fanática promedio puede conocer el nombre de Paige Spiranac antes que ella.","La légende du LPGA Tour Annika Sorenstam apprécie Paige Spiranac, les efforts d'autres influenceurs de golf pour faire croître le jeu","La légende du LPGA Tour Annika Sorenstam est peut-être la plus grande femme golfeuse de cette génération, mais le fan moyen peut connaître le nom Paige Spiranac avant elle.",LPGA 旅游传说 Annika Sorenstam 赞赏其他高尔夫影响者Paige Spiranac 努力成长游戏,"LPGA Tour 传奇人物Annika Sorenstam可能是这代人中 最伟大的女性高尔夫球手, 但普通球迷可能知道 她面前的Paige Spiranac这个名字。"
73,Reagan-nominated federal judge accuses Trump admin of 'discrimination' with cuts to NIH diversity grants,"A Reagan-appointed federal judge asserted that some of the Trump administration&apos;s NIH research grant cuts are illegal and discriminatory, reports indicate","Reagan-nominierte Bundesrichter beschuldigt Trump Admin von ""Diskriminierung"" mit Kürzungen an NIH Diversity Grants","Ein von Reagan ernannter Bundesrichter behauptete, dass einige der Trump-Administration&Apos; NIH-Forschungsstipendienkürzungen illegal und diskriminierend seien, heißt es in Berichten.","El juez federal designado por Reagan acusa al administrador Trump de ""discriminación"" con recortes a las subvenciones a la diversidad de NIH","Un juez federal nombrado por Reagan afirmó que algunos de los recortes de subvenciones de investigación de la administración Trump y apos; NIH son ilegales y discriminatorios, informes indican",Le juge fédéral nommé par Reagan accuse Trump d'«administration de la discrimination» avec des coupes dans les subventions à la diversité des NIH,"Un juge fédéral nommé par Reagan a affirmé que certaines de l'administration Trump&apos; les réductions de subventions de recherche NIH sont illégales et discriminatoires, les rapports indiquent","Reagan提名的联邦法官指控Trump行政官“歧视”,","Reagan任命的一位联邦法官声称,Trump 行政当局和apos;NIH研究赠款的削减是非法的和歧视性的,报告表明:"
74,Florida sheriff scolds Lizzo after she said law enforcement threatened to 'kill' peaceful protestors,"Florida Sheriff Wayne Ivey challenged Lizzo&apos;s accusation, saying he supports First Amendment rights for peaceful protests while only warning against violent protest tactics.","Florida Sheriff schimpft Lizzo, nachdem sie sagte, Strafverfolgung drohte zu ""töten"" friedliche Demonstranten","Florida Sheriff Wayne Ivey forderte Lizzo&apos;s Anschuldigung, dass er First Amendment Rechte für friedliche Proteste unterstützt, während nur vor gewalttätigen Protesttaktiken warnt.",Sheriff de Florida regaña a Lizzo después de que dijo que las fuerzas del orden amenazaron con 'matar' a manifestantes pacíficos,"El sheriff de Florida Wayne Ivey desafió la acusación de Lizzo&apos, diciendo que apoya los derechos de la Primera Enmienda para las protestas pacíficas mientras sólo advierte contra las tácticas violentas de protesta.","Le shérif de Floride gronde Lizzo après qu'elle ait dit que les forces de l'ordre menaçaient de ""tuer"" les manifestants pacifiques","Le shérif de Floride Wayne Ivey a contesté l'accusation de Lizzo&apos, affirmant qu'il soutient les droits de premier amendement pour les manifestations pacifiques tout en mettant en garde contre les tactiques violentes de protestation.","Florida治安官在Lizzo说执法部门威胁要杀害和平抗议者后,","佛罗里达州警长Wayne Ivey质疑Lizzo&apos;指控, 说他支持第一修正案和平抗议的权利,"
75,Blue state lawmaker rallies around mask ban for federal agents as ICE operations ramp up,California State Sen. Scott Wiener introduces the No Secret Police Act to ban law enforcement from covering faces amid increased ICE arrests and protests.,Blue State Gesetzgeber Kundgebungen rund um Maske Verbot für Bundesagenten als ICE-Operationen Rampen,"California State Sen. Scott Wiener führt das No Secret Police Act ein, um Strafverfolgungsbehörden zu verbieten, Gesichter inmitten erhöhter ICE Verhaftungen und Proteste zu bedecken.",El legislador del estado azul se reúne en torno a la prohibición de máscaras para los agentes federales mientras las operaciones del ICE aumentan,El Senador Estatal de California Scott Wiener introduce la Ley No Secreta de Policía para prohibir que las fuerzas del orden cubran caras en medio de crecientes arrestos y protestas del ICE.,Le législateur de l'État bleu se réunit autour de l'interdiction des masques pour les agents fédéraux alors que les opérations de l'ICE s'accélèrent,California State Sen. Scott Wiener introduit la loi No Secret Police Act pour interdire l'application de la loi de couvrir les visages au milieu de l'augmentation des arrestations et des protestations ICE.,"随着ICE行动升级, 蓝州立法者围绕禁止联邦探员戴面具的禁令集会,","Scott Wiener介绍了《禁止秘密警察法》,禁止执法部门在ICE逮捕和抗议活动增加时掩盖面孔。"
76,Israel says it killed Iran's 'senior-most military official',"Israel said Tuesday that they killed Iran’s wartime chief of staff Maj. Gen. Ali Shadmani, a close ally of Iranian Supreme Leader Ayatollah Ali Khamenei.","Israel sagt, es tötete den ""obersten Militärbeamten des Irans""","Israel sagte am Dienstag, dass sie Irans Kriegschef Generalmajor Ali Shadmani, einen engen Verbündeten des iranischen Obersten Führers Ayatollah Ali Khamenei, töteten.","Israel dice que mató al ""oficial militar más alto"" de Irán","Israel dijo el martes que mataron al jefe de estado mayor de Irán en tiempos de guerra, el general Ali Shadmani, un aliado cercano del líder supremo iraní Ayatollah Ali Khamenei.",Israël dit qu'il a tué le « plus ancien officier militaire » de l'Iran,"Israël a déclaré mardi qu'ils ont tué l'Iran chef d'état-major en temps de guerre Maj. Gén. Ali Shadmani, un allié proche du chef suprême iranien Ayatollah Ali Khamenei.",以色列说它杀死了伊朗最高级的军事官员,"以色列星期二说,他们杀害伊朗战时参谋长阿里·沙德马尼少将,他是伊朗最高领袖阿亚图拉·阿里·哈梅内伊的亲密盟友。"
77,Democrat group betting on anti-ICE fear in new campaign ad targeting young men,"New political advertisement from Progress Action Fund portrays ICE agents forcibly removing a U.S. citizen during a date, targeting swing districts ahead of 2026 midterms.",Demokratische Gruppe setzt auf Anti-ICE-Angst in neuer Kampagne Werbung für junge Männer,"Neue politische Werbung aus dem Progress Action Fund porträtiert ICE-Agenten gewaltsam Entfernen eines US-Bürger während eines Datums, gezielt Schaukelbezirke vor 2026 Midterms.",Grupo demócrata apostando por el miedo anti-ICE en un nuevo anuncio de campaña dirigido a los jóvenes,"Nuevo anuncio político del Progress Action Fund retrata a los agentes del ICE desalojando por la fuerza a un ciudadano estadounidense durante una fecha, apuntando a distritos provisionales antes de los exámenes de mitad de período de 2026.",Groupe démocrate parier sur la peur anti-ICE dans une nouvelle campagne publicitaire ciblant les jeunes hommes,"La nouvelle publicité politique du Progress Action Fund montre que les agents de l'ICE ont expulsé de force un citoyen américain au cours d'une date, ciblant les districts transitoires avant 2026 mi-parcours.","在针对青年男子的新运动广告中,","进步行动基金的新政治广告描绘ICE代理在某一天强行驱逐一名美国公民,"
78,"Why did Trump leave G7 early? 'Much bigger' than Iran cease-fire, he says","President Donald Trump told reporters aboard Air Force One early Tuesday that he&apos;s seeking &quot;better than a cease-fire&quot; in the Israel-Iran conflict, hinting at something &quot;bigger.&quot;","Warum hat Trump G7 früh verlassen? ""Viel größer"" als der Iran Waffenstillstand, sagt er","Präsident Donald Trump sagte den Reportern an Bord der Air Force Eines frühen Dienstags, dass he&apos;s sucht &quot;besser als ein Waffenstillstand&quot; im israelisch-iranischen Konflikt, deutet auf etwas &quot;bigger.&quot;","¿Por qué Trump dejó el G7 temprano? ""Mucho más grande"" que el alto el fuego iraní, dice","El presidente Donald Trump dijo a los reporteros a bordo de la Fuerza Aérea Un martes temprano que he&apos;s buscando &quot;mejor que un alto el fuego&quot; en el conflicto Israel-Irán, insinuando algo &quot;bigger.&quot;","Pourquoi Trump a-t-il quitté le G7 plus tôt ? « Beaucoup plus grand » que le cessez-le-feu iranien, dit-il.","Le président Donald Trump a dit aux journalistes à bord de l'Air Force Un mardi matin qu'il cherchait plus qu'un cessez-le-feu dans le conflit israélo-iranien, laissant entendre quelque chose à propos de &quot;bigger.&quot;",为什么特朗普提前离开G7?,"总统唐纳德·特朗普(Donald Trump)在星期二早些时候告诉空军的记者们, he&apos; 正在寻求和quot; 而不是停火和quot; 在以色列- 伊朗冲突中, 暗示一些 & quot; bigger. & quot;"
79,World Series champion Ron Taylor dead at 87,"Dr. Ron Taylor, a two-time World Series champion with the New York Mets and St. Louis Cardinals who later became the Toronto Blue Jays&apos; team physician, has died. He was 87.",Weltmeister Ron Taylor tot bei 87,"Dr. Ron Taylor, ein zweimaliger Weltmeister mit den New York Mets und St. Louis Cardinals, der später zum Toronto Blue Jays&apos wurde; Teamarzt, ist gestorben. Er war 87.",El campeón de la Serie Mundial Ron Taylor murió a los 87 años,"El Dr. Ron Taylor, dos veces campeón de la Serie Mundial con los Mets de Nueva York y St. Louis Cardinals que más tarde se convirtió en el Toronto Blue Jays&apos, médico del equipo, ha muerto.",Le champion du monde de la série Ron Taylor est mort à 87,"Le Dr Ron Taylor, deux fois champion des séries mondiales avec les Mets de New York et les Cardinaux de St. Louis, qui est devenu plus tard le Blue Jays&apos de Toronto; médecin d'équipe, est décédé. Il avait 87 ans.",世界联赛冠军Ron Taylor 87岁死亡,"Ron Taylor博士是纽约大都会和圣路易斯红衣主教的两次世界联赛冠军,后来成为多伦多蓝Jays&apos;小组医生。他去世了87岁。"
80,Minnesota lawmaker happened to be on vacation when masked suspect knocked on door,"The man accused of shooting two Minnesota state lawmakers and their spouses early Saturday also visited the homes of two other lawmakers, but one of them was away on vacation.","Minnesota Gesetzgeber zufällig im Urlaub zu sein, wenn maskierte Verdächtige an der Tür klopfte","Der Mann des Schießens zwei Minnesota Staat Gesetzgeber und ihre Ehegatten am frühen Samstag auch besuchte die Häuser von zwei anderen Gesetzgebern, aber einer von ihnen war weg im Urlaub.",El legislador de Minnesota estaba de vacaciones cuando un sospechoso enmascarado llamó a la puerta.,"El hombre acusado de disparar dos legisladores estatales de Minnesota y sus cónyuges temprano sábado también visitó las casas de otros dos legisladores, pero uno de ellos estaba de vacaciones.",Le législateur du Minnesota s'est avéré être en vacances quand le suspect masqué a frappé à la porte,"L'homme accusé d'avoir tiré deux législateurs de l'État du Minnesota et leurs conjoints début samedi a également visité les maisons de deux autres législateurs, mais l'un d'eux était en vacances.",明尼苏达州立法机构碰巧在度假 当蒙面嫌犯敲门时,"被控杀害两名明尼苏达州立法者及其配偶的男子星期六早些时候也前往另外两名立法者的家,"
81,180 new municipal partnerships formed between Germany and Ukraine since start of Russia’s war of aggression,"The German-Ukraine Municipal Partnership Network has grown from 70 to 250 partnerships since Russia’s war of aggression against Ukraine began in 2022. Around 700 mayors, city councillors and district leaders from Germany, Ukraine and other European countries are meeting in Münster today. The conference is being organised by the Federal Ministry for Economic Cooperation and Development (BMZ) and the City of Münster.",180 neue kommunale Partnerschaften zwischen Deutschland und der Ukraine seit Beginn des Angriffskrieges Russlands,"Das deutsch-ukrainische Städtepartnerschaftsnetz ist seit dem Angriffskrieg gegen die Ukraine 2022 von 70 auf 250 Partnerschaften gewachsen. Rund 700 Bürgermeister, Stadträte und Bezirksführer aus Deutschland, der Ukraine und anderen europäischen Ländern treffen sich heute in Münster. Die Konferenz wird vom Bundesministerium für wirtschaftliche Zusammenarbeit und Entwicklung (BMZ) und der Stadt Münster organisiert.",180 nuevas asociaciones municipales formadas entre Alemania y Ucrania desde el inicio de la guerra de agresión de Rusia,"La Red de Asociaciones Municipales entre Alemania y Ucrania ha pasado de 70 a 250 asociaciones desde que comenzó la guerra de agresión de Rusia contra Ucrania en 2022. Alrededor de 700 alcaldes, concejales y líderes de distrito de Alemania, Ucrania y otros países europeos se reúnen hoy en Münster. La conferencia está siendo organizada por el Ministerio Federal de Cooperación Económica y Desarrollo (BMZ) y la ciudad de Münster.",180 nouveaux partenariats municipaux formés entre l'Allemagne et l'Ukraine depuis le début de la guerre d'agression russe,"Le réseau de partenariat municipal entre l'Allemagne et l'Ukraine est passé de 70 à 250 partenariats depuis le début de la guerre d'agression contre l'Ukraine en 2022. Environ 700 maires, conseillers municipaux et chefs de district d'Allemagne, d'Ukraine et d'autres pays européens se réunissent aujourd'hui à Münster. La conférence est organisée par le ministère fédéral de la Coopération et du Développement économique (BMZ) et la ville de Münster.","自俄罗斯侵略战争开始以来,德国和乌克兰之间建立了180个新的城市伙伴关系","自2022年俄罗斯对乌克兰发动侵略战争以来,德国-乌克兰城市伙伴关系网络从70个发展到250个伙伴关系。 来自德国、乌克兰和其他欧洲国家的约700名市长、市议员和地区领导人今天正在明斯特举行会议。 会议由联邦经济合作与发展部(BMZ)和明斯特市组织。"
82,"At Hamburg Sustainability Conference, participants from across the world provide input and strengthen international cooperation","Today is the final day of the second Hamburg Sustainability Conference. German Development Minister Reem Alabali Radovan, who opened the Conference on Monday, has exchanged ideas with partners from all over the world on how to make international climate action work, use artificial intelligence responsibly and build a just world economy. Participants have formed numerous alliances on these and other sustainability issues.",Auf der Hamburg Sustainability Conference leisten Teilnehmer aus aller Welt Input und stärken die internationale Zusammenarbeit,"Heute ist der letzte Tag der zweiten Hamburg Sustainability Conference. Bundesentwicklungsminister Reem Alabali Radovan, der die Konferenz am Montag eröffnet hat, hat sich mit Partnern aus aller Welt darüber ausgetauscht, wie internationaler Klimaschutz funktioniert, künstliche Intelligenz verantwortungsvoll genutzt und eine gerechte Weltwirtschaft aufgebaut werden kann.","En la Conferencia de Sostenibilidad de Hamburgo, participantes de todo el mundo aportan su contribución y fortalecen la cooperación internacional","Hoy es el último día de la segunda Conferencia de Sostenibilidad de Hamburgo. El Ministro de Desarrollo de Alemania, Reem Alabali Radovan, quien inauguró la Conferencia el lunes, ha intercambiado ideas con socios de todo el mundo sobre cómo hacer que la acción climática internacional funcione, utilizar la inteligencia artificial de manera responsable y construir una economía mundial justa.","À la Conférence de Hambourg sur la durabilité, les participants du monde entier apportent leur contribution et renforcent la coopération internationale","Le ministre allemand du Développement, Reem Alabali Radovan, qui a ouvert la Conférence lundi, a échangé des idées avec des partenaires du monde entier sur la façon de faire fonctionner l'action climatique internationale, d'utiliser l'intelligence artificielle de manière responsable et de construire une économie mondiale juste. Les participants ont formé de nombreuses alliances sur ces questions et d'autres questions de durabilité.","在汉堡可持续性会议上,来自世界各地的与会者提供投入并加强国际合作","今天是第二次汉堡可持续性会议的最后一天,德国发展部长Reem Alabali Radovan于星期一宣布会议开幕,他与世界各地的伙伴就如何使国际气候行动发挥作用、负责任地使用人工智能和建立一个公正的世界经济交换了意见,与会者在这些和其他可持续性问题上结成了许多联盟。"
83,Closing in on a breakthrough to mobilize sustainable private investment in emerging markets and developing economies,"Just a few months after its launch, the Hamburg Sustainability Platform (HSP), an initiative of public and private institutions is laying the foundation for truly scaling private investment for sustainable development in emerging markets and developing countries. [...] Signing a joint declaration of intent at the Hamburg Sustainability Conference 2025, the HSP reaffirmed their joint commitment to remove structural obstacles that so far stood in the way of mobilizing large-scale investments.",Abschluss eines Durchbruchs zur Mobilisierung nachhaltiger privater Investitionen in Schwellen- und Entwicklungsländern,"Wenige Monate nach dem Start der Hamburg Sustainability Platform (HSP) legt eine Initiative öffentlicher und privater Institutionen den Grundstein für eine wirkliche Skalierung privater Investitionen für nachhaltige Entwicklung in Schwellen- und Entwicklungsländern. [...] Mit der Unterzeichnung einer gemeinsamen Absichtserklärung auf der Hamburg Sustainability Conference 2025 bekräftigte die HSP ihr gemeinsames Engagement, strukturelle Hindernisse zu beseitigen, die bisher der Mobilisierung von Großinvestitionen im Wege standen.",Finalización de un gran avance para movilizar la inversión privada sostenible en los mercados emergentes y las economías en desarrollo,"Apenas unos meses después de su lanzamiento, la Plataforma de Sostenibilidad de Hamburgo (HSP), una iniciativa de instituciones públicas y privadas, está sentando las bases para una verdadera ampliación de la inversión privada para el desarrollo sostenible en los mercados emergentes y los países en desarrollo. [...] Al firmar una declaración conjunta de intenciones en la Conferencia de Sostenibilidad de Hamburgo 2025, el HSP reafirmó su compromiso conjunto de eliminar los obstáculos estructurales que hasta ahora se interponían en la movilización de inversiones a gran escala.",Conclusion sur une percée en vue de mobiliser des investissements privés durables dans les marchés émergents et les économies en développement,"Quelques mois seulement après son lancement, la Hamburg Sustainability Platform (HSP), une initiative d'institutions publiques et privées, jette les bases d'une véritable expansion de l'investissement privé pour le développement durable dans les marchés émergents et les pays en développement. [...] Signant une déclaration d'intention commune à la Conférence de Hambourg sur la durabilité 2025, la HSP a réaffirmé son engagement commun à éliminer les obstacles structurels qui, jusqu'à présent, empêchaient de mobiliser des investissements à grande échelle.",结束在新兴市场和发展中经济体调动可持续私人投资,"在启动《汉堡可持续性平台》仅仅几个月后,公私机构的一项倡议,即《汉堡可持续性平台》,为真正扩大私人投资,促进新兴市场和发展中国家的可持续发展奠定了基础。 [.]在2025年汉堡可持续性会议上签署联合意向宣言,《汉堡可持续性平台》重申,它们共同承诺消除迄今阻碍调动大规模投资的结构性障碍。"
