,title-en,content-en,title-de,content-de,title-es,content-es,title-fr,content-fr,title-zh,content-zh
69,BROADCAST BIAS: Networks shield NYC socialist Mamdani from 'extreme' label they apply to conservatives,"Liberal media&apos;s double standard exposed as ABC, CBS, and NBC frame socialist mayoral candidate Mamdani as &apos;charismatic&apos; while ignoring his controversial positions","BROADCAST BIAS: Netzwerke schirmen NYC-Sozialisten Mamdani vom ""extremen"" Label, das sie für Konservative anwenden","Liberal media&apos;s doppelte Standard ausgesetzt als ABC, CBS, und NBC Rahmen sozialistischen Bürgermeister Kandidaten Maddani als &apos;charismatische&apos; während seine umstrittenen Positionen ignorieren","BROADCAST BIAS: Redes protegen al socialista neoyorquino Mamdani de la etiqueta ""extrema"" que aplican a los conservadores","Los medios liberales & apos;s doble estándar expuesto como ABC, CBS, y NBC enmarcan candidato a alcalde socialista Mamdani como & apos; carismático & apos; mientras ignora sus posiciones controvertidas",BIAS BROADCAST: Les réseaux protègent les socialistes de New York Mamdani du label 'extreme' qu'ils appliquent aux conservateurs,"Les médias libéraux ont deux poids, deux mesures exposées comme ABC, la CBS et la CCB encadrent le candidat mayoral socialiste Mamdani comme &apos;charismatic&apos; tout en ignorant ses positions controversées",BROADCAST BIAS:网络保护NYC社会主义的Mamdani免受适用于保守派的“极端”标签的“极端”标签。,"自由媒体&apos; 以ABC、 CBS 和 NBC 框架暴露的双重标准, 如ABC、 CBS 和 NBC 框架社会主义市长候选人 Mamdani 以 &apos; charismatic&apos; 无视他有争议的立场"
70,"1980s child star talks 'Goonies' sequel, music career, and why AI threatens Hollywood's ‘magic’","Actor Corey Feldman reflected on 50 years in entertainment, sharing fears about AI&apos;s impact on Hollywood, his music career, and insights on &quot;The Goonies&quot; sequel.","1980er Kinderstar spricht ""Goonies"" Fortsetzung, Musikkarriere und warum KI Hollywoods ""Magie"" bedroht","Schauspieler Corey Feldman reflektierte über 50 Jahre Unterhaltung, teilte Ängste über AI&apos;s Auswirkungen auf Hollywood, seine Musikkarriere und Einblicke auf &quot;The Goonies&quot; Fortsetzung.","La estrella infantil de la década de 1980 habla de la secuela de ""Goonies"", la carrera musical y por qué AI amenaza la ""magia"" de Hollywood","El actor Corey Feldman reflexionó sobre 50 años de entretenimiento, compartiendo miedos sobre el impacto de AI&apos en Hollywood, su carrera musical, y las ideas sobre &quot;The Goonies&quot; secuela.","Les années 1980 enfant star parle 'Goonies' suite, carrière musicale, et pourquoi AI menace Hollywood 'magique","L'acteur Corey Feldman a réfléchi sur 50 ans de divertissement, partageant des craintes au sujet de l'impact de l'IA&apos sur Hollywood, sa carrière musicale et ses idées sur &quot;The Goonies&quot; suite.","1980年代, 儿童明星在演讲续集、音乐生涯以及为什么AI威胁好莱坞的“魔术”时,","Actor Corey Feldman在娱乐界思考了50年, 分享了对AI&apos的恐惧; 对好莱坞的影响, 他的音乐事业, 以及对 & quot; The Goonies & quot; 续集的洞察力。"
71,Diver who freed sharks gets Trump pardon after felony conviction stuns him: 'My heart sank',"Trump pardons Florida diver who faced felony charges after cutting a longline and releasing 19 sharks, believing he was stopping illegal fishing activity.","Taucher, der Haie befreit, bekommt Trump begnadigt, nachdem ihn die Verurteilung des Verbrechens betäubt: 'Mein Herz sank'","Trump begnadigt Florida Taucher, die Verbrechensvorwürfe konfrontiert nach dem Schneiden einer Longline und Freigabe 19 Haie, glauben, dass er illegale Fischereitätigkeit zu stoppen.","El buzo que liberó a los tiburones consigue el perdón de Trump después de que la condena por delito le aturda: ""Mi corazón se hundió""","Trump perdona a un buceador de Florida que se enfrentó a cargos por delitos graves después de cortar una palangre y liberar a 19 tiburones, creyendo que estaba deteniendo la actividad pesquera ilegal.",Le plongeur qui a libéré les requins obtient le pardon Trump après une condamnation pour crime l'étourdit: 'Mon coeur a coulé',"Trump pardonne le plongeur de Floride qui a été accusé de crime après avoir coupé une palangre et libéré 19 requins, croyant qu'il arrêtait l'activité de pêche illégale.","释放鲨鱼的分歧者在被判重罪后获得特朗普特朗普特赦令,","特朗普赦免佛罗里达潜水员, 他因切下延绳和释放19条鲨鱼而面临重罪指控, 认为他正在阻止非法捕鱼活动。"
72,Wayfair's Fourth of July sale: Up to 70% off summer outdoor essentials and more,"Wayfair&apos;s Fourth of July sale is your chance to score fantastic deals on everything you need to set the scene for summer fun, from patio furniture and home decor to cozy new bedding and much more.",Wayfair's Vierte Juli-Verkauf: Bis zu 70% off Sommer Outdoor Essentials und mehr,"Wayfair&apos;s Vierte Juli-Verkauf ist Ihre Chance, fantastische Angebote auf alles, was Sie brauchen, um die Szene für Sommerspaß, von Terrassenmöbeln und Wohneinrichtung, gemütliche neue Bettwäsche und vieles mehr.",La venta del 4 de julio de Wayfair: Hasta un 70% de descuento en lo esencial del verano al aire libre y más,"Wayfair&apos;s La venta del 4 de julio es su oportunidad de anotar ofertas fantásticas en todo lo que necesita para establecer la escena para la diversión del verano, desde muebles de patio y decoración del hogar a ropa de cama nueva y acogedora y mucho más.",Vente du 4 juillet de Wayfair : jusqu'à 70 % de l'essentiel extérieur de l'été et plus,"Wayfair&apos;s Quatrième de la vente Juillet est votre chance de marquer des offres fantastiques sur tout ce dont vous avez besoin pour mettre la scène pour le plaisir d'été, du mobilier patio et de la décoration de la maison à la nouvelle literie confortable et beaucoup plus.",Wayfair的七月四四日销售: 高达70%的暑假户外基本必需品及更多,"Wayfair&apos;s Fourth of July Proferal;s 7月4日的销售,是你们在任何你需要的东西上取得绝佳交易的机会, 来为夏季的乐趣设置场景, 从庭院家具和家居装饰品到舒适的新床铺等等。"
73,How psychiatry and activism created the dangerous concept of 'transgender children',"The &quot;transgender children&quot; concept emerged from psychiatry, transforming gender nonconformity into a medical condition despite evidence most would naturally grow up gay or lesbian","Wie Psychiatrie und Aktivismus das gefährliche Konzept von ""Transgender Children"" schufen","Das Konzept von &quot;transgender children&quot; entstand aus der Psychiatrie und verwandelte Geschlechterunkonformität in einen medizinischen Zustand, obwohl die meisten Beweise natürlich schwul oder lesbisch aufwachsen würden.","Cómo la psiquiatría y el activismo crearon el peligroso concepto de ""niños transgénero""","El concepto de &quot;transgender children&quot; surgió de la psiquiatría, transformando la inconformidad de género en una condición médica a pesar de la evidencia, la mayoría naturalmente crecería gay o lesbiana.",Comment la psychiatrie et l'activisme ont créé le concept dangereux de «enfants transgenres»,"Le concept « &quot;transgender children&quot; » est né de la psychiatrie, transformant la non-conformité entre les sexes en une condition médicale malgré les preuves que la plupart d'entre eux grandissent naturellement gays ou lesbiennes.",精神病学和激进主义如何创造了危险的“儿童变性”概念。,"& quot; 将儿童与quot; 概念从精神病学中产生, 将性别不兼容化转化为医疗条件, 尽管有证据证明大多数会自然长成男同性恋者或女同性恋者"
74,"Ingredient in common kitchen herbs could target Alzheimer's, but don't change any recipes just yet","A study revealed carnosic acid in herbs may help combat Alzheimer&apos;s by reducing inflammation and improving brain cell connections, but cooking with herbs alone won&apos;t provide benefits just yet.","Ingredient in gemeinsamen Küchenkräuter könnte Alzheimer Ziel, aber ändern Sie keine Rezepte nur noch","Eine Studie ergab, dass Carnosinsäure in Kräutern helfen kann, Alzheimer&apos zu bekämpfen;s durch die Verringerung von Entzündungen und die Verbesserung der Gehirnzellverbindungen, aber Kochen mit Kräutern allein won&apos;t bieten Vorteile gerade noch.","Ingrediente en las hierbas comunes de la cocina podría apuntar Alzheimer, pero no cambiar ninguna receta todavía","Un estudio reveló que el ácido carnosico en las hierbas puede ayudar a combatir el Alzheimer&apos;s al reducir la inflamación y mejorar las conexiones de las células cerebrales, pero cocinar con solo hierbas won&apos;t proporcionar beneficios por el momento.","L'ingrédient dans les herbes de cuisine communes pourrait cibler Alzheimer, mais ne changez pas de recettes tout de suite","Une étude a révélé que l'acide carnosique dans les herbes peut aider à combattre la maladie d'Alzheimer en réduisant l'inflammation et en améliorant les connexions des cellules cérébrales, mais la cuisson avec des herbes seules won&apos;t procure des avantages tout de suite.","常见的厨房草药草本中的成分 可能针对阿尔茨海默氏症, 但不要改变任何食谱","一项研究发现,药草中的碳酸可能会通过减少炎症和改善脑细胞连接来帮助防治阿尔茨海默氏病和阿波斯病,但仅仅用草药做饭就能够带来好处。"
75,"Yale scholarship discriminating based on race, civil rights complaint alleges","The Equal Protection Project is challenging Yale and AAAP over REACH minority program that limits eligibility based on race, following President Trump&apos;s crackdown on DEI programs.","Yale-Stipendium diskriminieren basierend auf Rasse, Bürgerrechtsklage behauptet","Das Equal Protection Project fordert Yale und AAAP gegenüber REACH-Minderheitsprogramm heraus, das die Teilnahmeberechtigung auf der Grundlage von Rennen begrenzt, nachdem Präsident Trump&apos;s die DEI-Programme niedergeschlagen hat.","Beca de Yale discriminación por motivos de raza, denuncia de derechos civiles","El Equal Protection Project está desafiando a Yale y AAAP sobre el programa minoritario REACH que limita la elegibilidad en base a la raza, después de la represión del presidente Trump&apos en los programas DEI.","Bourse Yale discriminant en raison de la race, plainte en matière de droits civils","Le projet d'égalité de protection lance un défi à Yale et à l'AAAP au sujet du programme des minorités REACH qui limite l'admissibilité en fonction de la race, à la suite de la répression du président Trump&apos sur les programmes de DEI.","以种族为由进行歧视的耶鲁大学奖学金,民权申诉指称","总统特朗普和阿波斯(Trump&apos); 镇压DEI(DEI)计划后, 平等保护计划正在挑战耶鲁和AAAP,"
76,AOC's claimed Bronx identity called 'bold-face lie' by former schoolmate turned NY assemblyman,"New York Assemblyman Matt Slater shared a yearbook photo of Rep. Alexandria Ocasio-Cortez, calling her &apos;Bronx girl&apos; identity into question.","AOCs behauptete, Bronx-Identität, genannt ""bold-face-lüge"" von ehemaligen Schulkameraden verwandelt NY Versammlungsmann",New York Assemblyman Matt Slater teilte ein Jahrbuch Foto von Rep. Alexandria Ocasio-Cortez und nannte sie &apos;Bronx girl&apos; Identität in Frage.,"La AOC afirmó que la identidad del Bronx llamada ""mentira de cara fría"" por un ex compañero de escuela convertido en asambleísta de NY","El asambleísta de Nueva York Matt Slater compartió una foto del anuario de la representante Alexandria Ocasio-Cortez, llamando a su &apos;Bronx chica&apos; identidad en cuestión.",L'identité Bronx revendiquée par l'AOC s'appelle le « mensonge frontal » par un ancien camarade de classe devenu député de NY,"Le député de New York, Matt Slater, a partagé une photo de l'annuaire de la Rep. Alexandria Ocasio-Cortez, l'appelant &apos;Bronx girl&apos; identité en question.","AOC声称的布朗克斯身份 叫做""假脸谎言"" 前校友改成纽约组装员","纽约议员马特·斯莱特分享了亚历山大·奥卡西奥-科尔特斯共和国的年鉴照片,其中称她为&apos;Bronx girl&apos; 身份受到质疑。"
77,Marco Rubio holds first meeting with families of hostages held by Hamas,U.S. Secretary of State Marco Rubio held his first official meeting with the families of the hostages still held by Hamas in Gaza amid the terror group&apos;s ongoing war with Israel.,Marco Rubio trifft sich zum ersten Mal mit Geiselfamilien der Hamas,"Der US-Außenminister Marco Rubio hielt sein erstes offizielles Treffen mit den Familien der Geiseln ab, die die Hamas noch in Gaza inmitten der Terrorgruppe u.a.",Marco Rubio se reúne por primera vez con familias de rehenes retenidos por Hamas,"El Secretario de Estado de Estados Unidos, Marco Rubio, celebró su primera reunión oficial con las familias de los rehenes aún retenidos por Hamas en Gaza en medio del grupo terrorista & apos; la guerra en curso con Israel.",Marco Rubio tient sa première réunion avec des familles d'otages détenues par le Hamas,"Marco Rubio, secrétaire d'État des États-Unis, a tenu sa première réunion officielle avec les familles des otages toujours détenus par le Hamas à Gaza au milieu du groupe terroriste et de la guerre en cours avec Israël.",Marco Rubio与哈马斯扣押的人质家属举行第一次会议,美国国务卿马尔科·鲁比奥首次与哈马斯在加沙恐怖集团与以色列持续交战时仍扣留的人质家属举行正式会晤。
78,How a Trump rally turned this former cop into a conservative Youtube star,YouTuber and former police officer Brandon Tatum spoke with Fox News Digital about how he became one of the leading voices in the conservative movement today.,Wie eine Trump-Rallye diesen ehemaligen Cop in einen konservativen Youtube-Star verwandelte,"YouTuber und ehemaliger Polizist Brandon Tatum sprachen mit Fox News Digital darüber, wie er heute zu einer der führenden Stimmen in der konservativen Bewegung wurde.",Cómo un mitin de Trump convirtió a este ex policía en una estrella conservadora de Youtube,El YouTuber y el ex agente de policía Brandon Tatum hablaron con Fox News Digital sobre cómo se convirtió en una de las voces líderes en el movimiento conservador de hoy.,Comment un rallye Trump a transformé cet ancien flic en une star de Youtube conservatrice,YouTuber et l'ancien policier Brandon Tatum ont parlé avec Fox News Digital de la façon dont il est devenu l'une des principales voix du mouvement conservateur aujourd'hui.,一次特朗普集会如何将这位前警察 变成一个保守的Youtube明星,"YouTuber和前警官Brandon Tatum与Fox News Digital谈到他如何成为保守运动的主要声音之一,"
79,Final day of SCOTUS decisions brings wave of history-making rulings,The Supreme Court&apos;s last decision day of its term involved the justices reining in judicial power and serving up a victory for parents in the ongoing culture wars.,Der letzte Tag der SCOTUS-Entscheidungen bringt Welle von historischen Entscheidungen,"Der Oberste Gerichtshof u. a., der letzte Entscheidungstag seiner Amtszeit, beinhaltete, dass die Richter in die Justiz eintraten und den Eltern einen Sieg in den andauernden Kulturkriegen darbrachten.",El último día de las decisiones del SCOTUS trae una ola de decisiones históricas,"El último día de su mandato, la Corte Suprema de Justicia & Apos, involucró a los jueces que controlaban el poder judicial y servían una victoria para los padres en las guerras culturales en curso.",Le dernier jour des décisions SCOTUS apporte une vague de décisions historiques,"Le dernier jour de son mandat, la Cour suprême et la Cour suprême ont décidé que les juges résidaient dans le pouvoir judiciaire et serviraient une victoire pour les parents dans les guerres culturelles en cours.",SCOTUS决定的最后一天带来一波历史创造裁决,最高法院和最高法院;其任期的最后裁决日涉及法官控制司法权力和在正在进行的文化战争中为父母争取胜利。
80,Germany remains reliable partner in the fight against global diseases,"Germany will continue to support global efforts to protect people from preventable diseases. Today in Brussels, at the replenishment conference for Gavi, the Vaccine Alliance, German Development Minister Reem Alabali Radovan will pledge a total of 600 million euros for the period up to 2030.",Deutschland bleibt verlässlicher Partner im Kampf gegen globale Krankheiten,Deutschland wird die weltweiten Bemühungen um den Schutz von Menschen vor vermeidbaren Krankheiten weiter unterstützen. Heute wird der deutsche Entwicklungsminister Reem Alabali Radovan in Brüssel auf der Wiederauffüllungskonferenz für Gavi bis 2030 insgesamt 600 Millionen Euro versprechen.,Alemania sigue siendo un socio fiable en la lucha contra las enfermedades mundiales,"Alemania seguirá apoyando los esfuerzos mundiales para proteger a las personas de las enfermedades prevenibles. Hoy, en Bruselas, en la conferencia de reposición para Gavi, la Alianza de Vacunas, el ministro de Desarrollo alemán Reem Alabali Radovan se comprometerá a un total de 600 millones de euros para el período hasta 2030.",L'Allemagne reste un partenaire fiable dans la lutte contre les maladies mondiales,"L'Allemagne continuera à soutenir les efforts mondiaux de protection des personnes contre les maladies évitables. Aujourd'hui, à Bruxelles, lors de la conférence de reconstitution pour Gavi, l'Alliance Vaccine, le ministre allemand du Développement, Reem Alabali Radovan, promettra un total de 600 millions d'euros pour la période allant jusqu'à 2030.",德国在防治全球疾病的斗争中仍然是可靠的伙伴,"德国将继续支持保护人们免受可预防疾病影响的全球努力。 今天,在布鲁塞尔举行的加维(Gavi)补充会议上,德国发展部长雷姆·阿拉巴利·拉多万(Reem Alabali Radovan)将为2030年之前的时期认捐总额6亿欧元。"
81,180 new municipal partnerships formed between Germany and Ukraine since start of Russia’s war of aggression,"The German-Ukraine Municipal Partnership Network has grown from 70 to 250 partnerships since Russia’s war of aggression against Ukraine began in 2022. Around 700 mayors, city councillors and district leaders from Germany, Ukraine and other European countries are meeting in Münster today. The conference is being organised by the Federal Ministry for Economic Cooperation and Development (BMZ) and the City of Münster.",180 neue kommunale Partnerschaften zwischen Deutschland und der Ukraine seit Beginn des Angriffskrieges Russlands,"Das deutsch-ukrainische Städtepartnerschaftsnetz ist seit dem Angriffskrieg gegen die Ukraine 2022 von 70 auf 250 Partnerschaften gewachsen. Rund 700 Bürgermeister, Stadträte und Bezirksführer aus Deutschland, der Ukraine und anderen europäischen Ländern treffen sich heute in Münster. Die Konferenz wird vom Bundesministerium für wirtschaftliche Zusammenarbeit und Entwicklung (BMZ) und der Stadt Münster organisiert.",180 nuevas asociaciones municipales formadas entre Alemania y Ucrania desde el inicio de la guerra de agresión de Rusia,"La Red de Asociaciones Municipales entre Alemania y Ucrania ha pasado de 70 a 250 asociaciones desde que comenzó la guerra de agresión de Rusia contra Ucrania en 2022. Alrededor de 700 alcaldes, concejales y líderes de distrito de Alemania, Ucrania y otros países europeos se reúnen hoy en Münster. La conferencia está siendo organizada por el Ministerio Federal de Cooperación Económica y Desarrollo (BMZ) y la ciudad de Münster.",180 nouveaux partenariats municipaux formés entre l'Allemagne et l'Ukraine depuis le début de la guerre d'agression russe,"Le réseau de partenariat municipal entre l'Allemagne et l'Ukraine est passé de 70 à 250 partenariats depuis le début de la guerre d'agression contre l'Ukraine en 2022. Environ 700 maires, conseillers municipaux et chefs de district d'Allemagne, d'Ukraine et d'autres pays européens se réunissent aujourd'hui à Münster. La conférence est organisée par le ministère fédéral de la Coopération et du Développement économique (BMZ) et la ville de Münster.","自俄罗斯侵略战争开始以来,德国和乌克兰之间建立了180个新的城市伙伴关系","自2022年俄罗斯对乌克兰发动侵略战争以来,德国-乌克兰城市伙伴关系网络从70个发展到250个伙伴关系。 来自德国、乌克兰和其他欧洲国家的约700名市长、市议员和地区领导人今天正在明斯特举行会议。 会议由联邦经济合作与发展部(BMZ)和明斯特市组织。"
82,"At Hamburg Sustainability Conference, participants from across the world provide input and strengthen international cooperation","Today is the final day of the second Hamburg Sustainability Conference. German Development Minister Reem Alabali Radovan, who opened the Conference on Monday, has exchanged ideas with partners from all over the world on how to make international climate action work, use artificial intelligence responsibly and build a just world economy. Participants have formed numerous alliances on these and other sustainability issues.",Auf der Hamburg Sustainability Conference leisten Teilnehmer aus aller Welt Input und stärken die internationale Zusammenarbeit,"Heute ist der letzte Tag der zweiten Hamburg Sustainability Conference. Bundesentwicklungsminister Reem Alabali Radovan, der die Konferenz am Montag eröffnet hat, hat sich mit Partnern aus aller Welt darüber ausgetauscht, wie internationaler Klimaschutz funktioniert, künstliche Intelligenz verantwortungsvoll genutzt und eine gerechte Weltwirtschaft aufgebaut werden kann.","En la Conferencia de Sostenibilidad de Hamburgo, participantes de todo el mundo aportan su contribución y fortalecen la cooperación internacional","Hoy es el último día de la segunda Conferencia de Sostenibilidad de Hamburgo. El Ministro de Desarrollo de Alemania, Reem Alabali Radovan, quien inauguró la Conferencia el lunes, ha intercambiado ideas con socios de todo el mundo sobre cómo hacer que la acción climática internacional funcione, utilizar la inteligencia artificial de manera responsable y construir una economía mundial justa.","À la Conférence de Hambourg sur la durabilité, les participants du monde entier apportent leur contribution et renforcent la coopération internationale","Le ministre allemand du Développement, Reem Alabali Radovan, qui a ouvert la Conférence lundi, a échangé des idées avec des partenaires du monde entier sur la façon de faire fonctionner l'action climatique internationale, d'utiliser l'intelligence artificielle de manière responsable et de construire une économie mondiale juste. Les participants ont formé de nombreuses alliances sur ces questions et d'autres questions de durabilité.","在汉堡可持续性会议上,来自世界各地的与会者提供投入并加强国际合作","今天是第二次汉堡可持续性会议的最后一天,德国发展部长Reem Alabali Radovan于星期一宣布会议开幕,他与世界各地的伙伴就如何使国际气候行动发挥作用、负责任地使用人工智能和建立一个公正的世界经济交换了意见,与会者在这些和其他可持续性问题上结成了许多联盟。"
