,title-de,content-de,title-en,content-en,title-zh,content-zh
0,"Pistorius in Kyjiw: ""Wir stehen weiter zur Ukraine""",Bei seinem Besuch in Kyjiw verspricht Deutschlands Verteidigungsminister Boris Pistorius weitere Kooperationen bei der Rüstung. Und lässt sich den Ärger über seine Partei SPD nicht anmerken.,"Pistorius in Kyiv: ""We continue to Ukraine""","During his visit to Kyyiv, Germany's Minister of Defence Boris Pistorius promises further cooperation in the armaments field. And the anger about his party SPD cannot be noted.","皮斯托雷斯在京城 说""我们继续前往乌克兰""","德国国防部长鲍里斯·皮斯托里乌斯访问基吉时,他承诺在盔甲上进一步合作. 而且他对党内社民党的愤怒也无从得知."
1,OECD zeigt Deutschland Weg aus Wirtschaftsflaute auf,Die Organisation für wirtschaftliche Zusammenarbeit und Entwicklung fordert von Deutschland mehr Mut zu Reformen. Für 2026 fällt die Konjunkturprognose der OECD immerhin besser aus als in den vergangenen Jahren.,OECD shows Germany's way out of economic sluggishness,"The Organisation for Economic Cooperation and Development calls for more courage from Germany to reform. For 2026, the OECD's economic forecast is, after all, better than in recent years.",经合组织代表德国走出经济困境的路线,"经济合作与发展组织需要德国的改革勇气. 在2026年,经合组织预测的效果比过去几年要好得多."
2,DFB-Frauen: Bundestrainer Christian Wück nominiert EM-Kader,"Bundestrainer Christian Wück setzt bei der EURO 2025 in der Schweiz auf Erfahrung. Die Spielerinnen, die zuletzt wegen schlechter Kommunikation Kritik an ihm geübt haben, sind nicht dabei.",DFB women: Bundestrainer Christian Wück nominated EM-Kader,"Bundestrainer Christian Wück relies on experience at the EURO 2025 in Switzerland. The players, who have recently practiced criticism of him due to poor communication, are not present.",DFB女性: 联邦训练师克里斯汀·威格被提名为EM卡德,国家教练克里斯汀·威格在2025年在瑞士欧盟国家取得经验. 那些最近因沟通不佳而对他进行批评的球员们没有参与其中.
3,Air-India-Flugzeug nach Start abgestürzt – viele Todesopfer,Nahe dem Flughafen der Millionenstadt Ahmedabad ist eine Dreamliner-Maschine der indischen Fluggesellschaft Air India abgestürzt. An Bord waren nach Behördenangaben mehr als 240 Menschen.,Air India plane crashed after take-off – many fatalities,"Near the airport of the million city Ahmedabad, a Dreamliner aircraft of the Indian airline Air India crashed. According to the authorities, more than 240 people were on board.","起飞后,印度航空飞机在起飞后坠毁 死伤惨重",印度航空公司的梦游飞机坠毁在了百万城市艾哈迈德堡的机场附近. 飞机上载有240多人.
4,Atomstreit mit Iran: USA befürchten Eskalation in Nahost,Der Streit um das iranische Atomprogramm spitzt sich zu. Spekuliert wird über einen baldigen Angriff auf die Nuklearanlagen der Islamischen Republik. Die USA ziehen ihre Konsequenzen daraus.,Nuclear dispute with Iran: USA fears escalation in the Middle East,The dispute over Iran's nuclear program is intensifying. Speculated is an early attack on the Islamic Republic's nuclear facilities. The US is drawing its conclusions.,与伊朗的核战争:美国担心中东升级,关于伊朗核计划的争执越来越激烈了. 估计不久就会发生针对伊斯兰共和国核设施的袭击. 美国正在考虑其后果.
5,UN-Bericht: Mehr als 122 Millionen Menschen auf der Flucht,Die Zahl der geflüchteten Menschen weltweit ist nach Berechnungen der Vereinten Nationen auf Rekordhoch. Drei Länder sind von besonders großen Konflikten betroffen.,UN Report: More than 122 million people on the run,"According to United Nations calculations, the number of refugees worldwide is record high. Three countries are affected by particularly large conflicts.",联合国报告: 1122多万人在逃.,世界各地的逃难者数量根据联合国的计算是创纪录的. 三个国家受到重大冲突的影响.
6,News kompakt: Verteidigungsminister Pistorius in der Ukraine,Der deutsche Verteidigungsminister berät in der Ukraine über weitere Militärhilfe. Die USA reduzieren aus Sicherheitsgründen ihr Personal im Nahen Osten. Das Wichtigste in Kürze.,News compact: Defense Minister Pistorius in Ukraine,The German Minister of Defence is advising Ukraine on further military aid. The US is reducing its personnel in the Middle East for security reasons.,最新消息: 乌克兰的国防部长皮斯托里斯,"德国国防部长正在乌克兰讨论进一步的军事援助问题. 为了安全起见,美国正在减少中东的人员. 最重要的是,很快."
7,Türkei: Diyanet darf Koranübersetzungen zensieren,"Die türkische Religionsbehörde Diyanet kann nun Koranübersetzungen verbieten, die ihrer Ansicht nach nicht den Grundsätzen des Islam entsprechen. Das sorgt für Kritik und schürt Sorgen um die Glaubensfreiheit.",Turkey: Diyanet is allowed to censor Koranic translations,"The Turkish religious authority Diyanet can now ban Koran translations which, in their opinion, do not comply with the principles of Islam. This provides criticism and stirs up concerns about freedom of belief.","土耳其: 迪安特允许""古兰经""翻译翻译","土耳其宗教局现在可以禁止""古兰经""的翻译,而""古兰经""与伊斯兰教原则不符. 这会引起批评并引起对宗教自由的关注."
8,Polen: Tusk trotz gewonnener Vertrauensfrage angeschlagen,Nach der Niederlage seines Kandidaten bei der Präsidentenwahl stellt Premier Donald Tusk die Vertrauensfrage als Befreiungsschlag. Trotz gewonnener Abstimmung bleibt seine Koalitionsregierung angeschlagen.,Poland: Tusk battered in spite of the confidence issue,"After the defeat of his candidate in the presidential election, Prime Minister Donald Tusk raises the question of confidence as a blow to liberation. Despite the won vote, his coalition government remains battered.","波兰: Tusk 尽管赢得信任,但仍继续攻击波兰","唐纳德·塔斯克在总统选举中败北后 把信任问题作为解放的攻击. 尽管投票获胜了,但联合政府仍未倒台."
9,SPD-Manifest fordert Wiederannäherung an Russland,Eklat in der SPD: Prominente Politiker stellen die Außen- und Sicherheitspolitik der eigenen Parteispitze in Frage - und damit die der Regierung.,SPD Manifesto calls for a new approach to Russia,Eclat in the SPD: Prominent politicians question the foreign and security policy of their own party leaders - and thus that of the government.,社民党管理层要求俄罗斯重新接近,"社民党的Eklat:名人政客对党内领导人的外交和安全政策提出质疑,从而对政府提出质疑."
10,Indien: Mehr Extremwetterlagen infolge des Klimawandels,Extreme Wetterereignisse treten laut einer aktuelle Studie in Indien immer häufiger auf und beeinträchtigen drastisch die Lebensqualität.,India: More extreme weather conditions due to climate change,"According to a recent study in India, extreme weather events are becoming more and more common and dramatically affect the quality of life.",印度:气候变化导致的极端气温增加,"根据最新印度的一项研究,极端天气事件日益频繁,严重影响着生活质量"
11,"Afghanistan: Angst vor Abschiebungen in ein ""sicheres"" Land","In Afghanistan herrsche Sicherheit, behaupten die Taliban - und rufen geflüchtete Afghanen zur Rückkehr auf. Doch Hunger, Armut und Angst bestimmen den Alltag, besonders für Mädchen.","Afghanistan: Fear of deportations to a ""safe"" country","In Afghanistan, security prevails, the Taliban asserts, and calls on refugees to return, but hunger, poverty, and fear determine everyday life, especially for girls.","阿富汗:害怕被驱逐到""安全""国家","在阿富汗,塔利班宣称他们正在召唤阿富汗人返回家园. 但饥饿,贫穷和恐惧决定着日常生活,特别是女孩."
12,Compact-Verbot: Wo endet in Deutschland die Pressefreiheit?,"Am 24. Juni entscheidet das Bundesverwaltungsgericht, ob das rechtsextreme Compact-Magazin weiter erscheinen darf. Für kurze Zeit war es schon mal verboten.",Compact ban: Where does freedom of the press end in Germany?,"On 24 June, the Federal Administrative Court decided whether the far-right Compact magazine could continue to appear. For a short time, it was already forbidden.",新闻自由在德国在哪里结束?,"6月24日,联邦政府法庭决定 极右翼的""合作""杂志是否可以继续出现. 它曾经被禁止过一段时间."
13,EU am Scheideweg: Großkonzerne for Future?,Ein Reihe europäischer Großunternehmen fordern von der EU mehr Klarheit beim Klimaschutz und schnellere Umsetzung von Nachhaltigkeits-Zielen. Wie viel Eigeninteresse steckt dahinter?,EU at the crossroads: large corporations for future?,A number of European large companies are calling for more clarity in climate protection and faster implementation of sustainability targets. How much self-interest is behind this?,欧盟的十字路口是大前沿企业吗?,"几家欧洲大公司要求欧盟在气候变化问题上更加明确,加快实现可持续发展目标. 究竟有什么利益呢?"
14,Drei Weltrekorde: Summer McIntosh schwimmt allen davon,Die Kanadierin Summer McIntosh knackt bei den nationalen Schwimm-Meisterschaften innerhalb von fünf Tagen drei Weltrekorde. Mit erst 18 Jahren hat sie schon einige Einträge in den Geschichtsbüchern des Sports.,Three world records: Summer McIntosh swims away,Canadian Summer McIntosh scores three world records in the national swimming championships within five days. At the age of only 18 she already has some entries in the history books of sports.,三大世界纪录: 夏季麦金托许游过所有水域,"加拿大人萨默·麦克塔什 (Summer McIntosh) 在五天内在全国游泳冠军赛上打破三场世界纪录. 18岁以前,她已经在体育史册上写过几篇了."
15,Spanien: Wieder Proteste gegen Massentourismus,"Überfüllte Innenstädte, Wohnungsnot, Verdrängung der Einheimischen: Bürger demonstrieren gegen Auswüchse des Tourismus. Airbnb gerät stärker in den Fokus.",Spain: Protests against mass tourism again,"Overcrowded inner cities, housing shortages, displacement of the locals: citizens demonstrate against the excesses of tourism. Airbnb gets more into the focus.",西班牙:再次反对大规模旅游活动,"拥挤的国内城市,住房危机,当地居民的限制:公民抗议旅游业的暴乱. 空降兵更集中了注意力."
16,Bundesentwicklungsministerin Alabali Radovan zum UNHCR-Weltflüchtlingsbericht,"Ministerin Alabali Radovan: „Kein Mensch flieht freiwillig. 122 Millionen Menschen sind weltweit auf der Flucht vor Kriegen, Krisen und Verfolgung – so viele wie nie zuvor. Die meisten Menschen wollen möglichst nahe ihrer Heimat bleiben, sie suchen entweder im eigenen Land oder in Nachbarstaaten Zuflucht. Es sind Länder wie Jordanien, der Libanon, Äthiopien oder Kenia, die die Hauptlast schultern und dabei Enormes leisten. Doch vielerorts fehlt es an Unterkünften, Jobs, an medizinischer Versorgung und Schulen für die Kinder. Mit der deutschen Entwicklungszusammenarbeit unterstützen wir die Aufnahmeländer, damit sie Geflüchtete gut versorgen und ihnen Perspektiven bieten können. (...)""",Federal Minister for Development Alabali Radovan on the UNHCR World Refugee Report,"Minister Alabali Radovan: ""No human is fleeing voluntarily. 122 million people worldwide are fleeing wars, crises and persecution – more than ever before. Most people want to stay as close to their homeland as possible, they seek refuge either in their own country or in neighbouring countries. They are countries such as Jordan, Lebanon, Ethiopia or Kenya, which bear the main burden and do so in an enormous way. But in many places there is a lack of shelter, jobs, medical care and schools for the children. With German development cooperation, we support the host countries so that they can provide good care for refugees and offer them prospects. (...)""",联邦发展部长阿拉巴利·拉多万 难民专员办事处儿童报告,"内政部长阿拉巴利·拉多万: 没有人自愿逃离. 122百万人在世界各地逃避战争,危机和迫害. 多数人希望尽可能接近自己的家园,寻求庇护,要么留在自己的国家或邻国. 他们是像约旦,黎巴嫩,埃塞俄比亚或肯尼亚这样的国家,承担着主要负担,承担着教育责任. 但许多国家缺乏住所,工作,医疗保健和儿童学校. 德军发展合作有助于收容国,使他们能够很好地照顾他们,并且能展望他们. (...)"
17,Familienplanung weltweit unter Druck,"Ob und wie viele Kinder eine Frau kriegen soll oder darf – diese Frage wird weltweit immer mehr zum Politikum. Regierungen versuchen sowohl hohe Geburtenraten als auch sinkende Kinderzahlen mit politischen Maßnahmen zu beeinflussen. Damit schränken sie nicht nur häufig die Menschen in ihrer Freiheit zur Familienplanung ein, viele dieser Maßnahmen erreichen nur kurzfristige oder sogar gegenteilige Effekte.",Family planning worldwide under pressure,"Whether and how many children should or may have a wife – this question is becoming increasingly a political issue worldwide. Governments are trying to influence both high birth rates and falling numbers of children with political measures. Not only do they often restrict people in their freedom to plan families, many of these measures only achieve short-term or even opposite effects.",全世界家庭规划都在压力下进行,"政府试图通过政策措施来影响高出生率和降低儿童人数,不仅要限制他们为家庭计划的自由,而且许多措施只能在短期甚至反作用下实现."
18,Impulsgeber aus aller Welt stärken internationale Zusammenarbeit,"Heute geht die zweite Hamburger Nachhaltigkeitskonferenz, die „Hamburg Sustainability Conference 2025“, zu Ende. Entwicklungsministerin Reem Alabali Radovan, die die Konferenz am Montag eröffnete, hat in der Hansestadt mit Partnern aus aller Welt beraten, wie internationaler Klimaschutz, der verantwortungsvolle Einsatz künstlicher Intelligenz oder eine gerechte Weltwirtschaft gelingen können. Zu diesen und weiteren Nachhaltigkeitsthemen haben die Teilnehmenden zahlreiche Allianzen vereinbart.",Boosters from around the world strengthen international cooperation,"Today, the second Hamburg Sustainability Conference, the Hamburg Sustainability Conference 2025, comes to an end. Development Minister Reem Alabali Radovan, who opened the conference on Monday, has advised partners from all over the world in the Hanseatic city on how international climate protection, the responsible use of artificial intelligence or a just global economy can succeed. On these and other sustainability issues, the participants have agreed on numerous alliances.",世界各地的推动者正在加强国际合作,"今天,第二次汉堡可持续发展会议2025年即将结束. 周一开幕的发展部长雷姆·阿拉巴利·拉多万在汉斯城与世界各地的伙伴们讨论了国际气候保护,负责任地使用人工智能或公平的全球经济的可行性. 在这些问题和其他可持续性问题上,一些联盟达成了一致."
19,Hamburg Sustainability Conference vereint eine Welt im Umbruch für nachhaltige Zukunftsallianzen,"Am 2. und 3. Juni 2025 findet die Hamburg Sustainability Conference (HSC) statt. Zum zweiten Mal bringt die Konferenz hochrangige Vertreterinnen und Vertreter aus Politik, Wissenschaft, Wirtschaft, Zivilgesellschaft und internationalen Organisationen in Hamburg zusammen – mit dem Ziel, Allianzen für die nachhaltige Entwicklung zu schmieden und die Umsetzung der Agenda 2030 der Vereinten Nationen entscheidend voranzubringen.",Hamburg Sustainability Conference brings together a world in transition for sustainable future alliances,"The Hamburg Sustainability Conference (HSC) will take place on 2 and 3 June 2025. For the second time, the conference will bring together high-ranking representatives from politics, science, business, civil society and international organisations in Hamburg with the aim of forging alliances for sustainable development and decisively advancing the implementation of the United Nations 2030 Agenda.",汉堡可持续发展会议将统一一个为可持续未来贡献的世界,"2025年6月2日和3日,汉堡可持续发展会议 (HSC) 于2025年6月2日和3日举行. 第二次会议将高级代表和政治,科学,经济,民间社会和国际组织的代表联合起来,建立可持续发展联盟,并推动联合国2030年议程的执行."
20,Deutschland tritt ein für Nachhaltigkeit und multilaterale Lösungen,"Die Parlamentarische Staatssekretärin im Entwicklungsministerium (BMZ), Dr. Bärbel Kofler, ist zu einer fünftägigen Reise nach Côte d'Ivoire aufgebrochen. Dort findet ab heute die 60. Jahrestagung der afrikanischen Entwicklungsbank statt (AfDB). Im Mittelpunkt der Konferenz steht die Wahl einer neuen AfDB-Präsidentin / eines neuen -Präsidenten. Die Abstimmung hat eine besondere Bedeutung angesichts der großen Herausforderungen, vor denen der afrikanische Kontinent steht [...].",Germany advocates sustainability and multilateral solutions,"The Parliamentary State Secretary at the Ministry of Development (BMZ), Dr. Bärbel Kofler, has set out on a five-day trip to Côte d'Ivoire, where the 60th Annual Meeting of the African Development Bank (AfDB) will take place from today. The conference will focus on the election of a new AfDB President. The vote is particularly important given the major challenges facing the African continent [...].",德国支持可持续性和多边解决方案,"从今天开始,非洲开发银行60周年纪念 (AfDB) 将举行会议,选举一位新的总统/新任总统. 投票对于非洲大陆面临的重大挑战尤其重要."
21,Entwicklungsministerin Reem Alabali Radovan und UNICEF-Exekutivdirektorin Catherine Russell sprechen zur Lage der Kinder in Gaza,"Heute haben Entwicklungsministerin Reem Alabali Radovan und UNICEF-Exekutivdirektorin Catherine Russell im Rahmen eines Telefonates über die Lage der Kinder in Gaza gesprochen. Angesichts der sich weiter zuspitzenden Notlage waren sich beide einig, dass die Lage der Zivilbevölkerung und insbesondere der Kinder katastrophal ist und weitere Hilfslieferungen dringend bei den Menschen in Gaza ankommen müssen.",Development Minister Reem Alabali Radovan and UNICEF Executive Director Catherine Russell talk about the situation of children in Gaza,"Today, Development Minister Reem Alabali Radovan and UNICEF Executive Director Catherine Russell talked about the situation of the children in Gaza as part of a telephone call. In view of the increasing plight, both agreed that the situation of the civilian population, especially the children, is catastrophic and that further aid must urgently be delivered to the people of Gaza.",发展部长雷姆·阿拉巴利·拉多万 儿童基金会执行主任凯瑟琳·拉塞尔 (Catherine Russell) 为加沙儿童的境况发言,"今天,发展部长雷姆·阿拉巴利·拉多万和儿童基金会首席执行官凯瑟琳·拉塞尔 (Catherine Russell) 在电话中讨论了加沙儿童的境况. 由于情况不断恶化,双方都一致认为,平民,特别是儿童的境况是灾难性的,他们迫切需要向加沙人民提供更多的援助."
22,UN Women bezieht Büro in Bonn,"Seit April 2025 gibt es ein neues Büro der Vereinten Nationen in Bonn. Mit der Repräsentanz von UN Women arbeiten nun 27 Organisationen der UN auf dem Bonner UN Campus. Entwicklungsministerin Reem Alabali-Radovan betont: „Als erster Dienstsitz des Entwicklungsministeriums hat Bonn für die deutsche Entwicklungspolitik ohnehin schon eine besondere Bedeutung. Mit der Ansiedlung von UN Women wächst das Gewicht der Bundesstadt als Standort für die internationale Zusammenarbeit weiter. (...)""",UN Women moves to Bonn office,"Since April 2025, there has been a new United Nations office in Bonn. With the UN Women representative office, 27 UN organizations are now working on the UN campus in Bonn. Development Minister Reem Alabali-Radovan stresses: ""As the first official office of the Ministry of Development, Bonn is already of particular importance for German development policy. With UN Women's settlement, the weight of the federal city continues to grow as a location for international cooperation. (...)""",联合国在波恩的办公厅负责联合国妇女事务,"从2025年4月起,联合国在波恩成立了新的联合国办事处. 联合国妇女代表机构现已在波恩联合国校园工作27个组织. 发展部部长莱姆·阿拉巴里-拉多万强调,作为发展部首位官员,波恩已经对德国发展政策具有重大意义. 联合国在波恩的定居,联邦城市的重量继续增加,作为国际合作的地点. (...)"
23,"Ministerin Alabali Radovan zum Abschlussbericht der Kommission ""Welt im Umbruch – Deutschland und der Globale Süden""","Ministerin Alabali Radovan: „Der Bericht ist ein wertvoller Beitrag für eine bessere Politik. Er zeigt auf, was Deutschland tun kann, um sich auf die rasanten Veränderungen in der Welt einzustellen. Es geht darum, Deutschlands Platz in der Welt zu festigen. Dabei kommt es auf verlässliche Partnerschaften an, gerade auch mit den Ländern Afrikas, Asiens und Lateinamerikas. Die Entwicklungspolitik spielt dabei eine Schlüsselrolle. Sie ist gemeinsam mit Diplomatie und Verteidigungspolitik Teil einer umfassenden, ganzheitlich verstandenen deutschen Sicherheitspolitik. (...)""","Minister Alabali Radovan on the Commission's Final Report ""World in Transition – Germany and the Global South""","Minister Alabali Radovan: ""The report is a valuable contribution to a better policy. It shows what Germany can do to adapt to the rapid changes in the world. It is about consolidating Germany's place in the world. It depends on reliable partnerships, especially with the countries of Africa, Asia and Latin America. Development policy plays a key role here. Together with diplomacy and defence policy, it is part of a comprehensive, holistic German security policy. (...)""",阿拉巴利·拉多万部长 为德国和全球南方世界 世界大革命委员会的最后报告,"阿拉巴利·拉多万部长:这份报告是改善政策的宝贵贡献. 它显示德国可以做些什么来适应世界快速变化. 这是为了巩固德国在世界的地位. 这取决于与非洲,亚洲和拉丁美洲国家建立可靠的伙伴关系. 发展政策是关键的. 它与外交和国防政策一起,是全面理解的德国安全政策的一部分."
24,Außenminister Johann Wadephul und Entwicklungsministerin Reem Alabali Radovan zur Aufhebung aller Wirtschaftssanktionen gegen Syrien,"Auf dem heutigen Rat für Auswärtige Angelegenheiten in Brüssel haben die EU-Mitgliedsstaaten beschlossen, alle Wirtschaftssanktionen gegen Syrien aufzuheben. Dazu sagt Ministerin Alabali Radovan: „Das ist ein Moment der Hoffnung und des Neuanfangs für alle Syrerinnen und Syrer. Für einen erfolgreichen und friedlichen Neuanfang in Syrien kommt es entscheidend darauf an, dass die Wirtschaft anläuft und die Menschen sich mit dem Nötigsten versorgen können. Die Aufhebung der Sanktionen stärkt die Selbsthilfekräfte der syrischen Gesellschaft. (...)""",Minister of Foreign Affairs Johann Wadephul and Minister for Development Reem Alabali Radovan on the lifting of all economic sanctions against Syria,"At today's Foreign Affairs Council in Brussels, the EU member states decided to lift all economic sanctions against Syria. Minister Alabali Radovan said: ""This is a moment of hope and a new beginning for all Syrians. For a successful and peaceful new start in Syria, it is crucial that the economy starts and people can provide themselves with the most necessary supplies. The lifting of sanctions strengthens the self-help forces of Syrian society. (...)""",国务卿韦德福和发展部部长莱姆·阿拉巴利·拉多万 为了解除对叙利亚的一切经济制裁,"欧盟成员国在今天的布鲁塞尔外交事务理事会上决定取消对叙利亚的一切经济制裁. 为此,欧盟成员国决定取消对叙利亚的一切经济制裁. 内政部长阿拉巴利·拉多万说,这是叙利亚所有叙利亚妇女和叙利亚妇女的希望和重新开始的时刻. 叙利亚的成功,和平的复苏至关重要,必须是经济的成功,人民能够获得最需要的援助. 解除制裁有助于叙利亚社会的自力更生."
