,title-en,content-en,title-de,content-de,title-es,content-es,title-fr,content-fr,title-zh,content-zh
0,Putin unleashes a summer offensive to break Ukraine,His killing machine has been told to deliver a glorious victory at any cost,"Putin entfesselt eine Sommeroffensive, um die Ukraine zu brechen","Seine Tötungsmaschine wurde aufgefordert, um jeden Preis einen glorreichen Sieg zu erringen.",Putin desata una ofensiva de verano para romper Ucrania,Se le ha dicho a su máquina de matar que logre una victoria gloriosa a cualquier precio.,Poutine lance une offensive d'été pour briser l'Ukraine,Sa machine à tuer a été dit de livrer une victoire glorieuse à tout prix,"普京发动夏日攻攻,以摧毁乌克兰",他的杀人机器 奉命不惜一切代价 取得辉煌的胜利
1,Sending the National Guard to LA is not about stopping rioting,The city is being punished for resisting the Trump administration’s deportation efforts,"Die Nationalgarde nach L.A. zu schicken, geht nicht darum, Krawalle zu stoppen.","Die Stadt wird bestraft, weil sie der Trump-Administration Widerstand leistet.",Enviar a la Guardia Nacional a Los Ángeles no es parar los disturbios.,La ciudad está siendo castigada por resistirse a los esfuerzos de deportación de la administración Trump,Envoyer la Garde nationale à Los Angeles ne consiste pas à arrêter les émeutes,La ville est punie pour avoir résisté aux efforts de déportation de l'administration Trump,派国民警卫队去洛杉矶 不是为了阻止暴乱,"因为抵制特朗普政府驱逐行动,"
2,Can Tim Cook stop Apple going the same way as Nokia?,It’s time to tear up the rule book,Kann Tim Cook stoppen Apple gehen die gleiche Weise wie Nokia?,"Es ist Zeit, das Regelbuch aufzureißen",¿Puede Tim Cook dejar de Apple yendo de la misma manera que Nokia?,Es hora de romper el libro de reglas,Tim Cook peut-il arrêter Apple comme Nokia ?,C'est l'heure de déchirer le livre des règles,蒂姆·库克能阻止苹果和诺基亚一样吗?,是时候撕毁规则书了
3,Cover Story newsletter: How we chose the cover image,,Cover Story Newsletter: Wie wir das Coverbild gewählt haben,,Portada del boletín: Cómo elegimos la imagen de la portada,,Cover Story newsletter: Comment nous avons choisi l'image de couverture,,封面新闻通讯:我们如何选择封面图像,
4,Trump’s war on DEI,"Our weekly podcast on democracy in America. Donald Trump has attacked DEI throughout the government, and the private sector has shuttered many DEI offices. We look at the government’s war on affirmative action, and how it may change the workplace.",Trumps Krieg gegen DEI,"Unser wöchentlicher Podcast über Demokratie in Amerika. Donald Trump hat DEI überall in der Regierung angegriffen, und der Privatsektor hat viele DEI-Büros geschlossen. Wir betrachten die Regierung als einen Krieg gegen affirmative Maßnahmen und wie sie den Arbeitsplatz verändern könnte.",La guerra de Trump contra la DEI,"Nuestro podcast semanal sobre la democracia en Estados Unidos. Donald Trump ha atacado la DEI en todo el gobierno, y el sector privado ha cerrado muchas oficinas de la DEI. Observamos la guerra del gobierno contra la acción afirmativa y cómo puede cambiar el lugar de trabajo.",La guerre de Trump contre le DEI,"Notre podcast hebdomadaire sur la démocratie en Amérique. Donald Trump a attaqué la DEI dans tout le gouvernement, et le secteur privé a bloqué de nombreux bureaux de DEI. Nous regardons la guerre du gouvernement sur l'action positive, et comment elle peut changer le lieu de travail.",特朗普对迪伊的战争,"我们每周一次的关于美国民主的播客。 唐纳德·特朗普在整个政府中袭击了国防和情报局,而私营部门也关闭了许多国防和情报局办公室。 我们审视了政府在平权行动方面的战争,以及它如何改变工作场所。"
5,Donald Trump has many ways to hurt Elon Musk,The incentives for Mr Musk to make up with the president are powerful,"Donald Trump hat viele Möglichkeiten, Elon Musk zu verletzen","Die Anreize für Herrn Musk, den Präsidenten wiedergutzumachen, sind gewaltig.",Donald Trump tiene muchas maneras de herir a Elon Musk,Los incentivos para que el Sr. Musk compense con el Presidente son poderosos,Donald Trump a plusieurs façons de blesser Elon Musk,Les incitations pour M. Musk à se réconcilier avec le président sont puissantes,唐纳德・特朗普有很多方法 伤害伊隆・穆斯克,促使穆克先生和总统和解的激励力非常强大
6,The 11-year-old Ukrainian YouTuber snapping at MrBeast’s heels,Diana Kydysiuk is growing up—and growing rich—on camera,Der 11-jährige Ukrainische YouTuber schnappt sich MrBeasts Fersen,Diana Kydysiuk wächst – und wird reich – vor der Kamera,"El ucranio YouTuber, de 11 años, que toma los talones de MrBeast",Diana Kydysiuk está creciendo —y haciéndose rica— en cámara,Le YouTuber ukrainien de 11 ans s'écrase sur les talons de M. Beast,Diana Kydysiuk grandit – et s'enrichit – sur la caméra,"11岁的乌克兰YouTuTube在Mbeast的脚后摇摇欲坠,","Diana Kydysiuk正在成长,"
7,Who is ahead in the global tech race?,A ranking of 25 countries shows that the West is in a precarious spot,Wer ist im globalen Tech-Rennen voraus?,"Eine Rangliste von 25 Ländern zeigt, dass der Westen in einer prekären Lage ist",¿Quién está por delante en la carrera tecnológica global?,Un ranking de 25 países muestra que Occidente está en un lugar precario,Qui est en tête de la course technologique mondiale ?,Un classement de 25 pays montre que l'Occident est dans une situation précaire,谁是全球技术竞赛的先锋?,"25个国家的排名显示,西方处于不稳定的境地。"
8,How much protein do you really need?,"Unless you are older or want bigger muscles, you’re probably getting enough",Wie viel Protein brauchen Sie wirklich?,"Wenn du nicht älter bist oder größere Muskeln willst, wirst du wahrscheinlich genug",¿Cuánta proteína necesitas?,"A menos que seas mayor o quieras músculos más grandes, probablemente estás recibiendo suficiente",Combien de protéines avez-vous vraiment besoin ?,"Sauf si vous êtes plus vieux ou voulez de plus gros muscles, vous êtes probablement obtenir assez",你真的需要多少蛋白质?,"除非你年长或想要更大的肌肉,"
9,What to watch this weekend,"Starring athletes-turned-crime-fighters, volcanologists and exotic dancers",Was an diesem Wochenende zu sehen,"Starring Athleten-turned-crime-fighters, Vulkanologen und exotische Tänzer",Qué ver este fin de semana,"Protagonizados por atletas convertidos en luchadores del crimen, vulcanólogos y bailarines exóticos",Que regarder ce week-end,"Fighters, volcanologues et danseurs exotiques, avec des athlètes devenus criminels",这周末看什么看这个周末,主演 运动员 变换犯罪斗士 火山学家和异国舞者
10,The end of the affair?,"Our daily political update, featuring the stories that matter",Das Ende der Affäre?,"Unser tägliches politisches Update mit den Geschichten, die wichtig sind",¿El final de la aventura?,"Nuestra actualización política diaria, con las historias que importan",La fin de l'affaire ?,"Notre mise à jour politique quotidienne, mettant en vedette les histoires qui comptent",婚外情的结束?,"我们每天的政治最新情况,特别报道重要的故事"
11,Trump and Musk’s bromance has turned to hate. What happens next?,Also on the daily podcast: Israel’s hard-right and the decline of rhyme,Trump und Musk-Bromance haben sich dem Hass zugewandt. Was passiert als nächstes?,Auch auf dem täglichen Podcast: Israels Hard-right und der Rückgang des Reims,El amorío de Trump y Musk se ha convertido en odio. ¿Qué pasa después?,También en el podcast diario: la derecha dura de Israel y el declive de la rima,"Trump et Musk , la bromance s'est tournée vers la haine. Que se passe-t-il ensuite ?",Aussi sur le podcast quotidien: Israël à droite dure et le déclin de la rime,Trump和Musk的情谊变成了仇恨。 接下来会发生什么呢?,也是在每日播客上:以色列强硬的右派和押韵的衰落。
12,A historical guide to surviving and thriving in the court of Trump,Lessons from Thomas Cromwell and Niccolo Machiavelli about winning friends and influencing people in the White House,Ein historischer Führer zum Überleben und Gedeihen im Hof von Trump,Lektionen von Thomas Cromwell und Niccolo Machiavelli über Freunde zu gewinnen und Menschen im Weißen Haus zu beeinflussen,Una guía histórica para sobrevivir y prosperar en la corte de Trump,Lecciones de Thomas Cromwell y Niccolo Maquiavelo sobre ganar amigos e influenciar a la gente en la Casa Blanca,Un guide historique pour survivre et prospérer dans la cour de Trump,Leçons de Thomas Cromwell et Niccolo Machiavel sur la victoire d'amis et d'influencer les gens à la Maison Blanche,在特朗普法庭生存和繁荣的历史指南,Thomas Cromwell和Niccolo Machiavelli关于赢得朋友及影响白宫人士的教训
13,Muslim “modest-wear” is a hit with fashionistas of all faiths,Long hemlines and loose styles please the fashion gods,Muslimische Modest-Kleidung ist ein Hit mit Fashionistas aller Glaubensrichtungen,Lange Semlines und lose Stile gefallen den Modegöttern,El “modelo de vestir” musulmán es un éxito con los fashionistas de todas las religiones,Los largos dobladillos y los estilos sueltos complacen a los dioses de la moda,"Musulmane, la mode-vêtement est un succès avec les fashionistas de toutes les confessions",Longues ourlines et styles lâches s'il vous plaît les dieux de la mode,穆斯林的“现代服装”是所有信仰的时尚主义者的一击。,长长的长腿和松散的风格 令时装神欢喜
14,Sources and acknowledgments,,Quellen und Anerkennungen,,Fuentes y reconocimientos,,Sources et remerciements,,来源和确认,
15,The man behind Trump’s first tax cuts assesses the second,"Our podcast on markets, the economy and business. This week we sit down with Gary Cohn, Trump’s former chief economic adviser",Der Mann hinter Trumps ersten Steuersenkungen bewertet die zweite,"Unser Podcast über Märkte, Wirtschaft und Wirtschaft. Diese Woche setzen wir uns mit Gary Cohn, Trumps ehemaliger Chef-Wirtschaftsberater",El hombre detrás de los primeros recortes de impuestos de Trump evalúa el segundo,"Nuestro podcast sobre mercados, economía y negocios. Esta semana nos sentamos con Gary Cohn, ex asesor económico jefe de Trump",L'homme derrière les premières réductions d'impôt de Trump évalue la seconde,"Notre podcast sur les marchés, l'économie et les affaires. Cette semaine, nous nous asseyons avec Gary Cohn, ancien conseiller économique en chef de Trump.",Trump 第一次减税背后的人对第二次减税进行评估,"我们在市场、经济和商业上播客。 本周,我们与特朗普的前首席经济顾问加里·科恩坐在一起。"
16,Amanda Feilding fought to rescue the reputation of psychedelics,"The campaigner and scientific collaborator died on May 22nd, aged 82","Amanda Feilding kämpfte, um den Ruf der Psychedelika zu retten","Der Kämpfer und wissenschaftliche Mitarbeiter starb am 22. Mai, im Alter von 82 Jahren",Amanda Feilding luchó para rescatar la reputación de los psicodélicos,"El activista y colaborador científico murió el 22 de mayo, a los 82 años.",Amanda Feilding s'est battue pour sauver la réputation des psychédéliques,"Le militant et collaborateur scientifique est décédé le 22 mai, âgé de 82 ans.",阿曼达·费林为拯救精神错乱的名声而奋斗,"运动者和科学合作者于5月22日死亡,"
17,African architects have cool designs for a warming planet,They take inspiration from everything from the local terrain to termites,Afrikanische Architekten haben coole Designs für einen wärmenden Planeten,Sie lassen sich von allem vom lokalen Terrain bis zu Termiten inspirieren.,Los arquitectos africanos tienen diseños geniales para un planeta que se calienta,"Se inspiran en todo, desde el terreno local hasta las termitas.",Les architectes africains ont des conceptions cools pour une planète de réchauffement,"Ils s'inspirent de tout, du terrain local aux termites",非洲建筑师对变暖的地球 设计非常酷,他们从从当地地形到白蚁的 万物中汲取灵感
18,The 40 best books published so far this year,"When you lie down by the pool this summer, pick up one of these titles",Die bisher 40 besten Bücher in diesem Jahr,"Wenn Sie sich in diesem Sommer am Pool liegen, holen Sie sich einen dieser Titel",Los 40 mejores libros publicados en lo que va de año,"Cuando te acuestes en la piscina este verano, recoge uno de estos títulos.",Les 40 meilleurs livres publiés à ce jour cette année,"Lorsque vous vous couchez près de la piscine cet été, prenez l'un de ces titres",今年迄今出版的40本最佳书籍,今年夏天你躺在游泳池边的时候 取一个这些头衔
19,"Economic data, commodities and markets",,"Wirtschaftsdaten, Rohstoffe und Märkte",,"Datos económicos, productos básicos y mercados",,"Données économiques, produits de base et marchés",,经济数据、商品和市场,
20,How old are the Dead Sea Scrolls? An AI model can help,Scientists are using it to estimate the age of ancient handwriting,Wie alt sind die Schriftrollen vom Toten Meer? Ein KI-Modell kann helfen,"Wissenschaftler benutzen es, um das Alter der alten Handschrift zu schätzen",¿Cuántos años tienen los Rollos del Mar Muerto? Un modelo de IA puede ayudar,Los científicos lo están usando para estimar la edad de la escritura antigua,Quel âge ont les rouleaux de la mer Morte ? Un modèle d'IA peut aider,Les scientifiques l'utilisent pour estimer l'âge de l'écriture ancienne,死海卷卷几岁了 人工智能模型能帮上什么忙,科学家们用它来估计 古代笔迹的年代
21,AI agents are turning Salesforce and SAP into rivals,Artificial intelligence is blurring the distinction between front office and back office,KI-Agenten machen Salesforce und SAP zu Rivalen,Künstliche Intelligenz verwischt die Unterscheidung zwischen Front Office und Back Office,Agentes de inteligencia artificial están convirtiendo a Salesforce y SAP en rivales,La inteligencia artificial está desdibujando la distinción entre la oficina principal y la oficina trasera,Les agents de l'IA transforment Salesforce et SAP en rivaux,L'intelligence artificielle brouille la distinction entre le front office et le back office,AI 代理商正在把销售和SAP 变成竞争对手,人工人工智能模糊了前台办公室和后台办公室之间的区别
22,Germany thinks about cancelling a public holiday,There are plenty to choose from,"Deutschland denkt darüber nach, einen Feiertag abzusagen",Es gibt viel zur Auswahl,Alemania piensa en cancelar un día festivo,Hay mucho entre lo que elegir,L'Allemagne pense à annuler un jour férié,Il y a beaucoup à choisir parmi,德国考虑取消公共假日,有很多可以选择的
23,How managing energy demand got glamorous,Technology and power come together,Wie die Steuerung des Energiebedarfs glamourös wurde,Technologie und Macht kommen zusammen,Cómo gestionar la demanda de energía se volvió glamoroso,La tecnología y el poder se unen,Comment gérer la demande d'énergie a été glamour,La technologie et la puissance s'unissent,如何管理能源需求变得引人瞩目,科技与电力合而为一
24,What Bicester Village says about the luxury industry,Everyone loves a bargain,Was Bicester Village über die Luxusindustrie sagt,Jeder liebt ein Schnäppchen,Lo que dice Bicester Village sobre la industria del lujo,Todo el mundo ama una ganga,Ce que dit Bicester Village sur l'industrie du luxe,Tout le monde aime le marché,Bicester村对奢华产业的看法,每个人都喜欢讨价还价
25,Now China’s ultra-cheap EVs are scaring China,They highlight many of the economy’s current problems,Chinas ultra-billige EVs erschrecken China,Sie heben viele der aktuellen Probleme der Wirtschaft hervor,Ahora los vehículos eléctricos ultra baratos de China están asustando a China,Destacan muchos de los problemas actuales de la economía,"Aujourd'hui, les VE ultra-paches de la Chine font peur à la Chine",Ils mettent en évidence de nombreux problèmes économiques actuels,现在中国超便宜的EV正在吓吓中国,它们突显了经济当前的许多问题。
26,Chinese students want an American education less than they used to,Many are staying at home or studying elsewhere in Asia,"Chinesische Studenten wollen eine amerikanische Ausbildung weniger, als sie früher",Viele wohnen zu Hause oder studieren anderswo in Asien,Los estudiantes chinos quieren una educación americana menos de lo que solían,Muchos se están quedando en casa o estudiando en otras partes de Asia,Les étudiants chinois veulent une éducation américaine moins qu'ils n'en voulaient auparavant.,Beaucoup séjournent à la maison ou étudient ailleurs en Asie,中华学生想要的美国教育比以前少,许多人留在家中或在亚洲其他地方学习。
27,The mystery of China’s missing military,Why the PLA has ducked a brawl with America,Das Geheimnis des fehlenden Militärs in China,Warum die PLA eine Schlägerei mit Amerika entfesselt hat,El misterio de los militares desaparecidos de China,¿Por qué el PLA ha esquivado una pelea con América?,Le mystère de la Chine manque militaire,Pourquoi le PLA a fui une bagarre avec l'Amérique,中国失踪军队的神秘,为什么共和军与美国打斗
28,China is benefiting from the hell in Myanmar,It didn’t create the civil war. But it is playing both sides,China profitiert von der Hölle in Myanmar,Es hat nicht den Bürgerkrieg. Aber es spielt beide Seiten,China se está beneficiando del infierno en Myanmar,"No creó la guerra civil, pero está jugando a ambos lados",La Chine profite de l'enfer au Myanmar,Il n'a pas créé la guerre civile. Mais il joue les deux côtés,中国正从缅甸地狱中获益,它并没有制造内战。 但是它却在两边扮演着两边的角色。
29,Suriname’s chaotic democracy just chose its first woman president,An oil windfall may make it harder for Jennifer Geerlings-Simons to clean up the country,Surinams chaotische Demokratie hat gerade ihren ersten Frauenpräsidenten gewählt,"Ein Öl-Windfall könnte es für Jennifer Geerlings-Simons schwerer machen, das Land aufzuräumen",La caótica democracia de Suriname acaba de elegir a su primera presidenta,Una caída de petróleo puede hacer más difícil para Jennifer Geerlings-Simons limpiar el país,La démocratie chaotique du Suriname vient de choisir sa première femme présidente,Une chute de pétrole pourrait rendre plus difficile pour Jennifer Geerlings-Simons de nettoyer le pays,"苏里南混乱的民主民主刚刚选出第一位女总统,",石油意外收益可能使詹妮弗·杰林斯-西蒙斯更难清理国家
30,Trump’s tariffs have so far caused little inflation,Our estimate of their impact will update every month,Trumps Zölle haben bisher wenig Inflation verursacht,Unsere Schätzung ihrer Auswirkungen wird jeden Monat aktualisiert,Los aranceles de Trump hasta ahora han causado poca inflación,Nuestra estimación de su impacto se actualizará cada mes,Les droits de douane de Trump ont jusqu'à présent causé peu d'inflation,Notre estimation de leur impact sera mise à jour chaque mois,特朗普的关税迄今导致的通货膨胀很少。,我们对其影响的估计将每月更新
31,"Stanley Fischer mixed rigour and realism, compassion and calm","The former IMF, Bank of Israel and Federal Reserve official died on May 31st","Stanley Fischer gemischte Strenge und Realismus, Mitgefühl und Ruhe","Der ehemalige IWF, die Bank von Israel und Federal Reserve Beamter starb am 31. Mai","Stanley Fischer mezcló rigor y realismo, compasión y calma","El ex FMI, Banco de Israel y funcionario de la Reserva Federal murieron el 31 de mayo","Stanley Fischer a mélangé rigueur et réalisme, compassion et calme","L'ancien représentant du FMI, de la Banque d'Israël et de la Réserve fédérale est décédé le 31 mai.",斯坦利·菲舍尔将严谨和现实主义、同情和平静混为一谈,前国际货币基金组织、以色列银行和联邦储备基金官员于5月31日死亡
32,Trump thinks Americans consume too much. He has a point,"He will not like the remedy, however","Trump denkt, Amerikaner konsumieren zu viel. Er hat einen Punkt","Er wird das Heilmittel nicht mögen, jedoch",Trump cree que los estadounidenses consumen demasiado.,"Sin embargo, no le gustará el remedio.",Trump pense que les Américains consomment trop.,"Il n'aimera pas le remède, cependant",特朗普认为美国人消费过量 他有道理,"不过,他不会喜欢这种补救办法的"
33,Who would pay America’s “revenge tax” on foreigners?,Overseas investors at first—then Americans,"Wer würde Amerika zahlen, um Steuern auf Ausländer zu zahlen?",Übersee-Investoren auf den ersten – dann Amerikaner,¿Quién pagaría el “impuesto de venganza” de Estados Unidos a los extranjeros?,Inversionistas en el extranjero al principio — entonces americanos,Qui paierait l'impôt américain sur les étrangers ?,"Les investisseurs étrangers d'abord, puis les Américains",谁会向外国人支付美国“报复税”呢?,最初在美籍美国人的海外投资者
34,Why investors lack a theory of everything,"Markets have no fundamental laws, which is why they are so interesting",Warum Investoren keine Theorie von allem haben,"Die Märkte haben keine grundlegenden Gesetze, weshalb sie so interessant sind",Por qué los inversores carecen de una teoría de todo,"Los mercados no tienen leyes fundamentales, por lo que son tan interesantes.",Pourquoi les investisseurs n'ont pas une théorie de tout,"Les marchés n'ont pas de lois fondamentales, c'est pourquoi ils sont si intéressants",为什么投资者缺乏一切理论,"市场没有基本的法律,所以市场如此有趣"
35,Will the UAE break OPEC?,We find that the Emiratis are flouting the cartel’s rules on a grand scale,Wird die VAE OPEC durchbrechen?,"Wir stellen fest, dass die Emiratis die Kartellregeln in großem Maßstab missachten.",¿Los EAU romperán la OPEP?,Encontramos que los Emiratis están burlando las reglas del cártel a gran escala,Les Émirats arabes unis briseront-ils l'OPEP?,Nous découvrons que les Emiratis bafouent les règles du cartel sur une grande échelle,阿联酋将打破欧佩克吗?,我们发现酋长国在大规模蔑视卡特尔规则
36,Trump’s financial watchdogs promise a revolution,The regulatory pendulum swings violently,Trumps Finanzwachhunde versprechen eine Revolution,Das aufsichtsrechtliche Pendel schwingt heftig,Los vigilantes financieros de Trump prometen una revolución,El péndulo regulador oscila violentamente,Les chiens de garde financiers de Trump promettent une révolution,Le pendule réglementaire oscille violemment,特朗普的金融监督者承诺革命,监管的钟摆 激烈的摇摆
37,India has a chance to cure its investment malaise,Global trade turmoil presents a rare opportunity,"Indien hat die Chance, seine Investitionsunwohlsein zu heilen",Globale Handelsturbulenzen bieten eine seltene Chance,India tiene la oportunidad de curar su malestar de inversión,La agitación comercial mundial presenta una oportunidad rara,L'Inde a une chance de guérir son malaise à l'investissement,La tourmente du commerce mondial est une occasion rare,印度有机会解决其投资问题,全球贸易动荡是一个难得的机会
38,How might China win the future? Ask Google’s AI,The country’s sprawling industrial policy is beyond mere human comprehension,Wie könnte China die Zukunft gewinnen? Fragen Sie Google KI,"Das Land, das die Industriepolitik ausdehnt, ist jenseits des menschlichen Verständnisses.",¿Cómo podría China ganar el futuro? Pregúntele a la IA de Google,La expansión de la política industrial del país está más allá de la mera comprensión humana,Comment la Chine pourrait-elle gagner l'avenir ?,L'expansion de la politique industrielle est au-delà de la simple compréhension humaine,中国如何赢得未来? 问谷歌的AI,国家无所不能的工业政策是人类无法理解的。
39,The courts block Trump’s tariffs. Can he circumvent their verdict?,American trade policy is in chaos,Die Gerichte blockieren Trumps Zölle. Kann er ihr Urteil umgehen?,Die amerikanische Handelspolitik ist im Chaos,Los tribunales bloquean los aranceles de Trump. ¿Puede eludir su veredicto?,La política comercial estadounidense está en caos,Les tribunaux bloquent les tarifs Trump. Peut-il contourner leur verdict ?,La politique commerciale américaine est dans le chaos,法院封锁特朗普的关税。 他能绕过他们的判决吗?,美国贸易政策陷入混乱
40,China is waking up from its property nightmare,An ecstatic $38m luxury-mansion auction lights up the market,China erwacht aus seinem Eigentum Alptraum,Eine ekstatische $38m Luxus-Mansion-Auktion erhellt den Markt,China está despertando de su pesadilla de propiedad,Una subasta extática de $38m de lujo-mansión ilumina el mercado,La Chine se réveille de son cauchemar de propriété,Une vente aux enchères extatique de 38 M$ de luxe-mansion éclaire le marché,中国正在从财产恶梦中醒来,令人欣欣喜的38m豪华豪华豪华豪华豪华豪华豪华豪华豪华大拍卖 将市场推向光明
