,title-de,content-de,title-en,content-en,title-zh,content-zh
62,Die Macht der rechten Meinungsmacher in Frankreich,"Sie wollen ein nationalistisches Frankreich mit weniger Migranten und ohne ""Wokeness"" - und ihr Einfluss auf die öffentliche Meinung wächst: Milliardäre wie Bolloré und Stérin werden zum ""Schalthebel für die extreme Rechte"". Von J. Borutta.",The power of right-wing opinion makers in France,"They want a nationalist France with fewer migrants and without ""Wokeness"" - and their influence on public opinion is growing: billionaires like Bolloré and Stérin become ""the lever for the extreme right"". By J. Borutta.",法国右翼领袖的权力,"他们希望法国的民族主义者少一点移民少一点,没有""Wokeness"" 他们对公众意见的影响也更大:像布尔罗雷和斯蒂恩这样的亿万富翁成为""极右翼的控制"" 由J. Borutta领导的."
63,Verschärftes Rauchverbot in Frankreich in Kraft,"Frankreich verbannt die Raucher mehr und mehr: Ab heute ist auch am Strand, an der Bushaltestelle oder im Park das Rauchen tabu. Wer trotzdem zur Kippe greift, riskiert ein Bußgeld. Vor allem Kinder sollen besser geschützt werden.",Increased smoking ban in France,"France is banishing smokers more and more: from now on, smoking is taboo on the beach, at the bus stop or in the park. Those who take the tip nevertheless risk a fine. Children in particular should be better protected.",法国的禁烟措施已经生效,"从今天起,在海滩上,巴士站,公园里,法国烟民也禁止吸烟. 但是,拿烟烟抽的人,会因为罚款而受到罚款. 特别是儿童应该得到更好的保护."
64,BBC in der Kritik: Anti-israelische Parolen live im britischen TV,Die britische Regierung hat die BBC wegen der Übertragung eines Auftritts einer Rap-Gruppe scharf kritisiert und eine Erklärung gefordert. Auf dem Glastonbury-Festival in Südengland hatte ein Rapper anti-israelische Parolen gerufen.,BBC in Critique: Anti-Israeli slogans live on British TV,The British government strongly criticized the BBC for broadcasting a rap group appearance and called for a statement. A rapper called for anti-Israeli slogans at the Glastonbury Festival in southern England.,批評BBC:反以色列口号在英國電視上直播,"英国政府强烈批评英国广播公司 (BBC) 说他们正在转播一个饶舌乐组的演出,要求发表一份声明. 在英格兰南部格拉斯顿伯里节上,一位饶舌歌手呼吁反以色列口号."
65,Kurzvideos erschweren das Lernen,Kurze Lernvideos auf Social Media erzielen täglich Millionen Klicks. In zwei Studien der TU Braunschweig ist jetzt der Lerneffekt dieser Erklärvideos getestet worden - das Ergebnis ist ernüchternd. Von Monika Haas.,Short videos make learning more difficult,Short learning videos on social media achieve millions of clicks every day. In two studies of the TU Braunschweig the learning effect of these explanatory videos has now been tested - the result is sobering. By Monika Haas.,短片让学习变得困难重重,"社交媒体的简短学习视频每天收到数以百万计的点击声. 在TUB的两个研究中,这些解释视频的学习效果已经测试过了,结果令人清醒. 由莫妮卡·哈斯 (Monica Haas) 提供."
66,Mallorca lebt vom Tourismus - und leidet unter ihm,Mallorcas Hoteliers und Politiker wollten weniger Massen- und mehr Luxus-Tourismus. Nun haben sie beides. Und zum Ferienstart mehr Probleme als zuvor. Von Sebastian Kisters.,Mallorca lives from tourism - and suffers from it,Mallorca's hoteliers and politicians wanted less mass and more luxury tourism. Now they have both. And to start the holiday more problems than before. By Sebastian Kisters.,"马尔洛卡是旅游业的代言人,他受尽折磨","马洛卡的酒店老板和政客们想要少些大规模的奢侈旅游活动,现在他们都有了. 度假时的麻烦比以前多得多. 由塞巴斯蒂安·博格斯 (Sebastian Bankers) 提供."
67,Bundestagspräsidentin Klöckner und die Frage der Neutralität,Seit gut drei Monaten ist Julia Klöckner Bundestagspräsidentin - und soll in dieser Rolle die Neutralität des Parlaments bewahren. Eine Entscheidung zur Regenbogenflagge wird aber immer mehr zum Politikum. Von Julie Kurz.,President of the Bundestag Klöckner and the question of neutrality,"Julia Klöckner has been the President of the Bundestag for more than three months - and is supposed to maintain Parliament's neutrality in this role. However, a decision on the rainbow flag is becoming more and more a political issue. By Julie Kurz.",联邦主席Kluckner 和中立问题,"3个月来,茱莉亚·克罗克纳担任联邦日主席,并以此来维持议会的中立地位. 但对彩虹旗的裁决却变得越来越政治化了. 由朱莉·库尔茨 (Julie Kurchner) 担任."
68,"US-Demokraten wollen Trumps ""Big Beautiful Bill"" komplett vorlesen",Im US-Senat steht die Abstimmung über das umstrittene Steuer- und Ausgabengesetz von US-Präsident Trump an. Minderheitsführer Schumer möchte über den Gesetzentwurf aufklären - und offenbar alle 940 Seiten vorlesen lassen.,"US Democrats want to read Trump's ""Big Beautiful Bill"" completely","In the US Senate, the vote on the controversial tax and expenditure law of US President Trump is pending. Minority leader Schumer wants to clarify the bill - and apparently let all 940 pages read out.","美国独裁者想完全读完特朗普的""大美女比尔""","在美国参议院,关于美国总统特朗普的争议性税收和支出法案的投票即将举行. 少数派领导人舒默希望澄清该法案的设计 - 并显然让940页的读者都读出来."
69,Tausende demonstrieren in Israel für Freilassung der Geiseln,In Israel haben erneut Tausende Menschen für ein Ende des Gaza-Kriegs und die Freilassung der verbliebenen Geiseln demonstriert. Unterdessen weckt US-Präsident Trump Hoffnungen auf ein mögliches israelisches Abkommen mit der Hamas.,Thousands demonstrate in Israel for the release of hostages,"In Israel, thousands of people have once again demonstrated for an end to the Gaza war and the release of the remaining hostages. Meanwhile, US President Trump raises hopes for a possible Israeli agreement with Hamas.","数以千计的以色列示威示威,以释放人质","在以色列,有数千人示威结束加沙战争,释放余留的人质. 与此同时,美国总统特朗普希望以色列与哈马斯达成可能的协议."
70,"Pride-Teilnehmer in Budapest zeigen Orban den ""Stinkefinger""",Mit einem verschärften Anti-LGBTQ-Kurs wollte Ungarns Ministerpräsident bei den Wählern punkten. Doch auf das Verbot der Pride-Parade in Budapest folgte ein Rückschlag für Orban: Mehr Menschen als jemals zuvor nahmen an der Demo teil. Von Oliver Soos.,"Pride participants in Budapest show Orban the ""Stinkefinger""","With an intensified anti-LGBTQ course, Hungary's Prime Minister wanted to score among the voters. However, the ban on the Pride Parade in Budapest was followed by a setback for Orban: More people than ever before participated in the demo. By Oliver Soos.","布达佩斯的先锋们展示了""铁指""","在反LGBTQ课程上,匈牙利总理想在选民中得分. 但是,在布达佩斯的普及游行被禁止后,欧班的挫败程度比以往任何时候都大. 由奥利佛·苏斯参加游行."
71,Proteste in Serbien: Festnahmen und Verletzte nach Demonstration in Belgrad,In der serbischen Hauptstadt Belgrad haben erneut Zehntausende Menschen für vorgezogene Parlamentswahlen demonstriert. Im Anschluss kam es zu Zusammenstößen zwischen der Polizei und Demonstranten.,Protests in Serbia: Arrests and Injuries after Demonstration in Belgrade,"In Belgrade, the Serbian capital, tens of thousands of people have again demonstrated for early parliamentary elections, followed by clashes between the police and demonstrators.",塞尔维亚的抗议活动:贝尔格莱德示威后逮捕和受伤者,"在塞尔维亚首都贝尔格莱德,有成千上万的人在提前举行议会选举. 随后,警察和示威者之间发生了冲突."
72,Arabische Gemeinden in Israel nach den iranischen Angriffen,"Die Waffenruhe mit dem Iran hält. Auch in den betroffenen arabischen Gemeinden in Israel laufen die Aufräumarbeiten. Neben den Schäden kommt ans Licht, wie unterschiedlich das Land seine Bürger schützt. Von Bettina Meier.",Arab communities in Israel after the Iranian attacks,The ceasefire with Iran holds. Also in the affected Arab communities in Israel the clean-up works run. In addition to the damage comes to light how differently the country protects its citizens. By Bettina Meier.,"伊朗的袭击后,以色列阿拉伯社区在以色列境内.","与伊朗的停火维持着. 在以色列受影响的阿拉伯社区中,清理工作正在进行,除了损害,还显示了这个国家如何保护其公民. 由贝蒂娜·梅耶 (贝蒂娜·梅耶) 负责."
73,Merz warnt vor falschem Sicherheitsgefühl,"In Freiheit, Frieden und Sicherheit zu leben, sei keine Selbstverständlichkeit: Beim Tag der Bundeswehr forderte Kanzler Merz mit Blick auf den russischen Krieg gegen die Ukraine, es brauche zusätzliche Verteidigungsanstrengungen.",Merz warns against false security,"It is not a matter of course to live in freedom, peace and security: on the day of the Bundeswehr, Chancellor Merz called for additional defence efforts to be made in view of the Russian war against Ukraine.",梅兹警告我安全性错误,"生活在自由,和平与安全中是不可理喻的:在联邦军日上,梅兹总理呼吁进行进一步的防御."
74,Zehntausende demonstrieren in Budapest für LGBTQ-Rechte,"Zehntausende sind ins Zentrum von Budapest geströmt, um sich der Pride-Parade anzuschließen. Damit setzten sie auch ein Zeichen gegen die Politik von Ministerpräsident Orban, der die Demonstration verbieten ließ. Von Oliver Soos.",Tens of thousands demonstrate for LGBTQ rights in Budapest,"Tens of thousands have flowed into the centre of Budapest to join the Pride Parade, which has also signalled against the policies of Prime Minister Orban, who has banned the demonstration by Oliver Soos.",成千上万布达佩斯示威者在布达佩斯的LGBTQ权利示威.,"数以万计的人涌入布达佩斯中心参加了普及游行,这也违反了欧班总理的政策,禁止示威. 由奥利佛·苏斯领导的."
75,Berlin will Schutz von sexueller Identität im Grundgesetz,"Berlins Regierung will erreichen, dass der Schutz sexueller Identität künftig im Grundgesetz verankert wird. Ob die Initiative Chancen hat, ist offen - denn eine entsprechende Verfassungsänderung hat hohe Hürden.",Berlin wants to protect sexual identity in the Basic Law,Berlin's government wants to ensure that the protection of sexual identity is enshrined in the Basic Law in the future. Whether the initiative has opportunities is open - because a corresponding constitutional amendment has high hurdles.,柏林要求在基本法中保护性身份,"柏林政府希望将对性身份的保护列入""基本法""中. 该倡议是否有机会是开放的,因为相关宪法修正案有很大的障碍."
76,Christopher Street Day in München: Politparade für Vielfalt,"In München gehen bei der Politparade des Christopher Street Day Menschen für Freiheit, Vielfalt und Selbstbestimmung auf die Straße - unter erhöhten Sicherheitsvorkehrungen.",Christopher Street Day in Munich: Political parade for diversity,"At the political parade of Christopher Street Day in Munich, people for freedom, diversity and self-determination take to the streets - under increased security measures.",慕尼黑的克里斯多夫街日 多样性政治游行,"在慕尼黑,克里斯多夫街日日政治游行中, 自由,多样性和自决的人群, 受到加强的安全措施的限制."
77,Zehntausende bei verbotener Pride-Parade in Budapest,Ungarns Regierungschef Orban wollte die Pride-Parade in diesem Jahr mit Gesetzesänderungen unmöglich machen. Das polizeiliche Verbot scheint aber keine Wirkung zu zeigen - in Budapest sind Zehntausende Menschen zusammengekommen.,Tens of thousands at the forbidden Pride Parade in Budapest,"Hungary's Prime Minister Orban wanted to make the Pride Parade impossible with changes to the law this year. However, the police ban does not seem to have any effect - tens of thousands of people have come together in Budapest.",在布达佩斯的禁忌游行上 有成千上万的人在布达佩斯举行游行,"匈牙利领导人欧班想在今年使普及游行无法通过法律改革. 但警察的禁令似乎没有效果 - 在布达佩斯,成千上万的人聚集在一起."
78,Lohnt sich Fondsparen in Nebenwerte?,Auf dem Aktienmarkt stehen oft Großkonzerne wie Apple oder SAP im Rampenlicht. Für Fondssparer könnte sich aber ein Blick in die zweite und dritte Reihe von Unternehmen lohnen - auf die Nebenwerte. Von Andreas Braun,Is fund paren worth off-balance sheet?,"Large corporations such as Apple or SAP are often in the spotlight on the stock market. However, a look into the second and third row of companies could be worthwhile for fund savers - on the ancillary values. By Andreas Braun",养老金有附加值吗?,"股票市场上经常有像苹果或SAP这样的大公司受到关注. 但对养老金者来说,看看第二和第三排的公司 - - 其附加值 - - 可能会有所回报. 由Andreas Brown公司提供."
79,Justizministerin Hubig will möbliertes Vermieten strenger regeln,Trotz der Verlängerung der Mietpreisbremse nutzen Vermieter weiterhin Schlupflöcher. Dagegen will Justizministerin Hubig vorgehen: Mit zwei Stühlen und einem Tisch ließen sich keine überzogenen Mieten rechtfertigen.,Minister of Justice Hubig wants to impose stricter rules on furnished rents,"Despite the extension of the rental price brake, landlords continue to use loopholes. Justice Minister Hubig wants to take action against this: with two chairs and a table, no oversized rents could be justified.",司法部长赫柏格想对租房商进行更严格的监管,"房东继续使用漏洞. 与此相反,司法部长要处理的是两张椅子和一张桌子."
80,Kommt es nach Maja T. zur nächsten Auslieferung an Ungarn?,In Budapest geht das Strafverfahren gegen Maja T. weiter. Währenddessen droht noch einer Person in Deutschland die Auslieferung nach Ungarn - dem syrischen Staatsbürger Zaid A. aus Nürnberg. Von A. Lagmöller und E. Lopez.,Is it coming to Maja T. for the next delivery to Hungary?,"In Budapest, the criminal case against Maja T. continues. Meanwhile, a person in Germany is still threatened with extradition to Hungary - the Syrian citizen Zaid A. from Nuremberg. By A. Lagmöller and E. Lopez.",下一次向匈牙利引渡是玛雅·T吗?,"在布达佩斯,起诉Maja T. 的审判仍在进行中. 与此同时,德国还有一个人正威胁要引渡从纽伦堡的叙利亚公民Zaid A."
81,Afrikas Regierungen schauen mit Sorge auf die US-Zollentscheidung,"Die USA wollen die Wirtschaftsbeziehungen zu Afrika grundlegend ändern - für die dortigen Länder steht viel auf dem Spiel. Auf einem Wirtschaftsgipfel in Angola versuchten sie, das Schlimmste abzuwenden. Von Philip Raillon.",Africa's governments look with concern at the US customs decision,The US wants to fundamentally change economic relations with Africa - there is a lot at stake for the countries there. At an economic summit in Angola they tried to avert the worst. By Philip Raillon.,非洲各国政府关注着美国的决定,"美国想从根本上改变与非洲的经济关系 - - 对当地国家来说是一大威胁. 在安哥拉的一次经济峰会上,他们试图避免最坏的情况. Philip Railon."
82,Nahost-Liveblog: ++ Offenbar Tote bei Angriffen im Gazastreifen ++,Bei israelischen Angriffen im Gazastreifen sind nach palästinensischen Angaben mindestens 81 Menschen getötet worden. US-Präsident Trump rechnet nach eigenen Angaben mit einer Waffenruhe im Gazastreifen innerhalb einer Woche.,Middle East live blog: ++ Apparently dead in attacks in the Gaza Strip ++,"According to Palestinian sources, at least 81 people have been killed in Israeli attacks in the Gaza Strip. According to US President Trump, a ceasefire in the Gaza Strip is expected to take place within a week.",中东参考博客:++ 加沙地带的袭击中死伤者 ++++,"以色列在加沙的袭击中,根据巴勒斯坦的统计,至少有81人被杀害. 美国总统特朗普估计在一周内,会根据他自己的说法,在加沙地带停火."
83,Große Militärübung mit Soldaten aus vier Ländern am Niederrhein,"Am Niederrhein läuft eine groß angelegte Militärübung: Etwa 1.200 Soldaten und Soldatinnen aus vier Nationen trainieren die schnelle Überquerung des Rheins. Ziel der Übung ist es, die militärische Zusammenarbeit zu verbessern.",Great military exercise with soldiers from four countries on the Lower Rhine,"On the Lower Rhine there is a large-scale military exercise: about 1,200 soldiers from four nations train the rapid crossing of the Rhine. The aim of the exercise is to improve military cooperation.",和四个国家的士兵一起进行大规模军事演习,"在下风下,军事演习非常激烈:大约1200名来自四个国家的士兵和士兵,正在训练快速穿越莱茵河. 训练的目的是改善军事合作."
84,Das Comeback der Kiezkneipe in Berlin,In Berliner Eckkneipen sieht man immer mehr junge Menschen sitzen. Eine Entwicklung gegen den deutschlandweiten Trend: In den vergangenen Jahren sank die Zahl der Schankwirtschaften drastisch. Von Johanna Sagmeister.,The comeback of the Kiezkneipe in Berlin,"More and more young people are sitting in Berlin's Eckkneipen. A development against the German-wide trend: In recent years, the number of retail businesses has fallen dramatically. By Johanna Sagmeister.",柏林的基兹涅普号恢复了,"柏林角落的年轻人越来越多. 对抗德国广阔的趋势的发展:近年来,大宗商品价格暴跌,约翰娜·斯凯德 (Johanna Dismaster) 出台了."
85,Finnlands sorgenvoller Blick in Richtung Russland,"Stillgelegte Flughäfen werden reaktiviert, Kasernen modernisiert. Russland rüstet entlang der finnischen Grenze erkennbar auf. Vor Ort beobachtet man das mit Sorge - und stellt sich auf Krisenlagen ein. Von Christian Blenker.",Finland's caring view towards Russia,"Decommissioned airports are reactivated, barracks are modernized. Russia is clearly upgrading along the Finnish border. On the spot, one observes this with concern - and adjusts to crisis situations. By Christian Blenker.",芬兰对俄罗斯更关注的目光,"关闭的机场正在重新启动,军营现代化. 俄罗斯在芬兰边界上显现了高度. 当地人担心,他们正在观察 - 并开始应对危机. 由克里斯蒂安·布劳德勒 (Christian Breinder) 负责."
86,Hitzewelle mit über 30 Grad erreicht den deutschen Südwesten,"Viel Sonne, blauer Himmel und trocken: Dem Südwesten Deutschlands stehen ab heute sehr heiße Tage bevor - bis zu 40 Grad könnten möglich sein. Für die Gesundheit ist diese Hitze ein Risiko.",Heat wave with over 30 degrees reaches the German Southwest,"Lots of sun, blue sky and dry: The southwest of Germany are from today very hot days ahead - up to 40 degrees could be possible. For health this heat is a risk.",热浪超过30度 到达德国西南部,"晴天晴天和干燥:从今天起,德国西南部将面临非常热的天气 - 可能有40度的可能. 这种热量对健康来说是危险的."
87,"Scholz will ein Altkanzler sein, ""über den sich die SPD freut""","Altkanzler Scholz geht mit einem Versprechen: Beim SPD-Bundesparteitag in Berlin sicherte er den Sozialdemokraten zu, dass sie weiter auf ihn zählen können. Zugleich verteidigte er die Politik der Ampelkoalition.","Scholz wants to be an old chancellor ""of whom the SPD is happy""","Old Chancellor Scholz makes a promise: at the SPD Federal Party Congress in Berlin, he assured the Social Democrats that they could continue to count on him. At the same time, he defended the politics of the traffic light coalition.","舒兹想成为一个""社会民主党高兴""的总理","在柏林的党内党民主党大会上,他保证社会民主党能继续支持他. 与此同时,他还捍卫了红灯联盟的政策."
88,Mit Pubertätsblockern zu sexueller Zufriedenheit?,"Wenn Jugendliche sich in ihrem Geschlecht nicht wohl fühlen, können sie Pubertätsblocker erhalten. Eine Studie hat die Auswirkung der Medikamente auf die sexuelle Zufriedenheit in späteren Lebensjahren untersucht. Von D. Remus.",With puberty blockers to sexual satisfaction?,"If young people do not feel well in their sex, they can get puberty blockers. A study has investigated the effect of the drugs on sexual satisfaction in later years of life. By D. Remus.",青春期对性满意?,"如果年轻人在性别中不自在,他们可以获得青春期阻塞剂. 一项研究研究研究发现药物对未来几年性满足的影响. D. Remus."
89,Unipräsident in Virginia tritt nach Regierungsdruck zurück,"Der Präsident der University of Virginia, Ryan, ist zurückgetreten. Grund ist der wachsende Druck der US-Regierung. Die hatte laut einem Medienbericht nicht nur seinen Rücktritt eingefordert, sondern auch Kürzungen in Millionenhöhe angedroht.",University president in Virginia resigns after government pressure,"The president of the University of Virginia, Ryan, has resigned because of the growing pressure from the US government, which, according to a media report, had not only called for his resignation, but also threatened cuts in millions.",维吉尼亚大学校长在政府压力下辞职,"Virginia大学校长Ryan辞职了. 美国政府的压力正在增加. 根据媒体报道,她不但要求辞职,还威胁要削减数百万美元的开支."
90,Iran zeigt sich bereit für Atomgespräche mit den USA,Nach den Angriffen schienen Atomverhandlungen in weiter Ferne. Nun signalisiert Teheran Gesprächsbereitschaft - unter Bedingungen. Außenminister Araghtschi forderte von US-Präsident Trump einen respektvolleren Ton.,Iran is ready for nuclear talks with the US,"After the attacks, nuclear negotiations seemed far away. Now Tehran is signaling willingness to talk - under conditions. Foreign Minister Araghchi demanded a more respectful tone from US President Trump.",伊朗准备与美国进行核谈判,"袭击后,核谈判似乎远在天涯海角. 现在,德黑兰在条件下表示对谈的意愿. 国务卿阿拉赫奇要求美国总统特朗普更尊重他."
91,Iran: Auf Krieg folgt Repression im Innern,"Seit dem Krieg mit Israel läuft im Iran eine Verhaftungswelle, die Repression ist noch härter geworden. Das Regime will so Kontrolle demonstrieren - und seine Gegner im Innern einschüchtern. Von Pia Masurczak.",Iran: War follows repression inside,"Since the war with Israel there has been a wave of arrests in Iran, the repression has become even more severe. The regime wants to demonstrate control - and to intimidate its opponents inside. By Pia Masurczak.","伊朗:战争后,伊朗内部的压抑","自从以色列与以色列交战以来,伊朗的逮捕浪潮开始,镇压也变得越来越严重. 伊朗政权想以此表达控制,并恐吓其内部对手. 由皮亚·马苏克 (Pia Maschurczak) 发起."
