,title-en,content-en,title-de,content-de,title-es,content-es,title-fr,content-fr,title-zh,content-zh
84,Germany lobbies for sustainability and multilateral solutions,"Dr Bärbel Kofler, Parliamentary State Secretary at the Federal Ministry for Economic Cooperation and Development (BMZ), has set off on a five-day trip to Côte d'Ivoire where the 60th Annual Meetings of the African Development Bank (AfDB) will begin today. The election of a new AfDB President will be a key focus of the conference. The election is especially important as the continent is facing tremendous challenges, such as crisis-induced upheavals, the United States’ withdrawal from many areas of development cooperation, displacement and forced migration in Africa, and advancing climate change.",Deutschlandlobbies für Nachhaltigkeit und multilaterale Lösungen,"Dr. Bärbel Kofler, Parlamentarischer Staatssekretär im Bundesministerium für wirtschaftliche Zusammenarbeit und Entwicklung (BMZ), ist auf eine fünftägige Reise nach Côte d'Ivoire gestartet, wo heute die 60. Jahrestagung der Afrikanischen Entwicklungsbank (AfDB) beginnt. Ein Schwerpunkt der Konferenz wird die Wahl eines neuen AfDB-Präsidenten sein. Besonders wichtig ist die Wahl, da der Kontinent vor enormen Herausforderungen steht, wie z.B. krisenbedingte Umwälzungen, der Rückzug der USA aus vielen Bereichen der Entwicklungszusammenarbeit, Vertreibung und Zwangsmigration in Afrika und die Förderung des Klimawandels.",Alemania aboga por la sostenibilidad y las soluciones multilaterales,"El Dr. Bärbelçóler, Secretario de Estado Parlamentario del Ministerio Federal de Cooperación Económica y Desarrollo (BMZ), ha iniciado un viaje de cinco días a Côte d'Ivoire, donde las 60 Reuniones Anuales del Banco Africano de Desarrollo (BAfD) comenzarán hoy. La elección de un nuevo Presidente del BAfD será un foco clave de la conferencia. Las elecciones son especialmente importantes ya que el continente se enfrenta a enormes desafíos, tales como trastornos provocados por crisis, la retirada de los Estados Unidos de muchas áreas de cooperación para el desarrollo, desplazamientos y migración forzada en África, y el avance del cambio climático.",L'Allemagne milite pour la durabilité et des solutions multilatérales,"M. Bärbel Kofler, Secrétaire d'État parlementaire au Ministère fédéral de la coopération économique et du développement (BMZ), a entrepris un voyage de cinq jours en Côte d'Ivoire, où débuteront aujourd'hui les 60e réunions annuelles de la Banque africaine de développement (BAfD). L'élection d'un nouveau président de la BAfD sera un thème clé de la conférence. L'élection est particulièrement importante car le continent est confronté à d'énormes défis, tels que les bouleversements provoqués par les crises, le retrait des États-Unis de nombreux domaines de la coopération pour le développement, les déplacements et les migrations forcées en Afrique, et la promotion du changement climatique.",德国关于可持续性和多边解决办法的游说团,"联邦经济合作与发展部(BMZ)政务次官贝尔·考夫勒(Drärbel Kofler)已前往科特迪瓦,为期五天,非洲开发银行(非行)第六十届年会将于今天召开。 非洲开发银行(非行)新当选行长将是会议的主要焦点。 选举尤为重要,因为非洲大陆正面临巨大的挑战,如危机引发的动荡、美国退出许多发展合作领域、流离失所和被迫移徙以及推进气候变化。"
85,Foreign Minister Johann Wadephul and Development Minister Reem Alabali Radovan on the lifting of all economic sanctions against Syria,"At today’s Foreign Affairs Council in Brussels, the EU member states agreed to lift all economic sanctions against Syria. Development Minister Reem Alabali Radovan stated: ""This is a moment of hope and a new beginning for the people of Syria. To ensure a fresh start in Syria that is peaceful and successful, it is crucial that the economy recovers and that people can meet their basic needs. Lifting the sanctions will increase Syrian society’s ability to help itself. (...)""",Außenminister Johann Wadephul und Entwicklungsminister Reem Alabali Radovan zur Aufhebung aller wirtschaftlichen Sanktionen gegen Syrien,"Auf der heutigen Tagung des Rates für auswärtige Angelegenheiten in Brüssel haben sich die EU-Mitgliedstaaten darauf geeinigt, alle wirtschaftlichen Sanktionen gegen Syrien aufzuheben. Entwicklungsminister Reem Alabali Radovan erklärte: „Dies ist ein Moment der Hoffnung und eines Neuanfangs für das syrische Volk. Um einen friedlichen und erfolgreichen Neuanfang in Syrien zu gewährleisten, ist es entscheidend, dass die Wirtschaft wieder wächst und dass die Menschen ihre grundlegenden Bedürfnisse erfüllen können.",El Ministro de Asuntos Exteriores Johann Wadephul y el Ministro de Desarrollo Reem Alabali Radovan sobre el levantamiento de todas las sanciones económicas contra Siria,"En el Consejo de Asuntos Exteriores de hoy en Bruselas, los Estados miembros de la UE acordaron levantar todas las sanciones económicas contra Siria. El ministro de Desarrollo, Reem Alabali Radovan, declaró: ""Este es un momento de esperanza y un nuevo comienzo para el pueblo de Siria. Para garantizar un nuevo comienzo en Siria que sea pacífico y exitoso, es crucial que la economía se recupere y que la gente pueda satisfacer sus necesidades básicas.",Le ministre des Affaires étrangères Johann Wadephul et le ministre du Développement Reem Alabali Radovan sur la levée de toutes les sanctions économiques contre la Syrie,"Le ministre du Développement, Reem Alabali Radovan, a déclaré : « C'est un moment d'espoir et un nouveau départ pour le peuple syrien. Pour assurer un nouveau départ en Syrie qui soit pacifique et réussi, il est crucial que l'économie se rétablisse et que les gens puissent répondre à leurs besoins fondamentaux. Le relèvement des sanctions augmentera la capacité de la société syrienne à s'aider elle-même. (...) »",约翰·瓦德富尔外长兼发展部长雷姆·阿拉巴利·拉多万关于解除对叙利亚的所有经济制裁,"在今天的布鲁塞尔外交理事会上,欧盟成员国同意取消对叙利亚的所有经济制裁。 发展部长拉多万(Reem Alabali Radovan)说 : “ 这是叙利亚人民充满希望和新开端的时刻。 为确保叙利亚有一个和平成功的新开端,经济复苏和人民能够满足基本需要至关重要。 取消制裁将提高叙利亚社会自助的能力。 ”"
86,Call to sign the Hamburg Declaration on Responsible AI for the SDGs,How do we succeed in using artificial intelligence to promote human development – and in shaping it in such a way that it benefits all people? This question will be the focus of a panel discussion held by the Federal Ministry for Economic Cooperation and Development (BMZ) and the United Nations Development Programme (UNDP) on 2 June 2025 as part of the Hamburg Sustainability Conference.,Aufruf zur Unterzeichnung der Hamburger Erklärung zur Verantwortungsvollen KI für die SDGs,"Wie gelingt es uns, mit künstlicher Intelligenz die menschliche Entwicklung zu fördern – und so zu gestalten, dass sie allen Menschen zugute kommt? Diese Frage steht im Mittelpunkt einer Podiumsdiskussion des Bundesministeriums für wirtschaftliche Zusammenarbeit und Entwicklung (BMZ) und des Entwicklungsprogramms der Vereinten Nationen (UNDP) am 2. Juni 2025 im Rahmen der Hamburg Sustainability Conference.",Llamamiento a firmar la Declaración de Hamburgo sobre la IA responsable de los ODS,¿Cómo lograremos utilizar la inteligencia artificial para promover el desarrollo humano y darle forma de manera que beneficie a todas las personas? Esta cuestión será el centro de una mesa redonda organizada por el Ministerio Federal de Cooperación Económica y Desarrollo (BMZ) y el Programa de las Naciones Unidas para el Desarrollo (PNUD) el 2 de junio de 2025 como parte de la Conferencia de Sostenibilidad de Hamburgo.,Appel à signer la Déclaration de Hambourg sur l'IA responsable pour les ODD,Comment réussissons-nous à utiliser l'intelligence artificielle pour promouvoir le développement humain - et à le façonner de manière à ce qu'il profite à tous? Cette question sera au centre d'une table ronde tenue par le Ministère fédéral de la coopération économique et du développement (BMZ) et le Programme des Nations Unies pour le développement (PNUD) le 2 juin 2025 dans le cadre de la Conférence de Hambourg sur la durabilité.,呼吁签署《关于对可持续发展目标负责的大赦国际汉堡宣言》,我们怎样才能成功地利用人工智能促进人类发展 — — 并且以有利于所有人的方式塑造人文发展? 这个问题将是2025年6月2日联邦经济合作与发展部(BMZ)和联合国开发计划署(UNDP)作为汉堡可持续性会议一部分举行的小组讨论的重点。
87,Reem Alabali Radovan becomes new Development Minister,"Reem Alabali Radovan has taken office as Development Minister. After being formally appointed by Federal President Frank-Walter Steinmeier, she officially took over from her predecessor Svenja Schulze in a ceremony at the Berlin offices of the Federal Ministry for Economic Cooperation and Development (BMZ) today. Johann Saathoff was appointed Parliamentary State Secretary, and Bärbel Kofler will remain Parliamentary State Secretary at the Development Ministry (BMZ). Niels Annen will be State Secretary at the BMZ.",Reem Alabali Radovan wird neuer Entwicklungsminister,"Reem Alabali Radovan hat sein Amt als Entwicklungsministerin inne. Nach ihrer offiziellen Ernennung durch Bundespräsident Frank-Walter Steinmeier übernahm sie heute offiziell die Nachfolge ihrer Vorgängerin Svenja Schulze in den Berliner Büros des Bundesministeriums für wirtschaftliche Zusammenarbeit und Entwicklung (BMZ). Johann Saathoff wurde zum Parlamentarischen Staatssekretär ernannt, Bärbel Kofler bleibt Parlamentarische Staatssekretärin im Entwicklungsministerium (BMZ). Niels Annen wird Staatssekretär am BMZ sein.",Reem Alabali Radovan se convierte en nuevo Ministro de Desarrollo,"Reem Alabali Radovan ha asumido el cargo de Ministra de Desarrollo. Después de haber sido nombrada formalmente por el Presidente Federal Frank-Walter Steinmeier, ella tomó oficialmente el relevo de su predecesor Svenja Schulze en una ceremonia en las oficinas de Berlín del Ministerio Federal de Cooperación Económica y Desarrollo (BMZ) hoy. Johann Saathoff fue nombrado Secretario de Estado Parlamentario, y Bärbelóller seguirá siendo Secretario de Estado Parlamentario en el Ministerio de Desarrollo (BMZ). Niels Annen será Secretario de Estado en el BMZ.",Reem Alabali Radovan devient nouveau ministre du développement,"Reem Alabali Radovan a pris ses fonctions de Ministre du développement. Après avoir été officiellement nommée par le Président fédéral Frank-Walter Steinmeier, elle a officiellement pris la relève de son prédécesseur Svenja Schulze lors d'une cérémonie aux bureaux de Berlin du Ministère fédéral de la coopération économique et du développement (BMZ) aujourd'hui. Johann Saathoff a été nommé Secrétaire d'État parlementaire, et Bärbel Kofler restera Secrétaire d'État parlementaire au Ministère du développement (BMZ). Niels Annen sera Secrétaire d'État au BMZ.",Reem Alabali Radovan成为新的发展部长,"Reem Alabali Radovan担任发展部长,在联邦总统Frank-Walter Steinmeier正式任命后,她于今天在联邦经济合作与发展部(BMZ)柏林办公室的一次仪式上正式接任前任的Svenja Schulze,任命Johann Saathoff为议会国务秘书,Bärbel Kofler为发展部政务国务秘书,Niels Annn为BMZ国务秘书。"
88,Safeguarding global cooperation in turbulent times,Today in Washington D.C. the first World Bank meeting since US President Donald Trump began his second term in office will draw to a close. Germany was represented at the spring meeting by Development Minister Svenja Schulze as Germany’s World Bank Governor and by the Parliamentary State Secretary to the Minister Niels Annen. At the meeting it became clear that the Bank is well-equipped for the future (...),Schutz der globalen Zusammenarbeit in turbulenten Zeiten,"Heute wird in Washington D.C. das erste Weltbank-Treffen seit dem Amtsantritt des US-Präsidenten Donald Trump seine zweite Amtszeit beenden. Deutschland wurde auf dem Frühjahrstreffen von Entwicklungsminister Svenja Schulze als Deutschlands Weltbank-Gouverneur und vom Parlamentarischen Staatssekretär beim Minister Niels Annen vertreten. Auf dem Treffen wurde deutlich, dass die Bank gut für die Zukunft gerüstet ist (...)",Salvaguardar la cooperación mundial en tiempos turbulentos,"Hoy en Washington D.C., la primera reunión del Banco Mundial desde que el presidente estadounidense Donald Trump comenzó su segundo mandato llegará a su fin. Alemania estuvo representada en la reunión de primavera por el ministro de Desarrollo Svenja Schulze como gobernador del Banco Mundial de Alemania y por el secretario de Estado parlamentario del ministro Niels Annen. En la reunión quedó claro que el Banco está bien equipado para el futuro (...)",Préserver la coopération mondiale en période de turbulence,"Aujourd'hui à Washington D.C. la première réunion de la Banque mondiale depuis que le président américain Donald Trump a commencé son deuxième mandat prendra fin. L'Allemagne a été représentée à la réunion de printemps par le ministre du Développement Svenja Schulze en tant que gouverneur de la Banque mondiale et par le secrétaire d'État parlementaire du ministre Niels Annen. Lors de la réunion, il est devenu clair que la Banque est bien équipée pour l'avenir (...)",在动荡时期保障全球合作,"今天,在华盛顿特区,自美国总统唐纳德·特朗普(Donald Trump)开始第二任期以来的第一次世界银行会议即将结束。 德国作为德国世界银行行长的发展部长斯文雅·舒尔茨(Svenja Schulze)和尼尔斯·安妮(Niels Annn)部长的政务大臣国务大臣(Svenja Schulze)代表德国出席了春季会议。 在这次会议上,银行显然为未来做好准备(......)"
89,"""15 per cent for the 15 per cent"": Global Disability Summit concludes with strong commitments for global inclusion","The third Global Disability Summit, which is taking place in Berlin, will conclude today with concrete outcomes for better inclusion worldwide. The global population includes around 1.3 billion persons with disabilities – 15 per cent of all the people in the world. Now, promoting inclusion is also to be an objective in at least 15 per cent of development projects. That is the intention at the heart of the Amman-Berlin Declaration adopted by more than 80 countries and organisations at the Summit today.","""15 Prozent für die 15 Prozent"": Globaler Behindertengipfel schließt mit starken Zusagen für die globale Inklusion","Der dritte Globale Behindertengipfel, der in Berlin stattfindet, wird heute mit konkreten Ergebnissen für eine bessere Integration weltweit abschließen. Die Weltbevölkerung umfasst rund 1,3 Milliarden Menschen mit Behinderungen – 15 Prozent aller Menschen in der Welt. Jetzt soll auch die Förderung der Inklusion ein Ziel in mindestens 15 Prozent der Entwicklungsprojekte sein. Das ist die Absicht der Erklärung von Amman-Berlin, die heute von mehr als 80 Ländern und Organisationen auf dem Gipfel verabschiedet wurde.","""15 por ciento para el 15 por ciento"": Cumbre Mundial sobre Discapacidad concluye con firmes compromisos para la inclusión mundial","La tercera Cumbre Mundial sobre Discapacidad, que se está celebrando en Berlín, concluirá hoy con resultados concretos para una mejor inclusión en todo el mundo. La población mundial incluye alrededor de 1.300 millones de personas con discapacidad, el 15% de todas las personas del mundo. Ahora, promover la inclusión también debe ser un objetivo en al menos el 15% de los proyectos de desarrollo. Esa es la intención en el corazón de la Declaración de Ammán-Berlín adoptada hoy por más de 80 países y organizaciones en la Cumbre.",« 15 % pour les 15 % » : Le Sommet mondial sur le handicap se termine par des engagements fermes en faveur de l'inclusion mondiale,"Le troisième Sommet mondial sur le handicap, qui se tiendra à Berlin, se terminera aujourd'hui par des résultats concrets en vue d'une meilleure inclusion dans le monde entier. La population mondiale comprend environ 1,3 milliard de personnes handicapées – 15 % de l'ensemble des personnes dans le monde. Aujourd'hui, la promotion de l'inclusion doit également être un objectif dans au moins 15 % des projets de développement.",“15%为15%”:全球残疾问题首脑会议最后作出全球包容的坚定承诺,"第三次全球残疾人峰会将于今天在柏林举行,会议结束时将取得具体结果,促进全世界更好地包容残疾人,全球人口包括约13亿残疾人,占全世界总人口的15%,现在,促进包容也是至少15%发展项目的目标,这是80多个国家和组织在今天首脑会议上通过的《安曼-柏林宣言》的核心意图。"
90,Global summit for persons with disabilities to advance accessibility and inclusion worldwide,"More than 3000 people from some 100 countries, many of them with a disability, are meeting in Berlin for the third Global Disability Summit starting today. The goal is to advance accessibility and inclusion worldwide. The summit is being co-hosted by Germany, represented by the Federal Ministry for Economic Cooperation and Development (BMZ), the Hashemite Kingdom of Jordan and the International Disability Alliance.",Globaler Gipfel für Menschen mit Behinderungen zur Förderung der Zugänglichkeit und Inklusion weltweit,"Mehr als 3000 Menschen aus rund 100 Ländern, viele von ihnen mit Behinderung, treffen sich ab heute in Berlin zum dritten Globalen Behindertengipfel. Ziel ist es, die Zugänglichkeit und Inklusion weltweit zu fördern. Mitveranstaltet wird der Gipfel von Deutschland, vertreten durch das Bundesministerium für wirtschaftliche Zusammenarbeit und Entwicklung (BMZ), das Haschemitische Königreich Jordanien und die Internationale Behindertenallianz.",Cumbre Mundial en favor de las personas con discapacidad para promover la accesibilidad y la inclusión en todo el mundo,"Más de 3000 personas de unos 100 países, muchas de ellas con discapacidad, se reúnen hoy en Berlín para la tercera Cumbre Mundial sobre Discapacidad, cuyo objetivo es promover la accesibilidad y la inclusión en todo el mundo, organizada conjuntamente por Alemania, representada por el Ministerio Federal de Cooperación Económica y Desarrollo (BMZ), el Reino Hachemita de Jordania y la International Disability Alliance.",Sommet mondial pour les personnes handicapées en vue de promouvoir l ' accessibilité et l ' intégration dans le monde,"Plus de 3000 personnes originaires d'une centaine de pays, dont un grand nombre sont handicapées, se réunissent à Berlin pour le troisième Sommet mondial sur les personnes handicapées, à partir d'aujourd'hui. L'objectif est de promouvoir l'accessibilité et l'inclusion dans le monde entier. Le sommet est organisé conjointement par l'Allemagne, représentée par le Ministère fédéral de la coopération économique et du développement (BMZ), le Royaume hachémite de Jordanie et l'Alliance internationale pour les personnes handicapées.","残疾人问题全球首脑会议,推动全世界无障碍环境和包容","来自约100个国家的3 000多人,其中许多是残疾人,从今天起正在柏林参加第三次全球残疾人峰会,目标是在全世界促进无障碍和包容,由德国共同主办,由联邦经济合作与发展部、约旦哈希姆王国和国际残疾人联盟代表。"
91,Closing in on superconducting semiconductors,Plasma Science and Fusion Center researchers created a superconducting circuit that could one day replace semiconductor components in quantum and high-performance computing systems.,Schließen auf supraleitenden Halbleitern,"Die Forscher des Plasma Science and Fusion Centers schufen einen supraleitenden Kreislauf, der eines Tages Halbleiterkomponenten in Quanten- und Hochleistungs-Computing-Systemen ersetzen könnte.",Cierre en semiconductores superconductores,Los investigadores del Centro de Ciencia y Fusión de Plasma crearon un circuito de superconductores que un día podría reemplazar componentes semiconductores en sistemas de computación cuánticos y de alto rendimiento.,Fermeture sur semi-conducteurs supraconducteurs,Les chercheurs du Plasma Science and Fusion Center ont créé un circuit supraconducteur qui pourrait un jour remplacer les composants semi-conducteurs dans les systèmes informatiques quantiques et à haute performance.,关闭超导体半导体,"等离子体科学和融合中心研究人员创建了超导电路,一天可以取代量子和高性能计算系统中的半导体部件。"
92,"A brief history of the global economy, through the lens of a single barge","Ian Kumekawa’s book “Empty Vessel” explores globalization, economics, and the hazy world of short-term transactions known as “the offshore.”","Eine kurze Geschichte der Weltwirtschaft, durch die Linse einer einzigen Barge","Ian Kumekawa s book Empty Vessel, das sich mit Globalisierung, Ökonomie und der verschwommenen Welt der kurzfristigen Transaktionen beschäftigt, die als ""Offshore"" bekannt ist.","Una breve historia de la economía mundial, a través de la lente de una sola barcaza","El libro “Empty Vessel” de Ian Kumekawa explora la globalización, la economía y el nebuloso mundo de las transacciones a corto plazo conocidas como “la costa”.","Une brève histoire de l'économie mondiale, à travers la lentille d'une seule barge","Le livre de Ian Kumekawa explore la mondialisation, l'économie et le monde brumeux des transactions à court terme, connu sous le nom de ""l'offshore"".",以单条驳船为透镜的全球经济简史,伊恩·库梅卡瓦(Ian Kumemakawa)的著作《空船 》 ( Empty Vessel)探讨了全球化、经济学和被称为“海外”的短期交易的隐秘世界。
93,Students and staff work together for MIT’s first “No Mow May”,"With advocacy from GSC Sustain, the No Mow May project supports pollinator habitats and provides educational opportunities.",Studenten und Mitarbeiter arbeiten zusammen für das erste MIT.,Mit der Unterstützung von GSC Sustain unterstützt das Projekt No Mow May Bestäuberhabitate und bietet Bildungschancen.,Estudiantes y personal trabajan juntos para el primer “No Mow May” del MIT,"Con la promoción de GSC Sustain, el proyecto No Mow May apoya los hábitats de polinizadores y ofrece oportunidades educativas.",Les étudiants et le personnel travaillent ensemble pour les MIT.,"Grâce à la défense des intérêts de GSC Sustain, le projet No Mow May soutient les habitats des pollinisateurs et offre des possibilités d'éducation.","学生和教职员工一起为麻省理工学院的第一个 "" 诺莫五月 "" 工作","在全球供应链可持续性的倡导下,No Mow May项目支持授粉者生境,并提供教育机会。"
94,Professor Emeritus Hank Smith honored for pioneering work in nanofabrication,Longtime MIT electrical engineer receives SPIE Frits Zernike Award for Microlithography in recognition of outstanding accomplishments in microlithographic technology.,Professor Emeritus Hank Smith für Pionierarbeit in der Nanofertigung ausgezeichnet,Der langjährige MIT Elektroingenieur erhält den SPIE Frits Zernike Award für Mikrolithographie in Anerkennung herausragender Leistungen in der mikrolithographischen Technologie.,Profesor Emérito Hank Smith honrado por su trabajo pionero en nanofabricación,El ingeniero eléctrico del MIT recibe el premio SPIE Frits Zernike por microlitografía en reconocimiento a los logros sobresalientes en tecnología microlitográfica.,Professeur émérite Hank Smith honoré pour son travail de pionnier en nanofabrication,L'ingénieur électrique MIT de longue date reçoit le prix SPIE Frits Zernike pour la microlithographie en reconnaissance des réalisations exceptionnelles en technologie microlithographique.,荣誉荣誉教授 汉克・史密斯荣誉 荣誉荣誉 纳米制造的开创性工作,"长期的麻省理工学院电气工程师获得SPIE Frits Zernike微土摄影奖,以表彰微土摄影技术的杰出成就。"
