,title-en,content-en,title-de,content-de,title-es,content-es,title-fr,content-fr,title-zh,content-zh
67,Indiana Gov Mike Braun savoring state's moment in national spotlight as Pacers lead NBA Finals,"The NBA Finals are a matchup between two small markets, and Indiana Gov. Mike Braun is making sure he basks in the national spotlight.",Indiana Gov Mike Braun genießen den Moment des Staates im nationalen Rampenlicht als Pacers führen NBA-Finale,"Die NBA Finals sind ein Matchup zwischen zwei kleinen Märkten, und Indiana Gov. Mike Braun sorgt dafür, dass er im nationalen Rampenlicht sitzt.",El gobernador de Indiana Mike Braun saboreando el momento del estado en el centro de atención nacional mientras Pacers lidera las finales de la NBA,"Las finales de la NBA son una coincidencia entre dos mercados pequeños, y el gobernador de Indiana Mike Braun se está asegurando de que se deleita en el centro de atención nacional.",Indiana Gov Mike Braun savourant le moment de l'État dans les projecteurs nationaux alors que Pacers mène les Finales de la NBA,"Les Finales de la NBA sont un matchup entre deux petits marchés, et Indiana Gov. Mike Braun s'assure qu'il se cache sous les projecteurs nationaux.","在Pacers带领NBA决赛时,",NBA决赛是两大小市场和印第安纳政府之间的配对。
68,Coco Gauff says Trump's election led to 'down period' in US following French Open victory,"After winning the 2025 French Open, Coco Gauff reflected on what it means to travel and represent the U.S., where she described time after Donald Trump&apos;s election as a &quot;down period.&quot;","Coco Gauff sagt Trumps Wahl führte zu ""Down-Periode"" in den USA nach French Open Sieg","Nachdem sie die French Open 2025 gewonnen hatte, reflektierte Coco Gauff, was es bedeutet, die USA zu reisen und zu vertreten, wo sie die Zeit nach Donald Trump&apos;s Wahl als &quot;down-Periode beschrieb.&quot;","Coco Gauff dice que la elección de Trump llevó a un ""período de baja"" en EE.UU. después de la victoria del Abierto de Francia","Después de ganar el Abierto de Francia de 2025, Coco Gauff reflexionó sobre lo que significa viajar y representar a Estados Unidos, donde describió el tiempo después de la elección de Donald Trump&apos;s como un período &quot;down.&quot;.","Selon Coco Gauff, l'élection de Trump a mené à une « période de baisse » aux États-Unis suite à la victoire de l'Open","Après avoir remporté l'Open français de 2025, Coco Gauff a réfléchi à ce que signifie voyager et représenter les États-Unis, où elle a décrit le temps après l'élection de Donald Trump&apos;s comme une période &quot;down.&quot;","Coco Gauff说,Trump的当选导致在法式公开胜利后美国“下调期”","Coco Gauff在赢得了2025年的法式开放赛后, 思考旅行的意义并代表美国, 她将Donald Trump&apos; 当选后的时间描述为 & quot; down 期。 & quot;"
69,"Putin raises the stakes on ‘ghost fleet’ security, as NATO launches war games in the Baltic Sea","NATO exercise shows alliance resolve as concerns grow about Russia&apos;s shadow fleet in the Baltic Sea, with incidents of severed cables raising regional tensions","Putin erhöht den Einsatz für „Geisterflotte"" Sicherheit, da die NATO Kriegsspiele in der Ostsee startet","NATO-Übung zeigt, dass Allianzen Entschlossenheit zeigen, wenn die Besorgnis über Russland&Apos wächst; die Schattenflotte in der Ostsee, mit Zwischenfällen von durchtrennten Kabeln, die regionale Spannungen erhöhen","Putin pone en juego la seguridad de la “flota fantasma”, ya que la OTAN lanza juegos de guerra en el Mar Báltico","El ejercicio de la OTAN muestra la determinación de la alianza a medida que crece la preocupación por Rusia y la flota en la sombra en el Mar Báltico, con incidentes de cables cortados que aumentan las tensiones regionales","Poutine soulève les enjeux de la « flotte fantôme » de sécurité, alors que l'OTAN lance des jeux de guerre dans la mer Baltique","L'exercice de l'OTAN montre la résolution de l'alliance au fur et à mesure que les préoccupations concernant la Russie et les pays de la mer Baltique s'intensifient, avec des incidents de câbles coupés qui aggravent les tensions régionales.","北约在波罗的海发动战争游戏,","北约的演习表明,随着俄罗斯和阿波斯人对俄罗斯和阿波斯人的关切日益增长,北约联盟决心;波罗的海的影子船队,断断电缆事件加剧了区域紧张局势"
70,Obama WH physician says Biden doc should have performed cognitive test,Obama&apos;s former doctor states Joe Biden should have undergone cognitive testing while Republicans probe claims of a cover-up of Biden&apos;s mental fitness.,Obama WH Arzt sagt Biden Doc hätte kognitiven Test durchführen sollen,"Obama&apos; ehemaliger Arzt sagt, Joe Biden hätte kognitiven Tests unterzogen werden müssen, während Republikaner die Behauptungen einer Vertuschung von Biden&apos;s geistiger Fitness prüfen.",El médico de Obama WH dice que Biden doc debería haber realizado una prueba cognitiva,Obama&apos;s ex doctor afirma que Joe Biden debería haber sido sometido a pruebas cognitivas mientras los republicanos investigan las afirmaciones de un encubrimiento de Biden&apos;s aptitud mental.,Obama WH médecin dit Biden doc aurait dû effectuer un test cognitif,"Selon l'ancien médecin d'Obama&apos, Joe Biden aurait dû subir des tests cognitifs alors que les républicains procédaient à des recherches sur les allégations d'une dissimulation de la condition mentale de Biden&apos.",奥巴马的WH医生说拜登医生应该进行认知测试,"Obama&apos; 以前的医生Joe Biden应该经过认知测试, 而共和党人却在调查有关Biden&apos; 精神健康的隐蔽的说法。"
71,Trump White House sends message to Minnesota after trans softball pitcher leads team to state championship,"The White House has responded to news of a transgender softball pitcher leading a team in Minnesota to a state championship, defying Trump.","Trump White House sendet Nachricht nach Minnesota, nachdem Trans Softball Pitcher führt Team zu Staatsmeisterschaft","Das Weiße Haus hat auf die Nachricht von einem transgender Softball Pitcher reagiert, der ein Team in Minnesota zu einer Staatsmeisterschaft führt und Trump trotzt.",La Casa Blanca Trump envía mensaje a Minnesota después de que el lanzador trans de softbol lleve al equipo al campeonato estatal,"La Casa Blanca ha respondido a las noticias de un lanzador transgénero de softbol liderando un equipo en Minnesota a un campeonato estatal, desafiando a Trump.",Trump Maison Blanche envoie un message au Minnesota après le lanceur de softball trans conduit l'équipe au championnat d'État,"La Maison Blanche a répondu aux nouvelles d'un lanceur de softball transgenre menant une équipe au Minnesota à un championnat d'État, défiant Trump.",Trump White House 向明尼苏达州发送信息 之后横球垒球投手 带领球队进入州冠军赛,白宫回应了变性软球投手 在明尼苏达带领一支球队 参加州冠军赛 挑战特朗普的消息
72,Trump's CIA director details strategy using Mandarin videos to tap Chinese dissent for intelligence gains,John Ratcliffe discusses CIA&apos;s strategy to recruit Chinese informants through dark web communications while emphasizing his commitment to depoliticizing the intelligence agency.,Trump CIA-Direktor Details Strategie mit Mandarin-Videos zu tippen chinesischen Dissens für Intelligenz Gewinne,"John Ratcliffe diskutiert CIA&apos;s Strategie, chinesische Informanten durch dunkle Web-Kommunikation zu rekrutieren und gleichzeitig sein Engagement für die Entpolitisierung der Geheimdienste zu betonen.",El director de la CIA de Trump detalla la estrategia usando videos mandarín para aprovechar el disentimiento chino para obtener ganancias de inteligencia,John Ratcliffe discute la estrategia de CIA&apos para reclutar informantes chinos a través de comunicaciones web oscuras mientras enfatiza su compromiso con la despolitización de la agencia de inteligencia.,Le directeur de la CIA de Trump détaille la stratégie en utilisant des vidéos Mandarin pour taper la dissidence chinoise pour obtenir des gains de renseignement,John Ratcliffe discute de la stratégie de la CIA&apos pour recruter des informateurs chinois par le biais de communications sur le Web sombres tout en soulignant son engagement à dépolitiser l'agence de renseignement.,Trump的中央情报局主任详细策略 使用普通话视频 窃听中国异见 以获取情报,"John Ratcliffe讨论中央情报局和阿波斯; 通过暗网通讯招募中国线人的战略,"
73,"DAVID MARCUS: CNN’s airing of ‘Good Night, and Good Luck' proves it has learned nothing",CNN&apos;s live telecast of &quot;Good Night and Good Luck&quot; draws criticism for comparing Trump to McCarthy while ignoring media&apos;s own failures in Biden coverage and Harris interview editing,"DAVID MARCUS: CNN-Luftung von „Gute Nacht und Glück"" beweist, dass sie nichts gelernt hat","CNN&apos;s Live-Fernsehsendung von &quot;Good Night und Good Luck&quot; zieht Kritik dafür, Trump mit McCarthy zu vergleichen, während sie Media&apos ignoriert;s eigene Fehler in Biden Berichterstattung und Harris Interview Bearbeitung","DAVID MARCUS: La emisión de CNN de ""Buenas noches y buena suerte"" demuestra que no ha aprendido nada",CNN&apos;s transmisión en vivo de &quot;Buenas noches y buena suerte&quot; dibuja críticas por comparar a Trump con McCarthy mientras ignora los propios fracasos de medios & apos;s en la cobertura de Biden y edición de entrevistas de Harris,"DAVID MARCUS: La diffusion de CNN de ""Bonne nuit, et Bonne chance"" prouve qu'elle n'a rien appris",CNN&apos;s télédiffusé en direct de &quot;Good Night and Good Luck&quot; attire des critiques pour avoir comparé Trump à McCarthy tout en ignorant les échecs des médias dans la couverture de Biden et la rédaction d'entrevues avec Harris,CNN播出的“晚安与好运”证明它一无所获,"CNN&apos; 现场直播 & qopt; Good Night and good Luck & quot; 的 & quot; 即时直播 & quot; Good Night and Good Luck& quot; 受到批评, 批评将Trmp 和 McCarthy 比较, 却忽略媒体&apos; 自己在 Biden 报导和 Harris 采访编辑中的失败。"
74,American Culture Quiz: Test yourself on festival firsts and summery snacks,"The American Culture Quiz is a weekly test of our unique national traits, trends, history and people. This time, test your knowledge of festival firsts and summery snacks.",American Culture Quiz: Testen Sie sich auf Festivalpremieren und sommerlichen Snacks,"Das American Culture Quiz ist ein wöchentlicher Test unserer einzigartigen nationalen Merkmale, Trends, Geschichte und Menschen. Testen Sie dieses Mal Ihr Wissen über Festivalpremieren und sommerliche Snacks.",American Culture Quiz: Pruébate en los primeros festivales y aperitivos veraniegos,"The American Culture Quiz es una prueba semanal de nuestras características, tendencias, historia y gente nacionales únicas. Esta vez, prueba tu conocimiento de los primeros festivales y aperitivos veraniegos.",American Culture Quiz: Testez-vous sur les premières fêtes et les collations estivales,"Le Quiz de la culture américaine est un test hebdomadaire de nos caractéristiques nationales uniques, tendances, histoire et personnes. Cette fois, testez vos connaissances des premières fêtes et des collations estivales.",美国文化Quiz:在节庆第一季和夏夜小吃上测试自己,美国文化Quiz是对我们独特的民族特征、趋势、历史和民族的每周一次测试。 这次测试你们对节日第一和夏夜小吃的知识。
75,'Little House on the Prairie' star Melissa Gilbert says being 'raggedy and dirty' landed her iconic role,"Melissa Gilbert was a guest on the “Hey Dude… The 90s Called!&quot; podcast, and she detailed how she scored the role of Laura Ingalls on &quot;Little House on the Prairie.&quot;","'Little House on the Prairie'-Star Melissa Gilbert sagt, dass sie 'zerbrechlich und schmutzig' war, landete ihre ikonische Rolle.","Melissa Gilbert war Gast beim ""Hey Dude""... Die 90er Jahre Called!&quot; Podcast, und sie detailliert, wie sie die Rolle von Laura Ingalls auf &quot;Little House auf der Prairie.&quot;","""Pequeña Casa en la Prairie"" la estrella Melissa Gilbert dice que ser ""rabiosa y sucia"" consiguió su papel icónico","Melissa Gilbert fue invitada en el “Hey Dude... The 90s Called!&quot; podcast, y detalló cómo anotó el papel de Laura Ingalls en &quot;Little House en la Prairie.&quot;.",La star Melissa Gilbert dit qu'être « ragguée et sale » a posé son rôle emblématique,"Melissa Gilbert était une invitée sur le ""Hey Dude... The 90s Called!&quot; podcast, et elle a détaillé comment elle a marqué le rôle de Laura Ingalls sur &quot;Little House sur la Prairie.&quot;","玛莉莎·吉尔伯特的明星Melissa Gilbert 说自己是""肮脏肮脏的"" 扮演了她的标志性角色","Melissa Gilbert是“Hey Dude...90s Called! & quot; podcast”的嘉宾,她详细介绍了Laura Ingalls如何在Prairie & quot上赢得Laura Ingalls的角色。"
76,"Golf has a long history in the White House — but for Trump, it's more than a pastime","From Taft to Biden, presidents have had varying relationships with golf, with Trump&apos;s approach standing out for using the course as a place to conduct business and forge political relationships.",Golf hat eine lange Geschichte im Weißen Haus — aber für Trump ist es mehr als ein Zeitvertreib,"Von Taft bis Biden hatten Präsidenten unterschiedliche Beziehungen zum Golf, mit Trump&apos;s Ansatz, der sich dafür aussprach, den Kurs als Ort zu nutzen, um Geschäfte zu führen und politische Beziehungen zu schmieden.","Golf tiene una larga historia en la Casa Blanca — pero para Trump, es más que un pasatiempo","Desde Taft hasta Biden, los presidentes han tenido diferentes relaciones con el golf, con Trump&apos;s enfoque que destaca por utilizar el curso como un lugar para conducir negocios y forjar relaciones políticas.","Le golf a une longue histoire à la Maison Blanche — mais pour Trump, c'est plus qu'un passe-temps","De Taft à Biden, les présidents ont eu des relations variées avec le golf, avec Trump&apos; approche se distinguant pour utiliser le cours comme un endroit pour mener des affaires et forger des relations politiques.",高尔夫在白宫历史悠久 但对于特朗普来说 这不仅仅是消遣,"从塔夫特到拜登,总统与高尔夫球有着不同的关系,特朗普和阿波斯(Trump&apos);利用课程作为做生意和形成政治关系的场所。"
77,Former sex trafficking victim pardoned by President Trump reveals disturbing secrets of legal brothel,Rebecca &quot;Bekah&quot; Charleston was arrested in 2006 for tax evasion. The White House said she is a victim of sex trafficking who was forced into prostitution. She was pardoned in 2020.,Ehemaliges von Präsident Trump begnadigtes Opfer des Sexhandels enthüllt beunruhigende Geheimnisse des legalen Bordells,"Rebecca &quot;Bekah&quot; Charleston wurde 2006 wegen Steuerhinterziehung verhaftet. Das Weiße Haus sagte, sie sei ein Opfer des Sexhandels, der zur Prostitution gezwungen wurde. Sie wurde 2020 begnadigt.",Ex víctima de tráfico sexual perdonada por el presidente Trump revela inquietantes secretos de burdel legal,Rebecca &quot;Bekah&quot; Charleston fue arrestada en 2006 por evasión de impuestos. La Casa Blanca dijo que es víctima de tráfico sexual que fue forzada a prostituirse. Fue indultada en 2020.,L'ancienne victime du trafic sexuel graciée par le président Trump révèle des secrets inquiétants de bordel légal,Rebecca &quot;Bekah&quot; Charleston a été arrêtée en 2006 pour évasion fiscale. La Maison Blanche a déclaré qu'elle était victime de trafic sexuel qui a été forcé à la prostitution.,被特朗普总统赦免的前性贩运受害者透露了法律妓院的令人不安的秘密,"Rebecca & qut; Bekah&qut; Bekah&qot; Charleston 2006年因逃税被捕。 白宫说她是性贩运的受害者,被迫卖淫。 她于2020年获得赦免。"
78,Bold move to keep Americans safe from ‘terrorists’ is basis for US travel ban for some African nations,"President Trump enacted travel restrictions for 10 African countries, citing national security concerns, terrorism threats and high visa overstay rates.","Mutiger Schritt, um die Amerikaner vor ""Terroristen"" zu schützen, ist Grundlage für US-Reiseverbot für einige afrikanische Nationen","Präsident Trump hat Reisebeschränkungen für 10 afrikanische Länder erlassen, unter Berufung auf nationale Sicherheitsbedenken, Terrorismusbedrohungen und hohe Visa-Über Aufenthaltsraten.",Un movimiento audaz para mantener a los estadounidenses a salvo de los ‘terroristas’ es la base para la prohibición de viajar en Estados Unidos para algunas naciones africanas,"El presidente Trump promulgó restricciones de viaje para 10 países africanos, citando preocupaciones de seguridad nacional, amenazas de terrorismo y altas tasas de permanencia en el país.",Un mouvement audacieux pour garder les Américains à l'abri des «terroristes» est la base de l'interdiction de voyager aux États-Unis pour certaines nations africaines,"Le président Trump a imposé des restrictions aux déplacements de 10 pays africains, invoquant des préoccupations en matière de sécurité nationale, des menaces terroristes et des taux élevés de sursis aux visas.",让美国人免受「恐怖份子」威胁的大胆举动是美国禁止某些非洲国家旅行的根据。,"特朗普总统以国家安全关切、恐怖主义威胁和签证逾期滞留率高为由,对10个非洲国家实施旅行限制。"
79,BRETT TOLMAN: Mountain runner facing prison for using trail bureaucrats secretly deemed off-limits,"Record-setting runner Michelino Sunseri faces prosecution for trail use in Grand Tetons National Park, revealing concerns about overcriminalization and unchecked government power",BRETT TOLMAN: Bergläufer gegen Gefängnis wegen der Verwendung von Trail-Bürokraten heimlich als außerhalb der Grenzen,"Rekordläufer Michelino Sunseri steht vor der Anklage wegen Trail-Nutzung im Grand Tetons National Park, was Bedenken über Überkriminalisierung und ungeprüfte Regierungsmacht aufdeckt",BRETT TOLMAN: Corredor de montaña frente a la cárcel por usar burócratas en secreto considerados fuera de los límites,"Michelino Sunseri, corredor de récords, se enfrenta a una acusación por uso de senderos en el Parque Nacional Grand Tetons, revelando preocupaciones sobre la sobrecriminalización y el poder del gobierno sin control",BRETT TOLMAN: Coureur de montagne face à la prison pour avoir utilisé des bureaucrates de piste secrètement considérés hors limites,"Michelino Sunseri, coureur de record, fait l'objet de poursuites pour utilisation de sentiers dans le parc national Grand Tetons, révélant des inquiétudes au sujet de la surcriminalisation et du pouvoir gouvernemental incontrôlé.",山地跑者因使用被秘密视为禁止入境的官僚人员而面临监狱,"在大特顿国家公园使用线索, 引起人们对过度定罪及政府权力不受控制的关切。"
80,Iconic Hollywood filmmaker David Mamet dishes on why he was 'kicked out of the left',"Playwright, author and filmmaker David Mamet broke down his conservative values and criticized the entertainment industry&apos;s focus on &quot;social consciousness&quot; on &quot;Brian Kilmeade Show.&quot;","Iconic Hollywood Filmemacher David Mamet Geschirr darüber, warum er 'aus der Linken gekickt' wurde","Playwright, Autor und Filmemacher David Mamet brach seine konservativen Werte und kritisierte die Unterhaltungsindustrie&apos;s Fokus auf &quot;soziales Bewusstsein&quot; auf &quot;Brian Kilmeade Show.&quot;","El icónico cineasta de Hollywood, David Mamet, habla de por qué fue ""golpeado por la izquierda""","El dramaturgo, autor y cineasta David Mamet rompió sus valores conservadores y criticó el entretenimiento industria&apos;s enfoque en &quot;conciencia social&quot; en &quot;Brian Kilmeade Show.&quot;","David Mamet, réalisateur iconique d'Hollywood, fait des plats sur la raison pour laquelle il a été ""tiré de la gauche""","David Mamet, dramaturge, auteur et cinéaste, a brisé ses valeurs conservatrices et critiqué l'industrie du divertissement et a critiqué l'importance accordée à &quot;conscience sociale &quot; à &quot;Brian Kilmeade Show.&quot;","著名好莱坞电影制片人David Mamet的盘子 是关于他为什么被""踢出左边""的原因","Playwright、作者和电影制片人David Mamet打破了他的保守价值观,批评娱乐业和娱乐业; 关注 & qop; 社会意识和配额; 关注 & quot; Brian Kilmeade show. & quot;"
81,Closing in on a breakthrough to mobilize sustainable private investment in emerging markets and developing economies,"Just a few months after its launch, the Hamburg Sustainability Platform (HSP), an initiative of public and private institutions is laying the foundation for truly scaling private investment for sustainable development in emerging markets and developing countries. [...] Signing a joint declaration of intent at the Hamburg Sustainability Conference 2025, the HSP reaffirmed their joint commitment to remove structural obstacles that so far stood in the way of mobilizing large-scale investments.",Abschluss eines Durchbruchs zur Mobilisierung nachhaltiger privater Investitionen in Schwellen- und Entwicklungsländern,"Wenige Monate nach dem Start der Hamburg Sustainability Platform (HSP) legt eine Initiative öffentlicher und privater Institutionen den Grundstein für eine wirkliche Skalierung privater Investitionen für nachhaltige Entwicklung in Schwellen- und Entwicklungsländern. [...] Mit der Unterzeichnung einer gemeinsamen Absichtserklärung auf der Hamburg Sustainability Conference 2025 bekräftigte die HSP ihr gemeinsames Engagement, strukturelle Hindernisse zu beseitigen, die bisher der Mobilisierung von Großinvestitionen im Wege standen.",Finalización de un gran avance para movilizar la inversión privada sostenible en los mercados emergentes y las economías en desarrollo,"Apenas unos meses después de su lanzamiento, la Plataforma de Sostenibilidad de Hamburgo (HSP), una iniciativa de instituciones públicas y privadas, está sentando las bases para una verdadera ampliación de la inversión privada para el desarrollo sostenible en los mercados emergentes y los países en desarrollo. [...] Al firmar una declaración conjunta de intenciones en la Conferencia de Sostenibilidad de Hamburgo 2025, el HSP reafirmó su compromiso conjunto de eliminar los obstáculos estructurales que hasta ahora se interponían en la movilización de inversiones a gran escala.",Conclusion sur une percée en vue de mobiliser des investissements privés durables dans les marchés émergents et les économies en développement,"Quelques mois seulement après son lancement, la Hamburg Sustainability Platform (HSP), une initiative d'institutions publiques et privées, jette les bases d'une véritable expansion de l'investissement privé pour le développement durable dans les marchés émergents et les pays en développement. [...] Signant une déclaration d'intention commune à la Conférence de Hambourg sur la durabilité 2025, la HSP a réaffirmé son engagement commun à éliminer les obstacles structurels qui, jusqu'à présent, empêchaient de mobiliser des investissements à grande échelle.",结束在新兴市场和发展中经济体调动可持续私人投资,"在启动《汉堡可持续性平台》仅仅几个月后,公私机构的一项倡议,即《汉堡可持续性平台》,为真正扩大私人投资,促进新兴市场和发展中国家的可持续发展奠定了基础。 [.]在2025年汉堡可持续性会议上签署联合意向宣言,《汉堡可持续性平台》重申,它们共同承诺消除迄今阻碍调动大规模投资的结构性障碍。"
