,title-de,content-de,title-en,content-en,title-zh,content-zh
26,Bundesentwicklungsministerin Alabali Radovan zum UNHCR-Weltflüchtlingsbericht,"Ministerin Alabali Radovan: „Kein Mensch flieht freiwillig. 122 Millionen Menschen sind weltweit auf der Flucht vor Kriegen, Krisen und Verfolgung – so viele wie nie zuvor. Die meisten Menschen wollen möglichst nahe ihrer Heimat bleiben, sie suchen entweder im eigenen Land oder in Nachbarstaaten Zuflucht. Es sind Länder wie Jordanien, der Libanon, Äthiopien oder Kenia, die die Hauptlast schultern und dabei Enormes leisten. Doch vielerorts fehlt es an Unterkünften, Jobs, an medizinischer Versorgung und Schulen für die Kinder. Mit der deutschen Entwicklungszusammenarbeit unterstützen wir die Aufnahmeländer, damit sie Geflüchtete gut versorgen und ihnen Perspektiven bieten können. (...)""",Federal Minister for Development Alabali Radovan on the UNHCR World Refugee Report,"Minister Alabali Radovan: ""No human is fleeing voluntarily. 122 million people worldwide are fleeing wars, crises and persecution – more than ever before. Most people want to stay as close to their homeland as possible, they seek refuge either in their own country or in neighbouring countries. They are countries such as Jordan, Lebanon, Ethiopia or Kenya, which bear the main burden and do so in an enormous way. But in many places there is a lack of shelter, jobs, medical care and schools for the children. With German development cooperation, we support the host countries so that they can provide good care for refugees and offer them prospects. (...)""",联邦发展部长阿拉巴利·拉多万 难民专员办事处儿童报告,"内政部长阿拉巴利·拉多万: 没有人自愿逃离. 122百万人在世界各地逃避战争,危机和迫害. 多数人希望尽可能接近自己的家园,寻求庇护,要么留在自己的国家或邻国. 他们是像约旦,黎巴嫩,埃塞俄比亚或肯尼亚这样的国家,承担着主要负担,承担着教育责任. 但许多国家缺乏住所,工作,医疗保健和儿童学校. 德军发展合作有助于收容国,使他们能够很好地照顾他们,并且能展望他们. (...)"
27,Musikfestival in Großbritannien: Polizei überprüft antiisraelische Rufe auf Glastonbury-Festival,"Die BBC überträgt das Glastonbury-Festival live, als ein Musiker Stimmung gegen die israelische Armee macht. Jetzt werden strafrechtliche Schritte geprüft.",UK Music Festival: Police Investigate Anti-Israeli Calls at Glastonbury Festival,The BBC broadcasts the Glastonbury Festival live as a musician makes mood against the Israeli army. Now criminal proceedings are being examined.,音乐节在英国举行:警方正在查阅格拉斯顿伯里节的反以色列号召.,BBC正在现场直播格拉斯顿伯里节日 音乐家对以色列军队的情绪. 现在正在接受刑事调查.
28,Debatte: Bürgergremium mit Vorschlägen zur Finanzpolitik,"<a href=""https://www.zeit.de/news/2025-06/29/buergergremium-mit-vorschlaegen-zur-finanzpolitik""><img src=""https://img.zeit.de/news/2025-06/29/buergergremium-mit-vorschlaegen-zur-finanzpolitik-image-group/wide__148x84"" style=""float: left; margin-right: 5px;"" /></a> None",Debate: Citizen's body with proposals on fiscal policy,"<a href=""https://www.zeit.de/news/2025-06-29/buergergremium-mit-vorschlaegen-zur-finanzpolitik""><img src=""https://img.zeit.de/news/2025-06-29/buergergremium-mit-vorschlaegen-zur-finanzpolitik-image-group/wide__148x84"" style=""float: left; margin-right: 5px;"" /></a> None","辩论: 公民协会,有关于财政政策的建议","< a href=""http://www.Time.en/news2025/0/29/bugger-length-length"
29,Russischer Krieg gegen die Ukraine: Ukraine steigt aus Landminenabkommen aus,"Die Ukraine reagiert auf die ""Realität des Krieges"" und verlässt das internationale Abkommen. Die ukrainische Luftwaffe meldet den Absturz eines F-16-Jets. Das Liveblog",Russian war against Ukraine: Ukraine withdraws from landmine agreements,"Ukraine reacts to the ""reality of war"" and leaves the international agreement. The Ukrainian Air Force reports the crash of an F-16 jet. The live blog",俄罗斯对乌克兰的战争:乌克兰退出地雷协议.,"乌克兰对""战争的现实""做出反应,并抛弃了国际协议. 乌克兰空军报告说F -16客机坠毁. 现场博客是现场报道."
30,"Tödliche Schüsse in Oldenburg: ""Lorenz war kein Einzelfall"" - Forderung nach Reformen","<a href=""https://www.zeit.de/news/2025-06/29/lorenz-das-war-mord-500-leute-protestieren-in-oldenburg""><img src=""https://img.zeit.de/news/2025-06/29/lorenz-das-war-mord-500-leute-protestieren-in-oldenburg-image-group/wide__148x84"" style=""float: left; margin-right: 5px;"" /></a> None","Deadly shots in Oldenburg: ""Lorenz was not an isolated case"" - demand for reforms","<a href=""https://www.zeit.de/news/2025-06-29/lorence-das-war-mord-500-people-protest-in-oldenburg""><img src=""https://img.zeit.de/news/2025-06-29/lorence-das-war-mord-500-people-protest-in-oldenburg-image-group/wide_148x84"" style=""float: left; margin-right: 5px;"" /></a> None","Oldenburg的致命枪击: ""洛瑞兹不是个个案"" 要求改革","<href=""http://www.Time.en/news2025/0/29/Lolement - - 曾经500人抗议在-oldenburg""> <img shrc=""http://img.time.com/news 2025/0/6/29/Lolition- the -war -5500 -man - opposed in-oldenburg-group/wide_148x84"" style=""float: left: margin-right: 5px;"" //a> None"
31,Polizei sucht Zeugen: Betrunkener baut gleich zwei Unfälle,"<a href=""https://www.zeit.de/news/2025-06/29/betrunkener-baut-gleich-zwei-unfaelle""><img src=""https://img.zeit.de/news/2025-06/29/betrunkener-baut-gleich-zwei-unfaelle-image-group/wide__148x84"" style=""float: left; margin-right: 5px;"" /></a> None",Police are looking for witnesses: Drunks are building two accidents,"<a href=""https://www.zeit.de/news/2025-06-29/drunk-build-equal-two-unfaelle""><img src=""https://img.zeit.de/news/2025-06-29/drunk-build-equal-two-unfaelle-image-group/wide_148x84"" style=""float: left; margin-right: 5px;"" /></a> None",警察正在寻找证人:醉鬼正在制造两起事故.,<\ \ \ \ \ \ \ \ \ \ \ \ \ \ \ \ \ \ \ \ \ \ \ \ \ \ \ \ \ \ \ \ \ \ \ \ \ \ \ \ \ \ \ \ \ \ \ \ \ \ \ \ \ \ \ \ \ \ \ \ \ \ \ \ \ \ \ \ \ \ \ \ \ \ \ \ \ \ \ \ \ \ \ \ \ \ \ \ \ \ \ \ \ \ \ \ >
32,Nach dem Krieg mit Iran: Dobrindt bei Netanjahu: Unterstützung für Angriffe auf Iran,"<a href=""https://www.zeit.de/news/2025-06/29/dobrindt-bei-netanjahu-unterstuetzung-fuer-angriffe-auf-iran""><img src=""https://img.zeit.de/news/2025-06/29/dobrindt-bei-netanjahu-unterstuetzung-fuer-angriffe-auf-iran-image-group/wide__148x84"" style=""float: left; margin-right: 5px;"" /></a> None",After the war with Iran: Dobrindt at Netanyahu: Support for attacks on Iran,"<a href=""https://www.zeit.de/news/2025-06-29/dobrindt-bei-netanyahu-support-for-attacks-on-iran""><img src=""https://img.zeit.de/news/2025-06-29/dobrindt-bei-netanyahu-support-for-attacks-on-iran-image-group/wide_148x84"" style=""float: left; margin-right: 5px;"" /></a> None","与伊朗开战后,内塔尼亚胡的杜布赖特在内塔尼亚胡:支持对伊朗的袭击.","<href=""http://www.时间.en/news2025/0/29/briet netbridge - netjahu - entered assault to irran""> <img src=""http://img.time.com/news 2025/25/6/29/dundit-respect- netbulidt"
33,American Football: Berlin Thunder gegen Rhein Fire: Niederlage und Misstöne,"<a href=""https://www.zeit.de/news/2025-06/29/berlin-thunder-gegen-rhein-fire-niederlage-und-misstoene""><img src=""https://img.zeit.de/news/2025-06/29/berlin-thunder-gegen-rhein-fire-niederlage-und-misstoene-image-group/wide__148x84"" style=""float: left; margin-right: 5px;"" /></a> None",American Football: Berlin Thunder vs Rhein Fire: Defeat and Mistones,"<a href=""https://www.zeit.de/news/2025-06-29/berlin-thunder-gegen-rhein-fire-siege-und-misstoene""><img src=""https://img.zeit.de/news/2025-06-29/berlin-thunder-gegen-rhein-fire-siege-und-misstoene-image-group/wide_148x84"" style=""float: left; margin-right: 5px;"" /></a> None",美国橄榄球: 柏林雷雨对莱茵火: 失败和失败.,"<href=""http://www.时间.en/news2025/25/0/wide_1448x84"" shift=""machine-float: left: margin-right: 5px;"""
34,Verbrechen: Frau und Kleinkind liegen tot an Weg - Mordkommission,"<a href=""https://www.zeit.de/news/2025-06/29/frau-und-kleinkind-liegen-tot-an-weg-mordkommission""><img src=""https://img.zeit.de/news/2025-06/29/frau-und-kleinkind-liegen-tot-an-weg-mordkommission-image-group/wide__148x84"" style=""float: left; margin-right: 5px;"" /></a> None",Crime: Woman and toddler lying dead on their way - Homicide,"<a href=""https://www.zeit.de/news/2025-06-29 Women and small children lying dead to way murder commission""><img src=""https://img.zeit.de/news/2025-06-29 Women and small children lying dead to way murder commission-image-group/wide__148x84"" style=""float: left; margin-right: 5px;"" /></a> None",犯罪: 妻子和小孩死在路边 凶杀案,<\ \ \ \ \ \ \ \ \ \ \ \ \ \ \ \ \ \ \ \ \ \ \ \ \ \ \ \ \ \ \ \ \ \ \ \ \ \ \ \ \ \ \ \ \ \ \ \ \ \ \ \ \ \ \ \ \ \ \ \ \ \ \ \ \ \ \ \ \ \ \ \ \ \ \ \ \ \ \ \ \ \ \ \ \ \ \ \ \ \ \ \ \ \ \ \ >
35,Rauchverbot in Frankreich: Frankreich verbietet Rauchen an Stränden,"In Frankreich gilt ab sofort ein Rauchverbot an öffentlichen Stränden, Parks und Bushaltestellen. Bei einem Verstoß droht eine Geldstrafe von 135 Euro.",Smoking ban in France: France bans smoking on beaches,"In France there is now a ban on smoking on public beaches, parks and bus stops. In the event of a violation, a fine of 135 euros is imposed.","法国禁止吸烟,法国禁止海滩吸烟","从现在起,在法国,禁止吸烟于公共海滩,公园和巴士站. 如果违反规定,罚款将达135欧元."
36,Wesseling: Betrunkener kehrt nach Unfallflucht zurück,"<a href=""https://www.zeit.de/news/2025-06/29/betrunkener-kehrt-nach-unfallflucht-zurueck""><img src=""https://img.zeit.de/news/2025-06/29/betrunkener-kehrt-nach-unfallflucht-zurueck-image-group/wide__148x84"" style=""float: left; margin-right: 5px;"" /></a> None",Wesseling: Drunker returns after accident escape,"<a href=""https://www.zeit.de/news/2025-06-29/drunken-keft-nach-unfallflucht-zurueck""><img src=""https://img.zeit.de/news/2025-06-29/drunken-keft-nach-unfallflucht-zurueck-image-group/wide__148x84"" style=""float: left; margin-right: 5px;"" /></a> None",威灵顿:醉汉在意外逃逸后回来,"<href=""http://www.时间.en/news2025/0/29/drunker/float/float: left: margin-right: 5px;"""
37,Wetter: Hitzewelle kommt mit bis zu 37 Grad auch in den Norden,"<a href=""https://www.zeit.de/news/2025-06/29/hitzewelle-kommt-mit-bis-zu-37-grad-auch-in-den-norden""><img src=""https://img.zeit.de/news/2025-06/29/hitzewelle-kommt-mit-bis-zu-37-grad-auch-in-den-norden-image-group/wide__148x84"" style=""float: left; margin-right: 5px;"" /></a> None",Weather: Heat wave comes to the north with up to 37 degrees,"<a href=""https://www.zeit.de/news/2025-06-29/heat wave-comes-with-to-37-grade-even-in-the-norden""><img src=""https://img.zeit.de/news/2025-06-29/heat wave-comes-with-to-37-grade-even-in-the-norden-image-group/wide_148x84"" style=""float: left; margin-right: 5px;"" /></a> None",天气:热浪会到北边至37度,"<href=""http://www.时间.en/news2025/029/09热浪,""> <imgsrc=""http://img. time.com/news 2025/629/29高温波,附带-37度/度/度/度/7-7-7-7-7/7/004"" square=""float: left: margin-right: 5px;"" / > None"
38,"Golanhöhen: ""Wir sind von ihnen umzingelt""",Israels Armee setzt sich im Süden Syriens immer weiter fest. Auf dem Golan berichten Bewohner von Festnahmen und Einschüchterungen. Die Wut auf die Besatzer wächst.,"Golanhöhen: ""We are surrounded by them""",Israel's army continues to establish itself in the south of Syria. On the Golan people report arrests and intimidation. The anger on the occupiers grows.,"戈兰高地 ""我们被他们包围了""","以色列军队继续在叙利亚南部扎根. 在戈兰,人们报道逮捕和恐吓. 占领军的愤怒正在增加."
39,Bachmann-Preis 2025: Des is a Katastrophe,Natascha Gangl hat zu Recht den Bachmann-Preis gewonnen. Der Klagenfurter Wettbewerb offenbarte ansonsten: Die Gegenwartsliteratur leidet wohl unter Wiederholungszwang.,Bachmann Prize 2025: Des is a Katastrophe,"Natascha Gangl has rightly won the Bachmann Prize. Otherwise, the Klagenfurt Competition revealed that contemporary literature is probably suffering from repetitive pressure.",巴克曼的2025年奖品:,纳塔莎·甘道尔正确地赢得了Bachmann奖. 投诉的比赛暴露了这一点:现在的文学可能正遭受着重复的折磨.
40,Migrationspolitik: SPD-Parteitag verlangt Wiederaufnahme des Familiennachzugs,Die Delegierten des SPD-Parteitags wollen den Familiennachzug für subsidiär Schutzberechtigte neu ermöglichen. Die Aussetzung wurde eben erst vom Bundestag beschlossen.,Migration policy: SPD party congress demands resumption of family reunification,The delegates of the SPD party congress want to make the family reunification possible for subsidiary protected persons. The suspension was just decided by the Bundestag.,移民政策:党内民主党会议要求家庭复健,社民党党大会的代表们想重启家庭福利计划 为次要保护者重新开放. 暂停是联邦日才决定的.
41,Massentourismus: Cannes erlaubt nur noch ein Kreuzfahrtschiff pro Tag,Nach Nizza geht auch Cannes gegen den Kreuzfahrttourismus vor. Ab 2026 reguliert die französische Küstenstadt das Anlegen der riesigen Passagierschiffe.,Mass tourism: Cannes only allows one cruise ship per day,"After Nice Cannes also takes action against cruise tourism. From 2026, the French coastal city regulates the docking of the huge passenger ships.","大众旅游业,坎恩每天只允许一艘游轮","从2026年开始,法国海岸城市将控制大型客船"
42,Schneider: Konflikte überwinden,Zehn Tage Verhandlungen auf der UN-Klimakonferenz in Bonn brachten nur geringe Fortschritte. Umweltminister Schneider mahnt mehr Tempo an.,Schneider: Overcoming Conflicts,Ten days of negotiations at the UN Climate Change Conference in Bonn made little progress. Environment Minister Schneider urges more speed.,施耐德: 克服冲突,在波恩的联合国气候变化会议上10天的谈判进展甚微. 环境部长施耐德加速了.
43,Merz sieht Mercosur-Abkommen auf der Zielgeraden,Aktuelle Informationen über die deutsche Außenpolitik und die internationalen Beziehungen Deutschlands.<br />,Merz sees Mercosur agreement on the target line,Current information on German foreign policy and international relations in Germany.<br />,Merz看到水星协议在终点线上,关于德国外交政策和德国国际关系的最新信息.
44,Wadephul: Europa in guter Position gegenüber Iran,Laut Außenminister Johann Wadephul hat Europa bei einer möglichen Fortsetzung der Atomgespräche mit dem Iran „ein ganz gutes Blatt“.,Wadephul: Europe in a good position vis-à-vis Iran,"According to Foreign Minister Johann Wadephul, in a possible continuation of the nuclear talks with Iran, Europe has ""a very good leaf"".",韦德福:欧洲与伊朗关系良好,"国务卿约翰·韦德福说,如果欧洲继续与伊朗进行核谈判,欧洲将会非常成功."
45,Merz trifft EU-Staats- und Regierungschefs,"EU-Gipfel befasst sich vor allem mit Ukraine, Israel und der US-Zollpolitik",Merz meets EU Heads of State and Government,"EU summit focuses on Ukraine, Israel and US customs policy",默兹会见欧盟各国元首和政府首脑 Merz meets European State and Head of European.,"欧盟首脑会议主要关注乌克兰,以色列和美国的外交政策"
46,Körber-Preis für deutsche Pionierin des Quanteninternets,Stephanie Wehner erhält einen der weltweit höchstdotierten Forschungspreise.,Körber Prize for German Pioneer of Quantum Internet,Stephanie Wehner receives one of the world's most endowed research awards.,德国量子网先锋的篮球奖,Stephanie Renner得到世界最高研究奖之一
47,Deutschland unterstützt Millionen Menschen weltweit,Die Gesellschaft für Internationale Zusammenarbeit (GIZ) engagiert sich in 120 Ländern für Wohlstand und Sicherheit. Gestern stellte sie ihren Jahresbericht 2024 vor.,Germany supports millions of people worldwide,The Gesellschaft für Internationale Zusammenarbeit (GIZ) is committed to prosperity and security in 120 countries. Yesterday it presented its annual report 2024.,德国支持全世界数百万人,"国际合作协会 (GIZ) 在120个国家致力于繁荣和安全. 昨天,它提交了2024年的年度报告."
48,"Merz, Macron und Starmer appellieren an Iran","Deutschland, Frankreich und Großbritannien warnen vor weiterer Eskalation.","Merz, Macron and Starmer appeal to Iran","Germany, France and Great Britain warn of further escalation.","Merz, Macron 和 Starmer 呼吁伊朗.","德国,法国和英国都警告要进一步升级"
49,Reiche: Deutschland und USA sind enge Wirtschaftspartner,Bundeswirtschaftsministerin Reiche hob in Washington die intensive Handelspartnerschaft zwischen Deutschland und den USA hervor.,Rich: Germany and the USA are close economic partners,Federal Minister of Economics Reiche highlighted the intensive trade partnership between Germany and the USA in Washington.,富人:德国和美国是紧密的经济伙伴,德国和美德之间建立了紧密的贸易伙伴关系
50,Europäer wollen Verhandlungen mit Iran fortsetzen,"Die Außenminister von Deutschland, Frankreich und Großbritannien ziehen ein positives Fazit des Treffens mit ihrem iranischen Kollegen.",Europeans want to continue negotiations with Iran,"The Foreign Ministers of Germany, France and Great Britain draw a positive conclusion from the meeting with their Iranian colleague.",欧洲想继续与伊朗谈判,"德国,法国和英国的外交部长们正与伊朗的同僚会面."
51,"Deutschland, England und Frankreich verhandeln mit Iran",Außenminister treffen sich in Genf zu Gesprächen über Teherans Atomprogramm.,"Germany, England and France negotiate with Iran",Foreign Ministers meet in Geneva for talks on Tehran's nuclear programme.,"德国,英国和法国都与伊朗谈判",外交部长将在日内瓦讨论德黑兰核计划
52,Bericht aus Berlin: Klöckner verteidigt Regenbogenflaggen-Entscheidung,Trotz Kritik wehte zum Christopher Street Day keine Regenbogenflagge auf dem Reichstag. Im Bericht aus Berlin verteidigt Bundestagspräsidentin Klöckner ihre Entscheidung. Sie müsse neutral sein - auch im Umgang mit der AfD.,Report from Berlin: Klöckner defends rainbow flag decision,"Despite criticism, there was no rainbow flag on the Reichstag at Christopher Street Day. In the report from Berlin, President Klöckner defends her decision. She must be neutral - also in dealing with the AfD.",来自柏林的报道: 卷饼工在维护彩虹旗的决策,"尽管有批评,但克里斯多夫街日的旗帜并未在帝国纪念日出现. 柏林的报告中指出,德国总统柯克纳正在捍卫她的决定. 她必须保持中立,包括与AfD打交道."
53,Hongkongs letzte pro-demokratische Partei vor der Auflösung,Sie ist die letzte pro-demokratische Oppositionspartei in der chinesischen Sonderverwaltungszone: Die Liga der Sozialdemokraten steht in Hongkong vor der Auflösung. Als Grund nennt sie den enormen Druck aus Peking.,Hong Kong's Last Pro-Democratic Party Before Dissolution,"It is the last pro-democratic opposition party in the Chinese special administrative zone: the League of Social Democrats is facing dissolution in Hong Kong. As a reason, it calls the enormous pressure from Beijing.",解散前香港最后一个支持民主的政党,"她是中国特别行政区最后一位支持民主的反对派党:香港社会民主党联盟面临解散. 其原因是,它称北京的巨大压力."
54,Aussterbender Beruf in China: Die letzten Lastenträger von Chongqing,"Chinas Megametropole Chongqing ist in den Berg gebaut. Früher säumten Chongqings berühmte Lastenträger das Stadtbild. Ein Knochenjob, doch der Beruf stirbt langsam aus. Von Benjamin Eyssel.",Extinction in China: The Last Load Carriers of Chongqing,"China's mega metropolis Chongqing is built in the mountain. Formerly, Chongqing's famous carrier lineed the cityscape. A bone job, but the profession slowly dies out. By Benjamin Eyssel.",中国已故的职业: 重庆最后的运货人,"中国的变形金刚是建在那座山里的. 从前,中国著名的货船运货员为这座城市的画作铺平了道路. 一个骨架工作,但工作缓慢. 本杰明·艾索 (Benjamin Eissel) 的画."
55,Ukraine-Liveblog: ++ Ukraine verlässt Abkommen über Minen-Verbot ++,Nach den baltischen Staaten will auch die Ukraine aus dem Abkommen zum Verbot von Antipersonenminen austreten. Auch neue Sanktionen der EU werden nach Angaben des Kreml nicht zu einem Ende Krieges gegen die Ukraine führen.,Ukraine live blog: ++ Ukraine leaves agreement on mine ban ++,"After the Baltic states, Ukraine also wants to withdraw from the agreement to ban anti-personnel mines. According to the Kremlin, new EU sanctions will also not lead to an end to war against Ukraine.","乌克兰立体博客:++乌克兰退出""地雷禁运协定""++","在波罗的海国家之后,乌克兰也想退出""禁止杀伤人员地雷公约."" 根据克里姆林宫的说法,新的欧盟制裁也不会结束对乌克兰的战争."
56,Hitzewelle in Deutschland: Fast 40 Grad erwartet,"Deutschland steht in den kommenden Tagen eine Hitzewelle bevor, regional sind bis zu 39 Grad möglich. Der Deutsche Wetterdienst mahnt zur Vorsicht: Solche Temperaturen können für den Körper gefährlich werden.",Heat wave in Germany: Almost 40 degrees expected,"Germany is facing a heat wave in the coming days, regionally up to 39 degrees are possible. The German Weather Service warns for caution: such temperatures can become dangerous for the body.",德国热浪预计将近40度,"德国未来几天将面临热浪,地区气温将达39度. 德国气象局警告说,温度会对身体造成威胁."
57,Österreichische Autorin Gangl gewinnt Ingeborg-Bachmann-Preis,Die Österreicherin Natascha Gangl hat den renommierten Ingeborg-Bachmann-Preis gewonnen. In ihrem Text geht es um ein Verbrechen der NS-Zeit. Die Jury lobte die sprachliche Präzision und die dichte Atmosphäre.,Austrian author Gangl wins Ingeborg Bachmann Prize,The Austrian Natascha Gangl has won the prestigious Ingeborg Bachmann Prize. Her text is about a crime of the Nazi era. The jury praised the linguistic precision and the dense atmosphere.,奧地利作家黑手黨贏得英格博格·博格·博克曼獎,奥地利女权运动家纳塔莎·甘道尔赢得了著名的英格博格-博曼奖. 她的台词中提到的是NS时代的罪行. 陪审团称赞语言精准度和大气层.
58,Irans Nuklearprogramm: Wer darf Atomwaffen haben - und wer nicht?,"Israel und die USA haben ihre Militärschläge gegen den Iran damit begründet, dass Teheran eigene Atomwaffen bauen wolle. Aber warum dürfen einige Staaten Atomwaffen haben und andere nicht? Von Christoph Kehlbach.",Iran's nuclear program: Who can have nuclear weapons - and who can't?,Israel and the US have justified their military attacks against Iran by the fact that Tehran wants to build its own nuclear weapons. But why are some states allowed to have nuclear weapons and others not? By Christoph Kehlbach.,"伊朗的核计划,谁可以拥有核武器 谁不能呢?",以色列和美国的军事行动是基于德黑兰打算制造自己的核武器. 但为什么有些国家可以拥有核武器而其他国家则不能?
59,Iran könnte laut IAEA bald wieder Uran anreichern,"Der Chef der Internationalen Atomenergie-Agentur, Grossi, geht davon aus, dass der Iran nach den Angriffen bald wieder in der Lage sein wird, Uran anzureichern. Der Streit um eine Fortführung der Kontrollbesuche geht weiter.","According to the IAEA, Iran could soon replenish uranium","The head of the International Atomic Energy Agency, Grossi, assumes that Iran will soon be able to enrich uranium again after the attacks. The dispute over the continuation of the verification visits continues.","根据国际原子能机构的说法,伊朗可以很快地增加铀浓缩量",国际原子能机构局长格罗斯 (Grossi) 认为袭击后伊朗将重新获得铀浓缩. 持续控制访问的争端仍在继续.
60,SPD-Parteitag fordert Vorbereitung von AfD-Verbotsverfahren,"Zum Abschluss hat der SPD-Parteitag über ein AfD-Verbotsverfahren beraten. Bei einer Abstimmung sprachen sich die Delegierten für entsprechende Vorbereitungen aus. Parteichef Klingbeil sprach von einer ""historischen Aufgabe"".",SPD Party Congress calls for preparation of AfD ban procedures,"Finally, the SPD Party Congress discussed an AfD ban procedure. In a vote, the delegates voted for appropriate preparations. Party leader Klingbeil spoke of a ""historical task"".",SPD党会议要求准备AfD禁运程序,"党内党内党内党内会议讨论了一项AFD禁令. 投票时,代表们同意为此做准备. 党领袖克林贝尔提到了一项""历史性任务."""
61,Nahost-Liveblog: ++ Israel ruft zu Evakuierungen im Gazastreifen auf ++,"Das israelische Militär hat Palästinenser im Norden des Gazastreifens zur Evakuierung aufgerufen. IAEA-Chef Grossi warnt, dass der Iran binnen Monaten wieder Uran anreichern könnte.",Middle East live blog: ++ Israel calls for evacuations in the Gaza Strip ++,The Israeli military has called on Palestinians in the north of the Gaza Strip to evacuate. IAEA leader Grossi warns that Iran could replenish uranium within months.,"中东词汇博客:++以色列要求在加沙地带疏散,然后++++","以色列军队已在加沙北部召回巴勒斯坦人撤离. 国际原子能机构总裁格罗西警告说,伊朗可以在几个月内重新浓缩铀."
