,title-de,content-de,title-en,content-en,title-zh,content-zh
60,Ausländerfeindliche Krawalle in Nordirland reißen nicht ab,"Zwei rumänisch sprechende Jungen sollen in Nordirland versucht haben, ein Mädchen zu vergewaltigen. In der dritten Nacht nacheinander kommt es deswegen zu Ausschreitungen, ein Freizeitzentrum brennt. Wieder werden Einsatzkräfte angegriffen.",Anti-alien riots in Northern Ireland do not tear down,"Two Romanian-speaking boys in Northern Ireland are said to have tried to rape a girl. On the third night one after the other, riots occur, a leisure centre burns.",北爱尔兰的仇外暴动不会消失的,"两名讲罗马尼亚语的男孩在北爱尔兰试图强奸一个女孩. 在第三天晚上,暴乱开始,休闲中心着火. 行动部队又遭到袭击."
61,Wirtschaftsinstitute rechnen mit baldigem Ende der Krise in Deutschland,Nach jahrelanger Krise dürfte es für die deutsche Wirtschaft 2026 wieder bergauf gehen. Die führenden Forschungsinstitute haben ihre Konjunkturprognosen deutlich erhöht. Ein Risiko bleibt aber die US-Handelspolitik.,Economic institutes expect the crisis to end soon in Germany,"After many years of crisis, the German economy is expected to resurrect in 2026. Leading research institutes have significantly increased their economic forecasts, but US trade policy remains a risk.",经济机构预计德国危机即将结束,"在经历了多年的危机后,德国经济将恢复到2026年. 主要研究机构大幅提高了经济预测率,但风险依然是美国贸易政策."
62,Studie: Fast ein Fünftel der Neubauten in Großstädten mit Indexmiete,"Insgesamt zahlen nur wenige Mieter in Deutschland eine sogenannte Indexmiete, die an die Inflation gekoppelt ist. Allerdings gibt es regionale Unterschiede - und einen eindeutigen Trend bei neuen Immobilien.",Study: Almost one fifth of new buildings in large cities with index rent,"Overall, only a few tenants in Germany pay a so-called index rent, which is linked to inflation. However, there are regional differences - and a clear trend in new properties.",研究:几乎有五分之一的新建筑 位于有索引的大型城市.,"总的来说,在德国,很少有房客会支付所谓的房价,与通胀挂钩. 但是,在区域上存在差异 - 和对新房地产的明显趋势."
63,Passagierflugzeug in Indien abgestürzt - viele Tote befürchtet,Ein Flugzeug der Gesellschaft Air India ist in der indischen Stadt Ahmedabad nach dem Start abgestürzt. An Bord sollen mehr als 240 Menschen gewesen sein. Der Gesundheitsminister spricht von vielen Toten. Die Maschine war auf dem Weg nach London.,Passenger plane crashed in India - many dead feared,A plane from the Air India company crashed in the Indian city of Ahmedabad after taking off. More than 240 people were on board. The Minister of Health speaks of many deaths. The plane was on its way to London.,印度的飞机坠毁 许多人担心死亡,"印度航空公司的飞机在印度阿哈迈德巴达坠毁,据说机上有240多人. 卫生部长说有许多人死亡. 飞机正在前往伦敦的路上."
64,"SPD-Politiker verteidigen das Russland-""Manifest""","Ein ""Manifest"" mehrerer SPD-Mitglieder sorgt zwei Wochen vor dem Bundesparteitag für mächtig Unruhe in der Partei. Die Unterzeichner verteidigen sich - und verweisen auf die Schlappen bei den vergangenen Wahlen.","SPD politicians defend the Russia ""Manifesto""","A ""manifesto"" of several members of the SPD is causing massive unrest in the party two weeks before the Federal Party Congress. The signatories defend themselves - and refer to the slats in the past elections.","社民党领导人正在捍卫俄国的""管理""",几名社民党成员在党前两周在党内引起了严重的骚动. 签署方自卫 - 并指出了过去选举的缺点.
65,Hilfsorganisation in Gaza meldet acht Tote durch Hamas-Anschlag,Sie sollen den Menschen in Gaza helfen und Essen ausgeben: Nun sind acht Mitarbeiter der Gaza Humanitarian Foundation auf dem Weg zu einem Verteilzentrum getötet worden. Die US-Stiftung macht die Hamas für den Anschlag verantwortlich.,Aid organization in Gaza reports eight deaths from Hamas attack,They are supposed to help the people of Gaza and spend food: now eight employees of the Gaza Humanitarian Foundation have been killed on their way to a distribution center. The U.S. Foundation blames Hamas for the attack.,加沙的援助组织报告说 哈马斯遭到八人死亡,"他们希望帮助加沙居民,花食物:现在,加沙人道主义基金会的八名工作人员在前往一个分支中心的路上被杀害. 美国基金会把袭击事件归咎于哈马斯."
66,Nahost-Liveblog: ++ Bericht über Tote nahe einer Verteilstelle ++,Im Gazastreifen hat es nach palästinensischen Angaben wieder Tote nahe einer Verteilstelle für Hilfsgüter gegeben. Das israelische Parlament hat eine vorläufige Abstimmung zur Selbstauflösung abgelehnt.,Middle East Liveblog: ++ Report about dead people near a distribution point ++,"In the Gaza Strip, according to Palestinian information, there were again deaths near a distribution point for aid supplies, and the Israeli Parliament has rejected a preliminary vote on self-dissolution.","中东参考博客:++ 报告死亡情况,离分区很近,并+++","在加沙地带,根据巴勒斯坦情报,又有人死亡,靠近援助分支点. 以色列议会拒绝了临时性投票,拒绝进行自我解决."
67,Trotz massiver Kritik: Bahn bleibt bei Familienreservierung hart,Die Deutsche Bahn bleibt dabei: Ab dem 15. Juni 2025 wird es keine Familienreservierung mehr geben. Die neue Preispolitik sorgt für breite Empörung bei Politikern und Fahrgast- und Sozialverbänden.,Despite massive criticism: Bahn remains hard on family reservations,"Deutsche Bahn will continue to do so: from 15 June 2025, family reservations will no longer be available. The new pricing policy will cause widespread indignation among politicians and passenger and social associations.","尽管有强烈的批评,但铁路还是硬的,因为家庭保留是硬的.","从2025年6月15日起,德国铁路将不再有家庭保留. 新的价格政策将引发政客和乘客和社会团体的愤怒."
68,Was über die neue Corona-Variante Nimbus bekannt ist,"Nimbus - so lautet der Name einer neuen Corona-Variante, die seit ein paar Tagen für Aufmerksamkeit sorgt. Laut WHO breitet sie sich schneller aus als andere Varianten. Wie gefährlich ist sie? Von Nina Kunze.",What is known about the new Corona version Nimbus,"Nimbus - this is the name of a new Corona variant that has been attracting attention for a few days. According to WHO, it spreads faster than other variants. How dangerous is it? From Nina Kunze.",关于新的科罗娜变形人Nimbus的报道,"奈布思 - - 这是一种新的科罗娜变种的名字,它已经引起了几天的注意. 世界卫生组织认为它比其他变种更迅速传播. 它有多危险?"
69,Mehr als 200 Festnahmen nach Demonstrationen in Los Angeles,In Los Angeles hat die Polizei nach Protesten mehr als 200 Menschen festgenommen. Heute werden neue Nationalgardisten erwartet - mehrere kalifornische Bürgermeister sprechen sich für ein Ende der Razzien aus.,More than 200 arrests following demonstrations in Los Angeles,"In Los Angeles, after protests, the police arrested more than 200 people. Today, new National Guards are expected - several Californian mayors are calling for an end to the raids.",在洛杉矶示威后逮捕了200多人,"洛杉矶警方在抗议后逮捕了200多人. 今天,新的国家警卫队正在等待,数名加利福尼亚市长要求停止搜捕."
70,Währungen: Preiswerter Urlaub dank günstiger Wechselkurse?,Bei der Suche nach dem nächsten Urlaubsziel lohnt sich ein Blick auf den Wechselkurs. Seit Jahresbeginn hat der Euro deutlich an Stärke gegenüber dem Dollar gewonnen. Werden Reisen dadurch günstiger? Von Bianca von der Au.,Currencies: Cheap holiday thanks to favourable exchange rates?,"Looking for the next holiday destination is worth looking at the exchange rate. Since the beginning of the year, the euro has gained significantly in strength compared to the dollar. Will travel be cheaper? From Bianca from the Au.","货币:货币价值的假日,因为汇率便宜?","寻找下一个假期目标值得一看汇率. 从今年开始,欧元对美元的强度就大增. 这能带来更便宜的旅行吗?"
71,"Podcast 15 Minuten: Brennpunkt Grundschule, Freibäder, Sylter Goldschakal",15 Minuten diesmal mit Sprachproblemen bei Erstklässlern: Viele müssen das Schuljahr wiederholen. Wie Bürger Freibäder vor der Schließung retten. Und warum auf Sylt ein Goldschakal für Wirbel sorgt.,"Podcast 15 minutes: focal point primary school, outdoor pools, Sylver Goldschakal",15 minutes this time with speech problems with first graders: many have to repeat the school year. How citizens save outdoor pools from closing. And why on Sylt a gold jackal causes vertebrae.,"播客15分钟: 小学,免费浴室,双层金砖","学生语言问题15分钟:很多人必须复习学年,就像公民从关闭中拯救自由浴一样,为什么Sylt的金币会引起骚乱?"
72,11KM-Podcast: Eine Spritze Hoffnung: mRNA-Impfung gegen Hautkrebs,"Es wäre eine medizinische Revolution: Ein mRNA-Impfstoff könnte in Zukunft gegen Hautkrebs helfen. Der Podcast 11KM über eine Studie, die Patienten und Forscher hoffen lässt.",11KM podcast: One syringe Hope: mRNA vaccination against skin cancer,It would be a medical revolution: an mRNA vaccine could help against skin cancer in the future. Podcast 11KM about a study that makes patients and researchers hope.,注射一针希望: 抗皮肤癌的MRNA疫苗,那将是一个医学革命:将来的MRNA疫苗将有助于治疗皮肤癌. 播客11KM研究的一项研究让病人和研究者都抱有希望.
73,Rund 122 Millionen Menschen laut UN-Bericht auf der Flucht,"Kriege, Konflikte und Vertreibung - einem UN-Bericht zufolge sind weltweit rund 122 Millionen Menschen auf der Flucht. Besonders dramatisch sei die Lage im Sudan. Vor allem Syrer konnten aber in ihre Heimat zurückkehren. Von K. Hondl.",Around 122 million people on the run according to the UN report,"Wars, conflicts and displacement - according to a UN report, around 122 million people are fleeing worldwide. The situation in Sudan is particularly dramatic. Above all Syrians were able to return to their homeland. By K. Hondl.","据联合国报告,大约1.122亿人在逃亡","根据联合国的报告,战争,冲突和流离失所 - - 全世界大约有122万人在逃. 苏丹的情况尤其戏剧化. 但叙利亚人,特别是从K. Hondl那里返回家园."
74,Europa und Trump bei G7: Mit niedrigen Erwartungen nach Kanada,"Ukraine, Handel, Sanktionen: Gesprächsthemen für die EU und die USA beim G7-Gipfel gibt es einige. Doch obwohl einige EU-Staatschefs Beziehungen zu Trump aufgebaut haben, bleiben die Erwartungen niedrig. Von J. Mayr.",Europe and Trump at G7: Low expectations for Canada,"Ukraine, trade, sanctions: There are some topics for discussion for the EU and the US at the G7 summit. However, although some EU leaders have established relations with Trump, expectations remain low. By J. Mayr.",对加拿大的期望很低,"乌克兰,贸易,制裁:欧盟和美国在七国集团峰会上讨论的话题. 但是,尽管一些欧盟国家元首已经与特朗普建立了关系,但人们的期望仍然很低. 由J. Mayr (J. Mayr) 提出."
75,Hochseeschutzgebiete dringend benötigt,Die Hochsee ist eine Art rechtsfreier Raum. Nicht einmal anderthalb Prozent davon stehen unter Schutz. Doch das soll sich jetzt ändern. Von Jenny von Sperber.,High-seas protected areas urgently needed,The high seas are a kind of legal-free space. Not even one and a half percent of them are protected. But this should change now. By Jenny von Sperber.,急需高度戒备的海域,"高海是某种没有权利的空间,甚至没有1.5%受到保护,但现在该改变. 珍妮·冯·冯·雀鹰."
76,Bericht des Auswärtigen Amtes - Menschenrechtslage im Irak bleibt prekär,"Im Irak gibt es laut einem vertraulichen Lagebericht des Auswärtigen Amtes weiterhin Menschenrechtsverletzungen durch Polizei, Armee und Milizen. Der Bericht, der dem NDR vorliegt, dient als Grundlage für Entscheidungen über Asylanträge.",Report of the Federal Foreign Office - Human rights situation in Iraq remains precarious,"According to a confidential report by the Foreign Office, there are still violations of human rights by police, army and militia in Iraq. The report submitted to the NDR serves as the basis for decisions on asylum applications.",外交部的报告 - 伊拉克的人权状况仍然脆弱,"在伊拉克,根据国务院的机密报告,警察,军队和民兵继续侵犯人权. 报告是关于寻求庇护的决定的基础."
77,Erste Rufe nach einem schärferen Waffengesetz in Österreich,Nach dem Amoklauf mit zehn Toten herrscht in Österreich Trauer. Doch es werden auch erste Rufe nach einem schärferen Waffengesetz laut. Denn der 21-Jährige besaß Pistole und Schrotflinte ganz legal. Von Wolfgang Vichtl.,First calls for a sharper law on weapons in Austria,"After the rampage with ten dead people, there is mourning in Austria. But there are also first calls for a sharper weapon law. Because the 21-year-old had a gun and shotgun quite legally. By Wolfgang Vichtl.",首先呼吁在奥地利制定更严厉的武器法案,"在与十人死亡的爆炸后,奥地利在悲伤之中,但也有人大声呼吁一项更严厉的武器法案,因为21岁的年轻人拥有枪和猎枪. 由沃夫冈·文特尔 (Wolfgang Vichtel) 提供."
78,Leichen von zwei weiteren Geiseln im Gazastreifen geborgen,Israels Armee hat im Gazastreifen die Leichen zweier weiterer Geiseln geborgen. Beide Männer stammten aus dem Kibbuz Nir Oz. Mehr als 50 Menschen befinden sich weiter in den Händen der Hamas.,Corpses of two more hostages in the Gaza Strip,Israel's army has recovered the bodies of two other hostages in the Gaza Strip. Both men came from the kibbutz Nir Oz. More than 50 people are still in Hamas' hands.,加沙地带又发现两名人质的尸体,以色列军队在加沙地带又救回了两名人质的尸体. 两人都是从基布兹尼奥兹 (Kabuz Nir Oz) 来的. 超过50人被哈马斯控制.
79,USA ziehen Botschaftspersonal aus dem Irak ab,"Familienangehörige von Diplomaten, nicht dringend notwendiges Personal: Die USA reduzieren ihr Botschaftspersonal im Irak. Anlass könnte ein möglicher Angriff Israels auf den Iran sein - oder scheiternde Atomverhandlungen.",United States withdraw embassy staff from Iraq,"Family members of diplomats, not urgently needed personnel: The US is reducing its embassies in Iraq. The reason could be a possible attack by Israel on Iran - or failing nuclear negotiations.",美国正在从伊拉克撤出大使馆人员,"外交官家属,非必要人员: 美国正在缩减驻伊拉克大使馆的人员. 原因可能是以色列可能对伊朗发动袭击,或者核谈判失败."
80,Baden-Württembergs Finanzminister zum Investitions-Booster,"Viele Kommunen sind finanziell am Limit, sagt Baden-Württembergs Finanzminister Bayaz im tagesthemen-Interview. Obwohl der beschlossene Finanzbooster der Bundesregierung ein Loch in die Landeskassen reißt, sieht er darin eine Chance.",Baden-Württemberg's Finance Minister on the Investment Booster,"Many municipalities are financially close to the limit, says Baden-Württemberg's Finance Minister Bayaz in the day-to-day interview. Although the federal government's approved financial booster breaks a hole in the state funds, he sees this as an opportunity.",巴顿沃恩特伯格的投资波士顿投资财长财政部长,"巴登-沃恩特伯格的財政部长巴耶兹 (Bayaz) 在一天的主题访问中表示,许多地方都面临有限的财政限制. 尽管联邦政府所决定的金融巨头正在给本国的金融机构打洞,但他却看到了机会."
81,Marktbericht: Ernüchterung an der Wall Street,Die Wall Street tat sich heute mit den neuesten Inflationszahlen sowie dem Rahmenabkommen im Zollstreit mit China schwer. Zuvor hatte auch schon der DAX geschwächelt.,Market Report: Disillusionment on Wall Street,"Wall Street today was difficult with the latest inflation figures and the framework agreement in the customs dispute with China. Previously, the DAX had weakened.",市场报告: 华尔街的清醒状态,"华尔街今天对最近发生的通胀和与中国进行海关纠纷的框架协议都非常困难. 迄今为止,DAX也在削弱."
82,Argentinien will Botschaft 2026 nach Jerusalem verlegen,"Israel betrachtet ganz Jerusalem als Hauptstadt - international ist das umstritten. Nun will Argentinien seine Botschaft dorthin verlegen. Ein Schritt, der weit über die Bedeutung eines bloßen Standortwechsels hinausgeht.",Argentina wants to move embassy to Jerusalem in 2026,Israel considers all of Jerusalem as a capital city - internationally this is controversial. Argentina now wants to move its message there. A step that goes far beyond the importance of a mere change of location.,阿根廷想将使馆2026年迁往耶路撒冷,"以色列全耶路撒冷都认为是首都,国际上都存在争议. 现在阿根廷想将其大使馆转移到那里去,这一步远超越了仅仅改变地点的重要性."
83,Weinstein in neuem Prozess teils wieder schuldig befunden,"2024 war ein Schuldspruch gegen Ex-Hollywoodmogul Weinstein kassiert worden. Nun wurde er in einem Fall erneut des sexuellen Übergriffs für schuldig befunden. In einem zweiten wurde er freigesprochen, ein dritter wird noch beraten.",Weinstein found guilty in a new trial,"In 2024, a verdict against Ex-Hollywoodmogul Weinstein had been taken. Now, in one case, he was again found guilty of sexual assault. In a second, he was acquitted, and a third is still being discussed.","韦恩斯坦在新审判中被判有罪,部分罪名成立","2024年,他被判有罪,罪名是前霍利伍德大公温斯坦. 现在,他又被判有罪,在另一起案件中,他无罪,第三起罪名成立."
84,Ukraine-Liveblog: ++ Südosteuropäische Staaten verurteilen Invasion ++,Die Regierungschefs südosteuropäischer Staaten haben auf einem Gipfel in Odessa die russische Invasion verurteilt. Die Ukraine hat die sterblichen Überreste von mehr als 1.200 getöteten Soldaten erhalten. Die Entwicklungen vom Mittwoch zum Nachlesen.,Ukraine live blog: ++ Southeast European states condemn invasion ++,"At a summit in Odessa, the leaders of South-East European countries condemned the Russian invasion, and Ukraine received the remains of more than 1,200 soldiers killed.",乌克兰词汇博客:++东南欧国家谴责入侵++,东南欧国家领导人在奥德萨的一次峰会上谴责了俄罗斯入侵. 乌克兰已经接收了超过1200名士兵的遗体. 周三的事态发展.
85,Beach-Boys-Mitgründer Brian Wilson gestorben,"Er galt als kreativer Kopf der Band, seine Songs waren der Soundtrack zum American Dream der damaligen Zeit. Nun ist Beach-Boys-Mitgründer Brian Wilson im Alter von 82 Jahren gestorben. Von Mia von Hirsch.",Beach Boys co-founder Brian Wilson died,"He was considered a creative head of the band, his songs were the soundtrack to the American Dream of the time. Now Beach Boys co-founder Brian Wilson died at the age of 82. By Mia von Hirsch.",海滩男孩的创始人布莱恩·威尔逊死了,"他被认为是乐队的创造者,他的歌曲是当时的""美国梦""的首歌. 现在""海滩男孩""的创始人布莱恩·威尔逊在82岁就死了. 由米娅·冯·赫希特写的."
86,"Nationalgarde in L.A.: ""Trump strebt autoritäres Präsidialregime an""","Proteste in L.A. - und der US-Präsident entsendet die Nationalgarde. Dahinter erkennt der Historiker Berg den Wunsch Trumps, möglichst uneingeschränkt zu regieren. Dafür wende dieser einen ""klassischen Schachzug"" an.","National Guard in L.A.: ""Trump strives for authoritarian presidential regime""","Protests in L.A. - and the US President sends the National Guard. Behind this, historian Berg acknowledges Trump's desire to rule as unreservedly as possible. He uses a ""classical move"" to do so.","洛杉矶的国民警卫队 ""Trump追求专制总务制度""","在洛城和美国总统派遣国民警卫队抗议,历史学家山区承认特朗普希望尽可能充分地治理国家. 为此,他呼吁采取""古典主义行动."""
87,Tusk gewinnt Vertrauensabstimmung: Verschnaufpause statt Aufbruch,Polens proeuropäischer Regierungschef Tusk hat die wichtige Abstimmung im Parlament klar überstanden. Der Konflikt mit dem neuen rechtskonservativen Präsidenten Nawrocki liegt aber noch vor ihm. Von Martin Adam.,Tusk wins vote of confidence: breather instead of departure,"Poland's pro-European head of government Tusk has clearly survived the important vote in Parliament, but the conflict with the new right-wing Conservative President Nawrocki is still ahead of him.",Tusk赢得信任投票 暂停而不是离开,波兰的亲欧洲领导人塔斯克明确地通过了议会选举. 但与新任右翼保守党总统纳维洛基的冲突仍在他面前. 由马丁·亚当 (Martin Adam) 提出.
88,Schwierige Aufräumarbeiten nach Wintereinbruch in Südafrika,"Schnee, Glatteis und Hochwasser haben in den vergangenen Tagen weite Teile Südafrikas lahmgelegt. Mindestens 49 Menschen starben. Die Schäden sind enorm, die Aufräumarbeiten werden dauern. Von Stephan Ueberbach.",Difficult clean-up after winter break in South Africa,"Snow, ice and floods have paralyzed large parts of South Africa in recent days. At least 49 people died. The damage is enormous, the clean-up work will take place. By Stephan Ueberbach.","冬季入侵南非后,南非的清理工作非常艰苦","在过去的几天中,雪,甘油和淡水已经摧毁了南非的大部分地区. 至少49人死亡. 损失非常大,清理工作很费周折. 由斯蒂芬·尤伯巴赫负责."
89,"Anklage gegen Linksextremisten - Das Ende der ""Hammerbande""?","Johann G. galt als Kopf der ""Hammerbande"" und als einer der meistgesuchten Linksextremisten des Landes. Nun müssen sich er und weitere mutmaßliche Mitglieder wohl bald vor Gericht verantworten. Es geht auch um den Vorwurf des versuchten Mordes.","Indictment against left-wing extremists - The end of the ""Hammerband""?","Johann G. was regarded as the head of the ""Hammerbande"" and as one of the most wanted left-wing extremists in the country. Now he and other suspected members probably have to answer to court soon. It is also about the accusation of the attempted murder.","对左派极端分子的指控 - ""锤子帮""的终结?","约翰·G被列为""哈马斯帮""的头号通缉犯之一,是全国首屈一指的左派极端分子之一. 现在,他和其他被指控的成员可能很快就要接受审判了. 这还涉及企图谋杀的罪名."
90,Vorstoß zu Außenpolitik: Die Zerrissenheit der SPD,"Mehr Diplomatie, weniger Waffen - gerade in der Auseinandersetzung mit Russland: Kurz vor dem Parteitag treten prominente SPD-Politiker eine alte Debatte neu los. Der Beitrag zeigt, wie zerrissen die SPD in dieser Frage ist. Von D. Hebestreit.",Advance to Foreign Policy: The Distortion of the SPD,"More diplomacy, fewer weapons - especially in the conflict with Russia: Just before the party congress, prominent SPD politicians are reopening an old debate. The article shows how torn the SPD is on this issue. By D. Hebestreit.",针对外交政策的先发制人: 社民党的分崩离析,"更多的外交,更少的武器 - - 就在与俄罗斯的冲突中 - - 党内领袖们正在进行一场旧的辩论. 社民党在这方面的分崩离析. D. 希比的争执."
