,title-en,content-en,title-de,content-de,title-es,content-es,title-fr,content-fr,title-zh,content-zh
83,Closing in on a breakthrough to mobilize sustainable private investment in emerging markets and developing economies,"Just a few months after its launch, the Hamburg Sustainability Platform (HSP), an initiative of public and private institutions is laying the foundation for truly scaling private investment for sustainable development in emerging markets and developing countries. [...] Signing a joint declaration of intent at the Hamburg Sustainability Conference 2025, the HSP reaffirmed their joint commitment to remove structural obstacles that so far stood in the way of mobilizing large-scale investments.",Abschluss eines Durchbruchs zur Mobilisierung nachhaltiger privater Investitionen in Schwellen- und Entwicklungsländern,"Wenige Monate nach dem Start der Hamburg Sustainability Platform (HSP) legt eine Initiative öffentlicher und privater Institutionen den Grundstein für eine wirkliche Skalierung privater Investitionen für nachhaltige Entwicklung in Schwellen- und Entwicklungsländern. [...] Mit der Unterzeichnung einer gemeinsamen Absichtserklärung auf der Hamburg Sustainability Conference 2025 bekräftigte die HSP ihr gemeinsames Engagement, strukturelle Hindernisse zu beseitigen, die bisher der Mobilisierung von Großinvestitionen im Wege standen.",Finalización de un gran avance para movilizar la inversión privada sostenible en los mercados emergentes y las economías en desarrollo,"Apenas unos meses después de su lanzamiento, la Plataforma de Sostenibilidad de Hamburgo (HSP), una iniciativa de instituciones públicas y privadas, está sentando las bases para una verdadera ampliación de la inversión privada para el desarrollo sostenible en los mercados emergentes y los países en desarrollo. [...] Al firmar una declaración conjunta de intenciones en la Conferencia de Sostenibilidad de Hamburgo 2025, el HSP reafirmó su compromiso conjunto de eliminar los obstáculos estructurales que hasta ahora se interponían en la movilización de inversiones a gran escala.",Conclusion sur une percée en vue de mobiliser des investissements privés durables dans les marchés émergents et les économies en développement,"Quelques mois seulement après son lancement, la Hamburg Sustainability Platform (HSP), une initiative d'institutions publiques et privées, jette les bases d'une véritable expansion de l'investissement privé pour le développement durable dans les marchés émergents et les pays en développement. [...] Signant une déclaration d'intention commune à la Conférence de Hambourg sur la durabilité 2025, la HSP a réaffirmé son engagement commun à éliminer les obstacles structurels qui, jusqu'à présent, empêchaient de mobiliser des investissements à grande échelle.",结束在新兴市场和发展中经济体调动可持续私人投资,"在启动《汉堡可持续性平台》仅仅几个月后,公私机构的一项倡议,即《汉堡可持续性平台》,为真正扩大私人投资,促进新兴市场和发展中国家的可持续发展奠定了基础。 [.]在2025年汉堡可持续性会议上签署联合意向宣言,《汉堡可持续性平台》重申,它们共同承诺消除迄今阻碍调动大规模投资的结构性障碍。"
84,Germany lobbies for sustainability and multilateral solutions,"Dr Bärbel Kofler, Parliamentary State Secretary at the Federal Ministry for Economic Cooperation and Development (BMZ), has set off on a five-day trip to Côte d'Ivoire where the 60th Annual Meetings of the African Development Bank (AfDB) will begin today. The election of a new AfDB President will be a key focus of the conference. The election is especially important as the continent is facing tremendous challenges, such as crisis-induced upheavals, the United States’ withdrawal from many areas of development cooperation, displacement and forced migration in Africa, and advancing climate change.",Deutschlandlobbies für Nachhaltigkeit und multilaterale Lösungen,"Dr. Bärbel Kofler, Parlamentarischer Staatssekretär im Bundesministerium für wirtschaftliche Zusammenarbeit und Entwicklung (BMZ), ist auf eine fünftägige Reise nach Côte d'Ivoire gestartet, wo heute die 60. Jahrestagung der Afrikanischen Entwicklungsbank (AfDB) beginnt. Ein Schwerpunkt der Konferenz wird die Wahl eines neuen AfDB-Präsidenten sein. Besonders wichtig ist die Wahl, da der Kontinent vor enormen Herausforderungen steht, wie z.B. krisenbedingte Umwälzungen, der Rückzug der USA aus vielen Bereichen der Entwicklungszusammenarbeit, Vertreibung und Zwangsmigration in Afrika und die Förderung des Klimawandels.",Alemania aboga por la sostenibilidad y las soluciones multilaterales,"El Dr. Bärbelçóler, Secretario de Estado Parlamentario del Ministerio Federal de Cooperación Económica y Desarrollo (BMZ), ha iniciado un viaje de cinco días a Côte d'Ivoire, donde las 60 Reuniones Anuales del Banco Africano de Desarrollo (BAfD) comenzarán hoy. La elección de un nuevo Presidente del BAfD será un foco clave de la conferencia. Las elecciones son especialmente importantes ya que el continente se enfrenta a enormes desafíos, tales como trastornos provocados por crisis, la retirada de los Estados Unidos de muchas áreas de cooperación para el desarrollo, desplazamientos y migración forzada en África, y el avance del cambio climático.",L'Allemagne milite pour la durabilité et des solutions multilatérales,"M. Bärbel Kofler, Secrétaire d'État parlementaire au Ministère fédéral de la coopération économique et du développement (BMZ), a entrepris un voyage de cinq jours en Côte d'Ivoire, où débuteront aujourd'hui les 60e réunions annuelles de la Banque africaine de développement (BAfD). L'élection d'un nouveau président de la BAfD sera un thème clé de la conférence. L'élection est particulièrement importante car le continent est confronté à d'énormes défis, tels que les bouleversements provoqués par les crises, le retrait des États-Unis de nombreux domaines de la coopération pour le développement, les déplacements et les migrations forcées en Afrique, et la promotion du changement climatique.",德国关于可持续性和多边解决办法的游说团,"联邦经济合作与发展部(BMZ)政务次官贝尔·考夫勒(Drärbel Kofler)已前往科特迪瓦,为期五天,非洲开发银行(非行)第六十届年会将于今天召开。 非洲开发银行(非行)新当选行长将是会议的主要焦点。 选举尤为重要,因为非洲大陆正面临巨大的挑战,如危机引发的动荡、美国退出许多发展合作领域、流离失所和被迫移徙以及推进气候变化。"
85,Foreign Minister Johann Wadephul and Development Minister Reem Alabali Radovan on the lifting of all economic sanctions against Syria,"At today’s Foreign Affairs Council in Brussels, the EU member states agreed to lift all economic sanctions against Syria. Development Minister Reem Alabali Radovan stated: ""This is a moment of hope and a new beginning for the people of Syria. To ensure a fresh start in Syria that is peaceful and successful, it is crucial that the economy recovers and that people can meet their basic needs. Lifting the sanctions will increase Syrian society’s ability to help itself. (...)""",Außenminister Johann Wadephul und Entwicklungsminister Reem Alabali Radovan zur Aufhebung aller wirtschaftlichen Sanktionen gegen Syrien,"Auf der heutigen Tagung des Rates für auswärtige Angelegenheiten in Brüssel haben sich die EU-Mitgliedstaaten darauf geeinigt, alle wirtschaftlichen Sanktionen gegen Syrien aufzuheben. Entwicklungsminister Reem Alabali Radovan erklärte: „Dies ist ein Moment der Hoffnung und eines Neuanfangs für das syrische Volk. Um einen friedlichen und erfolgreichen Neuanfang in Syrien zu gewährleisten, ist es entscheidend, dass die Wirtschaft wieder wächst und dass die Menschen ihre grundlegenden Bedürfnisse erfüllen können.",El Ministro de Asuntos Exteriores Johann Wadephul y el Ministro de Desarrollo Reem Alabali Radovan sobre el levantamiento de todas las sanciones económicas contra Siria,"En el Consejo de Asuntos Exteriores de hoy en Bruselas, los Estados miembros de la UE acordaron levantar todas las sanciones económicas contra Siria. El ministro de Desarrollo, Reem Alabali Radovan, declaró: ""Este es un momento de esperanza y un nuevo comienzo para el pueblo de Siria. Para garantizar un nuevo comienzo en Siria que sea pacífico y exitoso, es crucial que la economía se recupere y que la gente pueda satisfacer sus necesidades básicas.",Le ministre des Affaires étrangères Johann Wadephul et le ministre du Développement Reem Alabali Radovan sur la levée de toutes les sanctions économiques contre la Syrie,"Le ministre du Développement, Reem Alabali Radovan, a déclaré : « C'est un moment d'espoir et un nouveau départ pour le peuple syrien. Pour assurer un nouveau départ en Syrie qui soit pacifique et réussi, il est crucial que l'économie se rétablisse et que les gens puissent répondre à leurs besoins fondamentaux. Le relèvement des sanctions augmentera la capacité de la société syrienne à s'aider elle-même. (...) »",约翰·瓦德富尔外长兼发展部长雷姆·阿拉巴利·拉多万关于解除对叙利亚的所有经济制裁,"在今天的布鲁塞尔外交理事会上,欧盟成员国同意取消对叙利亚的所有经济制裁。 发展部长拉多万(Reem Alabali Radovan)说 : “ 这是叙利亚人民充满希望和新开端的时刻。 为确保叙利亚有一个和平成功的新开端,经济复苏和人民能够满足基本需要至关重要。 取消制裁将提高叙利亚社会自助的能力。 ”"
86,Call to sign the Hamburg Declaration on Responsible AI for the SDGs,How do we succeed in using artificial intelligence to promote human development – and in shaping it in such a way that it benefits all people? This question will be the focus of a panel discussion held by the Federal Ministry for Economic Cooperation and Development (BMZ) and the United Nations Development Programme (UNDP) on 2 June 2025 as part of the Hamburg Sustainability Conference.,Aufruf zur Unterzeichnung der Hamburger Erklärung zur Verantwortungsvollen KI für die SDGs,"Wie gelingt es uns, mit künstlicher Intelligenz die menschliche Entwicklung zu fördern – und so zu gestalten, dass sie allen Menschen zugute kommt? Diese Frage steht im Mittelpunkt einer Podiumsdiskussion des Bundesministeriums für wirtschaftliche Zusammenarbeit und Entwicklung (BMZ) und des Entwicklungsprogramms der Vereinten Nationen (UNDP) am 2. Juni 2025 im Rahmen der Hamburg Sustainability Conference.",Llamamiento a firmar la Declaración de Hamburgo sobre la IA responsable de los ODS,¿Cómo lograremos utilizar la inteligencia artificial para promover el desarrollo humano y darle forma de manera que beneficie a todas las personas? Esta cuestión será el centro de una mesa redonda organizada por el Ministerio Federal de Cooperación Económica y Desarrollo (BMZ) y el Programa de las Naciones Unidas para el Desarrollo (PNUD) el 2 de junio de 2025 como parte de la Conferencia de Sostenibilidad de Hamburgo.,Appel à signer la Déclaration de Hambourg sur l'IA responsable pour les ODD,Comment réussissons-nous à utiliser l'intelligence artificielle pour promouvoir le développement humain - et à le façonner de manière à ce qu'il profite à tous? Cette question sera au centre d'une table ronde tenue par le Ministère fédéral de la coopération économique et du développement (BMZ) et le Programme des Nations Unies pour le développement (PNUD) le 2 juin 2025 dans le cadre de la Conférence de Hambourg sur la durabilité.,呼吁签署《关于对可持续发展目标负责的大赦国际汉堡宣言》,我们怎样才能成功地利用人工智能促进人类发展 — — 并且以有利于所有人的方式塑造人文发展? 这个问题将是2025年6月2日联邦经济合作与发展部(BMZ)和联合国开发计划署(UNDP)作为汉堡可持续性会议一部分举行的小组讨论的重点。
87,Reem Alabali Radovan becomes new Development Minister,"Reem Alabali Radovan has taken office as Development Minister. After being formally appointed by Federal President Frank-Walter Steinmeier, she officially took over from her predecessor Svenja Schulze in a ceremony at the Berlin offices of the Federal Ministry for Economic Cooperation and Development (BMZ) today. Johann Saathoff was appointed Parliamentary State Secretary, and Bärbel Kofler will remain Parliamentary State Secretary at the Development Ministry (BMZ). Niels Annen will be State Secretary at the BMZ.",Reem Alabali Radovan wird neuer Entwicklungsminister,"Reem Alabali Radovan hat sein Amt als Entwicklungsministerin inne. Nach ihrer offiziellen Ernennung durch Bundespräsident Frank-Walter Steinmeier übernahm sie heute offiziell die Nachfolge ihrer Vorgängerin Svenja Schulze in den Berliner Büros des Bundesministeriums für wirtschaftliche Zusammenarbeit und Entwicklung (BMZ). Johann Saathoff wurde zum Parlamentarischen Staatssekretär ernannt, Bärbel Kofler bleibt Parlamentarische Staatssekretärin im Entwicklungsministerium (BMZ). Niels Annen wird Staatssekretär am BMZ sein.",Reem Alabali Radovan se convierte en nuevo Ministro de Desarrollo,"Reem Alabali Radovan ha asumido el cargo de Ministra de Desarrollo. Después de haber sido nombrada formalmente por el Presidente Federal Frank-Walter Steinmeier, ella tomó oficialmente el relevo de su predecesor Svenja Schulze en una ceremonia en las oficinas de Berlín del Ministerio Federal de Cooperación Económica y Desarrollo (BMZ) hoy. Johann Saathoff fue nombrado Secretario de Estado Parlamentario, y Bärbelóller seguirá siendo Secretario de Estado Parlamentario en el Ministerio de Desarrollo (BMZ). Niels Annen será Secretario de Estado en el BMZ.",Reem Alabali Radovan devient nouveau ministre du développement,"Reem Alabali Radovan a pris ses fonctions de Ministre du développement. Après avoir été officiellement nommée par le Président fédéral Frank-Walter Steinmeier, elle a officiellement pris la relève de son prédécesseur Svenja Schulze lors d'une cérémonie aux bureaux de Berlin du Ministère fédéral de la coopération économique et du développement (BMZ) aujourd'hui. Johann Saathoff a été nommé Secrétaire d'État parlementaire, et Bärbel Kofler restera Secrétaire d'État parlementaire au Ministère du développement (BMZ). Niels Annen sera Secrétaire d'État au BMZ.",Reem Alabali Radovan成为新的发展部长,"Reem Alabali Radovan担任发展部长,在联邦总统Frank-Walter Steinmeier正式任命后,她于今天在联邦经济合作与发展部(BMZ)柏林办公室的一次仪式上正式接任前任的Svenja Schulze,任命Johann Saathoff为议会国务秘书,Bärbel Kofler为发展部政务国务秘书,Niels Annn为BMZ国务秘书。"
88,Safeguarding global cooperation in turbulent times,Today in Washington D.C. the first World Bank meeting since US President Donald Trump began his second term in office will draw to a close. Germany was represented at the spring meeting by Development Minister Svenja Schulze as Germany’s World Bank Governor and by the Parliamentary State Secretary to the Minister Niels Annen. At the meeting it became clear that the Bank is well-equipped for the future (...),Schutz der globalen Zusammenarbeit in turbulenten Zeiten,"Heute wird in Washington D.C. das erste Weltbank-Treffen seit dem Amtsantritt des US-Präsidenten Donald Trump seine zweite Amtszeit beenden. Deutschland wurde auf dem Frühjahrstreffen von Entwicklungsminister Svenja Schulze als Deutschlands Weltbank-Gouverneur und vom Parlamentarischen Staatssekretär beim Minister Niels Annen vertreten. Auf dem Treffen wurde deutlich, dass die Bank gut für die Zukunft gerüstet ist (...)",Salvaguardar la cooperación mundial en tiempos turbulentos,"Hoy en Washington D.C., la primera reunión del Banco Mundial desde que el presidente estadounidense Donald Trump comenzó su segundo mandato llegará a su fin. Alemania estuvo representada en la reunión de primavera por el ministro de Desarrollo Svenja Schulze como gobernador del Banco Mundial de Alemania y por el secretario de Estado parlamentario del ministro Niels Annen. En la reunión quedó claro que el Banco está bien equipado para el futuro (...)",Préserver la coopération mondiale en période de turbulence,"Aujourd'hui à Washington D.C. la première réunion de la Banque mondiale depuis que le président américain Donald Trump a commencé son deuxième mandat prendra fin. L'Allemagne a été représentée à la réunion de printemps par le ministre du Développement Svenja Schulze en tant que gouverneur de la Banque mondiale et par le secrétaire d'État parlementaire du ministre Niels Annen. Lors de la réunion, il est devenu clair que la Banque est bien équipée pour l'avenir (...)",在动荡时期保障全球合作,"今天,在华盛顿特区,自美国总统唐纳德·特朗普(Donald Trump)开始第二任期以来的第一次世界银行会议即将结束。 德国作为德国世界银行行长的发展部长斯文雅·舒尔茨(Svenja Schulze)和尼尔斯·安妮(Niels Annn)部长的政务大臣国务大臣(Svenja Schulze)代表德国出席了春季会议。 在这次会议上,银行显然为未来做好准备(......)"
89,"""15 per cent for the 15 per cent"": Global Disability Summit concludes with strong commitments for global inclusion","The third Global Disability Summit, which is taking place in Berlin, will conclude today with concrete outcomes for better inclusion worldwide. The global population includes around 1.3 billion persons with disabilities – 15 per cent of all the people in the world. Now, promoting inclusion is also to be an objective in at least 15 per cent of development projects. That is the intention at the heart of the Amman-Berlin Declaration adopted by more than 80 countries and organisations at the Summit today.","""15 Prozent für die 15 Prozent"": Globaler Behindertengipfel schließt mit starken Zusagen für die globale Inklusion","Der dritte Globale Behindertengipfel, der in Berlin stattfindet, wird heute mit konkreten Ergebnissen für eine bessere Integration weltweit abschließen. Die Weltbevölkerung umfasst rund 1,3 Milliarden Menschen mit Behinderungen – 15 Prozent aller Menschen in der Welt. Jetzt soll auch die Förderung der Inklusion ein Ziel in mindestens 15 Prozent der Entwicklungsprojekte sein. Das ist die Absicht der Erklärung von Amman-Berlin, die heute von mehr als 80 Ländern und Organisationen auf dem Gipfel verabschiedet wurde.","""15 por ciento para el 15 por ciento"": Cumbre Mundial sobre Discapacidad concluye con firmes compromisos para la inclusión mundial","La tercera Cumbre Mundial sobre Discapacidad, que se está celebrando en Berlín, concluirá hoy con resultados concretos para una mejor inclusión en todo el mundo. La población mundial incluye alrededor de 1.300 millones de personas con discapacidad, el 15% de todas las personas del mundo. Ahora, promover la inclusión también debe ser un objetivo en al menos el 15% de los proyectos de desarrollo. Esa es la intención en el corazón de la Declaración de Ammán-Berlín adoptada hoy por más de 80 países y organizaciones en la Cumbre.",« 15 % pour les 15 % » : Le Sommet mondial sur le handicap se termine par des engagements fermes en faveur de l'inclusion mondiale,"Le troisième Sommet mondial sur le handicap, qui se tiendra à Berlin, se terminera aujourd'hui par des résultats concrets en vue d'une meilleure inclusion dans le monde entier. La population mondiale comprend environ 1,3 milliard de personnes handicapées – 15 % de l'ensemble des personnes dans le monde. Aujourd'hui, la promotion de l'inclusion doit également être un objectif dans au moins 15 % des projets de développement.",“15%为15%”:全球残疾问题首脑会议最后作出全球包容的坚定承诺,"第三次全球残疾人峰会将于今天在柏林举行,会议结束时将取得具体结果,促进全世界更好地包容残疾人,全球人口包括约13亿残疾人,占全世界总人口的15%,现在,促进包容也是至少15%发展项目的目标,这是80多个国家和组织在今天首脑会议上通过的《安曼-柏林宣言》的核心意图。"
90,Faces of MIT: Ylana Lopez,"As assistant director for academics and events, Ylana Lopez leads an array of programming at the Martin Trust Center for MIT Entrepreneurship.",Gesichter des MIT: Ylana Lopez,Ylana Lopez leitet als Assistant Director für Akademiker und Events eine Reihe von Programmen am Martin Trust Center for MIT Entrepreneurship.,Rostros del MIT: Ylana López,"Como subdirectora de académicos y eventos, Ylana López lidera una serie de programas en el Centro Martin Trust para el Emprendimiento del MIT.",Visages du MIT: Ylana Lopez,"En tant que directrice adjointe pour les universitaires et les événements, Ylana Lopez dirige une série de programmes au Martin Trust Center for MIT Entrepreneurship.",亚拉娜·洛佩斯(Ylana Lopez),"Ylana Lopez作为学术和活动助理主任,在Martin MIT创业信托中心领导一系列方案编制工作。"
91,MIT and Mass General Brigham launch joint seed program to accelerate innovations in health,"The MIT-MGB Seed Program, launched with support from Analog Devices Inc., will fund joint research projects that advance technology and clinical research.",MIT und Mass General Brigham starten gemeinsames Saatgutprogramm zur Beschleunigung von Innovationen in der Gesundheit,"Das MIT-MGB Seed Programm, das mit Unterstützung von Analog Devices Inc. gestartet wurde, wird gemeinsame Forschungsprojekte finanzieren, die Technologie und klinische Forschung voranbringen.",El MIT y el General de Masas Brigham lanzan un programa conjunto de semillas para acelerar las innovaciones en salud,"El MIT-MGB Seed Program, lanzado con el apoyo de Analog Devices Inc., financiará proyectos conjuntos de investigación que promueven la tecnología y la investigación clínica.",MIT et Mass General Brigham lancent un programme conjoint de semences pour accélérer les innovations en santé,"Le programme de semences MIT-MGB, lancé avec le soutien d'Analog Devices Inc., financera des projets de recherche conjoints qui font progresser la technologie et la recherche clinique.","MIT和Mass General Brigham发起联合种子方案,加速保健创新",在模拟设备公司的支持下启动的麻省理工学院-MGB种子方案将资助促进技术和临床研究的联合研究项目。
92,Using generative AI to help robots jump higher and land safely,MIT CSAIL researchers combined GenAI and a physics simulation engine to refine robot designs. The result: a machine that out-jumped a robot designed by humans.,"Mit generativen KI Robotern helfen, höher zu springen und sicher landen","MIT CSAIL Forscher kombinierten GenAI und eine Physik-Simulationsmaschine, um Roboter-Designs zu verfeinern. Das Ergebnis: eine Maschine, die einen Roboter von Menschen entworfen übersprungen.",Usando IA generativa para ayudar a los robots a saltar más alto y aterrizar con seguridad,Los investigadores del MIT CSAIL combinaron GenAI y un motor de simulación física para refinar los diseños de robots. El resultado: una máquina que superó a un robot diseñado por humanos.,Utiliser l'IA générative pour aider les robots à sauter plus haut et à atterrir en toute sécurité,Les chercheurs du MIT CSAIL ont combiné GenAI et un moteur de simulation physique pour affiner la conception des robots. Le résultat : une machine qui a déjoué un robot conçu par les humains.,使用基因人工智能帮助机器人跳高安全着陆,麻省理工学院的CSAIL研究人员结合了GenAI和一个物理模拟引擎来改进机器人的设计。结果:一台机器超越了人类设计的机器人。
93,Nth Cycle is bringing critical metals refining to the U.S.,"Co-founded by Professor Desirée Plata, the company is already producing nickel and cobalt from battery scrap in Ohio.",Nth Cycle bringt kritische Metalle zur Raffination in die USA.,Mitgegründet von Professor Desirée Plata produziert das Unternehmen bereits Nickel und Kobalt aus Batterieschrott in Ohio.,Nth Cycle está trayendo el refinamiento de metales críticos a los EE.UU.,"Cofundada por el profesor Desirée Plata, la empresa ya está produciendo níquel y cobalto a partir de desechos de baterías en Ohio.",Nth Cycle apporte le raffinage des métaux critiques aux États-Unis.,"Cofondée par le professeur Desirée Plata, la société produit déjà du nickel et du cobalt à partir de déchets de batterie dans l'Ohio.",Nth Circle 正在给美国带来重要的金属提炼,"该公司由Desire Plata教授共同创立,已经在俄亥俄州用废电池生产镍和钴。"
94,Face-to-face with Es Devlin,The celebrated artist and designer creates connection at all scales.,Von Angesicht zu Angesicht mit Es Devlin,Der gefeierte Künstler und Designer schafft Verbindungen auf allen Ebenen.,Cara a cara con Es Devlin,El célebre artista y diseñador crea conexión a todas las escalas.,Face à face avec Es Devlin,L'artiste et designer célèbre crée des liens à toutes les échelles.,与Es Devlin面对面,著名艺术家和设计师在所有尺度上创建连接。
