,title-en,content-en,title-de,content-de,title-es,content-es,title-fr,content-fr,title-zh,content-zh
41,China’s exporters shrug off the trade war—for now,How long can they continue to do so?,Chinas Exporteure zucken den Handelskrieg ab — für jetzt,Wie lange können sie das noch tun?,"Los exportadores de China se encogen de hombros en la guerra comercial, por ahora",¿Cuánto tiempo pueden seguir haciéndolo?,Chine Les exportateurs s'éloignent de la guerre commerciale — pour l'instant,Combien de temps peuvent-ils continuer à le faire?,中国的出口商从贸易战争中退缩到现在,他们能继续这样做多久?
42,Why a fling with a foreigner insults China’s “national dignity”,Outrage mounts over a tryst between a Chinese student and a Ukrainian gamer,Warum ein Fling mit einem Ausländer China beleidigt,Outrage überragt einen Versuch zwischen einem chinesischen Schüler und einem ukrainischen Spieler,¿Por qué una aventura con un extranjero insulta la “dignidad nacional” de China?,La indignación se cierne sobre una cita entre un estudiante chino y un jugador ucraniano,Pourquoi un flirt avec un étranger insulte la Chine,L'outrage monte sur un essai entre un étudiant chinois et un joueur ukrainien,为何与外国人私奔侮辱中国的“民族尊严”,一个中国学生和一个乌克兰游戏玩家之间的交汇
43,A savage squabble between China and Europe,Tensions are high ahead of a big summit next week,Ein wilder Streit zwischen China und Europa,Die Spannungen sind hoch vor einem großen Gipfel nächste Woche,Una salvaje disputa entre China y Europa,Las tensiones están muy por delante de una gran cumbre la próxima semana,Une querelle sauvage entre la Chine et l'Europe,Les tensions sont en avance sur un grand sommet la semaine prochaine,中国和欧洲之间的野蛮争吵,"下星期召开大型首脑会议前,"
44,America is coming after Chinese it accuses of hacking,Xu Zewei was arrested in Milan on July 3rd,Amerika wird nach Chinesen es wirft Hacking,Xu Zewei wurde am 3. Juli in Mailand verhaftet,Estados Unidos viene tras los chinos acusa de hackear,Xu Zewei fue arrestado en Milán el 3 de julio,L'Amérique vient après les Chinois elle accuse de piratage,Xu Zewei a été arrêté à Milan le 3 juillet,美国在追杀中国人 指责美国黑客入侵,七月三日在米兰被捕
45,China’s local governments are approaching a fiscal black hole,Can provincial DOGE-ing help them avoid it?,Chinas lokale Regierungen nähern sich einem fiskalischen Schwarzen Loch,"Kann die Provinz DOGE-ing ihnen helfen, es zu vermeiden?",Los gobiernos locales de China se están acercando a un agujero negro fiscal,¿Puede el DOGE-ing provincial ayudarlos a evitarlo?,Chine Les gouvernements locaux approchent d'un trou noir fiscal,Le DOGE provincial peut-il les aider à l'éviter?,中国地方政府正在接近财政黑洞,省DOGE -ing能帮助他们避免吗?
46,Why so many Chinese are drowning in debt,Some contemplate suicide. Others vaunt their folly as influencers,Warum so viele Chinesen in Schulden ertrinken,"Einige betrachten Selbstmord, andere preisen ihre Torheit als Influencer",¿Por qué tantos chinos se están ahogando en deudas?,"Algunos contemplan el suicidio, otros se burlan de su locura como influencers",Pourquoi tant de Chinois se noient dans la dette,Certains envisagent le suicide. D'autres se vantent de leur folie en tant qu'influents.,为什么这么多中国人 都欠了债,"有些人想自杀,有些人则以愚弄为影响者而炫耀自己的愚妄行为。"
47,"Leung Kwok-hung, Hong Kong’s shaggy agitator for democracy","His League of Social Democrats, the territory’s last pro-democracy party, disbanded this week","Leung Kwok-hung, Hongkongs zitternder Agitator für Demokratie","Seine Liga der Sozialdemokraten, die letzte pro-demokratische Partei des Territoriums, löste diese Woche auf","Leung Kwok-hung, agitador de Hong Kong por la democracia","Su Liga de Socialdemócratas, el último partido prodemocrático del territorio, se disolvió esta semana","Leung Kwok-hung, Hong Kong shggy agitateur pour la démocratie","Sa Ligue des sociaux-démocrates, le dernier parti pro-démocratie du territoire, s'est dissoute cette semaine",香港民主狂热煽动者梁国洪,"领土最后一个支持民主的政党,即其社会民主党联盟,于本周解散。"
48,Epstein’s ghost haunts the Trump-Murdoch alliance,What happens when a president sues a press baron?,Epsteins Geist verfolgt die Trump-Murdoch-Allianz,"Was passiert, wenn ein Präsident einen Pressebaron verklagt?",El fantasma de Epstein persigue a la alianza Trump-Murdoch,¿Qué pasa cuando un presidente demanda a un barón de prensa?,Le fantôme d'Epstein hante l'alliance Trump-Murdoch,Que se passe-t-il quand un président poursuit un baron de presse ?,Epstein的鬼魂笼罩着Trump-Murdoch联盟,当总统起诉一个新闻男爵时会怎样?
49,Underground with America’s nuclear-missile crews,The cost of replacing ageing ICBMs is soaring as a new arms race looms,Underground mit Amerikas atomaren Besatzungen,Die Kosten für den Ersatz alternder ICBM steigen wie ein neues Wettrüsten,Bajo tierra con las tripulaciones de misiles nucleares de Estados Unidos,El costo de la sustitución de las medidas de fomento de la confianza de los países envejecidos está aumentando a medida que se avecina una nueva carrera de armamentos,Underground avec des équipages de missiles nucléaires américains,Le coût du remplacement des ICBM vieillissants augmente à mesure qu'une nouvelle course aux armements se profile,美国的核导弹机组人员潜在地下,"随着新一轮军备竞赛的到来,取代不断老化的洲际建立信任措施的费用正在飙升"
50,The Epstein files and Donald Trump,A vast right-wing conspiracy comes for the president,Die Epstein-Dateien und Donald Trump,Eine riesige rechte Verschwörung kommt für den Präsidenten,Los archivos de Epstein y Donald Trump,Una vasta conspiración de derecha viene para el presidente,Les fichiers Epstein et Donald Trump,Une vaste conspiration de droite vient pour le président,Epstein案卷和Donald Trump案卷,一个庞大的右翼阴谋 来对付总统
51,"Charlie Kirk, pied piper of the American right",The college drop-out fighting to preserve Donald Trump’s youth vote,"Charlie Kirk, Pied Piper der amerikanischen Rechten","Die College-Abbrecher kämpfen, um Donald Trumps Jugendwahl zu erhalten","Charlie Kirk, flautista de la derecha americana",La deserción universitaria luchando para preservar el voto juvenil de Donald Trump,"Charlie Kirk, piéd piper de la droite américaine",L'université se bat pour préserver Donald Trump's le vote des jeunes,"查理・柯克,美国右翼的飞笛手",大学辍学抗争以维护唐纳德·特朗普的青年选票
52,Why Superman is the least relevant superhero,And why that is his greatest strength,Warum Superman der am wenigsten relevante Superheld ist,Und warum das seine größte Stärke ist,Por qué Superman es el superhéroe menos relevante,Y por qué esa es su mayor fuerza,Pourquoi Superman est le super-héros le moins pertinent,Et pourquoi c'est sa plus grande force,为什么超人最无关紧要超级超级英雄,为什么这就是他最大的力量
53,Quantifying Trumpcare,"Researchers estimate the Big Beautiful Bill could result in 42,500 excess deaths a year",Quantifizierung von Trumpcare,"Forscher schätzen, dass der große schöne Gesetzentwurf zu 42.500 Todesfällen pro Jahr führen könnte",Cuantificando Trumpcare,Los investigadores estiman que el proyecto de ley podría resultar en 42.500 muertes al año.,Quantification Trumpcare,Les chercheurs estiment que le Big Beautiful Bill pourrait entraîner 42 500 décès excédentaires par an.,量化特朗普护理,"研究人员估计 大美人法案每年可能会导致42,500多人死亡"
54,The meaning of Trumpcare,Republicans bring the biggest changes to health care in 15 years,Die Bedeutung von Trumpcare,Republikaner bringen die größten Veränderungen in der Gesundheitsversorgung in 15 Jahren,El significado de Trumpcare,Los republicanos traen los mayores cambios a la atención de la salud en 15 años,La signification de Trumpcare,Les républicains apportent les plus grands changements aux soins de santé en 15 ans,Trumpcare 的意义,共和党在15年内对医疗保健带来最大的变化
55,Bryan Kohberger's 'weird' behavior and social awkwardness may make him bigger target than Jeffrey Dahmer,Idaho quadruple murderer Bryan Kohberger transitions from county jail to maximum security prison where inmates with life sentences have nothing to lose,"Bryan Kohbergers ""weibliches"" Verhalten und soziale Unbeholfenheit könnten ihn zu einem größeren Ziel machen als Jeffrey Dahmer","Idaho Vierfachmörder Bryan Kohberger wechselt vom Bezirksgefängnis ins höchste Sicherheitsgefängnis, wo Insassen mit lebenslänglichen Haftstrafen nichts zu verlieren haben","El comportamiento ""pequeño"" de Bryan Kohberger y la incomodidad social pueden hacerle un blanco más grande que Jeffrey Dahmer",Idaho cuádruple asesino Bryan Kohberger transiciones de prisión del condado a prisión de máxima seguridad donde los reclusos con cadena perpetua no tienen nada que perder,Le comportement « bizarre » de Bryan Kohberger et la gêne sociale peuvent le rendre plus cible que Jeffrey Dahmer,Idaho quadruple meurtrier Bryan Kohberger transitions de la prison de comté à la prison de sécurité maximale où les détenus condamnés à perpétuité n'ont rien à perdre,Bryan Kohberger的“怪怪怪的”行为和社会尴尬可能使他比Jeffrey Dahmer的目标更大。,依达霍四人命谋杀犯布赖恩·科伯格 从县监狱转至最高戒备监狱
56,‘Full House’ star Candace Cameron Bure says she was put on diet at 12 when she started filming hit show,Candace Cameron Bure revealed she was put on a diet at age 12 while starring on &quot;Full House&quot; due to her parents&apos; fears about Hollywood pressures.,"""Full House-Star Candace Cameron Bure sagt, sie wurde auf Diät mit 12, als sie begann zu filmen Hit-Show","Candace Cameron Bure zeigte, dass sie im Alter von 12 Jahren eine Diät bekam, während sie mit &quot;Full House&quot; aufgrund ihrer Eltern&apos; Angst vor Hollywood Druck.","La estrella de ‘Full House’, Candace Cameron Bure, dice que se puso a dieta a los 12 años cuando empezó a filmar el show de éxito",Candace Cameron Bure reveló que fue puesta en una dieta a los 12 años mientras protagonizaba &quot;Full House&quot; debido a sus padres&apos; miedos sobre las presiones de Hollywood.,La star Candace Cameron Bure dit qu'elle a été mise au régime à 12 ans quand elle a commencé à filmer un spectacle à succès,Candace Cameron Bure a révélé qu'elle avait été mise au régime à l'âge de 12 ans alors qu'elle jouait sur &quot;Full House&quot; en raison de ses parents&apos; craintes au sujet des pressions hollywoodiennes.,"明星Candace Cameron Bure在12岁开始拍摄电影时,","Candace Cameron Bure 透露她12岁时就被投入饮食, 而她则在 & quot; Full House & quot; 上当主演, 因为她的父母和apos; 担心好莱坞的压力。"
57,Epstein accomplice Ghislaine Maxwell could be eyeing three outcomes as she meets with DOJ again: expert,U.S. officials interview convicted sex trafficker Ghislaine Maxwell while her legal team awaits a Supreme Court decision on her 20-year prison sentence appeal.,"Epstein Komplize Ghislaine Maxwell könnte drei Ergebnisse sehen, während sie sich wieder mit DOJ trifft: Expertin","US-Beamte interviewen verurteilte Sexhändlerin Ghislaine Maxwell, während ihr juristisches Team eine Entscheidung des Obersten Gerichtshofs über ihre 20-jährige Gefängnisstrafe Berufung erwartet.",La cómplice de Epstein Ghislaine Maxwell podría estar mirando tres resultados mientras se reúne con el Departamento de Justicia de nuevo: experto,Funcionarios estadounidenses entrevistan a la traficante de sexo Ghislaine Maxwell mientras su equipo legal espera una decisión de la Corte Suprema sobre su apelación de 20 años de prisión.,La complice d'Epstein Ghislaine Maxwell pourrait regarder trois résultats alors qu'elle rencontre à nouveau le DOJ : experte,Les responsables américains interviewent le trafiquant sexuel reconnu coupable Ghislaine Maxwell alors que son équipe juridique attend une décision de la Cour suprême sur son appel de 20 ans de prison.,"Epstein帮凶Ghislaine Maxwell在与司法部再次会面时,可能会看到三种结果:专家。","美国官员与被定罪的性贩运者Ghislaine Maxwell进行面谈,而她的法律团队正等待最高法院就她20年监禁上诉作出裁决。"
58,"We've created your complete camping packing list, from tents to cooking gear","Make sure your bring all the camping gear you need, including tents, sleeping bags, cookware, and pet gear.","Wir haben Ihre komplette Camping-Packliste erstellt, von Zelten bis Kochausrüstung","Stellen Sie sicher, dass Sie alle Campingausrüstung, die Sie brauchen, einschließlich Zelte, Schlafsäcke, Kochgeschirr und Haustierausrüstung mitbringen.","Hemos creado su lista completa de embalajes de camping, desde tiendas de campaña hasta utensilios de cocina.","Asegúrese de traer todo el equipo de camping que necesita, incluyendo tiendas de campaña, sacos de dormir, utensilios de cocina y equipo para mascotas.","Nous avons créé votre liste complète d'emballages de camping, des tentes à l'équipement de cuisine","Assurez-vous d'apporter tout l'équipement de camping dont vous avez besoin, y compris les tentes, les sacs de couchage, les ustensiles de cuisine et l'équipement pour animaux de compagnie.",我们创造了你完整的露营包装清单 从帐篷到炊具,"一定要带上你需要的所有露营装备,包括帐篷、睡袋、厨具和宠物装备。"
59,"Gabbard's dangerous distraction, Trump's second reconciliation, and more from Fox News Opinion","Read the latest from Fox News Opinion &amp; watch videos from Sean Hannity, Raymond Arroyo &amp; more.","Gabbards gefährliche Ablenkung, Trumps zweite Versöhnung und mehr aus Fox News Opinion","Lesen Sie die neuesten von Fox News Opinion &amp; Videos von Sean Hannity, Raymond Arroyo &amp; mehr.","La peligrosa distracción de Gabbard, la segunda reconciliación de Trump y más de Fox News Opinion","Lea lo último de Fox News Opinion &amp; ver vídeos de Sean Hannity, Raymond Arroyo &amp; más.","La dangereuse distraction de Gabbard, la deuxième réconciliation de Trump, et plus encore de Fox News Opinion","Lisez les dernières nouvelles de Fox News Opinion &amp; regardez des vidéos de Sean Hannity, Raymond Arroyo &amp; plus.","Gabbard的危险分散注意力, Trump的第二次和解, 以及更多来自Fox News Review",阅读Fox News Views & amp; 从肖恩·汉尼蒂、雷蒙德·阿罗约(Raymond Arroyo) & amp; 更多观察视频的最新消息。
60,DeSantis-appointed US senator scores major endorsement ahead of 2026 special election: 'Tremendous job',"Sen. Ashley Moody, who was appointed to the U.S. Senate this year by Florida Gov. Ron DeSantis, scored an endorsement from President Donald Trump.",DeSantis-ernannter US-Senator erzielt große Zustimmung vor 2026 Sonderwahlen: 'Tremendous job',"Sen. Ashley Moody, der in diesem Jahr von Florida Gov. Ron DeSantis in den US-Senat berufen wurde, erzielte eine Unterstützung von Präsident Donald Trump.",El senador de los Estados Unidos nombrado por DeSantis obtiene un importante respaldo antes de las elecciones especiales de 2026: 'Tremenda tarea',"La senadora Ashley Moody, que fue nombrada para el Senado de Estados Unidos este año por el gobernador de Florida Ron DeSantis, obtuvo un respaldo del presidente Donald Trump.",Le sénateur américain DeSantis a obtenu un appui majeur avant les élections spéciales de 2026 : « Un travail précieux »,"Sen. Ashley Moody, qui a été nommé au Sénat des États-Unis cette année par le gouvernement de Floride Ron DeSantis, a obtenu l'aval du président Donald Trump.","在2026年特别选举前, 德桑蒂斯任命的美国参议员获得重大支持: “Tremendous job”","Sen Ashley Moody今年被佛罗里达州政府任命为美国参议院参议员,他获得了唐纳德·特朗普总统的支持。"
61,"Trump says SCOTUS immunity ruling likely helps Obama in light of Gabbard, DNI findings",President Donald Trump said Friday that former President Barack Obama “owes me big&quot; following the Supreme Court’s presidential immunity ruling.,"Trump sagt SCOTUS Immunität Urteil hilft wahrscheinlich Obama im Lichte von Gabbard, DNI Ergebnisse","Präsident Donald Trump sagte am Freitag, dass der ehemalige Präsident Barack Obama mich big&quot; nach dem Obersten Gerichtshof .","Trump dice que el fallo de inmunidad de SCOTUS probablemente ayuda a Obama a la luz de Gabbard, hallazgos del DNI",El presidente Donald Trump dijo el viernes que el ex presidente Barack Obama “me tiene en grande; después de la decisión de inmunidad presidencial de la Corte Suprema.,"Trump dit que la décision d'immunité SCOTUS aide probablement Obama à la lumière des conclusions de Gabbard, DNI",Le président Donald Trump a déclaré vendredi que l'ancien président Barack Obama m'a beaucoup et qu'à la suite de l'arrêt de la Cour suprême sur l'immunité présidentielle.,"Trump说,SCOTUS豁免裁决 可能会帮助奥巴马 根据Gabbard,DNI的调查结果","总统唐纳德·特朗普(Donald Trump)在星期五说,前总统奥巴马(Barack Obama)在最高法院总统豁免裁决后, “给我大权,"
62,Taylor Swift's boyfriend Travis Kelce gives fans rare glimpse into private life with pop star,"Kansas City Chiefs tight end Travis Kelce posted several personal photos featuring Taylor Swift among his offseason &quot;adventures,&quot; a rare glimpse into the couple&apos;s private life together.",Taylor Swifts Freund Travis Kelce gibt Fans einen seltenen Einblick ins Privatleben mit Popstar,"Kansas City Chiefs tight end Travis Kelce veröffentlichte mehrere persönliche Fotos mit Taylor Swift unter seinen Nebensaison &quot;Adventures,&quot; ein seltener Einblick in das Paar&apos;s Privatleben zusammen.","Travis Kelce, el novio de Taylor Swift, da a los fans una visión rara de la vida privada con estrella pop","Kansas City Chiefs fin apretado Travis Kelce publicó varias fotos personales con Taylor Swift entre su fuera de temporada & quot; aventuras, & quot; un vistazo raro en la pareja & apos;s vida privada juntos.",Le petit ami de Taylor Swift Travis Kelce donne aux fans un aperçu rare de la vie privée avec pop star,"Les chefs de Kansas City se sont serrés Travis Kelce a publié plusieurs photos personnelles mettant en vedette Taylor Swift parmi ses aventures hors saison, un rare aperçu de la vie privée du couple.",Taylor Swift的男朋友Travis Kelce 给粉丝们很少见的一眼 与流行歌星的私人生活,"堪萨斯市首府紧靠尾端的Travis Kelce张贴了几张个人照片,"
63,"'Louder by the hour': Senate GOP wants the Epstein drama to end, but Democrats aren't letting it go","The political divide over documents related to the late Jeffrey Epstein grew in the Senate this week, when Democrats pushed for transparency while Republicans argued Congress has limited power to release the files.","""Luder by the hour"": Senats-GOP will das Epstein-Drama beenden, aber Demokraten lassen es nicht los","Die politische Kluft über Dokumente im Zusammenhang mit dem späten Jeffrey Epstein wuchs im Senat in dieser Woche, als Demokraten für Transparenz drängten, während Republikaner argumentierten Kongress hat begrenzte Macht, die Dateien zu veröffentlichen.","'Más alto por hora': El Senado GOP quiere que el drama de Epstein termine, pero los demócratas no lo dejan pasar","La división política sobre los documentos relacionados con el fallecido Jeffrey Epstein creció en el Senado esta semana, cuando los demócratas presionaron por la transparencia mientras que los republicanos argumentaron que el Congreso tiene un poder limitado para publicar los archivos.","« Louder à l'heure » : Le GOP du Sénat veut que le drame d'Epstein prenne fin, mais les démocrates ne le laissent pas aller.","La division politique sur les documents liés à feu Jeffrey Epstein a augmenté au Sénat cette semaine, lorsque les démocrates ont insisté pour la transparence tandis que les républicains ont soutenu que le Congrès a limité le pouvoir de publier les dossiers.","参议员GOP希望结束Epstein的戏剧,","与已故杰弗里·埃普斯坦有关的文件的政治分歧在本周参议院中有所扩大,当时民主党人要求透明,而共和党人则认为国会有有限的权力公布档案。"
64,Is your home Wi-Fi really safe? Think again,"Protect your home network from hidden dangers, including router vulnerabilities, ISP tracking and smart device weaknesses with proper encryption, firmware updates and VPN technology.",Ist Ihr Zuhause Wi-Fi wirklich sicher? Denken Sie noch einmal,"Schützen Sie Ihr Heimnetzwerk vor versteckten Gefahren, einschließlich Router-Schwachstellen, ISP-Tracking und Smart Device-Schwachstellen mit korrekter Verschlüsselung, Firmware-Updates und VPN-Technologie.",¿Es su casa Wi-Fi realmente seguro? Piense de nuevo,"Proteja su red doméstica de peligros ocultos, incluyendo vulnerabilidades de router, seguimiento de ISP y debilidades de dispositivos inteligentes con cifrado adecuado, actualizaciones de firmware y tecnología VPN.",Votre Wi-Fi à la maison est-il vraiment sûr ?,"Protégez votre réseau domestique des dangers cachés, y compris les vulnérabilités des routeurs, le suivi des FAI et les faiblesses des appareils intelligents avec un cryptage approprié, des mises à jour du firmware et la technologie VPN.",你家无线上网安全吗?,"保护您的家庭网络免受隐蔽的危险,包括路由器弱点、IPS跟踪和智能装置弱点,并辅之以适当的加密、固件更新和VPN技术。"
65,Major Connecticut hospitals begin 'winding down' youth gender programs citing 'evolving landscape',Connecticut Children’s Medical Center and Yale New Haven Health sent out statements saying that they will be ending their gender treatments for youth patients.,"Hauptkrankenhäuser von Connecticut beginnen Jugend-Gender-Programme, in denen die ""evolvierende Landschaft"" genannt wird.","Connecticut Childrens Medical Center und Yale New Haven Health sendeten Aussagen aus, dass sie ihre Geschlechterbehandlungen für junge Patienten beenden werden.",Los principales hospitales de Connecticut comienzan a 'bajar' los programas de género juvenil citando 'paisaje en evolución',El Centro Médico Infantil de Connecticut y Yale New Haven Health enviaron declaraciones diciendo que terminarán sus tratamientos de género para pacientes jóvenes.,"Les grands hôpitaux du Connecticut commencent à « supprimer » les programmes de promotion de l'égalité des sexes destinés aux jeunes, citant « le paysage en évolution »",Le Centre médical des enfants du Connecticut et Yale New Haven Health ont envoyé des déclarations disant qu'ils cesseraient leurs traitements pour les jeunes patients.,"康涅狄格州主要医院开始“收缩”青年性别方案,","康涅狄格儿童医疗中心和耶鲁纽黑文健康中心发来声明,"
66,"USA Volleyball complies with Trump's executive order, bans trans athletes from girls' and women's competition",USA Volleyball is the latest organization to update its policy to effectively ban transgender athletes from girls&apos; and women&apos;s sports in compliance with President Donald Trump&apos;s executive order.,"USA Volleyball entspricht Trumps Exekutivordnung, verbietet Trans-Athleten vom Mädchen- und Frauenwettbewerb","USA Volleyball ist die neueste Organisation, um ihre Politik zu aktualisieren, um Transgender-Athleten effektiv von Mädchen und Frauen zu verbieten.","El Voleibol de EE.UU. cumple con la orden ejecutiva de Trump, prohíbe a los atletas trans de la competencia de niñas y mujeres",El Voleibol de USA es la última organización en actualizar su política para prohibir efectivamente a los atletas transgénero de las niñas y los apos; y los deportes de las mujeres y los apos en cumplimiento de la orden ejecutiva del presidente Donald Trump y los apos.,"USA Volleyball respecte l'ordre exécutif de Trump, interdit les athlètes trans de la compétition des filles et des femmes",USA Volleyball est la dernière organisation à mettre à jour sa politique pour interdire efficacement les athlètes transgenres des filles et des apos; et les femmes et apos; sports en conformité avec le président Donald Trump&apos; décret exécutif.,"美国排球队遵守特朗普的行政命令,禁止变性运动员参加女孩和妇女的竞赛","美国排球组织是更新其政策的最新组织,以有效禁止变性运动员参加女孩和运动会;妇女和运动会;按照总统唐纳德·特朗普和运动会的行政命令,开展体育运动。"
