,title-de,content-de,title-en,content-en,title-zh,content-zh
24,Zur Bekanntgabe der offiziellen Auflösung von USAID durch US-Außenminister Marco Rubio erklärt Entwicklungsministerin Reem Alabali Radovan:,"„Über sechs Jahrzehnte hat USAID weltweit Menschen aus größter Armut befreit, Krankheiten zurückgedrängt, ganze Regionen stabilisiert und Demokratien gestärkt. Die Auflösung schmerzt nicht nur alle, die sich für Solidarität und Menschlichkeit in der Welt einsetzen, sie hat dramatische Folgen. Bis zu 14 Millionen Menschen könnte der abrupte Rückzug der USA aus der Entwicklungszusammenarbeit bis 2030 das Leben kosten, darunter 4,5 Millionen Kinder. (...)""","On the announcement of the official dissolution of USAID by US Secretary of State Marco Rubio, Development Minister Reem Alabali Radovan states:","""For more than six decades, USAID has freed people from the world's greatest poverty, pushed diseases back, stabilised entire regions and strengthened democracies. Dissolution is not only painful for all those working for solidarity and humanity in the world, it has dramatic consequences. Up to 14 million people could be killed by the abrupt withdrawal of the US from development cooperation by 2030, including 4.5 million children. (...)""",为了宣布美国国务卿Marco Rubio正式解散美国国务卿 宣布Reem Alabali Radovan:,"六十多年来,美国发展局已经从世界最大的贫困中解放出来,阻止了疾病蔓延,加强了整个区域的稳定和民主. 解散不仅伤害了全世界所有致力于团结和人类的人,而且造成巨大的后果. 到2030年,美国在发展合作方面的突然退出可能造成生命损失,其中包括450万儿童 (...) """
25,Kraftvoller Schub für internationale Zusammenarbeit und eine gerechtere Welt,"In Sevilla hat heute die 4. Konferenz der Vereinten Nationen für Entwicklungsfinanzierung begonnen. Auf Einladung von UN-Generalsekretär Guterres und der spanischen Präsidentschaft berät die Weltgemeinschaft, darunter rund 70 Staats- und Regierungschef*innen, über Wege zur Finanzierung des Kampfes gegen Armut und Hunger, für globale Gesundheit, Bildung, Geschlechtergerechtigkeit und Frieden.",Powerful push for international cooperation and a fairer world,"Today the 4th United Nations Conference on Financing for Development began in Seville. At the invitation of UN Secretary-General Guterres and the Spanish Presidency, the world community, including some 70 heads of state and government, advises on ways to finance the fight against poverty and hunger, global health, education, gender equality and peace.",为国际合作和更公正的世界提供有力的鼓励,"在塞维利亚,联合国第4次发展筹资会议今天开始. 联合国秘书长索特斯和西班牙总统邀请国际社会,包括70位国家元首和政府首脑,就如何为消除贫穷和饥饿,为全球卫生,教育,性别平等与和平提供资金."
26,Christopher Street Day: Angriffe auf Truck von CDU-Verband beim Berliner CSD,"<a href=""https://www.zeit.de/news/2025-07/27/angriffe-auf-truck-von-cdu-verband-beim-berliner-csd""><img src=""https://img.zeit.de/news/2025-07/27/angriffe-auf-truck-von-cdu-verband-beim-berliner-csd-image-group/wide__148x84"" style=""float: left; margin-right: 5px;"" /></a> None",Christopher Street Day: Attacks on Truck by CDU-Verband at the Berlin CSD,"<a href=""https://www.zeit.de/news/2025-07/27/attacks-on-truck-of-cdu-verband-beim-berliner-csd""><img src=""https://img.zeit.de/news/2025-07/27/attacks-on-truck-of-cdu-verband-beim-berliner-csd-image-group/wide__148x84"" style=""float: left; margin-right: 5px;"" /></a> None",Christopher Street Day: 袭击柏林CSD的CDU网络卡车,"<href=""http://www.时间.en/news2025-07/27 attacking from-cdu -band -bair -bair -bair -bliner -csd""> <img src=""http://img.time.com/news 2025-07/27 on - track from -cdu-Cedu-Berliner-csd-image-group/wide_1448x84"" style=""float: left""; margin-right: 5px;"" //a>None"
27,Iran: Irans Parlament verabschiedet Gesetzentwurf zur Internetrinschränkung,"Ein neuer Gesetzentwurf soll dafür sorgen, dass Falschinformationen im Iran unter Strafe gestellt werden. Kritiker befürchten eine weitere Einschränkung des Internets.",Iran: Iran's Parliament adopts bill on Internet restriction,A new bill is designed to ensure that false information is punishable in Iran. Critics fear a further restriction of the Internet.,伊朗:伊朗议会通过互联网限制限制法案,一项新的法案是为了确保伊朗的虚假情报受到惩罚. 批评者担心互联网还会受到进一步的限制.
28,Grenzkonflikt in Südostasien: Druck von Trump auf Thailand und Kambodscha – neue Kämpfe,"<a href=""https://www.zeit.de/news/2025-07/27/druck-von-trump-auf-thailand-und-kambodscha-neue-kaempfe""><img src=""https://img.zeit.de/news/2025-07/27/druck-von-trump-auf-thailand-und-kambodscha-neue-kaempfe-image-group/wide__148x84"" style=""float: left; margin-right: 5px;"" /></a> None",Border conflict in Southeast Asia: Trump's pressure on Thailand and Cambodia – new struggles,"<a href=""https://www.zeit.de/news/2025-07/27/print-from-trump-on-thailand-and-kamboja-new-kaempfe""><img src=""https://img.zeit.de/news/2025-07/27/print-from-trump-on-thailand-and-kamboja-new-kaempfe-image-group/wide_148x84"" style=""float: left; margin-right: 5px;"" /></a> None","东南亚的边界冲突:特朗普对泰国和柬埔寨施加压力,引发新的战争.",<\ \ \ \ \ \ \ \ \ \ \ \ \ \ \ \ \ \ \ \ \ \ \ \ \ \ \ \ \ \ \ \ \ \ \ \ \ \ \ \ \ \ \ \ \ \ \ \ \ \ \ \ \ \ \ \ \ \ \ \ \ \ \ \ \ \ \ \ \ \ \ \ \ \ \ \ \ \ \ \ \ \ \ \ \ \ \ \ \ >
29,Event geht zu Ende: Travemünder Woche mit durchwachsener Bilanz,"<a href=""https://www.zeit.de/news/2025-07/27/travemuender-woche-mit-durchwachsener-bilanz""><img src=""https://img.zeit.de/news/2025-07/27/travemuender-woche-mit-durchwachsener-bilanz-image-group/wide__148x84"" style=""float: left; margin-right: 5px;"" /></a> None",Event comes to an end: Travemünder Week with a full-blown balance,"<a href=""https://www.zeit.de/news/2025-07/27/travemuender-week-with-adult balance""><img src=""https://img.zeit.de/news/2025-07/27/travemuender-week-with-adult balance-image-group/wide_148x84"" style=""float: left; margin-right: 5px;"" /></a> None","活动结束:一周的拖累 负债累累,负债累累","<href=""http://www.时间.en/news 2025-07/7/travemution-indeximumnation""> <img shrc=""http://img. time.com/news 2025-07/27/travelmmer - image-group/wide_148x84"" style=""float: left: margin-right: 5px;"" //a -None"
30,Parlamentseklat: Hakenkreuz-Skandal: Nun meldet sich Born zu Wort,"<a href=""https://www.zeit.de/news/2025-07/27/born-zum-hakenkreuz-hatte-keine-angst-erwischt-zu-werden""><img src=""https://img.zeit.de/news/2025-07/27/born-zum-hakenkreuz-hatte-keine-angst-erwischt-zu-werden-image-group/wide__148x84"" style=""float: left; margin-right: 5px;"" /></a> None",Parliamentary record: swastika scandal: Born now speaks,"<a href=""https://www.zeit.de/news/2025-07/27/born-to-hook-kreuz-hatte-no-anxiety-caught-to-be""><img src=""https://img.zeit.de/news/2025-07/27/born-to-hook-kreuz-hatte-no-anxe-caught-to-be-image-group/wide_148x84"" style=""float: left; margin-right: 5px;"" /></a> None","众议院: 纳粹丑闻,现在Born报到","< a href=""http://www.时间.en/news 2025-07/23-enhandle-knock-dock-src=""http://img.time.com/news 2025-07/27-757born-to-knock-dash-group/wide_148x84"" style=""float: left""; margin-right: 5px; //a>None"
31,Handball: Füchse Berlin gewinnen auch ihr drittes Testspiel deutlich,"<a href=""https://www.zeit.de/news/2025-07/27/fuechse-berlin-gewinnen-auch-ihr-drittes-testspiel-deutlich""><img src=""https://img.zeit.de/news/2025-07/27/fuechse-berlin-gewinnen-auch-ihr-drittes-testspiel-deutlich-image-group/wide__148x84"" style=""float: left; margin-right: 5px;"" /></a> None",Handball: Foxes Berlin also clearly win their third test game,"<a href=""https://www.zeit.de/news/2025-07/27/fuechse-berlin-wins-also-her-third-testgame-clear""><img src=""https://img.zeit.de/news/2025-07/27/fuechse-berlin-wins-also-her-third-testgame-clear-image-group/wide_148x84"" style=""float: left; margin-right: 5px;"" /></a> None",拳手: 狐狸在柏林的第三局比赛中胜出,"<href=""http://www.时间.en/news2025-07/200-7/foeches-level-first-first-test trials-src=""http://img.time.com/news 2025-07/270-foct-alth-friends-first-ground-level testing-group/wide_148x84"" style=""float: left: margin-right: 5px;"" //a>None"
32,Zootiere: Protest gegen Pavian-Tötung - Aktivisten kleben sich fest,"<a href=""https://www.zeit.de/news/2025-07/27/protest-gegen-pavian-toetung-aktivisten-kleben-sich-fest""><img src=""https://img.zeit.de/news/2025-07/27/protest-gegen-pavian-toetung-aktivisten-kleben-sich-fest-image-group/wide__148x84"" style=""float: left; margin-right: 5px;"" /></a> None",Zoo animals: Protest against baboon killing - Activists stick to each other,"<a href=""https://www.zeit.de/news/2025-07/27/protest-against-pavian-toetung-activist-stick-stick-stick-solid-image-group/wide_148x84"" style=""float: left; margin-right: 5px;"" /></a> None",动物园动物:反对帕维安的抗议活动 - - 活动家被困了.,"<href=""http://www.时间.en/news 2025-07/200 professional revolution - revolution - activities - src=""http://img. time.com/news 2025-07/2- protest - abvian-to-to-content"
33,Mentale Vorbereitung auf den Urlaub: Beach Body? Beach Brain!,"Das ganze Jahr ruinieren Menschen ihr Hirn mit sozialen Medien, im Urlaub wollen sie plötzlich Bücher lesen. Unsere Autorin erklärt, wie das mit etwas Training gelingt.",Mental preparation for your holiday: Beach Body? Beach Brain!,"Throughout the year, people ruin their brains with social media, and on vacation, they suddenly want to read books. Our author explains how to do this with some training.",为假期做心理准备 海滩运动?,"整整一年,人们用社交媒体破坏他们的脑子,在度假时突然想读书. 我们的作家解释了如何训练他们."
34,Feuerwehreinsatz: Brand einer Gartenlaube: Personen greifen Einsatzkräfte an,"<a href=""https://www.zeit.de/news/2025-07/27/brand-einer-gartenlaube-personen-greifen-einsatzkraefte-an""><img src=""https://img.zeit.de/news/2025-07/27/brand-einer-gartenlaube-personen-greifen-einsatzkraefte-an-image-group/wide__148x84"" style=""float: left; margin-right: 5px;"" /></a> None",Fire service: fire of a garden gazebo: people attack forces,"<a href=""https://www.zeit.de/news/2025-07/27/brand-a-gartenlaube-personen-griffe-kraefte-an""><img src=""https://img.zeit.de/news/2025-07/27/brand-a-gartenlaube-personen-griffe-kraefte-an-image-group/wide__148x84"" style=""float: left; margin-right: 5px;"" /></a> None",消防队:,"<href=""http://www.时间.en/news 2025-072-757brand-src=""http://img.time.com/news 2025-07/27-7/Brand-include-craft-include-image-group/wide_148x84"" style=""float: left: margin-right: 5px;"" //a -None"
35,"Daniel Kokotajlo: ""Mir scheint, dass wir auf eine Katastrophe zusteuern""","Eine superintelligente KI könnte die Menschheit ausrotten. Das sagen zwei, die sich sehr gut auskennen, Daniel Kokotajlo und Jonas Vollmer. Und zwar schon in zehn Jahren.","Daniel Kokotajlo: ""It seems to me that we are heading for a catastrophe""","A super-intelligent AI could wipe out humanity, which is what two people who know very well, Daniel Kokotajlo and Jonas Vollmer, say in ten years' time.","丹尼尔·科塔乔洛 (Daniel Kokotajlo) ""似乎我们正面临一场灾难""","一个超级聪明的人工智能可以消灭人类 这两个人非常了解人类,丹尼尔·科科塔乔洛和乔纳斯·福默,十年后就有了."
36,"Zollstreit EU-USA: Kommt ""der größte Deal von allen""?",In Schottland trifft sich EU-Kommissionspräsidentin Ursula von der Leyen mit US-Präsident Donald Trump. Gelingt ein Handelsabkommen? Antworten auf die wichtigsten Fragen,"EU-US customs dispute: comes ""the biggest deal of all""?","In Scotland, EU Commission President Ursula von der Leyen meets US President Donald Trump. Can a trade agreement be concluded? Answers to the most important questions","欧盟和美国的海关纠纷 ""最大的协议""会来临吗?","在苏格兰,欧盟委员会主席乌苏拉与美国总统唐纳德·特朗普会晤"
37,Krieg in der Ukraine: Ostukraine: Russen versuchen Einkesselung von Pokrowsk,"<a href=""https://www.zeit.de/news/2025-07/27/ostukraine-russen-versuchen-einkesselung-von-pokrowsk""><img src=""https://img.zeit.de/news/2025-07/27/ostukraine-russen-versuchen-einkesselung-von-pokrowsk-image-group/wide__148x84"" style=""float: left; margin-right: 5px;"" /></a> None",War in Ukraine: Eastern Ukraine: Russians trying to encircle Pokrovsk,"<a href=""https://www.zeit.de/news/2025-07/27/ostukraine-russen-unterungen-von-pokrowsk""><img src=""https://img.zeit.de/news/2025-07/27/ostukraine-russen-untersuchen-unterung-von-pokrowsk-image-group/wide_148x84"" style=""float: left; margin-right: 5px;"" /></a> None",乌克兰战争:东乌克兰:俄罗斯试图吞并波克洛克.,"< a href=""http://www.时间.en/news2025-07/7/20ostu 乌克兰-乌克兰-普洛茨基克"" > <imgsrc=""http://img. time.com/news 2025-07-07/ostu rush-rushed 乌克兰-looks-group/wide_148x84"" style=""float: left""; margin-right: 5px; //a -None"
38,Krieg in Gaza: Diese Hilfen sind nicht genug,"Israels Armee verkündet Kampfpausen im Gazastreifen und schickt mehr Hilfen – ein Eingeständnis, dass Netanjahus Gaza-Politik falsch war. Der Bevölkerung hilft das wenig.",War in Gaza: These Aids Are Not Enough,Israel's army announces breaks in the Gaza Strip and sends more aid – an admission that Netanyahu's Gaza policy was wrong.,加沙战争:这些援助还不够,"以色列军队宣布加沙地带的战斗暂停,并提供更多的援助来承认内塔尼亚胡的加沙政策是错误的. 民众对此无动于衷."
39,Krieg in Gaza: Merz fordert in Telefonat mit Netanjahu schnelle Hilfslieferungen,Der Bundeskanzler hat mit Israels Ministerpräsidenten über die Notlage in Gaza gesprochen. Erneut Berichte über getötete Menschen auf dem Weg zu Hilfsgütern. Das Liveblog,War in Gaza: Merz calls on Netanyahu for fast deliveries,The Federal Chancellor spoke to Israel's Prime Minister about the emergency situation in Gaza. Again reports about killed people on their way to relief supplies. The live blog,"加沙战争,梅兹要求尽快与内塔尼亚胡联系",德国总理与以色列总理讨论了加沙的紧急状况. 第二次报告是关于在前往救援途中被杀的人员. 现场新闻博客
40,Schulterschluss bei der Verteidigung,Aktuelle Informationen über die deutsche Außenpolitik und die internationalen Beziehungen Deutschlands.<br />,Confidentiality in defence,Current information on German foreign policy and international relations in Germany.<br />,辩方辩方的肩部断裂,关于德国外交政策和德国国际关系的最新信息.
41,Bayreuther Festspiele beginnen,Heute starten die Bayreuther Festspiele mit einer Neuproduktion von Richard Wagners „Die Meistersinger von Nürnberg“. Zur Premiere wird auch Friedrich Merz erwartet.,Bayreuth Festival begins,"Today the Bayreuth Festival starts with a new production of Richard Wagner's ""Die Meistersinger von Nürnberg"". Friedrich Merz is also expected to premiere.",巴伐利亚节日游戏开始,今天Bayluffer队开始庆祝 Richard Wagners 的重现 纽伦堡的大师级赛. 即将举行首映的是Friedrich Merz.
42,Macron und Merz bekräftigen Zusammenarbeit,Frankreichs Präsident und Deutschlands Bundeskanzler betonen die Freundschaft beider Länder und wollen auch Europa gemeinsam voranbringen.,Macron and Merz reaffirm cooperation,France's President and Germany's Chancellor stress the friendship of both countries and also want to promote Europe together.,Macron和Merz重申了合作,法国总统和德国总理强调两国的友谊 并希望共同推动欧洲前进
43,Bund investiert in Bundeswehr-Sanitätsdienst,Verteidigungsminister Pistorius will viel Geld in die Truppe investieren – dabei geht es nicht nur um Waffen.,Federal Government invests in Bundeswehr medical service,Defense Minister Pistorius wants to invest a lot of money in the force – this is not just about weapons.,盟军投资于联邦武装部队,国防部长皮斯托里乌斯想在部队里投资一大笔钱 这不仅仅是枪的问题
44,Mit Mooren und Wäldern gegen Hitze und Trockenheit,Wie kommt Deutschland besser mit der Erderwärmung zurecht? Die Natur sei die „wichtigste Verbündete“ sagt Umweltminister Carsten Schneider.,With bogs and forests against heat and drought,"How can Germany cope better with global warming? Nature is the ""most important ally"" says Environment Minister Carsten Schneider.",有荒野和森林来抵御炎热和干燥,"德国在应对全球变暖方面做得如何? 自然是最关键的盟友,Carsten Schneider部长说."
45,Initiative „Made for Germany“ plant hohe Investitionen,Eine Allianz von mehr als 60 Firmen stellt im Bundeskanzleramt Milliardenpläne für den Standort Deutschland vor.,"""Made for Germany"" initiative plans high investment",An alliance of more than 60 companies is presenting billions of plans for the location Germany in the Federal Chancellery.,德国联盟倡议计划进行大规模投资,超过60家公司联盟在德国总理办公室 提供数十亿美元的德国定位计划
46,Deutsche Fußballerinnen erreichen EM-Halbfinale,Deutschland ist bei der EM 2025 ins Halbfinale eingezogen. Gegen Frankreich siegte das Team mit 6:5 im Elfmeterschießen.,German women footballers reach the semi-finals,Germany moved into the semi-finals at the 2025 European Championships. The team won against France with 6:5 in penalty shooting.,德国足球女优进入EM决赛,德国在2025年进入了半决赛. 足球队以6比5胜11米.
47,Viertes Freiwasser-Gold: Wellbrock schreibt Geschichte,"Vier Starts, vier Siege: Schwimm-Triumphator Wellbrock gewinnt mit der Freiwasser-Staffel seinen vierten Titel im Freiwasser-Schwimmen.",Fourth Open Water Gold: Wellbrock Writes History,"Four starts, four victories: Swim-Triumphator Wellbrock wins his fourth title in outdoor swimming with the open water relay.",第四杯自由水的金币: 威勒布拉克正在创造历史.,"4次发射,4次胜利:游泳三重奏者韦尔布拉克 在自由水域赢得第4次冠军"
48,Merz fordert Feuerpause und mehr humanitäre Hilfe für Gaza,"Im Gaza-Krieg findet Merz klare Worte: Humanitäre Hilfe müsse die Menschen erreichen, die Geiseln freikommen und eine Nachkriegsordnung beiden Seiten gerecht werden.&nbsp;",Merz calls for ceasefire and more humanitarian aid for Gaza,"In the Gaza war, Merz finds clear words: Humanitarian aid must reach people, free the hostages and live up to a post-war order on both sides.","Merz要求停止对加沙的射击,增加人道主义援助.","加沙战争中,穆尔兹明确地指出,人道救援必须到达人民手中,释放人质,并执行战后的规则."
49,Neues Kapitel der deutsch-britischen Freundschaft,Bundeskanzler Merz und Premierminister Starmer haben einen deutsch-britischen Freundschaftsvertrag unterzeichnet – mit zahlreichen konkreten Vereinbarungen.&nbsp;,New chapter of German-British friendship,Federal Chancellor Merz and Prime Minister Starmer have signed a German-British friendship agreement – with numerous concrete agreements.,德国-英国友谊的新章节,"德国总理梅兹和史塔默总理 签署了一份德国和英国的友谊条约,并签署了许多具体的协议. & nbsp;"
50,Kritik an Reiches Vorstoß zu längerer Lebensarbeitszeit,"Mehr und länger arbeiten? Mit ihrer Forderung nach einer höheren Lebensarbeitszeit stößt Wirtschaftsministerin Reiche auf Widerspruch. Der kommt vom Koalitionspartner, aber auch aus der eigenen Partei.",Criticism of Empire Advance to Longer Lifetime Work,"More and longer work? With her demand for a higher working life, Minister Reiche encounters contradictions. This comes from the coalition partner, but also from her own party.",对帝国长期工作时间的批评,"工作时间越来越长了? 经济部长要求提高工作时间,却反对了富国. 联合党成员,也来自自己的政党."
51,Wie geschwächt ist die jemenitische Huthi-Miliz?,"Der Iran und seine ""Achse des Widerstands"" sind stark geschwächt - und auch die Huthi selbst waren Ziel vieler Angriffe. Doch die jemenitische Miliz und ihre Verbündeten formieren sich wohl neu. Von Jürgen Stryjak.",How weakened is the Yemeni Huthi militia?,"Iran and its ""axis of resistance"" are strongly weakened - and the Huthi themselves were also the target of many attacks. However, the Yemeni militia and their allies are probably regrouping. By Jürgen Stryjak.",荷梅尼赫希民兵有多弱?,"伊朗及其""抵抗轴心""严重削弱 - - 赫斯提本人也是很多攻击的目标. 但也门民兵及其盟国似乎正在重新集结. 由尤尔根·斯特里雅克 (Jurgen Stryjak) 领导."
52,Warum Frauen anders investieren sollten als Männer,"Bei Finanzen stehen Frauen oft schlechter da als Männer, etwa wegen ungleicher Bezahlung und Teilzeitarbeit. Wie Frauen ihre finanzielle Situation mit einer eigenen Strategie verbessern können. Von L.-M. Hiltscher und L. Leun.",Why women should invest differently than men,"In finance, women are often worse off than men, for example because of unequal pay and part-time work. How women can improve their financial situation with their own strategy. By L.-M. Hiltscher and L. Leun.",为什么女人要跟男人不同投资?,"女人在财务方面往往比男人糟糕,比如工资不平等,兼职工作. 女人如何用自己的策略改善她们的财政状况. 从L. M."
53,Nahost-Liveblog: ++ Merz fordert mehr Einsatz für Waffenruhe ++,Kanzler Merz hat in einem Telefonat mit Israels Premier Netanjahu mehr Engagement für eine Feuerpause gefordert. Nach palästinensischen Angaben wurden mindestens 40 Menschen bei israelischen Angriffen getötet.,Middle East live blog: ++ Merz calls for more use for ceasefire ++,"Chancellor Merz called Israel's Prime Minister Netanyahu for more commitment to a ceasefire. According to Palestinian information, at least 40 people were killed in Israeli attacks.","中东词典:++merz要求增加停火的部署量,++++","莫兹总理在与以色列总理内塔尼亚胡的通话中要求增加停火的决心. 据巴勒斯坦情报,在以色列袭击中至少杀害了40人."
54,"Hitzerekord und Waldbrände: 50,5 Grad im türkischen Silopi","Die Türkei hat einen neuen Hitzerekord gemeldet: In Silopi kletterte das Thermometer bis auf 50,5 Grad Celsius. In dem Land und in Griechenland kämpfen Einsatzkräfte seit Tagen gegen heftige Waldbrände.",Heat record and forest fires: 50.5 degrees in the Turkish silopi,"Turkey has reported a new heat record: in Silopi, the thermometer climbed to 50.5 degrees Celsius. In the country and in Greece, forces have been fighting violent forest fires for days.",土耳其的西拉皮市温度为50.5度,"土耳其的热量记录显示,在西拉皮,温度计达到了50.5摄氏度. 在土耳其和希腊,战斗人员几天来都在与强烈的森林大火战斗."
55,"Duisburg: Ein weiterer ""Weißer Riese"" ist gesprengt",Die 20 Stockwerke sind zu Geröll geworden: In Duisburg ist der dritte und vorerst letzte Hochhausblock eines markanten Wohnkomplexes gesprengt worden. Das war angesichts der Lage anspruchsvoll.,"Duisburg: Another ""White Giant"" is blown up",The 20 floors have become screeched: in Duisburg the third and for the time being the last high-rise block of a striking residential complex has been blown up. That was challenging given the location.,"杜瓦斯堡:又一个""白色巨人""被炸毁","二十层楼已经变高了:在杜伊斯堡,第三栋,目前已炸毁的楼顶. 考虑到情况,这是很艰巨的."
56,Russische Flottenparade wegen Sicherheitsproblemen abgesagt,Eigentlich sollte in St. Petersburg der Tag der Marine gefeiert werden - doch die geplante Parade fällt nun aus. Der Kreml verwies auf Sicherheitsprobleme. Am Morgen wurden in dem Gebiet mehr als zehn ukrainische Drohnen abgeschossen.,Russian fleet parade cancelled due to security problems,In St. Petersburg the day of the navy was supposed to be celebrated - but the planned parade is now cancelled. The Kremlin pointed to security problems. In the morning more than ten Ukrainian drones were shot down in the area.,俄罗斯舰队因安全问题取消大游行,"在圣彼得堡,本应庆祝海军陆战队日,但计划取消. 克里姆林宫指出了安全问题. 第二天早上在该地区击落了十多架乌克兰无人机."
57,Haiti und Dominikanische Republik: Hinter der Grenze das Elend,Viele Haitianer sind Billigarbeiter in der benachbarten Dominikanischen Republik. In ihrer Heimat herrschen dagegen Gewalt und Elend. Wie konnten sich beide Inselteile so unterschiedlich entwickeln? Von M.-K. Boese.,Haiti and Dominican Republic: Behind the border the misery,"Many Haitians are cheap workers in the neighboring Dominican Republic. In their homeland, violence and misery prevail. How could both parts of the island develop so differently? By M.-K. Boese.",海地和多米尼加共和国: 边境的另一边是痛苦,许多海地人都是邻国多米尼加共和国的低成本工人. 他们的家乡有暴力和苦难. 他们怎么会有如此不同的国家?
