,title-de,content-de,title-en,content-en,title-zh,content-zh
26,Wahl von Verfassungsrichtern: Und keiner sieht gut aus,Das Debakel anlässlich der Wahl der Verfassungsrichter hatte sich angedeutet. Doch dieser Freitag wurde zu einem befremdlichen Schauspiel. Was jetzt?,Election of constitutional judges: And no one looks good,"The debacle on the occasion of the election of the constitutional judges had hinted, but this Friday became a strange spectacle. What now?",选举宪法法官: 没有人是好的.,"法官选举时的失败已经显现出来,但本周五却成了一个奇怪的表演. 现在怎么办?"
27,Kurdenkonflikt: PKK legt erste Waffen nieder - Rückt Frieden näher?,"<a href=""https://www.zeit.de/news/2025-07/11/pkk-beginnt-symbolische-waffenniederlegung""><img src=""https://img.zeit.de/news/2025-07/11/pkk-beginnt-symbolische-waffenniederlegung-image-group/wide__148x84"" style=""float: left; margin-right: 5px;"" /></a> None",Kurdish conflict: PKK lays down first weapons - Does peace move closer?,"<a href=""https://www.zeit.de/news/2025-07/11/pkk-begins-symbolic-weapon stoppage""><img src=""https://img.zeit.de/news/2025-07/11/pkk-begins-symbolic-weapon stoppage-image-group/wide_148x84"" style=""float: left; margin-right: 5px;"" /></a> None",库尔德人冲突:PKK先放下武器 - 和平近吗?,"< a href=""http://www.时间.en/news 2025-07/11/pk-Strc-Strc=""http://img.time.com/news 2025-07/01/pk- symbol-decount-gumented-group/wide_148x84"" style=""float: left: margin-right: 5px;"" // a>None"
28,Migrationspolitik: Land will Abschiebehaftanstalt 2028 in Betrieb nehmen,"<a href=""https://www.zeit.de/news/2025-07/11/land-will-abschiebehaftanstalt-2028-in-betrieb-nehmen""><img src=""https://img.zeit.de/news/2025-07/11/land-will-abschiebehaftanstalt-2028-in-betrieb-nehmen-image-group/wide__148x84"" style=""float: left; margin-right: 5px;"" /></a> None",Migration policy: Land wants to put detention centre 2028 into operation,"<a href=""https://www.zeit.de/news/2025-07/11/land-will-deportation-institution-2028-in-operation""><img src=""https://img.zeit.de/news/2025-07/11/land-will-deportation-institution-2028-in-operation-image-group/wide_148x84"" style=""float: left; margin-right: 5px;"" /></a> None",移民政策:国家想在2028年启动拘留所,"< a href=""http://www.时间.en/news 2025-07/11/land-l-in operation""> <img shrc=""http://img. time.com/news 2025-07/11/land-l/remove-in operation-Group/wide_148x84"" style=""float: left: margin-right: 5px;"" // a>None"
29,Untreue-Vorwürfe: Landtagspräsident kritisiert Vorgehen bei Razzia im Landtag,"<a href=""https://www.zeit.de/news/2025-07/11/landtagspraesident-kritisiert-vorgehen-bei-razzia-im-landtag""><img src=""https://img.zeit.de/news/2025-07/11/landtagspraesident-kritisiert-vorgehen-bei-razzia-im-landtag-image-group/wide__148x84"" style=""float: left; margin-right: 5px;"" /></a> None",Infidelity: President of the Landtag criticizes action during raids in the Landtag,"<a href=""https://www.zeit.de/news/2025-07/11/landdayspraesident-critisiert-vorgang-bei-razzia-im-landtag""><img src=""https://img.zeit.de/news/2025-07/11/landdayspraesident-critisiert-vorgang-bei-razzia-im-landtag-image-group/wide_148x84"" style=""float: left; margin-right: 5px;"" /></a> None",不忠的提案:国家日报主席在全国日的搜捕行动中 提出批评.,"< a href=""http://www.时间.en/news2025-07/01/landtags pragment respected land tags in-landtag""> <img shr=""http: //img. time.com/news 2025-07/1111-landtags pragments authorized authorization authorized-in-mage-group/wide_148x84"" style=""float: left: margin-right: 5px;"" // > None"
30,Konflikte: Nach Vorfall: Demos vor Langenauer Gottesdiensten verboten,"<a href=""https://www.zeit.de/news/2025-07/11/nach-vorfall-demos-vor-langenauer-gottesdiensten-verboten""><img src=""https://img.zeit.de/news/2025-07/11/nach-vorfall-demos-vor-langenauer-gottesdiensten-verboten-image-group/wide__148x84"" style=""float: left; margin-right: 5px;"" /></a> None",Conflicts: After incident: Demos in front of Langenau services forbidden,"<a href=""https://www.zeit.de/news/2025-07/11/after-event-demos-vor-langenauer-godesdiensten-verboten""><img src=""https://img.zeit.de/news/2025-07/11/after-event-demos-vor-langenauer-godesdiensten-verboten-image-group/wide_148x84"" style=""float: left; margin-right: 5px;"" /></a> None","冲突:事件发生后,禁止示威,在严格的礼拜前禁止示威.","< a href=""http://www.时间.en/news 2025-07/111/11个事件发生前准确服务禁令""> <img shrc=""http://img. time.com/news 2025-07/11/first-first-floats/wide_148x84"" style=""float: left: margin-right: 5px;"" // a>None"
31,Prozess um Kindesentführung: Promi-Prozess um Entführung der Block-Kinder,"<a href=""https://www.zeit.de/news/2025-07/11/prozess-um-kindesentfuehrung-gegen-christina-block-gestartet""><img src=""https://img.zeit.de/news/2025-07/11/prozess-um-kindesentfuehrung-gegen-christina-block-gestartet-image-group/wide__148x84"" style=""float: left; margin-right: 5px;"" /></a> None",Child Abduction Trial: Celebrity Trial for Kidnapping Block Children,"<a href=""https://www.zeit.de/news/2025-07/11/prozess-um-kindesentführung-genu-christina-block-gestartet-image-group/wide_148x84"" style=""float: left; margin-right: 5px;"" /></a> None",绑架儿童的诉讼: 绑架Block儿童的名人诉讼,"<href=""http://www.时间.en/news2025-07/111-processitation 和 christina - block -gestererection""> <img shrc=""http://img.time.com/news 2025-07/11-processary process 和 kristina-strengthree-processistation-group/wide_148x84"" style=""float: left""; margin-right: 5px; ""//a>None"
32,Corona-Maskenaffäre: BGH reduziert Haftstrafe für Andrea Tandler,Die Verurteilung der Politikertochter Andrea Tandler wegen Steuerhinterziehung im Zuge der Coronapandemie ist rechtskräftig. Der BGH hat ihre Strafe jedoch verkürzt.,Corona mask affair: BGH reduces imprisonment for Andrea Tandler,"The conviction of the politician's daughter Andrea Tandler for tax evasion in the course of the Coronapandemie is legally valid. However, the BGH has shortened its punishment.","Corona Mascanatic: BZT减刑,Andrea Tendler被判处无期徒刑","政客的女儿安吉丽雅·坦德勒在科罗纳大流行期间因逃税而被判刑,是合法的. 但是,布宜诺斯艾利斯已经减刑了."
33,Öffentlicher Dienst: Bleibt die Tür für AfD im öffentlichen Dienst zu?,"<a href=""https://www.zeit.de/news/2025-07/11/bleibt-die-tuer-fuer-afd-im-oeffentlichen-dienst-zu""><img src=""https://img.zeit.de/news/2025-07/11/bleibt-die-tuer-fuer-afd-im-oeffentlichen-dienst-zu-image-group/wide__148x84"" style=""float: left; margin-right: 5px;"" /></a> None",Public service: Is the door for AfD closed in the public service?,"<a href=""https://www.zeit.de/news/2025-07/11/remains-the-tuer-for-afd-im-public-service-for-image-group/wide_148x84"" style=""float: left; margin-right: 5px;"" /></a> None",公共服务:AfD的门在公务部门是关着的吗?,"< a href=""http://www.时间.en/news 2025-07/111/留存- thetuer-fuer-afted public service to ""> <img shrc=""http: //img. time. com/news 2025-07/11- the-fuer-afd-in-oped-group/wide_148x84"" style=""float: left: margin-right: 5px;"" />"""
34,Brände: Feuer in Schuhgeschäft - 300.000 Euro Schaden,"<a href=""https://www.zeit.de/news/2025-07/11/feuer-in-schuhgeschaeft-300-000-euro-schaden""><img src=""https://img.zeit.de/news/2025-07/11/feuer-in-schuhgeschaeft-300-000-euro-schaden-image-group/wide__148x84"" style=""float: left; margin-right: 5px;"" /></a> None","Fires: fire in shoe shop - 300,000 euros damage","<a href=""https://www.zeit.de/news/2025-07/11/fire-in-shoe-shape-300-000-euro-damage-image-group/wide__148x84"" style=""float: left; margin-right: 5px;"" /></a> None","鞋店着火 - - 30,000欧元的损失",<\ \ \ \ \ \ \ \ \ \ \ \ \ \ \ \ \ \ \ \ \ \ \ \ \ \ \ \ \ \ \ \ \ \ \ \ \ \ \ \ \ \ \ \ \ \ \ \ \ \ \ \ \ \ \ \ \ \ \ \ \ \ \ \ \ \ \ \ \ \ \ \ \ \ \ \ \ \ \ \ \ \ \ \ \ \ \ \ \ \ \ \ \ \ \ \ >
35,PKK: PKK-Kämpfer verbrennen ihre Waffen im Nordirak,"Kämpfer der kurdischen Arbeiterpartei haben in einem symbolischen Akt damit begonnen, ihre Waffen zu übergeben. Kurz davor gab es einen Drohnenangriff.",PKK: PKK fighters burn their weapons in northern Iraq,"Fighters of the Kurdish Workers' Party began to hand over their weapons in a symbolic act. Shortly before that, there was a drone attack.",PKK:PK战士在伊拉克北部烧毁他们的武器,库尔德工人党的战士们开始以象征的姿态 交出他们的武器
36,Nach Brand in Warschau: Russland schließt polnisches Generalkonsulat in Kaliningrad,Polen wirft Russland die Beteiligung an einem Großbrand in Warschau vor und ließ das russische Generalkonsulat in Krakau schließen. Russland reagiert auf ähnliche Weise.,After a fire in Warsaw: Russia closes Polish Consulate General in Kaliningrad,Poland accuses Russia of participating in a major fire in Warsaw and closed the Russian Consulate General in Krakow. Russia reacts in a similar way.,在华沙大火后 俄罗斯在卡林宁拉德关闭了波兰总领事馆,"波兰指责俄罗斯参与了华沙一场大火,并关闭了克拉科夫的俄罗斯总领事馆. 俄罗斯也这样做了."
37,"Migration: Grenze offen, Grenze dicht","Vor zehn Jahren machten sich Tausende Geflüchtete auf den Weg in die EU. Zwei Perspektiven auf eine Entscheidung, deren Folgen bis heute nachwirken.","Migration: border open, border dense","Ten years ago, thousands of refugees made their way to the EU. Two perspectives for a decision, the consequences of which are still being followed up today.","移民: 开放边境,关闭边境","十年前,成千上万的逃往欧盟的难民,对一个决定有两个观点,直到今天才产生影响."
38,"Richterwahl im Bundestag: Lars Klingbeil fordert ""Führung und Verantwortung"" von der Union",Der SPD-Chef spricht nach der gescheiterten Richterwahl vom Wert des Kompromisses. Jens Spahn äußert sich schmallippig. Die Grünen fordern eine Bundestagssondersitzung.,"Election of judges in the Bundestag: Lars Klingbeil calls for ""leadership and responsibility"" from the Union","After the failed election of judges, the SPD boss speaks of the value of the compromise. Jens Spahn expresses himself narrow-lipped. The Greens demand a special session of the Bundestag.","Lars Klingbeil 要求联盟的""领导和责任""","社民党领袖在选举失败后,谈论妥协的价值. 延斯·斯巴恩说得很微妙. 绿党要求举行联邦特别会议."
39,Massaker von Srebrenica: Das Kind aus der Stadt des Todes,Ein todgeweihter Mann übergibt mitten in einem Massaker einer fremden Frau sein Baby. Diese Sekunde verändert fünf Leben für immer.,Srebrenica Massacre: The Child from the City of Death,A man dedicated to death hands over his baby in the middle of a massacre of a foreign woman. This second changes five lives forever.,斯雷布雷尼察大屠杀:死亡之城的孩子,"一个熟练的男人在一个陌生女人的大屠杀中把孩子交给了自己的孩子. 这个瞬间改变了五条生命,永远改变."
40,Bundestag gedenkt des Massakers von Srebrenica,Aktuelle Informationen über die deutsche Außenpolitik und die internationalen Beziehungen Deutschlands.<br />,Bundestag commemorates the massacre of Srebrenica,Current information on German foreign policy and international relations in Germany.<br />,联邦日纪念斯雷布雷尼察大屠杀,关于德国外交政策和德国国际关系的最新信息.
41,Merz für deutsche Führungsrolle in der Nato,Vor 70 Jahren ist die Bundesrepublik der Nato beigetreten. Bundeskanzler Friedrich Merz spricht sich für eine stärkere Position Deutschlands im Bündnis aus.,Merz for German leadership role in Nato,"70 years ago, the Federal Republic of Germany joined NATO. Federal Chancellor Friedrich Merz advocates a stronger position in Germany in the alliance.",德国在北约领导层的默兹,"70年前,北约加入纳托共和国. 总理弗里德里希·默兹支持德国在联盟中的地位."
42,Klingbeil plant hohe Investitionen in Deutschlands Zukunft,Finanzminister Lars Klingbeil kündigt in der Haushaltswoche des Bundestags einen Investitionsschub für die Infrastruktur an. Auch die Wirtschaft will Milliarden investieren.,Klingbeil plans to invest heavily in Germany's future,Finance Minister Lars Klingbeil announces an investment boost for the infrastructure during the budget week of the Bundestag. The economy also wants to invest billions.,克林贝尔计划对德国的未来进行大规模投资,Lars Klingbeil 财政部长在联邦预算周内宣布为基础设施投资. 经济也想要投资数十亿美元.
43,Lettland begrüßt deutsche Führungsrolle in Europa,Bundespräsident Steinmeier trifft in Riga Präsident Rinkevics und Premierministerin Silina&nbsp;,Latvia welcomes German leadership in Europe,Federal President Steinmeier meets President Rinkevics and Prime Minister Silina&nbsp in Riga;,拉脱维亚欢迎德国在欧洲的领导者,联邦主席斯坦梅耶在里加会见了林克维奇斯总统 总理席尔纳·恩尼格
44,Deutsche Industrie produziert überraschend wieder mehr,"Vor allem der Energiesektor, die Pharmabranche und die Autoindustrie legen zu.",German industry surprisingly produces more,"In particular, the energy sector, the pharmaceutical industry and the car industry are growing.",德国工业出人意料地恢复生产率,"特别是能源部门,制药业和汽车业"
45,Einem Klimarätsel auf der Spur,"Ein Forschungsteam hat in der Antarktis über 1,2 Millionen Jahre altes Eis angebohrt – und hofft, so ein Rätsel der Klimageschichte zu lösen.&nbsp;",Tracking down a climate puzzle,A research team in Antarctica has drilled over 1.2 million years old ice – and hopes to solve a mystery of climate history.&nbsp;,跟踪一个气候谜团,一个研究小组在南极洲挖了120万年的冰块 希望能解开这个气候历史的谜题
46,Wadephul betont Bedeutung der Wissenschaftsfreiheit,Zum 100-jährigen Bestehen des DAAD begrüßte Außenminister Johann Wadephul Geförderte aus 94 Ländern in Berlin.,Wadephul stresses the importance of freedom of science,"For the 100th anniversary of the DAAD, Foreign Minister Johann Wadephul welcomed sponsors from 94 countries in Berlin.",韦德福强调科学自由的重要性,"DAAD成立一百周年之际,外交部长约翰·韦德菲尔 (Johann Wadephul) 欢迎来自94个国家的柏林."
47,Deutschland baut Windkraft zügig aus,Auch Solar-Ausbau schreitet voran: Ziel für 2030 zur Hälfte erreicht.,Germany is rapidly expanding wind power,Solar expansion is also progressing: half of the target for 2030 is achieved.,德国正在迅速建造风力发电厂,太阳照射也正在前进 2030年的目标达到一半
48,Flasbarth: Klimadiplomatie intensivieren,"Umweltstaatssekretär Jochen Flasbarth wirbt auf einer Reise nach Brasilien, Südafrika und China für ein entschlossenes Vorgehen beim Klimaschutz.&nbsp;",Flasbarth: intensifying climate diplomacy,"Environment Secretary Jochen Flasbarth, on a trip to Brazil, South Africa and China, promotes a determined approach to climate protection.",Flasbarth: 加深气候外交,"环境秘书Jajan Flasbarth在前往巴西,南非和中国的路上 为气候变化采取果断行动. & nbsp;"
49,Ukraine-Liveblog: ++ US-Sondergesandter reist nach Kiew ++,Der US-Sondergesandte Kellogg beginnt am Montag einen einwöchigen Besuch in der Ukraine. In der Stadt Charkiw hat es Verletzte bei russischen Angriffen gegeben. Laut Präsident Selenskyj wurde auch eine Entbindungsstation getroffen.,Ukraine live blog: ++ US special envoy travels to Kiev ++,"US Special Envoy Kellogg starts a week-long visit to Ukraine on Monday. In the city of Kharkiv there were injured in Russian attacks. According to President Selenskyy, a maternity ward was also hit.",乌克兰立体博客:++美国特遣队前往基辅++,"美国特遣队Kellogg周一开始访问乌克兰一周. 在Charkiw市,俄罗斯袭击中有人受伤. 报告说,Selenskyy总统还袭击了分娩站."
50,Kommentar zur verschobenen Richterwahl: Ein Desaster für alle,"Nach dem Bundestags-Eklat um die Abstimmung über Richterposten steht für Dagmar Pepping keine Partei gut da: weder die Union noch die SPD. Zudem schwinde das Vertrauen, dass die Koalition stabil bleibt.",Comment on the postponed judge's election: A disaster for all,"According to the Bundestag statement for the vote on Judges, Dagmar Pepping does not have a good party: neither the Union nor the SPD. Furthermore, the confidence that the coalition will remain stable disappears.",关于推迟的法官选举的评论: 一场大灾难将给所有人带来灾难.,"经过联邦公投选举,达格玛·佩普普普的选举,没有一方是好政党:无论是联盟还是社民党. 此外,联盟保持稳定的信心也受到削弱."
51,Marktbericht: Neue US-Zolldrohungen vermiesen die Wochenbilanz,Zum Wochenschluss belastet die Ankündigung weiterer US-Strafzölle den DAX. Die Anleger möchten vor dem Wochenende die Risiken in ihrem Depots minimieren. Auch die Wall Street fällt wieder zurück.,Market Report: New US Customs Threats Failed the Weekly Balance,"At the end of the week, the announcement of additional US fines will burden the DAX. Investors want to minimize the risks in their depot before the weekend. Wall Street is also falling back.",市场报告:新的美国威胁会破坏周薪,"一周后,又一项美国关税通知将对达克斯公司造成影响. 投资者希望在周末前降低他们存货的风险. 华尔街也在倒退."
52,So geht gesundes Grillen,"Grillen hat in Sachen Gesundheit keinen guten Ruf - gegrilltes Fleisch etwa kann krebserregende Stoffe enthalten. Doch es gibt Tipps, mit denen sich das Risiko eindämmen lässt. Von Niels Walker.",That's how healthy cricketing works,"Grilling does not have a good reputation in terms of health - grilled meat, for example, can contain carcinogenic substances. However, there are tips that can help to reduce the risk. By Niels Walker.",健康的蟋蟀就是这样运作的,"烧烤炉在健康方面名声不好 - 比如烧烤的肉可以含有致癌物质,但有证据表明,Nels Walker会承担风险."
53,Wie geht es bei der Wahl der Verfassungsrichter nun weiter?,"Der Bundestag hat beschlossen, dass die viel diskutierte Wahl von drei Bundesverfassungsrichtern vorerst nicht stattfindet. Was bedeutet das für das Gericht und wie geht es jetzt weiter? Von Kolja Schwartz.",What is the next step in the election of the constitutional judges?,The Bundestag has decided that the much-discussed election of three federal constitutional judges will not take place for the time being. What does this mean for the court and how does it go on now? By Kolja Schwartz.,选举法官的进展如何?,"联邦会议决定,目前三位联邦法院法官的广泛辩论选举无效. 这对法庭意味着什么,现在要怎么办?"
54,Nanjing: Volkswagen schließt erstmals komplettes Werk in China,Der Volkswagen-Konzern schließt erstmals eines seiner Werke in China. Die Produktion in Nanjing steht dem Konzern zufolge bereits still. Bis Ende des Jahres soll der Standort endgültig geschlossen werden.,Nanjing: Volkswagen closes complete plant in China for the first time,"The Volkswagen Group is closing one of its plants in China for the first time. According to the company, production in Nanjing is already standing still. By the end of the year, the site is to be definitively closed.","南京,人民车首度在中国完成全部工作","人民汽车公司首度关闭其在中国的一部作品. 据说南京的生产已经停止了,到今年年底为止,该地点将被彻底关闭."
55,Sparkurs bei Ford: Gewerkschaft und Management einigen sich,Die IG Metall und das Management bei den kriselnden Ford-Werken in Köln haben sich auf Regelungen für den geplanten Stellenabbau verständigt. Bis Ende 2027 sollen fast 3.000 Mitarbeitende gehen.,Austerity at Ford: union and management agree,"The IG Metall and the management at the crisis-ridden Ford plants in Cologne have agreed on regulations for the planned job reduction. By the end of 2027 almost 3,000 employees are to go.","福特的储蓄率,工会和管理部门达成一致意见","核子危机中的福特厂商的IG金属和管理部门已经确定了计划的裁员安排. 到2027年末,将有大约3000人参与其中."
56,Texas: Trump besucht Überschwemmungsgebiet,Eine Woche nach den verheerenden Überschwemmungen mit mehr als 120 Toten in Texas besucht Präsident Trump das Gebiet. Noch immer suchen Helfer nach Vermissten. Doch in die Trauer mischt sich auch Kritik an der Regierung. Von R. Borchard.,Texas: Trump Visits Flooding Area,"One week after the devastating floods with more than 120 deaths in Texas, President Trump is visiting the area. Helpers are still looking for missing persons. But criticism of the government is also mixed in with grief. By R. Borchard.",德克萨斯州: 特朗普访问洪水区,"德克萨斯州有120多人遇难,一周后,特朗普总统访问了该地区. 援助人员仍在寻找失踪者. 但悲伤也伴随着对政府的批评. 由R. Borchard进行的批评."
57,Weltbevölkerungstag: Mehr Selbstbestimmung und weniger Kinder,"In einigen Regionen nimmt die Bevölkerung schnell zu, anderswo schrumpft sie. Forschende sagen, die Geburtenrate wäre ausgeglichener, wenn alle Menschen frei entscheiden könnten, wie viele Kinder sie haben wollen. Von Sven Kästner.",World Population Day: More self-determination and fewer children,"In some regions the population is growing rapidly, elsewhere it is shrinking. Researchers say that the birth rate would be more balanced if all people could decide freely how many children they want to have. By Sven Kästner.",世界日:更多的自决和少一点儿童.,"在某些地区,人口增长迅速,在其他地方下降. 研究者说,如果所有人都能自由地决定他们想要多少孩子,生育率就会更加均衡. 由斯文·卡斯特纳 (Sven Kastner) 提供."
58,"Mehr Firmenpleiten in Deutschland - ""Welle schwillt an""","Derzeit gehen so viele Firmen pleite wie seit vielen Jahren nicht mehr. Während einige Experten die hohe Zahl mit der schwächelnden Konjunktur und Standortproblemen begründen, sehen andere einen Nachholeffekt.","More company bankruptcies in Germany - ""wave swells up""","At present, as many companies are not going bankrupt as in many years. While some experts justify the high number with the weakening economy and location problems, others see a catch-up effect.","在德国,更多的公司倒闭 - - ""谁在发胖""","目前,许多公司没有像过去几年那样破产了. 虽然有些专家认为经济放缓和地理位置不稳,但其他人却看到了补救效应."
59,Bundestag verschiebt Wahlen von Verfassungsrichtern,"Die Neubesetzung von drei Stellen am Bundesverfassungsgericht bleibt vorerst ungeklärt. Die Abstimmung im Bundestag über die Posten wurde verschoben, nachdem die Union sich gegen die von der SPD nominierte Kandidatin gestellt hatte.",Bundestag postpones elections of constitutional judges,The replacement of three posts at the Federal Constitutional Court remains unexplained for the time being. The vote in the Bundestag on the posts was postponed after the Union had opposed the candidate nominated by the SPD.,联邦法院推迟了法官的选举,联邦宪法法院的三个职位的重新安置尚未确定. 联邦议会的选举在联盟反对党民党提名的候选人后被推迟了.
60,"Bundesrat stimmt ""Investitionsbooster"" für Unternehmen zu","Der Bundesrat hat den Weg für den ""Investitionsbooster"" freigemacht - ein Paket mit milliardenschweren Steuerentlastungen für Unternehmen. Kanzler Merz sagte, es sei dringend nötig, um wieder für Wachstum zu sorgen.","Federal Council approves ""investment booster"" for companies","The Federal Council has cleared the way for the ""investment booster"" - a package with billion-dollar tax reliefs for companies. Chancellor Merz said it was urgently necessary to restore growth.","联邦委员会同意为公司""投资组合""","联邦委员会为""投资组合""铺平了道路 - - 为公司提供了数十亿美元的税收减免额. 默兹总理说迫切需要恢复增长."
61,Viele Israelis haben im Krieg mit dem Iran ihre Wohnung verloren,Viele Wohnungen und Häuser in Israel wurden im Krieg mit dem Iran beschädigt oder zerstört. Die ehemaligen Bewohner schlafen in Hotels. Die Suche nach neuen Wohnungen gestaltet sich wegen steigender Mieten als schwierig. Von Bettina Meier.,Many Israelis lost their homes in the war with Iran,Many apartments and houses in Israel were damaged or destroyed in the war with Iran. The former residents sleep in hotels. The search for new apartments is difficult because of rising rents. By Bettina Meier.,许多以色列人在与伊朗的战争中失去了自己的住所,"以色列境内许多住宅和房屋在与伊朗的战争中遭到破坏或毁坏. 前居民睡在旅馆里,因为房租的增加而寻找新房是困难的. 由贝蒂娜·梅耶 (Bettina Meier) 提供."
62,Brasiliens Präsident Lula zeigt sich unbeeindruckt von US-Zollpolitik,"50 Prozent Importzoll haben die USA auf Waren aus Brasilien angekündigt. Was den Präsidenten des Landes, Lula da Silva, kaum aus der Ruhe bringt. Doch in der Bevölkerung wächst die Wut auf die US-Politik. Von Kai Laufen.",Brazil's President Lula Unimpressed by US Customs Policy,"The United States has announced 50 percent import tariffs on goods from Brazil, which makes the country's president, Lula da Silva, scarcely rest. However, in the population there is growing anger about US politics. By Kai Laufen.",巴西总统露拉对美国政策毫无印象,"美国已宣布50%的进口关税是来自巴西的商品. 这让该国总统卢拉达席尔瓦难以安宁. 但是,在民众中,美国政策的愤怒正在增加. 凯在奔跑."
