,title-de,content-de,title-en,content-en,title-zh,content-zh
27,Entwicklungsministerin Reem Alabali Radovan zur Ukraine anlässlich der ukrainisch-deutschen kommunalen Partnerschaftskonferenz,"Entwicklungsministerin Reem Alabali Radovan: „Russland überzieht die Ukraine mit den schlimmsten Angriffen seit dem Beginn des Krieges. Die Ukraine braucht unsere ungebrochene Solidarität und Unterstützung jetzt mehr denn je. Es ist bestärkend, dass das Engagement in Deutschland für die Ukraine nicht nur weitergeht, sondern es immer mehr Partnerschaften zwischen Städten und Gemeinden gibt. Denn viele in Deutschland wollen ganz praktisch den Menschen im Krieg helfen. (...)""",Development Minister Reem Alabali Radovan on Ukraine on the occasion of the Ukrainian-German local partnership conference,"Development Minister Reem Alabali Radovan said: ""Russia is taking over Ukraine with the worst attacks since the beginning of the war. Ukraine needs our unbroken solidarity and support now more than ever. It is encouraging that Germany's commitment to Ukraine not only continues, but that there are more and more partnerships between cities and communities. Many in Germany want to help people in the war in a practical way. (...)""",乌克兰的发展部长雷姆·阿拉巴利·拉多万 (Rem Alabali Radovan) 在乌克兰参加了乌克兰-德国社区伙伴关系会议.,"乌克兰比以往任何时候都更需要我们的团结和支持. 德国对乌克兰的承诺不仅持续,而且在城市和社区之间也日益增加. 因为许多德国人几乎都希望帮助战争中的人. """
28,Maskendeals: Ungeschwärzter Sonderbericht zeigt neue Vorwürfe gegen Jens Spahn,Der geschwärzte Maskenbericht ließ viele Fragen offen. Eine komplette Version liefert nun Aufschluss: Offenbar sollte Ex-Bundesgesundheitsminister Spahn geschützt werden.,Maskendeals: Unswedish special report shows new allegations against Jens Spahn,The blackened mask report left many questions open. A complete version now provides information: Apparently ex-Federal Health Minister Spahn should be protected.,面具作案: 不明身份的特别报告显示 有关Jens Sphn的新指控,"口头上的面具报告透露了许多问题. 一个完整的版本现在揭示了事实: 显然,前国务卿斯宾应该受到保护."
29,Todesfall: Ehemaliger Politiker Christean Wagner ist tot,"<a href=""https://www.zeit.de/news/2025-07/05/ehemaliger-politiker-christean-wagner-ist-tot""><img src=""https://img.zeit.de/news/2025-07/05/ehemaliger-politiker-christean-wagner-ist-tot-image-group/wide__148x84"" style=""float: left; margin-right: 5px;"" /></a> None",Death: Former politician Christean Wagner is dead,"<a href=""https://www.zeit.de/news/2025-07/05/former-politician-christean-wagner-ist-tot""><img src=""https://img.zeit.de/news/2025-07/05/former-politician-christean-wagner-ist-tot-image-group/wide__148x84"" style=""float: left; margin-right: 5px;"" /></a> None",前任政客克里斯汀·瓦格纳死了,"< a href=""http://www.Time.en/news2025-07/05/ehmal-christean-wagner-name-tode""> <img shrc=""http://img.time.com/news 2025-07//05-exe-christen-wagner"
30,Europameisterschaft: Giulia Gwinn fällt nach Knieverletzung für Rest der Fußball-EM aus,Im Auftaktspiel gegen Polen verletzte sich Giulia Gwinn am Innenband. Nach einer Untersuchung steht fest: Die EM ist für die deutsche Kapitänin verletzungsbedingt vorbei.,European Championship: Giulia Gwinn falls out after knee injury for the rest of the European Football Championship,"In the opening match against Poland, Giulia Gwinn was injured by the inner band. After an investigation, it is clear that the European Championship is over for the German captain due to injury.",歐洲冠軍Gulia Gwinn因膝蓋傷而喪命,"在反对波兰的预演中,朱利亚·格温在内线中受伤. 经过一次调查后,我们发现,EEM对德国船长来说已经没有伤害了."
31,Erneut Brände an US-Westküste: Bislang größtes Feuer des Jahres brennt in Kalifornien,"<a href=""https://www.zeit.de/news/2025-07/05/bislang-groesstes-feuer-des-jahres-brennt-in-kalifornien""><img src=""https://img.zeit.de/news/2025-07/05/bislang-groesstes-feuer-des-jahres-brennt-in-kalifornien-image-group/wide__148x84"" style=""float: left; margin-right: 5px;"" /></a> None",Fires on US West Coast Again: Biggest Fire of the Year Burns in California,"<a href=""https://www.zeit.de/news/2025-07/05/so far-greatest-fire-of-the-year-burnt-in-california""><img src=""https://img.zeit.de/news/2025-07/05/so far-greatest-fire-of-the-year-burnt-in-california-image-group/wide_148x84"" style=""float: left; margin-right: 5px;"" /></a> None","美国西海岸重新燃烧,今年最严重的火灾发生在加利福尼亚州","<href=""http://www.时间.en/news 2025-07/05/billion-gream-gross fire in Californias""> <img shrc=""http://img. time.com/news 2025-07//05/bills-groses-in California-Group/wide_148x84"" style=""float: left: margin-right: 5px;"" //a>None"
32,"Saalfelder Höhe: ""Das ist Übermenschliches"" - Waldbrand fordert Helfer heraus","<a href=""https://www.zeit.de/news/2025-07/05/vierter-hubschrauber-auf-saalfelder-hoehe-erwartet""><img src=""https://img.zeit.de/news/2025-07/05/vierter-hubschrauber-auf-saalfelder-hoehe-erwartet-image-group/wide__148x84"" style=""float: left; margin-right: 5px;"" /></a> None","Saalfelder Höhe: ""This is superhuman"" - Waldbrand challenges helpers","<a href=""https://www.zeit.de/news/2025-07/05/fourth helicopter-to-saal-fields-hoehe-anticipated""><img src=""https://img.zeit.de/news/2025-07/05/fourth helicopter-to-saal-fields-hoehe-anticipated-image-group/wide__148x84"" style=""float: left; margin-right: 5px;"" /></a> None","场地高度: ""这是超人类""","< a href=""http://www.时间.en/news2025-07/05/fourter-hoehe-hoe-hoe""> <img shrc=""http://img.time.com/news 2025-07//05/five-free-hoheed-group/wide_148x84"" style=""float: left: margin-right: 5px;"" //a>None"
33,Matthias Helferich: AfD schließt Matthias Helferich aus der Partei aus,Selbst in der AfD halten ihn wegen seiner radikalen Haltung viele für nicht tragbar. Nun hat die Partei Matthias Helferich rausgeworfen. Doch das Ende ist das noch nicht.,Matthias Helferich: AfD excludes Matthias Helferich from the party,"Even in the AfD, many people consider him unbearable because of his radical attitude. Now the party has thrown out Matthias Helferich. But the end is not yet.",AfD排除了Matthias Helpmanich的党内助手,"即使在AFD方面,由于他激进的态度,许多人认为他是不可接受的. 现在,党从Matthias Helpmanich (Matthias Iich) 中解职了,但这还没有结束."
34,Notfälle: Polizeieinsatz in Oldenburger Innenstadt,"<a href=""https://www.zeit.de/news/2025-07/05/polizeieinsatz-in-oldenburger-innenstadt""><img src=""https://img.zeit.de/news/2025-07/05/polizeieinsatz-in-oldenburger-innenstadt-image-group/wide__148x84"" style=""float: left; margin-right: 5px;"" /></a> None",Emergency: Police operation in downtown Oldenburg,"<a href=""https://www.zeit.de/news/2025-07/05/police intervention-in-oldenburger-innenstadt""><img src=""https://img.zeit.de/news/2025-07/05/police intervention-in-oldenburger-innenstadt-image-group/wide__148x84"" style=""float: left; margin-right: 5px;"" /></a> None",紧急情况:欧登堡警局在市中心,<\ \ \ \ \ \ \ \ \ \ \ \ \ \ \ \ \ \ \ \ \ \ \ \ \ \ \ \ \ \ \ \ \ \ \ \ \ \ \ \ \ \ \ \ \ \ \ \ \ \ \ \ \ \ \ \ \ \ \ \ \ \ \ \ \ \ \ \ \ \ \ \ \ \ \ \ \ \ \ \ \ \ \ \ \ \ \ \ \ \ \ \ \ \ \ \ >
35,Unfall bei Blender: Tödliches Überholmanöver - 53-Jähriger stirbt,"<a href=""https://www.zeit.de/news/2025-07/05/toedliches-ueberholmanoever-53-jaehriger-stirbt""><img src=""https://img.zeit.de/news/2025-07/05/toedliches-ueberholmanoever-53-jaehriger-stirbt-image-group/wide__148x84"" style=""float: left; margin-right: 5px;"" /></a> None",Accident at Blender: Deadly Overtaking Maneuver - 53-year-old dies,"<a href=""https://www.zeit.de/news/2025-07/05/toedliches-ueberholmanoever-53-jaehriger-stirbt""><img src=""https://img.zeit.de/news/2025-07/05/toedliches-ueberholmanoever-53-jaehriger-stirbt-image-group/wide_148x84"" style=""float: left; margin-right: 5px;"" /></a> None",假冒者发生意外 致命超速 53岁死亡,<\ \ \ \ \ \ \ \ \ \ \ \ \ \ \ \ \ \ \ \ \ \ \ \ \ \ \ \ \ \ \ \ \ \ \ \ \ \ \ \ \ \ \ \ \ \ \ \ \ \ \ \ \ \ \ \ \ \ \ \ \ \ \ \ \ \ \ \ \ \ \ \ \ \ \ \ \ \ \ \ \ \ \ \ \ \ \ \ \ >
36,2. Fußball-Bundesliga: KSC gewinnt Testspiel gegen Aarau,"<a href=""https://www.zeit.de/news/2025-07/05/ksc-gewinnt-testspiel-gegen-aarau""><img src=""https://img.zeit.de/news/2025-07/05/ksc-gewinnt-testspiel-gegen-aarau-image-group/wide__148x84"" style=""float: left; margin-right: 5px;"" /></a> None",2. Bundesliga: KSC wins test game against Aarau,"<a href=""https://www.zeit.de/news/2025-07/05/ksc-wins-testgame-against-aarau""><img src=""https://img.zeit.de/news/2025-07/05/ksc-wins-testgame-against-aarau-image-group/wide_148x84"" style=""float: left; margin-right: 5px;"" /></a> None","第二州足球联盟,KSC赢了对Aarau的测试比赛.",<\ \ \ \ \ \ \ \ \ \ \ \ \ \ \ \ \ \ \ \ \ \ \ \ \ \ \ \ \ \ \ \ \ \ \ \ \ \ \ \ \ \ \ \ \ \ \ \ \ \ \ \ \ \ \ \ \ \ \ \ \ \ \ \ \ \ \ \ \ \ \ \ \ \ \ >
37,Demonstration: 200 Menschen protestieren gegen Abschiebehaft in Arnstadt,"<a href=""https://www.zeit.de/news/2025-07/05/200-menschen-protestieren-gegen-abschiebehaft-in-arnstadt""><img src=""https://img.zeit.de/news/2025-07/05/200-menschen-protestieren-gegen-abschiebehaft-in-arnstadt-image-group/wide__148x84"" style=""float: left; margin-right: 5px;"" /></a> None",Demonstration: 200 people protesting deportation in Arnstadt,"<a href=""https://www.zeit.de/news/2025-07/05/200-men-protest-against-deportation-in-arnstadt-image-group/wide_148x84"" style=""float: left; margin-right: 5px;"" /></a> None",示威者: 200人抗议在阿纳市的拘留犯,"< a href=""http://www.时间.en/news2025/70/00/00/Men-Sublication/in-Arn city""> <img shrc=""http://img.time.com/news 2025/70/70/00/00/人类抗议"" - - 在雅典城市中被剥夺的权利 - - 组合/wide_148x84"" style=""float: left""; margin-right: 5px; //a - none"
38,Christopher Street Day: Hunderte bei CSD-Umzug für Vielfalt - Dutzende bei Gegendemo,"<a href=""https://www.zeit.de/news/2025-07/05/hunderte-bei-csd-umzug-fuer-vielfalt-dutzende-bei-gegendemo""><img src=""https://img.zeit.de/news/2025-07/05/hunderte-bei-csd-umzug-fuer-vielfalt-dutzende-bei-gegendemo-image-group/wide__148x84"" style=""float: left; margin-right: 5px;"" /></a> None",Christopher Street Day: Hundreds of CSD parades for diversity - dozens of neighborhoods,"<a href=""https://www.zeit.de/news/2025-07/05/hundreds-by-csd-move-for-diversity-dutzende-bei-gegendemo""><img src=""https://img.zeit.de/news/2025-07/05/hundreds-by-csd-move-for-diversity-dutzende-bei-gegendemo-image-group/wide_148x84"" style=""float: left; margin-right: 5px;"" /></a> None",Christopher街日: 成百上千的CSD多元化迁徙 - 数十处地区在Rosemo地区,"<href=""http://www.时间.en/news 2025-07/0/000/csd-czipd-bier"
39,Paris: Pariser können offiziell wieder in der Seine baden,"Seit 1923 war das Baden in der Seine in Paris verboten. Nun ist das Wasser sauber genug, dass drei Freibäder eröffnet wurden. Die Wasserqualität wird überwacht.",Paris: Parisians can officially bathe in the Seine again,Since 1923 bathing in the Seine was prohibited in Paris. Now the water is clean enough that three outdoor pools were opened. The water quality is monitored.,巴黎可以正式回到塞纳河,"自1923年以来,巴黎塞纳河的洗澡是禁区. 现在水够净,三个免费浴池开业. 水质被监视着."
40,Deutsch-polnische Grenze: Polen bietet Deutschland beidseitigen Verzicht auf Grenzkontrollen an,"Polen ist bereit, von den ab Montag geplanten Grenzkontrollen abzusehen. Voraussetzung dafür ist: Auch Deutschland soll seine Kontrollen einstellen.",German-Polish border: Poland offers Germany to renounce border controls on both sides,Poland is prepared to refrain from the border controls planned from Monday. Prerequisite for this is that Germany should also stop its checks.,波兰和波兰边界:波兰向德国提供双边拒绝边境管制的条款,波兰已经准备好不进行周一的边境管制了 要求德国也停止对边界进行检查
41,Deutschland kontrolliert Tanker in der Ostsee,Aktuelle Informationen über die deutsche Außenpolitik und die internationalen Beziehungen Deutschlands.<br />,Germany controls tankers in the Baltic Sea,Current information on German foreign policy and international relations in Germany.<br />,德国控制东海的油罐车,关于德国外交政策和德国国际关系的最新信息.
42,Flasbarth: Klimadiplomatie intensivieren,"Umweltstaatssekretär Jochen Flasbarth wirbt auf einer Reise nach Brasilien, Südafrika und China für ein entschlossenes Vorgehen beim Klimaschutz.&nbsp;",Flasbarth: intensifying climate diplomacy,"Environment Secretary Jochen Flasbarth, on a trip to Brazil, South Africa and China, promotes a determined approach to climate protection.",Flasbarth: 加深气候外交,"环境秘书Jajan Flasbarth在前往巴西,南非和中国的路上 为气候变化采取果断行动. & nbsp;"
43,Neue EU-Behörde Amla bekämpft Geldwäsche,Bankenstadt Frankfurt am Main wird Europas Zentrum im Kampf gegen Geldwäsche&nbsp;,New EU agency Amla fights money laundering,Bank city Frankfurt am Main becomes Europe's centre in the fight against money laundering;,新成立的欧盟机构安米拉在打击洗钱活动,法兰克福的银行城将成为欧洲打击洗钱的中心
44,Wer trägt was? Berlin Fashion Week gestartet,Pünktlich zur Sommerhitze schaut die Fachwelt auf die Modetrends. Die Berlin Fashion Week hat gestern begonnen – mit teils ungewöhnlichen Themen.&nbsp;,Who wears what? Berlin Fashion Week started,"Just in time for the summer heat, the experts look at the fashion trends. Berlin Fashion Week started yesterday – with some unusual topics.",柏林时装周开始发射,"在夏季热季时,科学界正在关注时装潮流. 柏林时装周昨天开始讨论一些不寻常的主题. & nbsp;"
45,Alabali Radovan bei UN-Gipfel in Sevilla,Treffen soll Finanzierung armer Staaten nach Rückzug der USA neu ordnen&nbsp;,Alabali Radovan at UN summit in Seville,Meeting is to reorganise the financing of poor states after the withdrawal of the US;,阿拉巴利·拉多万在联合国塞维利亚峰会上,"美国撤退后,会议应重新安排贫穷国家的资金和资金."
46,Wadephul: Russland bedroht das Leben in Deutschland,"Nach erneuten schweren Angriffen auf die Ukraine warnt der deutsche Außenminister davor, die Bedrohung durch Russland zu unterschätzen.",Wadephul: Russia threatens life in Germany,"After repeated serious attacks on Ukraine, the German Foreign Minister warns against underestimating the threat from Russia.",韦德福:俄罗斯威胁到德国的生活,"德国外交部长再次对乌克兰发动了大规模袭击之后,他警告说,他不会低估俄罗斯的威胁."
47,Schneider: Konflikte überwinden,Zehn Tage Verhandlungen auf der UN-Klimakonferenz in Bonn brachten nur geringe Fortschritte. Umweltminister Schneider mahnt mehr Tempo an.,Schneider: Overcoming Conflicts,Ten days of negotiations at the UN Climate Change Conference in Bonn made little progress. Environment Minister Schneider urges more speed.,施耐德: 克服冲突,在波恩的联合国气候变化会议上10天的谈判进展甚微. 环境部长施耐德加速了.
48,Wadephul: Europa in guter Position gegenüber Iran,Laut Außenminister Johann Wadephul hat Europa bei einer möglichen Fortsetzung der Atomgespräche mit dem Iran „ein ganz gutes Blatt“.,Wadephul: Europe in a good position vis-à-vis Iran,"According to Foreign Minister Johann Wadephul, in a possible continuation of the nuclear talks with Iran, Europe has ""a very good leaf"".",韦德福:欧洲与伊朗关系良好,"国务卿约翰·韦德福说,如果欧洲继续与伊朗进行核谈判,欧洲将会非常成功."
49,Merz trifft EU-Staats- und Regierungschefs,"EU-Gipfel befasst sich vor allem mit Ukraine, Israel und der US-Zollpolitik",Merz meets EU Heads of State and Government,"EU summit focuses on Ukraine, Israel and US customs policy",默兹会见欧盟各国元首和政府首脑 Merz meets European State and Head of European.,"欧盟首脑会议主要关注乌克兰,以色列和美国的外交政策"
50,Körber-Preis für deutsche Pionierin des Quanteninternets,Stephanie Wehner erhält einen der weltweit höchstdotierten Forschungspreise.,Körber Prize for German Pioneer of Quantum Internet,Stephanie Wehner receives one of the world's most endowed research awards.,德国量子网先锋的篮球奖,Stephanie Renner得到世界最高研究奖之一
51,Polen will auf Kontrollen verzichten - wenn Deutschland vorlegt,"Polens Innenminister Siemoniak hat die Bereitschaft seines Landes signalisiert, auf die ab Montag geplanten Grenzkontrollen zu verzichten: Hierfür müsse Deutschland aber zuerst seine Kontrollen einstellen.",Poland wants to do without controls - if Germany submits,Poland's Interior Minister Siemoniak has signalled his country's willingness to renounce the border controls planned from Monday: Germany must first stop its controls for this purpose.,波兰想在德国提出要求时放弃控制权,"波兰内政部长西莫尼耶克表示他国家愿意放弃 周一开始的边境管制,但这要求德国先停止对德国的控制."
52,"Klausurtagung: AfD wirft Regierung ""Wortbruch"" vor","Migration, Stromsteuer, Wirtschaft: Die AfD-Fraktion setzt auf ihrer Klausurtagung politische Schwerpunkte für die kommenden Monate. Co-Chefin Weidel teilt gegen Kanzler Merz aus - und kritisiert ein mögliches Verbotsverfahren scharf.","Klausurtagung: AfD accuses government of ""wrong break""","Migration, electricity tax, economy: The AfD Group sets political priorities for the coming months at its conference of exams. Co-chief Weidel disbands Chancellor Merz - and strongly criticises a possible banning procedure.","AfD 指控政府""断言""","移民,电力税,经济:AfD变动在今后几个月的会议中将把政治重点放在政治上. 联合主席韦勒对默兹总理提出反对,并批评可能的禁令程序."
53,Einbürgerung in die USA: Was Neubürger dazu bewegt,Am Unabhängigkeitstag haben mehrere Neu-Amerikaner ihre Einbürgerungsurkunden bekommen. Wer lässt sich unter der Trump-Regierung einbürgern - und warum? Von W. Landmesser.,Naturalization in the USA: What motivates new citizens to do,"On Independence Day, several New Americans received their naturalisation certificates. Who can be naturalized under the Trump administration - and why? By W. Landmesser.",移民美国: 新公民会因此受到影响,"独立日那天,几位新美国公民拿到了入籍证书 特朗普政府下谁能成为公民?"
54,Deutlich weniger Asylanträge im ersten Halbjahr 2025,Vor allem aus Syrien kommen immer weniger Menschen: Die Zahl der Asylanträge in Deutschland ist im ersten Halbjahr offenbar stark zurückgegangen. Das liegt nicht nur an den neuen Grenzkontrollen.,Significantly fewer asylum applications in the first half of 2025,"More and more people are coming from Syria: the number of asylum applications in Germany seems to have fallen sharply in the first half of the year, not only because of the new border controls.",2025年上半年避难申请少得多,"叙利亚的庇护申请在上半年大幅减少,这不仅是因为新的边境管制"
55,Weitere oppositionelle Bürgermeister in der Türkei festgenommen,Die türkische Regierung erhöht den Druck auf die Oppositionspartei CHP weiter. Erneut wurden Bürgermeister der Partei festgenommen - insgesamt sind nun bereits 14 ins Visier der Justiz geraten. Die CHP spricht von politischer Motivation.,Other opposition mayors arrested in Turkey,The Turkish government continues to increase the pressure on the opposition party CHP. Mayors of the party were arrested again - a total of 14 have already been targeted by the judiciary. The CHP speaks of political motivation.,土耳其又多了一位投机市长被捕,土耳其政府继续增加对反对党党党的压力. 再次逮捕了该党的市长 - 总共14个已经受到司法制裁. CHP在谈论政治动机.
56,Nahost-Liveblog: ++ Gaza-Stiftung meldet Angriff auf Helfer ++,Die umstrittene Gaza Humanitarian Foundation beklagt an einem ihrer Verteilzentren einen Angriff auf Mitarbeiter. Bei Angriffen im Gazastreifen hat es palästinensischen Angaben zufolge erneut viele Tote gegeben.,Middle East live blog: ++ Gaza Foundation announces attack on helpers ++,"The controversial Gaza Humanitarian Foundation denounces an attack on its personnel at one of its distribution centers. According to Palestinian reports, there have been many deaths in attacks in the Gaza Strip.","中东参考博客:++加沙基金会报告,有人攻击救援者++","有争议的加沙人道主义基金会在他们的一个分支中心对工作人员进行攻击. 加沙地带的袭击事件中,巴勒斯坦又有人死亡."
57,Türkei: Waldbrände in Izmir unter Kontrolle - neue Feuer im Süden,Die Bilanz der Waldbrände im türkischen Izmir ist mit mehreren zerstörten Dörfern und Toten verheerend. Dort sind die Feuer inzwischen unter Kontrolle - doch an anderer Stelle im Land brennt es weiter. Auch Griechenland meldet neue Brände.,Turkey: Forest fires under control in Izmir - new fire in the south,"The record of the forest fires in Izmir, Turkey, is devastating with several destroyed villages and dead. There the fires are now under control - but elsewhere in the country it continues to burn. Greece also reports new fires.",土耳其: 伊兹米尔的森林大火正在控制之中 - 南部的新大火正在蔓延.,"土耳其伊兹米尔的森林大火记录是一场灾难,多座村庄和死人被摧毁了. 火势现在在控制之中 - - 但该国的另一片地区仍在燃烧. 希腊也报告了新的火灾."
58,Israel: Welche psychischen Folgen Irans Angriffe für Kinder haben,"Irans Angriffe wirken nach: Autistische Kinder haben es besonders schwer, mit den Erfahrungen fertig zu werden. Eine Einrichtung kümmert sich um die Kleinen. Aber nicht nur sie brauchen Hilfe. Von Bettina Meier.",Israel: The psychological consequences of Iran's attacks on children,Iran's attacks have an impact: Autistic children have a particularly hard time coping with the experiences. An institution takes care of the little ones. But not only do they need help. By Bettina Meier.,"以色列:伊朗对儿童的攻击,其心理后果如何?","伊朗的攻击结果是自闭症儿童很难应付这些经历. 一个机构照顾小儿麻痹症患者,但不仅仅是他们需要援助. 由贝蒂娜·梅耶提供."
59,Gohrischheide: Brandenburgische Feuerwehr weiter in Alarmbereitschaft,Die Brände in der Gohrischheide haben sich über Nacht nicht ausgebreitet. Die brandenburgischen Feuerwehrleute sind aber weiterhin in Alarmbereitschaft. Unterdessen ist der Rauch selbst südlich von Berlin zu riechen.,Gohrischheide: Brandenburg fire brigade on alert,"The fires in the Gohrischheide have not spread overnight, but the firefighters in Brandenburg continue to be on alert. Meanwhile, the smoke itself can be smelled south of Berlin.",阿尔及利亚高尔夫球场: Brandenburg消防队在戒备状态下继续进入戒备状态.,"防火墙在一夜之间没有蔓延,但勃兰登堡消防队仍处于戒备状态. 与此同时,柏林南部也有烟味."
60,Gohrischheide: Waldbrand in Sachsen weiter außer Kontrolle,Auf der sächsischen Seite der Gohrischheide kämpft die Feuerwehr weiter gegen den Waldbrand. Tonnenweise alte Munition im Boden und auch das Wetter erschweren die Löscharbeiten. Alle Entwicklungen im MDR-Liveticker.,Gohrischheide: Forest fire in Saxony further out of control,On the Saxon side of the Gohrischheide the fire brigade continues to fight against the forest fire. Tons of old ammunition in the ground and also the weather make extinguishing work difficult. All developments in the MDR live ticker.,沙克森的森林大火继续失控,"戈尔什尼亚的撒克逊地区,消防队继续与森林大火作斗争. 土壤内有大量旧弹药,天气也使灭火工作更加困难. MDR线上的所有事态发展都是如此."
61,Neues Ministerium unter Wildberger: Digitale Großbaustelle,"Weniger Bürokratie, bessere Verwaltung und Infrastruktur - das soll das neue Digitalministerium schaffen. Minister Wildberger ist Quereinsteiger. Was hat er vor? Von Birthe Sönnichsen und Kilian Pfeffer.",New Ministry under Wildberger: Digital large-scale construction site,"Less bureaucracy, better administration and infrastructure - this is to be done by the new Digital Ministry. Minister Wildberger is a cross-country entrant. What does he intend to do? By Birthe Sönnichsen and Kilian Pfeffer.",在Wildeberger手下的新部门 数字大工程办公室,"政府官僚,更好的管理和基础设施都应该由新的数字部负责. 怀德伯格部长是新政府官员,他打算做什么?"
62,"Verkehrsminister Schnieder will an 0,5-Promille-Grenze festhalten","Bundesverkehrsminister Schnieder hält die jetzige 0,5-Promille-Grenze für ausreichend. Kritischer blickt er dagegen auf Cannabis. Dessen Wirkung sei im Straßenverkehr ""relativ unberechenbar"".",Transport Minister Schnieder wants to maintain a 0.5-promille border,"Federal Minister of Transport Schnieder considers the present 0.5-promille limit to be sufficient. On the other hand, he looks more critically at cannabis. Its effect is ""relatively unpredictable"" in road traffic.",交通部长施密特想坚持0.5普罗米耶边界线,"联邦运输部长施耐德认为现在的0.5普罗米耶边界足够了. 更为紧急的是,他正在寻找大麻,这在街头交通中的影响是""不可预测的."""
