,title-en,content-en,title-de,content-de,title-es,content-es,title-fr,content-fr,title-zh,content-zh
39,Why a fling with a foreigner insults China’s “national dignity”,Outrage mounts over a tryst between a Chinese student and a Ukrainian gamer,Warum ein Fling mit einem Ausländer China beleidigt,Outrage überragt einen Versuch zwischen einem chinesischen Schüler und einem ukrainischen Spieler,¿Por qué una aventura con un extranjero insulta la “dignidad nacional” de China?,La indignación se cierne sobre una cita entre un estudiante chino y un jugador ucraniano,Pourquoi un flirt avec un étranger insulte la Chine,L'outrage monte sur un essai entre un étudiant chinois et un joueur ukrainien,为何与外国人私奔侮辱中国的“民族尊严”,一个中国学生和一个乌克兰游戏玩家之间的交汇
40,A savage squabble between China and Europe,Tensions are high ahead of a big summit next week,Ein wilder Streit zwischen China und Europa,Die Spannungen sind hoch vor einem großen Gipfel nächste Woche,Una salvaje disputa entre China y Europa,Las tensiones están muy por delante de una gran cumbre la próxima semana,Une querelle sauvage entre la Chine et l'Europe,Les tensions sont en avance sur un grand sommet la semaine prochaine,中国和欧洲之间的野蛮争吵,"下星期召开大型首脑会议前,"
41,America is coming after Chinese it accuses of hacking,Xu Zewei was arrested in Milan on July 3rd,Amerika wird nach Chinesen es wirft Hacking,Xu Zewei wurde am 3. Juli in Mailand verhaftet,Estados Unidos viene tras los chinos acusa de hackear,Xu Zewei fue arrestado en Milán el 3 de julio,L'Amérique vient après les Chinois elle accuse de piratage,Xu Zewei a été arrêté à Milan le 3 juillet,美国在追杀中国人 指责美国黑客入侵,七月三日在米兰被捕
42,China’s local governments are approaching a fiscal black hole,Can provincial DOGE-ing help them avoid it?,Chinas lokale Regierungen nähern sich einem fiskalischen Schwarzen Loch,"Kann die Provinz DOGE-ing ihnen helfen, es zu vermeiden?",Los gobiernos locales de China se están acercando a un agujero negro fiscal,¿Puede el DOGE-ing provincial ayudarlos a evitarlo?,Chine Les gouvernements locaux approchent d'un trou noir fiscal,Le DOGE provincial peut-il les aider à l'éviter?,中国地方政府正在接近财政黑洞,省DOGE -ing能帮助他们避免吗?
43,Why so many Chinese are drowning in debt,Some contemplate suicide. Others vaunt their folly as influencers,Warum so viele Chinesen in Schulden ertrinken,"Einige betrachten Selbstmord, andere preisen ihre Torheit als Influencer",¿Por qué tantos chinos se están ahogando en deudas?,"Algunos contemplan el suicidio, otros se burlan de su locura como influencers",Pourquoi tant de Chinois se noient dans la dette,Certains envisagent le suicide. D'autres se vantent de leur folie en tant qu'influents.,为什么这么多中国人 都欠了债,"有些人想自杀,有些人则以愚弄为影响者而炫耀自己的愚妄行为。"
44,"Leung Kwok-hung, Hong Kong’s shaggy agitator for democracy","His League of Social Democrats, the territory’s last pro-democracy party, disbanded this week","Leung Kwok-hung, Hongkongs zitternder Agitator für Demokratie","Seine Liga der Sozialdemokraten, die letzte pro-demokratische Partei des Territoriums, löste diese Woche auf","Leung Kwok-hung, agitador de Hong Kong por la democracia","Su Liga de Socialdemócratas, el último partido prodemocrático del territorio, se disolvió esta semana","Leung Kwok-hung, Hong Kong shggy agitateur pour la démocratie","Sa Ligue des sociaux-démocrates, le dernier parti pro-démocratie du territoire, s'est dissoute cette semaine",香港民主狂热煽动者梁国洪,"领土最后一个支持民主的政党,即其社会民主党联盟,于本周解散。"
45,Beware tomes of Chinese political gossip!,Our new number-crunching on reading banned books,Hüten Sie sich vor chinesischem politischen Klatsch!,Unsere neue Nummer-Crunching beim Lesen verbotener Bücher,¡Cuidado con los chismes políticos chinos!,Nuestro nuevo número-cruzamiento en la lectura de libros prohibidos,Méfiez-vous des commérages politiques chinois !,Notre nouveau numéro-croûtement sur la lecture des livres interdits,当心中国政治流言!,我们在阅读被禁止的书籍方面的新人数
46,Hong Kong’s last functioning pro-democracy party disbands,A long campaign against dissent crushes a final few democrats,Hongkongs letzte funktionierende pro-demokratische Partei löst sich auf,Eine lange Kampagne gegen Dissent zermalmt einige letzte Demokraten,El último partido pro-democracia de Hong Kong se disuelve,Una larga campaña contra la disidencia aplasta a unos pocos demócratas finales,Le dernier parti pro-démocratie opérationnel de Hong Kong se dissout,Une longue campagne contre la dissidence écrase quelques derniers démocrates,香港最后一个正在运作的支持民主的政党解散,反对持不同政见者的长期运动压倒了最后的少数民主份子。
47,Why Superman is the least relevant superhero,And why that is his greatest strength,Warum Superman der am wenigsten relevante Superheld ist,Und warum das seine größte Stärke ist,Por qué Superman es el superhéroe menos relevante,Y por qué esa es su mayor fuerza,Pourquoi Superman est le super-héros le moins pertinent,Et pourquoi c'est sa plus grande force,为什么超人最无关紧要超级超级英雄,为什么这就是他最大的力量
48,Quantifying Trumpcare,"Researchers estimate the Big Beautiful Bill could result in 42,500 excess deaths a year",Quantifizierung von Trumpcare,"Forscher schätzen, dass der große schöne Gesetzentwurf zu 42.500 Todesfällen pro Jahr führen könnte",Cuantificando Trumpcare,Los investigadores estiman que el proyecto de ley podría resultar en 42.500 muertes al año.,Quantification Trumpcare,Les chercheurs estiment que le Big Beautiful Bill pourrait entraîner 42 500 décès excédentaires par an.,量化特朗普护理,"研究人员估计 大美人法案每年可能会导致42,500多人死亡"
49,The meaning of Trumpcare,Republicans bring the biggest changes to health care in 15 years,Die Bedeutung von Trumpcare,Republikaner bringen die größten Veränderungen in der Gesundheitsversorgung in 15 Jahren,El significado de Trumpcare,Los republicanos traen los mayores cambios a la atención de la salud en 15 años,La signification de Trumpcare,Les républicains apportent les plus grands changements aux soins de santé en 15 ans,Trumpcare 的意义,共和党在15年内对医疗保健带来最大的变化
50,"Americans are catching on to the joys of British food. Yes, really","Television, TikTok and travel are to blame","Amerikaner fangen an, die Freuden des britischen Essens. Ja, wirklich","Fernsehen, TikTok und Reisen sind schuld",Los estadounidenses están captando las alegrías de la comida británica.,"La televisión, TikTok y los viajes son los culpables.",Les Américains s'accrochent aux joies de la nourriture britannique.,"La télévision, TikTok et les voyages sont à blâmer",美国人正在捕捉英国食物的欢乐,电视、TikTok电视、旅行和旅行都怪罪
51,What if America’s red states are about to lose their cheap-housing advantage?,People move to the sunbelt for affordable homes. But it is getting harder to build there,"Was ist, wenn Amerikas rote Staaten ihren billigen Wohnvorteil verlieren werden?","Menschen bewegen sich in den Sonnengürtel für erschwingliche Häuser. Aber es wird schwieriger, dort zu bauen",¿Qué pasa si los estados rojos de Estados Unidos están a punto de perder su ventaja de vivienda barata?,"La gente se muda al cinturón de sol para conseguir casas asequibles, pero es cada vez más difícil construir allí.",Et si les états rouges américains sont sur le point de perdre leur avantage de logement bon marché ?,Les gens se déplacent vers la ceinture de soleil pour des maisons abordables. Mais il devient plus difficile de construire là-bas.,如果美国的红州将失去廉价住房优势呢?,"人们搬去遮阳带寻找负担得起的住房,但在那里建造越来越困难。"
52,The Economist is hiring journalists to work in Washington,We’re looking for writers to cover politics and public policy,"Der Economist stellt Journalisten ein, um in Washington zu arbeiten.",Wir sind auf der Suche nach Schriftstellern für Politik und öffentliche Politik,The Economist está contratando periodistas para trabajar en Washington,Estamos buscando escritores para cubrir la política y las políticas públicas,L'économiste recrute des journalistes pour travailler à Washington,Nous recherchons des écrivains pour couvrir la politique et les politiques publiques,《经济学家》正在华盛顿聘请记者工作,我们正在寻找作者来报道政治和公共政策
53,Wyoming gets a MAGA makeover,The nationalisation of politics finally comes for America’s least-populous state,Wyoming bekommt eine Maga Verjüngungskur,Die Verstaatlichung der Politik kommt schließlich für Amerikas am wenigsten bevölkerungsreichen Staat,Wyoming obtiene un cambio de imagen de MAGA,La nacionalización de la política finalmente viene para el estado menos poblado de Estados Unidos,Wyoming obtient un relooking MAGA,La nationalisation de la politique vient enfin pour l'Etat le moins peuplé de l'Amérique,怀俄明得到一个MAGA的改造,美国最不受欢迎的国家终于实现了政治的国有化。
54,Karoline Leavitt stops by ‘Ruthless’ to tout Trump’s 'incredible' six months of second term,"White House press secretary Karoline Leavitt touted President Trump&apos;s achievements in his first six months, claiming he delivered on promises of defeating inflation and securing the border.","Karoline Leavitt hält mit „Ruthless"" an, um Trumps „unüberbrückbare"" sechs Monate zweite Amtszeit anzustoßen","Die Pressesekretärin des Weißen Hauses Karoline Leavitt zitierte Präsident Trump&apos;s Erfolge in seinen ersten sechs Monaten, indem sie behauptete, er habe Versprechen gegeben, die Inflation zu besiegen und die Grenze zu sichern.",Karoline Leavitt pasa por ‘Ruthless’ para anunciar el ‘increíble’ segundo mandato de Trump,"La secretaria de prensa de la Casa Blanca, Karoline Leavitt, adelantó los logros del presidente Trump&apos en sus primeros seis meses, afirmando que cumplió con las promesas de derrotar la inflación y asegurar la frontera.",Karoline Leavitt s'arrête par ‘Ruthless' pour tout Trump's 'incroyable' six mois de deuxième mandat,"La secrétaire de presse de la Maison Blanche, Karoline Leavitt, a vanté le président Trump&apos; ses réalisations au cours de ses six premiers mois, affirmant qu'il a tenu les promesses de vaincre l'inflation et de sécuriser la frontière.","Karoline Leavitt在第二学期的六个月内,","白宫新闻秘书Karoline Leavitt 假称总统Trump&apos; 头六个月的成就,"
55,"Disputed fire by ancient church in Holy Land sparks diplomatic, religious fallout","Israeli police dismiss reports of Jewish settlers burning the Church of St. George in Taybeh, finding no damage to the holy site and only a small fire nearby.","Disputiertes Feuer der alten Kirche im Heiligen Land funkt diplomatischen, religiösen Fallout","Die israelische Polizei entlässt Berichte von jüdischen Siedlern, die die Kirche von St. George in Taybeh verbrennen, ohne Schaden an der heiligen Stätte und nur ein kleines Feuer in der Nähe zu finden.","Fuego disputado por la antigua iglesia en Tierra Santa chispas diplomáticas, secuelas religiosas","La policía israelí rechaza los informes de colonos judíos que queman la iglesia de San Jorge en Taybeh, no encontrando daños en el lugar sagrado y sólo un pequeño incendio cerca.",Le feu contesté par l'ancienne église en Terre Sainte déclenche des retombées diplomatiques et religieuses,"La police israélienne rejette les informations selon lesquelles des colons juifs auraient incendié l'église Saint-Georges à Taybeh, ne trouvant aucun dommage au lieu saint et seulement un petit incendie à proximité.",圣地古老教会的交火点燃了外交和宗教后果,"以色列警察驳回关于犹太定居者焚烧Taybeh的圣乔治教堂的报告,发现圣地没有受到破坏,附近只有一场小火。"
56,"Texas couple finds royal tomb, plus best gas stations for food","The Fox News Lifestyle Newsletter brings you trending stories on family, travel, food, neighbors helping neighbors, pets, autos, military veterans, heroes, faith and American values.","Texas Paar findet königliches Grab, plus beste Tankstellen für Lebensmittel","The Fox News Lifestyle Newsletter bringt Sie Trendgeschichten über Familie, Reisen, Essen, Nachbarn helfen Nachbarn, Haustiere, Autos, Militärveteranen, Helden, Glauben und amerikanische Werte.","La pareja de Texas encuentra la tumba real, además de las mejores gasolineras para comida","The Fox News Lifestyle Newsletter te trae historias de moda sobre familia, viajes, comida, vecinos ayudando a vecinos, mascotas, autos, veteranos militares, héroes, fe y valores estadounidenses.","Texas couple trouve tombe royale, plus les meilleures stations d'essence pour la nourriture","Le Fox News Lifestyle Newsletter vous propose des histoires tendance sur la famille, les voyages, la nourriture, les voisins aidant les voisins, les animaux de compagnie, les automobiles, les anciens combattants, les héros, la foi et les valeurs américaines.",德克萨斯夫妇找到皇家坟墓 加上最好的食品加油站,福克斯新闻《生活方式通讯》带来关于家庭、旅行、食物、邻居帮助邻居、宠物、汽车、退伍军人、英雄、信仰和美国价值观的流行故事。
57,Cuomo tones down Trump rhetoric after stunning loss to Mamdani in NYC mayor primary,"After his defeat at the hands of Zohran Mamdani in the Democratic Party mayoral primary in New York City, former Gov. Andrew Cuomo reset his campaign: less Trump and more affordability.",Cuomo Töne nach unten Trump Rhetorik nach atemberaubendem Verlust an Mamdani in NYC Bürgermeister primär,"Nach seiner Niederlage in den Händen von Zohran Mamdani in der Demokratischen Partei bürgermeisterlichen Grundschule in New York City, ehemaliger Gov. Andrew Cuomo seine Kampagne zurückgesetzt: weniger Trump und mehr Erschwinglichkeit.",Cuomo baja la retórica de Trump después de la impresionante pérdida de Mamdani en la primaria del alcalde de Nueva York,"Después de su derrota a manos de Zohran Mamdani en la alcaldía primaria del Partido Demócrata en la ciudad de Nueva York, el ex gobernador Andrew Cuomo reajustó su campaña: menos Trump y más asequibilidad.",Cuomo tonifie la rhétorique Trump après une perte étonnante à Mamdani dans le maire de New York primaire,"Après sa défaite aux mains de Zohran Mamdani dans la primaire du maire du Parti démocratique à New York, l'ancien gouvernement Andrew Cuomo réinitialise sa campagne : moins de Trump et plus d'abord.","在纽约市初等市长Mamdani失去巨大损失后, Cuomo Tonnes 压倒Trump的言论","前政府Andrew Cuomo重写他的竞选:减少特朗普(Trump),"
58,Anti-ICE attackers revealed to have extensive history of radical protest activities,"Some of the alleged anti-ICE attackers in Texas had a background of protest arrests, including during the Occupy Wall Street movement and at Texas A&amp;M University.","Anti-ICE-Angriffe enthüllt, um umfangreiche Geschichte der radikalen Protest-Aktivitäten haben","Einige der angeblichen ICE-Angreifer in Texas hatten einen Hintergrund von Protestverhaftungen, einschließlich während der Occupy Wall Street Bewegung und an der Texas A&amp;M University.",Atacantes anti-ICE revelaron tener una extensa historia de actividades de protesta radical,"Algunos de los presuntos atacantes anti-ICE en Texas tuvieron antecedentes de arrestos de protesta, incluyendo durante el movimiento Ocupar Wall Street y en Texas A&amp;M University.",Les agresseurs anti-ICE ont révélé avoir une longue histoire d'activités de protestation radicales,"Certains des agresseurs présumés anti-ICE au Texas ont eu des antécédents d'arrestations de protestation, y compris pendant le mouvement Occupy Wall Street et à Texas A&amp;M University.","反ICE袭击者透露,他们有广泛的激进抗议活动历史","在得克萨斯州,一些据称是反天主教儿童会的袭击者有抗议逮捕的背景,包括在占领华尔街运动和得克萨斯A&amp;M大学期间。"
59,Teen murder suspect led police on 'wild goose chase' after paddleboarder's death in coastal town: report,"Maine authorities charged a teenage camper in the strangulation death of Sunshine Stewart, whose body was found on a remote island in Crawford Pond.","Teen Mordverdächtige führte Polizei auf ""wilde Gänsejagd"" nach Paddelboarder's Tod in Küstenstadt: Bericht","Die Behörden von Maine beschuldigten einen jugendlichen Camper beim Erwürgen des Todes von Sunshine Stewart, dessen Leiche auf einer abgelegenen Insel im Crawford Pond gefunden wurde.","Sospechoso de asesinato de adolescentes lideró a la policía en ""persecución inútil"" después de la muerte del paddleboarder en la ciudad costera: informe","Las autoridades de Maine acusaron a un campista adolescente de estrangular a Sunshine Stewart, cuyo cuerpo fue encontrado en una isla remota en Crawford Pond.",Le suspect de meurtre d'adolescents a mené la police à la « chasse sauvage à l'oie » après la mort du paddleboarder dans la ville côtière: rapport,"Les autorités du Maine ont accusé un campeur adolescent d'avoir étranglé la mort de Sunshine Stewart, dont le corps a été retrouvé sur une île éloignée de Crawford Pond.","警方在海边镇捕食板人死后, 导致警方“无所事事地追逐 ” :","缅因州当局指控一名十几岁的露营者在Sunshine Stewart被勒死的事件中死亡,他的尸体是在克劳福德池塘的一个偏远岛上被发现的。"
60,Ellen DeGeneres 'would love' to host another talk show years after toxic workplace allegations,"Ellen DeGeneres is not ruling out the possibility of hosting another talk show, but doubts whether the format would work in today&apos;s world.","Ellen DeGeneres würde es lieben, eine weitere Talkshow Jahre nach toxischen Anschuldigungen am Arbeitsplatz zu beherbergen.","Ellen DeGeneres schließt die Möglichkeit nicht aus, eine weitere Talkshow zu veranstalten, sondern bezweifelt, ob das Format heute in der Welt von Apos funktionieren würde.",Ellen DeGeneres 'le encantaría' presentar otro programa de entrevistas años después de acusaciones tóxicas en el lugar de trabajo,"Ellen DeGeneres no está descartando la posibilidad de acoger otro programa de entrevistas, pero duda de si el formato funcionaría en el mundo de hoy en día.",Ellen DeGeneres « aimerait » accueillir un autre talk-show des années après des allégations de toxicité sur le lieu de travail,"Ellen DeGeneres n'exclut pas la possibilité d'organiser un autre talk-show, mais doute que le format fonctionne dans le monde d'aujourd'hui.",Ellen DeGeneres 热衷于在工作场所有毒指控多年后再主办一场脱口秀。,"Ellen DeGeneres并没有排除主办另一场脱口秀的可能性,"
61,Salvadoran president responds to Hunter Biden's invasion threat: What is he 'sniffing'?,"Hunter Biden threatens to invade El Salvador, prompting President Bukele to mock the statement while highlighting ongoing prisoner swap cooperation with the U.S.",Salvadorianischer Präsident reagiert auf Hunter Bidens Invasionsdrohung: Was schnüffelt er?,"Hunter Biden droht El Salvador einzumarschieren, was Präsident Bukele dazu veranlasst, die Erklärung zu verspotten und gleichzeitig die laufende Zusammenarbeit zwischen Gefangenen und den USA hervorhebt.",El presidente salvadoreño responde a la amenaza de invasión de Hunter Biden: ¿Qué es lo que 'sniffing'?,"Hunter Biden amenaza con invadir El Salvador, incitando al presidente Bukele a burlarse de la declaración mientras destaca la cooperación en curso del intercambio de prisioneros con Estados Unidos.",Le président salvadorien répond à la menace d'invasion de Hunter Biden : Qu'est-ce qu'il renifle ?,"Hunter Biden menace d'envahir El Salvador, ce qui incite le président Bukele à se moquer de cette déclaration tout en soulignant la coopération en cours entre les prisonniers et les États - Unis.",萨尔瓦多总统回应Hunter Biden的入侵威胁:,"Hunter Biden威胁要入侵萨尔瓦多,"
62,"Hunter Biden 'in a rage,' Trump's border miracle, and more from Fox News Opinion","Read the latest from Fox News Opinion &amp; watch videos from Sean Hannity, Raymond Arroyo &amp; more.","Hunter Biden 'in Wut', Trumps Grenzwunder und mehr aus Fox News Opinion","Lesen Sie die neuesten von Fox News Opinion &amp; Videos von Sean Hannity, Raymond Arroyo &amp; mehr.","Hunter Biden 'en una furia', el milagro fronterizo de Trump, y más de la opinión de Fox News","Lea lo último de Fox News Opinion &amp; ver vídeos de Sean Hannity, Raymond Arroyo &amp; más.","Hunter Biden 'dans une rage,' miracle de la frontière de Trump, et plus encore de Fox News Opinion","Lisez les dernières nouvelles de Fox News Opinion &amp; regardez des vidéos de Sean Hannity, Raymond Arroyo &amp; plus.","Trump的边境奇迹, 以及更多来自Fox News Review",阅读Fox News Views & amp; 从肖恩·汉尼蒂、雷蒙德·阿罗约(Raymond Arroyo) & amp; 更多观察视频的最新消息。
63,Democrat NY DA candidate under fire for inviting criminals to apply for high-paying campaign job,Nassau County DA candidate Nicole Aloise faces criticism after her campaign posted a job ad encouraging people with criminal records to apply for a communications director position.,Democratic NY DA Anwärter unter Beschuss für die Einladung von Kriminellen für hoch bezahlte Kampagne Job beantragen,"Nassau County DA-Kandidate Nicole Aloise steht vor Kritik, nachdem ihre Kampagne eine Stellenanzeige veröffentlicht hat, die Menschen mit Strafregistern ermutigt, sich für eine Position als Kommunikationsdirektorin zu bewerben.",Demócrata NY DA candidato bajo fuego por invitar a los criminales a solicitar un trabajo de campaña de alto pago,"La candidata al fiscal del condado de Nassau, Nicole Aloise, se enfrenta a críticas después de que su campaña publicara un anuncio de trabajo que animaba a personas con antecedentes penales a solicitar un puesto de directora de comunicaciones.",Le candidat de la D.A. démocrate de NY sous le feu pour avoir invité des criminels à postuler pour un poste de campagne à haut salaire,La candidate au poste de procureur du comté de Nassau Nicole Aloise fait l'objet de critiques après la publication d'une annonce d'emploi encourageant les personnes ayant un casier judiciaire à postuler à un poste de directeur des communications.,"邀请罪犯申请高薪竞选工作,","Nassau县DA候选人Nicole Aloise在竞选期间张贴一份工作广告, 鼓励有犯罪记录的人申请通信主任职位,"
64,EU defense chief warns of 'most dangerous moment' – coordinated Russian-Chinese aggression by 2027,NATO prepares for potential threats as EU defense chief highlights 2027 as a critical year when Russia and China could launch simultaneous military actions.,"EU-Verteidigungschef warnt vor ""gefährlichsten Momenten"" – koordinierte russisch-chinesische Aggression bis 2027","Die NATO bereitet sich auf potenzielle Bedrohungen vor, da der EU-Verteidigungschef 2027 als kritisches Jahr hervorhebt, in dem Russland und China gleichzeitig militärische Aktionen einleiten könnten.","Jefe de Defensa de la UE advierte de ""momento más peligroso"" – agresión coordinada ruso-china para 2027","La OTAN se prepara para amenazas potenciales, ya que el jefe de defensa de la UE destaca 2027 como un año crítico en el que Rusia y China podrían lanzar acciones militares simultáneas.",Le chef de la défense de l'UE met en garde contre le « moment le plus dangereux » – agression russo-chinoise coordonnée d'ici 2027,"L'OTAN se prépare aux menaces potentielles, comme le souligne le chef de la défense de l'UE en 2027, année critique où la Russie et la Chine pourraient lancer simultanément des actions militaires.",欧盟国防部长警告“最危险的时刻” — — 2027年俄罗斯-中国协调侵略,"北约准备应对潜在威胁, 欧盟国防首长强调2027年是俄罗斯和中国可以同时发起军事行动的关键一年。"
