,title-de,content-de,title-en,content-en,title-zh,content-zh
26,Entwicklungsministerin Alabali Radovan verleiht BMZ-Engagementpreis für herausragenden persönlichen Einsatz,"Entwicklungsministerin Reem Alabali Radovan verleiht heute im Berliner Dienstsitz des Entwicklungsministeriums (BMZ) den 7. BMZ-Engagementpreis. Mit ihm wird herausragendes persönliches Engagement in der Entwicklungszusammenarbeit gewürdigt. Ausgezeichnet werden fünf Persönlichkeiten, die in besonderer Weise an der Umsetzung der 17 globalen UN-Nachhaltigkeitsziele mitwirken.",Minister of Development Alabali Radovan awards BMZ Commitment Prize for Outstanding Personal Use,Development Minister Reem Alabali Radovan today awards the 7th BMZ Commitment Prize at the Berlin Office of the Ministry of Development (BMZ). He is acknowledging his outstanding personal commitment to development cooperation. Five personalities who are particularly involved in the implementation of the 17 global UN sustainability goals are honoured.,发展部长阿拉巴利·拉多万 颁发优良个人成就奖,发展部长莱姆·阿拉巴利·拉多万 今天在发展部柏林的总部颁发了7个BMZ合同奖. 他将获得杰出的个人参与发展合作奖. 五位特别参与实现17个联合国全球支持目标的人物将非常出色.
27,Brüssel: EU-Kommission schlägt zwei Billionen Euro Etat für sieben Jahre vor,"Ab 2028 beginnt die neue Budgetperiode in der EU, dazu braucht es einen Haushalt. Die EU-Kommission will diesen für mehr Investitionen deutlich höher ansetzen als bisher.",Brussels: Commission proposes two trillion euro budget for seven years,"The new budget period in the EU will start in 2028, which will require a budget. The EU Commission wants to set it up significantly higher for more investment than it has done so far.","布鲁塞尔:欧盟委员会提出2万亿欧元的预算,为期7年.","从2028年起,欧盟新预算预算将从欧盟开始,需要预算. 欧盟委员会希望它比以往任何时候都高得多."
28,Verkehr: Wasserrohrbruch in Nürnberg - Fahrbahn beschädigt,"<a href=""https://www.zeit.de/news/2025-07/16/wasserrohrbruch-in-nuernberg-fahrbahn-beschaedigt""><img src=""https://img.zeit.de/news/2025-07/16/wasserrohrbruch-in-nuernberg-fahrbahn-beschaedigt-image-group/wide__148x84"" style=""float: left; margin-right: 5px;"" /></a> None",Transport: Water pipe breakage in Nuremberg - roadway damaged,"<a href=""https://www.zeit.de/news/2025-07/16/wasserrohr-in-nuernberg-fahrbahn-schädigt""><img src=""https://img.zeit.de/news/2025-07/16/wasserrohrbruhr-in-nuernberg-fahrbahn-schädigt-image-group/wide__148x84"" style=""float: left; margin-right: 5px;"" /></a> None",交通堵塞 纽伦堡交通堵塞,<\ \ \ \ \ \ \ \ \ \ \ \ \ \ \ \ \ \ \ \ \ \ \ \ \ \ \ \ \ \ \ \ \ \ \ \ \ \ \ \ \ \ \ \ \ \ \ \ \ \ \ \ \ \ \ \ \ \ \ \ \ \ \ \ \ \ \ \ \ \ \ \ \ \ \ \ \ \ \ \ \ \ \ \ \ \ \ \ \ \ \ \ \ \ \ \ \ \ \ \ \ \ \ >
29,Freilaufendes Tier: Hund attackiert Fünfjährige,"<a href=""https://www.zeit.de/news/2025-07/16/hund-attackiert-fuenfjaehrige""><img src=""https://img.zeit.de/news/2025-07/16/hund-attackiert-fuenfjaehrige-image-group/wide__148x84"" style=""float: left; margin-right: 5px;"" /></a> None",Free-running animal: dog attacks five-year-old,"<a href=""https://www.zeit.de/news/2025-07/16/dog-attacked-fuenfjaehrige""><img src=""https://img.zeit.de/news/2025-07/16/dog-attacked-fuenfjaehrige-image-group/wide__148x84"" style=""float: left; margin-right: 5px;"" /></a> None",野生动物: 狗攻击五岁男孩.,<\ \ \ \ \ \ \ \ \ \ \ \ \ \ \ \ \ \ \ \ \ \ \ \ \ \ \ \ \ \ \ \ \ \ \ \ \ \ \ \ \ \ \ \ \ \ \ \ \ \ \ \ \ \ \ \ \ \ \ \ \ \ \ \ \ \ \ \ \ \ \ \ \ \ \ \ \ \ \ \ \ \ \ \ \ \ \ \ \ \ \ \ \ \ \ \ >
30,Gemeinschaftshaushalt: Von der Leyen schlägt EU-Budget von zwei Billionen Euro vor,"<a href=""https://www.zeit.de/news/2025-07/16/von-der-leyen-schlaegt-eu-budget-von-zwei-billionen-euro-vor""><img src=""https://img.zeit.de/news/2025-07/16/von-der-leyen-schlaegt-eu-budget-von-zwei-billionen-euro-vor-image-group/wide__148x84"" style=""float: left; margin-right: 5px;"" /></a> None",Community budget: EU budget of two trillion euros proposed by Leyen,"<a href=""https://www.zeit.de/news/2025-07/16/of-the-leyen-schlaegt-eu-budget-of-two-billion-euro-before""><img src=""https://img.de/news/2025-07/16/of-the-leyen-schlaegt-eu-budget-of-two-billion-euro-pre-image-group/wide_148x84"" style=""float: left; margin-right: 5px;"" /></a> None","共同预算:从莱昂人那里,欧盟预算建议用2万亿欧元来支付2万亿欧元.","<href=""http://www.Time.en/news 2025-07/16/ from ley-schlang-eu-eu-euro-eu-euro-euro-four""> <imgSrc=http://img.time.com/news 2025-07/16/ from the Line-Shue-Shue-Eu-Eu-Eu-Froup/wide_1448x84"" style=""float: left: margin-right: 5px;"" //a"
31,Cyberangriffe: Maßnahmen gegen Hacker-Gruppe - Server abgeschaltet,"<a href=""https://www.zeit.de/news/2025-07/16/massnahmen-gegen-hacker-gruppe-server-abgeschaltet""><img src=""https://img.zeit.de/news/2025-07/16/massnahmen-gegen-hacker-gruppe-server-abgeschaltet-image-group/wide__148x84"" style=""float: left; margin-right: 5px;"" /></a> None",Cyberattacks: Measures against Hacker Group - Servers disabled,"<a href=""https://www.zeit.de/news/2025-07/16/measures-against-hacker-group-server-off""><img src=""https://img.zeit.de/news/2025-07/16/measures-against-hacker-group-server-off-image-group/wide_148x84"" style=""float: left; margin-right: 5px;"" /></a> None",网络攻击:针对黑客集团的行动 - 服务器关闭,"<href=""http://www.时间.en/news2025-07/16/machine-shacker-server/server.""> <img shrc=""http://img.time.com/news 2025-07/16/mathler-hacker-server-program/wide_148x84"" style=""float: left: margin-right: 5px;"" // a -None"
32,Naturspektakel: Erneuter Vulkanausbruch auf Island,"<a href=""https://www.zeit.de/news/2025-07/16/erneuter-vulkanausbruch-auf-island""><img src=""https://img.zeit.de/news/2025-07/16/erneuter-vulkanausbruch-auf-island-image-group/wide__148x84"" style=""float: left; margin-right: 5px;"" /></a> None",Nature spectacle: Renewed volcanic eruption on Iceland,"<a href=""https://www.zeit.de/news/2025-07/16/new-volcanic outbreak-on-island""><img src=""https://img.zeit.de/news/2025-07/16/new-volcanic outbreak-on-island-image-group/wide_148x84"" style=""float: left; margin-right: 5px;"" /></a> None",自然角度: 冰岛火山再度爆发,"< a href=""http://www.时间.en/news2025-07/16/new-vulcan break -aisland""> <imgränter-volk -likes=""http://img. time.com/news2025-07/renew-volk-volk-like-like-guid"
33,Cyberangriffe: Prorussische Hacker-Gruppe - Server abgeschaltet,"<a href=""https://www.zeit.de/news/2025-07/16/prorussische-hacker-gruppe-server-abgeschaltet""><img src=""https://img.zeit.de/news/2025-07/16/prorussische-hacker-gruppe-server-abgeschaltet-image-group/wide__148x84"" style=""float: left; margin-right: 5px;"" /></a> None",Cyberattacks: Pro-Russian Hacker Group - Server disabled,"<a href=""https://www.zeit.de/news/2025-07/16/prorussian-hacker-group-server-off""><img src=""https://img.zeit.de/news/2025-07/16/prorussian-hacker-group-server-off-image-group/wide_148x84"" style=""float: left; margin-right: 5px;"" /></a> None",网络攻击: 普罗俄黑客集团 - 服务器关闭,<\ \ \ \ \ \ \ \ \ \ \ \ \ \ \ \ \ \ \ \ \ \ \ \ \ \ \ \ \ \ \ \ \ \ \ \ \ \ \ \ \ \ \ \ \ \ \ \ \ \ \ \ \ \ \ \ \ \ \ \ \ \ \ \ \ \ \ \ \ \ \ \ \ \ \ \ \ \ \ \ \ \ \ \ \ \ \ \ \ \ \ \ \ \ \ \ >
34,Unfall: Franke stirbt bei Bergtour am Arlberg,"<a href=""https://www.zeit.de/news/2025-07/16/franke-stirbt-bei-bergtour-am-arlberg""><img src=""https://img.zeit.de/news/2025-07/16/franke-stirbt-bei-bergtour-am-arlberg-image-group/wide__148x84"" style=""float: left; margin-right: 5px;"" /></a> None",Accident: Franke dies at Bergtour am Arlberg,"<a href=""https://www.zeit.de/news/2025-07/16/franke-stirbt-bei-bergtour-am-arlberg-image-group/wide__148x84"" style=""float: left; margin-right: 5px;"" /></a> None",法兰克死于阿尔伯格山的登山之旅,"< a href=""http://www.Time.en/news2025-07/16/frank-burg-srank-src-src=""http://img.time.com/news 2025-07/frik-flank-burg-stourge-speed-machine-mass/wide_148x84"" style=""float: left: margin-right: 5px;"" //a>None"
35,Konjunktur: Bundesbank: US-Zölle bedrohen schwache deutsche Wirtschaft,"<a href=""https://www.zeit.de/news/2025-07/16/bundesbank-us-zoelle-bedrohen-schwache-deutsche-wirtschaft""><img src=""https://img.zeit.de/news/2025-07/16/bundesbank-us-zoelle-bedrohen-schwache-deutsche-wirtschaft-image-group/wide__148x84"" style=""float: left; margin-right: 5px;"" /></a> None",Business cycle: Bundesbank: US tariffs threaten weak German economy,"<a href=""https://www.zeit.de/news/2025-07/16/bundesbank-us-zoelle-bedrohen-schwach-deutsche-wirtschaft""><img src=""https://img.zeit.de/news/2025-07/16/bundesbank-us-zoelle-bedrohen-schwach-deutsche-wirtschaft-image-group/wide_148x84"" style=""float: left; margin-right: 5px;"" /></a> None",经济:联邦储备银行:美国关税威胁弱德国经济,"< a href=""http://www.时间.en/news 2025-07/16/enbank-us-zoe -related-disted-Expire-Expression""> <imgSrc=http://img.Time.com/news 2025-07/16/enbank-us-zoll-digent-development-group/wide_148x84"" style=""float: left: margin-right: 5px;"" //a>None"
36,Frauke Brosius-Gersdorf: Lars Klingbeil zeigt sich verärgert über Streit um Richterwahl,"Als ""unnötig"" bezeichnet SPD-Chef und Vizekanzler Klingbeil das Scheitern der Verfassungsrichterwahl. Nun sieht er den Koalitionspartner am Zug.",Frauke Brosius-Gersdorf: Lars Klingbeil is angry about the dispute over the election of judges,"SPD leader and vice chancellor Klingbeil describes the failure of the constitutional judge's election as ""necessary"". Now he sees the coalition partner on the move.",拉斯·克林贝尔对法官选举的争执表示不满,社民党主席和副总理克林布尔称宪法裁判的失败. 现在他在火车上看到联盟伙伴了.
37,Verbrechen gegen Menschlichkeit: Generalbundesanwalt klagt fünf Männer wegen Verbrechen in Syrien an,Fünf Syrer sollen in ihrer Heimat zwischen 2012 und 2014 Kriegsverbrechen begangen haben. In Deutschland sind sie nun wegen Verbrechen gegen die Menschlichkeit angeklagt.,Crimes against humanity: Attorney General accuses five men of crimes in Syria,"Five Syrians are said to have committed war crimes in their homeland between 2012 and 2014. In Germany, they are now accused of crimes against humanity.",反人类罪:司法部长控告5个人在叙利亚犯罪,"據說五名叙利亚人在2012年至2014年期间在故乡犯下了战争罪. 在德国,他们被控危害人类罪."
38,"Hand-Pies mit Himbeeren: Hihi, Himbeere!","Wenn sich Himbeeren mit Pistazien in Teigtaschen verstecken, entstehen diese nussig-fruchtigen Hand-Pies. Perfekt für Ungeduldige, denn am besten schmecken sie noch warm.","Hand-peas with raspberries: Hihi, raspberry!","When raspberries hide in dough pockets with pistachios, these nutty-fruity hand-peas are created. Perfect for impatient people, because they still taste warm.","手掌和覆盆子是: hi, hi, himbee!","如果覆盆子里藏着开心果子酱,这些果酱手心派就形成了. 对不耐烦的人来说,是完美的,因为最好吃的是热的"
39,Syrien: Israelisches Militär greift Damaskus an,Das israelische Militär hat mehrere Ziele in Syriens Hauptstadt Damaskus angegriffen. In der südlichen Provinz Suweida bekämpfen sich Beduinen und Drusen.,Syria: Israeli military attacks Damascus,"The Israeli military has attacked several targets in Syria's capital Damascus. In the southern province of Suweida, Bedouins and Druze are fighting.",叙利亚:以色列军队攻击大马士革,"以色列军队在叙利亚首都大马士革袭击了几个目标. 在苏威达南部,贝都因人和德鲁士人正在战斗."
40,Lars Klingbeil: All you need is Lars,"Lars Klingbeil ist durch viel Geschick zur zentralen Figur der SPD geworden. Was will der Parteivorsitzende mit der ganzen Macht anstellen, die er da angehäuft hat?",Lars Klingbeil: All you need is Lars,Lars Klingbeil has become the central figure of the SPD through a lot of skill. What does the party leader want to do with all the power he has accumulated?,拉尔斯克林贝尔: 你所有需要的都是拉斯,拉尔斯·克林贝尔因多才多艺而成为社民党的中心人物
41,Maria Theresia von Österreich: Irre und bequem,Die große Historikerin Barbara Stollberg-Rilinger wird 70. Ihr neues Werk zeigt die österreichische Kaiserin Maria-Theresia als Kulturkämpferin.,Maria Theresia of Austria: Crazy and comfortable,The great historian Barbara Stollberg-Rilinger will be 70. Her new work shows the Austrian Empress Maria-Theresia as a cultural fighter.,奥地利的玛利亚·特瑞西亚 疯狂又舒适,伟大的历史学家芭芭拉·斯图尔伯格·里林格 70岁. 她的新作将奥地利女王玛利亚·提瑞西亚描绘为文化斗士.
42,Wadephul an Israel: Hilfe für Gaza schnell umsetzen,Aktuelle Informationen über die deutsche Außenpolitik und die internationalen Beziehungen Deutschlands.<br />,Wadephul to Israel: Rapid implementation of aid for Gaza,Current information on German foreign policy and international relations in Germany.<br />,Wadephul呼叫以色列: 快速地为加沙提供援助.,关于德国外交政策和德国国际关系的最新信息.
43,Emissionshandel halbiert Treibhausgase,"Seit seiner Einführung zeigen sich in Europa und Deutschland positive Effekte des Emissionshandels, der den Klimaschutz von Unternehmen stärkt.",Emissions trading halved greenhouse gases,"Since its introduction, emissions trading has had positive effects in Europe and Germany, which strengthens the climate protection of companies.",排放交易将温室气体减半,"自其引入以来,欧洲和德国的排放贸易产生了积极的影响,这将加强企业的气候管理."
44,Papier zu Staatsreform an Bundespräsidenten übergeben,"Steinmeier würdigt Engagement für die Verbesserung der Verwaltung und weitere Reformen. Staat soll „besser, schneller, bürgernäher“ werden.&nbsp;",Paper on State Reform handed over to Federal Presidents,"Steinmeier commends commitment to improving administration and further reforms. State should ""be better, faster, closer to the citizen.""",政府改革的纸张交给德国总理,"斯坦梅耶赞扬改进行政和进一步改革的承诺. 政府应该变得更好,更快,更接近公民. & nbsp;"
45,Cyberschutz-Verpflichtung für Firmen ab 2026,Schutz wichtiger Anlagen und Unternehmen vor Cyberangriffen soll gesetzlich verankert werden.,Cyber protection obligation for companies from 2026,Protection of important assets and companies from cyber attacks is to be enshrined by law.,从2026年开始 网络保护公司的义务从2026年开始,保护重要设施和企业不受网络攻击 应依法予以保护
46,Bayerns Märchenschlösser sind UNESCO-Welterbe,Neben Schloss Neuschwanstein hat die zuständige UNESCO-Kommission drei weitere Schlösser von Bayerns König Ludwig II. zum Welterbe erklärt.,Bavaria's Fairytale Castles are UNESCO World Heritage Sites,"In addition to Neuschwanstein Castle, the responsible UNESCO Commission has declared three other castles of Bavaria's King Louis II World Heritage Site.",巴伐利亚人的故事密码是 UNESCO世界遗产.,"除新星堡外,经合组织委员会 宣布贝耶因国王路德维希二世另外三座城堡成为世界遗产."
47,75 Jahre Deutschland im Europarat,Am 13. Juli 1950 trat Deutschland dem Europarat bei – ein wichtiger Schritt zurück in die europäische Gemeinschaft.,75 years of Germany in the Council of Europe,"On 13 July 1950, Germany joined the Council of Europe – an important step back into the European Community.",在欧洲委员会里75年是德国,"在1950年7月13日 德国回到欧洲委员会,迈出了重要的一步"
48,Berlin will von USA Patriots für Ukraine kaufen,Die internationale Wiederaufbau-Konferenz in Rom beschließt Milliardenhilfen für die Ukraine. Kanzler Merz stellt zudem neue Patriots in Aussicht.,Berlin wants to buy from USA Patriots for Ukraine,The international reconstruction conference in Rome decides billions of dollars for Ukraine. Chancellor Merz also envisages new patriots.,柏林想从美国购买爱国者到乌克兰,罗马的国际重建会议决定为乌克兰提供数十亿美元的援助. 默兹总理还期待着新的爱国者.
49,Merz für deutsche Führungsrolle in der Nato,Vor 70 Jahren ist die Bundesrepublik der Nato beigetreten. Bundeskanzler Friedrich Merz spricht sich für eine stärkere Position Deutschlands im Bündnis aus.,Merz for German leadership role in Nato,"70 years ago, the Federal Republic of Germany joined NATO. Federal Chancellor Friedrich Merz advocates a stronger position in Germany in the alliance.",德国在北约领导层的默兹,"70年前,北约加入纳托共和国. 总理弗里德里希·默兹支持德国在联盟中的地位."
50,Klingbeil plant hohe Investitionen in Deutschlands Zukunft,Finanzminister Lars Klingbeil kündigt in der Haushaltswoche des Bundestags einen Investitionsschub für die Infrastruktur an. Auch die Wirtschaft will Milliarden investieren.,Klingbeil plans to invest heavily in Germany's future,Finance Minister Lars Klingbeil announces an investment boost for the infrastructure during the budget week of the Bundestag. The economy also wants to invest billions.,克林贝尔计划对德国的未来进行大规模投资,Lars Klingbeil 财政部长在联邦预算周内宣布为基础设施投资. 经济也想要投资数十亿美元.
51,Lettland begrüßt deutsche Führungsrolle in Europa,Bundespräsident Steinmeier trifft in Riga Präsident Rinkevics und Premierministerin Silina&nbsp;,Latvia welcomes German leadership in Europe,Federal President Steinmeier meets President Rinkevics and Prime Minister Silina&nbsp in Riga;,拉脱维亚欢迎德国在欧洲的领导者,联邦主席斯坦梅耶在里加会见了林克维奇斯总统 总理席尔纳·恩尼格
52,Ex-Intendantin Schlesinger muss rbb Schadensersatz zahlen - und erhält Ruhegeld,"Die frühere Intendantin des Rundfunks Berlin-Brandenburg, Patricia Schlesinger, muss dem Sender Schadensersatz zahlen. Das hat das Berliner Landgericht entschieden. Zudem muss der rbb ein Ruhegeld zahlen - zunächst für einen Monat.",Ex-intendant Schlesinger must pay rbb damages - and receive pension,"Patricia Schlesinger, former director of the Berlin-Brandenburg Broadcasting Company, has to pay compensation to the broadcaster. This has been decided by the Berlin Regional Court. In addition, rbb has to pay a pension - first for one month.",前任内政部长施莱辛格必须支付赔偿金 并得到退休金,"柏林 -布兰登堡电台的前任内幕学家帕特里夏·斯雷辛格 (Patricia Schreesinger) 必须赔偿电视台. 这是柏林国家法院决定的. 此外,他必须先付一个月的休养费."
53,Marktbericht: US-Konjunkturdaten geben Anlegern etwas Hoffnung,Inmitten des internationalen Zollkonflikts haben die US-Erzeuger ihre Preise im Juni überraschend konstant gehalten. Die amerikanischen Börsen starten mit Auftrieb. Auch der DAX profitiert.,Market Report: US Economic Data Give Investors Some Hope,"In the midst of the international tariff conflict, US producers kept their prices surprisingly constant in June. American stock exchanges are starting to boost. The DAX also benefits.",市场报告:美国经济数据给投资者带来希望,"在国际海关冲突中,美国制造商在6月时突然保持价格稳定,美国股市开始升值. DAX也获益良多."
54,Behörden schalten Servernetz prorussischer Hacker ab,"Ihre Mitglieder haben kritische Infrastruktur, Behörden und Unternehmen angegriffen - jetzt wurde das Servernetz der prorussischen Hackergruppe NoName057(16) in einer international abgestimmten Aktion lahmgelegt.",Authorities switch off server network of pro-Russian hackers,"Their members have attacked critical infrastructure, authorities and companies - now the server network of the pro-Russian hacker group NoName057(16) has been paralyzed in an internationally coordinated action.",官方部门正在关闭亲俄黑客服务器网络,"他们的成员们攻击了重要的基础设施,当局和企业 现在俄罗斯亲俄黑客集团的服务器网络被以国际协调行动的方式摧毁了"
55,Gut jeder fünfte Mensch in Deutschland lebt allein,Rund 17 Millionen Menschen in Deutschland leben allein - das sind deutlich mehr als vor 20 Jahren und auch deutlich mehr als in anderen EU-Ländern. Alleinlebende sind in höherem Maße von Einsamkeit und Armut betroffen.,"Well, one in five people in Germany lives alone",Around 17 million people live in Germany alone - which is significantly more than 20 years ago and significantly more than in other EU countries. Living alone is more affected by loneliness and poverty.,德国的第五个人都是孤独一人,"德国大约有1700万人独自生活 - 比20年前要多得多,比其他欧盟国家还要多. 孤独生活的人更加孤独和贫穷."
56,Ukraine-Liveblog: Bundesregierung widerspricht Trump bei Patriots,"Die Bundesregierung hat US-Präsident Trump widersprochen, wonach bereits Patriots aus Deutschland auf dem Weg in die Ukraine seien. Das ukrainische Parlament hat für die Entlassung der Regierung gestimmt.",Ukraine live blog: Federal Government contradicts Trump at Patriots,"The Federal Government has objected to US President Trump, according to which patriots from Germany are already on their way to Ukraine. The Ukrainian parliament voted for the dismissal of the government.",乌克兰历史博客: 联邦政府在爱国者中比不上特朗普,"联邦政府反对美国总统特朗普的言论,说已经让爱国者离开德国前往乌克兰. 乌克兰议会投票支持政府释放."
57,Digitalisierung im Gesundheitswesen: Die verpasste Chance,"Mit Millionen des Bundes hätte Deutschland die Digitalisierung der Gesundheitsämter auf ein neues Niveau heben können. Doch Überforderung und Kleinstaaterei haben den großen Wurf bei der Digitalisierung verhindert, wie MDR-Recherchen zeigen.",Digitalisation in healthcare: the missed opportunity,"With millions of the federal government, Germany could have raised the digitisation of the health services to a new level. However, overburden and small states have prevented the big throw in digitalization, as MDR research shows.",医疗数字化: 错过的机会,"德国有数以百万计的联邦资金,可以将医疗卫生部门数字化提升到一个新的水平. 但过度挑战和小国行为阻止了数字化大投机,正如MDR调查显示的那样."
58,25 Kilogramm schwerer Marsmeteorit wird in New York versteigert,Das Auktionshaus Sotheby's versteigert heute einen 25 Kilogramm schweren Marsmeteoriten. Er flog Millionen von Jahre durch das All - bis er im November 2023 in der Sahara gefunden wurde. Von Uwe Gradwohl.,25 kg Marsmeteorite to be auctioned in New York,The auction house Sotheby's today auctions a 25 kilogram Mars meteorite. It flew through space for millions of years - until it was found in the Sahara in November 2023. By Uwe Gradwohl.,在纽约拍卖25公斤的火星金属,"今天索瑟比的拍卖会拍卖了一个25公斤重的火星热气球. 他在太空飞了几百万年,直到2023年11月他在撒哈拉沙漠中被发现. 由乌温恩 (Uwehome) 提供."
59,Gewalt in Syrien: Eine religiöse Minderheit kämpft um Mitsprache,In Süden Syriens weitet sich der Konflikt aus. Drusische Milizen kämpfen gegen die syrische Armee. Israel kommt der Minderheit zur Hilfe. Was passiert da gerade? Von Moritz Behrendt.,Violence in Syria: A Religious Minority Fights for Voice,"In southern Syria, the conflict is widening. Drusian militias are fighting against the Syrian army. Israel is coming to the aid of the minority. What is happening? By Moritz Behrendt.",叙利亚的暴力:少数宗教的少数派争夺发言权,叙利亚南部的冲突正在蔓延. 德鲁士民兵正在与叙利亚军队作战. 以色列正在帮助少数派. 发生了什么?
60,Gutachten entlastet Brosius-Gersdorf von Plagiatsvorwurf,"In der Union ist die SPD-Richterkandidatin Brosius-Gersdorf auch wegen der Plagiatsvorwürfe um ihre Doktorarbeit umstritten. Ein Gutachten, das die Juristin selbst in Auftrag gegeben hat, entlastet sie nun.",Report relieves Brosius-Gersdorf from Plagiarism submission,"In the Union, SPD candidate Brosius-Gersdorf is also controversial about her doctoral thesis because of the plagiarism submissions. An expert report, which the lawyer himself commissioned, now relieves her of the burden.",Plagiats 提议的Brosius-Gersdorf 咨询意见,"在联盟,社民党法官候选人Brouseius-Gersdorf对博士学位的提案也存在争议. 律师们亲自委托的咨询意见已使她无罪释放."
61,Nahost-Liveblog: ++ Drusen aus Israel überqueren Grenze nach Syrien ++,"Angehörige der religiösen Minderheit der Drusen aus Israel haben die Grenze zu Syrien überquert, um andere Drusen nach dem Gewaltausbruch im Nachbarland zu unterstützen. Bei einer Massenpanik im Gazastreifen sind offenbar 20 Menschen getötet worden.",Middle East live blog: ++ Druses from Israel cross border to Syria ++,Members of the religious minority of the Druze from Israel have crossed the border with Syria to support other Druze after the outbreak of violence in the neighbouring country. 20 people were apparently killed in a mass panic in the Gaza Strip.,中东词汇博客:++ 从以色列经由德鲁士越过边界进入叙利亚+++,"以色列宗教少数派成员已经跨过边境到叙利亚,支持邻国暴力爆发后的其他德鲁士人. 加沙地带爆发了大规模恐慌,似乎有20人丧生."
