,title-en,content-en,title-de,content-de,title-es,content-es,title-fr,content-fr,title-zh,content-zh
67,"DHS has begun flying migrants out of Florida's 'Alligator Alcatraz,' DeSantis announces",Florida Gov. Ron DeSantis announced Friday that the Department of Homeland Security has started flying migrants out of the “Alligator Alcatraz&quot; detention facility.,"DHS hat begonnen, Migranten aus Floridas 'Alligator Alcatraz,' DeSantis kündigt","Florida Gov. Ron DeSantis kündigte am Freitag an, dass das Ministerium für Heimatsicherheit begonnen hat, Migranten aus dem Alligator Alcatraz&quot zu fliegen; Haftanstalt.","DHS ha comenzado a volar migrantes desde el 'Alligator Alcatraz' de Florida, anuncia DeSantis",El gobernador de Florida Ron DeSantis anunció el viernes que el Departamento de Seguridad Nacional ha comenzado a volar a los migrantes fuera del “Alligator Alcatraz&quot; centro de detención.,"DHS a commencé à voler des migrants hors de la Floride 'Alcatraz alligator,' DeSantis annonce",Florida Gov. Ron DeSantis a annoncé vendredi que le Département de la Sécurité Intérieure a commencé à voler les migrants hors de l'Alcatraz Alligator&quot; centre de détention.,"人口与健康调查已经开始将移民从佛罗里达的“Aligator Alcatraz,” DeSantis宣布,","Florida Gov. Ron DeSantis在星期五宣布,国土安全部已开始将移民从“Alcatraz & quat;鳄鱼和鱼;拘留设施”中空运出去。"
68,"One dead, one injured in University of New Mexico campus shooting as manhunt continues",One person is dead and another was injured after a shooting at the University of New Mexico on Friday morning.,"Eine Tote, eine Verletzte in der Universität von New Mexico Campus Schießerei während der Jagd weiter",Eine Person ist tot und eine andere wurde nach einer Schießerei an der Universität von New Mexico am Freitagmorgen verletzt.,"Un muerto, un herido en el campus de la Universidad de Nuevo México disparando mientras continúa la persecución.",Una persona está muerta y otra resultó herida después de un tiroteo en la Universidad de Nuevo México el viernes por la mañana.,"Un mort, un blessé dans le campus de l'Université du Nouveau Mexique fusillade alors que la chasse à l'homme continue",Une personne est morte et une autre a été blessée après une fusillade à l'Université du Nouveau-Mexique vendredi matin.,"一人死亡,一人受伤 在新墨西哥大学校园 枪击继续搜捕","星期五上午在新墨西哥大学发生枪击事件后,一人死亡,另一人受伤。"
69,Democratic Party posts Biden-era price hikes in widely-mocked X post attacking Trump,The Democratic Party’s official X account posted a graph of rising grocery prices on Thursday that showed massive spike during the Biden administration.,Democratic Party posts Biden-era Preiserhöhungen in weit gedämpften X-Post Angriff Trump,"Der offizielle X-Account der Demokratischen Partei postete am Donnerstag einen Graphen steigender Lebensmittelpreise, der während der Biden-Administration eine massive Spitze zeigte.",El Partido Demócrata postea alzas de precios en la era Biden en un post X ampliamente mocked atacando a Trump,La cuenta oficial X del Partido Demócrata publicó un gráfico del aumento de los precios de los comestibles el jueves que mostró un aumento masivo durante la administración de Biden.,Le Parti Démocratique affiche des hausses de prix de l'ère Biden dans un poste X largement frappé attaquant Trump,Le compte X officiel du Parti démocrate a affiché un graphique de la hausse des prix des épiceries jeudi qui a montré une augmentation massive pendant l'administration de Biden.,"民主党在Biden-时代的Biden-时代大涨价,","民主党官方X帐户在星期四公布食品价格上涨图, 显示拜登政府执政期间大涨。"
70,Unearthed video exposes Mamdani's 'unabashed' commitment to supporting anti-Israel sanctions as lawmaker,NYC socialist mayoral candidate Zohran Mamdani outlined his &quot;unabashed&quot; support for BDS sanctions against Israel which he drawn criticism from Jewish groups nationwide.,"Unerfundenes Video entlarvt Mamdanis ""unerschütterliches"" Engagement für die Unterstützung von Anti-Israel-Sanktionen als Gesetzgeber","Der sozialistische Bürgermeisterkandidat der NYC Zohran Mamdani skizzierte seine &quot;unabashed&quot; Unterstützung für BDS-Sanktionen gegen Israel, die er landesweit von jüdischen Gruppen kritisierte.","Un vídeo desenterrado expone el compromiso ""despreocupado"" de Mamdani de apoyar las sanciones contra Israel como legislador","El candidato socialista a la alcaldía de Nueva York, Zohran Mamdani, describió su &quot;unababashed&quot; apoyo a las sanciones BDS contra Israel que atrajo críticas de grupos judíos en todo el país.",Une vidéo découverte expose l'engagement de Mamdani 'unabashed' à soutenir les sanctions anti-Israël en tant que législateur,"Zohran Mamdani, candidat au maire socialiste de NYC, a décrit son soutien aux sanctions du BDS contre Israël, qu'il a critiqués par des groupes juifs à l'échelle nationale.","Mamdani以立法者身份承诺支持反以色列制裁,","NYC社会主义市长候选人Zohran Mamdani概述了他的 & qut;unabashed&qot; 支持对以色列的BDS制裁,"
71,"SCOOP: Key GOP group starts work on 2nd 'big, beautiful bill' for Trump","A House GOP group is launching a specialized panel to solicit lawmaker ideas on a second budget reconciliation bill, Fox News Digital has learned.","SCOOP: Key GOP Gruppe beginnt die Arbeit an 2. ""großen, schönen Rechnung"" für Trump","Eine Haus-GOP-Gruppe startet ein spezialisiertes Panel, um Gesetzgeber Ideen auf eine zweite Budget-Aussöhnung Rechnung, Fox News Digital hat gelernt.","SCOOP: El grupo clave del Partido Republicano comienza a trabajar en el segundo ""gran proyecto de ley"" para Trump","Un grupo de House GOP está lanzando un panel especializado para solicitar ideas legislativas sobre un segundo proyecto de ley de conciliación presupuestaria, ha aprendido Fox News Digital.",SCOOP: Le groupe clé du GOP commence à travailler sur la 2e «belle facture» pour Trump,"Un groupe du GOP de la maison lance un groupe spécialisé pour solliciter des idées de législateur sur un deuxième projet de loi de réconciliation budgétaire, Fox News Digital a appris.","关键 GOP 组组开始为 Trump 进行第二张“大,漂亮”的“大,漂亮”帐单",福克斯新闻数字公司(Fox News Digital)已经学会了。
72,FDA chief has no 'plans' for abortion pill policy changes but continues safety review,Food and Drug Administration Commissioner Marty Makary said in a recent interview he has no plans to change policies regarding the abortion pill mifepristone.,"FDA Chef hat keine ""Pläne"" für Abtreibung Pille Politik Änderungen, sondern setzt Sicherheitsüberprüfung","Der Kommissar für Lebensmittel- und Drogenverwaltung, Marty Makary, sagte kürzlich in einem Interview, er habe keine Pläne, die Politik bezüglich des Misstrauenspflaumens für Abtreibungen zu ändern.","El jefe de la FDA no tiene ""planes"" para cambios en la política de píldoras para el aborto, pero continúa la revisión de seguridad","El Comisionado de Administración de Alimentos y Drogas, Marty Makary, dijo en una entrevista reciente que no tiene planes de cambiar las políticas con respecto a la píldora abortiva mifepristona.","Le chef de la FDA n'a pas de ""plans"" pour changer la politique des pilules d'avortement, mais continue l'examen de la sécurité","Le commissaire à l'administration des aliments et des drogues, Marty Makary, a déclaré dans un récent entretien qu'il n'avait pas l'intention de modifier les politiques concernant la pilule d'avortement mifepristone.","林业发展局局长没有堕胎药丸政策改变的“计划”,但继续安全审查。","食品和药品管理局专员马蒂·马卡里在最近的一次访谈中说,他没有计划改变有关堕胎药丸mifeprístone的政策。"
73,Ex-WWE broadcaster Jonathan Coachman recalls story behind Hulk Hogan's legendary WrestleMania X8 performance,Jonathan Coachman shares how The Rock and Hulk Hogan improvised their iconic WrestleMania X8 match when fans unexpectedly turned on Dwayne Johnson.,Ex-WWE-Sender Jonathan Coachman erinnert sich an die Geschichte hinter Hulk Hogans legendärem WrestleMania X8-Auftritt,"Jonathan Coachman teilt, wie The Rock und Hulk Hogan ihr ikonisches WrestleMania X8-Match improvisierten, als Fans unerwartet auf Dwayne Johnson umstellten.",Jonathan Coachman recuerda la historia detrás de la legendaria actuación de Hulk Hogan en WrestleMania X8,Jonathan Coachman comparte cómo The Rock y Hulk Hogan improvisaron su icónico partido WrestleMania X8 cuando los fans se volvieron inesperadamente en Dwayne Johnson.,L'ancien radiodiffuseur WWE Jonathan Coachman se souvient de l'histoire derrière la légendaire performance WrestleMania X8 de Hulk Hogan,Jonathan Coachman partage comment The Rock et Hulk Hogan ont improvisé leur fameux match WrestleMania X8 lorsque les fans ont inopinément activé Dwayne Johnson.,前WWE广播员Jonathan Contleman回顾胡克霍根(Hulk Hogan)传奇的Wrestle Mania X8表演背后的故事:,乔纳森·科德曼分享了《摇滚》和《胡克·霍根》如何在球迷意外地打开Dwayne Johnson时 模拟了他们的标志性Wrestle Mania X8比赛。
74,Grieving parents of American terror victim plead with top criminal prosecutor for justice,"The parents of a U.S. teen killed in a 2001 Jerusalem bombing meet with U.S. Attorney Jeanine Pirro, urging the extradition of Hamas terrorist Ahlam al-Tamimi from Jordan.",Trauernde Eltern des amerikanischen Terroropfers plädieren mit Top-Ankläger für Gerechtigkeit,"Die Eltern eines US-Teens, der 2001 bei einem Bombenanschlag in Jerusalem getötet wurde, treffen sich mit der US-Anwältin Jeanine Pirro und drängen auf die Auslieferung des Hamas Terroristen Ahlam al-Tamimi aus Jordanien.",Padres afligidos de la víctima del terror estadounidense suplican ante el fiscal penal superior por justicia,"Los padres de un adolescente estadounidense muerto en un atentado con bomba en Jerusalén en 2001 se reúnen con la abogada estadounidense Jeanine Pirro, instando a la extradición del terrorista de Hamás Ahlam al-Tamimi de Jordania.",Les parents de la victime américaine de la terreur plaident auprès du procureur pénal supérieur pour la justice,"Les parents d'un adolescent américain tué dans un attentat à Jérusalem en 2001 rencontrent le procureur américain Jeanine Pirro, exhortant à l'extradition du terroriste du Hamas Ahlam al-Tamimi de Jordanie.","美国恐怖受害者父母向最高刑事检察官申辩,要求司法审判","在2001年耶路撒冷爆炸事件中丧生的一位美国少年的父母与美国检察官Jeanine Pirro会面,敦促从约旦引渡哈马斯恐怖分子Ahlam al-Tamimi。"
75,"Jazz legend Chuck Mangione, known for ‘Feels So Good,’ dies at 84","Grammy Award-winning jazz musician Chuck Mangione, known for his hit single &apos;Feels So Good&apos; and voice acting on &apos;King of the Hill,&apos; has died at age 84 in Rochester, New York.","Jazz-Legende Chuck Mangione, bekannt für ‘Feels So Good,' stirbt bei 84","Der preisgekrönte Jazzmusiker Chuck Mangione, bekannt für seine Hitsingle &apos;Feels So Good&apos; und Stimme, die auf &apos;King of the Hill,&apos; spielt, ist im Alter von 84 Jahren in Rochester, New York, gestorben.","La leyenda del jazz Chuck Mangione, conocida por ‘Feels So Good’, muere a los 84 años.","El músico de jazz Chuck Mangione, conocido por su exitoso sencillo &apos;Feels So Good&apos; y la voz actuando en &apos;King of the Hill,&apos; ha muerto a los 84 años en Rochester, Nueva York.","La légende du jazz Chuck Mangione, connue pour ‘Feels So Good', meurt à 84 ans.","Chuck Mangione, le musicien de jazz primé par Grammy, connu pour son single hit &apos;Feels So Good&apos; et sa voix agissant sur &apos;King of the Hill,&apos; est décédé à l'âge de 84 ans à Rochester, New York.","以「感觉如此美好」闻名的Jazz传奇人物Chuck Mangione,","Grammy获奖爵士乐歌手Chuck Mangione, 以其打中单人和apos; Feels So Good&apos; 和对 &apos; Hill King, 和apos; 的声音演唱而闻名, 在纽约罗切斯特84岁时去世。"
76,Buffets are busier than ever in popular tourist town: Here's how to beat the wait,"Summer travelers to Las Vegas can skip the notorious buffet lines using this expert advice about online reservations, off-peak dining and concierge assistance.","Buffets sind geschäftiger denn je in der beliebten Touristenstadt: Hier ist, wie man das Warten schlagen","Sommerreisende nach Las Vegas können die berüchtigten Buffet-Linien überspringen mit diesem Experten-Ratschlag über Online-Reservierungen, Off-Peak-Essen und Concierge-Hilfe.",Los Buffets están más ocupados que nunca en la popular ciudad turística: Aquí está cómo superar la espera,"Los viajeros de verano a Las Vegas pueden saltarse las notorias líneas de bufet utilizando este consejo de expertos sobre reservas en línea, restaurantes fuera de la lengua y asistencia de conserjería.",Les buffets sont plus occupés que jamais dans la ville touristique populaire: Voici comment battre l'attente,"Les voyageurs d'été à Las Vegas peuvent sauter les lignes de buffet notoires à l'aide de ce conseil d'expert sur les réservations en ligne, les dîners hors-parle et l'assistance de concierge.","在热门的旅游城镇中,Buffetes比以往更加繁忙:这里是如何克服等待的。","暑假旅行者前往拉斯维加斯, 可以跳过臭名昭著的自助餐线,"
77,Youngkin unleashes cutting-edge AI technology in effort to slash Virginia's government red tape,"Gov. Glenn Youngkin&apos;s AI initiative has helped Virginia eliminate 26% of regulatory requirements and nearly half of state guidance, saving taxpayers $1.2 billion annually.","Youngkin entfesselt modernste KI-Technologie in dem Bemühen, Virginias Verwaltungsaufwand zu verschneiden","Gov. Glenn Youngkin&apos;s KI-Initiative hat Virginia geholfen, 26% der regulatorischen Anforderungen und fast die Hälfte der staatlichen Beratung zu beseitigen, sparen Steuerzahler $ 1,2 Milliarden jährlich.",Youngkin lanza tecnología de IA de vanguardia para reducir la burocracia del gobierno de Virginia,"La iniciativa de IA del gobernador Glenn Youngkin&apos ha ayudado a Virginia a eliminar el 26% de los requisitos regulatorios y casi la mitad de la orientación estatal, ahorrando a los contribuyentes $1.2 billones al año.",Youngkin lance une technologie d'IA de pointe dans le but de réduire la bureaucratie du gouvernement de Virginie,"L'initiative d'IA du gouvernement Glenn Youngkin&apos a aidé Virginia à éliminer 26 % des exigences réglementaires et près de la moitié des directives de l'État, ce qui a permis aux contribuables d'économiser 1,2 milliard de dollars par année.",杨金释放了最先进的人工智能技术 以粉碎弗吉尼亚政府的繁文缛节,"Glenn Youngkin&apos;AI倡议帮助弗吉尼亚消除了26%的监管要求和近一半的国家指导,每年节省纳税人12亿美元。"
78,"US-Mexico Tijuana River sewage crisis deal is ‘massive’ win for Americans, EPA says","EPA Administrator Lee Zeldin announces US-Mexico deal to resolve the Tijuana River sewage crisis, calling it a massive environmental win for San Diego-area residents.","US-Mexiko Tijuana Fluss Abwasserkrise Deal ist ""massiv"" Sieg für die Amerikaner, WPA sagt","WPA-Administrator Lee Zeldin kündigt ein US-Mexiko-Deal an, um die Tijuana-Fluss-Abwasserkrise zu lösen und nennt es einen massiven Umweltsieg für die Bewohner des San Diego-Gebiets.","El acuerdo de crisis de aguas residuales del río Tijuana entre Estados Unidos y México es ‘masivo’ para los estadounidenses, dice la EPA","Lee Zeldin, administrador de la EPA, anuncia un acuerdo entre Estados Unidos y México para resolver la crisis de aguas residuales del río Tijuana, y lo considera una gran victoria ambiental para los residentes del área de San Diego.","L'accord de crise entre les États-Unis et le Mexique sur la rivière Tijuana sur les eaux usées est « une victoire massive pour les Américains », affirme l'EPA.","L'administrateur de l'EPA, Lee Zeldin, annonce un accord entre les États-Unis et le Mexique pour résoudre la crise des eaux usées de la rivière Tijuana.","环保局指出, 美国-墨西哥提华纳河污水危机交易对美国人来说是“大屠杀”的胜利,","美国环保署署长Lee Zeldin宣布美国与墨西哥达成协议, 解决蒂华纳河污水危机,"
79,Five unforgettable Hulk Hogan matches that defined wrestling history,"A close look at five of Hulk Hogan&apos;s best in-ring moments, from his bout with Andre the Giant to passing the torch to Dwayne &quot;The Rock&quot; Johnson.","Fünf unvergessliche Hulk Hogan Spiele, die Wrestling Geschichte definiert","Ein genauer Blick auf fünf von Hulk Hogan&apos;s besten In-Ring-Momente, von seinem Kampf mit Andre the Giant bis hin zur Übergabe der Fackel an Dwayne &quot;The Rock&quot; Johnson.",Cinco inolvidables partidos de Hulk Hogan que definieron la historia de la lucha libre,"Una mirada cercana a cinco de Hulk Hogan&apos;s mejores momentos en el ring, desde su pelea con Andre el Gigante hasta pasar la antorcha a Dwayne &quot;The Rock&quot; Johnson.",Cinq matchs inoubliables de Hulk Hogan qui ont défini l'histoire de la lutte,"Un coup d'œil sur cinq des meilleurs moments de Hulk Hogan&apos, de son combat avec André le Géant à la traversée de la torche à Dwayne &quot;The Rock&quot; Johnson.",五个难以忘怀的绿巨人霍根匹配 定义摔跤历史,"仔细看看Hulk Hogan&apos的五集; 最佳的时段, 从他与巨人安德烈的交汇到把火炬传递到Dwayne & qopt; The Rock & qot; Johnson。"
80,Mini-organs from the lab,"Dr. Ines Lahmann explains how organoids could revolutionize medical research in a ‘Forschungsquartett’ interview with detektor.fm editor Esther Stephan.
<p></p>
  <img alt=""woman"" height=""200"" src=""https://www.mdc-berlin.de/system/files/styles/mdc_inline_small_mdc_phablet_1x/private/2025-01/%C2%A9%20Felix%20Petermann%2C%20Max%20Delbr%C3%BCck%20Center_portrait_lahmann%2C%20ines-IMG_6678_FAVORIT.jpg?h=66fc3203&amp;itok=LXACBcVY"" width=""320"" />



<p></p>
<p>Organoids are tiny replicas of human organs. Instead of animal testing, these mini-organs derived from stem cells could soon help us better understand diseases and develop tailored therapies.</p><p>Learn more in the <a href=""https://detektor.fm/wissen/forschungsquartett-organoide"">Podcast at detektor.fm</a></p>
<p></p>

<p></p>",Mini-Organe aus dem Labor,"Dr. Ines Lahmann erklärt, wie Organoide die medizinische Forschung in einem „Forschungsquartett""-Interview mit detektor.fm-Redakteur Esther Stephan revolutionieren könnten. <p></p> <img alt=""woman"" height=""200"" src=""https://www.mdc-berlin.de/system/files/styles/mdc_inline_small_mdc_phablet_1x/private/2025-01/%C2%A9%20Felix%20Petermann%2C%20Max%20Delbr%C3%BCck%20Center_portrait_lahmann%2C%20ines-IMG_6678_FAVORIT.jpg?h=66fc3203&amp;itok=LXACBcVY"" width=""320"" /> <p>Organoide sind winzige Repliken menschlicher Organe.",Miniorganismos del laboratorio,"El Dr. Ines Lahmann explica cómo los organoidees podrían revolucionar la investigación médica en una entrevista con la editora de detektor.fm Esther Stephan. <pañ/p> <img alt=""woman"" high=""200"" src=""https://www.mdc-berlin.de/system/files/styles/mdc_inline_small_mdc_phablet_1x/private/2025-01/%C2%A9%20Felix%20Petermann%2C%20Max%20C3BCck%20Center_portrait_lahmann%2C%20ines-IMG_6678_FAVORIT.jpg?h=66fc3203&amp;itok=LXACBcVY"" ancho=""320Center_portrait_law%C%c/p>p@dep/span/span/span/s.",Mini-organes du labo,"Le Dr Ines Lahmann explique comment les organoïdes pourraient révolutionner la recherche médicale dans le cadre d'une entrevue avec l'éditeur de detektor.fm Esther Stephan. <p></p> <img alt=""woman"" height=""200"" src=""https://www.mdc-berlin.de/system/files/styles/mdc_inline_small_mdc_phablet_1x/private/2025-01/%C2%A9%20Felix%20Petermann%2C%20Max%20Delbr%C3%BCck%20Center_portrait_lahmann%2C%20ines-IMG_6678_FAVORIT.jpg?h=66fc3203&amp;itok=LXACBcVY"" width=""320"" /> <p><p>Les organoïdes sont de minuscules répliques d'organes humains.",实验室的微型机体,"Ines Lahmann 博士解释有机体如何在“ Forschungsq Major.fm编辑Esther Stephan”的采访中使医学研究革命。 <p/p> <img alt=""woman"" 高度=""200"" src=""https://www.mdc-berlin.de/system/files/stims/ styles/mdc_phablet_1x/puterive/2025-01/%C2%A920Felix%20Petermann%2C%20Max20Delbr%C3%BCckk%20Center_portrait_lahmann%2C%2020Nines-IMG_66_FAVORIT.jpg?h=66fc3203&amp;itok=LXACBCVY宽度=""320""/ > <p/p> <p> <p> <rgansualsumasumasules are 它们是人类器官的小复制品。"
81,Biopolis – into the microbiome,"A young scientist explores the human microbiome in a part-science, part-fiction audio series. Podcastmaker Michiel van Poelgeest follows Dr. Theda Bartolomaeus from the Max Delbrück Center on her quest to decode the microbes within us. (5 episodes)
<p></p>
  <img alt=""Theda Bartolomaeus"" height=""200"" src=""https://www.mdc-berlin.de/system/files/styles/mdc_inline_small_mdc_phablet_1x/private/2025-07/rn_image_picker_lib_temp_7c0c8b45-42be-48ad-b853-cbeef4a8bc06.jpg?h=4521fff0&amp;itok=EjrYGyxS"" width=""320"" />



<p></p>
<p><a href=""https://springcast.app/biopolis-into-the-microbiome""><strong>Podcast website</strong></a></p><p><a href=""https://podcasts.apple.com/de/podcast/biopolis-into-the-microbiome/id1822739797"">Biopolis at Apple Podcasts</a></p>
<p></p>

<p></p>",Biopolis – ins Mikrobiom,"Ein junger Wissenschaftler erforscht das Mikrobiom in einer Teil-Wissenschaft, Teil-Fiction-Audioserie. Podcastmaker Michiel van Poelgeest folgt Dr. Theda Bartolomaeus vom Max-Delbrück-Zentrum auf ihrer Suche nach der Dekodierung der Mikroben in uns. (5 Episoden) <p></p> <img alt=""Theda Bartolomaeus"" Höhe=""200"" src=""https://www.mdc-berlin.de/system/files/styles/mdc_inline_smmdc_phablet_1x/private/2025-07/rn_image_picker_lib_temp_7c0c8b45-42be-48ad-b853-cbeef4a8bc06.jpg?h=4521fff0&amp;itok=EjrYGyxS"" Breite <p><p>*p>Href/dcast/appotyp><p>",Biopolis – en el microbioma,"Un joven científico explora el microbioma humano en una serie de audio de parte-ciencia, de parte-ficción. Podcastmaker Michiel van Poelgeest sigue a la Dra. Theda Bartolomeus del Centro Max Delbrück en su búsqueda de decodificar los microbios dentro de nosotros. (5 episodios) <pÃ3s/p> <img alt=""Theda Bartolomeus"" thigh=""200"" src=""https://www.mdc-berlin.de/system/files/styles/mdc_inline_small_mdc_phablet_1x/privado/2025-07/rn_image_picker_lib_temp_7c0c8b45-42be-48ad-b853-cbeef4a8bc06.jp?h=4521fff&amp;itok=EjrYGyxS"" ancho=""320/p/pmefÃ3cÃ3",Biopolis – dans le microbiome,"Un jeune scientifique explore le microbiome humain dans une série audio en partie scientifique, en partie fiction. Podcastmaker Michiel van Poelgeest suit la Dre Theda Bartolomaeus du Centre Max Delbrück dans sa quête de décoder les microbes en nous. (5 épisodes) <p></p> <img alt=""Theda Bartolomaeus"" height=""200"" src=""https://www.mdc-berlin.de/system/files/styles/mdc_inline_small_mdc_phablet_1x/private/2025-07/rn_image_picker_lib_temp_7c0c8b45-42be-48ad-b853-cbeef4a8bc06.jpg?h=4521fff0&amp;itok=EjrYGyxS"" width=""320"" /> <p> <p><a href><p>https://springcast.gov><p><p><p><p><p><p><p><p>",Biopolis — — 进入微生物,"一位年轻的科学家在部分科学、部分虚构的音频系列中探索人类微生物。来自Max Delbrück中心的Podcacardmaker Michiel van Poelgeest博士追随Max Delbrück中心的Theda Bartolomaeus 试图解码我们体内的微生物。 (5个片段) <p/p> <img alt=""Theda Bartomaeus"" 高度=""200"" src="" https://www.mdc-berlin.de/ systems/fiscles/mdlines/ styms_indc_indc_1x_puty_p_x/privilal/2025-07/rn_image_parter_lib_lib_temp_7c8b45-42be-48ad-b853-cbefwefe4,a8c06.jpg?h=4521fff0 &amp;itok=eokok=Ejorks=EjryrYYGydxS_podS_pop=_p_pop=30_ma_ma_ma_ma_ma_ma_ma_max_tocast_ma_tocasts/ misal_tocasto_ma_ma_ma_ma_ma_ma_tocastoal_tocast."
