,title-en,content-en,title-de,content-de,title-es,content-es,title-fr,content-fr,title-zh,content-zh
42,Beware tomes of Chinese political gossip!,Our new number-crunching on reading banned books,Hüten Sie sich vor chinesischem politischen Klatsch!,Unsere neue Nummer-Crunching beim Lesen verbotener Bücher,¡Cuidado con los chismes políticos chinos!,Nuestro nuevo número-cruzamiento en la lectura de libros prohibidos,Méfiez-vous des commérages politiques chinois !,Notre nouveau numéro-croûtement sur la lecture des livres interdits,当心中国政治流言!,我们在阅读被禁止的书籍方面的新人数
43,Hong Kong’s last functioning pro-democracy party disbands,A long campaign against dissent crushes a final few democrats,Hongkongs letzte funktionierende pro-demokratische Partei löst sich auf,Eine lange Kampagne gegen Dissent zermalmt einige letzte Demokraten,El último partido pro-democracia de Hong Kong se disuelve,Una larga campaña contra la disidencia aplasta a unos pocos demócratas finales,Le dernier parti pro-démocratie opérationnel de Hong Kong se dissout,Une longue campagne contre la dissidence écrase quelques derniers démocrates,香港最后一个正在运作的支持民主的政党解散,反对持不同政见者的长期运动压倒了最后的少数民主份子。
44,China’s growth targets cause headaches—even when met,Local officials wrestle with competing incentives,Chinas Wachstumsziele verursachen Kopfschmerzen – selbst wenn sie erfüllt werden,Lokale Beamte kämpfen mit konkurrierenden Anreizen,"Los objetivos de crecimiento de China causan dolores de cabeza, incluso cuando se cumplen",Funcionarios locales luchan con incentivos competitivos,"Les objectifs de croissance de la Chine provoquent des maux de tête, même lorsqu'ils sont atteints",Les autorités locales luttent avec des incitations concurrentes,中国的增长目标导致头痛 — — 即使在达到目标时也是如此,地方官员与相互竞争的奖励办法搏斗
45,China’s giant new gamble with digital IDs,They could change its internet for good and turbocharge AI efforts,Chinas riesiges neues Glücksspiel mit digitalen IDs,Sie könnten ihr Internet für gute und Turboladung KI Bemühungen ändern,La nueva apuesta gigante de China con identificaciones digitales,Podrían cambiar su Internet por buenos y turboalimentados esfuerzos de IA,Le nouveau pari géant de la Chine avec les ID numériques,Ils pourraient changer son internet pour de bons et turbocharge AI efforts,中国在数字身份识别码上的新赌博,"他们可以改变互联网,"
46,Chinese cops are cuffing erotica,Local police have found a perverse way to raise money,Chinesische Cops sind Handschellen Erotik,"Die örtliche Polizei hat einen perversen Weg gefunden, um Geld zu sammeln.",Policías chinos están esposando erótica,La policía local ha encontrado una forma perversa de recaudar dinero,Les flics chinois menottes érotiques,La police locale a trouvé un moyen pervers de recueillir de l'argent,中国警察在拷打色情片,当地警察找了个反常的筹钱办法
47,China’s new army of engineers,Its ranks will swell as the country’s high-tech industries grow,Chinas neue Armee der Ingenieure,"Seine Ränge werden schwellen, während das Land die High-Tech-Industrien wachsen",El nuevo ejército de ingenieros de China,Sus filas se incrementarán a medida que las industrias de alta tecnología del país crezcan,Chine nouvelle armée d'ingénieurs,Ses rangs vont gonfler au fur et à mesure que les industries de haute technologie du pays grandissent,中国新的工兵新军,"随着该国高科技产业的增长,其军衔将不断膨胀"
48,Jeffrey Epstein is still causing trouble for Donald Trump,His administration cannot shake rumours of a cover-up—in part because MAGA types enthusiastically endorsed it,Jeffrey Epstein macht Donald Trump immer noch Ärger,"Seine Regierung kann Gerüchte über eine Vertuschung nicht schütteln – zum Teil, weil MAMA-Typen sie begeistert befürworteten.",Jeffrey Epstein sigue causando problemas a Donald Trump,"Su administración no puede sacudir los rumores de un encubrimiento, en parte porque los tipos de MAGA lo apoyaron con entusiasmo",Jeffrey Epstein continue de causer des ennuis à Donald Trump,"Son administration ne peut pas ébranler les rumeurs d'une dissimulation, en partie parce que les MAGA l'approuvent avec enthousiasme.",Jeffrey Epstein还在给Donald Trump造成麻烦,部分是因为MAGA的风格热情支持。
49,What went wrong in the Texas floods?,DOGE may not have been to blame but local politicians have a case to answer,Was ist bei den Überschwemmungen in Texas schief gelaufen?,"DOGE war vielleicht nicht schuld, aber lokale Politiker haben einen Fall zu beantworten",¿Qué salió mal en las inundaciones de Texas?,"DOGE puede no haber sido la culpa, pero los políticos locales tienen un caso para responder",Qu'est-ce qui s'est passé dans les inondations du Texas ?,"DOGE n'a peut-être pas été à blâmer, mais les politiciens locaux ont un cas à répondre",在德州洪水中出了什么问题?,"DOGE可能没有被责怪,"
50,American men are hungry for injectable testosterone,A legion of new health clinics are serving it up,Amerikanische Männer sind hungrig nach injizierbaren Testosteron,Eine Legion neuer Kliniken dient ihr,Los hombres americanos tienen hambre de testosterona inyectable,Una legión de nuevas clínicas de salud lo están atendiendo.,Les hommes américains ont faim de testostérone injectable,Une légion de nouveaux dispensaires le servent.,美国男人渴望注射睾丸激素,一批新保健诊所正在为其提供服务
51,Trump embarrasses the Pentagon with a U-turn on Ukraine,His decision to resume arms shipments is a victory for common sense—while it lasts,Trump blamiert das Pentagon mit einem U-Turn gegen die Ukraine,"Seine Entscheidung, Waffenlieferungen wieder aufzunehmen, ist ein Sieg für den gesunden Menschenverstand – während sie anhält",Trump avergüenza al Pentágono con un giro en U contra Ucrania,"Su decisión de reanudar los envíos de armas es una victoria para el sentido común, mientras dure",Trump embarrasse le Pentagone avec un demi-tour sur l'Ukraine,"Sa décision de reprendre les livraisons d'armes est une victoire pour le bon sens, alors qu'elle dure",特朗普让五角大五角大楼难堪 用U回合乌克兰,"他决定恢复武器运输的决定是常识的胜利,尽管它持续至今"
52,ICE’s big payday makes mass deportation possible,What the controversial agency will do with even more funding,ICEAs großer Zahltag macht Massenabschiebung möglich,Was die umstrittene Agentur mit noch mehr Finanzierung machen wird,El gran día de pago del ICE hace posible la deportación masiva,Lo que hará la polémica agencia con aún más financiación,Le gros salaire de l'ICE rend possible la déportation massive,Ce que l'organisme controversé fera avec encore plus de financement,ICE的大发工资日使得大规模驱逐出境成为可能,争议机构会用更多资金做什么?
53,The War Room newsletter: Why America is denying Ukraine weapons,,The War Room newsletter: Warum Amerika die Waffen der Ukraine verweigert,,El boletín de War Room: Por qué Estados Unidos niega armas a Ucrania,,The War Room newsletter: Pourquoi l'Amérique refuse les armes à l'Ukraine,,《战争室通讯》通讯:为什么美国拒绝向乌克兰提供武器,
54,What becomes of Republicans who cross King Donald?,"We analysed 52,792 social-media posts to find out","Was wird aus Republikanern, die König Donald übertreten?","Wir analysierten 52.792 Social-Media-Posten, um herauszufinden,",¿Qué pasa con los republicanos que cruzan al rey Donald?,Analizamos 52.792 publicaciones en redes sociales para averiguar,Que deviennent les républicains qui croisent le roi Donald ?,Nous avons analysé 52 792 postes de médias sociaux pour en savoir plus,跨过唐纳德国王的共和党人会怎么样?,"我们分析了52,792个社会媒体文章,"
55,Top Ukrainian spy gunned down in Kyiv ambush attack: report,"A top spy from Ukraine&apos;s Security Service was fatally shot outside a building in Kyiv, with one official blaming the brazen attack on Russian operatives.",Top Ukrainische Spionin bei Angriff auf den Hinterhalt von Kiew erschossen: Bericht,"Ein Top-Spion aus Ukraine & Apos;s Security Service wurde tödlich vor einem Gebäude in Kiew erschossen, mit einem offiziellen Schuldzuweisung der dreist Angriff auf russische Aktivisten.",Top espía ucraniano asesinado a tiros en ataque de emboscada de Kiev: informe,"Un alto espía de Ukraine&apos;s Servicio de Seguridad fue fatalmente disparado fuera de un edificio en Kiev, con un oficial culpando el ataque descarado a los operativos rusos.",Haut de page L'espion ukrainien abattu à Kiev attaque d'embuscade: rapport,"Un espion d'Ukraine a été abattu à l'extérieur d'un bâtiment à Kiev, et l'un d'eux a accusé les membres russes de l'attaque.",在基辅伏击袭击中被枪杀的乌克兰顶尖间谍:报告,"乌克兰和阿波斯的顶级间谍在基辅的一栋大楼外被致命枪击身亡,"
56,Father and son drown in Lake Michigan during weekend family boating trip tragedy,Illinois residents David Meneou and his son Jameson drowned in Lake Michigan during a boating trip when their game of catch led to struggles in deep water.,Vater und Sohn ertrinken in Lake Michigan am Wochenende Familie Bootsfahrt Tragödie,"Die Einwohner von Illinois David Meneou und sein Sohn Jameson ertranken im Lake Michigan während einer Bootsfahrt, als ihr Fangspiel zu Kämpfen im tiefen Wasser führte.",Padre e hijo se ahogan en el lago Michigan durante el fin de semana familia viaje en barco tragedia,Los residentes de Illinois David Meneou y su hijo Jameson se ahogaron en el lago Michigan durante un viaje en barco cuando su juego de captura llevó a luchas en aguas profundas.,Père et fils se noient dans le lac Michigan pendant le week-end voyage de navigation familiale tragédie,Les résidents de l'Illinois David Meneou et son fils Jameson se sont noyés dans le lac Michigan lors d'un voyage en bateau quand leur jeu de capture a mené à des luttes en eau profonde.,父亲和儿子在周末家庭划船旅行悲剧中淹死在密歇根湖,"伊利诺伊州居民David Meneou和他的儿子Jameson在一次划船旅行中淹死在密歇根湖,当时他们的钓鱼游戏导致深水挣扎。"
57,American tennis star Amanda Anisimova upsets world No 1 Aryna Sabalenka to advance to Wimbledon final,American tennis star Amanda Anisimova defeated world No. 1-ranked Aryna Sabalenka in three grueling sets to advance to the Wimbledon finals.,"Der amerikanische Tennisstar Amanda Anisimova ärgert die Welt Nr. 1 Aryna Sabalenka, um zum Wimbledon-Finale vorzudringen","Der amerikanische Tennisstar Amanda Anisimova besiegte die Welt Nr. 1 in drei erbitterten Sätzen, um zum Wimbledon-Finale zu gelangen.",La estrella de tenis estadounidense Amanda Anisimova molesta al mundo No 1 Aryna Sabalenka para avanzar a la final de Wimbledon,La estrella estadounidense de tenis Amanda Anisimova derrotó al mundo No. 1 a Aryna Sabalenka en tres agotadores sets para avanzar a la final de Wimbledon.,"Amanda Anisimova, star du tennis américain, bouleverse le monde No 1 Aryna Sabalenka pour avancer vers la finale de Wimbledon",La star américaine du tennis Amanda Anisimova a battu le monde numéro 1 d'Aryna Sabalenka en trois sets épuisants pour avancer vers la finale de Wimbledon.,美国网球明星阿曼达·阿尼西莫娃(Amanda Amanda Anisimova)扰乱了阿尔纳·萨巴伦卡一号世界 向温布尔登决赛前进,"美国网球明星阿曼达·阿尼西莫娃击败了世界一号,"
58,Pro-Trump 'troll' who spread Hillary text-to-vote memes in 2016 has conviction tossed by appeals court,"The decision is a win for Douglass Mackey, a self-proclaimed &quot;troll&quot; who used his Twitter handle to spread false information in 2016 — and who is now threatening to sue for his conviction.","Pro-Trump 'troll', die Hillary Text-zu-Abstimmung Memes im Jahr 2016 verbreitet hat Verurteilung geworfen durch Berufungsgericht","Die Entscheidung ist ein Sieg für Douglass Mackey, einen selbsternannten &quot;troll&quot; der 2016 seinen Twitter-Handle benutzte, um falsche Informationen zu verbreiten – und der nun droht, seine Überzeugung zu verklagen.",Pro-Trump 'troll' que difundió a Hillary texto para votar memes en 2016 ha sido condenado por la corte de apelaciones,"La decisión es una victoria para Douglass Mackey, un autoproclamado &quot;troll&quot; que utilizó su manija de Twitter para difundir información falsa en 2016 — y que ahora está amenazando con demandar por su condena.",Pro-Trump 'troll' qui a répandu Hillary SMS-to-vote memes en 2016 a une condamnation jetée par la cour d'appel,"La décision est une victoire pour Douglass Mackey, un autoproclamé &quot;troll&quot; qui a utilisé sa poignée Twitter pour diffuser de fausses informations en 2016 — et qui menace maintenant de poursuivre pour sa condamnation.",2016年传播希拉里文字至投票模式的 Pro-Trump “troll” 被上诉法院推翻,"这个决定是道格拉斯·麦基(Douglas Mackey)的胜利, 他是一个自封的 & qut;troll & quot; 他在2016年使用Twitter手柄散布虚假信息,"
59,Idaho judge urged to remove gag order on Kohberger case following quadruple murder plea,"Bryan Kohberger admitted to killing four Idaho students, prompting media organizations to request removal of the non-dissemination order limiting case information since 2022.","Idaho Richter aufgefordert, Gag Befehl auf Kohberger Fall nach Vierfach-Mord-Plädoyer zu entfernen","Bryan Kohberger gab zu, vier Idaho-Studenten zu töten und forderte Medienorganisationen auf, die Aufhebung der Nichtverbreitungsverordnung zu beantragen, die die Fallinformationen seit 2022 begrenzt.",Juez Idaho instó a eliminar la orden mordaza en el caso Kohberger después de cuádruple declaración de asesinato,"Bryan Kohberger admitió haber matado a cuatro estudiantes de Idaho, lo que llevó a las organizaciones de medios a solicitar la eliminación de la orden de no difusión que limitaba la información del caso desde 2022.",Le juge Idaho a exhorté à retirer l'ordonnance de gag sur l'affaire Kohberger suite à un plaidoyer de meurtre quadruple,"Bryan Kohberger a admis avoir tué quatre étudiants de l'Idaho, incitant les organisations de médias à demander le retrait de l'ordonnance de non-diffusion limitant l'information sur les cas depuis 2022.",Idaho法官敦促在四重谋杀答辩后撤销对Kohberger案的封口命令,"Bryan Kohberger承认杀害了四名Idaho学生,促使媒体组织要求撤销自2022年以来限制案件信息的非传播令。"
60,Israeli Columbia professor leaves school over failure to address anti-Israel protests,Columbia Business School professor Shai Davidai confirmed to Fox News Digital that he has left the school after ongoing anti-Israel protests on campus.,Israelisch-Kolumbien-Professor verlässt die Schule wegen Nichtbewältigung von Anti-Israel-Protesten,"Der Columbia Business School Professor Shai Davidai bestätigte Fox News Digital, dass er die Schule nach andauernden Anti-Israel-Protesten auf dem Campus verlassen habe.",Profesor de Columbia Israelí deja la escuela por no hacer frente a las protestas contra Israel,"El profesor de la Escuela de Negocios de Columbia, Shai Davidai, confirmó a Fox News Digital que dejó la escuela después de las protestas contra Israel en el campus.",Le professeur israélien de Colombie quitte l'école pour ne pas avoir répondu aux protestations anti-israéliennes,Le professeur de Columbia Business School Shai Davidai a confirmé à Fox News Digital qu'il avait quitté l'école après les manifestations anti-israéliennes en cours sur le campus.,以色列哥伦比亚大学教授因未能解决反以色列抗议而离校,"哥伦比亚商学院教授Shai Davidai向Fox News Digital证实, 校内反以色列抗争后,"
61,"Texas suspect who damaged ICE vehicle, ‘aggressively pursued’ agents is arrested: police","The Harris County Precinct 4 Constable&apos;s Office helped arrest Sergio Olivares, a suspect accused of damaging and chasing an ICE vehicle in the Houston area.","Texas Verdächtiger, der ICE-Fahrzeug beschädigt, „aggressiv verfolgte Agenten wird verhaftet: Polizei","Das Harris County Precinct 4 Constable&apos;s Büro half bei der Verhaftung von Sergio Olivares, einem Verdächtigen, der beschuldigt wurde, ein ICE-Fahrzeug in Houston zu beschädigen und zu jagen.","Texas sospecha que dañó el vehículo del ICE, agentes ‘perseguidos agresivamente’ son arrestados: policía","La Oficina del Inspector 4 del Condado Harris ayudó a arrestar a Sergio Olivares, un sospechoso acusado de dañar y perseguir un vehículo del ICE en el área de Houston.","Le suspect du Texas qui a endommagé le véhicule ICE, «les agents poursuivis agressivement» est arrêté: la police","Le bureau de la police du comté de Harris 4 a aidé à arrêter Sergio Olivares, un suspect accusé d'avoir endommagé et poursuivi un véhicule ICE dans la région de Houston.","德克萨斯州嫌犯损坏ICE车辆, "" 侵略追逐 "" 特工被逮捕:警察",哈里斯县第4分局 4 Constable&apos;s Office 帮助逮捕了Sergio Olivares。 Sergio Olivares是被控在休斯顿地区损坏和追逐ICE车辆的嫌疑人。
62,"Federal judge blocks Trump's birthright citizenship ban for all infants, testing lower court powers","U.S. District Judge Joseph LaPlante issued a preliminary injunction against Trump&apos;s birthright citizenship ban, ruling that deprivation of citizenship would create irreparable harm.","Bundesrichter blockiert Trumps Geburtsrecht Staatsbürgerschaft Verbot für alle Säuglinge, Prüfung unteren Gerichtsgewalten","Der US-Bezirksrichter Joseph LaPlante erließ eine einstweilige Verfügung gegen Trump&apos; das Verbot der Geburtsrecht-Einbürgerung, wonach die Entziehung der Staatsbürgerschaft irreparablen Schaden verursachen würde.","El juez federal bloquea la prohibición de ciudadanía por derecho de nacimiento de Trump para todos los bebés, poniendo a prueba los poderes de los tribunales inferiores","El juez de distrito Joseph LaPlante emitió una orden preliminar contra Trump&apos; la prohibición de la ciudadanía por derecho de nacimiento, dictaminando que la privación de la ciudadanía crearía un daño irreparable.","Le juge fédéral bloque l'interdiction de citoyenneté de Trump pour tous les nourrissons, testant les pouvoirs de la cour inférieure","Le juge de district américain Joseph LaPlante a émis une injonction préliminaire à l'encontre de Trump&apos; l'interdiction de la citoyenneté fondée sur le droit d'aînesse, en concluant que la privation de la citoyenneté causerait un préjudice irréparable.","联邦法官封锁特朗普禁止所有婴儿享有出生权公民权的禁令,测试下级法院的权力","美国区法官Joseph Laplante对Trump&apos发出初步禁止令;禁止出生权公民权,裁定剥夺公民权会造成不可弥补的伤害。"
63,Hugh Grant falls asleep at Wimbledon tennis match while seated behind Queen Camilla,"While attending the 2025 Wimbledon Championships on Wednesday, Hugh Grant seemingly took a nap during a major match.","Hugh Grant schläft beim Wimbledon Tennis Match ein, während er hinter Königin Camilla sitzt.",Während der Wimbledon Championships 2025 am Mittwoch machte Hugh Grant scheinbar ein Nickerchen während eines großen Spiels.,Hugh Grant se duerme en el partido de tenis de Wimbledon mientras está sentado detrás de la reina Camilla,"Mientras asistía al Campeonato de Wimbledon 2025 el miércoles, Hugh Grant aparentemente tomó una siesta durante un gran partido.",Hugh Grant s'endort au match de tennis Wimbledon tout en étant assis derrière la reine Camilla,"En participant aux Championnats de Wimbledon 2025 mercredi, Hugh Grant a apparemment fait une sieste lors d'un match majeur.",休·格兰特在温布顿网球比赛上睡着了 坐在卡米拉皇后身后,"Hugh Grant在参加2025年温布尔登锦标赛时,"
64,Manhunt for suspected Washington killer dad goes cold in Idaho after false alarm sighting,"The search for Travis Decker, accused of killing his three daughters, continues after a false sighting in Idaho&apos;s Sawtooth National Forest, with U.S. Marshals offering a $20,000 reward.",Verfolgung wegen Verdachts Washington Killer Dad geht kalt in Idaho nach falschen Alarm Sichtung,"Die Suche nach Travis Decker, der beschuldigt wird, seine drei Töchter getötet zu haben, geht weiter nach einer falschen Sichtung in Idaho&apos;s Sawtooth National Forest, wobei US-Marshals eine Belohnung von 20.000 Dollar anbieten.",Búsqueda de sospechosos de asesinato en Washington papá se enfría en Idaho después de falsa alarma avistamiento,"La búsqueda de Travis Decker, acusado de matar a sus tres hijas, continúa después de un falso avistamiento en Idaho&apos; Sawtooth National Forest, con los marshals estadounidenses ofreciendo una recompensa de 20.000 dólares.",Manhunt pour suspecté Washington tueur papa va froid en Idaho après fausse alerte a vue,"La recherche de Travis Decker, accusé d'avoir tué ses trois filles, se poursuit après une fausse observation à Idaho&apos;s Sawtooth National Forest, avec des marshals américains offrant une récompense de 20 000 $.",被怀疑为华盛顿杀人凶手的追捕 父亲在看到假警报后在爱达荷州寒冷,"在Idaho&apos;s Sawtouth National Forest, 美国元帅悬赏20,000美元。"
65,"Noem warns of ‘unprecedented’ threat level for ICE agents, blames 'lies' from Democrats","DHS Secretary Kristi Noem called out ‘unprecedented’ violence against ICE agents, blaming inflamed rhetoric from Democratic leaders.","Noem warnt vor ""unvorhergesehenen"" Bedrohungslevel für ICE-Agenten, Schuld ""Lügen"" von Demokraten","DHS-Sekretärin Kristi Noem rief „unvorhergesehene"" Gewalt gegen ICE-Agenten hervor, die entflammte Rhetorik von demokratischen Führern beschuldigte.","Noem advierte del nivel de amenaza “sin precedentes” para los agentes del ICE, culpa a las “mentiras” de los demócratas","El secretario del DHS, Kristi Noem, llamó a la violencia ‘sin precedentes’ contra los agentes del ICE, culpando a los líderes demócratas de la retórica inflamada.","Noem met en garde contre le «niveau de menace sans précédent» pour les agents de l'ICE, blâme les «lies» des démocrates","Kristi Noem, secrétaire du DHS, a appelé à la « violence sans précédent » contre les agents de l'ICE, blâmant la rhétorique enflammée des dirigeants démocrates.","Noem 警告ICE代理“前所未闻”的威胁程度,","人口与健康部秘书Kristi Noem 大声疾呼「前所未闻的」针对ICE特工的暴力,"
66,Hiker dies on iconic Arizona park trail during extreme summer heat,"Grand Canyon National Park reports a 67-year-old man&apos;s death on South Kaibab Trail amid sweltering temperatures, despite CPR attempts by passersby and park medical personnel.",Hiker stirbt während der extremen Sommerhitze auf dem ikonischen Arizona Park Trail,"Der Grand Canyon National Park berichtet von einem 67-jährigen Man&apos, dem Tod auf dem South Kaibab Trail inmitten swelternder Temperaturen, trotz CPR-Versuche von Passanten und Parkärzten.",El excursionista muere en el icónico sendero del parque de Arizona durante el calor extremo del verano,"El Parque Nacional del Gran Cañón reporta la muerte de un hombre y apos de 67 años en South Kaibab Trail en medio de temperaturas sofocantes, a pesar de los intentos de RCP de los transeúntes y el personal médico del parque.",Hiker meurt sur l'emblématique sentier du parc de l'Arizona pendant la chaleur extrême de l'été,"Le parc national du Grand Canyon signale la mort d'un homme de 67 ans sur le sentier Kaibab du sud, malgré les températures stérilisantes, malgré les tentatives faites par les passants et le personnel médical du parc.",在极夏热中 在亚利桑那州的标志性公园小道上死亡,"大峡谷国家公园报告说,尽管路人和公园医疗人员试图进行抗逆转录病毒治疗,但67岁的男子和老人在南开拜巴特雷尔死亡,气温混乱。"
67,Mamdani lands endorsement of a top Cuomo backer in NYC mayoral primary,"Rep. Adriano Espaillat endorses Zohran Mamdani for NYC mayor in a setback for Andrew Cuomo, who previously received the influential congressman&apos;s support in the Democratic primary.",Mamdani landet Billigung eines Top Cuomo Backer in NYC bürgermeisterlichen Primary,"Rep. Adriano Espaillat unterstützt Zohran Mamdani als Bürgermeister von NYC in einem Rückschlag für Andrew Cuomo, der zuvor den einflussreichen Kongressabgeordneten&apos erhielt;s Unterstützung im demokratischen Primär.",Mamdani apoya el apoyo de un patrocinador superior de Cuomo en la primaria de la alcaldía de Nueva York,"El representante Adriano Espaillat apoya a Zohran Mamdani para alcalde de Nueva York en un revés para Andrew Cuomo, quien previamente recibió el influyente congresista &apos;s apoyo en la primaria demócrata.",Mamdani a l'approbation d'un haut soutien Cuomo à New York Mayoral primaire,"Adriano Espaillat soutient Zohran Mamdani pour le maire de NYC dans un revers pour Andrew Cuomo, qui a reçu auparavant l'appui influent du député et des députés dans le primaire démocratique.",Mamdani土地认可纽约市市长一级选举的一位顶尖的Cuomo支持者,"Adriano Espailat支持Zohran Mamdani为纽约市市长竞选,"
