,title-de,content-de,title-en,content-en,title-zh,content-zh
0,Corona-Maskenaffäre: Grüne fordern Untersuchungsausschuss,"Hat die deutsche Bundesregierung zu Beginn der Corona-Pandemie unnötig viel Geld für die Beschaffung von FFP2-Masken ausgegeben? Die Grünen fordern Aufklärung, nachdem ein Untersuchungsbericht nun komplett bekannt ist.",Corona mask affair: Greens call for committee of inquiry,"At the beginning of the Corona pandemic, has the German federal government spent an unnecessarily large amount of money on the procurement of FFP2 masks? The Greens demand clarification after a study report is now fully known.",Corona Mascanatic: Green is asking investigating investigation committee committee.,"科罗纳大流行时,德国联邦政府花大笔钱买燃料弹头了吗? 绿党要求了解情况,因为调查报告已经全面公布了"
1,Corona: Ex-Minister Jens Spahn und die Maskenaffäre,"FFP2-Masken besorgen, koste es, was es wolle - so verfuhr die deutsche Regierung zu Beginn der Covid-Pandemie. Der Versuch, Geschäfte rückgängig zu machen, hat juristische Folgen. Es könnte noch sehr teuer werden.",Corona: ex-minister Jens Spahn and the masquerade affair,Getting FFP2 masks at all costs - so the German government did at the beginning of the Covid pandemic. The attempt to reverse business has legal consequences. It could still be very expensive.,Corona: 前部长Jens Spash 和化妝师.,"德国政府在科维德大流行时就失败了,试图撤消交易,结果会造成法律后果. 可能会付出非常昂贵的代价."
2,Corona: Warum das Virus Deutschland weiter spaltet,Selten haben Anordnungen und Verbote die Gesellschaft in Deutschland so polarisiert wie in der Corona-Pandemie. Experten und Politiker fordern eine Aufarbeitung.,Corona: Why the virus continues to split Germany,Rarely have orders and prohibitions polarized society in Germany as much as in the Corona pandemic. Experts and politicians call for a revision.,科罗娜:为什么病毒会继续分裂德国?,德国的指令和禁令很少能像科罗纳大流行那样分化社会. 专家和政客要求进行升级.
3,Türkei: Erneut Festnahmen von oppositionellen Bürgermeistern,Die türkische Justiz geht weiter gegen Mitglieder der größten Oppositionspartei vor. Drei Bürgermeister von der sozialdemokratischen CHP wurden festgenommen. Kritiker sprechen von einer gezielten Kampagne.,Turkey: Once again arrests of opposition mayors,Turkish justice continues against members of the largest opposition party. Three mayors of the Social Democratic CHP were arrested. Critics speak of a targeted campaign.,土耳其:重新逮捕议员市长,土耳其司法部门继续对主要反对党成员进行审判. 社会民主党党的三名市长被逮捕了. 批评者说有针对性的竞选活动.
4,Trump zeigt sich für neue Russland-Sanktionen offen,Noch in den vergangenen Monaten war der US-Präsident auf Kemlchef Putin zugegangen. Doch nun gibt sich Donald Trump wegen des russischen Angriffskriegs gegen die Ukraine zunehmend verstimmt.,Trump is open to new Russia sanctions,"In recent months, the US President had approached Kemlchef Putin, but now Donald Trump is increasingly displeased by the Russian war of aggression against Ukraine.",特朗普公开支持新的俄罗斯制裁计划,"在过去几个月里,美国总统一直对普京进行攻击,但现在唐纳德·特朗普因为俄罗斯对乌克兰的侵略而越来越生气."
5,Mindestens 24 Tote nach Sturzflut in Texas,Überschwemmungen sind am Fluss Guadalupe im Süden der USA nichts Ungewöhnliches. Ein Unwetter hat nun aber eine verheerende Flut ausgelöst. Mehr als 20 Kinder werden vermisst.,At least 24 dead after flood in Texas,"Floods are not unusual on the Guadalupe River in the south of the USA. However, a storm has now triggered a devastating flood. More than 20 children are missing.",德州大洪水后至少死了24人,美国南部瓜达卢普河的洪水并不罕见. 暴风雪已经席卷了一场灾难. 超过20名儿童失踪.
6,News kompakt: Trump setzt umstrittenes Steuergesetz in Kraft,"Nach langem Ringen mit dem US-Kongress hat Präsident Donald Trump die sogenannte ""Big Beautiful Bill"" unterzeichnet. In Texas haben starke Regenfälle eine tödliche Sturzflut ausgelöst. Das Wichtigste in Kürze.",News compact: Trump implements controversial tax law,"After long struggles with the US Congress, President Donald Trump signed the so-called ""Big Beautiful Bill"". In Texas, heavy rains have caused a deadly flood.",新闻报道: 特朗普实施了争议性税法,"经过美国国会长期的争论,唐纳德·特朗普总统签署了所谓的""大美女比尔"". 在德克萨斯州,大雨席卷了一场大洪水. 最重要的是,即将到来."
7,IAEA: Atominspektoren haben Iran verlassen,Der Iran drohte schon seit längerem mit Konsequenzen wegen der Angriffe auf seine Atomanlagen. Die Kooperation mit den UN-Atomwächtern wurde auf Eis gelegt. Nun verlassen die internationalen Experten das Land.,IAEA: Atomic inspectors have left Iran,Iran has been threatening consequences for a long time because of the attacks on its nuclear facilities. Cooperation with the UN nuclear guards has been put on hold. Now the international experts are leaving the country.,国际原子能机构:核子调查员已离开伊朗,伊朗长期以来一直威胁要对其核设施进行攻击. 与联合国核防爆队的合作被冻结了. 国际专家们正在离开这个国家.
8,Warum beharrt der Iran auf seinem Atomprogramm?,"Der Iran setzt die Kooperation mit der Internationalen Atomenergiebehörde aus. Seit 1958 Mitglied der IAEA, betrachtet Teheran sein Atomprogramm als Symbol für Stärke, Unabhängigkeit und nun politisches Überleben.",Why does Iran insist on its nuclear program?,"Iran suspends cooperation with the International Atomic Energy Agency. Since 1958, a member of the IAEA, Tehran has seen its nuclear program as a symbol of strength, independence and now political survival.",为什么伊朗坚持他的核计划?,"伊朗停止与国际原子能机构合作. 自1958年以来,德黑兰一直把他的核计划视为强势,独立以及政治生存的象征."
9,Kroatien: 500.000 Zuschauer für rechtsextremen Sänger,"An diesem Samstag soll in Zagreb das größte Einzelkonzert in der Geschichte Europas stattfinden: Eine halbe Million Karten für den Auftritt des rechtsextremen Popstars Marko Perkovic alias ""Thompson"" wurden verkauft.","Croatia: 500,000 spectators for far-right singers","This Saturday the biggest single concert in the history of Europe will take place in Zagreb: half a million tickets for the performance of the far-right pop star Marko Perkovic alias ""Thompson"" were sold.",克罗地亚:50万观众为极右翼歌手.,本周六在扎格勒布举行欧洲历史上最大的一次独家演唱会:50万张欧洲极右翼流行歌手马科·佩克维克的演出票被卖出.
10,Russland erkennt als erstes Land die Taliban-Regierung in Afghanistan an,Russland hat als erstes Land weltweit die Taliban-Regierung in Afghanistan offiziell anerkannt. Dieser Schritt wertet die radikale Gruppe auf der internationalen Bühne auf und setzt den Westen unter Zugzwang.,Russia is the first country to recognise the Taliban government in Afghanistan,"Russia is the first country in the world to officially recognise the Taliban government in Afghanistan, a step that upgrades the radical group on the international stage and forces the West to move forward.",俄罗斯是第一个承认塔利班在阿富汗政府的国家,"俄罗斯是世界上第一个正式承认阿富汗塔利班政府的国家. 这一步让激进分子在国际舞台上高估了国际舞台上的激进势力,迫使西方屈服."
11,Südostasien: Das blühende Geschäft mit Methamphetamin,Der Handel mit Methamphetamin und synthetischen Drogen in Südostasien explodiert. Das Ausmaß der Krise zeigt sich auch an den immer größeren Mengen beschlagnahmter Drogen.,Southeast Asia: The thriving business of methamphetamine,"Trade in methamphetamine and synthetic drugs is exploding in Southeast Asia, and the scale of the crisis is also reflected in the ever-increasing quantities of seized drugs.",东南亚: 毒品交易的繁荣.,东南亚的冰毒和合成毒品的交易正在爆炸. 这场危机的规模也显示出被没收的毒品数量日增.
12,Drohnenabwehr in Deutschland: Dobrindt setzt auf Hightech,Er ist für die Sicherheit in Deutschland zuständig. Drohnen-Anschläge will der deutsche Innenminister Alexander Dobrindt mit High Tech verhindern. Ein Besuch beim Bundeskriminalamt (BKA).,Drone defense in Germany: Dobrindt relies on high-tech,He is responsible for security in Germany. The German Interior Minister Alexander Dobrindt wants to prevent drone attacks with High Tech. A visit to the Federal Criminal Office (BKA).,德国的无人机防御系统: 杜布赖特在高科技方面很可靠,他负责德国的安全. 德国国务卿杜布里特 (Alexander Dobridt) 的无人机袭击是为了防止高科技的爆炸. 访问了联邦犯罪组织 (BKA) .
13,Historischer Gipfel: Die EU tagt in Moldau,"Die Republik Moldau gilt als Putins nächstes Kriegsziel. Nun hält die EU in der Hauptstadt Chisinau erstmals ein Gipfeltreffen ab - ein Signal, das Land enger anzubinden. Wird Rumäniens Nachbar bald Unionsmitglied?",Historical Summit: EU meets in Moldova,The Republic of Moldova is considered Putin's next war goal. Now the EU is holding a summit in the capital Chisinau for the first time - a signal to tie the country closer. Will Romania's neighbour soon join the Union?,希斯多尔峰会: 欧盟在摩尔多瓦举行会议.,摩尔多瓦共和国被视为普京下一个战争目标. 现在欧盟首次在基西诺举行首脑会议 - - 这是让国家更加紧密的信号. 罗马尼亚的邻国会很快成为联盟成员吗?
14,Wie Kriegs-Influencer zu Gewalt in Somalia anstacheln,"Von Deutschland aus verbreiten somalische Influencer Hass und Hetze im Internet, rufen zu Gewalt auf und sammeln Geld für Waffen, so eine exklusive Recherche von DW und ARD.",How War Influencers Stimulate Violence in Somalia,"From Germany, Somali influencers spread hatred and incitement on the Internet, call for violence and collect money for weapons, according to an exclusive research by DW and ARD.",像煽动索马里内战的侵略者一样 煽动索马里国内的暴力,"从德国传播索马里仇恨和愤怒,在互联网上煽动暴力,为武器筹集资金,这是对DW和ARD的独家调查"
15,"Geflüchtet, verletzt, vergessen: Alltag im polnisch-belarussischen Grenzwald","Seit vier Jahren versucht Polen an seiner Grenze zu Belarus mit allen Mitteln, Flüchtlinge bei der Einreise in die EU stoppen. Die humanitären Folgen sind fatal. Unterwegs im Grenzwald mit einer Flüchtlingshelferin.","Escaped, injured, forgotten: everyday life in the Polish-Belarusian border forest","For four years, Poland has been trying to stop refugees entering the EU at its border with Belarus by all means. The humanitarian consequences are fatal. On the way in the border forest with a refugee helper.","被吓跑,受伤,被遗忘: 每天在波兰和比利时边境森林","四年来,波兰一直试图在白俄罗斯边境上以各种手段阻止难民入境欧盟. 人道主义后果是致命的."
16,Ozzy Osbourne und die Rückkehr von Black Sabbath,"Am 5. Juli gibt Ozzy Osbourne mit Black Sabbath ein letztes Konzert in seiner Heimatstadt Birmingham. Ein Rückblick auf das wilde Leben des ""Prince of Darkness"", der im Alter seine weichen Seiten zeigt.",Ozzy Osbourne and the Return of Black Sabbath,"On July 5th, Ozzy Osbourne gives a last concert with Black Sabbath in his hometown of Birmingham. A review of the wild life of the Prince of Darkness, which shows its soft sides in old age.",Ozzy Osbourne 和黑色安息日的归来,"7月5日 Ozy Osbourne在伯明翰的故乡 举办了黑色安息日最后一场音乐会. 回顾了""黑暗公主""的狂野生活"
17,"Fünf Dinge, die man zur Tour de France 2025 wissen sollte",Die Tour de France geht an diesem Samstag in ihre 112. Auflage. Wie sieht die Strecke aus? Wer sind die Favoriten? Und wie ist die Situation im Hinblick auf Sicherheit und Doping?,Five things to know about the Tour de France 2025,This Saturday the Tour de France goes into its 112th edition. What does the route look like? Who are the favourites? And what is the situation with regard to safety and doping?,Francis de France 2025年巡演时应该知道五件事,周六的法国巡回演唱会将举行第112次发布. 路线如何? 谁最受欢迎?
18,Zur Bekanntgabe der offiziellen Auflösung von USAID durch US-Außenminister Marco Rubio erklärt Entwicklungsministerin Reem Alabali Radovan:,"„Über sechs Jahrzehnte hat USAID weltweit Menschen aus größter Armut befreit, Krankheiten zurückgedrängt, ganze Regionen stabilisiert und Demokratien gestärkt. Die Auflösung schmerzt nicht nur alle, die sich für Solidarität und Menschlichkeit in der Welt einsetzen, sie hat dramatische Folgen. Bis zu 14 Millionen Menschen könnte der abrupte Rückzug der USA aus der Entwicklungszusammenarbeit bis 2030 das Leben kosten, darunter 4,5 Millionen Kinder. (...)""","On the announcement of the official dissolution of USAID by US Secretary of State Marco Rubio, Development Minister Reem Alabali Radovan states:","""For more than six decades, USAID has freed people from the world's greatest poverty, pushed diseases back, stabilised entire regions and strengthened democracies. Dissolution is not only painful for all those working for solidarity and humanity in the world, it has dramatic consequences. Up to 14 million people could be killed by the abrupt withdrawal of the US from development cooperation by 2030, including 4.5 million children. (...)""",为了宣布美国国务卿Marco Rubio正式解散美国国务卿 宣布Reem Alabali Radovan:,"六十多年来,美国发展局已经从世界最大的贫困中解放出来,阻止了疾病蔓延,加强了整个区域的稳定和民主. 解散不仅伤害了全世界所有致力于团结和人类的人,而且造成巨大的后果. 到2030年,美国在发展合作方面的突然退出可能造成生命损失,其中包括450万儿童 (...) """
19,Kraftvoller Schub für internationale Zusammenarbeit und eine gerechtere Welt,"In Sevilla hat heute die 4. Konferenz der Vereinten Nationen für Entwicklungsfinanzierung begonnen. Auf Einladung von UN-Generalsekretär Guterres und der spanischen Präsidentschaft berät die Weltgemeinschaft, darunter rund 70 Staats- und Regierungschef*innen, über Wege zur Finanzierung des Kampfes gegen Armut und Hunger, für globale Gesundheit, Bildung, Geschlechtergerechtigkeit und Frieden.",Powerful push for international cooperation and a fairer world,"Today the 4th United Nations Conference on Financing for Development began in Seville. At the invitation of UN Secretary-General Guterres and the Spanish Presidency, the world community, including some 70 heads of state and government, advises on ways to finance the fight against poverty and hunger, global health, education, gender equality and peace.",为国际合作和更公正的世界提供有力的鼓励,"在塞维利亚,联合国第4次发展筹资会议今天开始. 联合国秘书长索特斯和西班牙总统邀请国际社会,包括70位国家元首和政府首脑,就如何为消除贫穷和饥饿,为全球卫生,教育,性别平等与和平提供资金."
20,Statement von Entwicklungsministerin Reem Alabali Radovan zur Unterzeichnung eines Friedensabkommens durch die Außenminister der Demokratischen Republik Kongo und Ruandas in Washington,"„Der Krieg im Ostkongo hat unvorstellbares Leid über die Menschen in der Region gebracht. Die Unterzeichnung des neuen Friedensvertrags ist ein wichtiger Schritt in eine friedvollere Zukunft für die Menschen in der Demokratischen Republik Kongo, in Ruanda und für die gesamte Region. Nun geht es darum, dass dieser Vertrag auch wirklich umgesetzt wird – dass die Waffen endlich schweigen, dass Gewalt, Vergewaltigungen, Vertreibung und Missbrauch ein Ende haben. Die leidgeprüfte Bevölkerung im Ostkongo muss ein Leben in Sicherheit, Gewaltfreiheit und Würde führen können. Wir werden die Umsetzung der Friedensvereinbarung genau verfolgen.""",Statement by Development Minister Reem Alabali Radovan on the signing of a peace agreement by the Foreign Ministers of the Democratic Republic of the Congo and Rwanda in Washington,"""The war in the East Congo has brought unimaginable suffering to the people of the region. The signing of the new peace treaty is an important step towards a more peaceful future for the people of the Democratic Republic of Congo, Rwanda and for the entire region. Now it is about the fact that this treaty is actually being implemented – that the weapons are finally silent, that violence, rape, expulsion and abuse have an end. The suffering-tested people in the East Congo must be able to lead a life in security, non-violence and dignity. We will closely follow the implementation of the peace agreement.""",刚果民主共和国外交部长和卢旺达外交部长 在华盛顿发表了关于签署和平协议的演讲.,"东北战争给该地区人民带来了难以想象的痛苦. 签署新和平条约是为刚果民主共和国,卢旺达和整个区域人民更和平的未来迈出的一大步. 现在,它正在真正地被执行,这些条约将不言而喻地结束暴力,强奸,流离失所和虐待行为. 东北克的苦难人民必须能够安全,自由和尊严地生活. 我们将密切关注和平协定的实施. """
21,Deutschland bleibt verlässlicher Partner bei der Bekämpfung von weltweiten Krankheiten,"Deutschland wird sich weiterhin für den weltweiten Schutz vor vermeidbaren Krankheiten einsetzen. Bei der heutigen Wiederauffüllungskonferenz der Impfallianz Gavi in Brüssel kündigt Entwicklungsministerin Reem Alabali Radovan an, insgesamt 600 Millionen Euro bis 2030 zur Verfügung zu stellen.",Germany remains a reliable partner in the fight against global diseases,"Germany will continue to promote global protection against preventable diseases. At today's Gavi Impfallianz replenishment conference in Brussels, development minister Reem Alabali Radovan announces that she will make a total of EUR 600 million available by 2030.",德国在应对全球疾病方面依然是可靠的伙伴,"德国将继续致力于在全球范围内防治可预防的疾病. 在今天的布鲁塞尔防灾戈威会议上,发展部长雷姆·阿拉巴利·拉多万 (Reem Alabali Radovan) 宣布到2030年将提供6亿欧元."
22,Haushaltsentwurf 2025: Deutschland bleibt verlässlicher Partner in der globalen Zusammenarbeit,"Der heute im Kabinett beschlossene Haushaltsentwurf sieht einen Ansatz von 10,3 Milliarden Euro für den Etat des Entwicklungsministeriums im Jahr 2025 vor. Dazu sagt Ministerin Alabali Radovan: „Deutschland bleibt verlässlicher Partner für wirtschaftliche Zusammenarbeit und Entwicklung in der Welt. Das ist angesichts der extremen globalen Herausforderungen, Krisen und Kriege für Millionen von Menschen von existenzieller Bedeutung. (...)""",Draft budget 2025: Germany remains a reliable partner in global cooperation,"The draft budget adopted today in the cabinet provides for an approach of 10.3 billion euros for the budget of the Ministry of Development in 2025. Minister Alabali Radovan says: ""Germany remains a reliable partner for economic cooperation and development in the world. This is important for millions of people of existential importance in view of the extreme global challenges, crises and wars. (...)""",2025年拟议预算:德国仍然是可靠的全球合作伙伴.,"今天在内阁内通过的预算草案为发展部2025年预算提供了1030亿欧元的预算. 此外,国务卿阿拉巴利·拉多万说:德国依然是世界经济合作和发展的可靠伙伴. 面对全球的极端挑战,危机和战争,为数以百万计的生存重要人士提供战争. (...)"
23,Entwicklungsministerin Alabali Radovan: „Gerade jetzt dürfen wir Gaza nicht aus den Augen verlieren.“,"Entwicklungsministerin Reem Alabali Radovan hat heute den Chef des UN-Hilfswerks für Palästinaflüchtlinge (UNRWA) Philippe Lazzarini getroffen. An dem Treffen, das im Ministerium in Berlin stattfand, nahm auch Staatssekretär Niels Annen teil.  Im Zentrum des Gesprächs standen die Lage in Gaza und die eingeschränkte humanitäre Unterstützung der Menschen vor Ort. Darüber hinaus sprach die Ministerin die Fortschritte bei den Reformen an, zu denen sich das Hilfswerk wegen des Vorwurfs mangelnder Neutralität verpflichtet hat.","Development Minister Alabali Radovan: ""Right now we must not lose sight of Gaza.","Development Minister Reem Alabali Radovan met today the head of the UN Relief Agency for Palestine Refugees (UNRWA) Philippe Lazzarini. State Secretary Niels Annen also attended the meeting, which took place at the Ministry in Berlin. At the center of the discussion were the situation in Gaza and the limited humanitarian support of the people on the ground. In addition, the Minister spoke about the progress made in the reforms to which the relief agency committed itself because of the lack of neutrality.","发展部长阿拉巴利·拉多万: 现在,我们不能失去加沙.","发展部长雷姆·阿拉巴利·拉多万 今天与联合国巴勒斯坦难民救济和工程处 (UNIKA) 的首席执行官会面. 在柏林的会议中,部长尼尔斯·安恩也参加了. 会谈的核心是加沙的局势以及当地民众的人道主义支持有限. 此外,部长还提到了工程处对缺乏中立性的指控所承诺的改革进展."
24,Statement von Entwicklungsministerin Reem Alabali Radovan zu dem Anschlag in Damaskus am 22. Juni,"„Ich verurteile den Anschlag auf betende Gläubige in der Mar Elias Kirche in Damaskus aufs Schärfste. Diese feige Tat ist ein Anschlag auf die gesellschaftliche Vielfalt Syriens. Das Entwicklungsministerium unterstützt den Wiederaufbau und den gesellschaftlichen Zusammenhalt Syriens. Diese Arbeit ist wichtiger denn je. Der Wiederaufbau muss zu schnellen Ergebnissen führen, um Radikalen den Nährboden zu entziehen.“",Statement by Development Minister Reem Alabali Radovan on the attack in Damascus on 22 June,"""I strongly condemn the attack on praying believers in the Mar Elias Church in Damascus. This cowardly act is an attack on the social diversity of Syria. The Ministry of Development supports the reconstruction and social cohesion of Syria. This work is more important than ever. Reconstruction must lead to rapid results in order to remove radicals from the breeding ground.""",发展部长雷姆·阿拉巴利·拉多万宣布6月22日大马士革袭击案,"我谴责在大马士革的Mar Elias教堂袭击信众的行为,这是对叙利亚社会多样性的一次袭击. 发展部支持叙利亚的重建和社会凝聚力,这一工作比以往任何时候都重要. 重建工作必须产生快速的成果,才能让激进分子脱离困境."
25,Effiziente Hilfe für Menschen auf der Flucht und die Aufnahmeländer,"Nach aktuellen Zahlen des UN-Flüchtlingshilfswerks sind 122 Millionen Menschen weltweit auf der Flucht und damit mehr als jemals zuvor. Der weltweite Rückgang von Entwicklungsgeldern erhöht den Druck in den Aufnahmeländern. „Kein Mensch flieht freiwillig. Wer wegen Krieg, Krisen und Verfolgung seine Heimat verliert, verdient Mitmenschlichkeit und Hilfe. Wenn Menschen ihr Leben dafür riskieren, Hunger und Gewalt zu entkommen, dann helfen keine Parolen, sondern pragmatische Lösungen. (...)“, so Ministerin Reem Alabali Radovan.",Efficient assistance for refugees and host countries,"According to current figures from the UN Refugee Agency, 122 million people worldwide are on the run and thus more than ever before. The global decline in development funds increases the pressure in the host countries. ""No human being flees voluntarily. Anyone who loses his homeland because of war, crises and persecution deserves humanity and help. If people risk their lives to escape hunger and violence, then no slogans help, but pragmatic solutions. (...)-- said Minister Reem Alabali Radovan.",为逃犯和收容国提供高效的援助,"根据联合国难民救济中心的最新数字,全球1.12亿人正在逃命,这比以往任何时候都多. 全球发展资金的减少增加了收容国的压力. 没有人自愿逃离. 因为战争,危机和迫害而失去家园的人应该得到人道和帮助. 如果人们冒着生命危险逃避饥饿和暴力,那么他们就不会帮助帕洛尔,而是务实的解决方案."
26,Entwicklungsministerin Alabali Radovan verleiht BMZ-Engagementpreis für herausragenden persönlichen Einsatz,"Entwicklungsministerin Reem Alabali Radovan verleiht heute im Berliner Dienstsitz des Entwicklungsministeriums (BMZ) den 7. BMZ-Engagementpreis. Mit ihm wird herausragendes persönliches Engagement in der Entwicklungszusammenarbeit gewürdigt. Ausgezeichnet werden fünf Persönlichkeiten, die in besonderer Weise an der Umsetzung der 17 globalen UN-Nachhaltigkeitsziele mitwirken.",Minister of Development Alabali Radovan awards BMZ Commitment Prize for Outstanding Personal Use,Development Minister Reem Alabali Radovan today awards the 7th BMZ Commitment Prize at the Berlin Office of the Ministry of Development (BMZ). He is acknowledging his outstanding personal commitment to development cooperation. Five personalities who are particularly involved in the implementation of the 17 global UN sustainability goals are honoured.,发展部长阿拉巴利·拉多万 颁发优良个人成就奖,发展部长莱姆·阿拉巴利·拉多万 今天在发展部柏林的总部颁发了7个BMZ合同奖. 他将获得杰出的个人参与发展合作奖. 五位特别参与实现17个联合国全球支持目标的人物将非常出色.
