,title-de,content-de,title-en,content-en,title-zh,content-zh
62,Viele Vorwürfe gegen Frauke Brosius-Gersdorf - und eine Kampagne?,Unionspolitiker bleiben bei ihrer Kritik. Die SPD hält an ihrer Kandidatin für das Verfassungsgericht fest. Brosius-Gersdorf selbst erklärt ihre Haltung und berichtet von Drohungen. Wie konnte es so weit kommen? Ein Überblick.,Many accusations against Frauke Brosius-Gersdorf - and a campaign?,Union politicians stick to their criticism. The SPD adheres to its candidate for the Constitutional Court. Brosius-Gersdorf himself explains her attitude and reports on threats. How could it come about? An overview.,有很多指控指控穆斯凯·布罗修斯·格斯多夫夫人 和竞选活动吗?,"联邦官员仍然坚持他们的批评意见. 社民党一直坚持自己的宪法法庭候选人. 布罗修斯·格罗斯多夫自己解释了自己的立场,并报告了威胁. 这怎么可能发生这样的事情?"
63,Seltener Kiwi-Vogel auf Neuseelands Festland wiederentdeckt,Der Kiwi ist Neuseelands Nationalvogel. Die kleinste Art der außergewöhnlichen Tiere galt auf dem Festland seit Jahrzehnten als ausgestorben - bis jetzt. Experten sprechen von einem Wunder.,Rare Kiwi bird rediscovered on New Zealand's mainland,The kiwi is New Zealand's national bird. The smallest species of exceptional animals on the mainland has been considered extinct for decades - until now. Experts speak of a miracle.,新西兰大陆的稀有鸟类再次被发现,"Kiwi是新西兰的国民鸟. 数十年来最稀有的动物在大陆灭绝了 - 到目前为止,专家称它为奇迹"
64,USA nehmen durch Zölle laut Medienbericht knapp 50 Milliarden Dollar mehr ein,Die Zolleinnahmen der USA sind laut Financial Times auf ein Rekordhoch gestiegen. Im zweiten Quartal waren es dank der zusätzlichen Importzölle fast 50 Milliarden Dollar mehr als im Vorjahresquartal.,"US absorbs nearly 50 billion dollars more by tariffs, according to the media report","According to the Financial Times, US customs revenues have risen to a record high. In the second quarter, thanks to the additional import duties, the figure was almost $50 billion more than in the previous year's quarter.",媒体报道说美国通过关税收取了近500亿美元的税款,"根据""金融时报""的统计,美国关税收入创纪录高峰. 在第二季度,由于额外的进口关税,比去年的关税高了近500亿美元."
65,Richterwahl: Opposition nicht einig im Fall Brosius-Gersdorf,"Sollten sich SPD und Union doch noch auf Brosius-Gersdorf als Verfassungsrichterin einigen, bräuchten sie auch Stimmen aus der Opposition. Die Grünen fordern eine schnelle Lösung, die Linken zögern.",Election of judges: opposition disagreed in the case of Brosius-Gersdorf,"If SPD and Union still agree on Brosius-Gersdorf as a constitutional judge, they would also need voices from the opposition. The Greens demand a quick solution, the left hesitates.",法官选举:反对党在Brouseius-Gersdorf案上不一致.,"如果社民党和联盟仍对布卢修斯 - 格斯 - 格尔多夫的法官达成一致的话,他们也需要反对票. 绿党要求一个快速的解决方案,左派犹豫不决."
66,Vulkanausbruch auf isländischer Reykjanes-Halbinsel,Mit mehr als 30 aktiven Vulkansystemen ist Island die größte und aktivste Vulkanregion Europas. Nach einem Ausbruch auf der Halbinsel Reykjanes wurden ein Campingplatz und ein Thermalbad evakuiert - doch eine unmittelbare Gefahr soll es nicht geben.,Volcanic eruption on Icelandic Reykjanes Peninsula,"With more than 30 active volcanic systems, Iceland is the largest and most active volcanic region in Europe. After an eruption on the Reykjanes peninsula, a campsite and a thermal bath were evacuated - but there is no immediate danger.",冰岛雷凯尼斯海岛火山爆发,"冰岛是欧洲最大的,也是最活跃的火山区域. 在雷克雅奈斯半岛爆发暴动后,一个营地和热水澡被疏散了,但没有立即的危险."
67,AfD-Mitglieder im Staatsdienst? Länder setzten auf Einzelfallprüfung,Doch kein pauschaler Ausschluss: Neben Rheinland-Pfalz wollen auch andere Bundesländer bei der Einstellung von AfD-Mitgliedern in den Staatsdienst weiter im Einzelfall prüfen. Mancherorts könnte das aber strenger gehandhabt werden.,AfD-members in the state service? Countries rely on case-by-case examination,"But no general exclusion: In addition to Rhineland-Palatinate, other federal states also want to continue to examine in individual cases the recruitment of AfD members to the state service. However, this could be handled more strictly in some places.",AFD 公务员成员?,"但没有排除的余地:除了莱茵兰花之外,其他州,也愿意在雇佣AfD成员担任公务员时逐一审查. 但有些国家可以更严格地处理这个问题."
68,2.000 Soldaten verlassen Los Angeles wieder,Nach Demos gegen die Einwanderungspolitik der US-Regierung hatte Präsident Trump Soldaten der Nationalgarde nach Los Angeles geschickt. Knapp 2.000 von ihnen werden nun aus der US-Metropole abgezogen. Von Nils Dampz.,"2,000 soldiers leave Los Angeles again","After demonstrations against the US government's immigration policy, President Trump had sent National Guard soldiers to Los Angeles. Nearly 2,000 of them are now being withdrawn from the US metropolis, from Nils Dampz.",2000名士兵再次离开洛杉矶,"在反对美国政府移民政策的示威之后,特朗普总统派了士兵到洛杉矶去. 约2000名士兵现在被撤出美国大都会. 尼尔斯·丹普兹."
69,Die Epstein-Akten und der Ärger von Trumps Unterstützern,"Eigentlich versprach Trump, die Akten im Fall Epstein zu veröffentlichen. Doch das Justizministerium sieht das anders. Zum Ärger der Unterstützer Trumps. Jetzt kommt auch Kritik von einem der wichtigsten Republikaner. Von S. Jackisch.",The Epstein Acts and the Trouble of Trump's Supporters,"Trump actually promised to publish the files in the Epstein case, but the Ministry of Justice sees it differently. Trump's supporters' anger. Now there is criticism from one of the most important Republicans. By S. Jackisch.",Epstein文件和特朗普支持者的麻烦,"事实上,特朗普承诺要公布爱普斯坦案的记录,但司法部不同意,因为特朗普是支持者的麻烦. 现在,由一个主要的共和党人批评他."
70,Serielles Bauen: Mit Fertigbauteilen gegen die Wohnungsnot,"Mehr als jede zehnte neu gebaute Wohnung wurde im vergangenen Jahr mit Fertigbauteilen errichtet. Der Fertigbau habe auch in Zeiten schwacher Baukonjunktur Marktanteile gewinnen können, so das Bundesbauministerium.",Serial construction: with prefabricated components against housing shortages,"More than every tenth newly built apartment was built last year with prefabricated components. The prefabricated building was able to gain market share even in times of weak construction activity, according to the Federal Ministry of Construction.",序列建筑: 与住房困难作对,"去年,每10座新公寓建成的制造工地多于每栋建筑. 建筑业在建筑经济不景气的时期也可获得市场份额,即联邦建设部 (Fediary Department) 这样的市场份额."
71,Umweltbundesamt wertet CO2-Handel als Erfolg,"Es sei ""wirklich ein Grund zu feiern"", heißt es vom Umweltbundesamt. Gemeint ist der Handel mit CO2-Verschmutzungsrechten - eines der zentralen Klimaschutzinstrumente der EU. Seit Einführung sanken die Emissionen deutlich. Von H.-J. Vieweger.",Umweltbundesamt evaluates CO2 trading as a success,"It is ""a real reason to celebrate"", says the Federal Environment Agency. Trade in CO2 pollution rights is meant - one of the EU's key climate protection instruments. Since its introduction, emissions have decreased significantly. By H.-J. Vieweger.",环境局将二氧化碳交易视为成功,"环境局说,真正的庆祝是值得庆祝的. 贸易是与二氧化碳污染的贸易 - - 欧盟的主要气候工具之一. 自导游以来,排放量大幅下降. 由H. J. Vieswer提供."
72,USA setzen Iran offenbar Frist für Atomabkommen,Die USA drängen auf ein neues Atomabkommen mit dem Iran - und setzen nun offenbar eine Frist. Bis Ende August soll ein neuer Deal stehen. Unterstützung erhält die US-Regierung dabei einem Medienbericht zufolge auch aus Deutschland.,USA apparently set Iran deadline for nuclear agreements,"The US is pushing for a new nuclear agreement with Iran - and is now apparently setting a deadline. A new deal is to be made by the end of August. According to a media report, the US government is also receiving support from Germany.",美国似乎为伊朗定下核协议的期限,"美国正敦促与伊朗订立新的核协议,现在显然已经定好期限了,8月底之前要达成一项新的协议. 据媒体报道,美国政府也收到来自德国的援助."
73,Europäische Börsen profitieren vom Zollstreit mit den USA,Zollstreit und globale Krisen - viele Investoren orientieren sich in dieser Lage nach Europa. Der DAX eilt von Rekord zu Rekord. An einer anderen Börse in Europa ging es sogar noch steiler bergauf. Von Sebastian Schreiber.,European stock exchanges benefit from the customs dispute with the USA,Customs dispute and global crises - many investors are orienting themselves in this situation towards Europe. The DAX hurries from record to record. At another stock exchange in Europe it went up even steeper. By Sebastian Schreiber.,欧洲股市从与美国的海关纠纷中获益良多,海关纠纷和全球危机 - 许多投资者都以此为生. DAX已经创下了历史纪录. 在欧洲另一家股票交易所上山的海关更加激烈. 塞巴斯蒂安·塞巴斯蒂安.
74,Flexibler und moderner: EU-Kommission stellt Haushaltsplan ab 2028 vor,Heute stellt die EU-Kommission ihren Plan für den Haushalt der kommenden Jahre vor. Das Ziel: flexibler und moderner werden. Und mehr Einnahmequellen erschließen. Widerstand ist absehbar. Von Thomas Spickhofen.,More flexible and modern: EU Commission presents budget from 2028,"Today, the EU Commission is presenting its plan for the budget for the coming years. The goal: to become more flexible and modern, and to open up more sources of income. Resistance is foreseeable. By Thomas Spickhofen.",欧盟委员会从2028年开始预算计划,"今天,欧盟委员会正在为未来几年预算提出预算计划. 目标是更灵活,更现代化,并开发更多收入来源. 反对是可以预见的. 由托马斯·斯皮尔霍芬 (Thomas Spiffhofen) 提出."
75,"DRK, THW & Co: Für den Zivilschutzfall gut gerüstet?","Sollte Deutschland Teil eines bewaffneten Konflikts werden, wären Organisationen wie DRK und THW für den Zivilschutz zuständig. Um darauf vorbereitet zu sein, ist noch einiges an Arbeit nötig. Von Karin König.","DRK, THW & Co: Well prepared for the civil protection case?","If Germany were to become part of an armed conflict, organisations such as DRK and THW would be responsible for civil protection. To be prepared for this, there is still a lot of work to be done. By Karin König.",DRK THW 和 Co: 为民防工作准备妥当吗?,"如果德国成为武装冲突的一部分,像朝鲜和THW这样的组织将负责民防工作. 要做好准备,还需要一些工作. 卡琳·金 (Karen King)."
76,Umstrittene Machtkonzentration bei Lieferdiensten für Getränke,"Während einige Lieferdienste im harten Wettbewerb bereits wieder vom deutschen Markt verschwunden sind, sorgt flaschenpost bei der Oetker-Gruppe für Wachstum. Kleine Getränkelieferdienste sehen sich benachteiligt. Von M. Kolvenbach.",Controversial concentration of power in the supply of beverages,"While some delivery services have already disappeared from the German market in fierce competition, bottle mail at the Oetker Group ensures growth. Small beverage delivery services are disadvantaged. By M. Kolvenbach.","在饮料供应服务中,争夺权力的集中度.","一些竞争激烈的供应商已经从德国市场中消失,而奥特克集团则有瓶瓶装水供养增长. 小供应商的服务处于不利状态. 由柯文巴赫先生提供."
77,Brosius-Gersdorf hält sich Verzicht auf Nominierung offen,"Die Staatsrechtlerin Brosius-Gersdorf hält sich nach der Kritik an ihren Positionen einen Rückzug von ihrer Kandidatur zur Richterin am Bundesverfassungsgericht offen. Sie wolle sich jedoch auch nicht der ""Kampagne"" gegen sie beugen.",Brosius-Gersdorf remains open to nominee,"According to the criticism of her positions, the state lawyer Brosius-Gersdorf keeps a retreat from her candidacy to the judge at the Federal Constitutional Court. However, she also does not want to bow to the ""campaign"" against her.",Brouseus-Gersdorf 公开宣布放弃提名,"国务卿Brouseius-Gersdorf在批评她的立场后 公开退出联邦宪法法院法官的职位. 但她也不愿向""运动""屈服."
78,Haushaltskrise in Frankreich: Ein Sparkurs mit hohem politischen Risiko,"Nullrunde bei Sozialausgaben und Renten, mehr Arbeit, weniger Feiertage: Frankreichs Premierminister Bayrou will dem Land einen eisernen Sparkurs verordnen - es sei ein Moment der Wahrheit. Wird es auch das Ende seiner Regierung? Von Cai Rienäcker.",Budget crisis in France: a austerity course with high political risk,"Zero round of social spending and pensions, more work, fewer holidays: France's Prime Minister Bayrou wants to impose an iron austerity policy on the country - it is a moment of truth. Will it also end his government? By Cai Rienäcker.",法国财政危机:高政治风险的紧缩政策,"社会支出和养老金的零回合,更多的工作,更少的假日:法国总理贝鲁想对法国实行铁性储蓄 - 这是事实的一刻. 他的政府会结束吗?"
79,Marktbericht: Wall Street wieder im Tech-Modus,Allen Zoll- und Zinsunsicherheiten zum Trotz ging es heute an der Technologiebörse Nasdaq auf neue Rekordhöhen. Platzhirsch Nvidia stand dabei besonders im Fokus. Ansonsten herrschte Tristesse.,Market Report: Wall Street back in Tech Mode,"Despite all customs and interest-rate uncertainties, the technology exchange Nasdaq today set new record levels. Nvidia was particularly focused on top of the field. Otherwise, Tristesse ruled.",市场报告:华尔街重新进入科技模式,"尽管有各种关税和利息不确定性,但现在纳什达卡科技交易所 出现了新的创纪录高点. 纳维迪娅特别关注的是特瑞斯特."
80,Putschversuch in Brasilien: Bolsonaro als Hauptakteur angeklagt,"Brasiliens Generalstaatsanwaltschaft wirft Ex-Präsident Bolsonaro vor, als Staatsoberhaupt die Demokratie seines Landes systematisch attackiert zu haben. Der Prozess geht nun in die heiße Phase.",Putsch attempt in Brazil: Bolsonaro accused of being the main actor,Brazil's Attorney General's Office accuses ex-President Bolsonaro of systematically attacking his country's democracy as head of state. The trial is now entering the hot phase.,"巴西政变未遂,博尔森罗被控为主犯","巴西的总检察长办公室建议前总统波尔索纳罗作为国家元首,有系统地攻击了本国的民主制度. 审判正在进入热门阶段."
81,Frankreichs Premier kündigt fast 44 Milliarden Euro an Einsparungen an,"Weniger Staatsbeamte, Behörden und Feiertage - Frankreichs Premierminister Bayrou hat einen harten Haushaltskurs angekündigt, um fast 44 Milliarden Euro einzusparen. Die Regierung könnte über das Vorhaben stürzen.",France's Prime Minister announces almost 44 billion euros in savings,"Fewer state officials, public authorities and public holidays - France's Prime Minister Bayrou has announced a tough fiscal stance to save almost EUR 44 billion, and the government could overturn the plan.",法国总理宣布将削减4400亿欧元的预算,"政府官员,政府官员,节日和节日更少 - 法国首相贝鲁宣布了节约近4000亿欧元的财政课程. 政府可能会推翻这项计划."
82,Ukraine-Liveblog: ++ Rutte fordert von China Druck auf Putin ++,"NATO-Generalsekretär Rutte hat an China, Indien und Brasilien appelliert, Druck auf Russland auszuüben - andernfalls würden Sekundärsanktionen drohen. Die EU-Länder verlängern ihren Schutz für Ukrainer bis 2027.",Ukraine live blog: ++ Rutte calls for China to put pressure on Putin ++,"NATO Secretary General Rutte has appealed to China, India and Brazil to exert pressure on Russia - otherwise secondary sanctions would be threatened. EU countries extend their protection for Ukrainians until 2027.",乌克兰立体博客:++拉脱维亚 要求中国对普京施压+++,"北约秘书长鲁特曾呼吁中国,印度和巴西向俄罗斯施压,否则次级制裁将受到威胁. 欧盟国家将把对乌克兰人的保护延长到2027年."
83,"EU-Sanktionen gegen Russland: Viel Einigkeit, aber keine Einigung","Beim Treffen der EU-Außenminister sollte das 18. Sanktionspaket gegen Russland beschlossen werden. Doch die Slowakei stellt sich quer. Auch die Finanzierung der ""Patriot""-Systeme für die Ukraine ist offen. Von Helga Schmidt.","EU sanctions against Russia: a lot of unity, but no agreement","At the meeting of EU foreign ministers the 18th package of sanctions against Russia was to be decided. But Slovakia is cross-cutting. Also the financing of the ""patriot"" systems for Ukraine is open. By Helga Schmidt.","欧盟对俄罗斯的制裁:达成许多一致,但没有达成一致","欧盟外交部长会议本应通过对俄罗斯实施第十八套制裁措施,但斯洛伐克已经超越了其范围. 乌克兰的""爱国主义""系统也开放. 由赫尔加·施密特提供资金."
84,Kommentar: Trump macht Ukraine-Hilfe zum Geschäft,"Der US-Präsident schickt der Ukraine wieder Waffen - und bekommt Geld dafür aus Europa. Für die Ukraine ist die Hilfe wertvoll, aber Trump kann die Geschäftsbeziehung auch jederzeit wieder beenden, meint Florian Kellermann.",Comment: Trump Makes Ukraine Help to Business,"The US President sends weapons to Ukraine again - and gets money for it from Europe. The aid is valuable for Ukraine, but Trump can also end the business relationship at any time, says Florian Kellermann.",评论:特朗普让乌克兰人做业务援助.,"美国总统将重新向乌克兰提供武器,并从欧洲获得资金. 对乌克兰来说,援助是有价值的,但Transton可以随时终止交易, Florian Kellermann说."
85,Israel greift syrische Armeeeinheiten in Suweida an,Die Situation im syrischen Suweida ist unübersichtlich - nach Armeeangaben gilt nach schweren Kämpfen inzwischen eine Waffenruhe zwischen Drusen und Beduinen. Israel widerspricht und greift militärisch ein.,Israel attacks Syrian army units in Suweida,"The situation in the Syrian Suweida is unclear - according to the army, after heavy fighting, a ceasefire between Druze and Bedouin is now valid. Israel contradicts and intervenes militarily.",以色列在苏威达攻击叙利亚军队,"叙利亚苏威达的局势是不明朗的 - 根据军队的统计,在激烈的战斗中,在德鲁士和贝都因人之间实行停火. 以色列反对并采取军事行动."
86,"Hohe Strafen im Prozess um ""Robin Hood""-Baum","In Großbritannien müssen zwei Männer mehr als vier Jahre ins Gefängnis, weil sie einen berühmten Bergahorn am Hadrianswall gefällt haben. Das Motiv für die Zerstörung des ""Robin Hood""-Baums ist weiter unklar. Von Christoph Prössl.","High penalties in the trial around ""Robin Hood"" tree","In Britain, two men have to go to prison for more than four years because they liked a famous mountain maple on the Hadrianswall. The motive for the destruction of the ""Robin Hood"" tree is still unclear. By Christoph Prössl.",Robin Hood树案的审判中 最高刑期,"在英国,两个男人因击倒哈德里安的堡垒而在监狱服刑超过四年. 破坏""罗宾汉树""的动机还不明朗. 由克里斯托夫·普劳斯 (Christopher Prassel) 提出."
87,"Nach Eklat um Richterwahl: Merz und Söder wollen ""in Ruhe"" nach Lösung suchen","Wie geht es nach der gescheiterten Richterwahl weiter? Die SPD und auch die Kandidatin gehen in die Offensive. Und die Unionschefs? Merz und Söder wollen ""in Ruhe"" Lösungen suchen. Von Benjamin Großkopff.","After Eklat for Judge Election: Merz and Söder want to search ""in peace"" for solution","The SPD and the candidate go on to the offensive. And the Union leaders? Merz and Söder want to seek solutions ""in peace"". By Benjamin Großkopff.","在艾克拉特法官选举后 默兹和索德想""安静地""寻求解决","党卫军和候选人都准备进攻 联盟主席默兹和索德想寻求""安静""的解决办法. 由本杰明·阿斯特夫 (Benjamin Bigheadf) 提出."
88,Zuckerberg plant KI-Zentren so groß wie Manhattan,"Meta-Chef Zuckerberg träumt von KI-Rechenzentren mit gigantischen Ausmaßen. Und das Pentagon vergibt Millionen-Aufträge an KI-Firmen - auch an Musks xAI, dessen Chatbot mit antisemitischen Äußerungen aufgefallen war.",Zuckerberg plans AI centers as big as Manhattan,"Meta-Chef Zuckerberg dreams of AI data centers with gigantic dimensions. And the Pentagon awards millions of orders to AI companies - also Musks xAI, whose chatbot had been noticed with anti-Semitic statements.",扎克伯格计划用曼哈顿那么大的人工智能控制中心,五角大楼向人工智能公司发放数以百万计的战利品 - 包括穆斯克的 XA - 其聊天员曾发表反犹太言论
89,"DAK-Gesundheitsreport: ""Burn-out ist neue Pandemie bei Jüngeren""",Der Generation Z geht es vor allem um die Work-Life-Balance? Diesem Klischee widerspricht eine Studie einer großen Krankenkasse. Alarmierend sind demnach die Angaben zur psychischen Gesundheit.,"DAK Health Report: ""Burn-out is a new pandemic among younger people""","Generation Z is primarily concerned with work-life balance? This cliché is contradicted by a study of a large health insurance company. Therefore, the information on mental health is alarming.","DAK健康报告: ""博恩退出是年轻人的新流行病""","这项陈词滥调与大型医疗保险的研究相抵触. 因此,警觉是精神健康数据."
90,Großbritannien muss Tausende Afghanen wegen Datenlecks aufnehmen,"Die britische Regierung hat versehentlich Daten von 19.000 Afghanen verschickt, die ihr im Kampf gegen die Taliban halfen - ein Teil davon landete auf Facebook. Weil den Betroffenen Gefahr drohte, nahm Großbritannien Tausende von ihnen auf.",Britain must record thousands of Afghans for data leaks,"The British government accidentally sent data from 19,000 Afghans who helped her fight the Taliban - part of it landed on Facebook. Because the affected people were threatened, Britain took in thousands of them.",英国必须收容数千阿富汗人 因为数据泄露而收留他们,"英国政府意外发送了1万9千名阿富汗人的数据,其中一部分是你们协助打击塔利班的 - - 部分被送到Facebook上. 由于受到威胁,英国吸收了数千名阿富汗人."
91,Foie Gras ohne Stopfmast - das Ende der Gänsestopfleber?,In Frankreich ist sie eine Delikatesse - die Foie Gras. Mit Tierwohl hat die Gänsestopfleber aber nicht viel zu tun. Forschende haben nun eine Methode ohne Zwangsfütterung entwickelt. Kann sie sich durchsetzen? Von S. Schnabel.,Foie grass without a stuffed pole - the end of the goose-pot liver?,In France it is a delicacy - the foie gras. But with animal welfare the goose-pot liver has not much to do. Researchers have now developed a method without forced feeding. Can it prevail? From S. Beak.,- 鹅肝的末日?,"在法国,她是一个熟食店 - - ""火鸡"" - - . 动物的养殖场和养鹅场没什么关系. 研究者现在开发了一种方法,没有强制喂养. 它能胜任吗?"
