,title-de,content-de,title-en,content-en,title-zh,content-zh
58,GPS-Störungen auf der Ostsee: Besonders Freizeitboote gefährdet,Schon seit Wochen wächst das Problem von GPS-Störungen auf der Ostsee. Immer größer werden die betroffenen Bereiche. Vor allem für Freizeitboote ist das eine Gefahr. Steckt Russland dahinter? Von Ann-Brit Bakkenbüll.,GPS disturbances on the Baltic Sea: especially recreational boats at risk,"The problem of GPS disturbances on the Baltic Sea has been growing for weeks. The affected areas are getting bigger and bigger. Especially for recreational boats, this is a danger. Is Russia behind it? From Ann-Brit Bakkenbüll.","东海的GPS故障,尤其对休闲船造成威胁","东海岸的GPS故障已经增加好几周了. 受影响地区越来越大. 特别是对休闲艇来说,这是个威胁. 俄罗斯在背后吗?"
59,Größere Hilfslieferungen in den Gazastreifen wieder aufgenommen,"Der Druck auf Israel wegen der katastrophalen humanitären Lage hatte zugenommen: Jetzt kommen aus der Luft und über Land wieder Hilfsgüter in den Gazastreifen. Die Armee kündigte an, bis auf Weiteres Kampfpausen einzuhalten.",Major shipments of aid to the Gaza Strip resumed,The pressure on Israel because of the catastrophic humanitarian situation had increased: now aid is coming from the air and overland again to the Gaza Strip. The army announced that until further notice it would continue to stop fighting.,加沙地带的援助供应量增加 恢复到更大规模的加沙地带,"以色列由于人道主义灾难而遭受压力,现在从空中和陆地返回加沙地带. 军队宣布,在战斗暂停之前,必须停止战斗."
60,Finanzexperten wollen Schüler vor Schulden schützen,"Immer mehr junge Menschen verschulden sich, auch weil sie viel zu wenig über den Umgang mit dem eigenen Geld wissen. Ein Schulworkshop in Berlin zeigt, wie es richtig gemacht wird. Von Anke Hahn.",Financial experts want to protect students from debt,"More and more young people are in debt, also because they know far too little about dealing with their own money. A school workshop in Berlin shows how it is done correctly. By Anke Hahn.",金融專家想保護學生免除債務,"越来越多的年轻人欠了债,也因为他们对自己的钱了解得不够多. 在柏林开一个学校研讨会,说明了我们怎么做才是对的. 由安克公鸡所提供."
61,Was hilft gegen Gaffer bei Verkehrsunfällen?,"Sie filmen Verletzte mit dem Handy, behindern Retter bei der Arbeit und blockieren Straßen: Gaffer sorgen bei Unfällen immer wieder für Ärger. Helfen härtere Strafen weiter? Von Oliver Bemelmann.",What can help against Gaffer in traffic accidents?,"They film injured people with their mobile phone, hinder rescuers at work and block roads: Gaffers keep causing trouble in case of accidents. Help harder penalties continue? By Oliver Bemelmann.",加弗对交通事故有什么帮助?,"他们用手机拍摄伤员,阻挠救援人员工作,阻挡道路:盖弗在事故中会惹事. 更严厉的惩罚还会继续吗?"
62,Polizei löst queere Palästina-Demo in Berlin auf,Die Polizei hat am Samstagabend eine queere Demo in Berlin-Kreuzberg aufgelöst. Bei dem Protest stand der Gaza-Krieg im Fokus. Nach eigenen Angaben entschieden sich die Beamten wegen Angriffen und antisemitischer Parolen für den Abbruch.,Police dissolve queere Palestine demo in Berlin,"On Saturday evening, the police dissolved a queer demonstration in Berlin-Kreuzberg. The main focus of the protest was the Gaza war. According to their own statements, the officials decided to break up due to attacks and anti-Semitic slogans.",警察在柏林解散了巴勒斯坦的暴徒,"警方在周六晚上在柏林-十字路口解散了一场暴乱的示威游行. 这场抗议活动集中了加沙战争. 根据他们的消息,官员们决定取消攻击和反犹的口号."
63,Kambodscha und Thailand kämpfen auch nach Anruf von Trump weiter,An der Grenze zwischen Thailand und Kambodscha gehen die Kämpfe weiter. Zuvor hatte sich US-Präsident Trump eingeschaltet und eine Waffenruhe gefordert. Zu einer solchen sollen beide Seiten grundsätzlich bereit sein.,Cambodia and Thailand continue to fight after Trump's call,"Fights continue on the border between Thailand and Cambodia. Previously, US President Trump had called for a ceasefire, and both sides should be prepared to do so.",柬埔寨和泰国在特朗普的呼叫后继续战斗,"在泰国和柬埔寨的边界,战斗仍在继续. 之前,美国总统特朗普已经启动并要求停火. 双方都应该为停火做出根本的准备."
64,Musik: Warum gibt es sie überhaupt?,"Die Musik hat Evolutionspsychologen ratlos gemacht: Unser Gehirn ist offenbar darauf angelegt, Musik zu genießen oder gar hervorzubringen. Diese Fähigkeit scheint genetisch angelegt zu sein. Doch wozu brauchen wir sie? Von Gábor Paál.",Music: Why does it even exist?,The music has made evolution psychologists perplexed: our brain is obviously designed to enjoy music or even to produce it. This ability seems to be genetically designed. But what do we need it for? By Gábor Paál.,为什么有音乐?,"音乐让进化心理学家无法理解:我们的大脑似乎在享受或创造音乐. 这种能力似乎是遗传的,但我们为什么需要它?"
65,Verbraucherzentralen kritisieren geplantes System für Facharzttermine,"Erst Hausarzt, dann Fachärztin: Das sehen Pläne von Gesundheitsministerin Warken vor - doch die Kritik daran wächst. Die Verbraucherzentralen befürchten, dass es dadurch nicht leichter wird, einen Termin zu bekommen.",Consumer centres criticise planned system for specialist appointments,"First a family doctor, then a specialist: this is what Health Minister Warken plans for - but criticism of this is growing. Consumer centers fear that this will not make it easier to get an appointment.",消费者中心批评计划中的医学期刊系统,"先是家庭医生,然后是专业医生:这是卫生部长沃肯的计划 - 但批评越来越强烈了. 消费者中心担心这样不会更容易预约."
66,Armee wirft Hilfsgüter über Gaza ab und kündigt Kampfpause an,"Wegen der katastrophalen Lage im Gazastreifen steht Israel unter Druck. Jetzt hat die Armee offenbar erste Hilfslieferungen aus der Luft abgeworfen. Zudem soll es Kampfpausen geben, um die Güter zu verteilen.",Army throws aid over Gaza and announces a ceasefire,"Because of the catastrophic situation in the Gaza Strip, Israel is under pressure. Now the army seems to have thrown off the air for the first time, and there will be breaks to distribute the goods.",军队正在加沙上空卸货 宣布休战,"加沙地带的灾难性局势给以色列造成了压力. 现在,军队似乎已经从空中投掷了第一个援助物资. 另外,据说还有战斗暂停,以分发货物."
67,Trump empfängt von der Leyen: Zolldiplomatie im Golfresort,Für viele Schotten ist er ein unerwünschter Gast: US-Präsident Trump weilt in seinem Golfresort. Heute besucht ihn dort EU-Kommissionschefin von der Leyen und hofft auf eine Lösung im Zollstreit. Von Gabi Biesinger.,Trump receives from the Leyen: Customs Diplomacy in the Gulf Resort,"For many Scots, he is an undesirable guest: US President Trump is staying in his golf resort. Today, he is visiting the EU Commissioner from the Leyen and hoping for a solution in the customs dispute. By Gabi Biesinger.",特朗普从莱昂人那里接收到的 关外交部高尔夫球场的关税,"对很多苏格兰人来说,他是不受欢迎的客人:美国总统特朗普来到他的高尔夫球场. 今天他在那里访问了莱昂人欧盟议会,希望在海关纠纷中找到解决方法. 由加碧·拜辛格 (Gabi Bieesinger) 提供."
68,ICE der Deutschen Bahn bleibt in Tunnel bei Wien liegen,"Rund 400 Fahrgäste eines ICE von Wien nach Hamburg haben stundenlang in einem Tunnel festgesteckt - ohne Strom, ohne Licht und funktionierende Klimaanlage. Rettungskräfte brachten die Fahrgäste über Notausstiege aus dem Tunnel.",Deutsche Bahn's ICE remains in tunnels near Vienna,"Around 400 passengers of an ICE from Vienna to Hamburg have been stuck in a tunnel for hours - without electricity, without light and working air conditioning. Rescue personnel brought the passengers out of the tunnel via emergency exits.",德军的铁路在维也纳的隧道内,"从维也纳到汉堡的大约400人在没有电力,光线和空调的隧道里困了几个小时. 救援人员通过紧急出口把乘客带出了隧道."
69,Trump dringt auf Waffenruhe zwischen Thailand und Kambodscha,"An der Grenze zwischen Thailand und Kambodscha wird auch am dritten Tag weiter heftig gekämpft. Mittlerweile wurden mindestens 30 Menschen getötet, mehr als 150.000 vertrieben. Nun schaltet sich US-Präsident Trump ein.",Trump pushes for a ceasefire between Thailand and Cambodia,"On the border between Thailand and Cambodia, the fight continues on the third day. Meanwhile, at least 30 people have been killed, more than 150,000 have been displaced.",特朗普进入泰国和柬埔寨之间的停火状态,"泰国和柬埔寨之间的边界继续在第三天进行激烈的战斗. 目前,至少30人死亡,15万人流离失所. 现在,美国总统特朗普开始行动."
70,Große Waldbrände in Griechenland: Vororte von Athen evakuiert,"Die Regierung bittet um EU-Unterstützung: In Griechenland brennt es nördlich von Athen, auf dem Peloponnes und auf Inseln. Tschechische Feuerwehrleute helfen schon. Zyperns Regierung steht nach Bränden in der Kritik.",Large forest fires in Greece: suburbs of Athens evacuated,"The government is asking for EU support: Greece is burning north of Athens, on the Peloponnese and on islands. Czech firefighters are already helping. Cyprus' government is critical of fires.","希腊的大森林大火,雅典郊区疏散","政府请求欧盟的支持:在希腊,雅典北部,佩洛普群岛和岛上燃烧. 捷克消防员已经帮助. 塞浦路斯政府在火灾后受到批评."
71,Ein Jahr danach: Das zwiespältige Erbe von Olympia in Paris,Ein Jahr nach den Olympischen Spielen von Paris zieht Frankreich Bilanz. Wie hoch waren die tatsächlichen Ausgaben - und wie sehr haben die Menschen in der Region davon profitiert? Die Antwort fällt gemischt aus. Von C. Dylla.,A year later: The intertwined legacy of Olympia in Paris,"One year after the Olympic Games in Paris, France is taking stock. What was the actual expenditure - and how much did the people in the region benefit from it? The answer is mixed. By C. Dylla.","一年后,巴黎奥林匹克的巨大遗产","巴黎奥运会后一年,法国的记录显示了法国的记录. 法国的实际支出是多少? 该地区的人们从中获益多少? 答案是混合的,是C. Dylla."
72,Jugendverband des Bündnis Sahra Wagenknecht gegründet,Bisher liegt der Altersschnitt im Bündnis Sahra Wagenknecht bei weit über 50 Jahren. Doch die Partei will wachsen und dazu auch mehr junge Mitglieder gewinnen. Nun hat das BSW auch einen eigenen Nachwuchsverband.,Youth association of the alliance Sahra Wagenknecht founded,"So far, the age range in the alliance Sahra Wagenknecht has been well over 50 years. But the party wants to grow and to win more young members. Now the BSW also has its own youth association.",青年联盟成立了萨克拉车臣组织,"迄今为止,SSAW的年龄已超过50年. 但党想成长并赢得更多的年轻成员. 现在,BSW也有自己的新成员了."
73,Wie man mit Verlusten an der Börse Steuern sparen kann,Beim Sparen oder bei der Fondsanlage erhoffen sich Verbraucher stets positive Erträge. Aber an der Börse können auch Verluste entstehen. Die kann man jedoch mit Gewinnen verrechnen - und damit Steuern sparen. Von Andreas Braun.,How to save taxes with losses on the stock exchange,"Consumers always expect positive returns when saving or investing in funds. But losses can also occur on the stock exchange. However, these can be offset by profits - and thus save taxes. By Andreas Braun.",如何在股票上损失惨重的情况下节约税收,"消费者在储蓄和基金中总是希望有积极的回报,但是股票市场上也会有损失,但利润可以算在内,从而节约税收. 从Andreas Brown那里."
74,Oppositionspolitiker bleiben nach Volksabstimmung in Taiwan im Amt,24 Oppositionspolitiker in Taiwan dürfen im Amt bleiben: Laut vorläufigen Ergebnissen stimmte eine Mehrheit der Wähler gegen deren Abberufung. Die Regierungspartei DPP verfügt damit weiterhin über keine eigene Mehrheit im Parlament.,Opposition politicians remain in office after referendum in Taiwan,"24 opposition politicians in Taiwan are allowed to remain in office: According to preliminary results, a majority of voters voted against their dismissal. Thus, the ruling party DPP does not have its own majority in parliament.",反对党政治领袖在台湾全民公决后继续执政,"台湾的24名反对党领导人可以继续担任总统:根据初步结果,多数选民投票反对被赶下台. 民主党在议会中仍没有多数席位."
75,"Proteste in Schottland: ""Donald Trump ist hier nicht willkommen""",In Aberdeen und Edinburgh haben Hunderte Menschen gegen den Besuch von US-Präsident Trump in Schottland protestiert. Trump zeigte sich unbeeindruckt - und verbrachte den Tag auf einem Golfplatz.,"Protests in Scotland: ""Donald Trump is not welcome here""","In Aberdeen and Edinburgh, hundreds of people protested against US President Trump's visit to Scotland. Trump showed himself unimpressed - and spent the day on a golf course.","苏格兰的抗议活动""唐纳德·特朗普不受欢迎""","在阿伯丁和爱丁堡,数以百计的人反对美国总统特朗普访问苏格兰. 特朗普毫不惊讶地在高尔夫球场上待了一天."
76,Treffen in Schottland: Gibt es die Zolleinigung von EU und USA?,"Seit Monaten arbeitet die EU an einer Lösung im Zollstreit mit den USA. Am Sonntag trifft Kommissionspräsidentin von der Leyen US-Präsident Trump in Schottland. Ist ein ""Deal"" dort wahrscheinlich? Und was passiert, wenn er nicht kommt?",Meeting in Scotland: Is there a customs agreement between the EU and the US?,"For months, the EU has been working on a solution in the customs dispute with the US. On Sunday, Commission President of Leyen US President Trump will meet in Scotland. Is a deal likely there? And what happens if he doesn't come?","在苏格兰开会,欧盟和美国有关税吗?","欧盟在与美国进行海关纠纷的解决方案已经好几个月了. 星期日,欧盟委员会主席在苏格兰见了特朗普."
77,Nahost-Liveblog: ++ Merz: Große Übereinstimmung mit Macron und Starmer ++,"Merz hat in einem Telefonat mit Macron und Starmer ""nächste Schritte"" besprochen. Meloni will anders als Macron einen Palästinenserstaat vorerst nicht anerkennen. Der Liveblog vom Samstag zum Nachlesen.",Middle East live blog: ++ Merz: Great match with Macron and Starmer ++,"Merz discussed ""next steps"" in a phone call with Macron and Starmer. Meloni, unlike Macron, does not want to recognize a Palestinian state for the time being.",中东阅读博客: ++merz: 和Macron和Starmer ++ 大相符,"Merz在和Macron和Starmer""下一步行动""的通话中讨论过. 与Macron不同,Meloni现在不愿承认一个巴勒斯坦国. 星期六的现场博客是用来阅读的."
78,Wirtschaftsministerin Reiche fordert längere Lebensarbeitszeit,"In Deutschland stehen die Sozialsysteme unter Druck: Wirtschaftsministerin Reiche will gegensteuern und pocht darauf, dass die Lebensarbeitszeit steigt. Aus ihrer eigenen Partei und von Sozialverbänden kommt heftiger Widerspruch.",Minister of Economy Reiche calls for a longer working life,"In Germany, the social systems are under pressure: Minister Reiche wants to fight against it and insists that the working life increases. From her own party and from social associations comes a strong contradiction.",富豪经济部长要求长寿,"在德国,社会制度受到压力: 富国部长想要反向征税,并要求生活时限增加. 她自己的政党和社团组织都强烈反对."
79,Hunderttausende ziehen bei Christopher Street Day durch Berlin,"In Berlin hat unter dem Motto ""Nie wieder still!"" der Christopher Street Day begonnen. Laut den Veranstaltern zogen Hunderttausende Menschen durch die Stadt. Bei einer kleinen Gegendemonstration gab es Festnahmen.",Hundreds of thousands travel through Berlin at Christopher Street Day,"Christopher Street Day began in Berlin under the motto ""Never quiet again!"". According to the organisers, hundreds of thousands of people travelled through the city. In a small demonstration there were arrests.",Christopher Street Day有成千上萬的人在柏林游行,"在柏林,以""永远不再安静""为名的""克里斯多夫街日""开始了. 根据组织者的说法,数十万人在城市里游荡. 在一次小区示威中,被捕."
80,Orban: Ja zu EU-Finanzen nur nach Auszahlung aller Ungarn-Gelder,"Die EU-Kommission hatte mit dem Vorschlag eines Zwei-Billionen-Budgets die Verhandlungen über die Finanzen von 2028-2035 eröffnet. Ungarns Regierungschef Orban machte nun deutlich, woran er seine Zustimmung knüpft.",Orban: Yes to EU finances only after disbursement of all Hungarian funds,The EU Commission had opened negotiations on the finances of 2028-2035 with the proposal of a two-billion-budget. Hungary's head of government Orban made clear what he agreed to.,"城市:对欧盟金融机构,对欧盟金融机构,只取决于所有匈牙利货币的付款.","欧盟委员会提出一个2亿元的资产提议,就2028-2035年的财政问题展开了谈判. 匈牙利领导人欧班现在明确表明了他对财政状况的认可."
81,Konflikt zwischen Kambodscha und Thailand: Die Sorge vor einer Eskalation wächst,In der kambodschanisch-thailändischen Grenzregion sind Zehntausende Menschen auf der Flucht. Beide Staaten appellieren an die nationale Einheit. Wird aus den Kämpfen ein Krieg? Von Udo Schmidt.,Conflict between Cambodia and Thailand: Concern for escalation,In the Cambodian-Thai border region tens of thousands of people are fleeing. Both states appeal to national unity. Will the struggles become a war? By Udo Schmidt.,"柬埔寨和泰国之间的冲突日益加剧,对升级的担忧日益增加.",柬埔寨和泰国边境地区有数以万计的人在逃. 两国都呼吁民族团结. 战争会引发战争吗? 乌多·施密特?
82,"Thailand und Kambodscha: Ein Konflikt, der nur Kopfschütteln auslöst","Der Hintergrund des Konflikts zwischen Kambodscha und Thailand ist kaum nachvollziehbar. Am Ende wird es allerdings keinen Sieger geben, meint Udo Schmidt - sondern nur Verlierer.",Thailand and Cambodia: A conflict that only causes headshakes,"The background to the conflict between Cambodia and Thailand is hardly understandable. In the end, however, there will be no winner, says Udo Schmidt - but only losers.",泰国和柬埔寨: 一场只会引起头部震动的冲突,"柬埔寨和泰国之间的冲突很难解释. 但最终,没有胜利者,乌多·施密特认为只有失败者."
83,China will nach globalen Standards KI regulieren,"Diese Woche hatte US-Präsident Trump die KI-Vorgaben gelockert - doch China schwebt als größtem Konkurrenten anderes vor. Statt einer unkontrollierbaren Entwicklung müsse es ein weltweit anerkanntes Regelwerk geben, forderte Ministerpräsident Li.",China wants to regulate AI according to global standards,"This week, US President Trump relaxed AI requirements - but China is the biggest competitor in the world. Instead of uncontrollable development, there must be a globally recognized set of rules, Prime Minister Li demanded.",中国想根据全球标准的人工智能控制,"本周,美国总统特朗普放松了人工智能的限制,但中国是最大的竞争对手. 不仅没有不可控制的发展,还必须有一个全球公认的规则,总理李总理要求."
84,In der Koalition deutet sich eine alkoholpolitische Kehrtwende an,"Die Alkoholbranche ist alarmiert: Die schwarz-rote Koalition plant strengere Regeln. Es geht um Jugendschutz, Verkaufsbeschränkungen und die öffentliche Wahrnehmung von Alkohol als Genussmittel. Von Tina Handel.","In the coalition, an alcohol-political turnaround appears","The alcohol industry is alarmed: The black and red coalition is planning stricter rules. It is about youth protection, sales restrictions and the public perception of alcohol as a stimulant. By Tina Handel.",在联盟中 酒精的反向趋势意味着,"酒精业已得到警示:黑红联盟将制定更严格的规则. 这是关于青年保护,销售限制和公众对酒精的认识. 蒂娜贸易."
85,CSD in Berlin startet mit erhöhtem Schutz,"Hunderttausende werden heute zum Christopher Street Day in der Hauptstadt erwartet, ein größerer Polizei-Einsatz soll sie absichern. Der Protestmarsch verspricht laut zu werden - auch als Reaktion auf Äußerungen des Kanzlers.",CSD in Berlin starts with increased protection,"Hundreds of thousands are expected today for Christopher Street Day in the capital, a major police operation is to secure it. The protest march promises to be loud - also in response to statements by the Chancellor.",CSD在柏林起飞 加强了保护,"今天有数十万人将出席首都的克里斯托弗街日日, 为保护他们采取更大的警察行动. 抗议活动将发出声音,包括对总理的言论作出回应."
86,Die Roboter kommen - und verändern unsere Arbeitswelt,"Übernehmen bald Roboter monotone oder gefährliche Jobs - in Industrie, Gastronomie und Haushalt? Was hieße das für die Arbeit, die heutige Gesellschaft und unsere Zukunft? Von Thomas Falkner.",The robots come - and change our working world,"Will robots soon take over monotonous or dangerous jobs - in industry, gastronomy and household? What would that mean for work, today's society and our future? By Thomas Falkner.",机器人来改变我们的工作环境,"机器人很快会接手工业,食谱和家庭的危险工作? 这对今天的工作,社会和未来意味着什么?"
87,Tote nach nächtlichen Angriffen in Ukraine und Russland gemeldet,"Russland und die Ukraine haben erneut gegenseitige Angriffe gemeldet. Im ukrainischen Dnipro und der südrussischen Region Rostow gab es Tote. Aus Moskau heißt es, man habe zwei weitere Ortschaften eingenommen.",Deaths reported after nocturnal attacks in Ukraine and Russia,Russia and Ukraine have again reported mutual attacks. In the Ukrainian Dnipro and the southern Russian region of Rostov there were dead. Moscow is said to have taken two more villages.,乌克兰和俄罗斯在夜间袭击后死亡,俄罗斯和乌克兰再次报告了相互攻击. 乌克兰迪尼普罗和俄罗斯南部罗斯托夫地区有伤亡. 莫斯科传言说他们又占领了两个城市.
88,DWD warnt vor Unwettern und Überflutungen in Süddeutschland,"In Süddeutschland drohen ab heute heftige Unwetter: Bis zu 120 Liter Regen pro Quadratmeter könnten in den nächsten Tagen in Alpennähe niederprasseln, warnt der Deutsche Wetterdienst. Für Festival-Besucher sind das trübe Aussichten.",DWD warns against storms and floods in southern Germany,"In southern Germany severe storms are threatening from today: Up to 120 liters of rain per square meter could blow down near the Alps in the next few days, warns the German Weather Service. For festival visitors, the cloudy outlook is.",DD警告南德的暴风雨和洪水,"从今天起,在南德,暴风雪将至,每平方米降到120公升的降雨可能会在接下来几天内在阿尔卑斯山附近降温,德国气象局警告说. 对于Festival Festival,这种前景很模糊."
89,Debatte um Gaza-Hilfe: Für Schwarz-Rot hat sich viel verändert,"Das Papier von 28 Staaten, Kritik von Diplomaten und Frankreichs Ankündigung der Anerkennung Palästinas haben den Druck auf die Bundesregierung erhöht. Der Tenor: Mit Blick auf Gaza reichen Appelle wie bisher nicht aus. Nun scheint sich etwas zu tun. Von C. Nagel.",Debate on Gaza Help: A lot has changed for black and red,"The paper of 28 states, criticism of diplomats and France's announcement of the recognition of Palestine have increased the pressure on the federal government. Tenor: With regard to Gaza not enough appeals as before. Now something seems to be happening. By C. Nagel.","关于加沙援助的争论:对黑红来说,变化很大.","二十八个国家,法国外交官的批评,以及巴勒斯坦的承认的公报,加重了对联邦政府的压力. 特纳尔说,在加沙的呼唤中,没有足够的支持. 现在似乎有点忙了. 由西·阿德尔 (C."
