,title-de,content-de,title-en,content-en,title-zh,content-zh
63,Ministerin Hubig droht Vermietern mit Bußgeldern,"Der Bundesrat hat heute die Verlängerung der Mietpreisbremse beschlossen. Doch Bundesjustizministerin Hubig reicht das nicht aus. Sie kündigte eine Bußgeldregelung für Vermieter an, die gegen die Deckelung verstoßen.",Minister Hubig threatens landlords with fines,The Federal Council has today decided to extend the rental price brake. But Federal Justice Minister Hubig is not enough. She announced a fine scheme for landlords who violate the cap.,Hebig部长威胁要罚款给房东,联邦委员会今天决定延长租期. 但联邦国务卿赫伯格却没有这样做. 她宣布对违反禁令的房东签发罚款.
64,Union will Wahl von SPD-Kandidatin zur Verfassungsrichterin absetzen,"Eigentlich sollte der Bundestag heute über die SPD-Kandidatin für das Bundesverfassungsgericht, Brosius-Gersdorf, abstimmen. Doch SPD und Union wollen den Punkt von der Tagesordnung nehmen. Neben grundsätzlicher Kritik gibt es auch Bedenken wegen ihrer Doktorarbeit.",Union wants to dismiss election of SPD candidate as constitutional judge,"In fact, the Bundestag should vote today on the SPD candidate for the Federal Constitutional Court, Brosius-Gersdorf. However, SPD and Union want to remove the item from the agenda. In addition to fundamental criticism, there are also concerns about their doctoral thesis.",联盟希望党民党候选人投票给宪法法官,"联邦法院本应在今天投票给联邦宪法法院,Brouseius-Gersdorf. 但社民党和联盟想要将该项目从议程上除名. 除了基本的批评外,还有关于他们的博士论文的担忧."
65,Interesse von Sparern an nachhaltiger Geldanlage sinkt,Klimaziele werden aufgeweicht und viele Konzerne setzen eher wieder auf schnelle Profite: Unter US-Präsident Trump haben Nachhaltigkeit und Umweltschutz an Bedeutung verloren. Das zeigt sich auch im Verhalten von Sparern hierzulande.,Interest of savers in sustainable investment decreases,"Climate targets are softened and many companies tend to rely on fast profits again: under US President Trump, sustainability and environmental protection have lost importance. This is also evident in the behaviour of savers in this country.",储蓄者对可持续性金融资产的兴趣下降了,"气候目标受到削弱,许多公司更倾向于快速盈利:在美国总统特朗普中,可持续性和环境保护已经失去了重要性. 这在储蓄者的行为中也显现出来."
66,Einbürgerung nach drei Jahren: Wenig genutzt - und trotzdem vor dem Aus,Die neue schwarz-rote Bundesregierung will die noch von der Ampelkoalition eingeführte beschleunigte Einbürgerung wieder abschaffen. Dabei kamen bislang nur sehr wenige Menschen überhaupt in Betracht. Von Claudia Kornmeier.,Naturalization after three years: little used - and still before the end,The new black and red federal government wants to abolish the accelerated naturalisation introduced by the traffic light coalition. So far only very few people were considered. By Claudia Kornmeier.,"三年的公民身份: 很少使用,但仍未停止.","新成立的黑红政府想消除在红灯联盟中建立的加速移民潮. 迄今为止,很少有人认为是克劳迪娅·卡米耶."
67,11KM-Podcast: 30 Jahre Völkermord von Srebrenica,"Auch 30 Jahre nach dem Massaker von Srebrenica ringt die Stadt noch immer mit den Folgen. 11KM fragt: Wie lebt es sich an einem Ort, der in Europa für das größte Kriegsverbrechen seit dem Zweiten Weltkrieg steht?",11KM podcast: 30 years of genocide of Srebrenica,"Even 30 years after the Srebrenica massacre, the city is still struggling with the consequences. 11KM asks: How does it live in a place that stands for the greatest war crime since the Second World War in Europe?",11KM播客: 斯雷布雷尼察种族灭绝30年,斯雷布雷尼察大屠杀30年后 城市仍然在挣扎着后果
68,Pro-palästinensischer Aktivist fordert Entschädigung von US-Regierung,Nach Protesten gegen den Krieg in Gaza sollte der Aktivist Mahmoud Khalil aus den USA abgeschoben werden - trotz Aufenthaltsgenehmigung. Er saß 104 Tage in Abschiebehaft. Nun verlangt Khalil Schadensersatz in Millionenhöhe.,Pro-Palestinian activist demands compensation from U.S. government,"After protests against the war in Gaza, the activist Mahmoud Khalil was to be deported from the USA - despite residence permit. He was in detention for 104 days. Khalil now demands damages in millions.",亲巴勒斯坦活动家要求美国政府赔偿,"在对加沙战争进行抗议后,尽管被允许留校察看,但活动分子马哈茂德·卡里尔被驱逐出境,他被关押了104天. 现在卡里尔要求赔偿数以百万计."
69,Was man bei Fehlern im Rentenbescheid tun sollte,Kurz vor dem Start der gesetzlichen Rente erhalten Versicherte den Rentenbescheid. Der kann allerdings fehlerhaft sein. Rentnerinnen und Rentner kann das viel Geld kosten - schlimmstenfalls ein Leben lang. Von Andreas Braun,What to do in case of mistakes in the pension notice,"Just before the start of the statutory pension, insured persons receive the pension notice. However, this can be incorrect. Pensioners can cost a lot of money - at worst for a lifetime. By Andreas Braun",在养老金申请中出错时应该做些什么,"在立法退休前不久,退休金的保险金就得到保险金,但有缺陷. 退休妇女和退休妇女可以花费很多钱 - - 最坏的情况是一辈子. 由Andreas Brown提供. 安德里亚斯·布朗 (Andreas Brown) 提供."
70,Erste PKK-Kämpfer legen Waffen nieder,"Im Mai hatte die PKK angekündigt, den bewaffneten Kampf gegen den türkischen Staat zu beenden. Nun wollen die ersten der 2.000 Kämpfer im Nordirak ihre Waffen abgeben. Die Türkei setzt den Kampf gegen sie bis heute fort. Von Moritz Behrendt.",First PKK fighters put down weapons,"In May, the PKK announced that it would end the armed struggle against the Turkish state. Now, the first of the 2,000 fighters in northern Iraq want to surrender their weapons. Turkey continues the fight against them until today. By Moritz Behrendt.",第一人称PK战士放下武器,"5月,PK宣布停止与土耳其国进行武装斗争. 现在,伊拉克北部的第2000名战士中,有1个打算交出武器. 土耳其继续与他们战斗,直到现在. 由莫瑞茨·贝瑞特 (Moritz Behutt) 发起."
71,Abstimmung im Bundestag: Warum die Wahl der Verfassungsrichter so brisant ist,"Selten war die Wahl drei neuer Richter für das Bundesverfassungsgericht politisch so aufgeladen. Scheitern heute die Kandidatinnen der SPD an fehlenden Stimmen der Union, könnte das gravierende Folgen haben. Von Iris Sayram.",Voting in the Bundestag: Why the election of constitutional judges is so explosive,"Rarely was the election of three new judges so charged politically for the Federal Constitutional Court. If the SPD candidates fail today due to the lack of votes in the Union, this could have serious consequences. By Iris Sayram.",联邦选举委员会投票:为什么法官选举如此重要?,"联邦宪法法院的三位新法官很少如此政治上充电. 今天,社民党的投票缺失,可能造成严重后果. 由Iris Sayram决定."
72,Zweifel an Darstellung der Polizei nach Pro-Palästina-Demo in Berlin,"Bei einer Pro-Palästina-Kundgebung in Berlin wurde am 15. Mai ein Polizist schwer verletzt. Laut Polizei wurde er zu Boden gebracht und getreten. NDR und SZ liegt ein bisher unveröffentlichtes Video vor, das sich mit dieser Darstellung nicht deckt.",Doubts about portrayal of the police after Pro-Palestina-Demo in Berlin,"At a pro-Palestine rally in Berlin, a policeman was seriously injured on May 15. According to the police, he was brought to the ground and kicked. NDR and SZ have a previously unpublished video that does not match this performance.",警方对柏林的普罗巴蒂纳事件表示怀疑,"5月15日,在柏林的一次宣传活动中,一名警察遭到了重伤. 据警方称,他被击倒并踢了一脚. NDR和SZ有一段未公开的视频,并与此不相符."
73,"Srebrenica-Massaker: Ein Genozid, der bis heute nicht sein darf",Im Juli 1995 ermordeten bosnisch-serbische Soldaten und serbische Freischärler in Srebrenica 8.372 Bosniaken. International ist das Massaker heute als Genozid anerkannt. Viele Serben aber reden diese Taten bis heute klein. Von O. Soos.,Srebrenica Massacre: A Genocide That Must Not Be Until Today,"In July 1995, Bosnian Serb soldiers and Serb free-guards murdered 8,372 Bosniaks in Srebrenica. Today, the massacre is internationally recognized as a genocide, but many Serbs still speak of these acts as small. O. Soos.",斯雷布雷尼察大屠杀: 一种直到今天才被允许加入的种族屠杀.,"1995年7月,波斯尼亚塞族士兵和塞尔维亚解放军在斯雷布雷尼察杀害了8,372名波斯尼亚人. 国际社会今天承认屠杀是种族屠杀,但许多塞尔维亚人却说到今天,这些行为都是小规模的. 由奥·苏斯 (O. Soos) 发起的."
74,US Präsident Trump droht EU mit neuen pauschalen Strafzöllen,"Zuletzt hatte US-Präsident Trump die Frist für neue Zölle auf den 1. August verschoben. Nun droht er der EU mit neuen pauschalen Strafzöllen. Einen Brief könnte sie ""noch heute"" erhalten. Kanada bekam mittlerweile ein Schreiben.",US President Trump threatens EU with new flat-rate punitive tariffs,"Most recently, US President Trump had postponed the deadline for new tariffs to 1 August. Now, he is threatening the EU with new flat-rate punitive tariffs. She could receive a letter ""to this day"". Canada has now received a letter.",美国总统特朗普威胁要给欧盟新增关税,"美国总统特朗普最后一次将新关税期限推迟到8月1日. 现在他威胁要给欧盟新增关税. 她可能会收到一封信""今天. ""加拿大现在收到了一封信."
75,Nach Ende von Diversitäts-Programm: USA ebnen Weg für T-Mobile US,"Die US-Wettbewerbshüter haben den Weg für die milliardenschwere Übernahme von UScellular durch T-Mobile freigemacht. Zuvor hatte die Telekom-Tochter ihre Programme für Vielfalt, Gleichberechtigung und Integration auf Druck aus Washington beendet.",After the end of diversity program: USA paves the way for T-Mobile US,"The US competition guardians have cleared the way for the billion-dollar takeover of US Cellular by T-Mobile. Previously, the Telekom subsidiary had ended its programs for diversity, equality and integration under pressure from Washington.","多样化计划结束后,美国将为美国T -Mobile美国开辟一条道路.","美国参赛者已经为通过T -mobile收购数十亿美元美国奖学金铺平了道路. 到目前为止,电信女孩完成了她的多元性,平等和一体化方案,以应对来自华盛顿的压力."
76,Marktbericht: Wall Street-Anleger auf dem Sprung,Nach verhaltenem Start haben sich die Anleger an der Wall Street im Sitzungsverlauf wieder mutiger gezeigt. Mit Spannung werden die Ergebnisse der Zollverhandlungen mit der EU erwartet.,Market Report: Wall Street Investors on the Go,"After a slow start, investors on Wall Street have once again shown more courage in the course of the meeting, and the results of the customs negotiations with the EU are eagerly awaited.",市场报告: 华尔街在跳跃,"在开始行动后,华尔街的投资者在会议中再次表现出勇气. 紧张地等待着与欧盟进行关税谈判的结果."
77,Neue Hoffnung für potenzielle Contergan-Opfer nach Urteil,"Das Vorgehen, mit dem die Conterganstiftung über die Anerkennung von potenziellen Betroffenen entscheidet, entspricht nicht den gesetzlichen Vorgaben. Das hat das Bundesverwaltungsgericht entschieden. Von Christian Baars und Jana Heck.",New hope for potential Contergan victims according to judgement,"The procedure by which the Contergan Foundation decides on the recognition of potential stakeholders does not comply with the legal requirements. This has been decided by the Federal Administrative Court, by Christian Baars and Jana Heck.",康特根的潜在受害者有新的希望,康特根基金会决定承认潜在受害者的做法不符合法律规定. 这是联邦政府法庭的决定. 由克里斯蒂安·巴尔斯和贾娜·海克 (Jana Hacker) 和克里斯蒂安·海克 (Christian Baars) 提出的.
78,Nahost-Liveblog: ++ Israel lässt Treibstofflieferungen im Gazastreifen zu ++,Erstmals seit 130 Tagen haben die UN Treibstoff in den von Israel abgeriegelten Gazastreifen bringen können. In der israelischen Stadt Bat Jam hat der Abriss von mehreren im Krieg mit dem Iran beschädigten Gebäuden begonnen.,Middle East live blog: ++ Israel admits fuel deliveries in the Gaza Strip ++,"For the first time in 130 days, the UN has been able to transport fuel to the Gaza Strip sealed off by Israel. In the Israeli city of Bat Jam, several buildings damaged during the war with Iran have begun to be demolished.","中东参考博客:++以色列在加沙地带提供燃料,++++","130天以来,联合国首次能够在被以色列封锁的加沙地带 提供燃料. 在以色列首都巴特·扬,在与伊朗的战争期间,已开始拆除几座被破坏的建筑."
79,Frankreich und Großbritannien planen Tauschsystem für Migranten,"Frankreich und Großbritannien wollen die Flucht über den Ärmelkanal eindämmen - durch eine Art Tauschsystem. Details sind offen, doch Experten bezweifeln schon jetzt die Erfolgsaussichten. Von Christoph Prössl.",France and the UK plan exchange system for migrants,"France and Great Britain want to contain the flight across the English Channel - through a kind of exchange system. Details are open, but experts already doubt the chances of success. By Christoph Prössl.",法国和英国正计划对移徙者进行交换,"法国和英国想通过某种交换制度来遏制逃离英吉利海峡. 细节是开放的,但专家现在怀疑成功的可能性. 由克里斯托弗·普拉斯 (Christopher Prass) 提出."
80,Die Badehose - das Untenrum als Politikum,"Ob Pool oder Meer - für Mann gehört die Badehose seit Jahrzehnten dazu. Doch sie sorgt teils für ziemliche Diskussionen. Und offenbart, dass auch die Männerwelt durchaus mit Schönheitsidealen zu kämpfen hat. Von Dominic Konrad.",The bathing trunks - the bottom as a political,Whether pool or sea - for man the swimwear has been part of it for decades. But it partly provides for quite a discussion. And reveals that the men's world also has to fight with beauty ideals. By Dominic Konrad.,泳衣 - - 底层作为政治环境,"无论是泳池还是海洋,男人的泳衣几十年来都包括了它. 但它也引起了不少的讨论. 它还暴露出男子世界也与美容界有斗争. 由多米尼克·康拉德 (多米尼克·康拉德) 提供."
81,Abgeordnete müssen Regenbogenfahne aus Bundestagsbüros entfernen,"Die Regenbogenflagge steht als Zeichen der Toleranz und der Verbundenheit mit queeren Menschen - oder auch als Friedenssymbol. Derzeit wird sie zunehmend zum Politikum, auch wenn sie an einem Bundestagsbüro hängt. Von H. Schwesinger.",Members must remove rainbow flag from Bundestag offices,"The rainbow flag stands as a sign of tolerance and attachment to queer people - or also as a symbol of peace. At present, it is increasingly becoming a political area, even if it is attached to a Bundestag office. By H. Schwesinger.",国会议员必须把彩虹旗从联邦办公室撤走,"彩虹旗是宽容和宽容的象征,也是和平的象征. 现在它成为政治的象征,即使它挂在一个联邦会议上. 由斯威辛格 (H. Schweesinger) 领导."
82,"Ukraine-Liveblog: ++ Deutschland will zwei ""Patriot""-Systeme finanzieren ++","Nach Angaben des ukrainischen Präsidenten Selenskyj will Deutschland für zwei ""Patriot""-Luftabwehrsysteme zahlen, Norwegen für eines. Von Paris aus soll die ""Koalition der Willigen"" einen möglichen Waffenstillstand in der Ukraine unterstützen.","Ukraine live blog: ++ Germany wants to finance two ""patriot"" systems ++","According to Ukrainian President Selenskyy, Germany wants to pay for two ""patriot"" air defense systems, Norway for one. From Paris, the ""coalition of the willing"" is supposed to support a possible ceasefire in Ukraine.","乌克兰立体博客:++德国想为两个""爱国者""系统融资++","根据乌克兰总统塞伦斯基的说法,德国打算支付两家""爱国者""空军防御系统,一个是挪威. 从巴黎出发,""自愿联盟""将支持乌克兰的停战协议."
83,Ukraine braucht rund 850 Milliarden für Wiederaufbau,Nach dem Ende des Krieges benötigt Kiew nach eigenen Schätzungen Hunderte Milliarden Euro für den Wiederaufbau. Laut Kanzler Merz soll Russland für einen Großteil davon aufkommen. Bis dahin versprach er weitere Waffenlieferungen.,Ukraine needs about 850 billion for reconstruction,"After the end of the war, Kiev, according to its own estimates, needs hundreds of billions of euros for reconstruction. According to Chancellor Merz, Russia is expected to pay for a large part of it.",乌克兰需要约8500亿美元重建,"战争结束后,基辅自己估计需要数千亿欧元来重建. 根据梅兹总理的说法,俄罗斯要大体上承担这些责任. 在此之前,他承诺要提供更多的武器."
84,"Kommentar zur Enquete-Kommission: Wenn aufklären, dann richtig","Die Aufarbeitung der Corona-Pandemie ist aus Sicht von Birthe Sönnichsen überfällig. Doch es müsse um mehr gehen, als bekannte Probleme neu zu benennen. Und benötigte Hilfe dürfe durch die Aufarbeitung nicht aufgeschoben werden.","Comment on the Enquete Commission: When Enlighten, then correct","The processing of the Corona pandemic is overdue from the point of view of Birthe Sönnichsen. However, it had to be about more than renouncing known problems. And needed help should not be delayed by the processing.","对英克尔委员会发表评论: 如果澄清真相,就正确地解释","科罗娜大流行病在伯瑟·索尼森看来已经过时了. 但是,除了重新确定问题之外,还需要更多的问题. 处理过程中不需要任何帮助."
85,Misstrauensvotum gegen von der Leyen - möglichst schnell vom Tisch,Nach einer aufgeregten Debatte zu Beginn der Woche hat das EU-Parlament das Misstrauensvotum gegen Kommissionspräsidentin von der Leyen geräuschlos abgeräumt. Das Votum zeigt die Spaltung des Parlaments. Von Sabrina Fritz.,Mistrust vote against the Leyen - as soon as possible off the table,"After an excited debate at the beginning of the week, the EU Parliament has silently removed the vote of distrust against the President of the Commission from the leyen. The vote shows the division of Parliament. By Sabrina Fritz.",莱昂人持怀疑态度 越快越好,"本周早些时候的激烈辩论后,欧盟议会消除了对委员会主席雷恩的不信任. 投票结果显示议会的分歧. 由莎宾娜·弗里茨 (Sabrina Fritz) 提出."
86,Bundestag beschließt Enquete-Kommission zur Corona-Pandemie,"Die Aufarbeitung der Corona-Pandemie durch eine Enquete-Kommission ist beschlossen. Der Bundestag votierte mehrheitlich für das Gremium, das auf die Pandemie zurückblicken und Lehren für die Zukunft ziehen soll.",Bundestag decides Enquete Commission on the Corona pandemic,"The preparation of the Corona pandemic by an Enquete Commission has been decided. The Bundestag voted for the majority of the panel, which should look back on the pandemic and draw lessons for the future.",联邦委员会决定科罗纳州大流行病的安奎特委员会 (Enquete Committee Committee),"科罗娜大流行病的起草已经决定了. 联邦会议为该委员会提供了多元性,该委员会应该回顾大流行病,并为未来提供教训."
87,VW stoppt Lieferung des Elektro-Bulli ID.Buzz in die USA,Volkswagen verschifft vorerst keine Kleinbusse seines Modells ID.Buzz mehr in die Vereinigten Staaten. Der Konzern begründet dies mit einer zu breiten Rückbank. Offenbar spielen auch die Zölle eine Rolle.,VW stops delivery of the electric jumper ID.Buzz to the USA,Volkswagen no longer ships minibuses of its model ID.Buzz to the United States for the time being. The Group is justifying this with an over-wide reverse bank.,VW停止向美国运送电子牛标识. Buzzz,人民车暂时不再把模型IDBuzz送往美国. 公司用过宽的后座来解释. 显然关税也起着作用.
88,"U-Boot-Geschäft: Netanjahu wollte, dass Merkels Berater entlassen wird","Ein U-Boot-Deal zwischen Deutschland und Israel aus der Merkel-Zeit sorgte wiederholt für Aufregung. Panorama-Recherchen zeigen nun, dass Premier Netanjahu im Zuge der Verhandlungen die Entlassung von Merkel-Berater Heusgen forderte.",Submarine business: Netanyahu wanted Merkel's advisor to be dismissed,A submarine deal between Germany and Israel from the Merkel era caused a lot of excitement. Panorama research now shows that Prime Minister Netanyahu called for the dismissal of Merkel's advisor Heusgen during the negotiations.,内塔尼亚胡希望默克尔的顾问被解雇,"默克尔时代德国和以色列之间的潜艇交易一再引起了轰动. 泛美调查显示,在谈判中,内塔尼亚胡总理要求释放默克尔-豪森根顾问."
