,title-en,content-en,title-de,content-de,title-es,content-es,title-fr,content-fr,title-zh,content-zh
65,How to hand off data privacy responsibilities for older adults to a trusted loved one,"Managing data privacy for older adults has become increasingly difficult. Threats evolve constantly, security settings change frequently, and scammers get smarter. Fortunately, you don&apos;t have to handle this alone.",Wie man die Verantwortung für den Datenschutz für ältere Erwachsene an einen vertrauenswürdigen geliebten Menschen abgibt,"Die Verwaltung des Datenschutzes für ältere Erwachsene ist immer schwieriger geworden. Bedrohungen entwickeln sich ständig, Sicherheitseinstellungen ändern sich häufig, und Betrüger werden intelligenter. Glücklicherweise müssen Sie don&apos;t allein damit umgehen.",Cómo transferir responsabilidades de privacidad de datos para adultos mayores a un ser querido de confianza,"La gestión de la privacidad de los datos para los adultos mayores se ha vuelto cada vez más difícil.Las amenazas evolucionan constantemente, los ajustes de seguridad cambian con frecuencia y los estafadores se vuelven más inteligentes.",Comment transférer les responsabilités en matière de confidentialité des données pour les personnes âgées à un être cher de confiance,"La gestion de la confidentialité des données pour les personnes âgées est devenue de plus en plus difficile. Les menaces évoluent constamment, les paramètres de sécurité changent fréquemment et les arnaqueurs deviennent plus intelligents.",如何将老年人的数据隐私责任移交给受信任的亲人,"管理老年人数据隐私已变得越来越困难。 威胁不断变化,安全环境变化频繁,诈骗者变得更加聪明。 幸运的是,你不必独自处理。"
66,Viral Costco cookie blends childhood favorites into one: 'Out of this world',"Costco&apos;s new Kirkland Signature Marshmallow Crispy Cookies are going viral as customers rush to buy the $9.99 box that combines nostalgic flavors into a gooey, chewy dessert.",Viral Costco-Cookie mischt Kindheits-Favoriten zu einem: 'Aus dieser Welt',"Costco&apos;s neue Kirkland Signature Marshmallow Crispy Cookies gehen viral, da Kunden eilen, die $9.99 Box zu kaufen, die nostalgische Aromen zu einem gooey, kautigen Dessert kombiniert.",La cookie Viral Costco mezcla los favoritos de la infancia en uno: 'Fuera de este mundo',Costco&apos;s nuevo Kirkland Signature Marshmallow Crispy Las cookies se están volviendo virales mientras los clientes se apresuran a comprar la caja de $9.99 que combina sabores nostálgicos en un postre pegajoso y masticable.,Le cookie Viral Costco mélange les favoris de l'enfance en un : 'Out of this world',"Costco&apos;s nouveau Kirkland Signature Marshmallow Crispy Les cookies vont viral comme les clients se précipitent pour acheter la boîte de 9,99 $ qui combine les saveurs nostalgiques dans un goey, dessert à croquer.",Viral Costco饼干将童年最喜爱的曲子混为一:“走出这个世界”,"Costco&apos; 新建的Kirkland 标志性棉花糖脆脆饼干正在发作, 客户急忙购买9.99美元的盒子,"
67,5 bizarre moments from Hunter Biden's interview meltdown,"In a podcast rant, Hunter Biden claimed George Clooney sabotaged former President Joe Biden&apos;s campaign, criticized Democratic leaders and compared President Donald Trump&apos;s supporters to the KKK.",5 bizarre Momente aus Hunter Bidens Interview,"In einem Podcast-Rang behauptete Hunter Biden, George Clooney sabotierte den ehemaligen Präsidenten Joe Biden&apos;s Kampagne, kritisierte demokratische Führer und verglich Präsident Donald Trump&apos;s Anhänger mit der KKK.",5 extraños momentos de la crisis de la entrevista de Hunter Biden,"En un podcast, Hunter Biden afirmó que George Clooney saboteó la campaña del ex presidente Joe Biden&apos, criticó a los líderes demócratas y comparó al presidente Donald Trump&apos con los partidarios del KKK.",5 moments bizarres de l'interview de Hunter Biden,"Dans une rumeur podcast, Hunter Biden prétend que George Clooney a saboté l'ancien président Joe Biden&apos;s campagne, critiqué les dirigeants démocratiques et comparé le président Donald Trump&apos;s partisans du KKK.",亨特·拜登采访崩溃后 5个奇异的瞬间,Hunter Biden声称乔治·克鲁尼曾破坏前总统乔·拜登加波斯(Joe Biden&apos);
68,Trump endorses GOP senator years after asserting 'I will never endorse this jerk again',President Donald Trump endorsed GOP Sen. Mike Rounds of South Dakota after previously declaring in 2022 that he would never endorse the senator again.,"Trump unterstützt GOP-Senator Jahre nach der Behauptung ""Ich werde nie wieder diesem Idioten zustimmen""","Präsident Donald Trump unterstützte GOP Sen. Mike Rounds von South Dakota, nachdem er zuvor 2022 erklärt hatte, dass er den Senator nie wieder unterstützen würde.","Trump apoya al senador del Partido Republicano años después de afirmar ""Nunca más apoyaré a este idiota""",El presidente Donald Trump apoyó al senador del Partido Republicano Mike Rounds de Dakota del Sur después de declarar previamente en 2022 que nunca volvería a apoyar al senador.,Trump soutient le sénateur GOP des années après avoir affirmé « Je ne soutiendrai plus jamais ce crétin »,Le président Donald Trump a soutenu GOP Sen. Mike Rounds du Dakota du Sud après avoir déclaré précédemment en 2022 qu'il n'approuverait plus jamais le sénateur.,"特朗普支持GOP参议员多年后 声称""我决不会再支持这个混蛋""","总统唐纳德·特朗普支持GOP Sen, 南达科他州麦克回合在2022年宣布他将不再支持参议员。"
69,Colbert tells Trump to 'go f--- yourself’ after president taunts him over show cancellation,"Late-night host Stephen Colbert had a vulgar retort to President Donald Trump taunting him over his cancellation, saying &quot;go f--- yourself&quot; to audience cheers.",Colbert sagt Trump zu gehen f---- nachdem Präsident verspottet ihn über Show-Stornierung,"Der späte Gastgeber Stephen Colbert hatte eine vulgäre Retorte an Präsident Donald Trump, der ihn wegen seiner Kündigung verspottete und sagte &quot;go f---- yourself&quot; to audience jubels.","Colbert le dice a Trump que ""ve tú mismo"" después de que el presidente se burle de él por cancelación de show","El anfitrión nocturno Stephen Colbert tuvo una respuesta vulgar al presidente Donald Trump burlándose de él por su cancelación, diciendo &quot;go f--- you&quot; a la audiencia saluda.",Colbert dit à Trump de « aller f--- vous-même » après que le président l'emmerde sur l'annulation du spectacle,"Stephen Colbert, l'hôte de la nuit, a eu une rétorsion vulgaire au président Donald Trump qui l'a interpellé à cause de son annulation, en disant que vous--- vous---quot; aux applaudissements du public.","高拔告诉特朗普在总统责骂他取消演出后,","深夜主持人Stephen Colbert向Donald Trump总统提出粗俗的反驳,"
70,Deputy AG seeks Ghislaine Maxwell meeting in Epstein investigation,"DOJ Deputy AG Todd Blanche reaches out to Ghislaine Maxwell for cooperation in the Epstein investigation, marking a shift under Attorney General Pam Bondi.",Deputy AG sucht Ghislaine Maxwell Treffen in Epstein Untersuchung,DOJ Deputy AG Todd Blanche wendet sich an Ghislaine Maxwell für die Zusammenarbeit bei der Epstein-Untersuchung und markiert eine Verschiebung unter Generalstaatsanwalt Pam Bondi.,AG adjunta busca reunión de Ghislaine Maxwell en la investigación de Epstein,"El subdiputado del DOJ, Todd Blanche, busca la cooperación de Ghislaine Maxwell en la investigación de Epstein, marcando un cambio bajo el mando de la Fiscal General Pam Bondi.",L'adjoint de l'AG demande la réunion de Ghislaine Maxwell dans l'enquête Epstein,"L'adjoint de l'AG Todd Blanche du DOJ s'adresse à Ghislaine Maxwell pour obtenir sa collaboration dans l'enquête Epstein, marquant ainsi un changement sous la direction du procureur général Pam Bondi.",AG帮办要求Ghislaine Maxwell 在Epstein调查中会面,"司法部助理助理AG Todd Blanche 与Ghislaine Maxwell联系,请求在Epstein调查中给予合作,标志着司法部长Pam Bondi的轮班。"
71,House Republicans warn anti-ICE rhetoric from Democrats is driving violent attacks on agents,"House Republicans condemn violence against ICE and CBP officers amid President Donald Trump&apos;s immigration crackdown, blaming Democrats for inflaming tensions.",House Republikaner warnen Anti-ICE-Rhetorik von Demokraten treibt gewalttätige Angriffe auf Agenten,"House Republikaner verurteilen Gewalt gegen ICE- und CBP-Offiziere inmitten von Präsident Donald Trump&apos; es ist ein Immigrationsangriff, der Demokraten die Schuld für entzündende Spannungen gibt.",Republicanos de la Cámara advierten retórica anti-ICE de demócratas está impulsando ataques violentos contra agentes,"Los republicanos condenan la violencia contra los oficiales del ICE y el CBP en medio del presidente Donald Trump&apos; la represión migratoria, culpando a los demócratas por exacerbar las tensiones.",Les Républicains de la Chambre mettent en garde contre la rhétorique anti-ICE des Démocrates est à l'origine d'attaques violentes contre des agents,"Les républicains de la Chambre condamnent la violence contre les agents de l'ICE et du CBP au milieu du président Donald Trump&apos; la répression de l'immigration, blâmant les démocrates pour avoir enflammé les tensions.","众议院共和党警告民主党反对ICE的言论,","众议院共和党谴责针对ICE和CBP官员的暴力行为,"
72,Trump pulls US out of UN agency over its backing of 'woke' social causes,"The Trump administration announced Tuesday that the U.S. would pull out of a United Nations agency over its &quot;globalist, ideological agenda&quot; and anti-Israel bias.","Trump zieht die USA aus der UN-Agentur wegen ihrer Unterstützung für ""erwachte"" soziale Ursachen heraus","Die Trump-Administration kündigte am Dienstag an, dass die USA eine Organisation der Vereinten Nationen wegen ihrer &quot;globalistischen, ideologischen Agenda&quot; und anti-israelischen Vorlieben ausziehen würden.","Trump saca a EE.UU. de la agencia de la ONU por su respaldo a las causas sociales ""despertadas""","La administración Trump anunció el martes que Estados Unidos se retiraría de una agencia de las Naciones Unidas sobre su &quot;globalista, agenda ideológica&quot; y sesgo anti-Israel.",Trump retire les États-Unis de l'agence de l'ONU pour son soutien aux causes sociales «woke»,"L'administration Trump a annoncé mardi que les États-Unis se retireraient d'une agence des Nations Unies sur son agenda globaliste, idéologique et anti-israélienne.",特朗普把美国从联合国机构拉出 来支持“唤醒”社会事业,"特朗普政府周二宣布美国将退出一个联合国机构,"
73,Colorado's Deion Sanders admits he's 'still going through something' as football season approaches,"Deion Sanders is playing basketball and tennis and getting his training in, while admitting that he still hasn&apos;t fully recovered from an undisclosed health issue.","Colorados Deion Sanders gibt zu, dass er immer noch etwas durchmacht, während sich die Fußballsaison nähert.","Deion Sanders spielt Basketball und Tennis und bekommt sein Training in, während er zugibt, dass er immer noch&apos;t vollständig von einem ungeklärten Gesundheitsproblem erholt hat.",Deion Sanders de Colorado admite que 'todavía está pasando por algo' a medida que se acerca la temporada de fútbol,"Deion Sanders está jugando al baloncesto y al tenis y entrenando, mientras admite que todavía tiene &apos;t totalmente recuperado de un problema de salud no revelado.","Deion Sanders, du Colorado, admet qu'il « traverse toujours quelque chose » à l'approche de la saison du football","Deion Sanders joue au basketball et au tennis et s'entraîne, tout en admettant qu'il n'a toujours pas réussi à se remettre d'un problème de santé non divulgué.",科罗拉多的Deion Sanders承认 随着足球赛季的临近 他仍在经历一些事情,"Deion Sanders正在打篮球和网球, 并接受训练, 同时承认他仍拥有&apos; 从未披露的健康问题中完全康复。"
74,Federal judge slaps temporary restraining order on Mississippi DEI ban,"Mississippi law banning diversity, equity and inclusion programs in public schools and universities paused by federal judge who cited free speech concerns.",Bundesrichter schlägt einstweilige einstweilige Verfügung gegen Mississippi DEI Verbot,"Mississippi-Gesetz Verbot von Vielfalt, Gerechtigkeit und Inklusion Programme in öffentlichen Schulen und Universitäten innegehalten durch Bundesrichter zitiert Redefreiheit Bedenken.",Juez federal abofetea orden de restricción temporal sobre la prohibición de Mississippi DEI,"La ley de Mississippi que prohíbe la diversidad, la equidad y los programas de inclusión en las escuelas públicas y universidades se detuvo por el juez federal que citó preocupaciones de libertad de expresión.",Le juge fédéral gifle une ordonnance de restriction temporaire à l'interdiction de la DEI du Mississippi,"La loi du Mississippi interdisant les programmes de diversité, d'équité et d'inclusion dans les écoles publiques et les universités a été suspendue par un juge fédéral qui a cité les préoccupations relatives à la liberté d'expression.",联邦法官对密西西西比州DEI禁令的临时限制令给予耳光,"禁止公立学校和大学实行多样性、公平和包容方案的密西西比法律被联邦法官暂停,他援引了言论自由问题。"
75,San Francisco close to taking new step to fight homelessness,San Francisco is set to crack down on homelessness with officials voting on strict new parking limits for recreational vehicles throughout the city.,San Francisco steht kurz vor einem neuen Schritt zur Bekämpfung der Obdachlosigkeit,"San Francisco wird gegen Obdachlosigkeit vorgehen, wobei Beamte über strenge neue Parkgrenzen für Freizeitfahrzeuge in der ganzen Stadt abstimmen.",San Francisco cerca de dar un nuevo paso para luchar contra las personas sin hogar,San Francisco está dispuesto a reprimir la falta de vivienda con funcionarios votando sobre nuevos límites estrictos de estacionamiento para vehículos recreativos en toda la ciudad.,San Francisco est sur le point de prendre de nouvelles mesures pour lutter contre les sans-abri,San Francisco est sur le point de réprimer les sans-abri avec des fonctionnaires votant sur de nouvelles limites de stationnement strictes pour les véhicules récréatifs dans toute la ville.,"旧金山接近采取新步骤,解决无家可归问题","旧金山将打击无家可归现象, 官员们将投票决定全市娱乐车辆的新停车限制,"
76,27 inmates from notorious Iranian prison still at large after Israeli strike: Tehran,"Iranian media is reporting that 27 inmates from the notorious Evin Prison are still at large following Israel&apos;s strike on the facility last month, according to the Associated Press.",27 Häftlinge aus dem berüchtigten iranischen Gefängnis nach dem israelischen Streik noch auf freiem Fuß: Teheran,"Iranische Medien berichten, dass 27 Insassen des berüchtigten Evin Gefängnisses nach dem Streik von Israel&apos im vergangenen Monat noch auf freiem Fuß sind, so die Associated Press.",27 presos de la famosa prisión iraní siguen prófugos después de la huelga israelí: Teherán,"Los medios iraníes informan que 27 presos de la famosa prisión de Evin siguen prófugos tras la huelga de Israel y Apos el mes pasado, según Associated Press.",27 détenus de la célèbre prison iranienne toujours en liberté après la grève israélienne: Téhéran,"Selon les médias iraniens, 27 détenus de la célèbre prison d'Evin sont toujours en liberté après la grève d'Israël le mois dernier, selon l'Associated Press.","以色列发动袭击后,臭名昭著的伊朗监狱的27名囚犯仍然在逃:德黑兰","伊朗媒体报导, 臭名昭著的Evin监狱27名囚犯仍逍遥法外,"
77,Backyard party essentials to simplify summer entertaining,Summer entertaining is easier with the right supplies. Consider these 10 items to enhance your next soirée — from grill tools and coolers to fire pits and lawn games.,"Hinterhof Partei wesentliche, um den Sommer unterhaltsam zu vereinfachen","Sommerunterhaltung ist einfacher mit den richtigen Vorräten. Betrachten Sie diese 10 Artikel, um Ihre nächste Soirée zu verbessern — von Grill-Werkzeuge und Kühler, Feuergruben und Rasenspiele.",Lo esencial de la fiesta en el patio trasero para simplificar el entretenimiento de verano,"El entretenimiento de verano es más fácil con los suministros adecuados. Considere estos 10 artículos para mejorar su próxima velada, desde herramientas de parrilla y refrigeradores a fogatas y juegos de césped.",Les essentiels de la fête d'arrière-cour pour simplifier les divertissements d'été,L'été est plus facile avec les bons approvisionnements. Considérez ces 10 articles pour améliorer votre prochaine soirée - des outils de grill et de glacières aux foyers et jeux de pelouse.,简化夏季娱乐的后院派对必需品,"夏日娱乐比较容易得到合适的用品。考虑这10件物品来提升你的下一个小屋,从烧烤工具和冷却器到火坑和草坪游戏。"
78,Illinois coroner releases new details about woman found dead on illegal immigrant's property,An Illinois coroner has refuted claims that a woman found dead in a storage container at the home of an illegal immigrant was decapitated.,Illinois Gerichtsmediziner veröffentlicht neue Details über Frau tot auf illegalem Immigranten Eigentum gefunden,"Ein Gerichtsmediziner aus Illinois widerlegte die Behauptung, eine Frau, die tot in einem Lagercontainer eines illegalen Einwanderers aufgefunden worden sei, sei enthauptet worden.",El forense de Illinois publica nuevos detalles sobre la mujer encontrada muerta en propiedad de inmigrantes ilegales,Un forense de Illinois ha refutado las afirmaciones de que una mujer encontrada muerta en un contenedor de almacenamiento en la casa de un inmigrante ilegal fue decapitada.,Le coroner de l'Illinois publie de nouveaux détails sur la femme retrouvée morte sur la propriété de l'immigrante illégale,Un coroner de l'Illinois a réfuté les allégations selon lesquelles une femme retrouvée morte dans un conteneur à la maison d'un immigrant clandestin a été décapité.,伊利诺伊州验尸官公布 有关在非法移民财产上 被发现死亡的妇女的新细节,"一名伊利诺伊州验尸官反驳了有关一名妇女被发现死在非法移民家中的一个储藏箱里的说法,该妇女被斩首。"
79,Germany calls for stronger international cooperation to implement the 2030 Agenda,"Germany presented its third Voluntary National Review (VNR) today at the United Nations in New York. At the annual High-level Political Forum (HLPF) on Sustainable Development, representatives of governments, civil society, the scientific community and business come together to evaluate progress on implementing the 2030 Agenda.",Deutschland fordert stärkere internationale Zusammenarbeit zur Umsetzung der Agenda 2030,"Deutschland präsentierte heute bei den Vereinten Nationen in New York seinen dritten Voluntary National Review (VNR). Auf dem jährlichen High-Level Political Forum (HLPF) zum Thema Nachhaltige Entwicklung treffen sich Vertreter von Regierungen, Zivilgesellschaft, Wissenschaft und Wirtschaft, um die Fortschritte bei der Umsetzung der Agenda 2030 zu bewerten.",Alemania pide una cooperación internacional más fuerte para aplicar la Agenda 2030,"Alemania presentó hoy su tercer Examen Nacional Voluntario (VNR) en las Naciones Unidas en Nueva York. En el Foro Político Anual de Alto Nivel (HLPF) sobre Desarrollo Sostenible, representantes de los gobiernos, la sociedad civil, la comunidad científica y las empresas se reúnen para evaluar los progresos en la aplicación de la Agenda 2030.",L'Allemagne appelle au renforcement de la coopération internationale pour mettre en œuvre le programme à l'horizon 2030,"L'Allemagne a présenté aujourd'hui son troisième examen national volontaire aux Nations Unies à New York. Au Forum politique de haut niveau annuel sur le développement durable, des représentants des gouvernements, de la société civile, de la communauté scientifique et des entreprises se réunissent pour évaluer les progrès réalisés dans la mise en œuvre du Programme 2030.","德国呼吁加强国际合作,执行《2030年议程》","德国今天在纽约联合国提交了第三次国家自愿审查报告,在关于可持续发展问题的年度高级别政治论坛上,各国政府、民间社会、科学界和工商界的代表聚集一堂,评价《2030年议程》的执行进展情况。"
80,Statement of German Development Minister Reem Alabali Radovan at Ukraine Recovery Conference,"""The headlines of the last few days should shake us all. Russia is attacking Ukraine more and more brutally. We are seeing the worst attacks since the beginning of the war. Every day, people are killed and injured. Every day, fear. For more than three years now, Ukraine has been fighting for its freedom, for democracy, but also for our security, for Europe. Germany stands in solidarity with Ukraine. Ukraine can count on our support.""",Erklärung des deutschen Entwicklungsministers Reem Alabali Radovan auf der Ukraine Recovery Conference,"„Die Schlagzeilen der letzten Tage sollten uns alle erschüttern. Russland greift die Ukraine immer brutaler an. Wir sehen die schlimmsten Angriffe seit Beginn des Krieges. Jeden Tag werden Menschen getötet und verletzt. Jeden Tag Angst. Seit mehr als drei Jahren kämpft die Ukraine für ihre Freiheit, für Demokratie, aber auch für unsere Sicherheit, für Europa. Deutschland steht in Solidarität mit der Ukraine. Die Ukraine kann auf unsere Unterstützung zählen.""","Declaración del Ministro de Desarrollo de Alemania, Reem Alabali Radovan, en la Conferencia de Recuperación de Ucrania","""Los titulares de los últimos días deberían sacudirnos a todos. Rusia está atacando a Ucrania cada vez más brutalmente. Estamos viendo los peores ataques desde el comienzo de la guerra. Todos los días, las personas mueren y resultan heridas. Todos los días, el miedo. Desde hace más de tres años, Ucrania ha estado luchando por su libertad, por la democracia, pero también por nuestra seguridad, por Europa. Alemania se solidariza con Ucrania. Ucrania puede contar con nuestro apoyo"".","Déclaration du ministre allemand du développement, Reem Alabali Radovan, à la conférence sur la relance de l'Ukraine","La Russie attaque de plus en plus brutalement l'Ukraine. Nous voyons les pires attaques depuis le début de la guerre. Chaque jour, des gens sont tués et blessés. Chaque jour, la peur. Depuis plus de trois ans, l'Ukraine lutte pour sa liberté, pour la démocratie, mais aussi pour notre sécurité, pour l'Europe. L'Allemagne est solidaire avec l'Ukraine. L'Ukraine peut compter sur notre soutien. »",德国发展部长雷姆·阿拉巴利·拉多万在乌克兰恢复会议上的发言,"“过去几天的头条新闻应该震撼我们所有人。俄罗斯越来越残酷地攻击乌克兰。我们看到了自战争开始以来最严重的袭击。每天都有人伤亡。每天都有人伤亡。每天都有恐惧。三年多来,乌克兰一直在为自由、民主以及欧洲的安全而斗争。德国与乌克兰站在一起。乌克兰可以指望我们的支持。 ”"
81,Germany remains reliable partner in the fight against global diseases,"Germany will continue to support global efforts to protect people from preventable diseases. Today in Brussels, at the replenishment conference for Gavi, the Vaccine Alliance, German Development Minister Reem Alabali Radovan will pledge a total of 600 million euros for the period up to 2030.",Deutschland bleibt verlässlicher Partner im Kampf gegen globale Krankheiten,Deutschland wird die weltweiten Bemühungen um den Schutz von Menschen vor vermeidbaren Krankheiten weiter unterstützen. Heute wird der deutsche Entwicklungsminister Reem Alabali Radovan in Brüssel auf der Wiederauffüllungskonferenz für Gavi bis 2030 insgesamt 600 Millionen Euro versprechen.,Alemania sigue siendo un socio fiable en la lucha contra las enfermedades mundiales,"Alemania seguirá apoyando los esfuerzos mundiales para proteger a las personas de las enfermedades prevenibles. Hoy, en Bruselas, en la conferencia de reposición para Gavi, la Alianza de Vacunas, el ministro de Desarrollo alemán Reem Alabali Radovan se comprometerá a un total de 600 millones de euros para el período hasta 2030.",L'Allemagne reste un partenaire fiable dans la lutte contre les maladies mondiales,"L'Allemagne continuera à soutenir les efforts mondiaux de protection des personnes contre les maladies évitables. Aujourd'hui, à Bruxelles, lors de la conférence de reconstitution pour Gavi, l'Alliance Vaccine, le ministre allemand du Développement, Reem Alabali Radovan, promettra un total de 600 millions d'euros pour la période allant jusqu'à 2030.",德国在防治全球疾病的斗争中仍然是可靠的伙伴,"德国将继续支持保护人们免受可预防疾病影响的全球努力。 今天,在布鲁塞尔举行的加维(Gavi)补充会议上,德国发展部长雷姆·阿拉巴利·拉多万(Reem Alabali Radovan)将为2030年之前的时期认捐总额6亿欧元。"
