,title-en,content-en,title-de,content-de,title-es,content-es,title-fr,content-fr,title-zh,content-zh
0,The world court joins the fight over climate change,Its ruling that burning fossil fuels can be “internationally wrongful” risks provoking a backlash,Der Weltgerichtshof tritt dem Kampf um den Klimawandel bei,"Seine Entscheidung, fossile Brennstoffe zu verbrennen, kann international falsch sein, birgt die Gefahr, eine Gegenreaktion zu provozieren.",La corte mundial se une a la lucha por el cambio climático,Su decisión de que la quema de combustibles fósiles puede ser “internacionalmente ilícita” corre el riesgo de provocar una reacción negativa,La Cour mondiale se joint à la lutte contre le changement climatique,Sa décision selon laquelle la combustion de combustibles fossiles peut être internationalement illicite risque de provoquer un contrecoup,世界法院加入应对气候变化的斗争,其裁决认为燃烧化石燃料可能“国际不法行为”可能引发反弹
1,"Economic data, commodities and markets",,"Wirtschaftsdaten, Rohstoffe und Märkte",,"Datos económicos, productos básicos y mercados",,"Données économiques, produits de base et marchés",,经济数据、商品和市场,
2,"Booze, bills and $500,000 photoshoots: the golden age of magazines","Two new books look at the heyday of Vanity Fair, Vogue and their ilk","Alkohol, Rechnungen und 500.000 Dollar Fotoshootings: das goldene Zeitalter der Zeitschriften","Zwei neue Bücher schauen auf die Blütezeit der Vanity Fair, Vogue und ihre Ilk","Alcohol, facturas y $500.000 sesiones fotográficas: la edad de oro de las revistas","Dos nuevos libros miran el apogeo de Vanity Fair, Vogue y su calaña","Booze, billets et 500 000 photoshoots : l'âge d'or des magazines","Deux nouveaux livres regardent l'apogée de Vanity Fair, Vogue et leur ilk",酒、帐单和500 000美元的照片:杂志的黄金时代,"两本新书,看看《名利集市》的顶峰,《Vogue》和《Vogue》和《Their lalk》"
3,How satire is adapting to the second coming of Donald Trump,The conservative Babylon Bee is finding it easier than the Onion,Wie Satire sich an das zweite Kommen von Donald Trump anpasst,Die konservative Babylon Bee findet es leichter als die Zwiebel,Cómo se está adaptando la sátira a la segunda venida de Donald Trump,El conservador Babylon Bee lo encuentra más fácil que la Cebolla,Comment satire s'adapte à la seconde venue de Donald Trump,Le conservateur Babylon Bee le trouve plus facile que l'oignon,如何适应Donald Trump的第二次来临,保守的巴比伦蜜蜂发现比洋葱更容易
4,How much would you pay to nab a table at a swanky restaurant?,A tech bro created a viral reservation-trading website. The industry wants to shut it down,"Wie viel würden Sie zahlen, um einen Tisch in einem schäbigen Restaurant zu nageln?",Ein Tech-Bro erstellt eine virale Reservierung-Handels-Website. Die Industrie will es herunterfahren,¿Cuánto pagarías por agarrar una mesa en un restaurante elegante?,Un técnico bro creó un sitio web viral de reserva-negociación. La industria quiere cerrarlo,Combien payeriez-vous pour prendre une table dans un restaurant maladroit ?,Un tech bro a créé un site web de réservation virale. L'industrie veut l'arrêter.,你要花多少钱去 一家烂餐厅买餐桌?,一个技术兄弟创建了一个病毒预订交易网站。该行业希望关闭该网站。
5,Can Grab and GoTo forge a South-East Asian tech champion?,A rumoured merger may be scuppered by Indonesia’s government,Kann Grab und GoTo einen südostasiatischen Tech-Champion schmieden?,Eine angebliche Fusion kann von der indonesischen Regierung verwüstet werden,¿Puede tomar y ir a forjar un campeón de tecnología del sudeste asiático?,Una fusión rumoreada puede ser escupida por el gobierno de Indonesia,Est-ce que Grab et GoTo peuvent forger un champion de technologie en Asie du Sud-Est?,Une fusion rumeur peut être stupéfaite par le gouvernement indonésien,能够和GoTo一起打造东南亚科技冠军吗?,印尼政府可能会推翻一宗有谣言的兼并。
6,The rail mega-merger that could transform American supply chains,A tie-up between Union Pacific and Norfolk Southern would be messy but powerful,"Der Eisenbahn-Mega-Merger, der amerikanische Lieferketten verändern könnte","Eine Verbindung zwischen Union Pacific und Norfolk Southern wäre chaotisch, aber mächtig.",La megafusión ferroviaria que podría transformar las cadenas de suministro estadounidenses,Un empate entre Union Pacific y Norfolk Southern sería desordenado pero poderoso,La mégafusion ferroviaire qui pourrait transformer les chaînes d'approvisionnement américaines,Un lien entre Union Pacific et Norfolk Southern serait désordonné mais puissant,能够改变美国供应链的铁路巨型合并,太平洋联盟和南诺福克的分界线 将会是混乱但强大的
7,The Gulf’s oil giants risk becoming sprawling conglomerates,"Although many of their investments have a commercial logic, the result looks increasingly unwieldy","Die Ölriesen der Golfstaaten riskieren, sich ausbreitende Konglomerate zu entwickeln","Obwohl viele ihrer Investitionen eine kommerzielle Logik haben, sieht das Ergebnis zunehmend unhandlich",Los gigantes petroleros del Golfo corren el riesgo de convertirse en grandes conglomerados,"Aunque muchas de sus inversiones tienen una lógica comercial, el resultado parece cada vez más difícil de manejar",Les géants pétroliers du Golfe risquent de devenir des conglomérats tentaculaires,"Bien que bon nombre de leurs investissements aient une logique commerciale, le résultat semble de plus en plus difficile",海湾的石油巨头有可能成为无孔不入的集团集团。,"虽然许多投资具有商业逻辑,但结果看来越来越难以操作。"
8,Trump’s tariff mayhem has been a blessing for shippers,But it has only staved off a coming plunge,Trumps Tarif-Mayhem war ein Segen für Verlader,Aber es hat nur einen kommenden Sprung abgewendet,El caos arancelario de Trump ha sido una bendición para los cargadores,Pero sólo se ha mantenido fuera de una zambullida venidera,Le chaos tarifaire de Trump a été une bénédiction pour les chargeurs,Mais il n'y a plus qu'un plongeon à venir.,特朗普的关税破坏一直是托运人的祝福,但它只是逃避了即将来临的一瞬间
9,Rethinking the war on AIDS,American funding cuts are a catalyst for fresh thinking,Umdenken über den Krieg gegen Aids,Amerikanische Mittelkürzungen sind ein Katalysator für neues Denken,Repensar la guerra contra el SIDA,Los recortes de fondos estadounidenses son un catalizador para el pensamiento fresco,Repenser la guerre contre le sida,Les coupes de financement américaines sont un catalyseur pour une nouvelle pensée,反思防治艾滋病的战争,美国削减资金是新思维的催化剂
10,“Comrade” is making a comeback in China,Or so the government hopes,"""Comrade"" macht ein Comeback in China",Oder so hofft die Regierung,“Camarada” está volviendo a China,O eso es lo que el gobierno espera,Le camarade fait un retour en Chine,Ou alors le gouvernement espère,“同志”正在中国重新崛起,或政府希望
11,The looming deadline for the Panama Canal ports deal,China will approve their sale. But there’s a huge catch,Die bevorstehende Frist für den Panama-Kanal-Ports-Deal,China wird ihren Verkauf genehmigen. Aber es gibt einen riesigen Fang,El inminente plazo para el acuerdo con los puertos del Canal de Panamá,"China aprobará su venta, pero hay una enorme captura",L'échéance prochaine pour l'accord sur les ports du canal de Panama,La Chine va approuver leur vente. Mais il ya une énorme prise,巴拿马运河港口交易的最后期限即将到来,中国会批准它们的销售。 但有一个巨大的收获。
12,“Gated communities” are flourishing in India,But they are not quite the havens its elites had in mind,Gepflegte Gemeinden blühen in Indien,"Aber sie sind nicht ganz die Oasen, die ihre Eliten im Sinn hatten",Las “comunidades cerradas” están floreciendo en la India,Pero no son los paraísos que sus elites tenían en mente.,"En Inde, les communautés sont florissantes.",Mais ils ne sont pas tout à fait les havres que ses élites avaient à l'esprit,印度的“定居社区”蓬勃发展。,但他们并不是精英们所想到的避风港
13,Conservationists have rescued the world’s last truly wild horse,The takhi has never been tamed,Naturschützer haben die Welt gerettet Letzte wirklich wildes Pferd,Der Takhi wurde noch nie gezähmt,Los conservacionistas han rescatado al último caballo verdaderamente salvaje del mundo,El takhi nunca ha sido domado,Les écologistes ont sauvé le monde dernier cheval vraiment sauvage,Le takhi n'a jamais été dompté.,保护者拯救了世界最后一匹真正的野马,Takhi从未被驯服过
14,A new paradise for crypto,Amid monetary mayhem in Venezuela digital finance is booming and may threaten the regime,Ein neues Paradies für Krypto,Inmitten des monetären Chaos in Venezuela boomt die digitale Finanzierung und könnte das Regime bedrohen,Un nuevo paraíso para el cripto,En medio del caos monetario en Venezuela las finanzas digitales están en auge y pueden amenazar al régimen,Un nouveau paradis pour le crypto,"Dans un contexte de chaos monétaire au Venezuela, la finance numérique est en plein essor et risque de menacer le régime.",一个新的加密天堂,"在委内瑞拉货币动荡中,数字金融正在蓬勃发展,可能威胁到委内瑞拉政权。"
15,Trump’s astonishing battering of Brazil,"MAGA bullying is backfiring, boosting Lula’s government",Trumps erstaunliches Plätschern von Brasilien,"MAMA Mobbing ist Backfiring, Lulas Regierung zu stärken",El asombroso golpe de Trump a Brasil,"Maga bullying está retrocediendo, impulsando el gobierno de Lula",Trump est étonnamment battu du Brésil,"L'intimidation de l'AGA est de retour, dynamisant le gouvernement de Lula.",特朗普对巴西的惊人打击,"支持卢拉政府,"
16,"As Gaza starves, Israel fights on","Its generals think the war against Hamas has become pointless, but a ceasefire remains elusive","Während Gaza hungert, kämpft Israel weiter","Seine Generäle denken, der Krieg gegen die Hamas sei sinnlos geworden, aber ein Waffenstillstand bleibt schwer fassbar.","Mientras Gaza muere de hambre, Israel lucha","Sus generales piensan que la guerra contra Hamas se ha vuelto inútil, pero un alto el fuego sigue siendo difícil de lograr.","Alors que Gaza meurt de faim, Israël se bat pour","Ses généraux pensent que la guerre contre le Hamas est devenue inutile, mais un cessez-le-feu reste insaisissable","随着加沙的饥饿,以色列继续战斗","其将军们认为,对哈马斯的战争已经毫无意义,但停火仍然遥遥无期"
17,Ugandan intervention in Congo risks stoking ethnic violence,It may also cement Rwanda’s hold over its neighbour,Ugandanische Intervention im Kongo droht ethnische Gewalt zu schüren,Es kann auch zementieren Ruandas halten über seinen Nachbarn,La intervención ugandesa en el Congo corre el riesgo de avivar la violencia étnica,También puede cementar el dominio de Ruanda sobre su vecino,L'intervention ougandaise au Congo risque de provoquer des violences ethniques,Il pourrait aussi cimenter le Rwanda sur son voisin,乌干达对刚果的干预有煽动族裔暴力的危险,它还可能巩固卢旺达对邻国的控制权。
18,Somalia’s state-building project is in tatters,The West has all but given up on it,Somalias staatliches Bauprojekt befindet sich in Verwüstungen,Der Westen hat alles aufgegeben.,El proyecto de construcción del Estado de Somalia está en ruinas,Occidente se ha dado por vencido.,Le projet d'édification de l'État en Somalie est en jeu,L'Occident a tout abandonné.,索马里的建国项目陷入混乱,"西方已经放弃,但已经放弃"
19,A bloody week in Syria may have ripple effects in Lebanon,The presidents of both countries have limited time to rein in vicious militias,Eine blutige Woche in Syrien kann Welleneffekte im Libanon haben,"Die Präsidenten beider Länder haben nur begrenzte Zeit, sich in bösartige Milizen zu begeben.",Una semana sangrienta en Siria puede tener efectos de onda en el Líbano,Los presidentes de ambos países tienen poco tiempo para frenar a las milicias viciosas,Une semaine sanglante en Syrie peut avoir des effets d'entraînement au Liban,Les présidents des deux pays n'ont que peu de temps pour se réfugier dans des milices vicieuses.,叙利亚血腥的一周可能在黎巴嫩波波波效应。,两国总统控制邪恶民兵的时间有限
20,Cuts to food stamps are about to hit in America,One in five people in New Mexico receive the benefit,"Schnitte auf Lebensmittelmarken sind im Begriff, in Amerika zu treffen",Jeder fünfte in New Mexico erhält den Vorteil,Cortes a cupones de comida están a punto de golpear en América,Una de cada cinco personas en Nuevo México recibe el beneficio,Les coupures de timbres alimentaires sont sur le point de frapper en Amérique,Une personne sur cinq au Nouveau-Mexique reçoit l'allocation,美利坚合众国即将发生 粮食券的削减,新墨西哥州每5人中就有1人领取这项津贴。
21,A little poetic justice for Donald Trump,The Epstein uproar has revealed an unexpected danger—for the president—of a Justice Department that seems partisan,Ein wenig poetische Gerechtigkeit für Donald Trump,"Der Aufstand von Epstein hat eine unerwartete Gefahr — für den Präsidenten — eines Justizministeriums enthüllt, das parteiisch zu sein scheint.",Un poco de justicia poética para Donald Trump,El alboroto de Epstein ha revelado un peligro inesperado —para el presidente— de un Departamento de Justicia que parece partisano.,Un peu de justice poétique pour Donald Trump,L'attaque d'Epstein a révélé un danger inattendu — pour le président — d'un ministère de la Justice qui semble partisan.,给唐纳德·特朗普 一点诗意正义,"Epstein uproar 已经暴露出一个意外的危险,"
22,The year of the women’s-sports bar,"Fed up with the traditional joints, these businesswomen are shooting their shot",Das Jahr der Frauen-Sport-Bar,"Mit den traditionellen Gelenken gefüttert, schießen diese Geschäftsfrauen ihren Schuss",El año del bar de deportes femeninos,"Hastiados de los porros tradicionales, estas mujeres de negocios están disparando su tiro.",L'année du bar des femmes-sports,"Fédérées avec les articulations traditionnelles, ces femmes d'affaires tirent leur coup de feu",妇女体育年,这些女商人正在开枪射击
23,Could Europe be the next big coffee producer?,"While temperature changes threaten the coffee belt, some countries sense opportunity",Könnte Europa der nächste große Kaffeeproduzent sein?,"Während Temperaturänderungen den Kaffeegürtel bedrohen, spüren einige Länder die Chance",¿Podría Europa ser el próximo gran productor de café?,"Mientras que los cambios de temperatura amenazan el cinturón del café, algunos países perciben la oportunidad",L'Europe pourrait-elle être le prochain grand producteur de café ?,"Alors que les changements de température menacent la ceinture de café, certains pays sentent l'opportunité",欧洲会不会是下一个大咖啡生产商?,"虽然温度变化威胁着咖啡带,但一些国家感到机会"
24,"Cigarettes, booze and petrol bankroll Europe’s welfare empire",But what if people give up their sinful ways?,"Zigaretten, Schnaps und Benzinbankroll Europas Wohlfahrtsimperium","Was aber, wenn die Menschen ihre sündigen Wege aufgeben?","Cigarrillos, alcohol y gasolina financian el imperio del bienestar europeo",Pero ¿qué pasa si la gente renuncia a sus caminos pecaminosos?,"Cigarettes, alcool et essence bankroll Europe",Mais que faire si les gens abandonnent leurs voies pécheresses?,欧洲福利帝国的香烟、酒酒和汽油,万一人们放弃他们的罪恶之道呢?
25,Kurds and Turks are closer than ever to peace,They are both suspicious of Israeli aims in the region,Kurden und Türken sind dem Frieden näher denn je,Sie sind beide misstrauisch gegenüber israelischen Zielen in der Region,Los kurdos y los turcos están más cerca que nunca de la paz,Ambos son sospechosos de los objetivos israelíes en la región,Les Kurdes et les Turcs sont plus proches que jamais de la paix,Ils se méfient tous les deux des objectifs israéliens dans la région.,库尔德人和土耳其人比以往任何时候更接近和平,他们两人都怀疑以色列在该地区的目的
26,Why Britain’s police hardly solve any crimes,Crime has become more complex. The police have not kept up,Warum Britanniens Polizei kaum irgendwelche Verbrechen lösen,Die Kriminalität ist komplizierter geworden.,Por qué la policía británica apenas resuelve ningún crimen,El crimen se ha vuelto más complejo.,Pourquoi la police britannique ne résout pas les crimes,La criminalité est devenue plus complexe.,为什么英国警察几乎不解决任何犯罪,"犯罪变得更加复杂,警察没有跟上"
27,Macron was right about strategic autonomy,But France lacks the means to pay for much of it,Macron hatte Recht mit der strategischen Autonomie,"Aber Frankreich fehlt die Mittel, um für viel davon zu bezahlen",Macron tenía razón sobre la autonomía estratégica,Pero Francia carece de los medios para pagar gran parte de ella,Macron avait raison sur l'autonomie stratégique,Mais la France n'a pas les moyens d'en payer une grande partie.,宏对战略自主的看法是对的,但法国无力支付大部分费用
28,Seven in ten Britons expect more riots,Our survey finds that Britons are pessimistic about the country’s cohesion,Sieben von zehn Briten erwarten mehr Unruhen,"Unsere Umfrage stellt fest, dass Briten pessimistisch über den Zusammenhalt des Landes sind",Siete de cada diez británicos esperan más disturbios,Nuestra encuesta encuentra que los británicos son pesimistas sobre la cohesión del país,Sept Britanniques sur dix attendent d'autres émeutes,Notre enquête révèle que les Britanniques sont pessimistes sur la cohésion du pays.,10分7分7分 英国人预期暴动会更多,"我们的调查发现,英国人对国家的凝聚力持悲观态度"
29,"A year after Britain’s riots, things have deteriorated",The police are better; the politicians are worse,Ein Jahr nach Großbritanniens Unruhen hat sich die Lage verschlechtert,"Die Polizei ist besser, die Politiker sind schlechter","Un año después de los disturbios británicos, las cosas se han deteriorado",La policía es mejor; los políticos son peores,"Un an après les émeutes de la Grande-Bretagne, les choses se sont détériorées","La police est meilleure, les politiciens sont pires.","英国暴动一年后,情况恶化","警察更好,政客更差"
30,What economics can teach foreign-policy types,Hegemons should care about even puny countries,Welche Wirtschaftswissenschaften können außenpolitischen Typen beibringen?,Hegemons sollte sich um sogar klitzekleine Länder kümmern,Lo que la economía puede enseñar tipos de política exterior,Hegemons debe preocuparse por incluso los países débiles,Ce que l'économie peut enseigner aux politiques étrangères,Les hégémones devraient s'intéresser aux pays même pauvres.,什么样的经济学可以教授外交政策类型,黑门徒应该关心甚至小小国家
31,Where will be the Detroit of electric vehicles?,A fierce battle is under way in China,Wo wird der Detroit von Elektrofahrzeugen sein?,In China ist ein heftiger Kampf im Gange,¿Dónde estará el Detroit de los vehículos eléctricos?,Una feroz batalla está en marcha en China,Où sera le Détroit des véhicules électriques?,Une bataille féroce est en cours en Chine,电动车辆底特律在哪里?,中国正在进行激烈的战斗
32,Crypto’s big bang will revolutionise finance,"The more useful stablecoins and tokens prove to be, the greater the risk",Kryptos Urknall wird die Finanzen revolutionieren,"Je nützlicher sich stabile Münzen und Token erweisen, desto größer ist das Risiko.",El big bang de Crypto revolucionará las finanzas,"Cuanto más útiles sean los stablecoins y tokens, mayor será el riesgo",Le big bang de Cryptos révolutionnera la finance,"Plus les pièces et les jetons stables sont utiles, plus le risque est grand.",加密大爆炸将使金融革命化,"更有用的稳定币和象征性物越是有用,风险就越大。"
33,Why 24/7 trading is a bad idea,There are advantages to the old-fashioned working day,Warum 24/7 Trading eine schlechte Idee ist,Es gibt Vorteile für den altmodischen Arbeitstag,¿Por qué el comercio 24/7 es una mala idea,Hay ventajas en el día de trabajo pasado de moda,Pourquoi le trading 24/7 est une mauvaise idée,Il y a des avantages pour la journée de travail à l'ancienne,为什么24/7交易是个坏主意,旧式工作日有其优点
34,Want higher pay? Stay in your job,America’s cooling labour market is bad news for those who move about,Möchten Sie höhere Bezahlung? Bleiben Sie in Ihrem Job,"Amerikas Abkühlung des Arbeitsmarktes ist eine schlechte Nachricht für diejenigen, die sich bewegen",¿Quieres un sueldo más alto? Permanezca en su trabajo,El enfriamiento del mercado laboral de Estados Unidos es una mala noticia para los que se mueven,Vous voulez un salaire plus élevé? Restez dans votre emploi,Amérique Refroidir le marché du travail est une mauvaise nouvelle pour ceux qui se déplacent,想要高薪吗 留在你的工作里,美国的冷却劳力市场 对那些移动的人来说是个坏消息
35,Has Trump damaged the dollar?,Yes. How badly will become clear in the next crisis,Hat Trump den Dollar beschädigt?,Ja. Wie schlimm wird sich in der nächsten Krise zeigen,¿Trump ha dañado el dólar?,Sí. ¿Qué tan mal quedará claro en la próxima crisis,Trump a-t-il endommagé le dollar ?,Oui. À quel point la prochaine crise se fera-t-elle sentir?,特朗普有没有破坏美元?,"是的。 在下一次危机中,情况会有多糟糕?"
36,Why is AI so slow to spread? Economics can explain,Businesses are ignoring the street of hundred-dollar bills,Warum ist KI so langsam zu verbreiten? Wirtschaft kann erklären,Unternehmen ignorieren die Straße der 100-Dollar-Rechnungen,¿Por qué es la IA tan lenta para propagarse? La economía puede explicar,Los negocios están ignorando la calle de billetes de cien dólares,Pourquoi l'IA est-elle si lente à se propager ? L'économie peut expliquer,Les entreprises ignorent la rue des billets de cent dollars,为何AI的传播速度如此缓慢? 经济学可以解释,商业界对百元钞票的街头视而不见
37,Trump’s real threat: industry-specific tariffs,Which countries would be hit hardest by levies on electronics and pharmaceuticals?,Trumps reale Bedrohung: branchenspezifische Zölle,Welche Länder würden am stärksten von den Abgaben auf Elektronik und Pharmazeutika betroffen sein?,La verdadera amenaza de Trump: aranceles específicos de la industria,¿Qué países se verían más afectados por los impuestos sobre la electrónica y los productos farmacéuticos?,La menace réelle de Trump: les tarifs spécifiques à l'industrie,Quels pays seraient les plus durement touchés par les prélèvements sur l'électronique et les produits pharmaceutiques?,特朗普的真正威胁:具体行业的关税,对电子产品和药品征税对哪些国家打击最大?
38,Americans can still get a 2% mortgage,"At a time of high interest rates, there are bargains to be found",Amerikaner können immer noch eine 2% Hypothek erhalten,In einer Zeit hoher Zinsen gibt es Schnäppchen zu finden,Los estadounidenses todavía pueden obtener una hipoteca del 2%,"En un momento de altas tasas de interés, hay gangas que se encuentran",Les Américains peuvent encore obtenir un prêt hypothécaire de 2%,"À un moment où les taux d'intérêt sont élevés, il y a des affaires à trouver",美国人仍然可以拿到2%的抵押贷款,"在利率高时,可以找到讨价还价的办法"
39,Stablecoins might cut America’s debt payments. But at what cost?,The Trump administration will take any help it can get,"Stablecoins könnten Amerikas Schuldenzahlungen kürzen, aber um welchen Preis?","Die Trump-Administration wird jede Hilfe nehmen, die sie bekommen kann","Establecoins podría recortar los pagos de la deuda de Estados Unidos, pero ¿a qué costo?",El gobierno de Trump tomará cualquier ayuda que pueda conseguir,Stablecoins pourrait réduire les paiements de la dette de l'Amérique. Mais à quel coût?,L'administration Trump prendra toute l'aide qu'elle peut obtenir,稳定器可能会削减美国的债务支付。 但代价是什么?,特朗普政府会得到任何帮助
40,Xi Jinping is growing more elusive,His leadership is entering a new but no less powerful stage,Xi Jinping wird immer schwieriger,"Seine Führung tritt in eine neue, aber nicht weniger mächtige Bühne ein",Xi Jinping es cada vez más elusivo.,Su liderazgo está entrando en una nueva pero no menos poderosa etapa,Xi Jinping est de plus en plus insaisissable,"Son leadership entre dans une nouvelle étape, mais pas moins puissante",习近平越来越难以捉摸,他的领导层正在进入一个新的但同样强大的阶段
41,China’s exporters shrug off the trade war—for now,How long can they continue to do so?,Chinas Exporteure zucken den Handelskrieg ab — für jetzt,Wie lange können sie das noch tun?,"Los exportadores de China se encogen de hombros en la guerra comercial, por ahora",¿Cuánto tiempo pueden seguir haciéndolo?,Chine Les exportateurs s'éloignent de la guerre commerciale — pour l'instant,Combien de temps peuvent-ils continuer à le faire?,中国的出口商从贸易战争中退缩到现在,他们能继续这样做多久?
