,title-de,content-de,title-en,content-en,title-zh,content-zh
63,Warum viele im Urlaub krank werden,"Ausgerechnet am Wochenende oder im Urlaub krank oder erschöpft: Das kennen mehr als drei Viertel der Arbeitnehmer, zeigt eine Studie. Viele Faktoren können Ursache sein. Von K. Heudorfer und S. von Liebe.",Why many get sick on vacation,"On weekends or holidays of all ages, sick or exhausted: this is what more than three quarters of employees know, a study shows. Many factors can be the cause. By K. Heudorfer and S. von Liebe.",为什么很多人在度假时生病?,"周末生病或休假疲惫,因为这超过四分之三的工人,有一项研究显示出这一问题. 许多因素可能是因果关系. 由K. Hustorfer和S. 爱."
64,Ukraine-Liveblog: ++ Ukraine meldet Schlag gegen russische Luftwaffenbasis ++,Das ukrainische Militär hat eigenen Angaben zufolge den russischen Militärflugplatz in der Region Woronesch angegriffen. Nach Angriffen Russlands in der Nacht gibt es Verletzte in mehreren Teilen der Ukraine.,Ukraine live blog: ++ Ukraine reports blow against Russian air base ++,"The Ukrainian military has claimed to have attacked the Russian military airfield in the Voronezh region. After attacks by Russia at night, there are injured in several parts of Ukraine.",乌克兰日志:++乌克兰报告攻击俄罗斯空军基地++,"乌克兰军队据说袭击了沃罗涅什地区俄军空军基地. 在那晚俄军袭击后,乌克兰的几处地区发生了伤亡事件."
65,Gebärdenpoesie: Mit den Händen singen,"Mit Workshops und Auftritten bringt Ines Helke Menschen zusammen, die sonst selten miteinander ins Gespräch kommen: Hörende und Gehörlose. Gebärdenpoesie macht die Kulturlandschaft inklusiver. Von Annika Röhrs.",Sign Poesis: Singing with your hands,"With workshops and performances, Ines Helke brings together people who rarely come into conversation with each other: hearing and deaf people. Sign poetry makes the cultural landscape more inclusive. By Annika Röhrs.",产妇科: 用双手歌唱,"在工作场所和表演中,爱妮斯·赫尔克将人们聚在了一起,他们通常很少会说话: 聋子和聋子. 他们自生自灭,使文化圈更具包容性. 由安妮卡·罗尔斯 (Annika Rörrs) 提供."
66,Erstes Konzert seit 16 Jahren: Zehntausende feiern Oasis-Comeback,Es ist das erste Konzert von Oasis seit 16 Jahren: Die einst zerstrittenen Brüder Liam und Noel Gallagher begeistern in Cardiff die Massen. Auch die Presse lobt den Auftritt. Und jetzt startet die Welttournee.,First concert in 16 years: tens of thousands celebrate Oasis Comeback,"It is Oasis's first concert in 16 years: the brothers Liam and Noel Gallagher, who were once divided up, inspire the masses in Cardiff. The press also praises the performance. And now the world tour starts.","16年来第一场音乐会: 成千上万的人在庆祝""绿洲""的协奏曲.","16年来,欧亚首次音乐会: 曾经分裂的兄弟利亚姆和诺尔·盖勒格在卡迪夫吸引了群众注意. 新闻界也称赞这次演出. 现在,世界巡演开始."
67,Die Pariser dürfen wieder in der Seine baden,Premiere nach mehr als 100 Jahren: In Paris ist das Baden in der Seine wieder erlaubt. Drei überwachte Badestellen sind gratis zugänglich - eine davon beim Eiffelturm. Wie reagieren die Menschen? Von Cai Rienäcker.,The Parisians are allowed to bathe in the Seine again,Premiere after more than 100 years: Bathing in the Seine is allowed again in Paris. Three monitored bathing areas are free of charge - one of them at the Eiffel Tower. How do people react? By Cai Rienäcker.,巴黎人可以回到塞纳河里洗澡,"超过100年之后的首映式,在巴黎,塞纳河是允许洗澡的. 三个被监视的浴池是免费的,其中一间是艾菲尔铁塔. 人们如何反应?"
68,Bundesrichter stoppt Abschiebung von Migranten in den Südsudan,Sie kommen zwar nicht aus dem Südsudan - trotzdem will die US-Regierung acht verurteilte Migranten in das Land abschieben. Der Supreme Court hatte schon grünes Licht gegeben. Nun stoppte ein Bundesrichter das Vorhaben.,Federal judge stops deportation of migrants to South Sudan,"Although they do not come from South Sudan, the U.S. government still wants to deport eight convicted migrants to the country. The Supreme Court had already given the green light. Now a federal judge stopped the project.",联邦法官停止将移徙者移送到苏丹南部,"虽然他们不是从苏丹南部来的,但美国政府仍希望将8名被定罪的移民驱逐到该国. 最高法院已经批准了. 现在,联邦法官停止了这一计划."
69,Waldbrände in Ostdeutschland: Die Lage bleibt kritisch,Der Kampf gegen den Waldbrand in Brandenburg und Sachsen dauert jetzt schon Tage. Inzwischen mussten weitere Menschen ihre Häuser verlassen. Ab dem Nachmittag könnte es noch kritischer werden.,Forest fires in East Germany: The situation remains critical,"The fight against the forest fire in Brandenburg and Saxony already takes days. In the meantime, more people had to leave their homes. From the afternoon it could become even more critical.",东德的森林大火:情况依然危急,"与勃兰登堡和萨克森的森林大火斗争已经持续了好几天了. 现在,更多的人不得不离开自己的家园. 从下午开始,情况会更加危急."
70,Spannungen in der Nachbarschaft - Wird Russland zum Verlierer?,Russlands hat es mit zunehmend selbstbewussten Nachbarstaaten zu tun. Insbesondere Aserbaidschan probt den Aufstand. Nun könnte Russland seine Vormachtstellung im Südkaukasus verlieren. Von S. Stöber.,Tensions in the neighbourhood - Will Russia be a loser?,Russia has to deal with increasingly self-confident neighbouring states. Azerbaijan in particular is rehearsing the uprising. Now Russia could lose its supremacy in the South Caucasus. By S. Stöber.,邻国紧张局势 - 俄罗斯会输吗?,俄罗斯正在与日益自信的邻国打交道. 特别是阿塞拜疆正在进行叛乱. 现在俄罗斯可能失去在南高加索的领导地位. 由S. Stöber领导.
71,Was man zur Frühstart-Rente wissen sollte,"Zehn Euro pro Monat vom Staat ab dem sechsten Lebensjahr - 2026 soll die neue Frühstart-Rente kommen. Vieles ist noch unklar, aber schon gibt es viele Lockangebote. Was ist dabei zu beachten? Von Axel John.",What you should know about the early retirement pension,"Ten euros per month from the state from the age of six - 2026 the new early start pension is to come. Much is still unclear, but there are already many lock offers. What to consider? By Axel John.",起跑时应该知道些什么,"政府每个月10欧元,从6岁起 - - 2026年 - - 将会是新的起跑线. 一些还不清楚,但已经有很多诱饵了. 有什么值得注意的? 阿克塞尔·约翰."
72,"Gaza-Waffenruhe: Hamas meldet ""positive Antwort"" an Vermittler",Israel hat schon zugestimmt - jetzt will laut eigenen Angaben auch die Hamas einen neuen Entwurf für eine Gazastreifen-Waffenruhe grundsätzlich annehmen. Doch wichtige Details sind offenbar weiter offen.,"Gaza's Peace of Arms: Hamas Reports ""positive Response"" to Mediators","Israel has already agreed - now, according to its own statements, Hamas also intends to adopt a new draft for a Gazan ceasefire in principle. However, important details are apparently still open.","哈马斯向调解人报告""积极回应""","以色列已经同意 - - 现在根据它的说法,哈马斯也希望在原则上接受一个加沙地带武器库的新设计. 但关键细节似乎仍未明朗."
73,Christopher Street Day in Köln: Das mulmige Gefühl bleibt,Vermehrt greifen Rechtsextreme queere Events an. Der CSD in Köln hat ein striktes Sicherheitskonzept erarbeitet. Die Teilnehmenden wollen sich nicht einschüchtern lassen - das fällt aber immer schwerer. Von S. Abdulaziz.,Christopher Street Day in Cologne: The murky feeling remains,The CSD in Cologne has developed a strict security concept. The participants do not want to be intimidated - but this is becoming more and more difficult. By S. Abdulaziz.,Christopher Street Day in Korren: The mood felt,"更多人攻击右翼分子活动. 科隆的CSD设计了一个严格的安全概念. 一部分人不想被恐吓,但这越来越困难. 由S. AbuAziz."
74,Bundesbeauftragte Koch beklagt mehr Angriffe auf queere Personen,"Vor dem Christopher Street Day in Köln hat die Queer-Beauftragte der Bundesregierung, Koch, eine steigende Zahl von Angriffen auf queere Menschen beklagt. Debatten über Regenbogenfahnen bezeichnete sie als ""nicht hilfreich"".",Bundesbeauftragte Koch complains more attacks on queere persons,"Before Christopher Street Day in Cologne, the Federal Government's Queer Commissioner, Koch, complained of an increasing number of attacks on queer people. Debate on rainbow flags called them ""not helpful"".",联邦厨师抱怨更多的攻击暴徒.,"在克里斯多夫街日前的科隆市 联邦政府的奎尔委托人柯斯特 (Queer) 抱怨不断增加的攻击暴民事件. 有关彩虹花的辩论称它为""无助"""
75,"Trump unterzeichnet am US-Unabhängigkeitstag ""Big Beautiful Bill""",Große Inszenierung am Unabhängigkeitstag: Vor dem Weißen Haus hat Präsident Trump das umstrittene Steuer- und Ausgabengesetz unterzeichnet. Am Himmel gab es eine Flugshow - unter anderem mit einem Tarnkappenbomber.,Trump signs Big Beautiful Bill on U.S. Independence Day,Great staging on Independence Day: President Trump signed the controversial tax and expenditure law in front of the White House. There was a flight show in the sky - including a camouflage bomber.,"特朗普在美国独立日签署了""大美女比尔""","独立日的重大设计:在白宫之前,特朗普总统签署了一项争议性的税收和支出法案. 天空上有一场飞行表演,包括一个隐形炸弹客."
76,USA: Viele Tote bei Sturzflut in Texas,Binnen Minuten schwoll der Fluss Guadalupe um Meter an: In Texas kamen bei einer Sturzflut mindestens 24 Menschen ums Leben. Mädchen aus einem Sommercamp werden vermisst. Und eine weitere Flutwelle droht.,USA: Many dead in a flood in Texas,"Within minutes, the Guadalupe River swollen by meters: in Texas, at least 24 people were killed in a flood. Girls from a summer camp are missing and another tidal wave threatens.",德克萨斯州大洪水中死了很多人,"几分钟之内,瓜达卢普河水面暴涨,德州大洪水中至少有24人遇难. 一个夏令营的女孩失踪. 又一波海浪正迫在眉睫."
77,Fußball-EM der Frauen: Deutsches Team gewinnt 2:0 gegen Polen,Tore von Brand und Schüller haben den deutschen Fußballerinnen in St. Gallen einen Sieg beschert - bei ihrem ersten Match des Turniers. Kapitänin Gwinn wurde kurz vor Ende der ersten Halbzeit verletzungsbedingt ausgewechselt.,Women's Football EM: German team wins 2-0 against Poland,Gates of Brand and Schüller have given the German football women in St. Gallen a victory - in their first match of the tournament. Captain Gwinn was replaced due to injury shortly before the end of the first half.,女人的足球EM: 德国队赢了2比0对波兰人,Brand和Skeller之门在圣斯加伦的女足球队赢得胜利 - 在比赛的第一场比赛中获胜. 格温队长在中场受伤前不久被换掉了.
78,Ukraine-Liveblog: ++ AKW Saporischschja wieder extern versorgt ++,Die externe Stromversorgung des von Russland besetzten Atomkraftwerks Saporischschja funktioniert laut der Internationalen Atomenergiebehörde wieder. US-Präsident Trump will offenbar mit der Ukraine bei der Luftverteidigung zusammenarbeiten.,Ukraine live blog: ++ AKW Saporishhja again externally supplied ++,"According to the International Atomic Energy Agency, the external power supply of the Russian-occupied Zaporishya nuclear power plant is functioning again. US President Trump apparently wants to work with Ukraine in air defense.",乌克兰的立体博客:++AKW Saporschja 重新向外靠望++++,据国际原子能机构称 俄罗斯占领的萨波里什叶亚核电站的外部电力供应恢复正常了. 美国总统特朗普似乎希望与乌克兰在空中防御方面合作.
79,Silvester-Party am Brandenburger Tor steht auf der Kippe,Das Brandenburger Tor war bisher die Kulisse für die größte Silvester-Party Deutschlands. Dieses Jahr steht die Feier allerdings auf der Kippe. Der Veranstalter hat die Planungen vorerst eingestellt. Die Finanzierung sei nicht gesichert.,New Year's Eve party at the Brandenburg Gate stands on the tip,"The Brandenburg Gate has been the backdrop for Germany's largest New Year's Eve party so far. This year, however, the celebration is on the brink. The organiser has stopped planning for the time being.",Brandenburg门的新年派对已经泡汤了,"勃兰登堡之门是德国新年最盛大的派对的纪念碑,但今年的庆祝活动已经告吹了. 承办人暂时停止了计划. 资金未得到保证."
80,Marktbericht: DAX beendet Börsenwoche mit Kursverlusten,"Kommt es zu einem Handelsdeal zwischen EU und USA oder nicht? Diese Frage bestimmte am Freitag den Aktienhandel. Ohne Orientierung von der Wall Street zogen sich die Anleger zurück, der DAX hat auch auf Wochensicht verloren.",Market Report: DAX Ends Stock Exchange Week with Price Loss,"Is there a trade deal between the EU and the US or not? This question determined the share trading on Friday. Without orientation from Wall Street, investors withdrew, and the DAX has also lost sight of the week.","市场报告: DAX结束交易,市价暴跌的一周.","是欧盟和美国之间的贸易交易呢? 这个问题在星期五决定了股票交易. 没有华尔街的指示,投资者退步,DAX也损失了几周时间."
81,Bildungsministerin offen für Migrationsquote an Schulen,"Sollte der Anteil von Kindern mit Migrationshintergrund in Schulklassen begrenzt werden? Bildungsministerin Prien hält eine Obergrenze für ""denkbar"". Ablehnung kommt von der Integrationsbeauftragten. Auch der Lehrerverband ist skeptisch.",Minister of Education Open to Migration Rate in Schools,"Should the proportion of children with a migrant background be limited in school classes? Minister of Education Prien considers an upper limit to be ""thinkable"". Rejection comes from the Integration Officer. The Association of Teachers is also sceptical.",学校移徙率教育部长开放,"教育部长普林认为高等教育是""低级"" 的,而一体化代表拒绝. 教师协会也怀疑这一点."
82,Masken-Affäre: Was die geschwärzten Stellen im Sudhof-Bericht verbergen,"Fünf Jahre gelang es dem Gesundheitsministerium, einen Vergleich mit dem Schweizer Maskenhändler Emix geheim zu halten. Worum es genau ging, enthüllt der Sudhof-Bericht, der NDR, WDR und SZ ganz ohne Schwärzungen vorliegt.",Mask affair: What the blackened bodies hide in the Sudhof report,"For five years, the Ministry of Health managed to keep a comparison with the Swiss mask dealer Emix secret. The Sudhof report, which contains NDR, WDR and SZ, reveals exactly what it was about without any blackness.",面具特色: 中庭报告里那些小混混们 隐藏着什么?,"五年来,卫生部成功地与瑞士化装商Emix进行了和解. 具体情况是,Sumhif报告,NDR,WDR和SZ完全没有贬低."
83,Besserer Mathe-Unterricht mithilfe von KI?,"Mathematik-Unterricht mit Künstlicher Intelligenz verbessern? Wie das gehen kann, zeigt ein Würzburger Bildungsforscher seinen Lehramtsstudierenden. KI soll den Unterricht praxisnäher und interessanter machen. Von Jan Kerckhoff.",Better math lessons with AI?,"How can this be done, a Würzburg educational researcher shows his teaching students. AI is intended to make teaching more practical and interesting. By Jan Kerckhoff.",和人工智能一起学习数学更好吗?,"让人工智能的数学课程更加精明? 如何使一个调味品教育研究员可以向教员展示他的教职. 让人工智慧让学习更亲切,更有趣. 由Jan Kerkhoff提供."
84,Nach Attacke in ICE: Ermittlungen wegen zweifachen Mordversuchs,Nach der Attacke auf Passagiere in einem ICE in Bayern ermittelt die Staatsanwaltschaft gegen den Tatverdächtigen wegen zweifachen Mordversuchs und gefährlicher Körperverletzung. Das Tatmotiv ist noch unklar.,After attack in ICE: Investigation for double attempted murder,"After the attack on passengers in an ICE in Bavaria, the prosecution investigates the suspect for double attempted murder and dangerous bodily injury. The motive for the crime is still unclear.",袭击事件发生后 调查两起谋杀未遂,巴伐利亚的一名乘客遭到袭击后 地方检察官正在调查两起谋杀未遂和攻击. 动机尚不明朗.
85,Angst und Verzweiflung in der Ukraine nach massiven russischen Angriffen,"Kaum hatten Putin und Trump ihr Telefonat beendet, startete Russland eine Angriffswelle auf Kiew, wie es sie noch nicht gegeben hat. Die Menschen in der Stadt sind am Tag danach zermürbt - und sie beschleicht eine bestimmte Angst. Von S. Petersohn.",Fear and Desperation in Ukraine after Massive Russian Attacks,"As soon as Putin and Trump had finished their phone call, Russia launched a wave of attacks on Kiev, as it has not yet. The people in the city are crushed the day after - and it is causing a certain fear. By S. Petersohn.",乌克兰的恐惧和绝望是由于俄罗斯大规模的袭击而造成的.,"普京和特朗普刚打完电话,俄罗斯就发动了基辅的攻击. 第二天,城里的人们就变得焦头烂额了,他们害怕得要死. S. Peters son."
86,VW-Personalchef Kilian verlässt Konzern,"Volkswagen trennt sich von Personalchef Gunnar Kilian. Grund dafür seien ""unterschiedliche Vorstellungen"". In den vergangenen Monaten hatte der Autobauer mit einem geplanten Stellenabbau für Aufsehen gesorgt.",VW personnel manager Kilian leaves the company,"Volkswagen separates itself from personnel manager Gunnar Kilian. The reason for this was ""different ideas"". In recent months, the car manufacturer had caused a stir with a planned job reduction.",VW首席执行官基利安离开公司,"大众车和人力资源主管刚纳·基利安分居了. 原因在于""不同的观点"" . 在过去几个月里,汽车制造商在计划缩减工作时引起了警觉."
87,Russland setzt laut Geheimdiensten vermehrt verbotene Chemiewaffen ein,"Russland hat nach BND-Angaben den Einsatz von chemischen Waffen in der Ukraine verstärkt. Die Erkenntnis mehrerer Geheimdienste passe zu der Feststellung, dass der Krieg mit immer höherer Brutalität und Intensität geführt werde.","According to intelligence services, Russia is increasingly using banned chemical weapons","According to BND, Russia has stepped up the use of chemical weapons in Ukraine. Several intelligence agencies have found that the war is being waged with increasing brutality and intensity.",情报显示俄罗斯正在使用被禁止的化学武器,俄罗斯在BND颁布后加强了乌克兰的化学武器使用. 一些情报机构的认知与战争的残酷和强度越来越大是相符的.
88,Nahost-Liveblog: ++ Hamas wohl offen für Waffenruhe-Vorschlag ++,"Die militant-islamistische Hamas soll auf den US-Vorschlag zu einer Waffenruhe im Gazastreifen ""positiv"" geantwortet haben. Das israelische Militär hat Menschen im Nordwesten der Stadt Chan Yunis aufgefordert, die Gegend zu verlassen.",Middle East live blog: ++ Hamas probably open to ceasefire proposal ++,"Hamas is said to have responded ""positively"" to the US proposal for a ceasefire in the Gaza Strip. The Israeli military has called on people in the northwest of the city of Chan Yunis to leave the area.","中东词汇博客:++哈马斯可能对停火提案开放,并++++","传言说哈马斯对美国提出的""积极""停火方案作出回应. 以色列军队已经要求陈元尼斯西北部居民离开这个地区."
89,Warum nicht nach Afghanistan abgeschoben werden kann,"Die Regierung will Straftäter nach Afghanistan abschieben. Innenminister Dobrindt schlägt direkte Gespräche mit den Taliban vor. Doch wenn es um die konkrete Umsetzung geht, kommen vor allem Floskeln. Von Gabor Halasz.",Why can't we be deported to Afghanistan?,"The government wants to deport criminals to Afghanistan. Interior Minister Dobrindt proposes direct talks with the Taliban. However, when it comes to concrete implementation, there are mainly phrases. By Gabor Halasz.",为什么不能被驱逐到阿富汗呢?,"政府希望将犯罪分子驱逐到阿富汗. 内政部长杜布连特提议直接与塔利班谈判. 但是,在具体执行时,最重要的是,这些都是无稽之谈. 由加博·哈拉斯 (Gabor Halasz) 提出."
90,Massiver Stromausfall legt große Teile Tschechiens lahm,In Tschechien hat es einen massiven Stromausfall gegeben. Betroffen waren neben der Hauptstadt Prag auch weitere Teile des Landes - der Blackout konnte inzwischen behoben werden. Laut Polizei gibt es keine Hinweise auf Sabotage.,Massive power outage shuts down large parts of the Czech Republic,"In the Czech Republic there has been a massive blackout. In addition to the capital Prague, other parts of the country were affected - the blackout has now been resolved. According to the police, there is no evidence of sabotage.",大停电会破坏捷克的大部分地方,捷克境内发生大规模停电. 布拉格首都外还有其它地方 - - 目前已可以修复失忆症. 警方说没有破坏迹象.
