,title-de,content-de,title-en,content-en,title-zh,content-zh
25,Statement von Entwicklungsministerin Reem Alabali Radovan zu dem Anschlag in Damaskus am 22. Juni,"„Ich verurteile den Anschlag auf betende Gläubige in der Mar Elias Kirche in Damaskus aufs Schärfste. Diese feige Tat ist ein Anschlag auf die gesellschaftliche Vielfalt Syriens. Das Entwicklungsministerium unterstützt den Wiederaufbau und den gesellschaftlichen Zusammenhalt Syriens. Diese Arbeit ist wichtiger denn je. Der Wiederaufbau muss zu schnellen Ergebnissen führen, um Radikalen den Nährboden zu entziehen.“",Statement by Development Minister Reem Alabali Radovan on the attack in Damascus on 22 June,"""I strongly condemn the attack on praying believers in the Mar Elias Church in Damascus. This cowardly act is an attack on the social diversity of Syria. The Ministry of Development supports the reconstruction and social cohesion of Syria. This work is more important than ever. Reconstruction must lead to rapid results in order to remove radicals from the breeding ground.""",发展部长雷姆·阿拉巴利·拉多万宣布6月22日大马士革袭击案,"我谴责在大马士革的Mar Elias教堂袭击信众的行为,这是对叙利亚社会多样性的一次袭击. 发展部支持叙利亚的重建和社会凝聚力,这一工作比以往任何时候都重要. 重建工作必须产生快速的成果,才能让激进分子脱离困境."
26,American Football: Berlin Thunder verpasst Überraschung gegen Nordic Storm,"<a href=""https://www.zeit.de/news/2025-07/20/berlin-thunder-verpasst-ueberraschung-gegen-nordic-storm""><img src=""https://img.zeit.de/news/2025-07/20/berlin-thunder-verpasst-ueberraschung-gegen-nordic-storm-image-group/wide__148x84"" style=""float: left; margin-right: 5px;"" /></a> None",American Football: Berlin Thunder misses surprise against Nordic Storm,"<a href=""https://www.zeit.de/news/2025-07/20/berlin-thunder-verpasst-ueberurung-gegen-nordic-storm""><img src=""https://img.zeit.de/news/2025-07/20/berlin-thunder-verpasst-ueur surprise-gegen-nordic-storm-image-group/wide_148x84"" style=""float: left; margin-right: 5px;"" /></a> None",美国橄榄球: 柏林雷雨会错过北美风暴的惊喜,"<href=""http://www.时间.en/news2025-07/20/Berlin-jeffer-jeffer-Sturpter-Storm""> <img shrc=""http://img.time.com/news2020/20/20/7/berlin-thuntler-traffer-traffected-thestorm-image-group/wide_1448x84"" style=""float: left: margin-right: 5px;"" // a -None"
27,Krieg in Gaza: Gesundheitsministerium meldet 67 Tote im Norden des Gazastreifens,"67 Palästinenser sollen durch israelische Soldaten getötet worden sein, als sie auf Hilfsgüter warteten. Der Papst kritisiert die israelische Armee. Das Liveblog",Gaza War: Ministry of Health reports 67 deaths in the north of Gaza,67 Palestinians are said to have been killed by Israeli soldiers when they were waiting for relief supplies. The Pope criticizes the Israeli army.,加沙战争 卫生部报告说加沙北部有67人死亡,传闻说67名巴勒斯坦人在等待救援时被以色列士兵杀害. 教皇批评以色列军队. 现场博客是现场报道.
28,Syrien: Außenminister Wadephul ist offen für Abschiebungen nach Syrien,"Straftäter sollten abgeschoben werden, wenn die Lage in Syrien das erlaube, sagt Außenminister Johann Wadephul (CDU). Die SPD verweist auf die aktuellen Unruhen vor Ort.",Syria: Foreign Minister Wadephul is open for deportations to Syria,"Criminals should be deported if the situation in Syria permits, says Foreign Minister Johann Wadephul (CDU).The SPD refers to the current unrest on the ground.",叙利亚:国务卿韦德福愿意将他驱逐到叙利亚,"如果叙利亚的局势允许的话,应该将罪犯驱逐出境, 国务卿约翰·韦德福 (Johann Wadephul) 则说. 社民党指出当地最近发生的动乱."
29,Unterfranken: Autos stoßen zusammen - vier Menschen schwer verletzt,"<a href=""https://www.zeit.de/news/2025-07/20/autos-stossen-zusammen-vier-menschen-schwer-verletzt""><img src=""https://img.zeit.de/news/2025-07/20/autos-stossen-zusammen-vier-menschen-schwer-verletzt-image-group/wide__148x84"" style=""float: left; margin-right: 5px;"" /></a> None",Lower Franconia: Cars come together - four people seriously injured,"<a href=""https://www.zeit.de/news/2025-07/20/autos-pulses-together-four-humans-heavy-harmed""><img src=""https://img.zeit.de/news/2025-07/20/autos-pulses-together-four-humans-heavy-harmed-image-group/wide__148x84"" style=""float: left; margin-right: 5px;"" /></a> None",伤者: 汽车撞在一起 - 四人受重伤,"<href=""http://www.时间.en/news2025-07/20-4-auto-phys"
30,Ann-Katrin Berger: Waagerecht in der Luft,Es war eine der spektakulärsten Torwartparaden sei Langem. Wie gelang Ann-Katrin Berger im Viertelfinale dieses Kunststück? Die Antwort ist emotional.,Ann-Katrin Berger: Horizontal in the air,It was one of the most spectacular goalkeeper parades is Langem. How did Ann-Katrin Berger achieve this feat in the quarterfinals? The answer is emotional.,安·卡琳·伯格: 天空中的水平,"长远来看,这是最壮观的守门员游行之一. 安 -凯特琳 -伯格如何在这一表演的四分之一决赛中胜出?"
31,Notfall auf Bahnhofsparkplatz: Mutter lässt Dreijährige allein in aufgeheiztem Auto zurück,"<a href=""https://www.zeit.de/news/2025-07/20/mutter-laesst-dreijaehrige-allein-in-aufgeheiztem-auto-zurueck""><img src=""https://img.zeit.de/news/2025-07/20/mutter-laesst-dreijaehrige-allein-in-aufgeheiztem-auto-zurueck-image-group/wide__148x84"" style=""float: left; margin-right: 5px;"" /></a> None",Emergency on station parking: Mother leaves three-year-old alone in heated car,"<a href=""https://www.zeit.de/news/2025-07/20/mother-laest-three year-old-only-in-heated-auto-zurueck""><img src=""https://img.zeit.de/news/2025-07/20/mother-laest-three year-old-only-in-heated-auto-zurueck-image-group/wide_148x84"" style=""float: left; margin-right: 5px;"" /></a> None",火车站的紧急事故 母亲把三岁小孩一个人丢在热车上,"<href=""http://www.时间.en/news2025-07/20/20/20/20/20/20-level-level-level-auto-toubec""> <img src=""http://img.time.com/news 2020/20/07/ladesst-3-laisest-3-lein-lein-in-zuerge-in-gueck-gueck-group/wide_1448x84"" float=""float: left""; margin-right: 5px; ""/a>None"
32,Sommerinterview: Weidel-Interview geht in Demo-Lärm fast unter,"<a href=""https://www.zeit.de/news/2025-07/20/weidel-interview-geht-in-demo-laerm-fast-unter""><img src=""https://img.zeit.de/news/2025-07/20/weidel-interview-geht-in-demo-laerm-fast-unter-image-group/wide__148x84"" style=""float: left; margin-right: 5px;"" /></a> None",Summer interview: Weidel interview almost disappears in demo noise,"<a href=""https://www.zeit.de/news/2025-07/20/weidel-interview-geht-in-demo-laerm-fast-unter""><img src=""https://img.zeit.de/news/2025-07/20/weidel-interview-geht-in-demo-laerm-fast-unter-image-group/wide__148x84"" style=""float: left; margin-right: 5px;"" /></a> None",夏季采访: 牧羊人访问在示威场几乎陷落.,"< a href=""http://www.时间.en/news 2025-07/20/20-in-demo-laerm - food interview""> <img shrc=""http://img.time.com/news 2025-07/20/demo-laerm-Fashing interviews in-demo-larm-Croup/wide_148x84"" style=""float: left: margin-right: 5px;"" //a -None"
33,Tennis: Lois Boisson siegt am Hamburger Rothenbaum,"<a href=""https://www.zeit.de/news/2025-07/20/lois-boisson-siegt-am-hamburger-rothenbaum""><img src=""https://img.zeit.de/news/2025-07/20/lois-boisson-siegt-am-hamburger-rothenbaum-image-group/wide__148x84"" style=""float: left; margin-right: 5px;"" /></a> None",Tennis: Lois Boisson wins the Rothenbaum in Hamburg,"<a href=""https://www.zeit.de/news/2025-07/20/lois-boisson-sieft-am-hamburger-rothenbaum""><img src=""https://img.zeit.de/news/2025-07/20/lois-boisson-sieft-am-hamburger-rothenbaum-image-group/wide__148x84"" style=""float: left; margin-right: 5px;"" /></a> None",网球: 露易丝・博斯森在汉堡树上获胜,"<href=""http://www.时间.en/news2025-07/20/bis-boisson-float-am-hamburger-rotten tree""> <img shrc=""http://img. time.com/news 2025-07/20/boisson-boisson-fest-am-bober-rottenbag"
34,Unfall: Motorradfahrer bei Unfall schwer verletzt,"<a href=""https://www.zeit.de/news/2025-07/20/motorradfahrer-bei-unfall-schwer-verletzt""><img src=""https://img.zeit.de/news/2025-07/20/motorradfahrer-bei-unfall-schwer-verletzt-image-group/wide__148x84"" style=""float: left; margin-right: 5px;"" /></a> None",Accident: motorcyclists seriously injured in an accident,"<a href=""https://www.zeit.de/news/2025-07/20/cyclist-at-accident-heavy-injured""><img src=""https://img.zeit.de/news/2025-07/20/cyclist-at-accident-heavy-damaged-image-group/wide_148x84"" style=""float: left; margin-right: 5px;"" /></a> None",意外: 摩托车司机在事故中受伤严重,<\ \ \ \ \ \ \ \ \ \ \ \ \ \ \ \ \ \ \ \ \ \ \ \ \ \ \ \ \ \ \ \ \ \ \ \ \ \ \ \ \ \ \ \ \ \ \ \ \ \ \ \ \ \ \ \ \ \ \ \ \ \ \ \ \ \ \ \ \ \ \ \ \ \ \ \ \ \ \ \ \ \ \ \ \ \ \ \ \ \ \ \ \ \ \ \ \ \ \ \ >
35,Musik: Deichbrandfestival: Unwetterwarnung und erste Polizeibilanz,"<a href=""https://www.zeit.de/news/2025-07/20/deichbrandfestival-unwetterwarnung-und-erste-polizeibilanz""><img src=""https://img.zeit.de/news/2025-07/20/deichbrandfestival-unwetterwarnung-und-erste-polizeibilanz-image-group/wide__148x84"" style=""float: left; margin-right: 5px;"" /></a> None",Music: Deichbrandfestival: Severe weather warning and first police report,"<a href=""https://www.zeit.de/news/2025-07/20/deichbrandfestival-unweatherwarning-und-erste-police balance sheet""><img src=""https://img.zeit.de/news/2025-07/20/deichbrandfestival-unweatherwarning-und-erste-police balance sheet-image-group/wide_148x84"" style=""float: left; margin-right: 5px;"" /></a> None",音乐:,"< a href=""http://www.时间.en/news2025-07/0/dnbridge unfrontivial warning and first cop billion""> <img shrc=""http://img. time.com/news 2025-07/0/dBrandival-infestival-and-first broup/wide_148x84"" style=""float: left: margin-right: 5px;"" //a - None"
36,In Bielefeld: 16-Jähriger nach Streit vor Club außer Lebensgefahr,"<a href=""https://www.zeit.de/news/2025-07/20/16-jaehriger-nach-streit-vor-club-ausser-lebensgefahr""><img src=""https://img.zeit.de/news/2025-07/20/16-jaehriger-nach-streit-vor-club-ausser-lebensgefahr-image-group/wide__148x84"" style=""float: left; margin-right: 5px;"" /></a> None",In Bielefeld: 16-year-old after a fight before the club out of danger of life,"<a href=""https://www.zeit.de/news/2025-07/20/16-jaehriger-nach-streit-vor-club-ausser-lebensdanger""><img src=""https://img.zeit.de/news/2025-07/20/16-jaehriger-nach-streit-vor-club-ausser-lebensdanger-image-group/wide__148x84"" style=""float: left; margin-right: 5px;"" /></a> None",在比勒菲尔德 斗殴后16岁的年轻人 在俱乐部之外的俱乐部里,<\ \ \ \ \ \ \ \ \ \ \ \ \ \ \ \ \ \ \ \ \ \ \ \ \ \ \ \ \ \ \ \ \ \ \ \ \ \ \ \ \ \ \ \ \ \ \ \ \ \ \ \ \ \ \ \ \ \ \ \ \ \ \ \ \ \ \ \ \ \ \ \ \ \ \ \ \ \ \ \ \ \ \ \ \ \ \ \ \ \ \ \ \ \ \ \ \ \ \ \ \ \ \ \ >
37,Syrien: Erste Hilfskonvois erreichen Suweida,Lastwagen mit Lebensmitteln und Medizin des Roten Halbmonds erreichen erstmals Suweida. Berichten zufolge wurde eine syrische Regierungsdelegation zurückgewiesen.,Syria: First aid convoys reach Suweida,"Trucks with food and medicine of the Red Crescent reach Suweida for the first time. According to reports, a Syrian government delegation was rejected.",叙利亚:第一船队抵达苏威达,"首次到达苏威达,是红新月的食品和医药卡车. 据报道,叙利亚政府代表团遭到拒绝."
38,Gescheitertes Attentat auf Hitler: Bundesregierung erinnert an Widerstand gegen NS-Gewaltherrschaft,"In Berlin wird den Widerstandskämpfern gedacht. Die Erinnerung sei eine bleibende Aufgabe, sagt die Bundesjustizministerin und blickt besonders auf junge Generationen.",Failed assassination of Hitler: Federal Government recalls resistance to Nazi violence,"In Berlin, the resistance fighters are thought of. Memory is a permanent task, says the Federal Minister of Justice and looks particularly at young generations.",针对希特勒的暗杀行动令人想起了反对NS统治的反对,"柏林的反抗军战士们被认为存在. 记忆是永久性的,联邦司法部长说,他们特别关注年轻一代人."
39,Stoffe bei Hitze: Was tun gegen Schweißflecken?,"Schweiß steht für Kontrollverlust, für Gehetztsein und Überforderung. Doch er lässt sich in der Hitze nicht vermeiden. Nur ertragen. In Würde.",Substances in heat: What to do about welding stains?,"Sweat stands for loss of control, excesses and excesses. But it cannot be avoided in the heat. Just endured. In dignity.",热量中的物质: 如何处理汗痕?,"汗是因控制而流失,是因疲劳和压力而流汗的,但是在热天里,他不能逃避,只能忍受. 尊严的."
40,"Ukraine: ""Putin wirft jetzt alles in den Kampf""","Putin will die Ukraine mit neuer Wucht unterwerfen, sagt der ukrainische Militärstratege Mykola Sunhurowskyj. Ein Gespräch über Trumps Versprechen und Europas neue Rolle","Ukraine: ""Putin now throws everything into the fight""","Putin wants to subdue Ukraine with new force, says the Ukrainian military strategist Mykola Sunhurovskyj. A conversation about Trump's promises and Europe's new role","""乌克兰现在把一切投入战争""",乌克兰军事战略家米科拉·孙胡洛夫斯基说 普京想用新的力量征服乌克兰. 关于特朗普的承诺和欧洲的新角色的讨论.
41,Deutsche Fußballerinnen erreichen EM-Halbfinale,Deutschland ist bei der EM 2025 ins Halbfinale eingezogen. Gegen Frankreich siegte das Team mit 6:5 im Elfmeterschießen.,German women footballers reach the semi-finals,Germany moved into the semi-finals at the 2025 European Championships. The team won against France with 6:5 in penalty shooting.,德国足球女优进入EM决赛,德国在2025年进入了半决赛. 足球队以6比5胜11米.
42,Viertes Freiwasser-Gold: Wellbrock schreibt Geschichte,"Vier Starts, vier Siege: Schwimm-Triumphator Wellbrock gewinnt mit der Freiwasser-Staffel seinen vierten Titel im Freiwasser-Schwimmen.",Fourth Open Water Gold: Wellbrock Writes History,"Four starts, four victories: Swim-Triumphator Wellbrock wins his fourth title in outdoor swimming with the open water relay.",第四杯自由水的金币: 威勒布拉克正在创造历史.,"4次发射,4次胜利:游泳三重奏者韦尔布拉克 在自由水域赢得第4次冠军"
43,Merz fordert Feuerpause und mehr humanitäre Hilfe für Gaza,"Im Gaza-Krieg findet Merz klare Worte: Humanitäre Hilfe müsse die Menschen erreichen, die Geiseln freikommen und eine Nachkriegsordnung beiden Seiten gerecht werden.&nbsp;",Merz calls for ceasefire and more humanitarian aid for Gaza,"In the Gaza war, Merz finds clear words: Humanitarian aid must reach people, free the hostages and live up to a post-war order on both sides.","Merz要求停止对加沙的射击,增加人道主义援助.","加沙战争中,穆尔兹明确地指出,人道救援必须到达人民手中,释放人质,并执行战后的规则."
44,EU verhängt neue Russland-Sanktionen,Aktuelle Informationen über die deutsche Außenpolitik und die internationalen Beziehungen Deutschlands.<br />,EU imposes new sanctions on Russia,Current information on German foreign policy and international relations in Germany.<br />,欧盟对俄罗斯实施了新的制裁,关于德国外交政策和德国国际关系的最新信息.
45,Neues Kapitel der deutsch-britischen Freundschaft,Bundeskanzler Merz und Premierminister Starmer haben einen deutsch-britischen Freundschaftsvertrag unterzeichnet – mit zahlreichen konkreten Vereinbarungen.&nbsp;,New chapter of German-British friendship,Federal Chancellor Merz and Prime Minister Starmer have signed a German-British friendship agreement – with numerous concrete agreements.,德国-英国友谊的新章节,"德国总理梅兹和史塔默总理 签署了一份德国和英国的友谊条约,并签署了许多具体的协议. & nbsp;"
46,Deutschland und Frankreich wollen Startups stärken,Finanzminister Klingbeil und sein französischer Amtskollege Lombard wollen gemeinsam die Innovationskraft und Wettbewerbsfähigkeit Europas steigern.,Germany and France want to strengthen startups,Finance Minister Klingbeil and his French counterpart Lombard are working together to increase Europe's innovative strength and competitiveness.,德国和法国想加强起跑点,克林堡财政部长和他的法国同僚隆伯德 共同想提高欧洲创新力和竞争力
47,Emissionshandel halbiert Treibhausgase,"Seit seiner Einführung zeigen sich in Europa und Deutschland positive Effekte des Emissionshandels, der den Klimaschutz von Unternehmen stärkt.",Emissions trading halved greenhouse gases,"Since its introduction, emissions trading has had positive effects in Europe and Germany, which strengthens the climate protection of companies.",排放交易将温室气体减半,"自其引入以来,欧洲和德国的排放贸易产生了积极的影响,这将加强企业的气候管理."
48,Papier zu Staatsreform an Bundespräsidenten übergeben,"Steinmeier würdigt Engagement für die Verbesserung der Verwaltung und weitere Reformen. Staat soll „besser, schneller, bürgernäher“ werden.&nbsp;",Paper on State Reform handed over to Federal Presidents,"Steinmeier commends commitment to improving administration and further reforms. State should ""be better, faster, closer to the citizen.""",政府改革的纸张交给德国总理,"斯坦梅耶赞扬改进行政和进一步改革的承诺. 政府应该变得更好,更快,更接近公民. & nbsp;"
49,Cyberschutz-Verpflichtung für Firmen ab 2026,Schutz wichtiger Anlagen und Unternehmen vor Cyberangriffen soll gesetzlich verankert werden.,Cyber protection obligation for companies from 2026,Protection of important assets and companies from cyber attacks is to be enshrined by law.,从2026年开始 网络保护公司的义务从2026年开始,保护重要设施和企业不受网络攻击 应依法予以保护
50,Bayerns Märchenschlösser sind UNESCO-Welterbe,Neben Schloss Neuschwanstein hat die zuständige UNESCO-Kommission drei weitere Schlösser von Bayerns König Ludwig II. zum Welterbe erklärt.,Bavaria's Fairytale Castles are UNESCO World Heritage Sites,"In addition to Neuschwanstein Castle, the responsible UNESCO Commission has declared three other castles of Bavaria's King Louis II World Heritage Site.",巴伐利亚人的故事密码是 UNESCO世界遗产.,"除新星堡外,经合组织委员会 宣布贝耶因国王路德维希二世另外三座城堡成为世界遗产."
51,Livestream: Die Nachrichten auf tagesschau24,"Aktuelle Meldungen, vertiefende Analysen und Interviews: Verfolgen Sie das Programm des ARD-Nachrichtenkanals tagesschau24 hier live.",Livestream: The news on tagesschau24,"Latest news, in-depth analyses and interviews: Follow the program of the ARD news channel tagesschau24 live here.",现场直播: 每日新闻24:,"最新消息,深化分析和采访: 跟踪罗得新闻频道的节目,24日现场直播."
52,"Bärenpark im Schwarzwald nimmt ""Problembärin"" Gaia aus Italien auf",Der Wolf- und Bärenpark in Bad Rippoldsau-Schapbach hat die Bärin Gaia aufgenommen. Das Tier hatte einen Jogger in Italien getötet. Im Park lebt bereits ihre Mutter.,"Bear Park in the Black Forest takes up ""problem bear"" Gaia from Italy",The wolf and bear park in Bad Rippoldsau-Schapbach has taken in the bear Gaia. The animal had killed a jogger in Italy. Her mother already lives in the park.,"黑森林中的熊公园收留意大利的""毒熊""盖亚 (Gaia)","巴斯雷波杜巴赫的狼和熊公园收容了熊女盖亚. 该动物在意大利杀了一名慢跑者. 在公园里,她母亲住在公园里."
53,Tourismus in Norwegen: Auf den Lofoten wächst der Ärger,"Immer mehr Menschen verbringen ihren Urlaub im Norden. Manche Regionen werden geradezu überrannt. Die Folgen: mehr Müll, genervte Einheimische - und erste Touristenabgaben. Von Arne Bartram.",Tourism in Norway: trouble is growing on the Lofoten,"More and more people spend their holidays in the north. Some regions are almost overrun. The consequences: more garbage, annoying locals - and first tourist taxes. By Arne Bartram.","挪威的旅游业:在豪宅上,麻烦越来越大了","越来越多的人在北边度假. 有些地区几乎被占领了. 后果:更多的垃圾,愤怒的当地人,以及首批旅游者税. 阿恩·巴特兰."
54,Sommerurlaub im kühleren Norden - ein Trend?,"Der Gedanke liegt nahe: Die Sommerferien einfach mal nicht im Süden, sondern in kühleren Breitengraden verbringen. Wie ausgeprägt ist dieses ""Coolcation"" genannte Phänomen? Von Detlev Landmesser.",Summer holiday in the cooler north - a trend?,"The idea is obvious: to spend the summer holidays simply not in the south, but in cooler latitudes. How pronounced is this phenomenon called ""coolcation""? By Detlev Landmesser.",更冷的北方夏季度假 - - 潮流?,"原因很简单:夏令营不是在南方,而是在更凉爽的地平线上度过. 这个""工具""的现象究竟有多强烈?"
55,Iran zeigt sich bereit zu Wiederaufnahme von Atomverhandlungen,"Der Iran hat sich mit Deutschland, Frankreich und Großbritannien laut Angaben Teherans auf baldige Gespräche zu seinem Atomprogramm verständigt. Die Europäer hatten mit einer Wiederaufnahme von Sanktionen gedroht.",Iran is ready to resume nuclear negotiations,"Iran has reached agreement with Germany, France and Great Britain on early talks on its nuclear programme, according to Tehran, and Europeans had threatened to re-establish sanctions.",伊朗准备恢复核谈判,"根据德黑兰的情报,伊朗已与德国,法国和英国就其核计划的谈判达成了协议. 欧洲人威胁要重启制裁."
56,Angespannte Ruhe in syrischer Stadt Suwaida,Die Auseinandersetzungen zwischen Drusen und Beduinen in der syrischen Stadt Suwaida scheinen vorerst beendet. Die Lage wird als ruhig beschrieben. Zugleich gibt es Berichte Hinrichtungen in den vergangenen Tagen.,Tense calm in Syrian city of Suwaida,"The clashes between Druze and Bedouin in the Syrian city of Suwaida seem to have ended for the time being, and the situation is described as calm, while reports of executions have been reported in recent days.",叙利亚的苏瓦达市局势紧张,"叙利亚的苏瓦达市的德鲁士人和贝都因人之间的争执似乎已经结束. 情况被描述为平静. 与此同时,最近几天发生了处决."
57,Israelische Armee weitet Einsatz im Gazastreifen aus,"Zum ersten Mal rückt die israelische Armee in die Stadt Deir al-Balah im Gazastreifen vor. Bewohner wurden zur Flucht aufgerufen. Papst Leo XIV. forderte ein sofortiges Ende der ""Barbarei des Krieges"".",Israeli Army Expands Operation in the Gaza Strip,"For the first time, the Israeli army moves to the city of Deir al-Balah in the Gaza Strip. Residents were called to flee. Pope Leo XIV called for an immediate end to the ""barbarism of war"".",以色列军队在加沙地带扩大部署范围,"以色列军队首次进入加沙地带的Deir al -Balah市, 居民被要求逃跑. 教皇里奥十四世要求立即停止""战争的野蛮行为."""
58,Nach Afghanistan-Abschiebungen: Die Show der Taliban,Deutschland hat mehr als 80 Straftäter nach Afghanistan abgeschoben. Was ist mit ihnen nach der Ankunft passiert? Klar ist - die Taliban nutzen sie für ihre Inszenierung. Von Stefanie Markert.,After Afghanistan Deportations: The Taliban Show,Germany has deported more than 80 criminals to Afghanistan. What happened to them after arrival? Of course - the Taliban use them for their staging. By Stefanie Markert.,阿富汗被驱逐出境后 塔利班的演出,"德国已经将80多名罪犯驱逐到阿富汗了. 抵达后他们怎么了? 当然,塔利班正在利用他们做假. 来自Stefanie Markert."
59,Warum Türkei-Urlauber tiefer in die Tasche greifen müssen,Die Türkei ist bei Deutschen ein beliebtes Reiseziel. Doch steigende Preise in Hotels und Restaurants lassen Buchungen aus Deutschland zurückgehen. Welche Folgen hat das für die Wirtschaft des Landes? Von C. Röse,Why Turkey vacationers need to grab deeper into their pockets,"Turkey is a popular destination for Germans. However, rising prices in hotels and restaurants reduce bookings from Germany. What are the consequences for the country's economy? By C. Röse",为什么土耳其人要更深入地把持起来?,"土耳其是德国最受欢迎的旅行目的地,但酒店和餐厅的价格却上涨了. 这对德国的经济造成什么影响?"
60,"Klöckner will besseren Schutz: ""Bundestag ist ein begehrtes Ziel""",Immer wieder greifen Hacker den Bundestag an. Parlamentspräsidentin Klöckner will daher die Schutzmaßnahmen erhöhen. Handlungsbedarf sieht sie aber noch an anderer Stelle.,"Klöckner wants better protection: ""Bundestag is a coveted goal""","Hacker repeatedly attacks the Bundestag. Parliament President Klöckner therefore wants to increase the protection measures. However, she sees the need for action elsewhere.","愚人要求更好的保护: ""联邦节是值得追求的目标""","哈克一再攻击联邦日. 因此,众议院主席Kluckner想要增加保护措施. 但行动需要让她在别处看到."
