,title-de,content-de,title-en,content-en,title-zh,content-zh
0,Merz fordert Netanjahu zu Waffenruhe in Gaza auf,Israel steht wegen der humanitären Lage im Gazastreifen in der Kritik. Der Bundeskanzler fordert einen Waffenstillstand und Hilfe für die Zivilbevölkerung. Israel startet mit dem Abwurf von Hilfsgütern aus der Luft.,Merz calls on Netanyahu to ceasefire in Gaza,Israel is critical of the humanitarian situation in the Gaza Strip. The Federal Chancellor calls for a ceasefire and aid for the civilian population. Israel starts with the dumping of aid from the air.,Merz要求内塔尼亚胡在加沙停火,以色列因为加沙地带的人道主义局势而受到批评. 德国总理要求对平民提供停火和援助. 以色列正在从空中发射救援物资.
1,Russische Flottenparade aus Sicherheitsgründen abgesagt,"Die alljährliche Flottenparade in St. Petersburg zum Tag der Marine sollte an diesem Sonntag stattfinden, sie wurde aber kurzfristig abgesagt. Die Parade war 2017 von Präsident Wladimir Putin eingeführt worden.",Russian fleet parade cancelled for safety reasons,"The annual fleet parade in St. Petersburg for Marine Day was scheduled to take place on this Sunday, but was cancelled at short notice. President Vladimir Putin introduced the parade in 2017.","为了安全起见,为了安全原因取消了俄罗斯舰队游行","每年在圣彼得堡举行的海军大游行本应是周日,但被短期取消了. 游行是普京总统在2017年发起的."
2,Österreich: ICE bleibt stundenlang in Tunnel stecken,"Zunächst war der ICE ""Donauwalzer"" der Deutschen Bahn pünktlich aus Wien abgefahren. 17 Minuten später steckte er fest. Die Passagiere mussten sich in Geduld üben, bevor sie evakuiert werden konnten.",Austria: ICE remains stuck in tunnels for hours,"At first the ICE ""Donauwalzer"" of the Deutsche Bahn had left Vienna on time. 17 minutes later he was stuck. The passengers had to exercise patience before they could be evacuated.",奥地利:在隧道里待上几个小时,"起先,德意志铁路的""多诺瓦勒"" 准时离开维也纳,17分钟后被困. 乘客们必须耐心等待,才能撤离."
3,Rebellen im Sudan stellen eigene Regierung auf,Nach mehr als zwei Jahren Bürgerkrieg im Sudan hat die gegen die Regierung kämpfende RSF-Miliz eine Parallelregierung ernannt. Präsident des Bündnis wird der Anführer der Miliz Mohamed Hamdan Daglo.,Rebels in Sudan establish their own government,"After more than two years of civil war in Sudan, the RSF militia fighting against the government has appointed a parallel government. President of the alliance will be the leader of the militia Mohamed Hamdan Daglo.",在苏丹的反叛者正在组建自己的政府,"在苏丹内战两年多后,反政府武装力量武装力量民兵已经任命了平行政府. 联盟的主席将成为军队的领袖哈姆德·达格罗."
4,Kampf gegen Feuer in Griechenland und der Türkei,"In zahlreichen Landesteilen Griechenlands toben Brände. Hitze und Trockenheit machen auch der Türkei zu schaffen. Hier gab es einen neuen Rekord: 50,5 Grad.",Fight against fire in Greece and Turkey,Fires are raging in many parts of Greece. Heat and drought are also causing Turkey to develop. There was a new record here: 50.5 degrees.,"在希腊和土耳其,与火作斗争.",希腊的许多地方正在发生火灾. 热和干旱也使土耳其得以实现. 这里的新纪录是50.5度.
5,Trump fordert Waffenruhe zwischen Thailand und Kambodscha,Nach der Eskalation an der Grenze zwischen Kambodscha und Thailand bemüht sich US-Präsident Trump um Deeskalation. Beide Seiten zeigen sich gesprächsbereit - doch die Kämpfe dauern an.,Trump calls for a ceasefire between Thailand and Cambodia,"After the escalation on the border between Cambodia and Thailand, US President Trump is trying to deescalate. Both sides are ready to talk - but the fights continue.",特朗普要求泰国和柬埔寨之间的停火,"在柬埔寨和泰国边境边界升级后,美国总统特朗普正在寻求解体. 双方都准备就绪 - 但战争正在持续."
6,Faktencheck: Haben die Simpsons die Coldplay-Kiss-Cam vorhergesagt?,"Vom viralen Coldplay-Kuss-Cam-Moment bis zur Präsidentschaft Trumps: Die ""Simpsons"" haben angeblich schon so manches vorhergesagt. Das DW-Faktencheck-Team prüft, was davon stimmt.",Fact check: Did the Simpsons predict the Coldplay Kiss Cam?,From the viral Coldplay Kiss Cam moment to Trump's presidency: The Simpsons have supposedly predicted a lot of things. The DW fact check team checks what's right.,事实调查 辛普森一家预测了 Coldplay Kiss Cam?,从科德普莱-库斯凯姆事件到特朗普总统任期 辛普森一家据说已经预测过很多事了. DW档案调查小组正在查证真相.
7,"Ghana: Ein Land, das niemals schläft?","Präsident John Mahama will eine Wirtschaft aufbauen, die rund um die Uhr läuft. Ist das machbar und was muss berücksichtigt werden, damit der Plan in Ghana gelingt?",Ghana: A country that never sleeps?,President John Mahama wants to build an economy that runs around the clock. Is that feasible and what needs to be taken into account in order for the plan to succeed in Ghana?,加纳: 一个从不睡觉的国家?,"约翰·马哈马总统想要建立一个全天候运作的经济体. 如果可以的话,那么它需要考虑什么,才能让计划在加纳成功?"
8,Big Tech: KI-Entwickler dringend gesucht,"Auf der Suche nach KI-Talenten bieten Tech-Unternehmen wie Meta riesige Summen. Dabei werden Start-ups aufgekauft und Fachkräfte mit enormen Antrittsprämien geworben. Doch ob sich das lohnt, ist noch nicht klar.",Big Tech: AI Developers Urgently Wanted,"In search of AI talents, tech companies such as Meta offer huge sums of money. Start-ups are purchased and skilled workers are recruited with enormous start-up awards. However, whether this is worthwhile is not yet clear.",Big Tech: 人工智能开发者急于寻找,"寻找人工智能技术公司,如超新星一样,提供巨资,以购买创业企业,并招聘有大量入场费的专业人员. 但这些技术是否值得,还不清楚."
9,"Bayreuther Festspiele mit ""Meistersingern"" eröffnet","Mit KI und digitalen Welten locken die Bayreuther Festspiele schon für das Jubiläumsjahr 2026. Bei Wagners ""Meistersingern"" geht es zum Auftakt um Brüche mit Traditionen. Eine Blaupause für die Lage der Festspiele?","Bayreuth Festival opens with ""Meistersingern""","With AI and digital worlds, the Bayreuth Festival is already attracting for the anniversary year 2026. Wagner's ""Master Singers"" is about breaks with traditions at the beginning. A blueprint for the situation of the Festival?","巴伐利亚的""冠军""节日游戏开幕了","有人工智慧和数字世界,巴伐利亚人已经在2026年举办了2026年庆典. 华格纳的""大师级""是关于打破传统的序幕."
10,"Einsamkeit: Jung, allein, deutsch, sucht: Freund(in)","""Wie finde ich Freunde?"" ist die häufigste Frage, die ein deutscher Influencer täglich gestellt bekommt. Das Thema Einsamkeit wird in Deutschland in vielen Altersgruppen immer akuter, auch mit Folgen für die Demokratie.","Loneliness: Young, alone, German, searching: Friend","""How do I find friends?"" is the most common question that a German influencer gets asked every day. The topic of loneliness is becoming increasingly acute in many age groups in Germany, also with consequences for democracy.","孤独,孤独,德意志,寻找朋友","""我怎么找朋友?"" 这是德国移民每天最常问的问题. 在德国,孤独问题在许多年龄组中越来越严重,也对民主产生影响."
11,Wie eine russische Aktivistin Gefangenen in der Ukraine hilft,"Iryna Krynina ist die erste Russin, die ihren Lebensgefährten in ukrainischer Kriegsgefangenschaft besucht hat. Was ist aus der Beziehung des Paares geworden - und warum will Krynina nicht mehr zurück nach Russland?",How a Russian Activist Helps Prisoners in Ukraine,Iryna Krynina is the first Russian to visit her life partner in Ukrainian prisoner of war. What has become of the couple's relationship - and why does Krynina no longer want to go back to Russia?,就像一个俄罗斯激进分子在乌克兰帮助囚犯一样,伊丽娜·克丽娜是第一个在乌克兰战俘中探访过她的同伴的俄罗斯女孩. 那对情侣的关系呢? 为什么克丽娜不想回到俄罗斯?
12,Abenteuer Deutsche Bahn,"Deutschland, mitten in der Urlaubszeit des Sommers 2025: Eine Zugreise von der Nordseeküste nach Berlin zeigt die ganze Misere des Bahnverkehrs.",Adventure Deutsche Bahn,"Germany, in the middle of the summer 2025 holiday season: A train journey from the North Sea coast to Berlin shows the whole misery of rail traffic.",德国铁路冒险冒险,2025年夏天中德国:从北海沿岸到柏林的火车旅行... ...显示了铁路交通的不景气.
13,Oft erst spät erkannt: Altersdepressionen,"Häufig werden Depressionen im Alter nicht erkannt, weil ihre Symptome als Zeichen des Alterungsprozesses interpretiert werden. Milde Depressionen können dadurch chronisch werden.",Often only recognized late: Age depression,Often depressions in old age are not recognized because their symptoms are interpreted as signs of aging. Mild depression can become chronic.,通常直到深夜才发现: 抑制老龄化症,"抑郁症通常无法被识别,因为它的症状被解释为衰老的标志. 慢性抑郁症可以被慢性抑郁症."
14,Mini-Organe aus dem Labor,"Wie Organoide die medizinische Forschung verändern könnten, erklärt Dr. Ines Lahmann im „Forschungsquartett“-Gespräch mit detektor.fm-Redakteurin Esther Stephan.
<p></p>
  <img alt=""woman"" height=""200"" src=""https://www.mdc-berlin.de/system/files/styles/mdc_inline_small_mdc_phablet_1x/private/2025-01/%C2%A9%20Felix%20Petermann%2C%20Max%20Delbr%C3%BCck%20Center_portrait_lahmann%2C%20ines-IMG_6678_FAVORIT.jpg?h=66fc3203&amp;itok=LXACBcVY"" width=""320"" />



<p></p>
<p>Organoide sind winzige Nachbildungen menschlicher Organe. Statt Tierversuchen könnten diese Mini-Organe aus Stammzellen bald helfen, Krankheiten besser zu verstehen und Therapien passgenau zu entwickeln.</p><p>Mehr dazu im <a href=""https://detektor.fm/wissen/forschungsquartett-organoide"">Podcast bei detektor.fm</a></p>
<p></p>

<p></p>",Mini-organs from the laboratory,"How organoids could change medical research is explained by Dr. Ines Lahmann in the ""Research Quartet"" interview with detector.fm editor Esther Stephan. <p> </p> <img alt=""woman"" height=""200"" src=""https://www.mdc-berlin.de/system/files/styles/mdc_inline_small_mdc_phablet_1x/private/2025-01/%C2%A9%20Felix%20Petermann%2C%20Max%20Delbr%C3%BCck%20Center_portrait_lahmann%2C%20ines-IMG_6678_FAVORIT.jpg?h=66fc3203&amp;itok=LXACBcVY/Delbr%C3%BCck%20Center_portrait_lahmann%2C%20ines-IMG_6678_FAVORIT.jpg_faVorit.h=66fc3203/t/T/Ty/Ty/Ty/Ty/Ty/Ty/Ty/Ty/Ty/Ty/Ty/Ty/Ty/Ty/Ty/Ty/Ty/Ty/Ty/Ty/Ty/Ty/Ty/Ty/T/T/T/T/Ty/Ty/T/Ty/Ty/Ty/Ty/Ty/Ty/Ty/T/T/T/T/T/T/T/T/T/T/T/T/T/T/T/T/T/T/T/T/T/T/T/T/T/T/T/T/T/T/T/T/T/T/T/T/T/T/T/T/T/T/T/T/T/T/T/T/T/T/T/T/T/T/T/T/T/T/T/T/T/T/T/T/T/T/T/T/T/T/T/T/T/T/T/T/T/T/T/T/T/",实验室的迷你有机体,"器官人如何改变医学研究? 在研究四重奏时,伊尼丝·阿斯特凡 (EstherStephany) 博士在研究四重奏中解释了如何改变医学研究的慢性 (Esther.fm) 演讲中,因特网 (EstherStephan). <p> </img- edg=""work"" height=""200""src=""http://www.mdc-free. com/ system/files/mdc_incl_incl_incl_1ht) % 2% 2% 2% 12% 00% COC% % BC3% APT_PT_PT% 2C% 20% Center_PER_PERMNALL_PT. j? h3=f3=663sc=sc-inch/inch_inc_inc_inc_1hpt.1xt.1xt) % x2.2.0hmm hh"" - hpt\hpt\/h"
15,Biopolis – Reise ins Mikrobiom,"Eine junge Wissenschaftlerin erkundet das menschliche Mikrobiom – in einer fünfteiligen Serie, die changiert zwischen Wissenschaft und Fiktion. Der Podcaster Michiel van Poelgeest begleitet Dr. Theda Bartolomaeus vom Max Delbrück Center auf ihrer Suche nach dem Code der Mikroben in uns. (in Englisch)
<p></p>
  <img alt=""Theda Bartolomaeus"" height=""200"" src=""https://www.mdc-berlin.de/system/files/styles/mdc_inline_small_mdc_phablet_1x/private/2025-07/rn_image_picker_lib_temp_7c0c8b45-42be-48ad-b853-cbeef4a8bc06.jpg?h=4521fff0&amp;itok=EjrYGyxS"" width=""320"" />



<p></p>
<p><a href=""https://springcast.app/biopolis-into-the-microbiome""><strong>Podcast Website</strong></a></p><p><a href=""https://podcasts.apple.com/de/podcast/biopolis-into-the-microbiome/id1822739797"">Biopolis bei Apple Podcasts</a></p>
<p></p>

<p></p>",Biopolis – Journey to the microbiome,"A young scientist explores the human microbiome in a five-part series that changes between science and fiction. Podcaster Michiel van Poelgeest accompanies Dr. Theda Bartolomaeus from the Max Delbrück Center in her search for the code of the microbes in us. (in English) <p> </p> <img alt=""Theda Bartolomaeus"" height=""200"" src=""https://www.mdc-berlin.de/system/files/styles/mdc_inline_small_mdc_phablet_1x/private/2025-07/rn_image_picker_lib_temp_7c0c0c8b45-42be-48ad-b853cbeef4a8bc06.jpg?h21fff0&amp;itok=EjrYGyxS"" width=""320"" /> < </p> < bio-pbio-ref> http/bio-ref>.",Biopolis 和 微生物旅行到微生物.,"一名年轻的科学家在五部分中探索人类微生物,并进行科学和虚构之间的交换. 播客Michel/mc_inmel_mmml_mdl_BARt_220/20n_high_mx_p220n_high_b4b4b4b8bb8bbccm."" sc=""http: /w.mdc-blin.de.com/files/mc_mcl_mdit_BAR_BAR_BAR_1x220/20n_high_highr_high_bc8b4b4b4bc4bg=""mc""=""src=""mc=""mc=""mc=""mc=""mc=""mdlins.m2:h"
16,Wachstumschancen durch erneuerbare Energien: KfW-Kredit hilft deutschen und südafrikanischen Unternehmen,"Entwicklungsministerin Reem Alabali Radovan hat heute anlässlich ihrer Reise zum G20-Entwicklungsministertreffen eine Vereinbarung mit der südafrikanischen Regierung zum Ausbau der erneuerbaren Energien in Südafrika bekannt gegeben. Mit dem KfW-Kredit in Höhe von 500 Millionen Euro – reine Marktmittel, also ohne deutsches Steuergeld – sollen weitere Reformen des südafrikanischen Energiesektors vorangebracht werden, die gute Bedingungen für privatwirtschaftliche Investitionen schaffen. Dazu gehört der Ausbau der erforderlichen Netze für Solar- und Windanlagen.",Growth opportunities through renewable energies: KfW loan helps German and South African companies,"Development Minister Reem Alabali Radovan today announced an agreement with the South African government on the expansion of renewable energies in South Africa on her trip to the G20 Development Minister Meeting. The KfW loan of EUR 500 million – pure market funds, i.e. without German tax money – is intended to advance further reforms of the South African energy sector that create good conditions for private-sector investments, including the expansion of the necessary solar and wind power grids.",可再生能源为增长带来机会:KFW贷款帮助德国和南非公司.,"发展部长雷姆·阿拉巴利·拉多万 (Reem Alabali Radovan) 今天在前往G-20发展部长会议的路上,与南非政府签订了一项协议,在南非开发可再生能源. KFW发展中心 (KFW) 的市场资源纯额为5亿欧元,即没有德国的税收,南非能源部门应该继续改革,为私人部门投资创造有利条件. 这包括发展必要的太阳能和风能网."
17,Alabali Radovan beim Treffen der G20-Entwicklungsminister*innen: Globale Partnerschaften sichern in unsicheren Zeiten,Im Anschluss an ihre bilateralen Termine in Südafrika nimmt Entwicklungsministerin Reem Alabali Radovan am Treffen der G20-Entwicklungsminister*innen in Skukuza teil (24./25. Juli). Mit Südafrika hat erstmals ein afrikanisches Land die Präsidentschaft der G20 inne. Trotz des Rückzugs der USA aus den Verhandlungen konnte sich die Gruppe der 20 wirtschaftsstärksten Nationen unter anderem auf wichtige Schritte zur Bekämpfung illegaler Finanzströme sowie zur Stärkung sozialer Sicherungssysteme einigen.,Alabali Radovan at the G20 Development Ministers Meeting: Securing Global Partnerships in Unsafe Times,"Following her bilateral appointments in South Africa, Development Minister Reem Alabali Radovan is taking part in the G20 Development Ministers' meeting in Skukuza (24-25 July). With South Africa, for the first time, an African country holds the presidency of the G20. Despite the withdrawal of the US from the negotiations, the group of 20 most economically powerful nations was able to agree on important steps to combat illegal financial flows and strengthen social security systems.","在G-20发展部长会议期间,亚拉巴利·拉多万 (Alabali Radovan) 说: 全球伙伴关系在不确定的时代保护着不确定性","在双边会议之后,发展部长雷姆·阿拉巴利·拉多万 (Rem Alabal Radovan) 将在7月24日至25日在Skurza举行G-20会议. 与南非首次举行了非洲国家总统会议. 尽管美国已退出谈判,但20国集团仍能够商定采取重要步骤打击非法金融流以及加强社会保障制度."
18,Entwicklungsministerin Alabali Radovan in Südafrika: Wirtschaftliche Zusammenarbeit und strategische Partnerschaft stärken,Entwicklungsministerin Reem Alabali Radovan ist zu ihrer ersten großen Afrikareise gestartet. Ein zentrales Thema in Südafrika wird die enge wirtschaftliche Zusammenarbeit zwischen der größten afrikanischen Volkswirtschaft und Deutschland sein. Außerdem nimmt Alabali Radovan vom 24. bis 25. Juli am Treffen der G20-Entwicklungsminister*innen teil.,Development Minister Alabali Radovan in South Africa: Strengthening economic cooperation and strategic partnership,Development Minister Reem Alabali Radovan has started her first major trip to Africa. A central topic in South Africa will be close economic cooperation between the largest African economy and Germany. Alabali Radovan will also take part in the G20 Development Ministers' meeting from 24 to 25 July.,南非的发展部长阿拉巴利·拉多万 加强经济合作和战略伙伴关系,非洲最大经济体与德国之间的密切经济合作将会在7月24日至25日举行的G-20发展部长会议.
19,Bundesentwicklungsministerin Reem Alabali Radovan zu Gaza:,"„Was gerade in Gaza passiert, ist unfassbar. Unschuldige Kinder sterben. Menschen hungern. Ich war gerade in der Region, und alle meine Gespräche haben bestätigt: Es braucht jetzt – nicht irgendwann – einen sofortigen und nachhaltigen Waffenstillstand. Vor diesem Hintergrund sind die Forderungen des Briefes der 29 Partner an die israelische Regierung für mich nachvollziehbar. Ich hätte mir gewünscht, dass Deutschland sich dem Signal der 29 Partner anschließt. (...)""",Federal Minister for Development Reem Alabali Radovan on Gaza:,"""What is happening in Gaza is unbelievable. Innocent children are dying. People are starving. I was in the region right now, and all my conversations have confirmed that an immediate and sustainable ceasefire is needed now – not at some point. Against this background, the demands of the letter from the 29 partners to the Israeli government are understandable to me. I would have liked Germany to join the signal of the 29 partners. (...)""",联邦发展部长莱姆·阿拉巴利·拉多万 (Radovin) 前往加沙 (Reem Alabali Radovan),"目前加沙发生的事件令人难以置信. 无辜儿童正在挨饿. 我才刚到该地区,所有的谈话都证实了:现在不需要立即和可持续的停火. 在这样的背景下,29个伙伴给以色列政府的信的要求是可以解释的. 我希望德国能加入29个伙伴的信号. """
20,Deutschland setzt auf verstärkte internationale Zusammenarbeit zur Umsetzung der Agenda 2030,"Deutschland präsentiert heute seinen dritten Freiwilligen Staatenbericht vor den Vereinten Nationen in New York. Im Rahmen des jährlichen Hochrangigen Politischen Forums (HLPF) kommen dort Vertreter*innen von Regierungen, Zivilgesellschaft, Wissenschaft und Wirtschaft zusammen, um den Fortschritt bei der Umsetzung der Agenda 2030 zu bewerten.",Germany relies on increased international cooperation to implement the 2030 Agenda,"Today, Germany is presenting its third volunteer state report to the United Nations in New York. Representatives of governments, civil society, science and industry will meet at the HLPF to assess progress in implementing the 2030 Agenda.","德国要求加强国际合作,实施2030年议程.","德国今天在纽约向联合国发表了第三次志愿国报告. 在年度高级政治论坛 (HLPF) 中,各国政府,民间社会,科学和经济代表聚集在一起,评估2030年议程的执行进展情况."
21,Entwicklungsministerin Alabali Radovan führt in Ägypten Gespräche zum Wiederaufbau von Gaza,"Entwicklungsministerin Reem Alabali Radovan reist heute nach Ägypten, um mit der ägyptischen Regierung Gespräche zum Wiederaufbau in Gaza zu führen. Ägypten hatte kürzlich gemeinsam mit weiteren arabischen Ländern einen Plan für die Zukunft des weitgehend zerstörten Küstenstreifens vorgelegt.",Development Minister Alabali Radovan holds talks in Egypt on the reconstruction of Gaza,"Development Minister Reem Alabali Radovan is travelling to Egypt today to discuss reconstruction in Gaza with the Egyptian government. Egypt, together with other Arab countries, recently presented a plan for the future of the largely destroyed coastline.",艾拉巴利·拉多万发展部长 在埃及举行重建加沙的讨论会,"发展部长莱姆·阿拉巴利·拉多万今天将前往埃及与埃及政府进行加沙重建谈判. 埃及最近和其他阿拉伯国家一道,提出了一个关于被广泛摧毁的海岸线的未来计划."
22,Entwicklungsministerin Reem Alabali Radovan zur aktuellen Lage in Syrien:,"„Ich bin sehr beunruhigt über die Lage in Syrien. Die anhaltenden Auseinandersetzungen in Sweida haben zu vielen Opfern geführt, insbesondere in der Zivilbevölkerung. Ich appelliere an alle Beteiligten, die gestern vereinbarte Waffenruhe einzuhalten, alle Zivilisten zu schützen und von Angriffen und Hassrede gegen Minderheiten abzusehen. Syrien gehört allen Syrerinnen und Syrern und nur gemeinsam kann die Zukunft des Landes gesichert und ein Abgleiten ins Chaos vermieden werden. (...)""",Minister of Development Reem Alabali Radovan on the current situation in Syria:,"""I am very concerned about the situation in Syria. The ongoing clashes in Sweida have led to many victims, especially in the civilian population. I appeal to all those involved to observe the ceasefire agreed yesterday, to protect all civilians and to refrain from attacks and hate speech against minorities. Syria belongs to all Syrians and only together can the future of the country be secured and a drift into chaos can be avoided. (...)""",叙利亚目前的局势中 Reem Alabali Radovan 发展部长Reem Alabali Radovan:,"我对叙利亚局势感到非常不安. 斯威达持续的冲突造成许多伤亡,特别是平民伤亡. 我呼吁所有各方遵守昨天达成的停火协议,保护所有平民,避免针对少数族裔的攻击和仇恨言论. 叙利亚属于所有叙利亚人和叙利亚人,只有团结一致才能保证叙利亚的未来,避免陷入混乱 (...) ."
23,Startschuss für europäischen Ukraine-Wiederaufbaufonds,"Entwicklungsministerin Reem Alabali Radovan nimmt heute in Rom an der Ukraine-Wiederaufbaukonferenz teil. Das Entwicklungsministerium ist zuständig für die Koordinierung der Unterstützung der Bundesregierung für den Wiederaufbau der Ukraine. Auf der heutigen Konferenz wird der Startschuss für den „European Flagship Fund for Reconstruction of Ukraine“ gegeben. Dieser soll Privatinvestitionen in Infrastruktur, Energie, Industrie und andere strategisch wichtige Sektoren der ukrainischen Wirtschaft befördern.",Launch of European Ukraine Reconstruction Fund,"Development Minister Reem Alabali Radovan is taking part in the Ukraine Reconstruction Conference in Rome today. The Ministry of Development is responsible for coordinating the Federal Government's support for the reconstruction of Ukraine. Today's conference will launch the European Flagship Fund for Reconstruction of Ukraine, which will promote private investment in infrastructure, energy, industry and other strategically important sectors of the Ukrainian economy.",向欧洲乌克兰重建基金发射发射弹头,"发展部负责协调联邦政府对乌克兰重建的支持. 今天的会议将为乌克兰重建的欧盟旗帜基金 (European Flags for Ukraine Reconvention Foundation Foundation) 提供启动. 该基金将向基础设施,能源,工业和其他重要的乌克兰经济部门提供私人投资."
