,title-de,content-de,title-en,content-en,title-zh,content-zh
61,Bundesverfassungsgericht: Klingbeil hält an Brosius-Gersdorf fest,"Die Bedenken der Union wegen angeblicher Plagiate seien ja ausgeräumt: Vizekanzler Klingbeil will die SPD-Kandidatin Brosius-Gersdorf weiter in Karlsruhe sehen. Und es gehe eben auch um ""eine prinzipielle Frage"".",Federal Constitutional Court: Klingbeil holds on to Brosius-Gersdorf,"The Union's concerns about alleged plagiarism have been resolved: Vice Chancellor Klingbeil wants to see SPD candidate Brosius-Gersdorf further in Karlsruhe. And it is also about ""a fundamental question"".",Klingbeil被关押在Brouseius-Gersdorf身上.,"联盟对据称柏拉图的顾虑已经消除了 克林堡副总理Klingbeil希望S. D. Kingdittius-Gersdorf继续在卡尔西厄斯 (Karlzheus) 的S. Brossius-Gersdorf. 这也是""一个基本问题."""
62,Mindestens zehn Tote nach Erdrutschen in Südkorea,"Tagelanger, heftiger Regen hat in Südkorea zu Erdrutschen geführt. Mindestens zehn Menschen kamen ums Leben, etliche werden noch vermisst. Besonders betroffen war der Süden des Landes.",At least ten deaths after landslides in South Korea,"Day-long, heavy rain has led to landslides in South Korea. At least ten people were killed, some are still missing. The south of the country was particularly affected.",韩国的地球滑坡至少死了十个人,"长达数天的大雨导致韩国土崩瓦解. 至少10人死亡,还有一些人失踪. 南部尤其受到影响."
63,Britische Grooming-Opfer: Ignoriert und instrumentalisiert,"Es geht um jahrelangen, von Banden organisierten sexuellen Missbrauch von Mädchen. Großbritannien diskutiert wieder über den Grooming-Gang-Skandal. Doch die Debatte wurde längst von Rechtsradikalen gekapert. Von Mareike Aden.",British Grooming Victims: Ignored and instrumentalized,It's about years of gang-organized sexual abuse of girls. Britain is again discussing the grooming gang scandal. But the debate has long since been hijacked by right-wing radicals. By Mareike Aden.,英国的格罗明受害者: 被忽视和使用工具.,"这是有关多年的,有组织地对女孩的性虐待事件. 大不列颠再次讨论了格罗明帮派丑闻. 但这场辩论早已被法律制裁了. 由马崔克·阿登 (Mareke Aden) 提出."
64,Wieso Affen seltener Krebs bekommen als Menschen,Menschsein hat nicht nur Vorteile: Wir bekommen häufiger Krebs als zum Beispiel Schimpansen. Ein US-Forschungsteam hat jetzt einen Grund dafür gefunden - und den könnte man für zukünftige Krebstherapien nutzen. Von Veronika Simon.,Why monkeys get cancer less often than humans,"Humanity has not only advantages: we get cancer more often than chimpanzees, for example. A US research team has now found a reason for this - and it could be used for future cancer therapies. By Veronika Simon.",为什么猴子得癌症比人类还要罕见?,做人类不仅有好处:我们患癌症的次数比黑猩猩还要多. 美国研究小组已经找到了一个理由 - 并且可以用来治疗未来的癌症. 维罗妮卡·西蒙.
65,Millionen Patienten nutzen E-Akte noch nicht aktiv,"Über 70 Millionen E-Patientenakten sind vergeben - doch nur ein Bruchteil nutzt sie aktiv, um Daten zu sehen oder für Ärzte zu sperren. Das hat eine Umfrage bei Krankenkassen ergeben.",Millions of patients do not yet actively use E-Files,More than 70 million E-patient files are taken - but only a fraction of them use them actively to see data or to block them for doctors. This is the result of a survey conducted by health insurance companies.,数以百万计的病人还没有积极使用电子文件,"超过7000万个电子病记录被赦免了,但只有一小部分是使用来看病或锁医生的. 这是对医疗保险的调查."
66,Schwimm-WM: Viertes WM-Gold für Wellbrock,"Florian Wellbrock hat den nächsten Titel geholt: In Singapur gewann der 27-Jährige bei der Freiwasser-Staffel das vierte WM-Gold. Nun hat er ein paar Tage Zeit, um sich auf das nächste Rennen vorzubereiten.",Swimming World Cup: Fourth World Cup Gold for Wellbrock,"Florian Wellbrock has won the next title: in Singapore, the 27-year-old won the fourth World Cup gold at the open water relay. Now he has a few days to prepare for the next race.",世界游泳世界杯第四名世界杯金牌,"Florian Wellbrock获得下一届冠军:在新加坡,27岁的年轻人在自由水队中赢得了第四届世界杯金牌. 现在他有几天时间准备下一场比赛."
67,Tausende Israelis demonstrieren für Geiselfreilassung,Die Gespräche über eine Waffenruhe in Gaza ziehen sich in die Länge. Und noch immer sind Geiseln in den Tunneln der Hamas gefangen. Tausende Menschen haben in israelischen Städten für die Freilassung demonstriert.,Thousands of Israelis demonstrate for hostage release,Talks about a ceasefire in Gaza are continuing. And hostages are still trapped in Hamas tunnels. Thousands of people have demonstrated for release in Israeli cities.,数以千计的以色列人抗议释放人质,加沙停火的谈判时间越来越长了. 哈马斯的隧道里仍然有人质被俘虏. 数以千计的以色列人在以色列城市中抗议释放.
68,Fußball-EM: Deutschland zieht ins Halbfinale ein,Nach einem spannenden Elfmeterschießen haben die deutschen Frauen das Viertelfinale gegen Frankreich gewonnen. Sie stehen nun im Halbfinale der Fußball-EM. Deutschland hatte über 100 Minuten in der Unterzahl gespielt.,Football-EM: Germany enters the semi-finals,"After an exciting penalty shooting, the German women have won the quarter-final against France. They are now in the semi-finals of the Football-EM. Germany had over 100 minutes in the outnumber.",足球EM: 德国即将进入半决赛,德国妇女在击落1米1的战斗中赢得了对法国的四分之一决赛. 现在他们已进入了足球的半决赛. 德国的人数已经超过100分钟了.
69,Ex-SPD-Vorsitzender Platzeck verteidigt Moskau-Reisen,"""Diplomatie auf vielen Ebenen und in vielen Spielarten"": Ex-SPD-Chef Platzeck ist seit Beginn des russischen Angriffskriegs gegen die Ukraine mehrmals nach Moskau gereist. Nun hat er sich verteidigt.",Ex-SPD Chairman Platzeck defends Moscow journeys,"""Diplomaty on many levels and in many ways"": Ex-SPD boss Platzeck has travelled to Moscow several times since the beginning of the Russian war of aggression against Ukraine. Now he has defended himself.",前SPD主席的座位 为莫斯科的铁轨辩护,"俄罗斯攻击乌克兰战争开始以来,前SDP主席斯泰尔克多次前往莫斯科,现在他还为自己辩护."
70,Ukraine-Liveblog: ++ Mindestens drei Tote bei russischen Angriffen ++,Bei Luftangriffen in der Zentralukraine und in Odessa sind mindestens drei Menschen getötet worden. Russland hat seine große Militärschau im August ohne Nennung von Gründen abgesagt.,Ukraine live blog: ++ At least three deaths in Russian attacks ++,At least three people have been killed in air raids in central Ukraine and Odessa. Russia cancelled its large military show in August without mentioning any reasons.,乌克兰的立体博客:++至少死了3人,"在乌克兰中部和奥德萨空袭中,至少死了三个人. 俄罗斯在八月取消了其伟大的军事演习,毫无理由地取消了."
71,Selenskyj schlägt Moskau neue Verhandlungen vor,In die Verhandlungen um eine Feuerpause könnte Bewegung kommen: Kiew schlägt Moskau neue Gespräche in der kommenden Woche vor. Eine bedingungslose Waffenruhe ist aber nicht in Sicht - Moskau stellt Maximalforderungen.,Selenskyy proposes Moscow new negotiations,"In the negotiations for a ceasefire, movement could come: Kiev proposes Moscow new talks next week. An unconditional ceasefire is not in sight - Moscow sets maximum demands.",塞伦斯基提议在莫斯科进行新的谈判,停火谈判可能有所进展:下星期基辅提议莫斯科进行新的谈判. 但没有无条件停火 - 莫斯科要求最大限度的停战.
72,Wie die Epstein-Akten für Trump zum Problem wurden,Um den Fall ranken sich Gerüchte und Verschwörungstheorien. Nun wird die Frage der Veröffentlichung der Epstein-Akten für US-Präsident Trump immer mehr zum Problem. Warum ist die Sache so brisant?,How the Epstein Acts became a problem for Trump,"Rumours and conspiracy theories surround the case. Now, the issue of the publication of the Epstein files for US President Trump is becoming more and more a problem. Why is this so explosive?",Epstein的文件是如何成为特朗普的麻烦的?,"传言和阴谋论都与本案有关. 现在,有关Epstein给美国总统的文件出版的问题越来越严重了. 为什么这事这么严重?"
73,Touristenschiff kentert in Halong-Bucht in Vietnam - viele Tote,In Vietnam ist ein Touristenschiff während starker Regenfälle gekentert. Bei dem Unglück in der Halong-Bucht sind mindestens 35 Menschen ums Leben gekommen. Nach vier Vermissten wird gesucht.,Tourist ship capsized in Halong Bay in Vietnam - many dead,"In Vietnam, a tourist ship is capsized during heavy rains. At least 35 people have been killed in the disaster in Halong Bay. Four missing persons are wanted.",观光船在越南的夏隆湾沉没 - 死了很多人,"在越南,一艘旅游船在大降雨时停泊. 在海隆湾的灾难中,至少死了35人. 失踪4人被通缉."
74,Demokratische Republik Kongo und M23-Rebellen wollen Kämpfe beenden,Hoffnung auf ein Ende der Gewalt: Die Regierung der Demokratischen Republik Kongo und die von Ruanda unterstützten Rebellen der M23-Miliz haben sich auf eine Grundsatzerklärung zur Beendigung der Kämpfe verständigt.,Democratic Republic of Congo and M23 rebels want to end fighting,Hope for an end to violence: The government of the Democratic Republic of the Congo and the rebels of the M23 militia supported by Rwanda have agreed on a declaration of principle to end the fighting.,刚果民主共和国和M23叛军想结束战争,结束暴力的希望:刚果民主共和国政府和卢旺达支持的 M23民兵叛军已经同意了一项关于结束战斗的原则声明.
75,Kämpfe in Syrien: Hält die Waffenruhe?,Seit der Nacht gilt für den Süden Syriens erneut eine Waffenruhe - doch offenbar halten sich nicht alle Seiten daran. Aus der Provinz Suwaida gibt es weiter Berichte über Kämpfe. Inzwischen werden fast 1.000 Tote gemeldet.,Fighting in Syria: Does the ceasefire last?,"Since the night a ceasefire has been in effect for the south of Syria - but apparently not all sides adhere to it. From the province of Suwaida there are further reports about fighting. In the meantime nearly 1,000 deaths are reported.",在叙利亚战斗: 停火?,"叙利亚南部再次实行停火,但显然并非所有各方都遵守停火协议. 在苏瓦达省,还有关于战斗的报道. 现在有近一千人死亡."
76,Auto fährt in Los Angeles in Menschenmenge - viele Verletzte,Auf dem Santa Monica Boulevard in Los Angeles ist ein Autofahrer in eine Menschenmenge gefahren. Einsatzkräfte sprechen von mehr als 30 Verletzten. Der Fahrer wurde angeschossen.,Car drives in Los Angeles in crowd - many injured,"On Santa Monica Boulevard in Los Angeles, a car driver drove into a crowd, and there are more than 30 people injured. The driver was shot.",洛杉矶的汽车在人群中移动 - 许多人受伤,"洛杉矶圣莫尼卡大道上,一名司机撞车撞向人群. 现场人员说有30多人受伤. 司机中枪了."
77,Trotz fehlender Pressefreiheit: Ägyptens Podcast-Boom,"In Ägypten gibt es so gut wie keine Pressefreiheit, das Land liegt im internationalen Vergleich weit hinten. Und trotzdem gibt es einen regelrechten Podcast-Boom. Oder gerade deshalb? Von Kilian Pfeffer.",Despite the lack of press freedom: Egypt's podcast boom,"In Egypt there is virtually no freedom of the press, the country is far behind in international comparison. And yet there is a real podcast boom. Or is that why? Of Kilian Pfeffer.","尽管没有新闻自由,埃及的播客碗","埃及几乎没有新闻自由,而这个国家在国际上却远远落后. 然而,它仍然有一个真正的播客环境,对吗?"
78,75-jähriges Bestehen: Merz würdigt Zentralrat der Juden,"1950 wurde der Zentralrat der Juden gegründet - heute feiert er sein 75-jähriges Bestehen. Kanzler Merz würdigte den Zentralrat und erinnerte daran, dass Deutschland ein ""Schutzraum für Jüdinnen und Juden"" sein müsse.",75th anniversary: Merz pays tribute to the Central Council of Jews,"In 1950 the Central Council of Jews was founded - today it celebrates its 75th anniversary. Chancellor Merz paid tribute to the Central Council and recalled that Germany must be a ""protection area for Jews"".","75年纪念日,梅兹向犹太人中央委员会致敬","1950年成立了犹太中央委员会 (Central Council of Judge), 今天他庆祝了75年. 梅兹总理赞扬了中央委员会,并提醒人们德国必须成为犹太人和犹太人的保护区."
79,Schweitzer für Prüfung von AfD-Verbot,In der Debatte um ein mögliches AfD-Verbot hat sich der rheinland-pfälzische Ministerpräsident Schweitzer für die Vorbereitung eines Verfahrens ausgesprochen. Eine AfD-Strategie zur Spaltung von Schwarz-Rot alarmiert die Linke.,Schweitzer for testing of AfD ban,"In the debate about a possible AfD ban, the Rhineland-Palatinate Prime Minister Schweitzer spoke out in favour of the preparation of a procedure. An AfD strategy for splitting black and red alerts the left.",对AffD禁令进行审核,"在对可能的AfD禁令的辩论中, reynland -Photo -Photo -Photo -Sweitzer总理 (Shweitzer) 呼吁准备一项诉讼. 一个将黑-红划分划成两半的AFD战略提醒左派."
80,Japan: Fukushima-Erde zum Sitz des Regierungschef transportiert,"Japans Regierung will zeigen, dass Fukushima-Erde ungefährlich sei: Dutzende Säcke aus der Nähe des verunglückten AKW wurden zum Amtssitz von Premier Ishiba transportiert. Viele Regionen wollten aber nicht mitmachen.",Japan: Fukushima Earth transported to the head of government's headquarters,"Japan's government wants to show that Fukushima Earth is safe: dozens of sacks from the vicinity of the accident were transported to Premier Ishiba's headquarters, but many regions did not want to participate.",日本:把福岛地运至领导人所在地,"日本政府希望表明福岛地的安全性:几十包货被运到石木总部,离死胡同的AKW很近. 许多地区都不愿意参与其中."
81,Nahost-Liveblog: ++ Viele Tote nahe Hilfszentrum in Gaza ++,Israels Armee soll nach palästinensischen Angaben erneut viele Menschen bei einem Hilfszentrum im Gazastreifen getötet haben. US-Präsident Trump hat die baldige Freilassung weiterer Geiseln aus dem Gazastreifen angekündigt.,Middle East live blog: ++ Many dead near aid center in Gaza ++,"According to Palestinian sources, Israel's army has again killed many people at a relief centre in the Gaza Strip. US President Trump has announced the early release of other hostages from the Gaza Strip.",中东参考博客:++ 在加沙的救济中心附近死了很多人++,"以色列军队根据巴勒斯坦的消息再次在加沙地带的救济中心 杀害了许多人. 美国总统特朗普宣布,将早日释放更多的人质."
82,Elternvertreter: Lange Ferien sind Herausforderung für Familien,"Wochenlange Schulferien - das stellt viele Eltern vor Betreuungsprobleme. Für einige Familien sei es deshalb die ""schwierigste Zeit des Jahres"", sagt der Bundeselternrat. Kürzere Ferien lehnen Schülervertreter aber ab.",Parent representatives: Long holidays are a challenge for families,"Weeks of school holidays - this presents many parents with care problems. For some families it is therefore the ""most difficult time of the year"", says the Federal Parents Council. Shorter holidays, however, reject student representatives.",家长代表:长假是家庭挑战,"几周的假日 - - 有很多家长面临照顾问题. 因此,对一些家庭来说,这是一年中最困难的时期. 州长说,短短的假日会拒绝学生代表."
83,Mit 40 in Rente: Wie realistisch ist finanzielle Freiheit?,Nicht alle wollen erst mit 67 in den Ruhestand gehen. Ein alternativer Ansatz: früh finanziell unabhängig sein - und von den Erträgen des eigenen Vermögens leben. Kann das gelingen? Von Lilli-Marie Hiltscher.,Retirement at 40: How realistic is financial freedom?,Not everyone wants to retire at 67. An alternative approach: to be financially independent at an early stage - and to live on the profits of their own assets. Can this succeed? By Lilli-Marie Hiltscher.,"40岁退休,金融自由究竟有多现实?","不是所有人都想在67岁退休. 一个替代方案,即早期的经济独立性 - - 并从自己的财富中获益. 这可行吗?"
84,DRK: Millionen Menschen fehlen für Hilfe im Katastrophenfall,"Was ist bei Unwettern oder Katastrophen zu tun? Darauf bereiten zwar Kurse die Bevölkerung vor, doch laut DRK müssten Millionen Menschen ausgebildet werden - und zwar rasch. Aber dafür fehlen Mittel.",DRK: Millions of people are missing for disaster relief,"What needs to be done in the event of storms or disasters? Although courses are preparing the population for this, according to the DRC, millions of people would have to be trained - and quickly.",龙卷风:数百万人缺乏救灾能力,"暴风雨和灾难怎么办? 人民在为这个计划航线,但根据朝鲜的统计,有数百万人需要接受训练,而且速度很快,但资源不足"
85,Schweden glänzt mit Innovationskraft und Gründergeist,"Viel Wasser, weite Wälder - Schweden gilt vor allem als ein Ort der Ruhe. Gleichzeitig ist das Land wohl eines der innovativsten der Welt. Doch woher kommt diese Innovationskraft? Von Anne-Catherine Beck.",Sweden shines with innovative power and entrepreneurial spirit,"Lots of water, vast forests - Sweden is above all a place of peace. At the same time, the country is probably one of the most innovative in the world. But where does this innovative power come from? From Anne-Catherine Beck.",瑞典有创新和创始精神的闪耀,"众多水源,广阔的森林 - - 瑞典主要被视为平静之地. 与此同时,这个国家可能是世界最具创新性的. 但这种创新来自安恩-卡瑟琳·贝克."
86,Richterbund will mehr Unabhängigkeit für deutsche Staatsanwälte,In einem Rechtsstaat muss die Justiz unabhängig sein. In Deutschland aber haben Staatsanwälte den Anweisungen etwa von Ministern zu folgen. Der Richterbund fordert rasche Reformen - auch wegen des politischen Klimas.,Richterbund wants more independence for German prosecutors,"In a rule of law, the judiciary must be independent, but in Germany, prosecutors have to follow the instructions of ministers, for example.The judge's federation demands rapid reforms - also because of the political climate.",法官团想要更多的独立性 为德国检察官提供更多的独立性,"在法治中,司法必须独立,但在德国,检察官必须遵从部长们的指示. 法官协会要求迅速改革,包括政治气候."
87,Interstellares Objekt 3I/ATLAS rast durchs Sonnensystem,"Unser Sonnensystem hat Besuch von einem anderen Stern: Der Komet 3I/ATLAS ist erst der dritte interstellare Besucher, den Forschende entdeckt haben - und könnte älter als unser Sonnensystem sein. Von Franziska Konitzer.",Interstellar object 3I/ATLAS racing through the solar system,Our solar system has a visit from another star: Comet 3I/ATLAS is only the third interstellar visitor that researchers have discovered - and could be older than our solar system. By Franziska Konitzer.,星际物体3i/ATLAS 穿过太阳系,"我们的太阳系有另一个恒星来看望我们: 彗星3I/ATLAS只是第三位星际探访者,发现后发现此人,可能比我们的太阳系还老. 来自方济各的探访者."
88,Mit Meerwasser gegen die Dürre,Durch immer mehr heiße Tage wird Wasser knapp. Mehrere Länder setzen bereits auf die Entsalzung von Meerwasser. Könnte das ein Game Changer auch für Deutschland sein? Die Ostsee bietet zumindest einen strategischen Vorteil. Von K. Bruns.,With seawater against the drought,More and more hot days make water scarce. Several countries already rely on the desalination of sea water. Could this be a game changer for Germany too? The Baltic Sea offers at least a strategic advantage. By K. Bruns.,用海水抵御干旱,"日复一日,水就变得越来越稀少. 一些国家已经把海水的淡化放在了上头. 这会不会是德国的一场比赛? 东海至少提供了一个战略优势. 由K. Bruns提供."
89,"Asylpolitik der Bundesregierung: ""Merken nicht, dass die Zahlen zurückgehen""","Wirkt sich die härtere Asylpolitik der neuen Bundesregierung in den Kommunen aus? Eine Bürgermeisterin, die seit 2015 im Amt ist, berichtet. Von Susanna Zdrzalek.","Asylum policy of the Federal Government: ""Don't mention that the figures are falling""",Is the new federal government's tougher asylum policy working in the municipalities? A mayor who has been in office since 2015 reports. Susanna Zdrzalek.,"联邦政府的庇护政策: ""别指望数字会下降""",从2015年开始就任的市长. 苏珊娜·扎尔兹克报道.
