,title-de,content-de,title-en,content-en,title-zh,content-zh
0,Interpol: 158 Festnahmen bei Einsatz gegen Menschenhandel,Die Zugriffe fanden in über 40 Ländern auf der ganzen Welt statt. Fast 15.000 Beamte waren an den Ermittlungen beteiligt.,Interpol: 158 arrests against trafficking in human beings,"The visits took place in more than 40 countries around the world. Nearly 15,000 officials were involved in the investigation.",国际刑警组织:158次以贩卖人口为目的逮捕158人,"全球40多个国家都有这些访问记录 几乎有15,000名官员参与了这次调查"
1,EURO 2025: DFB-Frauen spielen gegen Schweden um Gruppensieg,Deutschlands Fußballerinnen wollen die Gruppenphase der Europameisterschaft in der Schweiz mit dem dritten Erfolg im dritten Spiel abschließen. Ein Remis reicht nicht für den Gruppensieg.,EURO 2025: DFB women play against Sweden for group victory,Germany's female football players want to complete the group phase of the European Championship in Switzerland with the third success in the third match. A draw is not enough for the group victory.,2025年欧盟:DFB妇女与瑞典人对打 集体胜利,德国女足球运动员想完成瑞士欧洲杯的第三场冠军赛. 一个足球队赢不了比赛.
2,IStGH sieht Anhaltspunkte für Kriegsverbrechen im Sudan,Der Bürgerkrieg im Sudan hat die größte Hunger- und Flüchtlingskrise der Welt ausgelöst. Der Internationale Strafgerichtshof in Den Haag ermittelt seit Jahren gegen mehrere Akteure des nordostafrikanischen Landes.,ICC provides evidence of war crimes in Sudan,The civil war in Sudan has triggered the world's biggest hunger and refugee crisis.The International Criminal Court in The Hague has been investigating several actors in the North-East African country for years.,国际刑事法院发现苏丹战争罪证据,苏丹内战引发了全世界最大的饥荒和难民危机. 海牙国际刑事法庭多年来一直在调查北欧国家多名行动者.
3,Berlin will von USA Patriots für Ukraine kaufen,Die Ukraine braucht unbedingt Unterstützung für die Luftabwehr bei ihrer Verteidigung gegen Russland. Nun hat Deutschlands Bundeskanzler Merz neue Patriots in Aussicht gestellt.,Berlin wants to buy from USA Patriots for Ukraine,Ukraine urgently needs support for air defence in its defence against Russia. Germany's Chancellor Merz has now offered new patriots.,柏林想从美国购买爱国者到乌克兰,"乌克兰急需空中防御,以防俄罗斯入侵. 现在德国总理默兹已经找到新的爱国者."
4,Trump verhängt neue Zölle gegen Kanada,US-Präsident Donald Trump eskaliert den Handelsstreit mit Kanada: Ab 1. August sollen 35-Prozent-Zölle gelten. In einem Brief kritisiert er auch Kanadas Rolle in der Fentanyl-Krise.,Trump imposes new tariffs on Canada,"US President Donald Trump escalates the trade dispute with Canada: 35 percent tariffs will apply from 1 August. In a letter, he also criticizes Canada's role in the fentanyl crisis.",特朗普对加拿大实施了新的关税,"美国总统唐纳德·特朗普升级了与加拿大的贸易纠纷:从8月1日起,他将接受35%的关税. 在一封信中,他批评加拿大在芬塔尼危机中的作用."
5,News kompakt: Milliardenhilfe für Wiederaufbau der Ukraine,Bei einer Konferenz in Rom wurden neue Aufbauhilfen für die Ukraine im Wert von einer Milliarde Euro zugesagt. Srebrenica gedenkt des Massakers in der bosnischen Stadt vor 30 Jahren. Das Wichtigste in Kürze.,News compact: billions of aid for reconstruction of Ukraine,"At a conference in Rome, new aid for Ukraine worth one billion euros was promised. Srebrenica commemorates the massacre in the Bosnian city 30 years ago. The most important thing in brief.",最新消息:为乌克兰重建提供数十亿美元的援助.,"30年前在波斯尼亚市发生的屠杀事件,斯雷布雷尼察曾承诺要为乌克兰提供10亿欧元的新援助. 最重要的是,很快."
6,PKK legt Waffen nieder: Ende des 40-jährigen Konflikts,Ein historischer Schritt: Nach 40 Jahren erklärt die PKK ihren bewaffneten Kampf für beendet und beginnt mit der Entwaffnung. Welche Chancen und Herausforderungen birgt dies für die Kurdenfrage im Nahen Osten?,PKK lays down weapons: End of the 40-year conflict,"A historic step: After 40 years, the PKK declares its armed struggle to be over and begins with disarmament. What opportunities and challenges does this present for the Kurdish question in the Middle East?",PK 会放下武器:40年冲突结束,"历史性的一步:经过40年,PKK宣布停止武装斗争,开始解除武装. 这对于中东库尔德问题有什么机会和挑战?"
7,Keine Regenbogenfahnen mehr in Bundestagsbüros,Parlamentspräsidentin Julia Klöckner lässt Regenbogenfahnen aus den Büros der Abgeordneten entfernen. Im Bundestag weht ein Hauch von Kulturkampf.,No more rainbow flags in Bundestag offices,Parliament President Julia Klöckner has rainbow flags removed from the offices of the deputies. In the Bundestag a breath of cultural struggle blows.,联邦会议办公室没有彩虹花,"众议院议员朱丽叶·柯克纳 (Julia Kluckner) 将彩虹花从众议员办公室中除去. 在德国国会,有一场文化斗争."
8,Obergrenze für Migranten an Schulen - eine gute Idee?,"Bildungsministerin Karin Prien hat vorgeschlagen, den Anteil von Einwandererkindern an Deutschlands Schulen zu begrenzen. Sie erntet Zuspruch und viel Kritik.",Limit for migrants in schools - a good idea?,Minister of Education Karin Prien has proposed to limit the proportion of immigrant children in Germany's schools. She reaps encouragement and much criticism.,学校里移民的上限 - 好主意?,"教育部长卡琳·普林提议将移民子女的比例限制在德国学校里. 她获得了支持,并提出许多批评."
9,Brasilien ist empört über Trumps 50-Prozent-Zölle,"US-Präsident Trump straft Brasilien mit satten Zöllen ab, weil ihm das Gerichtsverfahren gegen seinen alten Freund Bolsonaro nicht schmeckt. Das kann und will Brasiliens Staatschef Lula nicht auf sich sitzen lassen.",Brazil is outraged at Trump's 50 percent tariffs,US President Trump punishes Brazil with rich tariffs because he doesn't like the trial of his old friend Bolsonaro. Brazil's head of state Lula cannot and does not want to let that happen.,巴西对特朗普的五成关税很不满,"美国总统特朗普对巴西实施了严厉的惩罚,因为他不喜欢对老朋友波尔拿罗提起的审判. 这并不能,而且并不愿让巴西领导人露拉背黑锅."
10,Japan: Die Angst vor Mega-Erdbeben,Nach der jüngsten Erdbebenserie in Japan hat Tokio einen neuen Zivilschutzplan beschlossen. Die Sorge um ein besonders starkes Beben im Nankai-Graben ist groß. Die Regierung will Schäden minimieren.,Japan: The Fear of Mega-Earthquake,"Following the recent series of earthquakes in Japan, Tokyo has decided on a new civil protection plan. There is a great concern for a particularly strong earthquake in the Nankai Tomb. The government wants to minimize damage.",日本:害怕大地震,"日本最近的地震事件后,东京制定了新的民防计划. 纳凯地震的严重关注. 政府希望尽量减少损失."
11,Deutsche Islampolitik auf dem Prüfstand der neuen Regierung,Wird es auch in dieser Legislaturperiode eine Deutsche Islam Konferenz geben? In welcher Form? Ein Vertreter der Bundesregierung kündigt Veränderungen an.,German Islam policy at the test of the new government,Will there also be a German Islam Conference in this legislative period? In what form? A representative of the Federal Government announces changes.,在新政府审查范围内的德国伊斯兰政策,这个立法期间 会有一个德国伊斯兰会议吗? 一个联邦政府的代表会宣布变革
12,Libyen: Marodes Gesundheitssystem treibt Familie zur Migration,"Um ihr schwerkrankes Kind zu retten, wagt die Familie die gefährliche irreguläre Überfahrt per Boot von Libyen nach Italien. Die Geschichte des siebenjährigen Mädchens spiegelt die Krise des libyschen Gesundheitssystems.",Libya: Marodine's health care system drives family to migration,"In order to save her seriously ill child, the family dares to cross the dangerous irregular crossing by boat from Libya to Italy. The history of the seven-year-old girl reflects the crisis of the Libyan health system.",利比亚:马洛德的医疗系统让家庭迁徙,"为了救她的重病孩子,家庭敢于乘船从利比亚开往意大利 冒着危险的危险. 七岁女孩的故事反映了利比亚医疗体系的危机."
13,Entführt und erniedrigt: Schicksale alawitischer Frauen in Syrien,"Erpressungen und religiöser Hass: Mehrere Dutzend alawitische Frauen gelten in Syrien als ""vermisst"". Dahinter stecken offenbar politische wie kriminelle Motive und Strukturen. Die DW hat mit Betroffenen gesprochen.",Abducted and humiliated: Fate of Alawite Women in Syria,"Blackmail and religious hatred: Several dozen Alawite women are considered ""missing"" in Syria. There are apparently political and criminal motives and structures behind this. The DW has spoken with those affected.",绑架并羞辱叙利亚的阿拉维妇女命运,"勒索和宗教仇恨:在叙利亚,数十名阿拉维派妇女被认为""失踪"" 其背后似乎是政治动机和犯罪动机"
14,EURO 2025: Riola Xhemaili versetzt Schweiz in Freudentaumel,Dank eines späten Tors von Riola Xhemaili steht die Schweiz erstmals im Viertelfinale einer Frauen-Europameisterschaft. Die Spielerin hat kosovarische Wurzeln. In den sozialen Medien wird sie häufig angefeindet.,EURO 2025: Riola Xhemaili moves Switzerland into joy taumel,"Thanks to a late goal by Riola Xhemaili, Switzerland is the first quarter-final of a women's European championship. The player has Kosovar roots. In the social media it is often opposed.","2025年,里约热内卢·Xhemaili将瑞士转化为快乐的床铺","多亏了里约热内卢Xhemaili晚期的得分,瑞士首次进入女子欧洲杯的四分之一决赛. 玩家有科索沃的根. 在社交媒体中,她经常被敌视."
15,Eine kleine Geschichte der Queerness,"War die Mona Lisa keine Frau, sondern saß Leonardo da Vincis Liebhaber Modell für das Gemälde? Der Künstler war schwul - denn Queersein ist beileibe kein Phänomen der Neuzeit. Ein Streifzug durch die Jahrhunderte.",A little story of queerness,"Was the Mona Lisa not a woman, but was Leonardo da Vinci's lover model for the painting? The artist was gay - because queerness is no phenomenon of modern times. A journey through the centuries.",魁北克的一个小故事,"""蒙娜丽莎""不是女人,而是莱昂纳多·达芬奇画的情人模特儿. 艺术家是同性恋,因为求爱不是新时代的现象. 数百年来的漫步."
16,Startschuss für europäischen Ukraine-Wiederaufbaufonds,"Entwicklungsministerin Reem Alabali Radovan nimmt heute in Rom an der Ukraine-Wiederaufbaukonferenz teil. Das Entwicklungsministerium ist zuständig für die Koordinierung der Unterstützung der Bundesregierung für den Wiederaufbau der Ukraine. Auf der heutigen Konferenz wird der Startschuss für den „European Flagship Fund for Reconstruction of Ukraine“ gegeben. Dieser soll Privatinvestitionen in Infrastruktur, Energie, Industrie und andere strategisch wichtige Sektoren der ukrainischen Wirtschaft befördern.",Launch of European Ukraine Reconstruction Fund,"Development Minister Reem Alabali Radovan is taking part in the Ukraine Reconstruction Conference in Rome today. The Ministry of Development is responsible for coordinating the Federal Government's support for the reconstruction of Ukraine. Today's conference will launch the European Flagship Fund for Reconstruction of Ukraine, which will promote private investment in infrastructure, energy, industry and other strategically important sectors of the Ukrainian economy.",向欧洲乌克兰重建基金发射发射弹头,"发展部负责协调联邦政府对乌克兰重建的支持. 今天的会议将为乌克兰重建的欧盟旗帜基金 (European Flags for Ukraine Reconvention Foundation Foundation) 提供启动. 该基金将向基础设施,能源,工业和其他重要的乌克兰经济部门提供私人投资."
17,Zur Bekanntgabe der offiziellen Auflösung von USAID durch US-Außenminister Marco Rubio erklärt Entwicklungsministerin Reem Alabali Radovan:,"„Über sechs Jahrzehnte hat USAID weltweit Menschen aus größter Armut befreit, Krankheiten zurückgedrängt, ganze Regionen stabilisiert und Demokratien gestärkt. Die Auflösung schmerzt nicht nur alle, die sich für Solidarität und Menschlichkeit in der Welt einsetzen, sie hat dramatische Folgen. Bis zu 14 Millionen Menschen könnte der abrupte Rückzug der USA aus der Entwicklungszusammenarbeit bis 2030 das Leben kosten, darunter 4,5 Millionen Kinder. (...)""","On the announcement of the official dissolution of USAID by US Secretary of State Marco Rubio, Development Minister Reem Alabali Radovan states:","""For more than six decades, USAID has freed people from the world's greatest poverty, pushed diseases back, stabilised entire regions and strengthened democracies. Dissolution is not only painful for all those working for solidarity and humanity in the world, it has dramatic consequences. Up to 14 million people could be killed by the abrupt withdrawal of the US from development cooperation by 2030, including 4.5 million children. (...)""",为了宣布美国国务卿Marco Rubio正式解散美国国务卿 宣布Reem Alabali Radovan:,"六十多年来,美国发展局已经从世界最大的贫困中解放出来,阻止了疾病蔓延,加强了整个区域的稳定和民主. 解散不仅伤害了全世界所有致力于团结和人类的人,而且造成巨大的后果. 到2030年,美国在发展合作方面的突然退出可能造成生命损失,其中包括450万儿童 (...) """
18,Kraftvoller Schub für internationale Zusammenarbeit und eine gerechtere Welt,"In Sevilla hat heute die 4. Konferenz der Vereinten Nationen für Entwicklungsfinanzierung begonnen. Auf Einladung von UN-Generalsekretär Guterres und der spanischen Präsidentschaft berät die Weltgemeinschaft, darunter rund 70 Staats- und Regierungschef*innen, über Wege zur Finanzierung des Kampfes gegen Armut und Hunger, für globale Gesundheit, Bildung, Geschlechtergerechtigkeit und Frieden.",Powerful push for international cooperation and a fairer world,"Today the 4th United Nations Conference on Financing for Development began in Seville. At the invitation of UN Secretary-General Guterres and the Spanish Presidency, the world community, including some 70 heads of state and government, advises on ways to finance the fight against poverty and hunger, global health, education, gender equality and peace.",为国际合作和更公正的世界提供有力的鼓励,"在塞维利亚,联合国第4次发展筹资会议今天开始. 联合国秘书长索特斯和西班牙总统邀请国际社会,包括70位国家元首和政府首脑,就如何为消除贫穷和饥饿,为全球卫生,教育,性别平等与和平提供资金."
19,Statement von Entwicklungsministerin Reem Alabali Radovan zur Unterzeichnung eines Friedensabkommens durch die Außenminister der Demokratischen Republik Kongo und Ruandas in Washington,"„Der Krieg im Ostkongo hat unvorstellbares Leid über die Menschen in der Region gebracht. Die Unterzeichnung des neuen Friedensvertrags ist ein wichtiger Schritt in eine friedvollere Zukunft für die Menschen in der Demokratischen Republik Kongo, in Ruanda und für die gesamte Region. Nun geht es darum, dass dieser Vertrag auch wirklich umgesetzt wird – dass die Waffen endlich schweigen, dass Gewalt, Vergewaltigungen, Vertreibung und Missbrauch ein Ende haben. Die leidgeprüfte Bevölkerung im Ostkongo muss ein Leben in Sicherheit, Gewaltfreiheit und Würde führen können. Wir werden die Umsetzung der Friedensvereinbarung genau verfolgen.""",Statement by Development Minister Reem Alabali Radovan on the signing of a peace agreement by the Foreign Ministers of the Democratic Republic of the Congo and Rwanda in Washington,"""The war in the East Congo has brought unimaginable suffering to the people of the region. The signing of the new peace treaty is an important step towards a more peaceful future for the people of the Democratic Republic of Congo, Rwanda and for the entire region. Now it is about the fact that this treaty is actually being implemented – that the weapons are finally silent, that violence, rape, expulsion and abuse have an end. The suffering-tested people in the East Congo must be able to lead a life in security, non-violence and dignity. We will closely follow the implementation of the peace agreement.""",刚果民主共和国外交部长和卢旺达外交部长 在华盛顿发表了关于签署和平协议的演讲.,"东北战争给该地区人民带来了难以想象的痛苦. 签署新和平条约是为刚果民主共和国,卢旺达和整个区域人民更和平的未来迈出的一大步. 现在,它正在真正地被执行,这些条约将不言而喻地结束暴力,强奸,流离失所和虐待行为. 东北克的苦难人民必须能够安全,自由和尊严地生活. 我们将密切关注和平协定的实施. """
20,Deutschland bleibt verlässlicher Partner bei der Bekämpfung von weltweiten Krankheiten,"Deutschland wird sich weiterhin für den weltweiten Schutz vor vermeidbaren Krankheiten einsetzen. Bei der heutigen Wiederauffüllungskonferenz der Impfallianz Gavi in Brüssel kündigt Entwicklungsministerin Reem Alabali Radovan an, insgesamt 600 Millionen Euro bis 2030 zur Verfügung zu stellen.",Germany remains a reliable partner in the fight against global diseases,"Germany will continue to promote global protection against preventable diseases. At today's Gavi Impfallianz replenishment conference in Brussels, development minister Reem Alabali Radovan announces that she will make a total of EUR 600 million available by 2030.",德国在应对全球疾病方面依然是可靠的伙伴,"德国将继续致力于在全球范围内防治可预防的疾病. 在今天的布鲁塞尔防灾戈威会议上,发展部长雷姆·阿拉巴利·拉多万 (Reem Alabali Radovan) 宣布到2030年将提供6亿欧元."
21,Haushaltsentwurf 2025: Deutschland bleibt verlässlicher Partner in der globalen Zusammenarbeit,"Der heute im Kabinett beschlossene Haushaltsentwurf sieht einen Ansatz von 10,3 Milliarden Euro für den Etat des Entwicklungsministeriums im Jahr 2025 vor. Dazu sagt Ministerin Alabali Radovan: „Deutschland bleibt verlässlicher Partner für wirtschaftliche Zusammenarbeit und Entwicklung in der Welt. Das ist angesichts der extremen globalen Herausforderungen, Krisen und Kriege für Millionen von Menschen von existenzieller Bedeutung. (...)""",Draft budget 2025: Germany remains a reliable partner in global cooperation,"The draft budget adopted today in the cabinet provides for an approach of 10.3 billion euros for the budget of the Ministry of Development in 2025. Minister Alabali Radovan says: ""Germany remains a reliable partner for economic cooperation and development in the world. This is important for millions of people of existential importance in view of the extreme global challenges, crises and wars. (...)""",2025年拟议预算:德国仍然是可靠的全球合作伙伴.,"今天在内阁内通过的预算草案为发展部2025年预算提供了1030亿欧元的预算. 此外,国务卿阿拉巴利·拉多万说:德国依然是世界经济合作和发展的可靠伙伴. 面对全球的极端挑战,危机和战争,为数以百万计的生存重要人士提供战争. (...)"
22,Entwicklungsministerin Alabali Radovan: „Gerade jetzt dürfen wir Gaza nicht aus den Augen verlieren.“,"Entwicklungsministerin Reem Alabali Radovan hat heute den Chef des UN-Hilfswerks für Palästinaflüchtlinge (UNRWA) Philippe Lazzarini getroffen. An dem Treffen, das im Ministerium in Berlin stattfand, nahm auch Staatssekretär Niels Annen teil.  Im Zentrum des Gesprächs standen die Lage in Gaza und die eingeschränkte humanitäre Unterstützung der Menschen vor Ort. Darüber hinaus sprach die Ministerin die Fortschritte bei den Reformen an, zu denen sich das Hilfswerk wegen des Vorwurfs mangelnder Neutralität verpflichtet hat.","Development Minister Alabali Radovan: ""Right now we must not lose sight of Gaza.","Development Minister Reem Alabali Radovan met today the head of the UN Relief Agency for Palestine Refugees (UNRWA) Philippe Lazzarini. State Secretary Niels Annen also attended the meeting, which took place at the Ministry in Berlin. At the center of the discussion were the situation in Gaza and the limited humanitarian support of the people on the ground. In addition, the Minister spoke about the progress made in the reforms to which the relief agency committed itself because of the lack of neutrality.","发展部长阿拉巴利·拉多万: 现在,我们不能失去加沙.","发展部长雷姆·阿拉巴利·拉多万 今天与联合国巴勒斯坦难民救济和工程处 (UNIKA) 的首席执行官会面. 在柏林的会议中,部长尼尔斯·安恩也参加了. 会谈的核心是加沙的局势以及当地民众的人道主义支持有限. 此外,部长还提到了工程处对缺乏中立性的指控所承诺的改革进展."
23,Statement von Entwicklungsministerin Reem Alabali Radovan zu dem Anschlag in Damaskus am 22. Juni,"„Ich verurteile den Anschlag auf betende Gläubige in der Mar Elias Kirche in Damaskus aufs Schärfste. Diese feige Tat ist ein Anschlag auf die gesellschaftliche Vielfalt Syriens. Das Entwicklungsministerium unterstützt den Wiederaufbau und den gesellschaftlichen Zusammenhalt Syriens. Diese Arbeit ist wichtiger denn je. Der Wiederaufbau muss zu schnellen Ergebnissen führen, um Radikalen den Nährboden zu entziehen.“",Statement by Development Minister Reem Alabali Radovan on the attack in Damascus on 22 June,"""I strongly condemn the attack on praying believers in the Mar Elias Church in Damascus. This cowardly act is an attack on the social diversity of Syria. The Ministry of Development supports the reconstruction and social cohesion of Syria. This work is more important than ever. Reconstruction must lead to rapid results in order to remove radicals from the breeding ground.""",发展部长雷姆·阿拉巴利·拉多万宣布6月22日大马士革袭击案,"我谴责在大马士革的Mar Elias教堂袭击信众的行为,这是对叙利亚社会多样性的一次袭击. 发展部支持叙利亚的重建和社会凝聚力,这一工作比以往任何时候都重要. 重建工作必须产生快速的成果,才能让激进分子脱离困境."
24,Effiziente Hilfe für Menschen auf der Flucht und die Aufnahmeländer,"Nach aktuellen Zahlen des UN-Flüchtlingshilfswerks sind 122 Millionen Menschen weltweit auf der Flucht und damit mehr als jemals zuvor. Der weltweite Rückgang von Entwicklungsgeldern erhöht den Druck in den Aufnahmeländern. „Kein Mensch flieht freiwillig. Wer wegen Krieg, Krisen und Verfolgung seine Heimat verliert, verdient Mitmenschlichkeit und Hilfe. Wenn Menschen ihr Leben dafür riskieren, Hunger und Gewalt zu entkommen, dann helfen keine Parolen, sondern pragmatische Lösungen. (...)“, so Ministerin Reem Alabali Radovan.",Efficient assistance for refugees and host countries,"According to current figures from the UN Refugee Agency, 122 million people worldwide are on the run and thus more than ever before. The global decline in development funds increases the pressure in the host countries. ""No human being flees voluntarily. Anyone who loses his homeland because of war, crises and persecution deserves humanity and help. If people risk their lives to escape hunger and violence, then no slogans help, but pragmatic solutions. (...)-- said Minister Reem Alabali Radovan.",为逃犯和收容国提供高效的援助,"根据联合国难民救济中心的最新数字,全球1.12亿人正在逃命,这比以往任何时候都多. 全球发展资金的减少增加了收容国的压力. 没有人自愿逃离. 因为战争,危机和迫害而失去家园的人应该得到人道和帮助. 如果人们冒着生命危险逃避饥饿和暴力,那么他们就不会帮助帕洛尔,而是务实的解决方案."
25,Entwicklungsministerin Alabali Radovan verleiht BMZ-Engagementpreis für herausragenden persönlichen Einsatz,"Entwicklungsministerin Reem Alabali Radovan verleiht heute im Berliner Dienstsitz des Entwicklungsministeriums (BMZ) den 7. BMZ-Engagementpreis. Mit ihm wird herausragendes persönliches Engagement in der Entwicklungszusammenarbeit gewürdigt. Ausgezeichnet werden fünf Persönlichkeiten, die in besonderer Weise an der Umsetzung der 17 globalen UN-Nachhaltigkeitsziele mitwirken.",Minister of Development Alabali Radovan awards BMZ Commitment Prize for Outstanding Personal Use,Development Minister Reem Alabali Radovan today awards the 7th BMZ Commitment Prize at the Berlin Office of the Ministry of Development (BMZ). He is acknowledging his outstanding personal commitment to development cooperation. Five personalities who are particularly involved in the implementation of the 17 global UN sustainability goals are honoured.,发展部长阿拉巴利·拉多万 颁发优良个人成就奖,发展部长莱姆·阿拉巴利·拉多万 今天在发展部柏林的总部颁发了7个BMZ合同奖. 他将获得杰出的个人参与发展合作奖. 五位特别参与实现17个联合国全球支持目标的人物将非常出色.
