,title-en,content-en,title-de,content-de,title-es,content-es,title-fr,content-fr,title-zh,content-zh
68,Sweeping bipartisan bill would nationalize standards for student athlete pay,"New House legislation would establish national standards for college athlete compensation, while mandating schools provide academic and medical support to student athletes.",Zweiparteienrechnung würde Standards für Schülerathleten zahlen verstaatlichen,"Die Rechtsvorschriften des New House würden nationale Standards für die Entschädigung von Hochschulathleten festlegen, während die Schulen, die Schulen beauftragen, Schülerathleten akademische und medizinische Unterstützung bieten.",La ley bipartidista de barrer nacionalizaría los estándares para la paga de atleta estudiantil,"La legislación de la New House establecería normas nacionales para la compensación de atletas universitarios, mientras que las escuelas de mando proporcionan apoyo académico y médico a los atletas estudiantiles.",Le projet de loi bipartite de balayage nationaliserait les normes relatives à la rémunération des étudiants-athlètes,"La nouvelle loi de la Chambre établirait des normes nationales pour la rémunération des athlètes collégiaux, tandis que les écoles qui en font la demande fourniraient un soutien scolaire et médical aux athlètes étudiants.",扫荡两党法案将使学生运动员薪资标准国有化,"新众议院立法将确立国家学院运动员补偿标准,而授权学校向学生运动员提供学术和医疗支助。"
69,Carville pans Democrats for continuing to alienate men with 'future is female' talk,"Democratic strategist James Carville claims men feel ignored by the modern Democratic Party, and are told they are privileged precisely as they are losing status.","Carville pans Demokraten für die Fortsetzung der Entfremdung Männer mit ""Zukunft ist weiblich"" Talk","Der demokratische Stratege James Carville behauptet, die Männer fühlen sich von der modernen Demokratischen Partei ignoriert, und man sagt ihnen, sie seien privilegiert, genau da sie den Status verlieren.","Carville critica a los demócratas por seguir alienando a los hombres con ""futuro es femenino""","El estratega democrático James Carville afirma que los hombres se sienten ignorados por el Partido Democrático moderno, y se les dice que son privilegiados precisamente porque están perdiendo estatus.",Carville pans Democrats pour continuer à aliéner les hommes avec 'futur est une discussion féminine',"Le stratège démocratique James Carville prétend que les hommes se sentent ignorés par le Parti démocratique moderne, et on leur dit qu'ils ont le privilège de perdre leur statut.","Carville Pans Democrats 继续疏远男人 说""未来是女性""","民主战略家James Carville声称, 现代民主党忽视男性,"
70,Fake agent phone scams are spreading fast across the US,"A disturbing wave of fake agent phone scams is sweeping across the United States, catching people off guard and draining their savings.",Fake Agent Telefon Betrug verbreiten sich schnell in den USA,"Eine beunruhigende Welle von gefälschten Agenten-Handy-Betrügereien fegt durch die Vereinigten Staaten, fängt Leute aus der Wache und entleert ihre Ersparnisse.",Falsas estafas telefónicas de agentes se están extendiendo rápidamente por los EE.UU.,"Una inquietante ola de falsas estafas telefónicas de agentes está barriendo a través de los Estados Unidos, atrapando a la gente desprevenido y drenando sus ahorros.",Faux agents arnaques téléphoniques se propagent rapidement à travers les États-Unis,"Une vague inquiétante d'escroqueries téléphoniques de faux agents balaye les États-Unis, attrape les gens hors de leur garde et épuise leurs économies.",假间谍电话诈骗正在美国各地迅速蔓延,"令人不安的一波假间谍电话骗局席卷美国各地,"
71,WNBA fans furious as Angel Reese gets NBA 2K26 cover over Caitlin Clark,WNBA fans expressed their displeasure on Wednesday as 2K Games announced that Angel Reese will have the WNBA edition cover of NBA 2K26.,WNBA Fans wütend als Angel Reese bekommt NBA 2K26 Cover über Caitlin Clark,"WNBA Fans drückten ihre Unzufriedenheit am Mittwoch aus, als 2K Games bekannt gaben, dass Angel Reese das WNBA Edition Cover von NBA 2K26 haben wird.",Aficionados de la WNBA furiosos como Angel Reese consigue NBA 2K26 cubierta sobre Caitlin Clark,Los fans de la WNBA expresaron su descontento el miércoles cuando 2K Games anunció que Angel Reese tendrá la portada de la edición de la WNBA de la NBA 2K26.,Les fans de WNBA furieuse comme Angel Reese obtient NBA 2K26 couverture sur Caitlin Clark,Les fans de WNBA ont exprimé leur mécontentement mercredi alors que 2K Games a annoncé qu'Angel Reese aura la couverture de l'édition WNBA de NBA 2K26.,"当天使里瑟得到NBA 2K26掩护凯特琳·克拉克时,WNBA粉丝愤怒","WNBA粉丝在星期三表示不满, 2K运动会宣布Angel Reese将获得NBA 2K26的WNBA版封面。"
72,"John Kerry admits Trump was 'right' on border, says he told Biden that Democrats missed on immigration",Former Secretary of State John Kerry said during a BBC podcast that President Trump had been right about the border and called a protected border essential to having a nation.,"John Kerry gibt zu, dass Trump an der Grenze ""richtig"" war, sagt er Biden, dass Demokraten bei der Einwanderung verpasst haben.","Der ehemalige Außenminister John Kerry sagte während eines BBC-Podcasts, dass Präsident Trump Recht über die Grenze hatte und eine geschützte Grenze für eine Nation als wesentlich bezeichnete.","John Kerry admite que Trump tenía 'correcto' en la frontera, dice que le dijo a Biden que los demócratas fallaron en inmigración",El ex secretario de Estado John Kerry dijo durante un podcast de la BBC que el presidente Trump había tenido razón sobre la frontera y llamó a una frontera protegida esencial para tener una nación.,"John Kerry admet que Trump était «à droite» à la frontière, dit-il à Biden que les démocrates ont manqué à l'immigration",L'ancien secrétaire d'État John Kerry a déclaré lors d'un podcast de la BBC que le président Trump avait raison sur la frontière et a qualifié une frontière protégée essentielle à l'existence d'une nation.,"约翰・克里承认特朗普在边境上是“右”的, 他说他告诉拜登,","前国务卿约翰·克里(John Kerry)在英国广播公司播客播客中说,特朗普总统对边界的看法是正确的,并称边界是拥有一个国家所必需的受保护的边界。"
73,"DAVID MARCUS: In wake of Kerrville flood, locals ignore blame game","Hill Country locals reject political blame games after deadly floods, viewing the disaster as an unstoppable act of nature while focusing on community support",DAVID MARCUS: Im Gefolge der Kerrville Flut ignorieren Einheimische Schuld Spiel,"Hill Country Einheimische lehnen politische Schuldspiele nach tödlichen Überschwemmungen ab und betrachten die Katastrophe als einen unaufhaltsamen Akt der Natur, während sie sich auf die Unterstützung der Gemeinschaft konzentrieren","DAVID MARCUS: Después de la inundación de Kerrville, los lugareños ignoran la culpa juego","Los lugareños de Hill Country rechazan los juegos de culpa política después de inundaciones mortales, viendo el desastre como un acto imparable de la naturaleza mientras se centran en el apoyo comunitario","DAVID MARCUS: À la suite de l'inondation de Kerrville, les habitants ignorent le jeu de la faute","Les habitants de Hill Country rejettent les jeux de blâme politique après des inondations mortelles, considérant la catastrophe comme un acte de nature inarrêtable tout en se concentrant sur le soutien communautaire","Kerrville洪水过后,","将这场灾难视为不可阻挡的自然行为,"
74,"One year after Trump assassination attempt, Butler widow demands accountability from Secret Service","Helen Comperatore, whose husband Corey was killed during an attempt on President Donald Trump&apos;s life, reflects on the tragedy and lapses in Secret Service protection.",Ein Jahr nach Trumps Attentat fordert Butler-Witwe Rechenschaft vom Secret Service,"Helen Comperatore, dessen Ehemann Corey während eines Attentats auf Präsident Donald Trump&apos getötet wurde, reflektiert die Tragödie und erlischt im Secret Service-Schutz.","Un año después del intento de asesinato de Trump, la viuda Butler exige la rendición de cuentas del Servicio Secreto","Helen Comperatore, cuyo esposo Corey fue asesinado durante un atentado contra el presidente Donald Trump&apos;s vida, reflexiona sobre la tragedia y falla en la protección del Servicio Secreto.","Un an après la tentative d'assassinat de Trump, la veuve Butler exige des services secrets qu'ils rendent des comptes.","Helen Comperatore, dont le mari Corey a été tué lors d'une tentative contre le président Donald Trump&apos;s la vie, réfléchit sur la tragédie et les lacunes dans la protection des services secrets.",在特朗普刺杀未遂一年后 巴特勒寡妇要求特勤处负责,"Helen Compatore的丈夫Corey在试图攻击总统Donald Trump&apos时被杀,"
75,Hawley moves to block China's buy-up of US farmland as Trump admin sounds alarm,"Sen. Hawley&apos;s bill aims to counter Chinese ownership of U.S. farmland, especially near military bases, which officials call a security concern.","Hawley bewegt sich, Chinas Ankauf von US-Land zu blockieren, als Trump Admin Alarm ertönt","Sen. Hawley&apos;s Gesetzentwurf zielt darauf ab, dem chinesischen Eigentum an US-Farmland entgegenzuwirken, besonders in der Nähe von Militärstützpunkten, die Beamte als Sicherheitsbedenken bezeichnen.",Hawley se mueve para bloquear la compra por China de tierras de cultivo estadounidenses mientras el administrador de Trump suena alarma,"El proyecto de ley del Senador Hawley&apos pretende contrarrestar la propiedad china de las tierras agrícolas estadounidenses, especialmente cerca de bases militares, a las que los funcionarios llaman una preocupación de seguridad.",Hawley se déplace pour bloquer l'achat par la Chine des terres agricoles américaines comme Trump admin sonne alarme,"Le projet de loi Sen. Hawley&apos; vise à contrer la propriété chinoise des terres agricoles américaines, en particulier à proximité des bases militaires, ce que les responsables appellent une préoccupation en matière de sécurité.","以阻止中国收买美国农田,","Hawley&apos; 法案旨在对抗中国对美国农田的所有权,特别是在军事基地附近,而军方官员则对此提出安全关切。"
76,Actress reveals how cancer test that saved her life led to surprising family discovery,"The breast cancer risk assessment test that detected Olivia Munn&apos;s aggressive Luminal B cancer has now identified breast cancer in her mother, demonstrating its life-saving potential.","Schauspielerin zeigt, wie Krebs-Test, der ihr Leben gerettet führte zu überraschenden Familien-Entdeckung","Der Brustkrebs-Risikobewertungstest, der Olivia Munn&apos entdeckte; der aggressive Luminal-B-Krebs hat nun Brustkrebs bei ihrer Mutter identifiziert und sein lebensrettendes Potenzial demonstriert.",Actriz revela cómo la prueba de cáncer que salvó su vida llevó a sorprendente descubrimiento familiar,"La prueba de evaluación del riesgo de cáncer de mama que detectó a Olivia Munn&apos; s cáncer Luminal B agresivo ahora ha identificado el cáncer de mama en su madre, demostrando su potencial para salvar vidas.",Actrice révèle comment le test de cancer qui lui a sauvé la vie a mené à une découverte familiale surprenante,"Le test d'évaluation du risque de cancer du sein qui a détecté Olivia Munn&apos; le cancer agressif de Luminal B a maintenant identifié le cancer du sein chez sa mère, démontrant ainsi son potentiel vital.",女演员展示了 拯救她生命的癌症测试 是如何导致 出人意料的家庭发现,"检测到Olivia Munn&apos的乳腺癌风险评估测试;攻击性乳腺B型癌症现已查明她母亲的乳腺癌,表明其挽救生命的潜力。"
77,10 reasons the DOJ and FBI face backlash over Epstein files flop,DOJ leaders are facing criticism and resignation calls from one-time supporters after they ended their inquiry into Jeffrey Epstein’s sex trafficking case without releasing new files.,"10 Gründe, warum das DOJ und FBI Face Backlash über Epstein Dateien Flop","DOJ-Führer stehen vor Kritik und Resignationsrufen von einstigen Unterstützern, nachdem sie ihre Untersuchung in Jeffrey Epsteins Sexschmuggel-Fall beendet hatten, ohne neue Dateien zu veröffentlichen.",10 razones por la reacción del Departamento de Justicia y el FBI sobre los archivos de Epstein flop,Los líderes del Departamento de Justicia se enfrentan a críticas y renuncias de partidarios de una sola vez después de que terminaran su investigación sobre el caso de trata sexual de Jeffrey Epstein sin publicar nuevos archivos.,10 raisons pour lesquelles le ministère de la Justice et le FBI font face à un contre-coup sur les fichiers d'Epstein flop,"Les dirigeants du MJ font face à des critiques et à des appels de démission de partisans ponctuels après avoir terminé leur enquête sur l'affaire Jeffrey Epstein, sans publier de nouveaux dossiers.",司法部和联邦调查局在Epstein档案上 面临反弹的10个原因,"司法部领导人在结束对Jeffrey Epstein性贩运案的调查后,"
78,"Kathy Griffin stands by belief that Trump didn't win 2024 election, despite 'tinfoil hat' label","Kathy Griffin shared doubts about the legitimacy of the 2024 election results during a Substack Live with E. Jean Carroll, stating she doesn&apos;t believe Trump won.","Kathy Griffin steht zu der Überzeugung, dass Trump 2024 Wahl trotz ""Tinfoil Hut""-Label nicht gewonnen hat","Kathy Griffin teilte Zweifel an der Legitimation der 2024 Wahlergebnisse während eines Substack Live mit E. Jean Carroll und sagte, dass sie does&apos;t glauben, Trump gewann.","Kathy Griffin cree que Trump no ganó las elecciones de 2024, a pesar de la etiqueta de ""sombrero de papel""","Kathy Griffin compartió dudas sobre la legitimidad de los resultados de las elecciones de 2024 durante un substack en vivo con E. Jean Carroll, diciendo que ella doesn&apos; no cree que Trump ganó.","Kathy Griffin est convaincue que Trump n'a pas remporté les élections de 2024, malgré le label 'tinfoil hat'","Kathy Griffin partageait des doutes quant à la légitimité des résultats des élections de 2024 lors d'une Substack Live avec E. Jean Carroll, déclarant qu'elle n'a pas et apos;t croire Trump a gagné.","Kathy Griffin认为Trump没有赢得2024年的选举,","Kathy Griffin对2024年选举结果的合法性表示怀疑,"
79,"Patriots' Drake Maye, wife delivered incredible act of kindness after wedding, radio host says","New England Patriots quarterback Drake Maye and his wife Ann donated their wedding gifts to shelters back home, according to a Boston-based radio host.","Patriots' Drake Maye, Frau lieferte unglaubliche Akt der Freundlichkeit nach der Hochzeit, Radio-Host sagt","New England Patriots Quarterback Drake Maye und seine Frau Ann spendeten ihre Hochzeitsgeschenke an Heimunterkünfte, so ein in Boston ansässiger Radiosender.","Drake Maye de Patriots, esposa entregó increíble acto de bondad después de la boda, presentador de radio dice","El quarterback de New England Patriots Drake Maye y su esposa Ann donaron sus regalos de boda a refugios en casa, según un presentador de radio con sede en Boston.","Drake Maye des patriotes, épouse a livré un acte incroyable de gentillesse après le mariage, l'animateur de radio dit","Les patriotes de la Nouvelle-Angleterre quarterback Drake Maye et sa femme Ann ont donné leurs cadeaux de mariage à des abris chez eux, selon un animateur de radio basé à Boston.","爱国者Drake Maye, 妻子在婚礼后提供了令人难以置信的善意行为, 电台主持人说,","新英格兰爱国者四分卫Drake Maye和他的妻子Ann将结婚礼物捐给了家乡的避难所,"
80,Statement of German Development Minister Reem Alabali Radovan at Ukraine Recovery Conference,"""The headlines of the last few days should shake us all. Russia is attacking Ukraine more and more brutally. We are seeing the worst attacks since the beginning of the war. Every day, people are killed and injured. Every day, fear. For more than three years now, Ukraine has been fighting for its freedom, for democracy, but also for our security, for Europe. Germany stands in solidarity with Ukraine. Ukraine can count on our support.""",Erklärung des deutschen Entwicklungsministers Reem Alabali Radovan auf der Ukraine Recovery Conference,"„Die Schlagzeilen der letzten Tage sollten uns alle erschüttern. Russland greift die Ukraine immer brutaler an. Wir sehen die schlimmsten Angriffe seit Beginn des Krieges. Jeden Tag werden Menschen getötet und verletzt. Jeden Tag Angst. Seit mehr als drei Jahren kämpft die Ukraine für ihre Freiheit, für Demokratie, aber auch für unsere Sicherheit, für Europa. Deutschland steht in Solidarität mit der Ukraine. Die Ukraine kann auf unsere Unterstützung zählen.""","Declaración del Ministro de Desarrollo de Alemania, Reem Alabali Radovan, en la Conferencia de Recuperación de Ucrania","""Los titulares de los últimos días deberían sacudirnos a todos. Rusia está atacando a Ucrania cada vez más brutalmente. Estamos viendo los peores ataques desde el comienzo de la guerra. Todos los días, las personas mueren y resultan heridas. Todos los días, el miedo. Desde hace más de tres años, Ucrania ha estado luchando por su libertad, por la democracia, pero también por nuestra seguridad, por Europa. Alemania se solidariza con Ucrania. Ucrania puede contar con nuestro apoyo"".","Déclaration du ministre allemand du développement, Reem Alabali Radovan, à la conférence sur la relance de l'Ukraine","La Russie attaque de plus en plus brutalement l'Ukraine. Nous voyons les pires attaques depuis le début de la guerre. Chaque jour, des gens sont tués et blessés. Chaque jour, la peur. Depuis plus de trois ans, l'Ukraine lutte pour sa liberté, pour la démocratie, mais aussi pour notre sécurité, pour l'Europe. L'Allemagne est solidaire avec l'Ukraine. L'Ukraine peut compter sur notre soutien. »",德国发展部长雷姆·阿拉巴利·拉多万在乌克兰恢复会议上的发言,"“过去几天的头条新闻应该震撼我们所有人。俄罗斯越来越残酷地攻击乌克兰。我们看到了自战争开始以来最严重的袭击。每天都有人伤亡。每天都有人伤亡。每天都有恐惧。三年多来,乌克兰一直在为自由、民主以及欧洲的安全而斗争。德国与乌克兰站在一起。乌克兰可以指望我们的支持。 ”"
81,Germany remains reliable partner in the fight against global diseases,"Germany will continue to support global efforts to protect people from preventable diseases. Today in Brussels, at the replenishment conference for Gavi, the Vaccine Alliance, German Development Minister Reem Alabali Radovan will pledge a total of 600 million euros for the period up to 2030.",Deutschland bleibt verlässlicher Partner im Kampf gegen globale Krankheiten,Deutschland wird die weltweiten Bemühungen um den Schutz von Menschen vor vermeidbaren Krankheiten weiter unterstützen. Heute wird der deutsche Entwicklungsminister Reem Alabali Radovan in Brüssel auf der Wiederauffüllungskonferenz für Gavi bis 2030 insgesamt 600 Millionen Euro versprechen.,Alemania sigue siendo un socio fiable en la lucha contra las enfermedades mundiales,"Alemania seguirá apoyando los esfuerzos mundiales para proteger a las personas de las enfermedades prevenibles. Hoy, en Bruselas, en la conferencia de reposición para Gavi, la Alianza de Vacunas, el ministro de Desarrollo alemán Reem Alabali Radovan se comprometerá a un total de 600 millones de euros para el período hasta 2030.",L'Allemagne reste un partenaire fiable dans la lutte contre les maladies mondiales,"L'Allemagne continuera à soutenir les efforts mondiaux de protection des personnes contre les maladies évitables. Aujourd'hui, à Bruxelles, lors de la conférence de reconstitution pour Gavi, l'Alliance Vaccine, le ministre allemand du Développement, Reem Alabali Radovan, promettra un total de 600 millions d'euros pour la période allant jusqu'à 2030.",德国在防治全球疾病的斗争中仍然是可靠的伙伴,"德国将继续支持保护人们免受可预防疾病影响的全球努力。 今天,在布鲁塞尔举行的加维(Gavi)补充会议上,德国发展部长雷姆·阿拉巴利·拉多万(Reem Alabali Radovan)将为2030年之前的时期认捐总额6亿欧元。"
82,180 new municipal partnerships formed between Germany and Ukraine since start of Russia’s war of aggression,"The German-Ukraine Municipal Partnership Network has grown from 70 to 250 partnerships since Russia’s war of aggression against Ukraine began in 2022. Around 700 mayors, city councillors and district leaders from Germany, Ukraine and other European countries are meeting in Münster today. The conference is being organised by the Federal Ministry for Economic Cooperation and Development (BMZ) and the City of Münster.",180 neue kommunale Partnerschaften zwischen Deutschland und der Ukraine seit Beginn des Angriffskrieges Russlands,"Das deutsch-ukrainische Städtepartnerschaftsnetz ist seit dem Angriffskrieg gegen die Ukraine 2022 von 70 auf 250 Partnerschaften gewachsen. Rund 700 Bürgermeister, Stadträte und Bezirksführer aus Deutschland, der Ukraine und anderen europäischen Ländern treffen sich heute in Münster. Die Konferenz wird vom Bundesministerium für wirtschaftliche Zusammenarbeit und Entwicklung (BMZ) und der Stadt Münster organisiert.",180 nuevas asociaciones municipales formadas entre Alemania y Ucrania desde el inicio de la guerra de agresión de Rusia,"La Red de Asociaciones Municipales entre Alemania y Ucrania ha pasado de 70 a 250 asociaciones desde que comenzó la guerra de agresión de Rusia contra Ucrania en 2022. Alrededor de 700 alcaldes, concejales y líderes de distrito de Alemania, Ucrania y otros países europeos se reúnen hoy en Münster. La conferencia está siendo organizada por el Ministerio Federal de Cooperación Económica y Desarrollo (BMZ) y la ciudad de Münster.",180 nouveaux partenariats municipaux formés entre l'Allemagne et l'Ukraine depuis le début de la guerre d'agression russe,"Le réseau de partenariat municipal entre l'Allemagne et l'Ukraine est passé de 70 à 250 partenariats depuis le début de la guerre d'agression contre l'Ukraine en 2022. Environ 700 maires, conseillers municipaux et chefs de district d'Allemagne, d'Ukraine et d'autres pays européens se réunissent aujourd'hui à Münster. La conférence est organisée par le ministère fédéral de la Coopération et du Développement économique (BMZ) et la ville de Münster.","自俄罗斯侵略战争开始以来,德国和乌克兰之间建立了180个新的城市伙伴关系","自2022年俄罗斯对乌克兰发动侵略战争以来,德国-乌克兰城市伙伴关系网络从70个发展到250个伙伴关系。 来自德国、乌克兰和其他欧洲国家的约700名市长、市议员和地区领导人今天正在明斯特举行会议。 会议由联邦经济合作与发展部(BMZ)和明斯特市组织。"
